file,query,answer
bridge_subgraph_25718.graphml,哪种疾病在进行前正中入路手术和个性化护理的同时，还需要通过MRI和X线进行影像学检查？,胫骨平台骨折
bridge_subgraph_25712.graphml,哪种疾病在男性患者中更常见，且常伴随复杂胫骨骨折和强直并发症，同时需要进行心理干预辅助治疗？,胫骨平台骨折
bridge_subgraph_25717.graphml,哪种疾病在进行三维重建影像和LISS钢板治疗时，通常需要借助多层螺旋CT并表现出良好的治疗效果？,胫骨平台骨折
bridge_subgraph_25720.graphml,哪种疾病在采用半月板修复成形和微创内固定技术治疗后，更需要精心护理而非常规护理？,胫骨平台骨折
bridge_subgraph_25708.graphml,哪种疾病在需要进行自体髂骨植骨和经皮钢板固定手术的同时，还需要使用抗生素治疗，并且年龄是高危因素？,胫骨平台骨折
bridge_subgraph_25721.graphml,哪种疾病在非手术疗法中常结合针灸理疗，且在诊断过程中需依赖CT检查？,胫骨平台骨折
bridge_subgraph_25714.graphml,哪种疾病在早期活动时需要使用法尼基硫代水杨酸，并且常与抗生素联用，术后并发症也较为常见？,FTS
bridge_subgraph_25719.graphml,哪种疾病在41~50岁人群中常见，需进行双侧钢板内固定术治疗，且患者常伴有MRI检查异常和抑郁症状？,胫骨平台骨折
bridge_subgraph_25709.graphml,哪种疾病在放射性核素显影和实时荧光定量PCR检测中常见，并且通常需要结合卡方检验和优质护理服务进行治疗评估？,恶性实体肿瘤
bridge_subgraph_25727.graphml,哪种疾病在围手术期需要特别重视引流管护理、饮食护理，并且与左半结肠癌密切相关？,肠梗阻手术
bridge_subgraph_25724.graphml,哪种疾病在RK术后屈光欠矫时，需要结合Sirius角膜地形图仪检查，并辅以围手术期护理和激光治疗？,LASIK
bridge_subgraph_25725.graphml,哪种疾病在进行最大密度投影和C型臂X线机检查时，特别需要考虑患者年龄这一高危因素，并强调护理干预的辅助治疗效果？,胫骨平台骨折
bridge_subgraph_25731.graphml,哪种疾病在采用单切口双钢板支撑技术辅助治疗和双切口手术入路手术治疗的同时，常伴有卡方检验的实验室检查结果以及抑郁的临床表现？,胫骨平台骨折
bridge_subgraph_25730.graphml,哪种疾病既以血脂异常和吸烟为高危因素，又需要通过康复护理和外科手术来进行治疗？,中老年脑卒中
bridge_subgraph_25728.graphml,哪种疾病在治疗过程中常同时使用补骨胶囊和阿仑膦酸钠，且通过sOPG检查，与骨质疏松密切相关？,骨丢失
bridge_subgraph_25743.graphml,哪种疾病会导致血压升高，并在B超和CT检查中同时出现异常表现？,肾上腺皮质病
bridge_subgraph_25732.graphml,哪种疾病在治疗过程中需要结合膝关节功能锻炼、使用松质螺钉，并且强调护理和舒适护理的重要性？,胫骨平台骨折
bridge_subgraph_25735.graphml,哪种疾病在免疫组织化学染色检测和T1加权像中表现出特定特征，且常与CT检查结果和患者年龄相关？,HPC
bridge_subgraph_25734.graphml,哪种疾病容易在股骨远端和长骨干骺端的软骨部位发病，并且可以通过CT检查发现？,髓内高分化骨肉瘤
bridge_subgraph_25736.graphml,哪种疾病在治疗过程中需要同时采用开瑞坦和扑尔敏，并且需要特别进行护理干预，而不仅仅是常规护理？,小儿喘息性支气管炎
bridge_subgraph_25742.graphml,哪种疾病会出现头痛和复视，并且可以通过常规护理和穴位按摩进行辅助治疗？,视网膜脱离术
bridge_subgraph_25723.graphml,哪种疾病在手术体位选择时需要特别考虑，并且在进行MRI检测时表现良好，且常常与MRI一同被提及？,肩袖全层撕裂
bridge_subgraph_25738.graphml,哪种疾病在治疗时需要使用牙痛灵和抗生素，并且伴随出汗的临床表现，同时还需要进行心理护理？,牙痛
bridge_subgraph_25733.graphml,哪种疾病在治疗过程中需要采用手术坚强内固定和韧带修复术，并辅以解剖型钢板结合CPM功能锻炼，同时通过MRI进行影像学检查？,胫骨平台骨折
bridge_subgraph_25716.graphml,哪种疾病在男性因坠落伤导致多节段脊柱骨折时，需要特别注意加强交通管理？,交通事故伤
bridge_subgraph_25737.graphml,哪种疾病既与脑瘫相关（转化）又属于出生缺陷的病理分型，并且在治疗过程中常需结合康复护理干预和针灸作为辅助治疗？,脑发育不良
bridge_subgraph_25752.graphml,哪种疾病在进行解剖钢板固定或微创固定时，需要特别注意MRI或磁共振成像的检查结果？,胫骨平台骨折
bridge_subgraph_25744.graphml,哪种疾病最适合采用综合康复护理模式，包括体位摆放和软组织贴扎技术，并且需要早期综合康复治疗和早期康复治疗？,肩关节半脱位
bridge_subgraph_25748.graphml,哪种疾病在侵袭性NK细胞白血病患者接受IMRT治疗期间，容易并发感染且需要使用万古霉素进行治疗？,中性粒细胞减少
bridge_subgraph_25729.graphml,哪种疾病需要进行关节镜下韧带重建术和外固定支架固定，并且需要配合健康宣教和手术治疗？,胫骨平台骨折
bridge_subgraph_25747.graphml,哪种疾病在三维CT重建影像中常表现为胫骨平台后内侧柱损伤，且通常需要手术治疗和常规护理？,胫骨平台骨折
bridge_subgraph_25745.graphml,哪种疾病在治疗过程中常需进行减张内固定，并可能伴随胫骨平台骨折，同时涉及切开复位内固定术和延迟手术？,筋膜间隔综合征
bridge_subgraph_25746.graphml,哪种疾病在治疗过程中常需结合关节镜技术、量化康复训练，并且通常需要通过手术治疗和MRI影像学检查来辅助诊断和治疗？,胫骨平台骨折
bridge_subgraph_25755.graphml,哪种疾病在治疗过程中需要结合CPM锻炼和术后护理，并且常通过多层螺旋CT和MRI进行影像学检查？,胫骨平台骨折
bridge_subgraph_25758.graphml,哪种疾病在关节镜下手术后，需要结合软组织损伤修复和护理干预，以及优质护理干预来预防复发？,胫骨平台骨折
bridge_subgraph_25753.graphml,哪种疾病在彩色超声和CT影像学检查中常见，且常由生殖道支原体感染导致，同时需要心理干预作为辅助治疗？,不孕不育症
bridge_subgraph_25741.graphml,哪种疾病需要通过Schatzker Ⅰ-Ⅳ分类进行评估，并在髂胫束入路复位植骨的同时，借助CT扫描或CT进行检查？,胫骨平台骨折
bridge_subgraph_25751.graphml,哪种疾病在治疗过程中通常会结合中药熏蒸外敷和病情观察，且可能需要膝关节镜手术及常规护理？,创伤性膝关节滑膜炎
bridge_subgraph_25754.graphml,哪种医学内容在涉及自体骨植骨和生物学固定的同时，还需要结合X线片检查和预防创伤性关节炎？,胫骨平台骨折
bridge_subgraph_25722.graphml,哪种疾病在急性黄疸型肝炎并发症出现时，需要通过磁共振成像（MRI）检查，并可能采用原位肝移植作为手术治疗？,脑桥中央髓鞘溶解症
bridge_subgraph_25726.graphml,哪种疾病在复杂胫骨骨折的病理分型中，通过X线拍片常被诊断，且在治疗过程中需配合综合护理，尤其好发于特定年龄段的人群？,胫骨平台骨折
bridge_subgraph_25749.graphml,哪种疾病在认知灵活性问卷和钉板系统测试中表现较差，且常需要支撑钢板治疗？,DCS
bridge_subgraph_25756.graphml,哪种疾病在出现膝关节僵硬并发症时，通常需要通过外科治疗，尤其是内固定手术，并结合综合护理干预来辅助治疗？,胫骨平台骨折
bridge_subgraph_25750.graphml,哪种疾病在采用中西医结合治疗作为辅助手段的同时，还需要通过螺旋CT三维重建影像检查进行精确诊断，并可能涉及手术治疗？,胫骨平台骨折
bridge_subgraph_25757.graphml,哪种疾病在男性中发病率约为6.0%，且随着年龄增长风险增加，通常表现为良性MCN？,新发糖尿病
bridge_subgraph_25763.graphml,哪种疾病会导致骨量丢失和关节功能障碍，通常需要使用阿仑膦酸钠和补肾中药进行治疗？,骨折
bridge_subgraph_25739.graphml,哪种疾病在SchatzkerⅡ~Ⅴ型病理分型中，通过螺旋CT三维重建影像检查，常伴随Ⅱ型病理分型，并需采用切开复位内固定术进行治疗？,胫骨平台骨折
bridge_subgraph_25759.graphml,哪种疾病在男性中较为常见，常表现为肿胀，且需通过双切口入路手术治疗，同时优质护理对其康复至关重要？,胫骨平台骨折
bridge_subgraph_25766.graphml,哪种疾病在X线诊断和多层螺旋CT、CT检查中常伴有Letournel-Judet并发症？,胫骨平台骨折
bridge_subgraph_25765.graphml,哪种疾病需要男性在特定年龄段佩戴防护镜来预防流感？,禽流感
bridge_subgraph_25762.graphml,哪种疾病在新型冠状病毒肺炎和T2DM并发症的高危因素中，同时需要综合护理辅助治疗且抑郁也是其高危因素？,糖尿病合并症
bridge_subgraph_25770.graphml,哪种疾病在围手术期综合护理和有效固定的辅助治疗下，相比常规护理模式更能显著提升护理效果？,胫骨平台骨折
bridge_subgraph_25740.graphml,哪种疾病在体重增加和感染情况下容易引发，并且可能导致枕叶癫痫，通常需要通过MRI检查来诊断？,低血糖脑损伤
bridge_subgraph_25768.graphml,哪种疾病在胃大部切除术或胃大部切除后，通过良好的心理护理能显著改善患者康复效果？,胃溃疡穿孔
bridge_subgraph_25769.graphml,哪种疾病在中药配合手法辅助治疗时，常通过CT片和X线片检查确诊为前错位？,骶髂关节错位
bridge_subgraph_25772.graphml,哪种疾病在CT和MSCT影像学检查中常表现为中央星状瘢痕？,肾嗜酸性细胞腺瘤
bridge_subgraph_25760.graphml,哪种疾病在经过64排螺旋CT扫描后，通常需要结合CT检查、手术治疗以及功能性恢复锻炼来进行综合治疗？,胫骨平台骨折
bridge_subgraph_25761.graphml,哪种疾病在采用锁定钢板的内固定手术治疗和中药汤剂内服的同时，还需要进行康复治疗及常规康复治疗？,胫骨平台骨折
bridge_subgraph_25775.graphml,哪种疾病在预防呼吸系统并发症和脊髓损伤病理分型方面，需要同时进行心理干预并特别注意肺炎的风险？,颈段脊髓损伤
bridge_subgraph_25767.graphml,哪种疾病在常规镇痛管理中常结合针灸和中药治疗，且适合通过回顾性分析法进行辅助检查？,胫骨平台骨折
bridge_subgraph_25773.graphml,哪种疾病在年龄较大的人群中常见，且在进行膝关节镜联合复位内固定治疗时，常需借助螺旋CT检查和CT扫描进行影像学诊断？,胫骨平台骨折
bridge_subgraph_25777.graphml,哪种疾病在治疗过程中需要植骨和有效固定辅助治疗，并可能采用跨关节临时外固定支架固定手术，同时患者会出现疼痛和手术切口？,胫骨平台骨折
bridge_subgraph_25771.graphml,哪种疾病在经过内固定治疗辅助后，通过MSCT影像学检查显示骨性愈合良好，且常需手术治疗？,胫骨平台骨折
bridge_subgraph_25764.graphml,哪种疾病在治疗过程中可能引发腓骨假关节和深静脉血栓，且老年痴呆是其潜在的相关转化，常需通过内固定手术进行治疗？,再骨折
bridge_subgraph_25781.graphml,哪种疾病在治疗过程中需要钢板固定和早期关节活动，并且通常通过CT扫描和X线平片进行影像学检查？,胫骨平台骨折
bridge_subgraph_25774.graphml,哪种疾病在妇科门诊中，需要采用宫颈环形电切治疗，并且配合优质护理干预或保守治疗？,宫颈癌前病变
bridge_subgraph_25785.graphml,哪种疾病在治疗过程中需要同时使用万古霉素和中药，并配合饮食指导和心理干预？,胫骨平台骨折
bridge_subgraph_25779.graphml,哪种疾病在采用关节镜辅助手术或关节镜下微创内固定结合术治疗的同时，还需要配合护理干预和饮食指导？,胫骨平台骨折
bridge_subgraph_25780.graphml,哪种医学内容在涉及胸部CT和积液引流时，通常会与X线及MSCT同时出现？,结核性胸腔积液
bridge_subgraph_25782.graphml,哪种疾病在靶位超声和64排螺旋CT三维重组影像检查中表现明显，且通常需要配合早期康复治疗和心理干预？,胫骨平台骨折
bridge_subgraph_25786.graphml,哪种疾病在治疗过程中常需结合辣椒辣素、曲马多和塞来昔布药物治疗，并辅以优质护理服务？,膀胱痉挛性疼痛
bridge_subgraph_25776.graphml,哪种疾病需要通过带蹬吊带体系辅助治疗，并在必要时进行股骨短缩去旋转截骨或切开复位，且常需借助X线片进行影像学检查？,先天性髋脱位
bridge_subgraph_25789.graphml,哪种疾病在急性化脓性阑尾炎使用高频超声探头检查时，容易出现切口感染和疼痛？,单纯性阑尾炎
bridge_subgraph_25784.graphml,哪种疾病在41~50岁人群中常见，且在治疗过程中常需用到解剖型支持锁定钢板和中医药辅助疗法，同时通过X线片进行影像学检查？,胫骨平台骨折
bridge_subgraph_25794.graphml,哪种疾病在导致听力残疾的同时，还需要进行肠产毒性大肠杆菌的防治，并配合健康宣教和常规护理？,传染性疾病
bridge_subgraph_25788.graphml,哪种疾病在进行多层螺旋CT扫描时，常与Ⅱ型病变相关，并且可能需要结合磁共振成像和多模式镇痛进行治疗？,胫骨平台骨折
bridge_subgraph_25790.graphml,哪种疾病需要同时进行切开复位、钢板内固定手术治疗，以及切开复位关节面整复和个性康复辅助治疗？,胫骨平台骨折
bridge_subgraph_25792.graphml,哪种疾病在进行面神经功能评价量表辅助检查后，可能转化为GBS，并且需要考虑外科治疗和针灸治疗作为治疗方案？,面神经瘫痪
bridge_subgraph_25787.graphml,哪种疾病在脊髓损伤的病理分型中常见，且常表现为尿失禁，需要配合常规护理和康复治疗？,完全性脊髓损伤
bridge_subgraph_25778.graphml,哪种疾病在治疗过程中常采用切开复位联合钢板固定手术，并可能辅以单侧或双侧钢板内固定治疗，同时还需要进行心理护理和服用塞来昔布药物？,胫骨平台骨折
bridge_subgraph_25796.graphml,哪种疾病在早期康复锻炼和中医综合治疗中效果显著，且常采用中西医结合治疗以缓解疼痛？,胫骨平台骨折
bridge_subgraph_25793.graphml,哪种疾病在血流RI值异常和超声造影检查中常见，且需要配合优质护理和围手术期护理？,恶性卵巢肿瘤
bridge_subgraph_25795.graphml,哪种疾病在治疗过程中需要特别注重疼痛护理管理、康复外科护理，并且常常伴随情志护理和常规护理的综合辅助治疗？,肝癌手术
bridge_subgraph_25791.graphml,哪种疾病在采用64排螺旋CT三维影像后处理技术进行诊断和传统开放手术加内固定手术进行治疗的同时，还需要使用玻璃酸钠药物和MRI检查？,胫骨平台骨折
bridge_subgraph_25800.graphml,哪种疾病在手术复位情况下需要双切口显露和关节面骨折直接复位，且同时适用于非手术治疗和手术治疗？,胫骨平台骨折
bridge_subgraph_25797.graphml,哪种疾病在治疗过程中需要同时使用石膏外固定和解剖型钢板结合CPM功能锻炼，并且常伴随丹参注射液的使用和磁共振成像的检查？,胫骨平台骨折
bridge_subgraph_25799.graphml,哪种疾病会导致肌细胞肿胀和Bcl-2蛋白表达增强，同时常伴有深静脉血栓（DVT）的发生？,阿加曲班
bridge_subgraph_25798.graphml,哪种疾病在患者有糖尿病病史且伴运动障碍的情况下，同时需要运动疗法并可能引发抑郁？,VCI
bridge_subgraph_25801.graphml,哪种疾病在治疗过程中需要同时进行饮食护理、心理干预，并且可能采用经皮微创钢板内固定手术和CT影像学检查？,胫骨平台骨折
bridge_subgraph_25804.graphml,哪种疾病在CT和MRI检查中常见，且通常需要通过手术修复骨化性肌炎？,胫骨平台骨折
bridge_subgraph_25783.graphml,哪种疾病在进行切除术和GDC治疗后，预后良好且需要配合心理护理？,儿童颅内动脉瘤
bridge_subgraph_25809.graphml,哪种疾病在早期进行功能锻炼和采用正中单切口手术时，常会结合MSCT进行诊断和治疗？,胫骨平台骨折
bridge_subgraph_25802.graphml,哪种疾病会导致股骨髁部骨质疏松，同时在X线片上表现出骨小梁弹性模量的异常？,松质骨
bridge_subgraph_25813.graphml,哪种疾病需要采用后路联合手术及颈椎前后路Ⅰ期联合治疗，并辅以康复治疗和联合手术？,重症脊髓型颈椎病
bridge_subgraph_25811.graphml,哪种疾病在磁共振成像中表现为SchatzkerⅠ型，且在使用唑来膦酸治疗后仍伴随疼痛？,胫骨平台骨折
bridge_subgraph_25805.graphml,哪种疾病在治疗时通常采用标准胫骨平台入路和LCP+开窗植骨复位，并且需要进行MRI和CT影像学检查？,胫骨平台骨折
bridge_subgraph_25807.graphml,哪种疾病在治疗过程中需要同时使用三维CT检查、双钢板辅助治疗以及抗生素和万古霉素药物治疗？,胫骨平台骨折
bridge_subgraph_25803.graphml,哪种疾病在进行重建手术后，需要结合多元化康复模式的护理干预，并且在外科手术过程中常伴随疼痛？,胫骨平台骨折
bridge_subgraph_25816.graphml,哪种疾病在治疗过程中需要常规护理方法、解剖型支持锁定钢板、围手术期护理和心理护理等多种辅助治疗手段？,胫骨平台骨折
bridge_subgraph_25806.graphml,哪种疾病在采取100%预后状况的压疮防护措施、舒适护理和常规康复护理后，能够显著提高患者的康复效果？,脑外科手术
bridge_subgraph_25819.graphml,哪种疾病需要采用胫骨平台下截骨植骨内固定手术或Y形切口解剖钢板内固定治疗，并辅以综合护理干预或整体护理？,胫骨平台骨折
bridge_subgraph_25810.graphml,哪种疾病需要同时进行磁共振成像和多层螺旋CT检查，并可能采用内固定手术或膝关节镜辅助下微创手术进行治疗？,胫骨平台骨折
bridge_subgraph_25808.graphml,哪种疾病在采用闭合撬拨整复空心螺钉内固定和MDCT治疗的同时，更适合配合综合护理干预而非仅使用常规护理？,胫骨平台骨折
bridge_subgraph_25814.graphml,哪种疾病在采用微创内固定技术治疗和双切口多钢板内固定治疗时，容易出现感染和骨质疏松？,胫骨平台骨折
bridge_subgraph_25822.graphml,哪种疾病在常规康复护理干预和正侧位数字X线摄影的同时，还需要进行MRI检查和运动疗法？,胫骨平台骨折
bridge_subgraph_25820.graphml,哪种疾病在需要进行正确功能锻炼的同时，常伴有膝内外翻畸形，并且可以通过螺旋CT和MRI进行检查？,胫骨平台骨折
bridge_subgraph_25817.graphml,哪种疾病在评估时既需要考虑分半信度和自我护理能力测评表，又常与抑郁症状和焦虑自评量表同时出现？,CD-RISC
bridge_subgraph_25815.graphml,哪种疾病在采用标准胫骨平台入路或传统切开复位治疗时，需特别考虑患者年龄这一高危因素，并通过磁共振成像进行影像学检查？,胫骨平台骨折
bridge_subgraph_25821.graphml,哪种疾病需要通过单鼻孔蝶窦入路手术进行治疗，且在MRI和CT影像学检查中表现为鞍前型蝶鞍？,鞍区病变
bridge_subgraph_25826.graphml,哪种疾病在进行锁定加压钢板内固定术治疗的同时，需要配合综合护理和抗生素药物治疗，且属于Ⅱ型病理分型？,胫骨平台骨折
bridge_subgraph_25812.graphml,哪种疾病在关节镜下球囊成形术后容易出现复位不良，且需要综合护理干预和个性化护理来辅助治疗？,胫骨平台骨折
bridge_subgraph_25827.graphml,哪种疾病在治疗过程中需要同时进行宫腔镜和腹腔镜的内窥镜检查，并辅以常规护理和整体护理？,妇科不孕症
bridge_subgraph_25825.graphml,哪种疾病在供区均直接缝合和康复治疗的辅助下，表现为皮瓣质地柔软，且伤口能一期愈合？,拇指指端缺损
bridge_subgraph_25823.graphml,哪种疾病在垂体MRI检查中常见于垂体后叶，并且可能同时需要通过MRI和CT进行进一步诊断？,儿童中枢性尿崩症
bridge_subgraph_25818.graphml,哪种疾病在传统切开内固定治疗时常需借助64排螺旋CT三维重建成像、X线平片检查和MRI来进行诊断和评估？,胫骨平台骨折
bridge_subgraph_25830.graphml,哪种疾病在周径纤维缩短速度加快和进行PVP手术后，常伴随使用唑来膦酸并需要进行康复训练？,VCF
bridge_subgraph_25831.graphml,哪种疾病需要进行去顶减压手术，并在术前通过CT分析、CT检查和CT平扫进行影像学评估？,成人型多囊肾
bridge_subgraph_25829.graphml,哪种疾病在进行螺旋CT三维重建图像和骨诱导人工骨植骨治疗的同时，还需要进行MRI和CT检查？,胫骨平台骨折
bridge_subgraph_25833.graphml,哪种疾病会导致头颈部血管病变并引发头痛，且在MRI和CT检查中同时出现相关征象？,继发性头痛
bridge_subgraph_25834.graphml,哪种疾病在治疗过程中需要同时采用模块化康复护理和针灸辅助治疗，并且通常表现为活动受限，手术治疗方式为手术复位内固定？,胫骨平台骨折
bridge_subgraph_25835.graphml,哪种疾病在二维超声下呈现良性结节特征型，并且常通过X线及X线检查同时发现？,乳腺硬化性腺病
bridge_subgraph_25837.graphml,哪种症状在心血管系统疾病转化过程中与胫骨平台骨折的临床表现同时出现，并需要结合心理护理和中药治疗？,抑郁
bridge_subgraph_25836.graphml,哪种疾病在治疗过程中既需要系统康复训练辅助，又常常结合切开复位内固定和外科手术治疗，并且通常需要通过X线平片进行影像学检查？,胫骨平台骨折
bridge_subgraph_25839.graphml,哪种医学内容涵盖了双侧骶骨纵行骨折、不稳定型骨盆骨折，并且常与C1型骨折同时出现？,Tile C型
bridge_subgraph_25832.graphml,哪种疾病在并发症多、诊治复杂的情况下，常伴随胫骨平台双髁骨折，且需要护理干预和CT检查？,胫骨平台骨折
bridge_subgraph_25824.graphml,哪种疾病在采用微波消融术治疗骨痛时，可能需要考虑与传统开放手术相比的手术治疗效果？,甲状旁腺瘤
bridge_subgraph_25845.graphml,哪种疾病需要通过食管超声和磁共振成像进行影像学检查，并可能采用卵圆孔封堵器进行手术治疗？,卵圆孔未闭
bridge_subgraph_25840.graphml,哪种疾病在治疗过程中需要同时采用解剖复位、足量植骨、解剖钢板内固定联合中药，以及常规护理和中药辅助治疗？,胫骨平台骨折
bridge_subgraph_25838.graphml,哪种疾病在关节面塌陷程度较高时，通过容积成像和MRI成像技术能更清晰地被诊断？,胫骨平台骨折
bridge_subgraph_25844.graphml,哪种疾病在手术治疗侧副韧带损伤后，通过CT检查显示出良好恢复效果？,胫骨平台骨折
bridge_subgraph_25828.graphml,哪种疾病在治疗过程中常采用低压间断灌注法和常规功能训练，且在诊断时通常需要借助CT和MRI进行影像学检查？,胫骨平台骨折
bridge_subgraph_25847.graphml,哪种疾病在诊治过程中较为复杂，需要结合体能训练，并且常与DVT和多层螺旋CT检查同时出现？,胫骨平台骨折
bridge_subgraph_25842.graphml,哪种疾病在胫骨平台骨折组和非关节炎组中都会出现疼痛，并且需要护理干预？,胫骨平台骨折
bridge_subgraph_25846.graphml,哪种疾病在进行CT扫描检查时，需要结合三维可视模型，并且通常会同时使用CT和MRI进行诊断？,胫骨平台骨折
bridge_subgraph_25851.graphml,哪种疾病会导致呕吐停止和惊厥，并且常与肺炎同时出现在特定年龄段的儿童中？,RV肠炎
bridge_subgraph_25841.graphml,哪种疾病在治疗时常用止痛和推拿作为辅助手段，且常与骨质疏松同时出现，也可能需要针灸辅助治疗？,骨痹
bridge_subgraph_25848.graphml,哪种疾病在VCT的3D成像和CT平扫中均有明显表现，并且需要中西医结合的护理方案来缓解疼痛？,胫骨平台骨折
bridge_subgraph_25850.graphml,哪种疾病在DR病理分型下，常需通过MRI检查确诊，并可能采用自体髂骨移植进行手术治疗？,胫骨平台骨折
bridge_subgraph_25852.graphml,哪种疾病在男性中较为常见，且随着年龄增长风险增加，需要通过抗骨质疏松剂和全方位护理来进行治疗？,胫骨平台骨折
bridge_subgraph_25861.graphml,哪种疾病在61～70岁人群中易引发消化道出血，且通常需要手术治疗并可通过多层螺旋CT进行影像学检查？,结肠憩室
bridge_subgraph_25857.graphml,哪种疾病在早期进行功能锻炼和关节镜辅助复位内固定的同时，还需要结合针刺治疗，并且与患者年龄密切相关？,胫骨平台骨折
bridge_subgraph_25856.graphml,哪种疾病需要同时采用闭合复位和X线检查，并联合使用外固定架植骨和加压铜板进行治疗？,桡骨远端C3型骨折
