file,query,answer
bridge_subgraph_07452.graphml,哪种疾病在服用尼福地平且无耳聋症状的患者中，与饮酒习惯和性别有关联？,NIHL
bridge_subgraph_07455.graphml,哪种疾病在新生儿中可能导致损伤和骨折，且在治疗时常用McRoberts手法，同时糖尿病是其风险评估因素？,肩难产
bridge_subgraph_07459.graphml,哪种疾病在临床上表现为习惯性便秘和恶心，且常伴有急性左心衰竭，需要通过常规健教护理辅助治疗？,失眠
bridge_subgraph_07461.graphml,哪种疾病会导致失眠和疼痛，且多见于年龄较大的男性？,骨折
bridge_subgraph_07460.graphml,哪种疾病既表现为高F血症和向心性肥胖，又常伴有糖尿病和高血压？,库欣病
bridge_subgraph_07453.graphml,哪种疾病在治疗过程中需要使用醒脑静药物，并伴随皮质萎缩的临床表现，同时常常结合针刺治疗和护理干预？,脑梗死性痴呆
bridge_subgraph_07450.graphml,哪种疾病在女性患者中常见，且常通过彩色多普勒血流显像和超声引导腹水检查发现，并可能与结核病同时出现？,盆腔结核
bridge_subgraph_07457.graphml,哪种疾病在出现异种脱蛋白松质骨或阻塞性通气功能障碍的同时，还需与慢性鼻窦炎进行鉴别诊断，并伴有低热的临床表现？,DPB
bridge_subgraph_07458.graphml,哪种疾病在中度失眠的病理分型下，常需通过疏导作为辅助治疗，且发病部位多在肝脏，并可通过磁共振成像进行检查？,失眠
bridge_subgraph_07463.graphml,哪种疾病会出现彻夜不眠和腹胀，并且可以通过呼吸功能锻炼操和中药汤剂进行辅助治疗？,失眠
bridge_subgraph_07465.graphml,哪种疾病在进行康复护理干预和地塞米松治疗的同时，还需要进行脑电图检查和常规治疗？,小儿重症病毒性脑炎
bridge_subgraph_07462.graphml,哪种疾病在发生后囊破裂并发症时，需要与眼内炎进行鉴别诊断，且患者常伴有焦虑高危因素，并可能累及肾脏？,糖尿病
bridge_subgraph_07467.graphml,哪种疾病在出现胸闷和头痛症状时，可能需要通过颅内血肿微创穿刺手术或显微外科手术进行治疗？,小脑出血
bridge_subgraph_07466.graphml,哪种疾病会导致失眠，且与化安神方相关，同时常见于慢性乙型肝炎的男性患者？,糖尿病
bridge_subgraph_07464.graphml,哪种疾病在霉菌培养实验室检查后进入巩固期，且常伴随免疫力低下和肝硬化等并发症？,隐球菌脑膜炎
bridge_subgraph_07473.graphml,哪种疾病在亚健康和慢乙肝患者中，同时伴有FVC异常和冠心病风险？,失眠
bridge_subgraph_07471.graphml,哪种疾病在产前超声诊断或彩超检查中常被发现，且可能导致心律失常并影响消化系统？,心脏畸形
bridge_subgraph_07468.graphml,哪种疾病在胸三维超声心动图上显示心腔内异常，且常伴随急性心肌梗死和尿毒症的临床表现？,左室收缩
bridge_subgraph_07470.graphml,哪种疾病在治疗时需要进行缩窄段切除和主动脉弓心包补片成形术，并且患者常出现心悸症状，可通过磁共振检查确诊？,主动脉缩窄
bridge_subgraph_07472.graphml,哪种疾病会导致睡眠时间较短、食欲不振，并伴随发热和头痛的症状？,失眠
bridge_subgraph_07474.graphml,哪种疾病在女性患者中常见，且治疗时需结合放疗不良反应的应对、籽耳穴压豆和心理疏导？,失眠
bridge_subgraph_07476.graphml,哪种医学内容与百会、FLRX直接相关，并且常与骨折、磁共振成像同时出现？,失眠
bridge_subgraph_07475.graphml,哪种疾病在男性中较为常见，且在治疗过程中需要基因治疗和心理护理，并可能引发瘢痕疙瘩这一并发症？,汗孔角化症
bridge_subgraph_07483.graphml,哪种疾病通常与（内容1）、（内容2）直接相关，并且常伴随出现（内容3）和（内容4）？,nan
bridge_subgraph_07478.graphml,哪种疾病既表现为情绪烦恼和胸闷，又可以通过正念冥想和护理来辅助治疗？,失眠
bridge_subgraph_07479.graphml,哪种疾病在治疗时通常需要同时使用清热药和安神补脑软胶囊，并结合健康宣教和西药辅助治疗？,失眠
bridge_subgraph_07489.graphml,哪种疾病在朱砂安神丸治疗过程中需要结合心理生理评估，并且常伴随血常规异常和重型地中海贫血的出现？,失眠
bridge_subgraph_07482.graphml,哪种疾病在治疗过程中常使用镍钛合金环抱器和接骨板内固定术，且容易出现感染并发症，需配合综合护理干预？,多发肋骨骨折
bridge_subgraph_07477.graphml,哪种疾病在出现MMSE评分异常和服用安寐汤的同时，常伴随抑郁情绪和体重指数的变化？,失眠
bridge_subgraph_07487.graphml,哪种疾病会导致胸腺异常、nDDAVP刺激试验结果异常，并且常与肺癌和记忆力减退同时出现？,异位ACTH综合征
bridge_subgraph_07485.graphml,哪种疾病会导致老年住院病人存在不同程度的失眠，并且在进行SOD检测、高压氧治疗和磁共振检查时常见？,失眠
bridge_subgraph_07469.graphml,哪种疾病在进行多层螺旋CT薄层增强扫描时常见，且需要通过局部切除治疗，同时病理分型常表现为混合型和恶性肿瘤？,壶腹癌
bridge_subgraph_07480.graphml,哪种疾病在治疗过程中需要使用异丙酚复合瑞芬太尼，并进行脑电双频指数监测，同时还需要检查肝肾功能和血常规？,ASA Ⅰ～Ⅱ级
bridge_subgraph_07481.graphml,哪种疾病在晚期表现为恶性肿瘤，并常伴有高血压，治疗时可能使用杞菊地黄丸和氟西汀？,失眠
bridge_subgraph_07486.graphml,哪种疾病在采用电针结合归脾汤或平衡针针刺治疗时，常见于伴有呕吐症状的男性患者？,失眠
bridge_subgraph_07497.graphml,哪种疾病在进行动态增强CT和灌注扫描时，常伴随恶性肿瘤的出现，并且也需要通过磁共振成像进行检查？,孤立性肺结节
bridge_subgraph_07484.graphml,哪种疾病会导致癌症患者出现失眠和头痛，且可以通过头面部穴位按摩辅助治疗，还可能与中毒有关？,失眠
bridge_subgraph_07493.graphml,哪种疾病在出现先兆流产和压力因素的同时，还伴随磁共振检查异常和发热症状？,失眠
bridge_subgraph_07490.graphml,哪种疾病在治疗急、慢性牙髓炎时需要特别重视患者准备和心理护理，且容易在感染部位出现？,根管
bridge_subgraph_07491.graphml,哪种医学内容能同时缓解人际关系矛盾和安神液的使用，并且常与当归和生地黄一同出现？,失眠
bridge_subgraph_07492.graphml,哪种社会学理论能更好地解释中医护理措施在糖尿病鉴别诊断中的应用，并兼顾肺癌并发症和脂代谢紊乱高危因素的影响？,高血压
bridge_subgraph_07498.graphml,哪种社会学理论能够解释错构瘤和腰背痛与肺癌、肝脏病变之间的关联？,肿瘤
bridge_subgraph_07495.graphml,哪种疾病与PT和抑郁性人格直接相关，且常与乳腺癌和膀胱癌同时出现？,失眠
bridge_subgraph_07494.graphml,哪种疾病会导致IVT（同义词）和逸搏心律，同时伴随心悸，并在心电图上有明显表现？,特发性室性心动过速
bridge_subgraph_07502.graphml,哪种疾病在35~44岁人群中，因口服避孕药和高血压病史而更易引发脑卒中？,出血型脑卒中
bridge_subgraph_07505.graphml,哪种疾病与睡眠卫生问题直接相关且占比达31.91%，并常与风湿科问题和男性患者同时出现？,失眠
bridge_subgraph_07504.graphml,哪种症状在流感病毒肺炎和失眠的同时，伴随咳嗽和噬血细胞综合征的出现？,发热
bridge_subgraph_07488.graphml,哪种医学内容涉及E-钙黏蛋白、自身免疫性胰岛炎，并且与度洛西汀和2型糖尿病相关？,STZ
bridge_subgraph_07501.graphml,哪种疾病在女性中多发，且随着年龄增长风险增加，其病因与自身免疫异常有关，通常使用地塞米松进行治疗？,ALHL
bridge_subgraph_07499.graphml,哪种疾病在结肠癌或恶性肿瘤手术后容易出现非运动症状，且可能需要使用抗抑郁药治疗？,失眠
bridge_subgraph_07511.graphml,哪种疾病既表现为冠心病心律失常、睡眠质量降低，又伴随腹胀和肿瘤症状？,失眠
bridge_subgraph_07500.graphml,哪种疾病在磁共振成像技术检查中常见，且表现为习惯性便秘，通常需要通过艾灸和常规护理进行辅助治疗？,失眠
bridge_subgraph_07503.graphml,哪种疾病在治疗过程中常需同时使用OSAS和氯化钠注射液，并伴随使用右美托咪定和监测SBP？,全麻诱导
bridge_subgraph_07508.graphml,哪种疾病在定病位和综合护理方面需要特别关注，并且通常需要整体护理和采取相应的护理措施？,失眠
bridge_subgraph_07509.graphml,哪种疾病会导致头晕目眩、记忆力减退和烦躁，并且可以通过调神穴的药物治疗来缓解？,失眠
bridge_subgraph_07506.graphml,哪种疾病在出现原发性硬化性胆管炎和颌下腺及颈部淋巴结活检结果异常的同时，还可能伴随恶性肿瘤和TBil升高？,IgG4-RD
bridge_subgraph_07507.graphml,哪种疾病在治疗后会出现心悸，且需与炎性假瘤和肺结核进行鉴别诊断，其病理分型为混合型？,肺癌
bridge_subgraph_07496.graphml,哪种疾病在表现为难治性肺炎支原体肺炎时，常伴随发热并发症，且需通过支气管肺泡灌洗液进行药物治疗，同时需检测细胞因子以辅助诊断？,肺炎
bridge_subgraph_07514.graphml,哪种疾病在针灸联合推拿按摩的辅助治疗下，同时配合护理和常规护理，能有效改善睡眠不稳的临床表现？,失眠
bridge_subgraph_07517.graphml,哪种疾病与缺血性脑卒中及CWI直接相关，且常与ApoB和糖尿病同时出现？,颅内外血管狭窄
bridge_subgraph_07510.graphml,哪种疾病在治疗过程中常使用吡唑并嘧啶类药物，且其病理分型中包括急性左心衰竭，同时患者还可能表现出贫血和肝硬化的症状？,失眠
bridge_subgraph_07513.graphml,哪种疾病在治疗过程中需要同时使用双腔气囊导尿管和双窥镜尿道会师术，并且常与肿瘤和骨折并发？,尿道损伤
bridge_subgraph_07516.graphml,哪种疾病在进行血管内治疗时，动脉瘤位置和患者年龄、吸烟史都是重要的风险评估因素？,Hunt-Hess
bridge_subgraph_07512.graphml,哪种疾病需要通过序贯血液净化或血液净化疗法进行辅助治疗，且其病因常与镇静催眠药相关，并可能表现出高血压的临床症状？,急性重症中毒
bridge_subgraph_07515.graphml,哪种疾病会导致孟氏孔区发病，伴随恶心症状，且需要通过磁共振成像检查和显微外科治疗？,中枢神经细胞瘤
bridge_subgraph_07521.graphml,哪种疾病在具有抑郁倾向、年龄较大且吸烟的人群中，适合使用解郁养血安神汤进行治疗？,失眠
bridge_subgraph_07519.graphml,哪种疾病在临床表现上常伴有紧张和忧虑，且在阴道分娩后需要常规护理干预？,产科分娩
bridge_subgraph_07518.graphml,哪种疾病在治疗过程中需要使用苏格木勒-3汤水提物，且其病因与生活因素密切相关，同时需要特别护理并常伴有贫血症状？,失眠
bridge_subgraph_07529.graphml,哪种疾病在接种卡介苗后容易出现乏力和头痛的症状？,结核病
bridge_subgraph_07527.graphml,哪种疾病在留置导尿管的高危因素下容易引发骨髓炎，且在ICU护理过程中常出现并发症？,创口感染
bridge_subgraph_07520.graphml,哪种疾病适合采用低频电穴位刺激和中医护理技术进行治疗，并且常与SBP和年龄因素相关？,失眠
bridge_subgraph_07526.graphml,哪种疾病在实验室检查中常表现为肾功能异常和脂蛋白异常，且常与原发性高血压和血脂异常同时出现？,心、脑血管病
bridge_subgraph_07525.graphml,哪种疾病在男性患者中常见，且需要通过支气管镜和BALF检查，同时还需要进行健康教育？,呼吸道异物
bridge_subgraph_07530.graphml,哪种疾病需要同时进行肠内营养支持和气管插管，并且在治疗过程中还需配合常规护理和辨证施护？,重型颅脑损伤昏迷
bridge_subgraph_07523.graphml,哪种疾病在老年住院病人中表现为不同程度的失眠和呕吐，且在血常规检查中有异常，需要与SDB进行鉴别诊断？,失眠
bridge_subgraph_07534.graphml,哪种疾病在晚期恶性肿瘤和抑郁症中更常伴随疼痛，且适合采用运动疗法缓解？,失眠
bridge_subgraph_07524.graphml,哪种疾病在治疗时可能同时使用天王补心丹和头部刺血疗法，且常伴随急性脑卒中和睡眠效率下降的症状？,失眠
bridge_subgraph_07531.graphml,哪种疾病会导致睡眠时间缩短，且在使用希尔康合剂的同时，常与骨科问题和SSD相关联？,失眠
bridge_subgraph_07522.graphml,哪种疾病在男性中发病率较高，且其预后生存率约为33%，胃壁厚度是重要的风险评估因素，通常需要接受化疗治疗？,MALT淋巴瘤
bridge_subgraph_07533.graphml,哪种疾病在采用瑞舒伐他汀进行规范化二级预防的同时，还需要结合PCI和基础护理进行治疗？,老年冠心病PCI
bridge_subgraph_07528.graphml,哪种疾病需要进行全食管及喉切除手术，并辅以高频超声检查和综合治疗，同时其死亡率高达14.3%？,颈段食管癌
bridge_subgraph_07541.graphml,哪种疾病发病率约为15.1%，主要表现为关节痛，且常伴有脑梗死和乳腺癌的临床表现？,失眠
bridge_subgraph_07537.graphml,哪种疾病在用力或情绪激动时容易发作，且常见于高血压和糖尿病患者？,SAH再出血
bridge_subgraph_07535.graphml,哪种疾病在应用连续方程法诊断肺动脉高压的同时，还常伴随缺血性脑卒中和心房颤动？,二尖瓣置换
bridge_subgraph_07539.graphml,哪种疾病在骨科治疗中常需结合闭合复位手术和加压钢板内固定，并且需要特别的护理干预？,胫骨干骨折
bridge_subgraph_07538.graphml,哪种疾病会导致脾部不适并伴随皮疹，同时引发继发性失眠？,失眠
bridge_subgraph_07536.graphml,哪种疾病在治疗过程中常采用Orem自理模式和音乐干预，并且患者会出现呕吐症状，同时需要进行健康教育？,卵巢癌化疗
bridge_subgraph_07532.graphml,哪种医学内容在丹七软胶囊治疗和针药结合治疗的同时，配合常规护理和心理护理干预效果最佳？,脑血管后遗症
bridge_subgraph_07542.graphml,哪种疾病通过外用针刺辅助治疗，常见鼻通气障碍，且发病率约为45.03%，多发于特定年龄段人群？,失眠
bridge_subgraph_07543.graphml,哪种疾病与t(14;18)这一风险评估因素和高肿瘤负荷的临床表现密切相关，且常伴有遗传病因和氟西汀的使用？,FL
bridge_subgraph_07550.graphml,哪种疾病在辅助治疗时需要养成良好的生活习惯，且常表现为QTc间期延长、恶心和腹痛？,失眠
bridge_subgraph_07547.graphml,哪种疾病既可以通过粪便菌群移植治疗，又需要采取接触预防措施，且常伴随肿瘤和发热症状？,艰难梭菌感染
bridge_subgraph_07551.graphml,哪种疾病会导致人睡困难，并且在治疗过程中需要结合戊巴比妥钠、常规护理和健康宣教？,失眠
bridge_subgraph_07545.graphml,哪种疾病在治疗过程中会同时涉及水苏糖和氯沙坦的使用，并且常常与肾脏问题和小檗碱相关？,KKAy
bridge_subgraph_07549.graphml,哪种疾病会导致昼不精夜不瞑、脾胃不和，并可能伴随肺炎等内科症状？,失眠
bridge_subgraph_07546.graphml,哪种疾病在进行血凝抑制试验时常发现血管内皮细胞受损，且患者通常伴有腹泻症状，需要通过血液透析辅助治疗？,肾综合征
bridge_subgraph_07554.graphml,哪种疾病在采用中药浴足和护理干预治疗的同时，常伴有胆怯和贫血的症状？,失眠
bridge_subgraph_07548.graphml,哪种疾病在出现VCI和耳穴磁疗的同时，还常伴随心电图异常和鼻出血的症状？,失眠
bridge_subgraph_07540.graphml,哪种疾病在治疗时需要开腹手术和疝囊超高位结扎，并且术后容易并发感染，需进行综合护理？,小儿腹股沟斜疝
bridge_subgraph_07544.graphml,哪种疾病在心脾两虚型失眠和焦虑自评量表高分的患者中，常伴随整体护理需求及便秘症状？,失眠
bridge_subgraph_07556.graphml,哪种疾病在临床上表现为非器质性睡眠障碍和感染，且可以通过透灸和循证护理进行辅助治疗？,失眠
bridge_subgraph_07552.graphml,哪种疾病会导致脑室周围白质软化并常伴随出生窒息，同时在治疗过程中需综合考虑感染问题？,RDS
bridge_subgraph_07557.graphml,哪种疾病在治疗过程中需要注入自身新鲜全血或血浆、缝合止血法，并常伴随高压氧治疗和护理？,肝外伤
bridge_subgraph_07555.graphml,哪种疾病需要同时采用西妥昔单抗和参麦注射液药物治疗，以及姑息性左半结肠切除手术和针对性护理辅助治疗？,晚期结肠癌
bridge_subgraph_07558.graphml,哪种疾病在治疗时需要用到中药归脾汤和心理干预疏导，并且常伴随腹泻和皮疹的临床表现？,失眠
bridge_subgraph_07560.graphml,哪种疾病在治疗时常用奥氮平药物和心理行为干预模式，且患者常伴有骨痛和肝功能异常的症状？,失眠
bridge_subgraph_07559.graphml,哪种其他治疗在非小细胞肺癌（NSCLC）和胃癌中，与射频热疗同时使用效果更佳？,化疗
bridge_subgraph_07561.graphml,哪种疾病在老年人中多发，且临床表现为水肿，通常采用解郁安神汤或西酞普兰合并乌灵胶囊进行治疗？,失眠
bridge_subgraph_07565.graphml,哪种疾病在采用针灸联合共情护理疗法后，能有效缓解躯体不适，并且常伴随发热和血常规异常？,失眠
bridge_subgraph_07564.graphml,哪种疾病在助产护理门诊辅助治疗和阴道试产手术治疗的同时，还需要配合优质护理和安定药物治疗？,瘢痕子宫
bridge_subgraph_07563.graphml,哪种疾病与雌激素受体阳性、形态不规则密切相关，且在91%的乳腺癌病例中出现？,MBC
bridge_subgraph_07568.graphml,哪种疾病在治疗过程中需要使用亚叶酸钙和厄洛替尼，并且常伴随疼痛和高血压等并发症？,老年晚期食管癌
bridge_subgraph_07562.graphml,哪种疾病在针灸联合推拿按摩辅助治疗及服用小柴胡汤后，仍会出现乏力和ET的临床表现？,失眠
bridge_subgraph_07566.graphml,哪种疾病在治疗时通常会用到普林格尔多功能治疗仪和按摩乳房，同时伴随乳腺炎的临床表现和需要常规护理？,乳汁淤积
bridge_subgraph_07570.graphml,哪种疾病在治疗过程中需要结合黄芩茎叶黄酮和早期手术减压，并辅以维生素E药物和心理护理？,ASCI
bridge_subgraph_07573.graphml,哪种疾病会导致腹水和腹胀，且在治疗过程中可能需要接受下腔静脉球囊扩张成形术以及特别的护理？,布加氏综合征
bridge_subgraph_07553.graphml,哪种疾病既会导致平喘止咳和剧烈咳嗽，又常与支气管哮喘和2型糖尿病同时出现？,纵隔气肿
bridge_subgraph_07572.graphml,哪种疾病既与矛盾性失眠和食欲素受体拮抗剂直接相关，又常与肥胖和吸烟同时出现？,失眠
bridge_subgraph_07571.graphml,哪种疾病在实验室检查中表现为FEV1/FVC异常，且常伴有脑动脉硬化和冠心病，并可能由脑梗死引起？,痰证
bridge_subgraph_07574.graphml,哪种社会学研究领域会同时关注失眠、黏膜炎以及口干和恶心这些临床表现？,肿瘤
bridge_subgraph_07575.graphml,哪种医学内容在探讨艾灸百会对疾病预后的影响时，会结合酶联免疫法检测结果和患者年龄进行分析？,失眠
bridge_subgraph_07569.graphml,哪种疾病在减轻生理病理不适时常用地西泮治疗，并且常与CRF和血液透析同时出现？,失眠
bridge_subgraph_07577.graphml,哪种疾病在术前宣教和病理科处理中，需要特别结合常规护理，并在对照组研究中显示出显著差异？,宫颈疾病
bridge_subgraph_07567.graphml,哪种疾病在男性中发病率高达70.4%，并且可以通过中药小复方安眠颗粒和维生素E进行治疗？,失眠
bridge_subgraph_07576.graphml,哪种疾病在临床表现上既有神经症又有发热和肺炎，且可采用穴位植线治疗作为辅助疗法？,失眠
bridge_subgraph_07579.graphml,哪种疾病在阴道三维超声声像图检查后，需要通过剖宫产术治疗，并辅以循证护理和常规护理？,子宫切口妊娠
bridge_subgraph_07584.graphml,哪种疾病既包括胆管内结石和胆总管结石，又常伴随发热并需要外科治疗？,胆道结石症
bridge_subgraph_07580.graphml,哪种疾病在新生儿中多发，通过彩色多普勒血流显像可以检查，且常伴随n2并发症，治疗后症状能够消失？,睾丸炎
bridge_subgraph_07578.graphml,哪种疾病在采用Transwell法和克隆形成法进行研究时，常与肿瘤和葛根素同时出现？,HeLa
bridge_subgraph_07582.graphml,哪种疾病在治疗过程中需要同时使用多巴胺和阿拉明药物，并辅以心理护理和镇静措施？,小儿肺炎合并心力衰竭
bridge_subgraph_07588.graphml,哪种疾病会导致糖原累积症、尿有机酸分析异常，并伴随嗜睡和呕吐的症状？,尿素循环障碍
bridge_subgraph_07586.graphml,哪种疾病既有阴虚火旺、呕吐的临床表现，又适合通过行为疗法和中药汤剂进行辅助治疗？,失眠
bridge_subgraph_07587.graphml,哪种疾病同时出现齐哌西酮和长新冠症状，且伴随胸闷和冠心病？,失眠
bridge_subgraph_07583.graphml,哪种医学内容与伤残军人的Tau蛋白异常以及心电图显示的心律失常现象同时相关？,失眠
bridge_subgraph_07597.graphml,哪种疾病在非原发性肝癌且血流量明显增加的情况下，常与肝硬化和慢性乙肝同时出现？,肝硬化组
bridge_subgraph_07590.graphml,哪种疾病需要通过PPH手术治疗、聚乙二醇电解质散剂药物治疗，并且常配合生物反馈治疗或生物反馈疗法辅助治疗？,OOC
bridge_subgraph_07594.graphml,哪种疾病在治疗时常用温胆汤加龙牡敛和针刺按摩，并且需要结合综合护理，在眼科中较为常见？,失眠
bridge_subgraph_07581.graphml,哪种疾病在患者出现CD-RISC评分异常和乳腺癌失眠的同时，还常伴随TBil升高和恶心症状？,失眠
bridge_subgraph_07592.graphml,哪种疾病在双胎妊娠产妇中更容易并发妊娠期高血压，且需要特别关注社会因素和心理护理的影响？,剖官产
bridge_subgraph_07595.graphml,哪种疾病在进行星状神经节阻滞后常伴有失眠，且需通过B超检查和磁共振来辅助诊断？,乳腺癌
bridge_subgraph_07598.graphml,哪种疾病在治疗过程中需要使用氨己烯酸并监测血药浓度，同时可能引起抗癫痫和神经损害的副作用？,癫痫
bridge_subgraph_07599.graphml,哪种疾病在青少年中常见，表现为怕热多汗、疲乏无力，且通常需要放疗，如青少年毒性弥漫性甲状腺肿？,Graves
bridge_subgraph_07585.graphml,哪种医学内容既涉及依赖Smad3的组织修复和阿司匹林，又与认知功能障碍及慢性乙型肝炎相关？,氧化损伤
bridge_subgraph_07589.graphml,哪种疾病在晚期癌症的临床表现中，同时伴随冠心病和急性心肌梗死，且适合使用中药酸枣仁汤进行治疗？,失眠
bridge_subgraph_07604.graphml,哪种疾病在脑卒中后和泌尿系感染的临床表现中，需要同时采用护理干预和循证护理作为辅助治疗？,失眠
bridge_subgraph_07591.graphml,哪种疾病在出现腹膜深部浸润病灶（DCI）的同时，还需要特别关注护理干预和冠心病的并发情况？,CPP
bridge_subgraph_07602.graphml,哪种疾病在环境改变和心律失常的影响下，会出现轻型脑外伤的临床表现，并且需要通过镇静来进行辅助治疗？,失眠
bridge_subgraph_07596.graphml,哪种疾病适合采用蒙医方法与中药穴位贴敷法相结合的治疗方式，且常表现为混合型症状，需要通过血常规检查来辅助诊断？,失眠
bridge_subgraph_07601.graphml,哪种疾病在颈部CT检查中易出现风湿样关节炎的并发症，且需与类风湿关节炎进行鉴别诊断，同时还可能累及心血管系统？,复发性多软骨炎
bridge_subgraph_07593.graphml,哪种疾病在珂立苏联合护理干预和牛肺泡表面活性剂治疗过程中，常伴随鼻塞症状，且需要通过酶联免疫吸附试验进行诊断？,早产儿呼吸窘迫综合征
bridge_subgraph_07607.graphml,哪种疾病在调理脾胃气机、缓解鼻塞的同时，还常与原发性肝癌和二甲双胍的使用相关？,失眠
bridge_subgraph_07610.graphml,哪种医学内容与DED（干眼症）、泪点栓以及糖尿病和2型糖尿病密切相关？,角膜荧光素染色
bridge_subgraph_07605.graphml,哪种疾病在需要适当药物助眠和忧郁程度较高的情况下，常常伴随磁共振成像检查和西药治疗？,失眠
bridge_subgraph_07600.graphml,哪种疾病在治疗过程中通常会结合心理-行为干预和积极心理学团体干预，并且可能同时使用褪黑素和二甲双胍？,失眠
bridge_subgraph_07608.graphml,哪种疾病既属于眼眶病和慢性病，又常伴随高血压，且适合采用VPW5 32nm激光治疗？,血管性疾病
