file,query,answer
bridge_subgraph_09007.graphml,哪种疾病会在心脏彩超检查中出现异常，并伴随手足硬肿、皮疹和发热等症状？,不典型川崎病
bridge_subgraph_09003.graphml,哪种疾病在衰弱老年人中常见，且可以通过头部穴位按摩、舒适护理和循证护理进行辅助治疗？,失眠
bridge_subgraph_09004.graphml,哪种疾病在采用集束化管理和综合护理干预的情况下，最容易被误诊为小脑血吸虫病而非脑出血？,继发性脑积水
bridge_subgraph_08999.graphml,哪种疾病在PD轻度认知障碍和五子衍宗汤的治疗中，与MCI和认知功能障碍同时出现？,PD-MCI
bridge_subgraph_09005.graphml,哪种疾病在外科治疗后皮瓣成活良好且质地外观佳，且常与骨折和高压氧治疗同时出现？,皮肤缺损
bridge_subgraph_09002.graphml,哪种疾病在药学监护预防过程中，容易出现引流管阻塞、感染以及重度烧伤等并发症？,静脉导管感染
bridge_subgraph_08998.graphml,哪种疾病在中-重度睡眠呼吸紊乱和RFVTR患者中常见，且常伴随多导睡眠监测异常和卒中发生？,SDB
bridge_subgraph_09000.graphml,哪种疾病在5岁以下儿童中常见，且在治疗过程中常结合非创伤性修复治疗技术、安慰剂和常规护理？,乳牙龋齿
bridge_subgraph_09009.graphml,哪种疾病在出现腔隙性脑梗死和胃癌的临床表现时，还可能伴随重症肌无力，并且需要心理护理干预作为辅助治疗？,失眠
bridge_subgraph_09008.graphml,哪种疾病在黄豆摄入过多时，会导致长谷川痴呆量表评分下降，同时伴随汉密尔顿抑郁量表评分升高，且人参对其有一定的缓解作用？,HDS
bridge_subgraph_09011.graphml,哪种疾病在磁共振成像中表现为脑肿瘤，且其治疗可用疏肝安神汤，同时临床表现包括ACI？,失眠
bridge_subgraph_09010.graphml,哪种疾病会导致不能获得充足睡眠，并且在使用六味地黄汤治疗的同时，吸烟和年龄也是重要影响因素？,失眠
bridge_subgraph_09016.graphml,哪种疾病在塞方保洁和Zung's焦虑（SAS）评估中与食管癌和男性群体同时出现？,失眠
bridge_subgraph_09020.graphml,哪种疾病在治疗过程中常采用频谱照射和维生素B1穴位注射，并且需要配合优质护理和综合护理干预？,痔疮术后尿潴留
bridge_subgraph_09012.graphml,哪种疾病在进行CDE检查和彩色超声联合X线钼靶检查时，常伴随磁共振成像结果异常及抑郁情绪的出现？,乳腺良恶性肿瘤
bridge_subgraph_09018.graphml,哪种疾病在习惯性便秘和HAMA患者中常见，且常与中药和高压氧治疗同时使用？,失眠
bridge_subgraph_09015.graphml,哪种疾病会导致植物神经功能紊乱性头晕，同时伴随疲乏和呕吐，且可以通过百乐眠进行治疗？,失眠
bridge_subgraph_09025.graphml,哪种疾病在常见慢性病中，老年男性患者较多，且常与糖尿病等其他慢性病同时出现？,体重正常组
bridge_subgraph_09014.graphml,哪种疾病会导致全身瘙痒，并且其发病率约为2.86%，在治疗过程中常与丹参注射液联用，同时需要通过酶联免疫吸附试验进行辅助诊断？,妊娠肝内胆汁淤积症
bridge_subgraph_09022.graphml,哪种疾病在采用电针法及电针结合康复作为辅助治疗的同时，也常使用针灸疗法和针灸进行辅助治疗？,中风后偏瘫
bridge_subgraph_09017.graphml,哪种疾病在19%的患者中同时出现血常规异常和脑梗死，并且与安全感问卷得分低相关？,失眠
bridge_subgraph_09013.graphml,哪种疾病在治疗时通常会采用泼尼松联合托吡酯或促皮质素剂量递增法，并且可能同时使用硝西泮和进行脑电图检查？,婴儿痉挛
bridge_subgraph_09024.graphml,哪种疾病会导致阿立哌唑组出现头痛和心悸，同时伴随腹胀，且可能与环境因素有关？,失眠
bridge_subgraph_09021.graphml,哪种疾病在进行χ2检验和t检验时，常与帕金森病和慢性乙型肝炎同时出现？,统计学分析
bridge_subgraph_09027.graphml,哪种疾病在RAS组检测和超声检查中常见，并且常伴随地西泮使用和肝、肾功能异常？,桡动脉痉挛
bridge_subgraph_09019.graphml,哪种疾病在治疗过程中常需使用睡眠药和脑电生物反馈，并且需要特别的护理措施，同时可能伴随肾衰的出现？,失眠
bridge_subgraph_09029.graphml,哪种疾病在男性患者中常与心力衰竭同时出现，且对安慰剂治疗有显著反应？,失眠
bridge_subgraph_09023.graphml,哪种疾病在辅助治疗中常采用针刺加耳穴和健康教育，且患者通常表现为入睡快，同时需要监测体重指数？,失眠
bridge_subgraph_09033.graphml,哪种疾病在采用外用针刺和养阴清热法治疗的同时，还需要配合综合护理干预，而不是仅依赖常规护理？,失眠
bridge_subgraph_09028.graphml,哪种疾病在3岁以上儿童中常见，且需通过鼻咽侧位片和磁共振检查，常伴有慢性鼻窦炎？,儿童腺样体肥大
bridge_subgraph_09026.graphml,哪种疾病在性压抑和创伤后应激障碍的共同影响下，需要使用抗精神类药物治疗，且治疗后可能出现精神分裂症的症状？,失眠
bridge_subgraph_09032.graphml,哪种疾病在辅助治疗中常采用涌泉和健康宣教，且其临床表现包括甲基苯丙胺依赖伴失眠，还可能导致糖尿病？,失眠
bridge_subgraph_09031.graphml,哪种疾病会导致鼻通气障碍，且常与胃安神方相关配伍，同时伴随贫血，且在不同年龄人群中均有出现？,失眠
bridge_subgraph_09036.graphml,哪种疾病在女性患者中，既需要使用龙胆泻肝汤治疗，又可能伴随化疗和恶性肿瘤的出现？,失眠
bridge_subgraph_09030.graphml,哪种疾病更容易在具有轻中度ED和饮酒史的人群中出现，尤其是年龄较大且吸烟的人群？,DED
bridge_subgraph_09034.graphml,哪种疾病在使用稳心颗粒治疗的同时，心内科医生会特别关注心衰的健康宣教？,永久性心房颤动
bridge_subgraph_09038.graphml,哪种疾病与卷烟水溶性提取物和Opn抗体直接相关，且在酶联免疫吸附试验中常与慢性阻塞性肺疾病同时出现？,CSE
bridge_subgraph_09035.graphml,哪种疾病在表现为Marfan综合征的同时，还常伴有头痛和癫痫症状，并且可以使用熄风胶囊进行治疗？,MFS
bridge_subgraph_09040.graphml,哪种疾病既有红斑型病理分型，又常表现为失眠，且可能与天疱疮并发，需使用维甲酸治疗？,银屑病
bridge_subgraph_09046.graphml,哪种疾病在MRI影像学检查后，通常需要术后化疗，并且患者体质量指数和化疗效果密切相关？,肢体骨肉瘤
bridge_subgraph_09045.graphml,哪种疾病会导致记忆力减退或不集中，并伴随心理及药物因素的影响，同时可能出现心律失常和过敏性休克？,失眠
bridge_subgraph_09043.graphml,哪种疾病在辅助治疗中能有效减轻生理病理不适，且发病率高达73.5%，常伴有高血压和头痛的临床表现？,失眠
bridge_subgraph_09039.graphml,哪种疾病在急性失眠亚组中常见，且需要护理援助，并常与糖尿病相关、伴随银屑病的表现？,失眠
bridge_subgraph_09041.graphml,哪种疾病在出现副肿瘤肌炎综合征和肌肉活检异常的同时，还伴随发热，且与性别有关？,特发性炎性肌病
bridge_subgraph_09050.graphml,哪种疾病在基础护理辅助治疗期间，常表现为夜间惊恐发作和头痛，且需通过磁共振成像进行检查？,失眠
bridge_subgraph_09042.graphml,哪种疾病在治疗过程中常需联合使用米氮平和常规护理干预，并可能伴随中药辅助治疗，且高血脂是其高危因素？,失眠
bridge_subgraph_09049.graphml,哪种疾病会导致功能性消化不良，并且可能伴随脑卒中并发症和疼痛，同时可以通过运动处方辅助治疗？,失眠
bridge_subgraph_09051.graphml,哪种疾病在学习负担重时容易出现，且生地黄对其有辅助疗效，同时需要常规治疗并伴随疼痛症状？,失眠
bridge_subgraph_09047.graphml,哪种疾病在患者进行安全感问卷评估和解郁安神汤治疗的同时，常常伴随脑电图异常和癫痫发作？,失眠
bridge_subgraph_09053.graphml,哪种疾病在临床上表现为精神疲劳和敌对，并且通常需要通过护理干预和综合护理进行辅助治疗？,失眠
bridge_subgraph_09055.graphml,哪种疾病在需要进行外科手术治疗的同时，还会出现癫痫的临床表现，并通过脑脊液免疫学检查和磁共振影像学检查来辅助诊断？,脑型血吸虫病
bridge_subgraph_09048.graphml,哪种疾病在脑白质营养不良的病理分型中，通过MR功能成像和磁共振成像检查，常伴随运动障碍的临床表现？,肾上腺脑白质营养不良
bridge_subgraph_09057.graphml,哪种症状会在人际敏感和幻想的同时，伴随出现强迫和职业倦怠？,抑郁
bridge_subgraph_09058.graphml,哪种疾病在采用子午流注和综合护理干预治疗时，常伴随化疗相关性呕吐和腹痛？,失眠
bridge_subgraph_09037.graphml,哪种疾病在发生后凸畸形并发症时，通常需要接受植骨钉棒系统内固定术治疗，并且在进行健康宣教和体格检查后进行辅助治疗和检查？,胸椎结核
bridge_subgraph_09054.graphml,哪种疾病会导致血管舒缩指数异常、工作效率下降，并且需要心理护理和检测心肌酶水平？,失眠
bridge_subgraph_09056.graphml,哪种疾病更容易与成年人慢传输型便秘和慢性紧张型头痛同时出现，是2型糖尿病还是二甲双胍的使用？,失眠
bridge_subgraph_09052.graphml,哪种疾病在治疗过程中常联合使用逍遥散、黄芪注射液和二甲双胍，且其临床表现主要为慢性阻塞性肺疾病？,失眠
bridge_subgraph_09060.graphml,哪种疾病会导致血红蛋白和Ret异常，并常伴随苯巴比妥使用和贫血症状？,BICE
bridge_subgraph_09044.graphml,哪种疾病在采用高效液相色谱法检测时，常与PPARα相关，并且患者可能会同时出现艾塞那肽使用和失眠症状？,糖尿病
bridge_subgraph_09061.graphml,哪种疾病在治疗时常用生半夏和疏肝法，并且患者常伴有高血压和头晕的症状？,失眠
bridge_subgraph_09059.graphml,哪种疾病在治疗过程中需要综合考虑精神和环境因素，并结合使用中西药物、睡眠仪、耳穴贴压，同时常通过磁共振进行检查？,失眠
bridge_subgraph_09064.graphml,哪种疾病在高中学生中多发，且临床表现包括腹痛和成年人慢传输型便秘，还可能与化疗有关？,失眠
bridge_subgraph_09062.graphml,哪种疾病在老年人中多发，且需通过BacT-ALERT法和药物敏感检测来确诊，常与结核病同时出现？,MTB
bridge_subgraph_09063.graphml,哪种疾病在治疗过程中需要结合上肢运动操和等速肌力训练，并且通常会采用循证护理和常规护理相结合的方式？,乳腺癌术后淋巴水肿
bridge_subgraph_09069.graphml,哪种疾病会出现非旋转性头晕和水平眼震，并常伴随眩晕，需要联合治疗？,PC-BPPV
bridge_subgraph_09073.graphml,哪种疾病最适合采用中药穴位贴敷法结合中医特色护理，并在护理干预和健康教育中取得显著效果？,失眠
bridge_subgraph_09065.graphml,哪种疾病既有先兆流产的临床表现，又需要采用胃安神法治疗，且常与2型糖尿病相关并可能由吸烟引起？,失眠
bridge_subgraph_09071.graphml,哪种疾病在脱落细胞学检查后，需要通过舒适的护理和护理干预辅助治疗，并且治疗后可能会出现发热症状？,恶性胸腹水
bridge_subgraph_09070.graphml,哪种疾病在进行腹腔镜子宫肌瘤剔除术后，更容易出现失眠，并且需要通过常规护理和循证护理来改善？,子宫肌瘤
bridge_subgraph_09067.graphml,哪种疾病在开颅手术中会导致14.3%的患者出现术中急性脑膨出，且与n2相关？,迟发性颅内血肿
bridge_subgraph_09072.graphml,哪种疾病在老年人中多发，且常伴有口干症状，针灸治疗对其有辅助疗效？,失眠
bridge_subgraph_09080.graphml,哪种疾病在进行头面部穴位按摩治疗和护理时，容易出现易汗和眼科症状？,失眠
bridge_subgraph_09074.graphml,哪种疾病会出现HD和继发性症状，同时伴随乏力和皮疹？,何杰金氏病
bridge_subgraph_09068.graphml,哪种疾病会导致痰塔特姆氏菌感染和尿酸结石，且常伴有高血压，尤其好发于女性？,草酸钙结石
bridge_subgraph_09078.graphml,哪种疾病的发病率高达90.2%，通常使用小柴胡汤加减治疗，并且可能伴随银屑病和肝功能异常的临床表现？,失眠
bridge_subgraph_09077.graphml,哪种疾病会导致女性在患上呼吸道感染的同时，出现睡眠质量下降，且服用人参后症状未见明显改善？,失眠
bridge_subgraph_09079.graphml,哪种疾病在治疗时需要配合天王补心丹和较高的运动指数，且常与肿瘤和放松训练同时出现？,失眠
bridge_subgraph_09084.graphml,哪种症状最可能在高热和乳酸性酸中毒昏迷的同时，伴随呕吐和慢性心力衰竭出现？,乏力
bridge_subgraph_09083.graphml,哪种疾病会导致眩晕、呕吐，并伴有耳鸣，且可以通过口服谷维素进行治疗？,失眠
bridge_subgraph_09075.graphml,哪种疾病在辅助治疗中需要调整患者人格，并伴随每周体育活动少、腹泻等临床表现，同时还需要进行常规护理？,失眠
bridge_subgraph_09076.graphml,哪种疾病在出现乳房疼痛的同时，也可能伴随头痛，且在使用四逆散水煎液治疗后，心电图会有相应变化？,失眠
bridge_subgraph_09082.graphml,哪种疾病需要同时采用单克隆抗体靶向治疗和单倍型外周血造血干细胞移植，并且在治疗过程中需密切关注血常规变化和感染风险？,恶性血液肿瘤
bridge_subgraph_09085.graphml,哪种疾病在运动治疗和养阴和胃法辅助治疗下效果较好，且常因过食肥甘引起，伴随情绪不稳定的表现？,糖尿病
bridge_subgraph_09081.graphml,哪种疾病既可以通过压耳穴和滋阴降火辅助治疗，又常常因起居失常而引发，并伴随绝经综合征的临床表现？,失眠
bridge_subgraph_09087.graphml,哪种疾病在慢性耳鸣的风险评估因素中，同时可能伴随脑梗死并发症和慢性乙型肝炎的临床表现，并且可以通过针刺联合心理疗法进行辅助治疗？,失眠
bridge_subgraph_09091.graphml,哪种疾病在中医护理技术辅助治疗下，常表现为PD睡眠障碍和体重减轻，并适合采用联合治疗？,失眠
bridge_subgraph_09066.graphml,哪种疾病在女性中常见，需要通过单纯导管扩张型治疗和病变导管切除，并且护理干预对其康复尤为重要？,浆细胞性乳腺炎
bridge_subgraph_09089.graphml,哪种疾病在治疗时既会用到针刺主穴四关穴，又可能涉及心脏介入术，并且常与支气管哮喘和安慰剂的使用相关？,失眠
bridge_subgraph_09088.graphml,哪种疾病会导致记忆力减退或不集中、恐惧心理，并且需要循证护理和综合护理干预？,失眠
bridge_subgraph_09086.graphml,哪种疾病在更年期综合征的临床表现中常见，并且子午流注针法可辅助治疗，同时可能与糖尿病相关并需要使用安慰剂进行药物治疗？,失眠
bridge_subgraph_09097.graphml,哪种疾病因服用含甘汞中药引发，需用盐酸丁咯地尔高治疗，且常伴有帕金森病和精神症状？,周围神经损害
bridge_subgraph_09095.graphml,哪种疾病会导致氟斑牙和心包炎，并且常与糖尿病和右美托咪定的使用相关？,ERS
bridge_subgraph_09090.graphml,哪种疾病在具有抑郁倾向的患者中，通过中药新药治疗并辅以针刺疗法和单盲法进行辅助治疗，效果较为显著？,失眠
bridge_subgraph_09093.graphml,哪种疾病会导致女性出现尿急和排尿困难，且常用匹多莫德进行治疗？,NGU
bridge_subgraph_09092.graphml,哪种疾病在尿毒症并发症中较为常见，且心理素质差的学生更易受其影响，同时可能与肿瘤和眼科问题同时出现？,失眠
bridge_subgraph_09098.graphml,哪种疾病在出现系统性红斑狼疮和气促的同时，还伴随腹胀和乏力？,大量心包积液
bridge_subgraph_09094.graphml,哪种疾病会导致黑夜时间减少，并可能引发重度OSAHS，同时伴随高血压和肥胖的临床表现？,失眠
bridge_subgraph_09099.graphml,哪种疾病更容易导致急性尿潴留和混合性坏疽，且与患者的年龄和婚姻状况密切相关？,失眠
bridge_subgraph_09102.graphml,哪种疾病在中医科护理干预下，通过QLQ-C30量表评估，常伴随呕吐和便秘症状？,失眠
bridge_subgraph_09096.graphml,哪种疾病在治疗过程中常需采用正压通气联合认知疗法，且容易出现湿郁现象，同时患者可能伴有原发性肝癌并需接受化疗？,失眠
bridge_subgraph_09100.graphml,哪种社会学理论能更好地解释烧伤感染与脓毒症之间的关联，并综合考虑优质护理在预防中的作用以及环境因素在病因中的影响？,感染
bridge_subgraph_09107.graphml,哪种疾病会导致感觉神经肽P物质和脱氧核苷酸钠水平异常，并且常与感染和糖尿病同时出现？,创面愈合
bridge_subgraph_09104.graphml,哪种疾病在治疗过程中常联合使用帕罗西汀片和头针，并且也可能同时使用二甲双胍和逍遥散？,失眠
bridge_subgraph_09103.graphml,哪种疾病在辅助治疗时常用高电位治疗仪，药物治疗中会使用不深安神汤，并且患者常伴有发热和腹痛的症状？,失眠
bridge_subgraph_09101.graphml,哪种疾病在精神及躯体疾病的高危因素下，需要特别重视心理护理作为辅助治疗，并且其临床表现包括n2，发病率高达20.00%？,失眠
bridge_subgraph_09106.graphml,哪种疾病会导致多梦易醒、睡眠不深，并可能伴随骨折和SAS症状？,失眠
bridge_subgraph_09108.graphml,哪种疾病需要通过夜间阴茎勃起监测和服用疏肝益阳胶囊来诊断，并且治疗过程中可能涉及磁共振检查和安慰剂的使用？,心理性勃起功能障碍
bridge_subgraph_09110.graphml,哪种疾病在治疗过程中需要结合艾灸神阙，并且特别强调心理护理干预和心理干预来提高患者的不确定性忍受力？,失眠
bridge_subgraph_09109.graphml,哪种疾病在治疗过程中需要同时采用氧喷治疗、祛痰、止咳、镇静的方法，并且通常结合西药和综合护理干预？,小儿喘息性疾病
bridge_subgraph_09105.graphml,哪种疾病在进行非药物护理干预和针刺加耳穴辅助治疗的同时，常需要通过磁共振进行影像学检查，并且年龄是高危因素？,失眠
bridge_subgraph_09115.graphml,哪种疾病在同时进行咪达唑仑治疗和冠搭手术的情况下，最需要护理干预以预防心血管疾病的发生？,冠状动脉搭桥
bridge_subgraph_09114.graphml,哪种疾病在血常规检查异常且白天精神差的情况下，常需要通过针药结合和针灸治疗来辅助治疗？,失眠
bridge_subgraph_09118.graphml,哪种社会学研究方法最适合评估睡眠护理干预对失眠患者，尤其是同时患有尿毒症和糖尿病的人群的影响？,恶性肿瘤
bridge_subgraph_09116.graphml,哪种疾病在临床表现上既有MMT又有银屑病，且其病因与淤有关，治疗时常使用右美托咪定？,失眠
bridge_subgraph_09119.graphml,哪种疾病会出现心率变异的临床表现，需要使用消化系统用药治疗，并且常伴随癫痫病因，同时需要综合护理作为辅助治疗？,新生儿疾病
bridge_subgraph_09112.graphml,哪种疾病在早期护理干预中，结合使用安神补脑液和低阻抗意念导入疗法，能有效改善匹兹堡睡眠质量指数？,失眠
bridge_subgraph_09113.graphml,哪种疾病会导致脏腑气血亏虚，并需要结合基础护理和心理护理，同时患者还可能表现出匹兹堡睡眠质量指数表上的问题？,失眠
bridge_subgraph_09111.graphml,哪种疾病在治疗时通常会联合使用百会针灸和肉蔻五味丸配合曲唑酮，并且常与糖尿病同时出现？,失眠
bridge_subgraph_09127.graphml,哪种疾病在人文因素影响下容易发生，且在自我调节治疗的同时，常伴随化疗和肺癌的临床表现？,失眠
bridge_subgraph_09120.graphml,哪种疾病在临床表现上类似气滞血瘀，需要与高血压进行鉴别诊断，且在治疗中常使用中医中药和呋塞米？,糖尿病
bridge_subgraph_09123.graphml,哪种疾病在特定年龄和性别群体中常表现为无力，且与OPIDN有关？,迟发性神经病
bridge_subgraph_09135.graphml,哪种疾病会导致机体免疫功能下降，并伴随食欲不振和便秘的临床表现？,失眠
bridge_subgraph_09126.graphml,哪种疾病在临床表现上常出现早泄，且其辅助治疗包括认知行为干预和综合护理，同时病因可能与外感六淫有关？,失眠
bridge_subgraph_09129.graphml,哪种疾病既与高血压和神经并发症直接相关，又常与NCAC和体重问题同时出现？,糖尿病
bridge_subgraph_09124.graphml,哪种疾病在治疗过程中最适合结合针刺捻转补法、泻其有余和补其不足，同时配合优质护理和整体护理？,失眠
bridge_subgraph_09125.graphml,哪种疾病在病理分型上与胆石症和卵巢早衰有关，且在药物治疗上常采用逍遥散或逍遥散加减治疗？,肝气郁结型
bridge_subgraph_09130.graphml,哪种疾病在膝关节发病时，需要科学选择体位辅助治疗，并常伴随使用丹参注射液和骨折并发症？,下肢深静脉栓塞
bridge_subgraph_09132.graphml,哪种疾病在胃癌化疗和PCI治疗过程中，常伴随头颅MRI检查异常和癫痫发作？,失眠
bridge_subgraph_09122.graphml,哪种疾病既会因经济压力引发，又表现为ET，且在治疗过程中常需配合心理护理和心理干预？,失眠
bridge_subgraph_09131.graphml,哪种疾病需要采用内镜联合腹腔镜肝切除术或腹腔镜与胆道镜联合治疗，并辅以心理护理和中药治疗？,肝内外胆管结石
bridge_subgraph_09121.graphml,哪种疾病在IVF-ET治疗过程中与妊娠期高血压疾病同时出现时，更需要进行护理干预而非仅依赖常规护理？,试管婴儿技术
bridge_subgraph_09128.graphml,哪种疾病会导致情绪低落和忧虑，且适合用柴胡疏肝散治疗，常与肝郁相关？,肝气郁结证
bridge_subgraph_09137.graphml,哪种疾病在患者同时出现冠心病和心力衰竭的情况下，与CS2和苯海索的使用有直接关联？,失眠
bridge_subgraph_09136.graphml,哪种疾病主要发病于血液系统，实验室检查可见TXB₂升高，且需与上呼吸道感染鉴别，通常采用综合治疗作为辅助手段？,MP肺炎
bridge_subgraph_09133.graphml,哪种疾病在男性患者中同时伴有糖尿病，且冠状动脉造影异常，多表现为冠心病多支病变？,单支病变
bridge_subgraph_09144.graphml,哪种疾病在放松训练和火郁的情况下，常与原发性肝癌和腹痛同时出现？,失眠
bridge_subgraph_09142.graphml,哪种疾病在男性患者中更常见，且常伴随发热，需要与暴力性伤害和普通外伤进行鉴别诊断和病理分型？,坠落伤
bridge_subgraph_09139.graphml,哪种疾病在采用耳穴按压联合康复治疗和中医护理作为辅助治疗时，常伴有高血压和关节痛的临床表现？,失眠
bridge_subgraph_09140.graphml,哪种疾病既与冠心病和疏肝理气直接相关，又常伴随失眠和需要辅酶Q10的补充？,糖尿病
bridge_subgraph_09148.graphml,哪种疾病在采用耳穴压丸治疗的同时，常伴随鼻出血和胸闷症状，且需要常规护理？,失眠
bridge_subgraph_09138.graphml,哪种疾病在治疗过程中需要同时进行心脏彩超检查、服用阿司匹林，并可能涉及冠状动脉介入治疗和参麦注射液的使用？,急性非ST段抬高型心肌梗死
bridge_subgraph_09141.graphml,哪种疾病既会导致口腔异味，又与糖尿病并发，且通过护理干预能有效辅助治疗，其发病率约为0.5.1%？,口腔并发症
bridge_subgraph_09143.graphml,哪种疾病在就业压力和过食肥甘的影响下容易出现，并且需要综合护理干预和基础护理来辅助治疗？,失眠
bridge_subgraph_09151.graphml,哪种疾病在采用温泉水联合运动疗法治疗时，常与焦虑障碍同时出现，并且与肿瘤和当归的使用有关？,失眠
bridge_subgraph_09145.graphml,哪种疾病会导致夜间惊恐发作和MHT，并且常伴随常规护理和ACS的出现？,失眠
bridge_subgraph_09147.graphml,哪种疾病在进行核素扫描和阿替普酶联合低分子肝素治疗的同时，常伴随心电图异常和高血压症状？,急性PTE
bridge_subgraph_09157.graphml,哪种疾病在CT影像学检查和活检组织学检查中表现明显，且常伴随血脂异常和体格检查异常？,KMS
bridge_subgraph_09154.graphml,哪种疾病在心理和针灸综合治疗（包括电针）辅助下，能有效缓解卫气不得入于阴的症状？,失眠
bridge_subgraph_09156.graphml,哪种疾病在围绝经期常表现为逍遥丸治疗有效，且可能伴随卒中和心肌梗死的风险？,失眠
bridge_subgraph_09152.graphml,哪种疾病在亚低温治疗过程中容易出现呕吐和癫痫发作，且与ICA有关？,颅内积气
bridge_subgraph_09159.graphml,哪种疾病在高接触组工人中常见，临床表现为便秘，需用桂枝汤加味治疗，并辅以心理护理？,失眠
