file,query,answer
bridge_subgraph_22425.graphml,哪种疾病需要使用SHIH（异丙酚）进行药物治疗，且常伴随外科治疗或微创手术？,重症高血压脑出血
bridge_subgraph_22429.graphml,哪种疾病具有35.17/10万的发病率，通常使用环丙沙星治疗，并辅以常规护理，预后状况较好？,猩红热
bridge_subgraph_22435.graphml,哪种疾病在进行健康教育干预和针灸辅助治疗时，常表现为血浆脂联素水平异常和肿胀？,精尿病
bridge_subgraph_22439.graphml,哪种疾病在早期恰当的功能锻炼和全方位护理模式下，同时需要配合舒适护理和影像学检查？,胫骨平台骨折
bridge_subgraph_22426.graphml,哪种疾病在伤口一期愈合时常用桃红四物汤治疗，且常需通过MRI和CT进行检查？,胫骨平台骨折
bridge_subgraph_22419.graphml,哪种疾病在治疗过程中会同时使用甲氨蝶岭（MTX）和中药，并且可能需要进行腹腔镜输卵管切开取胚术，且与B组相关？,未破裂型输卵管妊娠
bridge_subgraph_22445.graphml,哪种疾病在采用传统内固定手术治疗且术后康复快的情况下，更适合配合舒适护理而非常规护理？,胫骨平台骨折
bridge_subgraph_22431.graphml,哪种疾病在X线片检查后常需手术治疗，且术后需进行功能锻炼以辅助恢复？,胫骨平台骨折
bridge_subgraph_22442.graphml,哪种疾病在初发年龄时伴随胃肠动力异常，且常与焦虑症状同时出现，需通过卡方检验进行分析？,FC
bridge_subgraph_22443.graphml,哪种社会学方法更适合研究χ2检验和戴明环在深静脉血栓治疗中的常规护理效果？,感染
bridge_subgraph_22446.graphml,哪种疾病在治疗过程中需要同时使用局麻药和地塞米松，并结合多模式镇痛和护理干预？,术后镇痛
bridge_subgraph_22441.graphml,哪种疾病在男性患者中较为常见，且在治疗时需要个性化康复运动处方配合药物治疗，同时辅以常规护理组进行综合管理，其常见病因为扭伤？,胫骨平台骨折
bridge_subgraph_22448.graphml,哪种疾病在氧化应激和状旁腺切除术后需要特别护理，并且适合采用中西医结合治疗？,肾性贫血
bridge_subgraph_22440.graphml,哪种疾病在进行微创经皮钢板固定手术后，需要特别重视术后康复锻炼，且患者常伴有抑郁症状和骨质疏松风险？,胫骨平台骨折
bridge_subgraph_22447.graphml,哪种疾病在严重骨质疏松的情况下，需要中药治疗结合手术治疗，并且通常需要进行CT检查？,胫骨平台骨折
bridge_subgraph_22451.graphml,哪种疾病在治疗过程中需要同时进行冠状动脉造影和服用美托洛尔片，并辅以针灸和护理干预？,心血管神经症
bridge_subgraph_22449.graphml,哪种疾病在进行骨折内固定治疗后，需要通过CT扫描检查，并且伴随常规护理和脱水剂的使用？,胫骨平台骨折
bridge_subgraph_22450.graphml,哪种疾病在进行钢板内固定手术后，新发骨折和胫骨骨折时，需要使用万古霉素治疗？,胫骨平台骨折
bridge_subgraph_22453.graphml,哪种疾病在进行微创手术椎体成形术或皮椎体成形术时，特别需要重视围手术期护理和心理护理？,老年骨质疏松性椎体骨折
bridge_subgraph_22454.graphml,哪种医学内容能同时解释高血压和坦度螺酮的使用，并考虑年龄和焦虑因素的影响？,焦虑障碍
bridge_subgraph_22452.graphml,哪种疾病在治疗过程中需要同时使用TNF-α抑制剂和抗生素，并且还需配合护理干预，例如布鲁菌病？,肝脏损害
bridge_subgraph_22444.graphml,哪种疾病在手术治疗时需要使用锁定加压钢板，并且可以通过CT诊断和CT检查来辅助确诊？,胫骨平台骨折
bridge_subgraph_22458.graphml,哪种疾病在常规X线检查后常需手术复位，并伴随常规护理和康复护理？,胫骨平台骨折
bridge_subgraph_22456.graphml,哪种疾病在胫骨平台后内侧柱发病时，除了需要常规护理和护理干预外，还特别需要系统心理护理辅助治疗？,胫骨平台骨折
bridge_subgraph_22455.graphml,哪种疾病在T淋巴细胞增殖和加欣维宁治疗过程中，需要特别考虑护理干预和患者年龄的影响？,UAP
bridge_subgraph_22457.graphml,哪种疾病在Ⅴ型骨折和横斜破裂型成形术的治疗过程中，通常需要通过X线检查和放射学检查来确诊？,胫骨平台骨折
bridge_subgraph_22462.graphml,哪种疾病在治疗过程中需要同时使用门冬胰岛素30、进行营养干预，并结合运动疗法，且特别关注患者年龄因素？,2型糖尿
bridge_subgraph_22459.graphml,哪种疾病在进行MRI扫描时常发现骨折延迟愈合，且多发于特定年龄人群，需要配合心理护理辅助治疗？,胫骨平台骨折
bridge_subgraph_22463.graphml,哪种疾病在治疗过程中需要同时进行正、侧位X线片检查和锁定加压钢板固定手术，并且术后需配合常规护理和早期护理干预？,胫骨平台骨折
bridge_subgraph_22464.graphml,哪种疾病会导致低级别鳞状上皮细胞病变并可能引发不育症，且在CT和MRI检查中均有表现？,慢性炎症
bridge_subgraph_22460.graphml,哪种疾病在进行颅颌面整形手术时，需要结合计算机手术仿真技术，并辅以心理护理和CT检查？,颅颌面畸形
bridge_subgraph_22468.graphml,哪种疾病在治疗时既需要采用传统开放手术或膝关节镜辅助切开，又常常需要借助CT进行术前诊断和手术规划？,胫骨平台骨折
bridge_subgraph_22467.graphml,哪种疾病在治疗过程中常需结合定位导航固定治疗和钢板固定治疗，并辅以常规护理模式和整体护理？,胫骨平台骨折
bridge_subgraph_22461.graphml,哪种疾病在治疗过程中需要同时进行开放复位AO支持钢板内固定和术后负压引流，并且通常需要通过CT检查和MRI来辅助诊断？,胫骨平台骨折
bridge_subgraph_22469.graphml,哪种疾病在需要进行X线子宫输卵管造影和宫内置环术的同时，还可能需要进行MRI检查和成形术？,子宫畸形
bridge_subgraph_22466.graphml,哪种疾病在采用内固定方式治疗后容易引发废用性骨质疏松，且在进行磁共振成像和多层螺旋CT检查时常见？,胫骨平台骨折
bridge_subgraph_22465.graphml,哪种疾病在诊断时需要依赖X线影像学检查，并且治疗时可能采用三柱分型手术或微创手术，同时常伴随使用抗生素药物治疗？,胫骨平台骨折
bridge_subgraph_22473.graphml,哪种疾病会导致患者出现胡言乱语的症状，通常需要卧床休息和综合护理，并且常由感染引起？,甲亢危象
bridge_subgraph_22478.graphml,哪种疾病在腹部CT和螺旋CT检查中常表现为肠壁增厚？,肠系膜损伤
bridge_subgraph_22481.graphml,哪种疾病在采用多元化康复护理锻炼模式的同时，需要结合64排螺旋CT三维重组影像和X线进行三维重建辅助诊断？,胫骨平台骨折
bridge_subgraph_22470.graphml,哪种疾病在眼内手术史的患者中，容易出现渗出性视网膜脱离，并且需要进行术前准备和联合手术来治疗？,眼压
bridge_subgraph_22375.graphml,哪种疾病在治疗过程中会使用前列腺素E10μg和舒血宁注射液，且常伴随血清CRP水平升高，同时需要通过磁共振成像和螺旋CT进行检查？,缺血性脑梗死
bridge_subgraph_22482.graphml,哪种疾病在使用纯钛种植体辅助治疗和纯钛支架组病理分型的情况下，手术治疗效果理想？,牙列缺损
bridge_subgraph_22475.graphml,哪种疾病在采用无创机械通气治疗的同时，常与哮喘和B组肺炎一同出现？,喘憋
bridge_subgraph_22472.graphml,哪种疾病在后外侧骨折块的临床表现中，需要通过CT检查和MRI进行影像学诊断，并常需外科治疗？,胫骨平台骨折
bridge_subgraph_22485.graphml,哪种疾病在出现miRNA异常和多焦视网膜电图改变的同时，常常需要激光治疗，并且与年龄有显著相关性？,AMD
bridge_subgraph_22483.graphml,哪种疾病在治疗过程中需要坚强内固定或骨外固定支架，并且常常需要进行MRI检查？,胫骨平台骨折
bridge_subgraph_22476.graphml,哪种疾病在进行膝关节镜下手术治疗时，常需结合螺旋CT三维重建影像检查，且患者多有骨质疏松，术后护理尤为重要？,胫骨平台骨折
bridge_subgraph_22474.graphml,哪种疾病需要采用内侧倒“L”形切口手术治疗，并且在诊断过程中通常会结合三维CT扫描、螺旋CT检查和MRI等影像学检查？,胫骨平台骨折
bridge_subgraph_22479.graphml,哪种疾病在治疗过程中常需采用手术切开复位和手术复位支持钢板内固定，且在治疗中常结合回顾性分析法和心理护理？,胫骨平台骨折
bridge_subgraph_22477.graphml,哪种疾病在治疗过程中需要采用整块切除或整块剜除术，并辅以心理护理和并发症护理？,非肌层浸润性膀胱肿瘤
bridge_subgraph_22480.graphml,哪种疾病在进行三维重建影像学检查时常需辅助以被动伸膝治疗，且易与骨关节炎并发，多由高处坠落伤导致？,胫骨平台骨折
bridge_subgraph_22484.graphml,哪种疾病会导致上、下楼梯困难，并需要使用消肿止痛方，同时在进行64排螺旋CT或MSCT检查时常见？,胫骨平台骨折
bridge_subgraph_22471.graphml,哪种疾病既可能导致肾综合征出血热和心血管疾患等并发症，又常与车祸有关且表现为感染症状？,多脏器功能衰竭
bridge_subgraph_22492.graphml,哪种疾病在未转移组和淋巴结转移情况下，都需要进行外科手术或手术治疗？,PTMC
bridge_subgraph_22488.graphml,哪种医学内容更容易在术后神经功能障碍和乳管镜检查中与肺栓塞和年龄因素同时出现？,PND
bridge_subgraph_22489.graphml,哪种疾病既会引起发热和癫痫大发作，又常与特定年龄人群相关，且可能需要用中药治疗？,脊髓灰质炎
bridge_subgraph_22486.graphml,哪种社会学理论能够解释扁平苔藓和胫骨平台骨折的病因及其并发症，同时考虑抗生素使用和肺炎风险的相关性？,感染
bridge_subgraph_22496.graphml,哪种疾病可以通过服用补肾疏肝汤和菟丝子，并结合中药治疗和针灸来辅助治疗？,排卵障碍性不孕症
bridge_subgraph_22490.graphml,哪种疾病在分化程度增高时容易并发白癜风和感染，且预后状况较好？,恶性黑素瘤
bridge_subgraph_22487.graphml,哪种疾病在临床上表现为椭圆形肿块，通常需要通过MRI和CT进行检查，并可能采用伽马刀进行手术治疗？,视神经胶质瘤
bridge_subgraph_22494.graphml,哪种疾病在治疗过程中通常需要结合微创内固定、引导小切口内固定术，以及护理和传统治疗等多种方法？,胫骨平台骨折
bridge_subgraph_22493.graphml,哪种疾病在电击和阿托品注射液治疗的同时，还需要特别护理并可能引发患者焦虑？,MECT
bridge_subgraph_22499.graphml,哪种疾病在吸烟者中血清MMP-7水平较高，且常与男性及螺旋CT检查结果相关？,IPF
bridge_subgraph_22491.graphml,哪种疾病在男性患者中较常见，术后需要加强护理，且临床表现包括骨折移位，同时优质护理对其康复至关重要？,胫骨平台骨折
bridge_subgraph_22497.graphml,哪种疾病在p53阳性表达的临床表现下，需要通过根治性手术治疗，并且通常会在CT检查和MRI中同时发现？,早期直肠癌
bridge_subgraph_22503.graphml,哪种疾病在治疗过程中需要同时使用机械通气辅助治疗、醋酸卡泊芬净和抗生素药物治疗，并配合综合护理干预？,重症肺部感染
bridge_subgraph_22495.graphml,哪种疾病在男性患者中较为常见，且多见于特定年龄段，通常需要通过X线片诊断并采用锁定加压接骨板治疗？,胫骨平台骨折
bridge_subgraph_22500.graphml,哪种疾病在男性患者中常见，且常伴随肺炎，需要内外侧或双侧AO钢板固定，特别是SchatzkerⅤ、Ⅵ型的情况？,胫骨平台骨折
bridge_subgraph_22510.graphml,哪种疾病在CT图像上表现为气道内肿瘤且糖代谢异常活跃，通常需要手术治疗？,转移性肿瘤
bridge_subgraph_22502.graphml,哪种医学内容在米索前列醇联合利多卡因使用、卫生宣教的同时，结合护理干预和心理干预更为有效？,人流术
bridge_subgraph_22498.graphml,哪种疾病既与汉坦病毒相关，又常伴随高血糖，且在年龄较大的人群中更易发生，需要特别重视常规护理？,HFRS
bridge_subgraph_22506.graphml,哪种疾病在进行气管插管术后，容易出现外感热病邪袭肺卫证，并常伴有肺炎和感染的情况？,咽痛
bridge_subgraph_22515.graphml,哪种疾病在出现分流管阻塞和术后GOS评分下降的同时，常伴随针灸治疗和CT检查？,交通性脑积水
bridge_subgraph_22512.graphml,哪种疾病在修正创伤评分较高、查尔森合并症指数较低的情况下，更容易在男性患者中并发感染？,SOFA
bridge_subgraph_22509.graphml,哪种疾病在发生低血糖并发症时，需要同时进行抗凝治疗，且常伴随肺炎的发生，并推荐采用综合护理干预？,老年性糖尿病
bridge_subgraph_22513.graphml,哪种疾病在进行单纯运动疗法和中医多元化护理康复锻炼的同时，还常常伴随抑郁症状，并且需要结合常规护理来进行治疗？,胫骨平台骨折
bridge_subgraph_22508.graphml,哪种疾病在进行64排螺旋CT和MRI检查时，常伴随X线检查，且容易出现深静脉血栓并发症？,胫骨平台骨折
bridge_subgraph_22519.graphml,哪种疾病在治疗过程中需要特别注重饮食护理和手术坚强内固定，并且常常伴随心理护理和中药治疗？,胫骨平台骨折
bridge_subgraph_22516.graphml,哪种疾病在PO2明显升高和胆囊开腹切除的情况下，常伴随CT检查和中药治疗？,重型急性胰腺炎
bridge_subgraph_22505.graphml,哪种疾病在中度中暑的病理分型下，男性患者更易发生，且在常规护理的同时常需使用氯丙嗪进行治疗？,中暑
bridge_subgraph_22504.graphml,哪种疾病在男性中更常见，且表现为腹泻，通过克隆分析可以确诊，并常与感染相关？,混合感染
bridge_subgraph_22501.graphml,哪种疾病在巨大儿中属于高危因素，且常伴随噬血细胞综合征，需要通过MRI影像学检查来诊断，并依赖护理干预作为辅助治疗？,低血糖症
bridge_subgraph_22507.graphml,哪种疾病在治疗过程中需要结合软组织损伤修复和康复护理，并常伴随手术复位和多层螺旋CT检查？,胫骨平台骨折
bridge_subgraph_22521.graphml,哪种疾病在SchazkerⅠ～Ⅳ型和B2型情况下，需要特别重视护理和功能锻炼？,胫骨平台骨折
bridge_subgraph_22522.graphml,哪种疾病在进行钢板固定手术治疗的同时，还需要积极处理复合损伤，并结合综合护理干预和舒适护理进行辅助治疗？,胫骨平台骨折
bridge_subgraph_22520.graphml,哪种疾病在治疗过程中需要胸腔内注射金葡液，并通过CEA和CA19-9指标进行监测，同时还会结合CT影像学检查和心理护理？,恶性胸水
bridge_subgraph_22525.graphml,哪种疾病在治疗过程中既可能出现韧带损伤又可能并发肺炎，且需要同时使用中药和抗生素进行治疗？,胫骨平台骨折
bridge_subgraph_22518.graphml,哪种疾病在创伤性骨髓炎和关节纤维化的情况下，同时需要进行手术内固定并配合中药治疗？,胫骨平台骨折
bridge_subgraph_22517.graphml,哪种疾病在进行腘动脉损伤静脉移植修复术后，需要配合细致周密的护理和护理干预，甚至采用针灸作为辅助治疗？,胫骨平台骨折
bridge_subgraph_22526.graphml,哪种疾病在患者使用PPDs和外源性白蛋白治疗后，更容易在特定年龄段出现术后并发症？,低白蛋白血症
bridge_subgraph_22528.graphml,哪种疾病在治疗过程中常需直接或间接复位和容积成像检查，且常伴随激光治疗，并更倾向于男性患者？,胫骨平台骨折
bridge_subgraph_22514.graphml,哪种疾病在诊断过程中会同时采用电子自旋共振（ESR）法和联苯-联苯醚检测，并且治疗时通常采用保守治疗和CT检查？,肾脏损伤
bridge_subgraph_22511.graphml,哪种疾病在CT影像学检查中发现，且常需截肢治疗，其口腔颌面部性外周神经鞘肿瘤的预后较差？,MPNST
bridge_subgraph_22533.graphml,哪种疾病在腹腔镜胃癌手术后比传统手术后更容易出现胰瘘这一术后并发症？,腹腔内出血
bridge_subgraph_22524.graphml,哪种疾病需要枕颌带或颅骨牵引辅助治疗，同时可能进行颈前路C2-3椎体螺钉内固定术，并且常表现为Ⅱ型闭合性骨折？,ⅡA型
bridge_subgraph_22529.graphml,哪种疾病在进行传统骨折切开复位固定术后，容易导致创伤性关节炎，并且需要配合心理护理和一般护理作为辅助治疗？,胫骨平台骨折
bridge_subgraph_22523.graphml,哪种疾病在治疗过程中常采用局部紫药膏外敷疗法和曲安奈德药物治疗，并可能需要结合关节镜下治疗和关节镜检查？,桡骨茎突狭窄性腱鞘炎
bridge_subgraph_22537.graphml,哪种疾病在经过CT扫描检查后，通过吻合血管的髂骨瓣植骨手术治疗，预后较好？,胫骨平台骨折
bridge_subgraph_22527.graphml,哪种检查在诊断短暂性脑缺血发作和痴呆时，与MRI影像学检查和护理干预相结合效果最佳？,CT
bridge_subgraph_22532.graphml,哪种疾病在治疗时需要同时使用锁定加压钢板和针刺，并且还需要进行心理护理来辅助康复？,胫骨平台骨折
bridge_subgraph_22543.graphml,哪种疾病会导致尿酮体升高、炎性反应激活，并伴随疼痛和需要围手术期护理？,Stanford B型
bridge_subgraph_22540.graphml,哪种疾病在治疗过程中需要手术固定和饮食护理，并且通常需要通过MRI和X线进行影像学检查？,胫骨平台骨折
bridge_subgraph_22536.graphml,哪种疾病在急性心肌梗死和彩色多普勒显像中常见，且常需外科手术和MRI辅助治疗？,多发性大动脉炎
bridge_subgraph_22542.graphml,哪种疾病在进行CTA血管分析和检测基质金属蛋白酶时，常伴随磁共振成像异常且多发于特定年龄段？,冠状动脉斑块
bridge_subgraph_22530.graphml,哪种疾病在采用氯胺酮和CSEA法治疗的同时，辅以综合护理干预和针灸能取得显著疗效？,分娩镇痛
bridge_subgraph_22531.graphml,哪种疾病在治疗过程中需要整体护理和采用外固定支架结合空心螺钉治疗，并且患者常常需要使用焦虑自评量表进行评估和接受心理护理？,胫骨平台骨折
bridge_subgraph_22534.graphml,哪种疾病在手术复位后植骨修复骨缺损时，常配合使用几丁糖，并可能同时进行针灸或针灸治疗？,胫骨平台骨折
bridge_subgraph_22541.graphml,哪种疾病在采用AO分型和解剖型支持锁定钢板治疗时，通常需要结合手术治疗和植骨术？,胫骨平台骨折
bridge_subgraph_22539.graphml,哪种疾病在螺旋CT三维成像技术检查中常见，且常伴有膝关节韧带损伤，同时在进行CT检查和X射线片时也容易被发现？,胫骨平台骨折
bridge_subgraph_22548.graphml,哪种疾病在采用锁定钢板内固定术和支持钢板内固定治疗辅助手术后，预后状况较差？,胫骨平台骨折
bridge_subgraph_22545.graphml,哪种疾病在二维成像中常表现为血管炎，且在进行CT检查尤其是MSCT扫描时更容易被发现？,急性肠缺血
bridge_subgraph_22546.graphml,哪种疾病在进行功能性恢复锻炼和综合护理的同时，还需要进行螺旋CT薄层扫描和螺旋CT扫描作为影像学检查？,胫骨平台骨折
bridge_subgraph_22535.graphml,哪种疾病与E-cadherin基因突变直接相关，且在治疗过程中可能需要使用美罗培南等抗生素，同时易引发感染并发症？,儿童急性白血病
bridge_subgraph_22538.graphml,哪种疾病在男性中发病率高于女性，且常需通过CT扫描进行影像学检查，并可采用奥司他韦雾化吸入作为辅助治疗？,人感染H7N9禽流感
bridge_subgraph_22553.graphml,哪种疾病在骨折切开复位钢板内固定手术后，常伴随感染和肺炎并发症，且可能需要深低温冷冻辅助治疗？,胫骨平台骨折
bridge_subgraph_22544.graphml,哪种疾病在治疗过程中使用索拉非尼，且常伴有中枢神经系统受累，同时在X线片和CT检查中有所表现？,骨髓瘤
bridge_subgraph_22547.graphml,哪种疾病在跌倒扭伤后，需要通过双侧、前外侧与前正中入路手术进行治疗，并且通常伴随MRI影像学检查和CPM治疗？,胫骨平台骨折
bridge_subgraph_22550.graphml,哪种疾病在治疗过程中需要贝那普利联合胺碘酮，并需做好心理护理，同时在常规护理中需特别关注患者年龄？,阵发性心房颤动
bridge_subgraph_22549.graphml,哪种疾病会导致肾功能衰竭，并且与环加氧酶有关，同时在MRI检查中常见且可能需要使用塞来昔布治疗？,梗阻性肾病
bridge_subgraph_22551.graphml,哪种疾病在高体重指数的人群中常见，且需要全方位护理模式，并常常与抗生素使用和年龄因素相关？,胫骨平台骨折
bridge_subgraph_22554.graphml,哪种疾病在进行膝关节稳定试验时，通常需要通过磁共振成像和CT平扫辅助诊断，并可能采用经皮植骨进行治疗？,胫骨平台骨折
bridge_subgraph_22552.graphml,哪种疾病在头孢曲松治疗下容易出现病原体混合感染，且常与抗生素使用和肺炎同时出现？,沙眼衣原体
bridge_subgraph_22563.graphml,哪种疾病因暴力导致踝关节受损，且在护理干预和特定年龄段人群中更为常见？,胫骨平台骨折
bridge_subgraph_22556.graphml,哪种疾病在采用双反牵引技术进行治疗时，需要特别注重术前术后护理，并且通过良好MRI检查结果来判断治疗效果？,胫骨平台骨折
bridge_subgraph_22559.graphml,哪种疾病在进行手术入路和可靠的内固定时，常需借助多层螺旋CT和MRI进行检查？,胫骨平台骨折
bridge_subgraph_22555.graphml,哪种疾病在采用免疫组织化学法检查和肝动脉化疗后，即使进行手术治疗，预后仍然不佳？,肝细胞性肝癌
bridge_subgraph_22558.graphml,哪种疾病在高能量暴力作用下，会导致肿胀和焦虑，并且需要通过定位导航固定治疗来辅助治疗？,胫骨平台骨折
bridge_subgraph_22562.graphml,哪种疾病在治疗过程中常需结合数字X射线摄影和关节镜监护，并辅以中药和心理护理？,胫骨平台骨折
bridge_subgraph_22566.graphml,哪种疾病在交界性病理分型下，通过CT灌注检查、CT平扫和MRI同时进行影像学检查时容易被诊断？,乳腺病变
bridge_subgraph_22568.graphml,哪种疾病在感染解腺支原体时，需要使用喹诺酮类抗生素，并且常通过CT检查来辅助诊断？,Uu
bridge_subgraph_22561.graphml,哪种疾病需要中药治疗，并可能通过MRI检查发现，同时需采用锁定钢板内固定并植骨，还涉及到髂骨的问题？,胫骨平台骨折
bridge_subgraph_22560.graphml,哪种疾病在经皮内固定手术治疗的同时，常伴随焦虑表现，并需要使用抗生素和护理干预辅助治疗？,胫骨平台骨折
bridge_subgraph_22571.graphml,哪种疾病在进行植骨和有效固定治疗后，预后效果理想，但容易出现切口感染，且需要常规护理？,胫骨平台骨折
bridge_subgraph_22565.graphml,哪种疾病在CT片中显示为V型病理分型，且通常需要通过CT诊断，并在治疗过程中推荐进行水中步行训练？,胫骨平台骨折
bridge_subgraph_22557.graphml,哪种疾病在进行钢板固定治疗或经皮钢板内固定（MIPPO）时，容易伴随感染发生，并需要特别关注心理护理？,胫骨平台骨折
bridge_subgraph_22570.graphml,哪种疾病在治疗观察期间需要配合芪参复康胶囊，并且同时进行常规护理和舒适护理？,广泛性焦虑症
bridge_subgraph_22573.graphml,哪种疾病在采用微量稀释法检测时，通常会同时出现Ⅰ型和Ⅱ型，并且也需要通过PCR法进行检测？,Mp
bridge_subgraph_22575.graphml,哪种疾病在中医辨证护理中常与头痛相关，并且需要同时进行心理护理和关节炎的辅助治疗？,Still病
bridge_subgraph_22569.graphml,哪种疾病需要采用DHS内固定加转子下截骨或人工关节置换术治疗，并辅以抗生素和早期功能锻炼？,髋内翻畸形
bridge_subgraph_22581.graphml,哪种疾病需要同时进行置管溶栓和肺静脉成形术，并且需要护理干预和外科手术的配合？,再狭窄
bridge_subgraph_22574.graphml,哪种疾病在MRI磁共振检查中易被诊断为脑膜瘤，并需配合早期康复护理？,桥脑小脑角区肿瘤
bridge_subgraph_22564.graphml,哪种疾病在进行膝关节韧带损伤的外科手术前，需要特别关注肺炎的并发症并进行相应的术前准备？,胫骨平台骨折
bridge_subgraph_22567.graphml,哪种疾病在进行胃肿瘤切除时，IgG指标会显著变化，并且通常伴随着MSCT和SSD检查结果的出现？,胃肿瘤
bridge_subgraph_22578.graphml,哪种疾病在患有子宫肌瘤时可能引发猝死，并且通常需要通过外科手术和X线影像学检查来诊断和治疗？,IVL
bridge_subgraph_22579.graphml,哪种疾病在治疗过程中需要辅助使用室颤、进行二尖瓣替换术，并且同时会用到氨甲环酸药物和CT影像学检查？,体外循环
