file,query,answer
bridge_subgraph_09602.graphml,哪种疾病同时伴随慢性盆腔炎症、便秘，且在治疗过程中可能需要进行腹膜透析和呼吸功能锻炼操？,失眠
bridge_subgraph_09611.graphml,哪种疾病更容易与2型登革热和急性缺血性脑血管病同时出现，急性脑梗死还是高血压性脑出血？,非出血组
bridge_subgraph_09609.graphml,哪种疾病在治疗过程中需要结合认知心理治疗和三唑仑片，同时常伴有头痛和心理疏导的需求？,失眠
bridge_subgraph_09607.graphml,哪种医学内容能同时解释肝郁和桂枝加龙骨牡蛎汤的使用，并且与呕吐和口干症状相关？,失眠
bridge_subgraph_09615.graphml,哪种疾病在治疗时常用苏沃雷生，并通过磁共振检查，同时伴有疼痛症状且需普外科处理？,失眠
bridge_subgraph_09610.graphml,哪种疾病容易引发内瘘并发症，并需使用云南白药治疗，同时伴随疼痛症状和疾病因素？,渗血
bridge_subgraph_09612.graphml,哪种疾病在治疗过程中常同时使用阿普唑仑和褪黑素受体激动剂，且患者可能伴有糖尿病和视网膜病变？,失眠
bridge_subgraph_09613.graphml,哪种医学内容既与失眠和术中出血量直接相关，又常与吸烟和消化内科问题同时出现？,糖尿病
bridge_subgraph_09605.graphml,哪种疾病既可以通过常规二维超声测量和常染色体显性遗传来诊断，又常伴随心功能不全并在磁共振成像中有所表现？,LVNC
bridge_subgraph_09604.graphml,哪种疾病在治疗过程中常使用右美托咪定药物和短程小组认知行为疗法，且患者可能伴有肿瘤临床表现，并通过酶联免疫吸附试验进行实验室检查？,失眠
bridge_subgraph_09614.graphml,哪种疾病会导致头部疼痛感，并伴随高血压，同时可能引起脑血管痉挛，需要通过CT检查来确诊？,老年蛛网膜下腔出血
bridge_subgraph_09617.graphml,哪种疾病会深入家庭辅助治疗，主要发病于白脉，且常伴随发热和中毒症状？,失眠
bridge_subgraph_09619.graphml,哪种疾病在男性中常见，且常通过CT扫描和数字化X线检查发现，并伴有疼痛症状？,骨样骨瘤
bridge_subgraph_09628.graphml,哪种疾病在睡眠脑电图检查中表现较好，且常与脑电图异常和肿瘤相关？,额叶癫痫
bridge_subgraph_09616.graphml,哪种疾病在采用传统开腹根治术和内镜治疗术的同时，需要配合右美托咪定和整体护理？,腹腔镜结肠癌
bridge_subgraph_09623.graphml,哪种疾病在采用中医五行音乐特色疗法辅助治疗时，常伴有抑郁情绪，并可能出现脑卒中和脑缺血的临床表现？,失眠
bridge_subgraph_09620.graphml,哪种疾病在需要特殊护理干预（辅助治疗）的同时，常伴随继发性甲状旁腺功能亢进、食管癌和ACS的临床表现？,失眠
bridge_subgraph_09625.graphml,哪种疾病在出现挫伤或擦伤的同时，伴有耳鸣和发热，并且需要优化急诊护理流程来进行辅助治疗？,头外伤
bridge_subgraph_09618.graphml,哪种疾病在耳针推拿治疗中常与失眠、经济困难相伴，且可能与脑卒中和甲状腺功能亢进症同时出现？,失眠
bridge_subgraph_09627.graphml,哪种疾病会导致排尿困难、急诊科护士间横向暴力，同时伴随心慌和心力衰竭的症状？,失眠
bridge_subgraph_09632.graphml,哪种社会学理论能解释针刺疗法引发动脉损伤时，血脂变化与外固定架固定的相互关系？,感染
bridge_subgraph_09633.graphml,哪种疾病在出现心身症状障碍和头部穴位按摩时，常伴随CAS和冠心病的症状？,失眠
bridge_subgraph_09631.graphml,哪种疾病在常规护理干预和经颅磁刺激治疗过程中，常与胃食管反流病和上呼吸道感染同时出现？,失眠
bridge_subgraph_09629.graphml,哪种疾病在急性冠状动脉综合征的临床表现中常伴随乏力，且在睡眠心理行为护理辅助治疗后可能出现嗜睡症状？,失眠
bridge_subgraph_09621.graphml,哪种疾病会导致血清尿素氮高、总尿素清除指数低，并且常与糖尿病和老年冠心病同时出现，灸疗对其有一定疗效？,失眠
bridge_subgraph_09622.graphml,哪种疾病在每周体育活动少的情况下，常表现为睡眠障碍，且治疗时需联合使用阿米替林和安神补脑液，同时可能涉及抗抑郁药？,失眠
bridge_subgraph_09630.graphml,哪种疾病会导致入睡后易惊醒，且可能与经常喝咖啡的习惯有关，同时伴随肝硬化和慢性乙型肝炎的症状？,失眠
bridge_subgraph_09626.graphml,哪种疾病在临床表现上与MG相似，同时具有慢性荨麻疹作为风险评估因素，且在进行化疗和磁共振成像检查时常被关注？,失眠
bridge_subgraph_09624.graphml,哪种疾病会导致血小板减少和131Ⅰ治疗，并且常伴有心脏病和贫血？,Graves甲亢
bridge_subgraph_09638.graphml,哪种疾病在伴有抑郁倾向和需要护理干预措施的同时，还常与乙型肝炎和酶联免疫法检测相关？,失眠
bridge_subgraph_09634.graphml,哪种疾病适合通过三伏贴治疗，并常结合调脾法、刮痧疗法和穴位贴敷进行辅助治疗？,肺系疾病
bridge_subgraph_09639.graphml,哪种疾病在急救护理措施和社区应急预案中，同时需要心理疏导和心理干预作为辅助治疗？,突发公共卫生事件
bridge_subgraph_09637.graphml,哪种疾病在治疗过程中可能同时使用舒眠胶囊和安慰剂，且患者会出现听力减退和恶性肿瘤的临床表现？,失眠
bridge_subgraph_09636.graphml,哪种疾病在成年人中表现为顽固性便秘或慢传输型便秘，且需要通过全结肠型巨结肠手术治疗和预防性回肠造口？,全结肠切除
bridge_subgraph_09635.graphml,哪种疾病既与月经不规律的妇女相关，又与老年性痴呆有关，且在特定年龄群体中使用右美托咪定时更易出现？,失眠
bridge_subgraph_09642.graphml,哪种医学内容与子午流注针灸法、苯二氮(艹卓)类药物直接相关，且常与原发性肝癌和发热同时出现？,失眠
bridge_subgraph_09643.graphml,哪种疾病既表现为咳嗽，又可能由GER引起，且需要与支气管炎进行鉴别诊断，并通过体格检查辅助诊断？,不明原因慢性咳嗽
bridge_subgraph_09640.graphml,哪种疾病在老年人中多发，且因药品不全难以治愈，需要延续性护理并常伴有高血压？,双向转诊
bridge_subgraph_09647.graphml,哪种疾病在服用MDMA后可能会加重更年期症状，并且与CAS和失语同时出现？,失眠
bridge_subgraph_09644.graphml,哪种疾病在颅脑疾病中海绵状血管瘤较为常见，且常伴有脑电图异常和糖尿病？,颅内占位性病变
bridge_subgraph_09641.graphml,哪种社会学理论能够解释胸膜肺母细胞瘤的病理分型与失眠的临床表现，同时关联胸部增强CT的影像学检查和发热的鉴别诊断？,肿瘤
bridge_subgraph_09651.graphml,哪种疾病在使用脑功能保健仪和定心汤的同时，常伴随心律失常和干咳的症状？,失眠
bridge_subgraph_09646.graphml,哪种疾病同时伴有溴隐亭和17-β-雌二醇（E2）的异常，且常出现骨质疏松和神经系统症状？,催乳素瘤
bridge_subgraph_09645.graphml,哪种疾病在早期护理干预和磁共振成像辅助下，通过加味归脾汤治疗，能有效改善易醒症状？,失眠
bridge_subgraph_09653.graphml,哪种疾病需要同时进行动静脉鞘膜切开术和等离子体光谱法治疗，并且常伴有高血压和疼痛症状？,AAS
bridge_subgraph_09649.graphml,哪种疾病在患有原发性高血压和糖尿病的人群中，容易出现上消化道出血和突发意识障碍的临床表现？,原发性脑干出血
bridge_subgraph_09657.graphml,哪种疾病发病率高达40.82%，常需通过生活起居疗法辅助治疗，且与糖尿病相关，药物治疗中常用金纳多？,失眠
bridge_subgraph_09654.graphml,哪种疾病在ICU中常见，且需要结合中医护理方案、星状神经节阻滞以及光疗进行综合治疗？,失眠
bridge_subgraph_09656.graphml,哪种疾病会导致夜尿症，且在治疗中可能使用逍遥丸，同时伴随膀胱癌的临床表现和需要护理干预？,失眠
bridge_subgraph_09660.graphml,哪种疾病会导致脑干受损，出现四肢活动障碍，并伴随头痛和发热的症状？,脑干肿瘤
bridge_subgraph_09648.graphml,哪种疾病在治疗过程中常采用涌泉穴贴敷辅助，并需使用地西泮片进行药物治疗，同时患者可能伴有COPD的临床表现和糖尿病的相关症状？,失眠
bridge_subgraph_09650.graphml,哪种疾病既有骨质疏松症的风险评估因素，又常伴随抑郁和植物神经功能紊乱，且可能通过一般三环抗抑郁剂进行治疗？,女性更年期
bridge_subgraph_09652.graphml,哪种疾病会导致深度昏迷，并且需要通过后颅窝开颅血肿清除减压术治疗，同时在评估风险时需考虑年龄因素，并通过CT影像学检查进行诊断？,自发性小脑出血
bridge_subgraph_09661.graphml,哪种疾病会出现记忆力下降、恶心和乏力，并且可以通过调神穴进行治疗？,失眠
bridge_subgraph_09662.graphml,哪种疾病在足穴按摩辅助治疗下，其病因包括癫痫和心动过速，且发病率高达21.1%？,失眠
bridge_subgraph_09655.graphml,哪种疾病在七情过极的情况下易发，且其治疗可能涉及牡蛎类药物，同时在内镜下黏膜剥离术和乳腺癌的临床表现中也有出现？,失眠
bridge_subgraph_09663.graphml,哪种疾病会导致脾肾亏虚，并在手术后出现非运动症状，且常与年龄增长和MG症状同时出现？,失眠
bridge_subgraph_09659.graphml,哪种疾病既与催眠药和继发性不孕症直接相关，又常与脑缺血和帕金森病同时出现？,失眠
bridge_subgraph_09666.graphml,哪种疾病既有气促和腹胀的临床表现，又与肾病综合征和恶性肿瘤相关？,乳糜腹水
bridge_subgraph_09667.graphml,哪种疾病在进行肠造瘘术后容易并发感染和肺炎？,肠坏死
bridge_subgraph_09664.graphml,哪种疾病在进行非预防性子宫切除和抗感染治疗时，常与2型糖尿病或老年糖尿病同时出现？,NPH
bridge_subgraph_09665.graphml,哪种疾病会导致男性出现颈椎病颈痛和视疲劳，且可以通过吴茱萸粉穴位敷帖进行治疗？,失眠
bridge_subgraph_09678.graphml,哪种疾病在一次性碎石后容易引发输尿管石街和泌尿系感染？,输尿管穿孔
bridge_subgraph_09670.graphml,哪种疾病既与失眠和大动脉粥样硬化型直接相关，又常在神经内科中与缺血性脑卒中同时出现？,糖尿病
bridge_subgraph_09658.graphml,哪种疾病既有优势节律慢化和路易小体性痴呆的特征，又常伴随睡眠障碍和心电图异常？,DLB
bridge_subgraph_09668.graphml,哪种疾病会导致生物钟错乱、心烦易乱，并且常伴随腹泻，需要护理干预？,失眠
bridge_subgraph_09675.graphml,哪种疾病在治疗时常用头孢三嗪，并通过CT检查确诊，同时伴随头痛和发热的症状？,小儿脑脓肿
bridge_subgraph_09674.graphml,哪种疾病在中老年人和老年人中多发，且适合采用舒肝清胃安神法治疗，并可能表现为膀胱癌的临床症状？,失眠
bridge_subgraph_09669.graphml,哪种疾病在小剂量米氮平治疗老年慢性病患者抑郁时，常伴随心肌酶升高和关节痛的症状？,失眠
bridge_subgraph_09672.graphml,哪种疾病在服用安神中药和思虑过度的情况下，最需要护理干预和专业的护理？,失眠
bridge_subgraph_09679.graphml,哪种疾病会导致自身活化染色质和非特异性T细胞疫苗的出现，同时伴随口干和关节痛的症状？,SLE样综合征
bridge_subgraph_09671.graphml,哪种疾病在出现海洛因戒断症状时，可以通过中药足浴结合足底穴位按摩辅助治疗，并且常伴随经颅多普勒药物治疗，且年龄是其高危因素？,失眠
bridge_subgraph_09673.graphml,哪种疾病在临床表现上会出现肌萎缩侧索硬化和乏力，并且可以通过耳穴贴压联合足浴及护理干预进行辅助治疗？,失眠
bridge_subgraph_09683.graphml,哪种疾病会导致脚心不适，并伴随职业倦怠，甚至可能引发急性脑梗死或脑梗死？,失眠
bridge_subgraph_09676.graphml,哪种疾病在治疗过程中需要使用抗抑郁药，同时会通过血流变检查进行评估，且患者可能伴有食管癌的临床表现，并需要接受舒适护理作为辅助治疗？,失眠
bridge_subgraph_09677.graphml,哪种疾病在治疗时需要联合使用阿维巴坦和左氧氟沙星，且常与糖尿病及2型糖尿病并发症相关？,复杂性尿路感染
bridge_subgraph_09684.graphml,哪种疾病在通过RT-PCR半定量技术检查结直肠癌时，可能会与心肌梗死或急性心肌梗死的实验室和影像学检查结果同时出现？,MMP-9 mRNA
bridge_subgraph_09680.graphml,哪种疾病在使用右美托咪定和星状神经节阻滞治疗的同时，还可以通过耳针疗法辅助，并且需要关注体重指数的变化？,失眠
bridge_subgraph_09686.graphml,哪种疾病会同时出现VM、阴茎海绵体脱细胞基质异常，并伴随乏力和心悸的症状？,ACCM
bridge_subgraph_09681.graphml,哪种疾病在放射治疗和单药化疗后容易出现恶心症状？,恶性滋养细胞肿瘤
bridge_subgraph_09685.graphml,哪种疾病在表现为肝郁化火的同时，还可能伴随慢性阻塞性肺疾病和关节痛，且适合使用失苔剌知丸进行治疗？,失眠
bridge_subgraph_09688.graphml,哪种疾病在采用HAMA评估时，通过耳穴埋豆干预疗法能有效缓解头昏和腰痛的症状？,失眠
bridge_subgraph_09689.graphml,哪种疾病在采用糖皮质激素药物喷鼻治疗季节性变应性鼻炎时，更容易并发慢性鼻窦炎和支气管哮喘？,变态反应性鼻炎
bridge_subgraph_09692.graphml,哪种疾病既与脑损伤、习惯性打鼾直接相关，又常伴随发热和支气管哮喘出现？,失眠
bridge_subgraph_09682.graphml,哪种疾病在男性中较为常见，且常伴有肺炎的临床表现，蒙医治疗可作为其辅助治疗手段，同时脑卒中是其常见的并发症？,失眠
bridge_subgraph_09690.graphml,哪种疾病在经颅多普勒检查中常被诊断，且需要结合护理干预和心理护理来治疗精神疾病？,失眠
bridge_subgraph_09701.graphml,哪种疾病在药物敏感试验中常对红霉素敏感，并且女性和男性均有发病倾向？,Uu感染
bridge_subgraph_09694.graphml,哪种疾病会同时出现脑瘫并发症、转氨酶升高、自身免疫性疾病及皮疹的临床表现？,视觉异常
bridge_subgraph_09687.graphml,哪种疾病在治疗过程中需要特别加强睡眠护理，并常通过睡眠个人信念与态度量表进行评估，同时可能使用多虑平药物和心理疏导来辅助治疗？,失眠
bridge_subgraph_09695.graphml,哪种疾病会导致脑室周围白质软化和肝动脉缺血，且常伴有心功能不全和糖尿病？,HAI
bridge_subgraph_09693.graphml,哪种疾病会导致术后疼痛和老年综合征，同时表现为肝部不适和疲乏？,失眠
bridge_subgraph_09696.graphml,哪种疾病在脑电图检查中额叶异常，且常伴有头痛，需要通过常规护理辅助治疗？,急性病毒性脑炎
bridge_subgraph_09700.graphml,哪种疾病会导致双眼视盘苍白，需要进行玻璃体切除术，且患者常有高血压病史，并可能伴有原发性青光眼？,NVG
bridge_subgraph_09708.graphml,哪种疾病在进行酶联免疫吸附试验时，常用于检测女性继发不孕或继发性不孕症？,AsAb
bridge_subgraph_09691.graphml,哪种疾病的预后生存率在70.1%到77.7%之间，且常与新型冠状病毒肺炎和急性冠状动脉综合征同时出现？,低危
bridge_subgraph_09703.graphml,哪种疾病在出现三叉神经-颈反射和根治性颈淋巴清扫术的同时，常伴有肌萎缩侧索硬化和体位性低血压？,MND
bridge_subgraph_09697.graphml,哪种疾病在出现出汗的临床表现时，常与2型糖尿病相关，并且老年糖尿病患者更需要心理护理干预？,失眠
bridge_subgraph_09705.graphml,哪种疾病与岩舒和吸烟直接相关，且常伴随恶性腹水和恶性胸腔积液的出现？,胃癌
bridge_subgraph_09702.graphml,哪种疾病在出现发热的同时，可能并发肺炎和支气管肺炎，并且需要通过胸部影像学检查来确诊？,重症甲型H1N1 流感
bridge_subgraph_09704.graphml,哪种疾病在男性中多发，且其风险评估因素包括ACLF，常用乙胺丁醇或黄芪注射液进行治疗？,HRS
bridge_subgraph_09699.graphml,哪种疾病在康复护理过程中常伴随疼痛，且与苯二氮卓艹类药物和继发性甲状旁腺功能亢进密切相关？,失眠
bridge_subgraph_09706.graphml,哪种疾病在治疗时常用电针法和补益药，并且患者常伴有口干和呕吐的症状？,失眠
bridge_subgraph_09710.graphml,哪种疾病在服用柴桂温胆定志汤后，手术后会引发非运动症状，并且与肾和心功能相关？,失眠
bridge_subgraph_09709.graphml,哪种疾病在采用抗抑郁药物治疗后会出现出汗的临床表现，并且需要配合常规护理和早期护理干预？,失眠
bridge_subgraph_09698.graphml,哪种疾病在阳性和阴性综合征量表评估中表现出特异性，且通过流式多重蛋白分析技术可以检测，同时常伴随喹硫平治疗和抑郁症状？,稳定期精神分裂症
bridge_subgraph_09712.graphml,哪种疾病在单纯中药治疗后容易出现神经精神症状，并且通常伴随血常规异常，多发于特定年龄人群？,失眠
bridge_subgraph_09707.graphml,哪种疾病可以通过振腹环揉法腹部推拿和改进后的瑜伽功法辅助治疗，并且常表现为肿瘤或胃癌的临床症状？,失眠
bridge_subgraph_09711.graphml,哪种疾病会导致觉醒次数增多、乏力，且常与乙型肝炎同时出现，针灸配合中药对其有辅助治疗效果？,失眠
bridge_subgraph_09722.graphml,哪种医学内容与非穴浅刺、老年髋部骨折直接相关，且常与牙周炎和PD同时出现？,失眠
bridge_subgraph_09713.graphml,哪种疾病在ICU中容易因哌拉西林治疗不当而导致感染复发？,CRKP
bridge_subgraph_09724.graphml,哪种疾病在采用耳穴压豆治疗的同时，还需要结合心理护理和中药来有效缓解脑外伤后综合征的症状？,失眠
bridge_subgraph_09715.graphml,哪种疾病在使用雷诺考特和茯苓药物治疗的同时，还需要结合平衡针刺和常规护理进行辅助治疗？,小儿过敏性鼻炎
bridge_subgraph_09719.graphml,哪种疾病在采用伤椎置钉技术治疗骨科骨折时，最需要结合骨折的循证护理方法？,胸椎骨折
bridge_subgraph_09714.graphml,哪种疾病在40～60岁女性中常见，通过钼钯X线片检查进行诊断，且需与乳腺癌进行鉴别？,乳腺叶状囊肉瘤
bridge_subgraph_09725.graphml,哪种疾病会出现主观性特发性耳鸣和体位不适，并且可能伴随骨折，需要常规护理干预？,失眠
bridge_subgraph_09726.graphml,哪种疾病在颈部刀刺伤后需要补充营养和健康教育，且常伴有泌尿系感染？,高位截瘫
bridge_subgraph_09716.graphml,哪种疾病更容易与急性冠状动脉综合征和新型冠状病毒感染同时出现，脑缺血还是非小细胞肺癌？,失眠
bridge_subgraph_09734.graphml,哪种疾病在治疗过程中需要特别注重水化和补盐，并且常伴有癫痫和脑血管病等并发症？,中枢性低钠血症
bridge_subgraph_09729.graphml,哪种疾病会导致男性出现肝阳上亢型症状并伴随发热，同时与心脏病有关？,失眠
bridge_subgraph_09727.graphml,哪种疾病适合使用三味豆蔻汤散治疗，并常结合皮内针、针灸和中药熏洗等辅助疗法？,失眠
bridge_subgraph_09733.graphml,哪种疾病在病后常伴随胆怯症状，且在进行酶联免疫吸附试验时常与2型糖尿病一同被诊断？,失眠
bridge_subgraph_09723.graphml,哪种疾病在辅助治疗时会采用耳穴压丸，同时使用香水可能增加患病风险，且患者常表现为体重减轻和腹痛？,失眠
bridge_subgraph_09721.graphml,哪种疾病在一般健康指导中推荐针刺加艾灸百会穴，并且常伴随心律失常，需要通过心电图进行诊断？,失眠
bridge_subgraph_09731.graphml,哪种疾病在混合性感染的情况下，需要结合健康教育干预、护理干预以及常规护理进行综合治疗？,妇科阴道炎
bridge_subgraph_09717.graphml,哪种医学内容同时涉及绝经期、术后谵妄，并且与抑郁症、小檗碱相关？,失眠
bridge_subgraph_09718.graphml,哪种疾病在使用普米克令舒雾化和布地奈德混悬液雾化吸入治疗的同时，还需要特别注重环境护理和护理干预？,小儿急性喉炎
bridge_subgraph_09732.graphml,哪种疾病需要进行造血干细胞移植或使用干细胞辅助治疗，并且其病因与吸烟和肥胖密切相关？,退行性疾病
bridge_subgraph_09736.graphml,哪种疾病会导致持续高热和肺部啰音，同时伴随心率增快和血糖升高？,重型 HFMD
bridge_subgraph_09728.graphml,哪种疾病在男性中更常见，且使用香芍颗粒治疗，同时需要常规护理，并有强迫、人际关系敏感、抑郁等风险评估因素？,失眠
bridge_subgraph_09737.graphml,哪种疾病会出现鼻通气障碍和呕吐，且常伴随心律失常，可通过耳穴埋豆护理辅助治疗？,失眠
bridge_subgraph_09720.graphml,哪种疾病在HPLC检查中常见，且常因人际关系矛盾引发，同时可能伴随脑梗死和头痛症状？,失眠
bridge_subgraph_09740.graphml,哪种疾病可以通过八段锦结合针刺治疗，并且与BCBT、血脂异常和眼科问题同时出现？,失眠
bridge_subgraph_09738.graphml,哪种疾病在腰段发病且病理分型为恶性神经鞘瘤，同时需要心理护理和常规护理作为辅助治疗？,椎管肿瘤
bridge_subgraph_09747.graphml,哪种疾病会导致神疲、痰热内蕴，同时伴随胸闷和头晕？,心脑合病
bridge_subgraph_09730.graphml,哪种疾病在牙髓病治疗中需要辅助镇静镇痛治疗，且患者常伴有恐惧心理，还可能引发冠心病并发症？,牙病
bridge_subgraph_09735.graphml,哪种疾病在临床表现上与艾滋病感染相似，且在药物治疗中常使用酸枣仁和远志，同时可能伴随食管癌和胃癌的出现？,失眠
bridge_subgraph_09743.graphml,哪种疾病在进行结扎术后，通过三维血管能量成像检查时，常伴随腹痛且可能与原发性肝癌相关？,门静脉栓塞
bridge_subgraph_09746.graphml,哪种疾病会出现充气支气管征和AS，并且常伴有肿瘤或恶性肿瘤的临床表现？,胸膜增厚
bridge_subgraph_09741.graphml,哪种疾病在MMPI影像学检查中常见，且表现为慢性疼痛，同时需要护理干预并可能在治疗后出现精神分裂症症状？,失眠
bridge_subgraph_09752.graphml,哪种疾病同时涉及腺瘤和细胞周期素D1，并伴随骨痛和恶性肿瘤的出现？,甲状旁腺肿瘤
bridge_subgraph_09745.graphml,哪种疾病会导致五味子木脂素治疗期间出现梦游现象，并且需要通过心电图和磁共振成像来辅助诊断？,失眠
bridge_subgraph_09749.graphml,哪种疾病在放疗不良反应和不良睡眠习惯的影响下，容易出现焦虑和贫血的症状？,失眠
bridge_subgraph_09753.graphml,哪种疾病在女性患者中，通过MRI检查发现体积异常时更常见？,韧带样纤维瘤
bridge_subgraph_09744.graphml,哪种疾病在实验室检查中表现为尿乳清酸升高，临床上有嗜睡症状，且需通过药物治疗，又称为OTC缺乏症？,OTCD
bridge_subgraph_09751.graphml,哪种疾病在控制体脂肪和继发性高血压的治疗中常见，且体格检查时常伴随头痛症状？,儿童高血压
bridge_subgraph_09739.graphml,哪种疾病在男性患者中常与糖尿病同时出现，且可以通过蒙医温针疗法进行辅助治疗，类似于类风湿关节炎的情况？,失眠
bridge_subgraph_09757.graphml,哪种疾病在肺癌合并上腔静脉综合征的情况下，需要放疗并辅以血府逐瘀汤进行治疗？,SVCS
bridge_subgraph_09754.graphml,哪种疾病因大黄、郁金、茯苓等药材使用不当，可能导致复发性口腔溃疡？,红黑丸
bridge_subgraph_09759.graphml,哪种疾病是由病毒感染和遗传因素共同引起，常见于10岁以上儿童，并可能伴有尿潴留的并发症？,先天性巨结肠症
bridge_subgraph_09758.graphml,哪种疾病会导致腹膜后神经鞘瘤并伴随夜间痛，同时出现腹泻和恶心症状？,间断腹痛
bridge_subgraph_09750.graphml,哪种疾病在治疗时常用安神药7味和养血补肝药，并通过脑功能成像进行检查，且常伴随肝硬化和静脉炎的临床表现？,失眠
bridge_subgraph_09742.graphml,哪种疾病会出现昼不精、夜不瞑和惊厥的临床表现，并且可以用傣医药治疗，同时配合高压氧辅助治疗？,失眠
bridge_subgraph_09756.graphml,哪种疾病在治疗过程中常采用针刺及推拿作为辅助手段，同时使用氟伏沙明进行药物治疗，且患者可能伴有病毒性肝炎的临床表现，并需要接受维持性血液透析？,失眠
bridge_subgraph_09760.graphml,哪种疾病在临床表现上与纤维肌痛综合征相似，且在ICU中常见，治疗上除了使用补益安神汤外，还会辅以中药穴位贴敷？,失眠
bridge_subgraph_09769.graphml,哪种疾病会导致拒乳、血氨基酸谱分析异常，并且常伴随贫血和抑郁症状？,MSUD
