file,query,answer
bridge_subgraph_28718.graphml,哪种疾病在使用唑来膦酸治疗时，通常需要进行MRI和CT影像学检查？,胫骨平台骨折
bridge_subgraph_28713.graphml,哪种疾病需要同时采用中药治疗和手术治疗，如转移皮瓣成形术或手术切除分层缝合术？,骶尾部藏毛窦
bridge_subgraph_28720.graphml,哪种疾病会导致鼻骨塌陷移位，并且通过螺旋CT和X线检查后，预后状况恢复良好？,鼻中隔骨折
bridge_subgraph_28714.graphml,哪种疾病在出现膝关节僵直并发症时，需要通过正、侧位X线片和CT进行影像学检查，并需在围术期进行特别护理？,胫骨平台骨折
bridge_subgraph_28725.graphml,哪种疾病在骨折解剖复位和C1型骨折后常伴随疼痛，且适合采用激光治疗？,胫骨平台骨折
bridge_subgraph_28708.graphml,哪种疾病需要进行切口切开复位手术治疗，且主要发病部位在软骨，同时需要配合护理干预和常规护理？,胫骨平台骨折
bridge_subgraph_28724.graphml,哪种疾病在进行多层螺旋CT及扫描后，通常需要通过常规切开复位内固定治疗来辅助治疗？,胫骨平台骨折
bridge_subgraph_28728.graphml,哪种疾病在MRI检查中常见，并可能导致关节功能障碍，通常需要使用活血化瘀中药进行治疗？,胫骨平台骨折
bridge_subgraph_28726.graphml,哪种疾病需要进行膀胱造瘘术或结肠造瘘术，并且通常需要手术治疗和进行CT检查？,创伤性膀胱破裂
bridge_subgraph_28730.graphml,哪种疾病在治疗过程中常采用经皮微创空心钉加压固定辅助治疗，并且需要通过靶位超声、MRI和CT等多种影像学检查进行诊断？,胫骨平台骨折
bridge_subgraph_28719.graphml,哪种疾病在常规轴位扫描和经口咽入路治疗的同时，常需要结合三维CT重建和微创手术？,寰枢椎病变
bridge_subgraph_28733.graphml,哪种疾病在术中窒息的及时处理中需要特别依赖放射影像技术，尤其是X线检查？,小儿气管
bridge_subgraph_28717.graphml,哪种疾病在治疗过程中需要结合饮食治疗、综合护理干预，并常通过HbA1c检查评估疗效，同时中药也常作为辅助药物使用？,糖尿病合并高血脂
bridge_subgraph_28734.graphml,哪种疾病在农村妇女和少年儿童中多发，且在治疗过程中除了使用抗菌素外，还需配合心理干预和常规护理？,犬咬伤
bridge_subgraph_28731.graphml,哪种疾病在治疗过程中需要同时采用中立位固定和屈曲位固定，并辅以康复护理和护理干预？,伸直型桡骨远端骨折
bridge_subgraph_28729.graphml,哪种疾病在治疗时需要采用双切口显露和关节面骨折直接复位，并辅以早期康复锻炼，同时可能伴随关节活动受限，且需通过CT检查进行影像学诊断？,胫骨平台骨折
bridge_subgraph_28732.graphml,哪种疾病在需要接受开腹修补术或单纯穿孔修补术的同时，还会通过X线影像学检查进行诊断？,消化性溃疡急性穿孔
bridge_subgraph_28736.graphml,哪种疾病在采用灌洗关节腔和患膝关节功能锻炼等辅助治疗后，通过保守治疗能有较好的预后？,胫骨平台骨折
bridge_subgraph_28716.graphml,哪种疾病在出现消化道出血的临床表现时，需要通过CT影像学检查确诊，并可能需要进行剖腹探查术及围手术期护理？,小儿美克尔憩室
bridge_subgraph_28737.graphml,哪种疾病在平均43.6岁的患者中常需通过切开复位治疗，并且通常需要进行CT扫描？,胫骨平台骨折
bridge_subgraph_28721.graphml,哪种疾病在肘关节内骨折（病理分型）时，通常需要采用切开复位LPHP内固定（手术治疗），并辅以内固定方法，同时需通过X线片进行影像学检查？,陈旧骨折
bridge_subgraph_28735.graphml,哪种疾病需要进行固定支架手术和精确的关节面修复，并且常通过关节镜检查，最终可能导致创伤性关节炎？,胫骨平台骨折
bridge_subgraph_28727.graphml,哪种疾病在进行X线和解剖型钢板治疗的同时，还需要配合优质护理和护理干预？,胫骨平台骨折
bridge_subgraph_28723.graphml,哪种疾病会导致骨折不愈合，同时需要进行膝关节功能恢复训练，并且常伴随MRI检查和膝关节镜的使用？,胫骨平台骨折
bridge_subgraph_28738.graphml,哪种疾病在肌动蛋白异常时，通过3D-MSCTA检查能够发现，并且常伴随MSCT和三维CT成像的辅助诊断？,空肠间质瘤
bridge_subgraph_28746.graphml,哪种疾病在采用开放手术或经尿道手术治疗时，B组并发症较少且预后效果良好？,输尿管膨出
bridge_subgraph_28741.graphml,哪种疾病需要采用膝关节镜辅助下微创手术治疗或手术切开复位钢板内固定法，并且常常涉及手术治疗和锁定加压钢板的应用？,胫骨平台骨折
bridge_subgraph_28744.graphml,哪种疾病在进行护理干预和功能复位的同时，需要通过CT或螺旋CT检查，并辅以充分植骨治疗？,胫骨平台骨折
bridge_subgraph_28742.graphml,哪种疾病在进行微创手术骨折复位治疗时，容易出现畸形愈合，并且通常需要通过CT检查来辅助诊断？,胫骨平台骨折
bridge_subgraph_28739.graphml,哪种疾病在治疗时需要使用脱水剂和进行取髂骨植骨，并且常伴随骨折和腘动脉损伤的情况？,胫骨平台骨折
bridge_subgraph_28748.graphml,哪种疾病在治疗过程中需要全面综合护理和早期功能锻炼，并辅以健康宣教，尤其适用于高脂血症患者？,直肠癌手术
bridge_subgraph_28740.graphml,哪种疾病在治疗时既需要使用胫骨近端解剖钢板辅助治疗，又可能采用胫骨平台解剖复位手术治疗，并且常见于Ⅰ型和Ⅲ型病理分型？,胫骨平台骨折
bridge_subgraph_28745.graphml,哪种疾病在临床表现上会出现抑郁，且需要通过关节镜下内固定术进行治疗，同时常伴随磁共振成像和关节镜检查？,胫骨平台骨折
bridge_subgraph_28752.graphml,哪种疾病在采用中西医结合的护理方案进行辅助治疗时，针对肱骨外科颈骨折引起的疼痛，特别需要强调优质护理的作用？,胫骨平台骨折
bridge_subgraph_28751.graphml,哪种疾病在进行内镜黏膜切除术后，需要结合氟尿嘧啶治疗，并且还需要进行常规护理和保守治疗？,胃肠恶性肿瘤
bridge_subgraph_28750.graphml,哪种疾病在膝关节镜下手术后，结合中药治疗，容易出现胫骨骨折和感染并发症？,胫骨平台骨折
bridge_subgraph_28754.graphml,哪种疾病在治疗过程中通常需要结合虚拟手术和内固定，并辅以抗生素和优质护理服务？,胫骨平台骨折
bridge_subgraph_28743.graphml,哪种疾病在采取综合防护措施预防的同时，因接触低浓度镉而引发，且患者常伴有抑郁症状，需要心理干预作为辅助治疗？,职业性镉中毒
bridge_subgraph_28760.graphml,哪种疾病在膝关节功能锻炼和骨科外科手术治疗后，常同时出现在膝关节和踝关节？,胫骨平台骨折
bridge_subgraph_28747.graphml,哪种疾病会导致上颈椎畸形不稳定，并且需要通过CT复查、X线和MRI等影像学检查来确诊？,寰枢椎半脱位
bridge_subgraph_28755.graphml,哪种疾病既可能伴有腋神经损伤和桡神经损伤的病理分型，又常出现感染并发症并需进行康复训练辅助治疗？,正中神经损伤
bridge_subgraph_28759.graphml,哪种疾病在治疗过程中需要同时采用热敷、针灸和护理干预，且其病因可能与长期使用抗精神病药物有关？,药源性便秘
bridge_subgraph_28766.graphml,哪种疾病需要通过膝关节切开复位和手术治疗，并配合解剖钢板内固定联合中药治疗？,胫骨平台骨折
bridge_subgraph_28764.graphml,哪种疾病在进行基础康复护理和有限切开的同时，还需要特别重视心理护理和护理干预？,胫骨平台骨折
bridge_subgraph_28761.graphml,哪种疾病最适合使用3D打印骨折模型引导小切口手术治疗，而不是传统的骨性关节炎治疗方法？,胫骨平台骨折
bridge_subgraph_28758.graphml,哪种疾病在颈部转移时，通过CT检查（包括21例行增强扫描）和MRI影像学检查能够被有效诊断？,大涎腺癌
bridge_subgraph_28768.graphml,哪种疾病在CT影像学检查中表现为分房大小不一，且通常属于良性脾肿瘤？,血管淋巴管瘤
bridge_subgraph_28753.graphml,哪种疾病在治疗过程中特别需要指导正确饮食、合理处理伤口，并且离不开常规护理和全面的护理措施？,过敏性水疱性皮炎
bridge_subgraph_28757.graphml,哪种疾病在侧位X线片和磁共振成像中常表现为软骨受损，并适合采用经皮空心螺钉内固定方法治疗？,胫骨平台骨折
bridge_subgraph_28772.graphml,哪种疾病在骨科治疗中常需要使用外固定支架和膝关节镜辅助切开，且可能需要进行人工膝关节置换术？,胫骨平台骨折
bridge_subgraph_28762.graphml,哪种疾病在胫骨近端发病，表现为70胎DA异常，需通过骨桥切除术治疗，且预后良好？,早闭
bridge_subgraph_28774.graphml,哪种疾病在单排CT扫描和螺旋CT检查中常见局部骨质硬化，且常伴有关节强直的症状？,骶髂关节病变
bridge_subgraph_28767.graphml,哪种疾病在治疗过程中需要同时采用外科手术和定位导航固定治疗，并且药物治疗中会使用TGF-β？,胫骨平台骨折
bridge_subgraph_28775.graphml,哪种疾病需要常规药物和24小时强化护理，同时还要配合心理护理和常规护理？,肺结核咳血
bridge_subgraph_28749.graphml,哪种疾病在治疗过程中需要结合内固定方法（实验室检查）和横斜破裂型成形术（手术治疗），并且同时需要常规护理和护理干预（辅助治疗）？,胫骨平台骨折
bridge_subgraph_28763.graphml,哪种疾病在采用解剖钢板内固定联合中药治疗和前交叉韧带重建术的同时，最适合配合舒适护理和综合护理？,胫骨平台骨折
bridge_subgraph_28756.graphml,哪种疾病在术前术后的护理干预和内固定手术治疗中，常常需要借助X线及X线检查来进行影像学评估？,胫骨平台骨折
bridge_subgraph_28765.graphml,哪种疾病在41至50岁人群中，常需外科治疗且与塌陷骨折复位直接相关？,胫骨平台骨折
bridge_subgraph_28770.graphml,哪种疾病在经过良好预后状况的CT平扫检查后，结合综合护理干预和护理辅助治疗，效果最佳？,胫骨平台骨折
bridge_subgraph_28771.graphml,哪种疾病在开放骨折作为高危因素的情况下，需要术前、术后精心护理，并且通常伴随CT扫描和CT检查等影像学检查？,胫骨平台骨折
bridge_subgraph_28781.graphml,哪种疾病在急诊中常需进行SLT检查，并且往往需要结合CT结果和手术治疗？,严重肝损伤
bridge_subgraph_28780.graphml,哪种疾病需要通过多层螺旋CT扫描、MRI和CT检查进行影像学诊断，并在关节镜辅助下进行微创手术治疗？,胫骨平台骨折
bridge_subgraph_28782.graphml,哪种疾病在需要进行腹会阴联合根治术的同时，还可能发生肝转移，并且通常需要外科治疗作为辅助手段？,直肠肛管恶性黑色素瘤
bridge_subgraph_28778.graphml,哪种疾病在进行外科治疗或外科手术时，常伴随CRE感染和需要进行胼胝体切开？,儿童难治性癫痫
bridge_subgraph_28785.graphml,哪种疾病在膝关节镜下辅助治疗后容易出现复位不良，且在非手术治疗和微创手术中也有类似风险？,胫骨平台骨折
bridge_subgraph_28777.graphml,哪种疾病在治疗过程中需要同时进行心理干预护理和姑息治疗，且患者常表现出焦虑症状，并需接受一般护理？,癌症晚期
bridge_subgraph_28773.graphml,哪种疾病在治疗过程中需要结合TGF-β药物治疗、经皮螺钉内固定术手术治疗，以及自行锻炼和常规护理等辅助治疗措施？,胫骨平台骨折
bridge_subgraph_28784.graphml,哪种疾病在Ⅱ期时主要影响视网膜，并且通过CT检查可见，同时伤口能够一期愈合？,n13
bridge_subgraph_28776.graphml,哪种疾病在进行同种异体骨移植手术治疗时，需要同时进行骨折X线、MRI和多层螺旋CT等影像学检查？,胫骨平台骨折
bridge_subgraph_28783.graphml,哪种疾病在改善微循环和运动治疗的辅助下，常与七叶皂苷钠药物联合使用，且又称为特发性面神经麻痹？,Bell麻痹
bridge_subgraph_28790.graphml,哪种疾病在数字化X线摄影中常见于欧洲男性，且常伴有疼痛症状？,肱骨髁上突
bridge_subgraph_28787.graphml,哪种疾病在低能量损伤（病理分型）和解剖复位（手术治疗）中常见，且常需通过X线及磁共振成像进行影像学检查？,胫骨平台骨折
bridge_subgraph_28791.graphml,哪种疾病在64层CT检查中能清晰显示膝关节内翻畸形，且CT治疗效果理想？,胫骨平台骨折
bridge_subgraph_28789.graphml,哪种疾病在进行开放性手术治疗和关节面解剖复位辅助治疗时，通常需要同时进行螺旋CT扫描和普通CT影像学检查？,胫骨平台骨折
bridge_subgraph_28792.graphml,哪种疾病在进行骨折切开复位支持钢板内固定术或切开复位内固定治疗的同时，还需要配合常规护理和康复护理干预？,胫骨平台骨折
bridge_subgraph_28779.graphml,哪种疾病在治疗过程中通常会同时采用无痛化综合护理和手法复位夹板外固定治疗，并且也可能需要经皮锁定钢板内固定术或微创手术？,老年四肢骨折
bridge_subgraph_28795.graphml,哪种疾病在进行磁共振检查和尿培养时，通常需要同时使用抗生素和进行CT平扫？,AFBN
bridge_subgraph_28800.graphml,哪种疾病在暴力导致的骨折后，容易出现感染性骨不连，且需要通过MRI检查来确诊？,胫骨平台骨折
bridge_subgraph_28793.graphml,哪种疾病在膝关节部位容易出现畸形愈合并发症，且通常需要通过切开复位内固定技术治疗，并可能伴随关节镜检查？,胫骨平台骨折
bridge_subgraph_28788.graphml,哪种疾病在诊断时通常需要结合靶位超声、X线平片和多层螺旋CT扫描，且治疗时多采用切开复位锁定钢板内固定手术？,胫骨平台骨折
bridge_subgraph_28801.graphml,哪种疾病在胫骨平台Ⅱ型骨折后，需要结合早期功能锻炼进行辅助治疗，并且通常通过MSCT和X射线平片进行影像学检查？,胫骨平台骨折
bridge_subgraph_28797.graphml,哪种疾病在进行X线检查时常发现胫骨平台骨折，并且通常需要手术治疗？,胫骨平台骨折
bridge_subgraph_28808.graphml,哪种疾病在Ⅱ型和Ⅲ型病理分型中，常常需要通过针刺和关节辅助下的方法进行辅助治疗？,胫骨平台骨折
bridge_subgraph_28806.graphml,哪种疾病既需要急症手术又适合择期手术治疗，并且通常采用外科治疗和特定的手术方案？,老年胆囊炎胆石症
bridge_subgraph_28807.graphml,哪种疾病在采用手术切开复位钢板内固定法治疗后，容易出现感染并发症，但预后状况通常良好？,胫骨平台骨折
bridge_subgraph_28799.graphml,哪种疾病在康复外科中常见，且常与下肢深静脉血栓同时出现，类似于肌间静脉血栓和动静脉血栓栓塞？,髋、膝关节置换术
bridge_subgraph_28798.graphml,哪种疾病在治疗过程中常需进行切开减压和复位内固定手术，并辅以中医综合疗法，同时在诊断时常用螺旋CT扫描并需外科治疗？,胫骨平台骨折
bridge_subgraph_28809.graphml,哪种疾病在治疗过程中会同时使用GANFH和杜仲补肾健骨颗粒，并且也可能配合中药桃红四物汤进行治疗？,激素性股骨头缺血性坏死
bridge_subgraph_28805.graphml,哪种疾病会导致胸腰段脊柱异常，并伴随预期性恶心，同时需要通过CT和MRI进行诊断？,ANV
bridge_subgraph_28804.graphml,哪种疾病在100.0％的情况下需要通过CT三维重建与MRI进行诊断，且常与X线、64层CT检查同时出现？,胫骨平台骨折
bridge_subgraph_28812.graphml,哪种疾病在治疗时需要采用传统的切开复位或髂胫束入路复位，并且通常需要通过MRI检查来辅助诊断？,胫骨平台骨折
bridge_subgraph_28814.graphml,哪种疾病在进行超声检查后常需通过膀胱输尿管移植手术治疗，且术后容易并发感染？,重复肾
bridge_subgraph_28802.graphml,哪种疾病在进行免疫组化检查时常见于着色性干皮病患者，且在治疗过程中常需手术治疗和出院指导？,眼部恶性肿瘤
bridge_subgraph_28803.graphml,哪种疾病在Ⅳ型11例和V型病理分型中，需要采用排钉内固定结合植骨的手术治疗，并辅以抗生素药物治疗和护理干预？,胫骨平台骨折
bridge_subgraph_28815.graphml,哪种疾病在采用取髂骨植骨手术治疗时，容易并发深静脉血栓，并且通常需要配合推拿手法和针灸治疗？,胫骨平台骨折
bridge_subgraph_28810.graphml,哪种疾病需要通过急诊切开复位内固定术进行治疗，并辅以内固定及术后早期功能锻炼，同时常用X线平片和16层螺旋CT进行影像学检查？,胫骨平台骨折
bridge_subgraph_28823.graphml,哪种疾病会导致前循环血管闭塞，并在MRI检查尤其是弥散加权成像中显现出来？,早期脑出血
bridge_subgraph_28811.graphml,哪种疾病在治疗过程中常需结合125I放射性粒子植入术和经皮椎体成形术，且患者常伴有X线平片异常和褥疮问题？,椎体转移性肿瘤
bridge_subgraph_28819.graphml,哪种疾病在进行人性化护理和地塞米松治疗的同时，还需要配合一般护理和常规护理？,ICU气管插管
bridge_subgraph_28816.graphml,哪种疾病在采用单双号抽签分组法进行临床试验时，使用丹参注射液治疗，并且需要通过MRI和CT进行辅助诊断？,胫骨平台骨折
bridge_subgraph_28820.graphml,哪种疾病在开放骨折作为高危因素时，通过消肿西药治疗，并经CT检查确认，预后通常良好？,胫骨平台骨折
bridge_subgraph_28817.graphml,哪种疾病需要积极防治其他并发症、迅速补充血容量，并且通常需要配合常规护理和外固定支架治疗？,创伤性骨盆骨折
bridge_subgraph_28818.graphml,哪种疾病会导致膝内外翻畸形，并且在进行膝关节活动训练的同时，通常需要通过MRI检查来辅助诊断和治疗？,胫骨平台骨折
bridge_subgraph_28769.graphml,哪种疾病在出现骨化性肌炎（B组病理分型）的并发症时，需要特别注重功能锻炼和心理护理的辅助治疗？,胫骨平台骨折
bridge_subgraph_28796.graphml,哪种疾病在采用塞来昔布治疗和MRI检查的同时，还可能需要微创手术，并且与患者年龄密切相关？,胫骨平台骨折
bridge_subgraph_28824.graphml,哪种疾病在使用脱水剂治疗的同时，配合常规护理和康复护理，预后效果良好？,胫骨平台骨折
bridge_subgraph_28825.graphml,哪种疾病在治疗过程中通常需要结合常规分割照射和靶向药物，并且常常需要通过CT和MRI进行检查？,肿瘤骨转移
bridge_subgraph_28813.graphml,哪种疾病在治疗过程中会同时使用舒经活血汤和中药汤剂内服，并且常见于Ⅵ型和Ⅲ型病理分型？,胫骨平台骨折
bridge_subgraph_28822.graphml,哪种疾病会出现Sharp角平均51°的临床表现，并且常伴有WibergⅠ型、Ⅱ型和Ⅲ型病理分型？,Wiberg
bridge_subgraph_28794.graphml,哪种疾病在治疗过程中既需要通过三维CT和CT三维重建进行影像学检查，又可能涉及骨折切开复位支持钢板内固定术和有效固定作为辅助治疗？,胫骨平台骨折
bridge_subgraph_28826.graphml,哪种疾病在治疗过程中常需进行切开复位内固定手术或单侧锁定钢板内固定治疗，并辅以心理护理和优质护理？,胫骨平台骨折
bridge_subgraph_28786.graphml,哪种疾病在采用酶替代治疗和护理及健康教育计划辅助治疗的同时，预后状况较差，且常需进行切开复位手术治疗？,此病
bridge_subgraph_28827.graphml,哪种疾病在治疗过程中既需要用到气压弹道和经皮肾镜碎石术，又常伴随开放性手术和疼痛护理？,复杂性结石
bridge_subgraph_28830.graphml,哪种疾病在治疗时既需要用到桃红四物汤，又可能需要进行切开复位内固定手术，并且常通过X线和MRI进行检查？,胫骨平台骨折
bridge_subgraph_28832.graphml,哪种疾病在CT影像上呈现为原发性卵巢癌的特征，而在MRI上表现较差？,卵巢转移瘤
bridge_subgraph_28829.graphml,哪种疾病在进行后外侧支撑固定术后需要特别注意术后护理，并且常常需要通过CT和MRI进行检查？,胫骨平台骨折
bridge_subgraph_28828.graphml,哪种疾病在病理分型上属于混合性结缔组织病，且常伴随肌炎的发生并需要心理护理作为辅助治疗？,系统性红斑狼疮
bridge_subgraph_28838.graphml,哪种疾病在针灸治疗和术后科学功能锻炼作为辅助治疗的同时，还需通过多层螺旋CT或CT进行影像学检查？,胫骨平台骨折
bridge_subgraph_28835.graphml,哪种疾病在治疗过程中常需使用骨外固定支架和锁定加压接骨板，并且患者常伴有焦虑症状，同时需要接受常规护理？,胫骨平台骨折
bridge_subgraph_28821.graphml,哪种疾病在治疗过程中需要体位干预辅助，且常通过前正中入路手术进行治疗，同时在诊断时经常使用螺旋CT或CT进行检查？,胫骨平台骨折
bridge_subgraph_28834.graphml,哪种疾病在男性患者中常见，且在进行膝关节镜和三维CT重建检查时常伴随感染并发症？,胫骨平台骨折
bridge_subgraph_28831.graphml,哪种疾病在治疗时需要同时使用阿莫西林/克拉维酸钾和静脉滴注青霉素钠，并且还需配合常规护理和个性化护理？,小儿化脓性扁桃体炎
bridge_subgraph_28841.graphml,哪种疾病会导致淋巴干病变，并在LAM、CT及MSCT扫描中同时显现？,DLG
bridge_subgraph_28836.graphml,哪种疾病在MRI扫描中常表现为爆裂型骨折和胸腰椎损伤，且属于Ⅱ型病理分型？,Denis
bridge_subgraph_28842.graphml,哪种疾病在CT影像尤其是CT平扫中，最常见于肝脏良性肿瘤的病理分型？,肝脏间叶性错构瘤
bridge_subgraph_28844.graphml,哪种疾病在坠落导致损伤后，通常需要通过植骨钢板内固定或颈前路钢板内固定进行手术治疗？,创伤性枢椎滑脱
bridge_subgraph_28840.graphml,哪种疾病在治疗时需要同时采用撬拨植骨和锁定双钢板，并且常常伴随使用阿仑膦酸钠来缓解疼痛？,胫骨平台骨折
bridge_subgraph_28837.graphml,哪种疾病在采用中西结合护理干预和常规护理相结合的方式，以及进行健康宣教的情况下，对高BMI和开放性骨折的患者治疗效果更佳？,胫骨平台骨折
bridge_subgraph_28852.graphml,哪种疾病在临床上表现为抑郁和焦虑，经过心理干预后功能恢复良好？,胫骨平台骨折
bridge_subgraph_28843.graphml,哪种疾病在治疗过程中既需要闭合撬拨整复空心螺钉内固定辅助治疗，又需要切开复位联合钢板固定手术治疗，并且常常通过多层螺旋CT和MRI检查来辅助诊断？,胫骨平台骨折
bridge_subgraph_28833.graphml,哪种疾病在X光片和CT影像学检查中常见，且往往需要通过传统内固定手术进行治疗，且多发于特定年龄段人群？,胫骨平台骨折
bridge_subgraph_28845.graphml,哪种疾病在男性中较为常见，且常由坠落伤引起，需通过LCP+开窗植骨复位手术治疗，并伴有交通伤并发症？,胫骨平台骨折
bridge_subgraph_28849.graphml,哪种疾病在早期康复治疗和围手术期综合护理中尤为重要，且通常需要结合MRI检查和手术治疗？,胫骨平台骨折
bridge_subgraph_28854.graphml,哪种疾病在CT检查中常见，且常伴有关节纤维化并发症，需采用锁定钢板加自体髂骨植骨手术治疗，预后状况较差？,胫骨平台骨折
bridge_subgraph_28848.graphml,哪种疾病需要通过金属固定物固定和空心螺钉治疗，并且常常伴随内固定手术或内固定术的使用？,胫骨平台骨折
bridge_subgraph_28850.graphml,哪种疾病在被动伸膝和心理护理、护理干预等辅助治疗下，且与室内活动有关？,胫骨平台骨折
bridge_subgraph_28860.graphml,哪种疾病在单侧钢板内固定术后需要通过X线检查和MRI来评估术后功能锻炼的效果？,胫骨平台骨折
bridge_subgraph_28858.graphml,哪种疾病在64排螺旋CT三维重建、MRI检查和X线影像学检查中，常伴随出现废用性骨质疏松这一并发症？,胫骨平台骨折
bridge_subgraph_28846.graphml,哪种疾病需要同时使用断血流片和雌孕激素，并配合中药及护理干预进行治疗？,青春期功能性子宫出血
bridge_subgraph_28862.graphml,哪种疾病在进行闭合性骨折内固定治疗后，患者常需进行MRI检查且容易出现焦虑情绪？,胫骨平台骨折
bridge_subgraph_28859.graphml,哪种医学内容在处理筋膜室切开减压和OCS时，常与心理护理及骨折复位内固定同时出现？,骨筋膜室综合症
bridge_subgraph_28847.graphml,哪种疾病在康复过程中需要完善、合理的康复计划，并结合针刺、中药熏蒸加运动疗法，同时还需要整体护理和术后护理的辅助治疗？,胫骨平台骨折
