file,query,answer
bridge_subgraph_25008.graphml,哪种疾病在治疗过程中需要常规骨科护理和早期的功能性恢复锻炼，并且通常需要通过CT扫描进行影像学检查？,胫骨平台骨折
bridge_subgraph_25005.graphml,哪种疾病在临床表现上常出现粉碎性骨折，且在治疗时需采用关节镜技术，同时在诊断过程中常需借助MRI和X线进行影像学检查？,胫骨平台骨折
bridge_subgraph_24995.graphml,哪种疾病在治疗时需要可靠的内固定辅助，并且在进行SEMS0.35T永磁MRI影像学检查时常伴随骨折和CT影像学检查？,胫骨平台骨折
bridge_subgraph_25002.graphml,哪种疾病在直接或间接复位后预后不佳，且常伴随解剖复位和感染并发症？,胫骨平台骨折
bridge_subgraph_25001.graphml,哪种疾病在康复指导辅助治疗和关节面解剖复位手术治疗后，预后状况仍不佳且常需再次手术？,胫骨平台骨折
bridge_subgraph_25013.graphml,哪种疾病在采用音乐疗法和音乐干预辅助治疗的同时，还需要结合常规护理来有效缓解疼痛？,新生儿疼痛
bridge_subgraph_25007.graphml,哪种医学内容在涉及主钉道压配植骨和防旋股骨近端髓内钉的同时，也与手术治疗和唑来膦酸的应用相关？,骨质疏松性股骨转子间骨折
bridge_subgraph_25010.graphml,哪种疾病在CT检查中显示出较差的预后，且大细胞神经内分泌癌的占比高达64.5%？,肺大细胞癌
bridge_subgraph_25014.graphml,哪种疾病在进行术前CT扫描及三维重建时，常需采用LISS钢板微创内固定方法治疗？,胫骨平台骨折
bridge_subgraph_24997.graphml,哪种疾病在进行SWI和增强CT扫描时，常常需要同时进行MRI和普通CT检查？,脑梗死出血性转化
bridge_subgraph_25016.graphml,哪种疾病在通过病理组织活检进行鉴别诊断后，若及时进行外科治疗，通常会有良好的预后？,克隆病
bridge_subgraph_25003.graphml,哪种疾病在硬膜外麻醉中使用地卡因合剂或甲磺酸罗哌卡因时，容易同时引发抑郁症状？,运动阻滞
bridge_subgraph_25018.graphml,哪种疾病在护理干预中需要同时采用最大化无菌屏障和集束化护理措施，以有效预防感染？,导管相关血流感染
bridge_subgraph_25019.graphml,哪种疾病在重物砸伤后通过MRI检查显示良好预后？,胫骨平台骨折
bridge_subgraph_25011.graphml,哪种疾病与rs17592236位点、UAER和FBG的异常相关，且在年龄较大患者中使用丹参注射液进行治疗时更为常见？,T2DN
bridge_subgraph_25015.graphml,哪种疾病在治疗过程中常需坚强的内固定和活血化瘀辅助治疗，且多发于特定年龄人群并易引发感染并发症？,胫骨平台骨折
bridge_subgraph_25012.graphml,哪种疾病在PTGD拔除引流管和CT引导下经皮穿刺胆囊引流过程中，需要特别注意CT检查和围术期护理？,急性重症胆囊炎
bridge_subgraph_25023.graphml,哪种疾病在治疗过程中通常会用到肘压复位法，并且辅以抱颈提胸法、针刺和推拿手法？,胸椎小关节紊乱
bridge_subgraph_25004.graphml,哪种疾病在开放骨折的高危因素下，需要使用生物胶复合物进行药物治疗，并且通常需要通过CT检查进行影像学诊断，同时可能采用微创手术作为治疗手段？,胫骨平台骨折
bridge_subgraph_25025.graphml,哪种疾病在CT图像中常见，且使用倍他米松治疗的有效率高达47.1%？,支气管肺发育不良
bridge_subgraph_25020.graphml,哪种疾病在膝关节部位骨折（病理分型）并需经皮钢板内固定手术（手术治疗）的情况下，常伴随心理干预（辅助治疗）且文化水平较低者（高危因素）更容易发生？,胫骨平台骨折
bridge_subgraph_25006.graphml,哪种疾病需要同时进行双侧钢板内固定术和手术切开复位，并且通常需要通过X线和MRI进行影像学检查？,胫骨平台骨折
bridge_subgraph_25017.graphml,哪种疾病在CT平扫中常表现为鼻窦低度恶性肌纤维母细胞肉瘤或低度恶性肌纤维母细胞性肉瘤？,LGMS
bridge_subgraph_25026.graphml,哪种疾病在术前超声诊断和CT扫描中常见，且死亡率约为0.22/10万，同时需要心理护理作为辅助治疗？,甲状腺恶性肿瘤
bridge_subgraph_25027.graphml,哪种疾病在男性患者接受外科治疗后，需要通过解剖型钢板结合CPM功能锻炼和疼痛管理来进行康复？,胫骨平台骨折
bridge_subgraph_25024.graphml,哪种疾病在出现骨缺损和Ⅲ型骨折的临床表现时，通常需要结合健康宣教和护理干预进行辅助治疗？,胫骨平台骨折
bridge_subgraph_25022.graphml,哪种疾病需要同时进行开放性切开复位锁定钢板内固定术和关节镜处理，并且在外科治疗过程中还需依赖影像学检查？,胫骨平台骨折
bridge_subgraph_25030.graphml,哪种疾病在采用改良双侧钢板内固定治疗和体位干预的同时，还需要使用抗生素以确保有效固定？,胫骨平台骨折
bridge_subgraph_25032.graphml,哪种疾病会同时导致重度水肿和静脉血栓，且常与DVT（深静脉血栓）并发？,亚急性期
bridge_subgraph_25021.graphml,哪种疾病在进行关节辅助下治疗和传统切开复位内固定治疗时，通常需要通过MRI影像学检查来辅助诊断并指导手术？,胫骨平台骨折
bridge_subgraph_25029.graphml,哪种疾病在临床表现上常伴有腹痛，病因与l-Asp相关，并且需要优质护理来辅助治疗，同时也容易导致感染？,酮症酸中毒
bridge_subgraph_25031.graphml,哪种疾病会导致血栓性疾病，并且在进行综合护理和常规护理辅助治疗时，常与GIB同时出现？,老年消化道出血
bridge_subgraph_25036.graphml,哪种疾病在进行MRA和增强扫描时，通常需要同时进行非手术治疗，并且也会用到CT检查？,脑静脉血栓
bridge_subgraph_25037.graphml,哪种疾病在治疗过程中需要同时采用关节内固定植骨支撑和骨外固定架固定手术，并辅以舒适护理和常规护理？,胫骨平台骨折
bridge_subgraph_25028.graphml,哪种疾病在采用关节镜监视和围手术期综合护理的情况下，其治疗效果会受到婚姻状况和常规护理的影响？,胫骨平台骨折
bridge_subgraph_25045.graphml,哪种疾病在扭伤后常需接受关节镜微创手术治疗，并辅以护理和心理干预？,胫骨平台骨折
bridge_subgraph_25033.graphml,哪种疾病在年龄≥50岁的患者中，通过CT检查发现，且需进行保胆手术，同时发病部位涉及神经精神科？,胆囊息肉样病变
bridge_subgraph_25041.graphml,哪种疾病在治疗过程中需要坚强固定和同种异体骨植入，并且常通过CT和X线进行检查？,胫骨平台骨折
bridge_subgraph_25046.graphml,哪种疾病在治疗时既会用到泼尼松和中药，又可能需要进行腹腔镜手术和微创手术？,输卵管性不孕症
bridge_subgraph_25034.graphml,哪种疾病在患者体内检测到弓形虫抗体，且伴随汉密尔顿抑郁量表评分异常，同时还会出现焦虑自评量表高分和MRI异常表现？,原发性癫痫
bridge_subgraph_25035.graphml,哪种疾病在膝关节早期功能练习和加压钢板内固定术治疗后，需要特别考虑年龄因素并加强护理干预？,胫骨平台骨折
bridge_subgraph_25049.graphml,哪种疾病会导致疤痕狭窄型气道阻塞，并且常与Ⅳ型和Ⅰ型同时出现？,TBTB
bridge_subgraph_25052.graphml,哪种疾病在41~50岁人群中常见，且在康复护理和综合护理干预中需要顺势牵引？,胫骨平台骨折
bridge_subgraph_25040.graphml,哪种疾病在实验室检查中血清铁蛋白异常，且在治疗过程中需要无肝素透析和综合护理、一般护理的辅助治疗？,急、慢性肾功能衰竭
bridge_subgraph_25039.graphml,哪种疾病在骨折后使用加压接骨板治疗时，容易通过X线检查发现并发感染？,胫骨平台骨折
bridge_subgraph_25042.graphml,哪种疾病在进行社区康复治疗和数字X线摄影的同时，还需要配合护理和中西医结合治疗？,胫骨平台骨折
bridge_subgraph_25051.graphml,哪种疾病在进行骨骼穿刺活检和三维血流成像的同时，还需要进行磁共振成像和CT扫描检查？,梗塞
bridge_subgraph_25048.graphml,哪种疾病在采用优质护理服务治疗周围韧带损伤的同时，也需要结合常规护理和早期护理干预？,胫骨平台骨折
bridge_subgraph_25043.graphml,哪种疾病在治疗过程中常采用锁定钢板结合木筏克氏针技术，并辅以舒适护理，同时在影像学检查中常用容积成像，且易并发肺炎？,胫骨平台骨折
bridge_subgraph_25038.graphml,哪种疾病在进行X线与CT平扫检查时表现为schatzkerⅤ、Ⅵ型，且常伴随MRI检查异常和明显疼痛？,胫骨平台骨折
bridge_subgraph_25055.graphml,哪种疾病会出现反流、清嗓和焦虑的临床表现，并需要心理干预作为辅助治疗？,LPRD
bridge_subgraph_25047.graphml,哪种疾病在治疗过程中需要同时采用锁定加压板固定和毛节镜监视，并且还需配合心理护理和疼痛护理？,胫骨平台骨折
bridge_subgraph_25050.graphml,哪种疾病在治疗过程中需要改进术式和雌孕激素保胎，并且通常涉及手术及围手术期护理？,小儿尿道下裂
bridge_subgraph_25054.graphml,哪种疾病在采用双侧钢板内固定治疗和外固定支架结合空心螺钉治疗的同时，还需配合优质护理和焦虑自评量表的应用？,胫骨平台骨折
bridge_subgraph_25060.graphml,哪种疾病在治疗过程中既需要常规护理干预和心理护理，又可能涉及抗生素治疗和消化道异物的手术治疗？,耳鼻喉科手术
bridge_subgraph_25064.graphml,哪种疾病在使用胆木注射液治疗扁桃体肿大的同时，还需要配合抗生素和舒适护理？,小儿急性上呼吸道感染
bridge_subgraph_25066.graphml,哪种疾病需要同时进行CT血管成像和直接及间接颅内外血管重建术？,缺血型烟雾病
bridge_subgraph_25044.graphml,哪种疾病在Evans-Jensen和Schatzker病理分型中，通过X线平片检查常表现为Ⅵ型？,V型
bridge_subgraph_25061.graphml,哪种疾病在患有骨质疏松的情况下，骨折后常采用经皮钢板固定手术治疗，并需配合早期康复治疗？,胫骨平台骨折
bridge_subgraph_25056.graphml,哪种疾病在治疗过程中通常会结合气功、耳穴贴压疗法，并辅以心理干预和针灸？,亚健康失眠
bridge_subgraph_25067.graphml,哪种疾病会出现持续高热和细菌性肠炎，并且需要心理护理和抗生素治疗？,幼儿急疹
bridge_subgraph_25053.graphml,哪种疾病在孕期通过乳房保健护理可以预防，并且吸乳、情志护理及护理干预能作为其辅助治疗方法？,产后乳腺炎
bridge_subgraph_25062.graphml,哪种疾病在进行MPR重建影像学检查后，采用非手术治疗能较好地避免骨折延迟愈合的并发症？,胫骨平台骨折
bridge_subgraph_25068.graphml,哪种疾病在三维CT影像检查后常需坚强的内固定和足量的植骨治疗，且容易并发感染和术后切口感染？,胫骨平台骨折
bridge_subgraph_25059.graphml,哪种疾病在创伤性骨折和膝关节周围骨折的情况下，通常伴随较差的CT平扫结果？,胫骨平台骨折
bridge_subgraph_25063.graphml,哪种疾病在髁间棘撕脱骨折的并发症中，通过常规普通X线片检查较难发现，且术后并发症风险较高，尤其在年龄较大的人群中更为常见？,胫骨平台骨折
bridge_subgraph_25076.graphml,哪种疾病在临床护理干预和优质护理干预下，常表现出实质回声颗粒样增粗和骨质疏松？,病毒性肝炎肝硬化
bridge_subgraph_25072.graphml,哪种疾病在治疗过程中需要同时采用西药对症支持治疗、健脾、护理干预以及常规护理等多种辅助手段？,脾胃虚寒型慢性胃炎
bridge_subgraph_25065.graphml,哪种疾病在治疗过程中常需结合锁定加压接骨板、非锁定支持钢板这两种辅助治疗，并且还需要进行细致的护理和X线影像学检查？,胫骨平台骨折
bridge_subgraph_25073.graphml,哪种疾病在患者接受锁定钢板加自体髂骨植骨治疗后，因坠落伤导致，且需要通过磁共振成像（MRI检查）来进一步诊断？,胫骨平台骨折
bridge_subgraph_25057.graphml,哪种疾病在采用肺泡灌洗治疗的同时，需要特别关注孕粤孕情况，并且通常会在多层螺旋CT检查后进行相应的护理措施？,肺泡蛋白沉积症
bridge_subgraph_25071.graphml,哪种疾病在治疗过程中需要支撑钢板和围术期护理，并且常伴随心理护理和透射电镜检查？,胫骨平台骨折
bridge_subgraph_25074.graphml,哪种疾病会导致乳头凹陷，并可能转化为乳腺脓肿，同时在治疗中常采用传统治疗辅助中药的方法？,哺乳期乳腺炎
bridge_subgraph_25078.graphml,哪种疾病在临床护理路径中需要特别采用正压通气，并与其他护理方法和常规护理手段同时进行辅助治疗？,急性左心功能衰竭
bridge_subgraph_25079.graphml,哪种疾病在康复护理干预和B组病理分型的情况下，通常需要通过CT扫描进行影像学检查？,胫骨平台骨折
bridge_subgraph_25070.graphml,哪种疾病在采用Y形切口解剖钢板内固定治疗的同时，还需配合中西结合护理干预和围术期护理？,胫骨平台骨折
bridge_subgraph_25058.graphml,哪种疾病在治疗过程中既需要应用自理理论进行辅助治疗，又可能借助3D打印技术进行手术治疗，并且在诊断时常常需要同时进行CT检查和MRI影像学检查？,胫骨平台骨折
bridge_subgraph_25080.graphml,哪种疾病会出现血尿，并需要通过宫腔镜和腹腔镜检查，同时可能采用微创治疗和X线影像学检查？,宫内节育器异位
bridge_subgraph_25069.graphml,哪种疾病在男性患者中更常见，且通常需要通过复杂胫骨骨折的病理分型进行诊断，并采用取髂骨植骨的手术治疗，同时辅以健康宣教？,胫骨平台骨折
bridge_subgraph_25086.graphml,哪种疾病在采用内外联合入路和传统康复治疗的同时，也需要借助CT检查和手术治疗？,胫骨平台骨折
bridge_subgraph_25082.graphml,哪种疾病在治疗过程中需要特别注重饮食指导和围术期护理，并且常伴随心理护理，但其预后状况通常较差？,胫骨平台骨折
bridge_subgraph_25077.graphml,哪种疾病在采用单边双通道内镜技术进行手术治疗的同时，还需要结合MR影像学检查和中药及外科治疗？,腰椎椎管狭窄症
bridge_subgraph_25075.graphml,哪种疾病在进行三维重建及虚拟手术治疗后，使用C型臂X线机进行影像学检查时，容易出现术后切口感染，且常与B组病理分型相关？,胫骨平台骨折
bridge_subgraph_25089.graphml,哪种疾病在采用微创内固定技术治疗膝关节韧带损伤的同时，常伴随疼痛和抑郁症状？,胫骨平台骨折
bridge_subgraph_25087.graphml,哪种疾病在进行锁定钢板内固定术和功能复位的同时，还需要通过MRI和CT检查来辅助诊断，并且往往需要充分植骨来促进康复？,胫骨平台骨折
bridge_subgraph_25088.graphml,哪种疾病在进行胫骨平台骨折内固定术治疗后，常因高处坠落伤引起，并需要配合心理护理和综合护理进行辅助治疗？,胫骨平台骨折
bridge_subgraph_25090.graphml,哪种疾病在进行胫骨平台手术和普通解剖钢板治疗的同时，还需要进行CT平扫和心理护理？,胫骨平台骨折
bridge_subgraph_25081.graphml,哪种疾病在治疗过程中需要同时采用呋喃妥因药物和包括优质护理服务及综合护理在内的临床护理干预？,急诊手外伤
bridge_subgraph_25085.graphml,哪种疾病在治疗过程中需要使用酒石酸唑吡坦，且膀胱冲洗速度是其高危因素，同时需要配合心理护理和护理干预？,前列腺术后膀胱痉挛
bridge_subgraph_25095.graphml,哪种疾病在出现流泪症状后，通过结膜松弛症手术治疗后预后较好？,结膜松弛症
bridge_subgraph_25083.graphml,哪种疾病在平均43.5岁的人群中常见，且需要通过膝关节功能锻炼辅助治疗，同时在诊断时常需借助X线片，并可能与交通伤导致的并发症有关？,胫骨平台骨折
bridge_subgraph_25094.graphml,哪种疾病在青春期发病，通常需要用地屈孕酮治疗，并辅以活血化瘀和针灸治疗？,崩漏
bridge_subgraph_25092.graphml,哪种疾病在进行功能恢复练习和关节镜下复位内固定术后，预后状况仍然较差？,胫骨平台骨折
bridge_subgraph_25099.graphml,哪种疾病在骨科就诊时需要通过微创复位内固定手术治疗，并在术后需要进行护理康复锻炼？,胫骨平台骨折
bridge_subgraph_25098.graphml,哪种疾病在进行外科手术治疗时，采用传统内固定手术的比例高达28.1%？,胫骨平台骨折
bridge_subgraph_25097.graphml,哪种疾病会导致牙关紧闭，常与运动和感染有关，且预后较好？,横纹肌溶解综合征
bridge_subgraph_25091.graphml,哪种疾病在治疗过程中需要低浓度吸入麻醉和肺切除手术，并且常伴随心理护理和CT影像学检查？,重度肺气肿
bridge_subgraph_25084.graphml,哪种疾病在治疗过程中既需要中药汤剂内服，又适合采用微创内固定技术，并且还需配合护理干预和饮食护理？,胫骨平台骨折
bridge_subgraph_25093.graphml,哪种疾病在骨科就诊时常见，患者会表现为活动受限，且功能锻炼和针灸均为其辅助治疗方法？,胫骨平台骨折
bridge_subgraph_25105.graphml,哪种疾病在采用体位干预和肺炎治疗的同时，还需要进行手术治疗并通过CT进行检查？,胫骨平台骨折
bridge_subgraph_25102.graphml,哪种疾病在骨科就诊时，经磁共振成像检查后，采用外固定治疗辅助治疗效果不佳？,胫骨平台骨折
bridge_subgraph_25104.graphml,哪种疾病在胸腰段发病时，其X线平片和其他影像学检查结果具有典型特征？,椎体血管瘤
bridge_subgraph_25096.graphml,哪种社会学理论能够解释深静脉血栓、褥疮和胫骨平台骨折在特定人群中的高并发现象？,感染
bridge_subgraph_25115.graphml,哪种疾病在复杂型肺栓塞的诊断中，常常需要借助CT和关节镜技术进行检查？,胫骨平台骨折
bridge_subgraph_25101.graphml,哪种疾病既有不稳定骨折和骨质疏松作为高危因素，又常与Ⅳ型病理分型及内固定术治疗相关，并需要多元化护理作为辅助治疗？,胫骨平台骨折
bridge_subgraph_25100.graphml,哪种疾病在采用中西结合护理干预措施和微创治疗的同时，容易因跌倒和室内活动引发，并且常需借助容积成像进行影像学检查？,胫骨平台骨折
bridge_subgraph_25112.graphml,哪种疾病在采用叙事护理方法、自我效能护理干预的同时，结合中西医结合护理和康复训练作为辅助治疗效果最佳？,轻中型颅脑损伤
bridge_subgraph_25109.graphml,哪种疾病在治疗过程中需要结合人工膝关节置换术和桃红四物汤加减，并常常伴随使用多层螺旋CT检查和心理护理？,胫骨平台骨折
bridge_subgraph_25114.graphml,哪种疾病在成纤维细胞异常增生时，使用伊班膦酸钠治疗，并且需要通过CT和MPR进行影像学诊断？,CAF
bridge_subgraph_25117.graphml,哪种疾病在术后需要科学的功能锻炼辅助治疗，且常由高能量暴力引起，在进行多层螺旋CT扫描时能被清晰诊断？,胫骨平台骨折
bridge_subgraph_25111.graphml,哪种疾病需要进行钢板内固定手术或开放性切开复位锁定钢板内固定术，并且通常需要通过CT进行影像学检查？,胫骨平台骨折
bridge_subgraph_25120.graphml,哪种疾病在采用异氟醚药物治疗和护理干预辅助治疗的同时，也需要进行手术治疗，类似于冠心病的情况？,冠脉搭桥
bridge_subgraph_25119.graphml,哪种疾病需要进行膝部骨内压测定，并可能通过关节清扫或关节镜治疗来处理，且常与骨性关节炎相关？,退行性膝关节病
bridge_subgraph_25116.graphml,哪种疾病在进行微创内固定治疗外翻型损伤的同时，需要配合常规护理和舒适护理？,胫骨平台骨折
bridge_subgraph_25118.graphml,哪种疾病在采用微波热凝术和支撑喉镜联合内镜治疗的同时，也需要配合传统治疗，并且容易引发感染并发症？,会厌囊肿
bridge_subgraph_25106.graphml,哪种疾病在Ⅴ型骨折患者中常见，且需要结合传统x线和MRI进行诊断，同时还要特别注意饮食护理？,胫骨平台骨折
bridge_subgraph_25107.graphml,哪种疾病在腹腔镜下胃肠修补术后容易引发腹腔感染，并需要同时进行心理护理和护理干预？,急性胃肠穿孔
bridge_subgraph_25110.graphml,哪种疾病在胫骨平台后柱骨折的病理分型下，术后需要加强护理，并且通常需要通过CT扫描和MRI进行影像学检查？,胫骨平台骨折
bridge_subgraph_25123.graphml,哪种疾病在出现膝关节僵硬的临床表现时，可能需要通过X线影像学检查来诊断，并可能涉及到颈椎邻椎病或全髋关节置换的手术治疗？,翻修手术
bridge_subgraph_25121.graphml,哪种疾病需要进行塌陷骨折复位手术和抗生素抗感染治疗，且常通过螺旋CT或CT检查来确诊？,胫骨平台骨折
bridge_subgraph_25113.graphml,哪种疾病需要通过多层螺旋CT薄层扫描来准确评估伤情，并常同时使用多层螺旋CT扫描检查辅助治疗？,胫骨平台骨折
bridge_subgraph_25127.graphml,哪种疾病在治疗过程中需使用渴络欣胶囊，且常通过尿微量白蛋白肌酐比检查来监测，同时与患者年龄和护理措施密切相关？,糖尿病肾脏疾病
bridge_subgraph_25122.graphml,哪种疾病会导致饮酒后出现玻璃体黄斑黏着，且在男性患者中通过CT检查常见？,MH
bridge_subgraph_25124.graphml,哪种疾病在过伸损伤类病理分型中，常需通过MRI和MSCT影像学检查确诊，并适合采用微创手术进行骨折复位治疗？,胫骨平台骨折
bridge_subgraph_25103.graphml,哪种疾病在进行螺旋CT三维重建和骨折切开复位支持钢板内固定术后，预后较差且常需外科手术治疗？,胫骨平台骨折
bridge_subgraph_25108.graphml,哪种疾病在进行X线检查时常被误诊为成骨不全症，且在进行鼻部整形时易引发B组并发症？,血胸
bridge_subgraph_25126.graphml,哪种疾病在治疗过程中需要结合TGF-β药物治疗和手术切开减压，同时辅以优质护理干预和护理干预以提高疗效？,胫骨平台骨折
bridge_subgraph_25125.graphml,哪种疾病在治疗过程中需要同时采用锁定板加空心螺钉辅助治疗、64层CT重建手术治疗，并且还需要配合心理护理和中药药物治疗？,胫骨平台骨折
bridge_subgraph_25128.graphml,哪种疾病在颈动脉超声检测未发现复发的情况下，结合心理干预和MRI检查，能有效辅助治疗？,中老年脑梗死
bridge_subgraph_25136.graphml,哪种疾病在采用传统切开复位术或关节镜技术治疗的同时，还需要配合常规护理和CT影像学检查？,胫骨平台骨折
bridge_subgraph_25135.graphml,哪种疾病在肿块型病理分型下，通过免疫组织化学检查和MSCT、CT影像学检查能够同时被诊断？,肺MALT淋巴瘤
bridge_subgraph_25131.graphml,哪种疾病需要通过切开复位术或开窗植骨复位治疗，且患者常伴有抑郁和疼痛症状？,胫骨平台骨折
bridge_subgraph_25129.graphml,哪种疾病在进行空心加压螺钉内固定治疗的同时，配合多元化护理康复锻炼，并通过卡方检验和心理干预的效果评估，能显著提升患者康复效果？,胫骨平台骨折
bridge_subgraph_25140.graphml,哪种疾病在通过CT影像学检查后，需要与鼻咽癌进行鉴别诊断，并且在进行手术治疗的同时，还需配合个性化护理干预作为辅助治疗？,真菌性鼻-鼻窦炎
bridge_subgraph_25137.graphml,哪种疾病在进行尿培养和脑室腹腔分流术的同时，还需要特别重视围手术期护理和心理护理？,脊髓脊膜膨出
bridge_subgraph_25130.graphml,哪种疾病在治疗过程中常采用胫骨近端解剖钢板内固定辅助治疗和膝关节镜微创手术治疗，且患者常伴有焦虑症状，需使用万古霉素进行药物治疗？,胫骨平台骨折
bridge_subgraph_25139.graphml,哪种疾病在治疗过程中需要结合分期护理干预和球囊成形术，并且通常需要进行X线片检查和围手术期护理？,胫骨平台骨折
bridge_subgraph_25141.graphml,哪种疾病在常规切开复位内固定术后需要通过X线片检查来评估疗效，并需配合优质护理以预防感染并发症？,胫骨平台骨折
bridge_subgraph_25138.graphml,哪种疾病在围手术期护理中需要使用咪达唑仑TCI，且其发生率约为2.41%，与常规护理有何不同？,SICU
bridge_subgraph_25146.graphml,哪种疾病需要同时进行室间隔消融术和二尖瓣成形，并且常伴随磁共振成像检查和心理护理？,梗阻性肥厚型心肌病
bridge_subgraph_25132.graphml,哪种疾病在需要进行前后联合入路手术治疗的膝关节损伤患者中，因年龄因素而更易并发肺炎？,胫骨平台骨折
bridge_subgraph_25142.graphml,哪种疾病在活检确诊为纵隔肿瘤后，通常需要通过CT检查进一步评估，并可能采用微创手术进行治疗？,纵隔囊肿
