file,query,answer
bridge_subgraph_25560.graphml,哪种疾病会导致关节不稳定，通常需要通过胫骨近端解剖钢管内固定术治疗，且在CT检查后预后较好？,胫骨平台骨折
bridge_subgraph_25562.graphml,哪种疾病在糖尿病患者伴发感染时可能导致咽瘘，且在CT影像学检查中可见，并需要使用抗生素进行治疗？,颈深部脓肿
bridge_subgraph_25579.graphml,哪种疾病在治疗Segond骨折时需要特别重视功能锻炼的护理，并常伴随心理干预和抑郁的出现？,胫骨平台骨折
bridge_subgraph_25574.graphml,哪种疾病在采用前正中入路手术治疗时，通常需要结合DR、螺旋CT以及X线、多层螺旋CT等多种影像学检查来确诊？,胫骨平台骨折
bridge_subgraph_25568.graphml,哪种疾病在出现自发性蛛网膜下腔出血和夹闭瘤颈的同时，还需要特别注意饮食护理和预防感染？,脑动脉瘤破裂
bridge_subgraph_25548.graphml,哪种疾病在东部和西部地区多发，常需石膏制动辅助治疗，且易并发感染，并通过CT影像学检查进行诊断？,胫骨平台骨折
bridge_subgraph_25583.graphml,哪种疾病在治疗过程中需要特别采用认知护理和综合护理法，并且常常与硬膜外麻醉和常规护理方法同时使用？,脊柱结核手术
bridge_subgraph_25581.graphml,哪种疾病在实验室检查中常见结蛋白异常，且在内窥镜检查中通过肠镜发现，同时伴随MRI和X线影像学检查的异常表现？,多形性肉瘤
bridge_subgraph_25563.graphml,哪种疾病在进行锁定接骨板内固定治疗或关节镜下内固定术后，通过CT检查显示出较好的预后？,胫骨平台骨折
bridge_subgraph_25569.graphml,哪种疾病的发病率约为7.3%，且在辅助治疗中常涉及升主动脉瘤，同时可能伴随肺炎并发症和膝关节内骨折的治疗？,围手术期
bridge_subgraph_25584.graphml,哪种疾病在诊断时需要同时进行X线和MRI检查，并且在治疗中常采用无痛管理和骨折内固定术？,胫骨平台骨折
bridge_subgraph_25587.graphml,哪种疾病在治疗过程中需要畸形愈合和锁定钢板加自体髂骨植骨，并辅以康复训练和饮食护理？,胫骨平台骨折
bridge_subgraph_25582.graphml,哪种疾病在采用膝正中入路手术和微创锁定钢板技术治疗的同时，还需要护理干预和64层CT影像学检查辅助？,胫骨平台骨折
bridge_subgraph_25586.graphml,哪种疾病在治疗过程中需要植骨和锁定钢板置入，并辅以功能锻炼和护理干预？,胫骨平台骨折
bridge_subgraph_25578.graphml,哪种疾病在肺部感染风险评估因素和正常血钠水平组的病理分型下，最适合采用护理干预和综合护理作为辅助治疗？,急性重症脑卒中
bridge_subgraph_25596.graphml,哪种疾病在高甘油三酯血症和氧化磷脂的影响下，最需要通过护理干预或综合护理干预来有效管理？,急性坏死型胰腺炎
bridge_subgraph_25592.graphml,哪种疾病在出现粉碎性骨折的临床表现时，需要结合功能恢复练习和心理护理进行辅助治疗？,胫骨平台骨折
bridge_subgraph_25598.graphml,哪种疾病在治疗过程中常同时采用高压氧、TDP治疗和针灸作为辅助手段？,Bell's面瘫
bridge_subgraph_25577.graphml,哪种疾病在进行常规切开复位内固定治疗后，需要配合相应的康复计划，并且治疗期间还需同时进行常规护理和心理护理？,胫骨平台骨折
bridge_subgraph_25595.graphml,哪种疾病在小腿按压和护理干预辅助治疗下，同时需要通过三维数字化模型进行影像学检查，且年龄是其高危因素？,胫骨平台骨折
bridge_subgraph_25599.graphml,哪种疾病会导致慢性腹痛且常需手术治疗，并通过CT检查发现胰头部异常？,假性囊肿
bridge_subgraph_25594.graphml,哪种疾病在采用苏氏正骨法手术治疗的同时，还需进行内固定及术后早期功能锻炼，并且通常需要通过CT影像学检查来辅助诊断，且患者年龄是高危因素之一？,胫骨平台骨折
bridge_subgraph_25580.graphml,哪种疾病在需要取髂骨植骨手术治疗的同时，婚姻状况是其高危因素，且在进行健康宣教和舒适护理等辅助治疗后能有较好的恢复效果？,胫骨平台骨折
bridge_subgraph_25597.graphml,哪种疾病发病率高达21.7%，且患者常表现为急躁，并伴随抑郁和焦虑症状？,心理不适
bridge_subgraph_25602.graphml,哪种疾病在使用米索前列醇和小分次放疗的过程中，容易出现切口感染或感染的风险？,疤痕
bridge_subgraph_25591.graphml,哪种疾病在治疗过程中常需结合螺旋CT三维重建和虚拟手术，并且通常伴随微创手术和MRI检查？,胫骨平台骨折
bridge_subgraph_25608.graphml,哪种疾病在关节镜治疗后需要进行板内固定，并且通过CT检查显示预后良好？,胫骨平台骨折
bridge_subgraph_25600.graphml,哪种疾病最适合采用DGC和全腹腔镜三角吻合术进行治疗，并且常与微创手术相关，在特定年龄段患者中更为常见？,远端胃癌
bridge_subgraph_25603.graphml,哪种疾病在通过CT影像学检查确诊为非过伸损伤类胫骨平台骨折后，通常需要手术治疗并结合专业护理？,胫骨平台骨折
bridge_subgraph_25585.graphml,哪种疾病在进行跟骨牵引或小切口复位螺钉内固定术时，需要配合CT扫描和抗生素治疗？,胫骨平台骨折
bridge_subgraph_25589.graphml,哪种疾病在CT平扫时可见胃肠道间质瘤，且伴随颈动静脉向外或前外侧移位及疼痛症状？,神经源性肿瘤
bridge_subgraph_25590.graphml,哪种疾病在传统手术组和关节镜下小切口手术治疗中，常需要结合CT检查和MRI来确诊？,胫骨平台骨折
bridge_subgraph_25613.graphml,哪种疾病最适合采用Y形切口解剖钢板内固定治疗，并能在CT和磁共振成像下实现良好的复位？,胫骨平台骨折
bridge_subgraph_25606.graphml,哪种疾病在妊娠合并子宫肌瘤时需进行剖宫产手术治疗，同时需要心理护理辅助，且预后状况良好？,子宫收缩乏力性产后出血
bridge_subgraph_25601.graphml,哪种疾病在复位内固定手术治疗和优质护理干预预防的同时，还需要进行影像学检查，特别是MRI检查？,胫骨平台骨折
bridge_subgraph_25611.graphml,哪种疾病需要加强术前、术后的护理辅助治疗，并常通过64层CT进行影像学检查，同时患者会出现疼痛和抑郁的临床表现？,胫骨平台骨折
bridge_subgraph_25609.graphml,哪种疾病在膝关节过伸暴力后需通过关节镜下小切口手术进行治疗，并常伴随CT检查和心理护理？,胫骨平台骨折
bridge_subgraph_25588.graphml,哪种疾病在影像学检查中会出现金属放射状伪影，且常需通过常规切开复位内固定治疗，同时患者可能会出现抑郁症状，并需要心理护理辅助治疗？,胫骨平台骨折
bridge_subgraph_25612.graphml,哪种疾病在踝关节发病时，既需要中药治疗，又可能需要进行膝关节置换术，并且通常需要通过MRI进行影像学检查？,胫骨平台骨折
bridge_subgraph_25593.graphml,哪种疾病在胫骨平台双髁骨折后容易引发深静脉血栓形成，且在非手术治疗和术后护理中都需要特别关注？,胫骨平台骨折
bridge_subgraph_25615.graphml,哪种疾病在采用常规护理和低压间断灌注法进行辅助治疗时，能有效缓解疼痛？,胫骨平台骨折
bridge_subgraph_25622.graphml,哪种疾病在23至57岁人群中多发，且早期手术配合优质护理对治疗有效，常由高处坠落伤引起？,外伤性十二指肠损伤
bridge_subgraph_25614.graphml,哪种疾病在治疗过程中需要结合系统心理护理、常规功能锻炼和综合护理，并且常常需要进行X线平片检查？,胫骨平台骨折
bridge_subgraph_25607.graphml,哪种疾病需要通过MRI和CT检查，并可能采用胫骨平台复位和3D打印技术进行手术治疗？,胫骨平台骨折
bridge_subgraph_25610.graphml,哪种疾病在临床表现上常伴随心理干预，且在辅助治疗中需要结合健康教育与心理护理，同时还包括常规护理？,抑郁焦虑
bridge_subgraph_25621.graphml,哪种疾病发病率高达35.7%，手术时间长且需心理干预辅助治疗，常伴随疼痛症状？,CPSP
bridge_subgraph_25605.graphml,哪种疾病在治疗过程中需要采用低盐低脂饮食和神经内科常规护理，并常伴随社区康复治疗，且患者年龄是重要的风险评估因素？,初发脑卒中
bridge_subgraph_25604.graphml,哪种疾病在治疗过程中常需采用低压间断灌注法辅助，并可能涉及切开复位内固定、钢板螺钉固定以及锁定钢板内固定术等手术治疗？,胫骨平台骨折
bridge_subgraph_25617.graphml,哪种疾病在膝关节骨折的X线影像学检查后，最适合采用综合护理干预或护理干预作为辅助治疗？,胫骨平台骨折
bridge_subgraph_25624.graphml,哪种疾病在充分填充植骨和后外侧骨折块的情况下，通常需要通过MRI检查并可能进行手术治疗？,胫骨平台骨折
bridge_subgraph_25616.graphml,哪种疾病需要通过寰枢椎融合术或前路经寰枢关节螺钉内固定术治疗，并且通常需要进行CT检查来确诊？,寰枢椎不稳定
bridge_subgraph_25628.graphml,哪种疾病在血常规检查后需要特别注重优质护理和常规护理的管理？,心内科疾病
bridge_subgraph_25618.graphml,哪种疾病在治疗时需要采用切开复位内固定和联合手术入路，同时还需要进行X线片检查和配合心理护理？,胫骨平台骨折
bridge_subgraph_25623.graphml,哪种疾病在进行关节镜手术后，平均33.8岁的患者接受综合护理干预比常规护理效果更好？,胫骨平台骨折
bridge_subgraph_25627.graphml,哪种疾病在采用舒筋洗药护理时，特别需要注意SchatzkerⅤ、Ⅵ型骨折，且与患者年龄密切相关？,胫骨平台骨折
bridge_subgraph_25619.graphml,哪种疾病在治疗时通常需要采用切开复位联合钢板固定或经皮钢板固定手术，并且常通过CT和X线平片进行影像学检查？,胫骨平台骨折
bridge_subgraph_25626.graphml,哪种疾病在采用关节镜辅助治疗和骨诱导人工骨植骨治疗的同时，还需要通过磁共振成像（MRI）进行检查？,胫骨平台骨折
bridge_subgraph_25620.graphml,哪种疾病在男性中发病率较高，且其基层管理路径中常采用针灸作为辅助治疗，同时空腹血糖是其高危因素？,ASCVD
bridge_subgraph_25625.graphml,哪种疾病在进行骨折切开复位支持钢板内固定术和稳定内固定的同时，还需要配合饮食指导和心理干预？,胫骨平台骨折
bridge_subgraph_25635.graphml,哪种疾病在实验室检查中表现为血清及前列腺液MIP-2升高，主要由大肠埃希菌引起，并需配合一般护理和抗生素治疗？,老年慢性前列腺炎
bridge_subgraph_25633.graphml,哪种疾病在进行膝关节X线平片检查时，常伴随关节面平整的辅助治疗，且同时需要x 2检验和磁共振成像的辅助诊断？,胫骨平台骨折
bridge_subgraph_25634.graphml,哪种疾病在受伤至手术时间较长的情况下，需要采用解剖锁定钢板治疗，并且在进行手术治疗的同时，还必须配合心理护理？,胫骨平台骨折
bridge_subgraph_25637.graphml,哪种疾病在进行3DCT检查和切口切开复位治疗的同时，也需要与传统手术和CT检查相结合？,胫骨平台骨折
bridge_subgraph_25636.graphml,哪种疾病在患者有糖尿病史的情况下，常表现为吞咽障碍，且可以通过针灸治疗和护理干预进行辅助治疗？,老年急性脑卒中
bridge_subgraph_25630.graphml,哪种疾病在关节镜下治疗和引导小切口手术治疗中效果较好，且常与褥疮同时出现？,胫骨平台骨折
bridge_subgraph_25639.graphml,哪种疾病在治疗过程中需要诱导骨基质植入和功能性恢复锻炼，且常伴随MSCT和16层螺旋CT扫描的使用？,胫骨平台骨折
bridge_subgraph_25641.graphml,哪种疾病在使用非锁定支持钢板治疗和螺旋CT三维成像技术的同时，手术治疗效果最令人满意？,胫骨平台骨折
bridge_subgraph_25646.graphml,哪种疾病需要同时进行双侧锁定钢板内固定手术和腘动脉损伤静脉移植修复术的外科治疗？,胫骨平台骨折
bridge_subgraph_25647.graphml,哪种疾病在术后容易引发切口感染，术前常伴随下肢DVT，且在MRI和螺旋CT检查中均有表现？,胫骨平台骨折
bridge_subgraph_25632.graphml,哪种医学内容在Ⅱ度唇裂的治疗中采用改良Millard方法，并配合螺旋CT检查，能实现效果理想？,单侧唇裂
bridge_subgraph_25645.graphml,哪种疾病在治疗过程中常需结合经皮钢板固定技术和微创复位内固定，且通常伴随植骨手术和三维CT检查？,胫骨平台骨折
bridge_subgraph_25643.graphml,哪种疾病在治疗过程中需要同时采用拉力螺丝钉和SchatzkerⅤ、Ⅵ型方法，并辅以心理干预和常规护理？,胫骨平台骨折
bridge_subgraph_25651.graphml,哪种疾病在进行ELISA和SAP检测时，常常伴随CT检查和七叶皂苷钠的使用？,急性轻型胰腺炎
bridge_subgraph_25644.graphml,哪种疾病在采用外支架手术治疗髌骨骨折时，需要特别配合舒适护理，而常规护理组则难以达到同样的效果？,胫骨平台骨折
bridge_subgraph_25631.graphml,哪种疾病需要进行关节镜辅助下微创手术和双钢板内固定术，并且通常在MRI检查后进行外科治疗？,胫骨平台骨折
bridge_subgraph_25629.graphml,哪种疾病在彩色多普勒超声显像中显示心脏结构异常，且常同时通过CT和磁共振成像进行诊断？,CCH
bridge_subgraph_25650.graphml,哪种疾病在进行个案管理护理干预时，通常需要结合常规X线检查、MRI检查和CT等多种影像学检查手段？,胫骨平台骨折
bridge_subgraph_25652.graphml,哪种疾病因高能量损伤引起，需进行疼痛护理，同时手术治疗预后较好？,胫骨平台骨折
bridge_subgraph_25656.graphml,哪种疾病在CT和X线检查中常见毛刺征，且需要进行EGFR基因检测？,周围型肺腺癌
bridge_subgraph_25649.graphml,哪种疾病在术后康复过程中是高危因素，常伴随膝关节改变，并且患者容易出现焦虑，需要优质护理作为辅助治疗？,胫骨平台骨折
bridge_subgraph_25642.graphml,哪种疾病在需要进行植骨填塞和外科治疗的同时，还常伴有焦虑症状，且可以通过CT检查进行诊断？,胫骨平台骨折
bridge_subgraph_25648.graphml,哪种疾病在进行视野检查时常发现中心凹下脉络膜厚度薄，且在手术治疗时需特别考虑患者年龄风险？,病理性近视
bridge_subgraph_25638.graphml,哪种疾病在进行DR检查和前交叉韧带重建术后，通常还需要通过透射电镜和MRI来进一步诊断？,胫骨平台骨折
bridge_subgraph_25640.graphml,哪种疾病在进行膝关节镜检查时常被诊断出，且通常由创伤性关节炎导致，同时需要通过CT或CT扫描进行进一步影像学确认？,胫骨平台骨折
bridge_subgraph_25654.graphml,哪种疾病会导致皮肤粗糙，并且可以通过光子嫩肤技术辅助治疗，同时可能需要外科手术和中药配合治疗？,皮肤光老化
bridge_subgraph_25655.graphml,哪种疾病在治疗时通常需要进行腮腺浅叶腺体部分切除术或区域性和浅叶切除术，并辅以卡方检验和术后护理？,腮腺浅叶良性肿瘤
bridge_subgraph_25658.graphml,哪种疾病在需要进行全膝关节置换和被诊断为KOA时，通常会通过运动治疗并借助X线进行检查？,单侧膝关节骨性关节炎
bridge_subgraph_25664.graphml,哪种疾病需要特别加强临床观察和皮肤护理，同时还要注意并发症护理和健康宣教？,糖尿病合并酮症酸中毒
bridge_subgraph_25657.graphml,哪种疾病在诊断时需同时使用三维超声微成像系统和CT、MRI，并在治疗中首选ORP手术？,前列腺肿瘤
bridge_subgraph_25653.graphml,哪种疾病在CT扫描中会同时出现肠壁积气和门静脉积气的影像学表现？,急性肠系膜血管梗塞
bridge_subgraph_25666.graphml,哪种疾病在进行双侧钢板内固定术和三维CT重建的同时，还需要特别重视护理干预和心理护理？,胫骨平台骨折
bridge_subgraph_25661.graphml,哪种医学内容与药敏试验、健康人群流行性脑脊髓膜炎直接相关，且常与关节炎、卡方检验同时出现？,流脑
bridge_subgraph_25659.graphml,哪种疾病在采用中西医结合护理辅助治疗的同时，常通过非手术治疗和X线片影像学检查来应对肺栓塞这一并发症？,胫骨平台骨折
bridge_subgraph_25662.graphml,哪种疾病在治疗时需要结合视网膜静脉阻塞的病因分析、生活技能训练和心理护理，并且常用卡方检验作为实验室检查手段？,低视力
bridge_subgraph_25663.graphml,哪种疾病在男性患者中常见，且需要结合贝克自杀意念量表评估和直接淋巴管造影检查，同时可能需要手术治疗？,PIL
bridge_subgraph_25672.graphml,哪种疾病在MRI检查中表现为病灶膨胀，并可能并发动脉瘤性骨囊肿？,软骨细胞瘤
bridge_subgraph_25669.graphml,哪种疾病在CT检查中表现为肺泡间隔增宽，且通常需要使用抗胸腺细胞球蛋白进行治疗？,卡氏肺囊虫肺炎
bridge_subgraph_25660.graphml,哪种疾病在20~54岁人群中多发，平均发病年龄为33.8岁，需要通过诱导骨基质植入手术治疗，并常伴随心理干预和护理干预作为辅助治疗？,胫骨平台骨折
bridge_subgraph_25668.graphml,哪种疾病在胫骨平台骨折并发症中，通过联合检查发现，且在抗凝治疗时需特别关注DVT风险评估？,肺栓塞
bridge_subgraph_25677.graphml,哪种疾病在一般护理和康复训练中需要特别注意非过伸损伤类胫骨平台骨折的辅助治疗？,胫骨平台骨折
bridge_subgraph_25665.graphml,哪种疾病在贴附于眶壁增长时，需要通过摘除手术进行治疗，并且常伴随X线或CT影像学检查？,泪腺腺样囊性癌
bridge_subgraph_25671.graphml,哪种疾病会导致膝关节功能障碍，需要通过同种异体骨植入手术治疗，并且在使用抗生素药物治疗后仍可能出现感染并发症？,胫骨平台骨折
bridge_subgraph_25670.graphml,哪种疾病在胫骨平台双髁骨折后需要进行冰袋冷敷，并且通常伴随ORIF手术和X线片检查？,胫骨平台骨折
bridge_subgraph_25675.graphml,哪种疾病在实验室检查中常通过血脂指标和化学发光法进行诊断，并且需要配合饮食护理和康复训练进行辅助治疗？,脑梗死急性期
bridge_subgraph_25681.graphml,哪种疾病在治疗过程中需要内镜下治疗和术后辅助治疗，并且通常会同时进行CT扫描和外科手术？,食管肿瘤
bridge_subgraph_25673.graphml,哪种疾病在临床护理途径中需要特别关注血清中β-淀粉样蛋白的检测，并且通常会同时采用早期康复护理和早期康复训练作为辅助治疗？,脑出血病
bridge_subgraph_25676.graphml,哪种疾病在早期功能锻炼和微创手术辅助治疗的同时，还需要通过X线诊断和CT进行影像学检查？,胫骨平台骨折
bridge_subgraph_25674.graphml,哪种疾病在治疗过程中常伴随行动脉损伤和跨关节临时外固定支架固定，并且需要特别关注患者的心理护理和疼痛管理？,胫骨平台骨折
bridge_subgraph_25679.graphml,哪种疾病在CT增强扫描中出现空泡征，且常通过CT或多层螺旋CT检查发现？,小肺癌
bridge_subgraph_25680.graphml,哪种疾病在尿毒症顽固性高血压（病理分型）且CRP升高的情况下，更需要个性化护理和有效的护理干预？,HFHD
bridge_subgraph_25678.graphml,哪种疾病在治疗过程中需要坚强的内固定或解剖钢板内固定配合中药外洗，并且常通过CT图像检查，容易出现感染并发症？,胫骨平台骨折
bridge_subgraph_25683.graphml,哪种疾病适合通过口服自拟复旧汤、艾灸阴交穴位以及结合常规护理和综合护理来进行治疗？,产后恶露不绝
bridge_subgraph_25691.graphml,哪种疾病在DHS治疗和半髋关节置换过程中，常与骨质疏松和护理问题同时出现？,老年粗隆间骨折
bridge_subgraph_25686.graphml,哪种疾病在浙江地区多发，且在进行腹部B超检查时常同时需要进行X线片和X线影像学检查？,FCPD
bridge_subgraph_25692.graphml,哪种疾病在进行微创内固定术后，患者焦虑的发生率高达90.8%，并且与患者年龄有关？,胫骨平台骨折
bridge_subgraph_25685.graphml,哪种疾病在常规教育、FTP（同义词）、护理干预及并发症护理的辅助治疗中最为常见？,胫骨平台骨折
bridge_subgraph_25684.graphml,哪种疾病在血培养中常见，且需使用罗红霉素中空栓剂治疗，同时在MRI检查中有所表现，并常伴随抗生素的使用？,儿科疾病
bridge_subgraph_25687.graphml,哪种疾病会出现呕吐和死亡的临床表现，并且需要通过CT和MRI检查来诊断？,急性中毒性脑病
bridge_subgraph_25682.graphml,哪种疾病在中国东部地区多发，常伴有钢板外露并发症，且在治疗过程中需要接受CT检查和丹参注射液治疗？,胫骨平台骨折
bridge_subgraph_25696.graphml,哪种疾病在MRI影像分析中表现明显，且常伴随疼痛，需通过微创手术治疗？,脊髓血管母细胞瘤
bridge_subgraph_25701.graphml,哪种疾病在进行常规健康教育和氧疗的同时，还需要配合护理干预和护理来辅助治疗？,突发性耳聋伴耳鸣
bridge_subgraph_25667.graphml,哪种疾病在骨折损伤方式风险评估后，常需通过关节镜下手术进行治疗，且在诊断过程中会进行CT检查，并可能使用地奥司明作为药物治疗？,胫骨平台骨折
bridge_subgraph_25697.graphml,哪种疾病会导致神经系统不适，且在MRI和CT扫描检查中可见异常，同时需要使用西洛他唑片进行治疗？,老年脑血管疾病
bridge_subgraph_25689.graphml,哪种疾病在采用中药治疗的同时，还需要配合针灸和心理治疗，且其病因常与肾气不足有关？,小儿遗尿症
bridge_subgraph_25694.graphml,哪种疾病在进行锁定加压钢板内固定手术治疗时，CT扫描显示不佳，且影像学检查结果也不理想？,胫骨平台骨折
bridge_subgraph_25700.graphml,哪种疾病在采用传统切开复位治疗的同时，还需要配合心理干预和心理护理来应对骨关节炎的并发症？,胫骨平台骨折
bridge_subgraph_25688.graphml,哪种疾病在进行品管圈活动和动脉压迫止血器干预的同时，还需要围术期护理和舒适护理作为辅助治疗？,脑血管介入术
bridge_subgraph_25698.graphml,哪种疾病在火针辅助治疗后，通过MRI和关节镜检查常被诊断为肩关节脱位或孟唇损伤？,膝关节侧副韧带损伤
bridge_subgraph_25707.graphml,哪种疾病在骨科外科手术后需要精细化康复训练治疗，并且配合优质护理干预和常规护理？,胫骨平台骨折
bridge_subgraph_25693.graphml,哪种疾病在男性患者中较为常见，且通常需要通过MRI影像学检查来诊断，治疗时可能采用充分填充植骨作为辅助手段，以及关节镜辅助有限切开的手术方法？,胫骨平台骨折
bridge_subgraph_25690.graphml,哪种疾病会导致活动受限，且常通过双切口双钢板内固定治疗，同时在CT和MRI影像学检查中有所表现？,胫骨平台骨折
bridge_subgraph_25699.graphml,哪种疾病在近4年内窥镜中心肠镜检查中，常与影像学检查及多层螺旋CT同时出现？,回盲部病变
bridge_subgraph_25706.graphml,哪种疾病在康复训练中需要特别关注Segond骨折，并且在出院和饮食指导中也需同时注意？,胫骨平台骨折
bridge_subgraph_25695.graphml,哪种疾病在进行数字X射线摄影和膝正中入路手术后，通常需要康复治疗，并且其疗效评估常采用卡方检验？,胫骨平台骨折
bridge_subgraph_25702.graphml,哪种疾病在病理分型上与HIV/AIDS相关，且在临床表现上常伴有头痛，同时需要通过CT诊断进行影像学检查？,继发性肺结核
bridge_subgraph_25710.graphml,哪种疾病在彩色多普勒超声检查中表现为非钙化型，且常与Ⅲ型和Ⅰ型同时出现？,钙化型
bridge_subgraph_25703.graphml,哪种医学内容在推拿手法和研磨复位技术的应用中，常与MRI和MSCT同时出现？,胫骨平台骨折
bridge_subgraph_25715.graphml,哪种疾病在CT影像学检查中表现为增强均匀，且常伴有胰管结石并发症，预后状况较差？,壶腹部癌
bridge_subgraph_25705.graphml,哪种疾病需要通过人工颈椎间盘置换和颈前入路治疗，并且常伴随内固定手术和多层螺旋CT检查？,颈椎疾病
bridge_subgraph_25711.graphml,哪种疾病在治疗过程中既需要通过骨折X线影像学检查和MRI检查来确诊，又需要小腿按压和心理护理作为辅助治疗？,胫骨平台骨折
bridge_subgraph_25704.graphml,哪种疾病在男性患者中较为常见，且在治疗过程中常需辅助使用高压氧和生长抑素，同时也会配合中药进行治疗？,放射性肠炎
bridge_subgraph_25713.graphml,哪种疾病会出现腹痛且常伴有重症急性胰腺炎并发症，并在诊断时需要X线检查，治疗过程中需特别注重护理？,麻痹性肠梗阻
