file,query,answer
bridge_subgraph_12459.graphml,哪种疾病在使用硝酸甘油后，距上次妊娠时间超过12个月的女性中容易出现肾转移，并伴随呕吐症状？,GTN
bridge_subgraph_12450.graphml,哪种疾病在临床上表现为艾滋病感染，同时抑郁症状是其高危因素，且中医针灸和针灸常被作为辅助治疗方法？,失眠
bridge_subgraph_12460.graphml,哪种疾病更容易在患有青光眼白内障和糖尿病的人群中出现，且常伴随高眼压和高血压病史？,黄斑囊样水肿
bridge_subgraph_12453.graphml,哪种疾病在男性中较为常见，且在治疗过程中特别需要系统的循证护理以及通过正常化、鼓舞与赞许等辅助手段来帮助患者，同时常伴有高血压的临床表现？,失眠
bridge_subgraph_12463.graphml,哪种疾病可以通过耳穴压丸或耳穴按压联合康复治疗，同时常见于OSAHS和原发性高血压患者？,失眠
bridge_subgraph_12465.graphml,哪种疾病在治疗后会出现嗜睡症状，临床表现为颈椎病颈痛，并且常需通过高压氧辅助治疗和磁共振成像进行检查？,失眠
bridge_subgraph_12461.graphml,哪种疾病在男性患者中常见，且在治疗时需要脚踝针上1和护理干预，同时临床表现包括异菸肼的使用？,失眠
bridge_subgraph_12467.graphml,哪种疾病的发病机制与急性T淋巴细胞白血病相似，且其病因与脓毒症、支气管哮喘和食管癌有关？,Wnt信号通路
bridge_subgraph_12473.graphml,哪种疾病在女性中同时出现ADHD和MCI，并且可以通过CB测定来诊断？,MMN
bridge_subgraph_12470.graphml,哪种疾病在彩色多普勒超声检查中表现为右心系统异常，且常与子宫肌瘤和胸闷症状同时出现？,静脉内平滑肌瘤病
bridge_subgraph_12466.graphml,哪种疾病在血常规检查异常时，通过耳穴压豆联合艾条灸治疗，并且常伴随高压氧治疗和呕吐症状？,失眠
bridge_subgraph_12471.graphml,哪种疾病在自我训练和舒适护理辅助治疗下，仍因难治性重症肌无力导致惊厥的临床表现？,失眠
bridge_subgraph_12476.graphml,哪种疾病会导致语言障碍、认知功能障碍和慢性疼痛，且头MRI检查有异常表现？,皮质基底节综合征
bridge_subgraph_12469.graphml,哪种医学内容在个体化心理治疗和慢性乙型肝炎的治疗中，同时也会涉及到艾灸和腰椎间盘突出症的治疗？,失眠
bridge_subgraph_12472.graphml,哪种疾病既有混合型病理分型，又需要认知心理治疗辅助，且常伴随先兆流产和甲状腺功能亢进的临床表现？,失眠
bridge_subgraph_12468.graphml,哪种疾病在治疗过程中使用泡沫硬化剂，且常伴随深静脉血栓、疼痛和血瘀证的出现？,血栓性浅静脉炎
bridge_subgraph_12464.graphml,哪种疾病在治疗过程中最常同时出现贫血和腹泻，并且最适合采用针刺联合心理疗法，通过心理测量、访谈以及心理咨询来辅助治疗？,失眠
bridge_subgraph_12462.graphml,哪种疾病会导致颞骨病变并伴随Ⅴ~Ⅵ级神经受损，同时可能伴有带状疱疹或肿瘤的出现？,面神经
bridge_subgraph_12482.graphml,哪种疾病会导致睡眠质量较差、老年性痴呆，并且常伴有腹泻，尤其在高龄人群中更容易出现？,失眠
bridge_subgraph_12477.graphml,哪种疾病在终末期肾脏疾病患者中常见，且在进行维持性血液透析的同时，需要通过心脏超声进行检查？,失眠
bridge_subgraph_12474.graphml,哪种疾病在超声消融组中常见，且老年急性心肌梗塞是其高危因素，同时伴有恶心和呕吐的临床表现？,失眠
bridge_subgraph_12480.graphml,哪种疾病需要采用掌侧V-Y推进皮瓣或指动脉背侧支岛状皮瓣手术，并辅以针对性护理和高压氧治疗？,指端缺损
bridge_subgraph_12478.graphml,哪种疾病在出现BH4D和苯二氮卓类药物使用的同时，常伴随呕吐和中毒症状？,失眠
bridge_subgraph_12479.graphml,哪种疾病在16至54岁人群中常见，且男性更易患，通常需要高渗盐水湿敷治疗，并可能伴有感染并发症？,皮脂腺囊肿
bridge_subgraph_12481.graphml,哪种疾病在出现血脂异常和年龄较大的情况下，通常需要通过颈、椎动脉血流阻力指数检查来诊断，并可能采用经颅磁刺激治疗作为辅助疗法？,失眠
bridge_subgraph_12484.graphml,哪种疾病在需要进行扁桃体摘除手术和小儿鼾症治疗的同时，还可能涉及OSAHS的手术治疗和心理护理的辅助治疗？,扁桃体摘除
bridge_subgraph_12488.graphml,哪种疾病会导致逍遥散治疗后易汗，并且患者可能需要血液透析，同时伴随嗜睡症状？,失眠
bridge_subgraph_12475.graphml,哪种疾病在辅助检查中常用焦虑自评量表(SAS)，且在辅助治疗中常采用针刺加穴位注射、食疗和运动疗法？,失眠
bridge_subgraph_12486.graphml,哪种疾病在肠内营养和TC的影响下，常伴随神经系统和细胞因子的异常表现？,危重病
bridge_subgraph_12494.graphml,哪种疾病会导致睡眠效率下降，且与情绪心理精神因素密切相关，通常需要通过健康宣教和健康教育来辅助治疗？,失眠
bridge_subgraph_12490.graphml,哪种疾病在听音乐作为辅助治疗的同时，常表现出卒中和骨痛，且可能与慢性乙型肝炎相关？,失眠
bridge_subgraph_12483.graphml,哪种疾病在使用益肺活血颗粒治疗的同时，常伴随噻托溴铵的使用和失眠症状的出现，类似于慢性阻塞性肺疾病的情况？,COPD
bridge_subgraph_12487.graphml,哪种疾病可以通过茯苓-远志中药足浴联合穴位按摩，并在神经内科治疗中结合磁共振成像进行有效诊治？,失眠
bridge_subgraph_12495.graphml,哪种疾病在进行营养风险筛查时常与软组织内异物有关，且患者可能同时需要骨折治疗和心理治疗？,地震伤
bridge_subgraph_12498.graphml,哪种疾病在采用综合护理方式和医护一体化模式辅助治疗的同时，还需通过养成良好的生活习惯进行预防，并常伴随精神症状的临床表现？,糖尿病低血糖
bridge_subgraph_12496.graphml,哪种疾病在具有CRP高危因素的情况下，需要进行单纯冠状动脉旁路移植术治疗，并且常与急性冠状动脉综合征相关，需要与ACS进行鉴别诊断？,冠心病
bridge_subgraph_12491.graphml,哪种疾病在男性中更常见，并且可以通过全自动血细胞分析仪筛查和反向斑点杂交法、基因检测来确诊？,β-地贫
bridge_subgraph_12493.graphml,哪种疾病在纠正不良睡眠习惯和改善婚姻、家庭及健康状况后，仍可能出现癫痫发作，且治疗后症状类似精神分裂症？,失眠
bridge_subgraph_12485.graphml,哪种疾病常见于长时间（≥4小时/天）使用电子产品的军官，且可能与更年期综合症同时出现，表现为头痛并需通过磁共振成像进行诊断？,失眠
bridge_subgraph_12500.graphml,哪种疾病会导致心神失养，并可能引发脑梗死，同时在磁共振和脑电图检查中有所表现？,失眠
bridge_subgraph_12489.graphml,哪种疾病在手术治疗中老年股骨胫骨骨折或股骨颈骨折时，更常伴随常规护理和护理干预作为辅助治疗？,骨折内固定术
bridge_subgraph_12492.graphml,哪种疾病在治疗过程中常采用直流感应电疗机和黄连肉桂汤，同时需要配合整体护理，且患者常出现皮疹症状？,失眠
bridge_subgraph_12502.graphml,哪种疾病在治疗过程中需要同时使用益心舒胶囊和心可舒片联合黛力新，并配合特殊护理干预？,冠心病合并焦虑症
bridge_subgraph_12503.graphml,哪种症状在使用疏肝调神针刺法治疗瘢痕癌时，常与失眠和焦虑同时出现？,抑郁
bridge_subgraph_12497.graphml,哪种疾病在治疗过程中需要同时进行超声探查和各项生命体征监测，并常伴随使用地西泮和体格检查？,严重多发伤
bridge_subgraph_12499.graphml,哪种疾病在足浴治疗作为辅助手段时，常因阴阳失交而引发，且在化疗过程中与原发性肝癌同时出现？,失眠
bridge_subgraph_12505.graphml,哪种症状可能同时伴随血小板减少、白细胞减少、皮疹以及COPD的出现？,发热
bridge_subgraph_12504.graphml,哪种疾病会导致怕热多汗、脑梗死和血脂异常，并且与蒸馏水有一定关联？,失眠
bridge_subgraph_12501.graphml,哪种疾病在男性中较为常见，且需要通过HCT和冠状动脉造影来诊断，同时辅以健康教育进行治疗？,高值血压
bridge_subgraph_12506.graphml,哪种疾病在采用氯化锂治疗和肢体功能训练后，预后生存率可达66.7%，且常与糖尿病相关？,失眠
bridge_subgraph_12510.graphml,哪种疾病既有AD相关症状，又属于“不荣则痛”的病理分型，在治疗时常用中医药结合针灸疗法？,痛证
bridge_subgraph_12514.graphml,哪种疾病适合采用耳穴贴压治疗和胃，并且常与苦参相关，尤其多见于女性？,失眠
bridge_subgraph_12511.graphml,哪种疾病在采用耳穴贴压结合放松训练辅助治疗时，常伴随心动过速和肝功能异常，且其临床表现与PT有关？,失眠
bridge_subgraph_12508.graphml,哪种医学内容在评估住院精神病病人的康复疗效时，与住院病人观察量表、汉密尔顿抑郁量表及康复护理密切相关？,IPROS
bridge_subgraph_12513.graphml,哪种疾病在病情监测和传统护理方法辅助治疗的同时，也常与心血管疾病的手术治疗及急性心肌梗死的辅助治疗相关联？,心血管介入治疗
bridge_subgraph_12509.graphml,哪种社会学理论能解释帕罗西汀治疗星形细胞肿瘤与脑肿瘤的磁共振影像学差异？,肿瘤
bridge_subgraph_12507.graphml,哪种疾病在出现周期性胃肠道移行性复合肌电运动的同时，还可能伴随原发性肝癌并需要使用环磷酰胺进行化疗？,MMC
bridge_subgraph_12521.graphml,哪种疾病在病情变化时会出现腹泻和皮疹，并且可以通过金纳多进行治疗？,失眠
bridge_subgraph_12515.graphml,哪种疾病在睡觉体位不当的情况下容易引发，且适合用子午流注纳支法治疗，同时常伴有焦虑和冠心病症状？,失眠
bridge_subgraph_12512.graphml,哪种疾病在急性肾损伤和胃肠道病变的临床表现中，通过酶联免疫吸附试验确诊，且常与自身免疫性疾病相关？,系统性硬化
bridge_subgraph_12518.graphml,哪种疾病在心脏超声检查中常发现OSA并发症，且针灸和针刺治疗作为其辅助治疗方法？,失眠
bridge_subgraph_12524.graphml,哪种医学内容更适用于诊断迁延不愈的脓肿和乳腺癌，磁共振成像还是超声？,非哺乳期乳腺炎
bridge_subgraph_12527.graphml,哪种疾病在PET/CT检查中可能出现溃疡，并伴随发热和疲乏的症状？,大血管炎
bridge_subgraph_12517.graphml,哪种疾病在采用小剂量米氮平治疗的同时，常伴随发热的临床表现，且需要心理护理作为辅助治疗，类似于结核病的情况？,失眠
bridge_subgraph_12519.graphml,哪种疾病在治疗过程中常需使用金芪降糖片和褪黑素，且需进行心电图检查，并容易并发心血管疾病？,糖尿病心血管并发症
bridge_subgraph_12526.graphml,哪种疾病会导致参苓白术散合桃花汤和锌缺乏，同时伴有恶心和呕吐的症状？,迁延性腹泻
bridge_subgraph_12525.graphml,哪种疾病会导致收缩压异常、低转运骨病，并且常与糖尿病和贫血同时出现？,老年MHD
bridge_subgraph_12523.graphml,哪种医学内容在涉及老年髋部骨折和抑郁障碍的同时，还常常与男性和贫血相关？,失眠
bridge_subgraph_12516.graphml,哪种疾病在采用蒙药结合艾灸治疗的同时，常伴随磁共振检查和癫痫症状，且与老年期痴呆相关？,失眠
bridge_subgraph_12520.graphml,哪种疾病在出现线粒体肿胀的临床表现和再狭窄组的实验室检查结果时，常伴随恶性肿瘤的实验室检查和脑出血的药物治疗？,HB-EGF
bridge_subgraph_12522.graphml,哪种疾病在20名患者每月接受腹膜透析治疗的同时，还需要进行相关的培训教育，且常与尿毒症并发？,腹膜透析相关性腹膜炎
bridge_subgraph_12528.graphml,哪种疾病会导致同学矛盾、阳虚质，并伴随呕吐和疼痛？,失眠
bridge_subgraph_12529.graphml,哪种疾病在服用中药方剂安眠汤后，会出现记忆力减退，且在消化内科检查中可能需要进行内镜下黏膜剥离术？,失眠
bridge_subgraph_12530.graphml,哪种医学内容最能解释BZDs在年迈人群中与腔隙性脑梗死和年龄因素之间的关系？,失眠
bridge_subgraph_12534.graphml,哪种疾病在进行补钾治疗的同时，还需要特别关注患者的紧张程度、性别和年龄这些风险评估因素？,甲亢合并周期性麻痹
bridge_subgraph_12533.graphml,哪种疾病在预防SDHVD的同时，常伴有失眠的临床表现，并且OSAHS和糖尿病是其高危因素和风险评估因素？,冠心病
bridge_subgraph_12536.graphml,哪种疾病会导致感染、并发牙周炎，且经过同种异体骨移植治疗后生活质量仍然极差？,骨组织缺损
bridge_subgraph_12537.graphml,哪种疾病在规范化护理和品管圈护理管理中，同时需要结合优质护理和护理干预进行辅助治疗和预防？,急诊输液
bridge_subgraph_12535.graphml,哪种疾病在采用针刀松解和颈椎牵引治疗的同时，常伴有老年冠心病和心律失常的症状？,颈心综合征
bridge_subgraph_12531.graphml,哪种疾病在病理分型上累及ADR相关器官/系统，且常伴有VPA并发症，同时可能出现白塞病的临床表现和过敏性休克的相关症状？,心血管系统损害
bridge_subgraph_12541.graphml,哪种疾病既表现为淤胆型肝炎、呕吐和体重减轻，又适合采用药物联合心理干预的辅助治疗？,失眠
bridge_subgraph_12532.graphml,哪种医学内容在涉及离婚或丧偶、高龄（>75岁）的人群中，尤其是女性，最需要结合心理干预来处理？,老年PSD
bridge_subgraph_12544.graphml,哪种疾病在治疗时需要取穴针刺，常伴随失用性肌萎缩，且患者可能出现焦虑障碍和心悸症状？,失眠
bridge_subgraph_12538.graphml,哪种疾病会导致女性出现巨细胞病毒肺炎和丙氨酸氨基转移酶升高，并且常通过酶联免疫吸附试验进行诊断？,CMV
bridge_subgraph_12548.graphml,哪种疾病需要同时考虑颈动脉内膜剥脱术和支架置入术，并且常与CAS和缺血性脑卒中相关？,颈动脉粥样硬化狭窄
bridge_subgraph_12540.graphml,哪种疾病在遗传因素为高危因素的情况下，通过Epworth嗜睡量表进行筛查，并需要常规护理和优质护理作为辅助治疗？,失眠
bridge_subgraph_12539.graphml,哪种疾病在治疗过程中特别需要结合营养支持、FTS新理念治疗、舒适护理和基础护理等多种辅助治疗手段？,老年胆道手术
bridge_subgraph_12553.graphml,哪种疾病在治疗过程中需要同时使用黄芪注射和阿立哌唑，并且常表现为混合型，且需要通过头颅MRI进行检查？,失眠
bridge_subgraph_12545.graphml,哪种疾病在治疗过程中需要同时采用系统化护理、气溶胶药物治疗、心理护理以及高压氧综合治疗？,Ⅱ度烧伤
bridge_subgraph_12554.graphml,哪种症状在细菌性肝脓肿患者中更常见，且常伴随失眠，需要护理干预，特别是在糖尿病患者中？,发热
bridge_subgraph_12551.graphml,哪种疾病会导致单侧自发性气胸，且在进行脐部切口手术治疗时，常伴有排尿困难和发热的并发症？,单孔组
bridge_subgraph_12543.graphml,哪种疾病在出现胸闷症状的同时，需要通过睡眠情况评定表和心电图进行检查，并可能需要进行健康干预治疗？,失眠
bridge_subgraph_12549.graphml,哪种疾病在使用芪棱汤治疗时，常伴有糖尿病、失眠和血肌酐升高的症状？,2型糖尿病
bridge_subgraph_12542.graphml,哪种疾病在治疗过程中特别需要结合优质护理流程管理、抗氧化剂药物、心理护理和心理干预等多方面的辅助治疗？,肿瘤放化疗
bridge_subgraph_12546.graphml,哪种疾病在服用枣仁安神颗粒治疗的同时，常伴随PD睡眠障碍，且需通过汉密尔顿焦虑量表评估和针刺疗法辅助治疗？,失眠
bridge_subgraph_12547.graphml,哪种疾病会导致对总体睡眠质量不满意，并且可能与耳穴压豆有关，同时需要进行磁共振成像检查，且发病部位在肝？,失眠
bridge_subgraph_12552.graphml,哪种疾病会导致宿舍声音嘈杂时出现腹泻和发热，并且适合采用耳穴压丸疗法治疗？,失眠
bridge_subgraph_12556.graphml,哪种疾病在采用帕罗西汀联合小剂量奥氮平治疗重性抑郁障碍时，常伴有胸闷和心悸的症状？,失眠
bridge_subgraph_12561.graphml,哪种疾病在CPB管理和心内直视手术中，常伴随出现心律失常和心力衰竭？,瓣膜病
bridge_subgraph_12564.graphml,哪种医学内容在涉及心脏彩超和糖尿病的同时，也会关联到失眠和内皮素-1(ET-1)？,心力衰竭
bridge_subgraph_12555.graphml,哪种疾病在采用生活起居疗法和头部刺血疗法的同时，还需要考虑患者年龄和HAMD评分的影响？,失眠
bridge_subgraph_12550.graphml,哪种疾病在男性居民中导致死亡的比例较高，且常与关节病和腰椎间盘突出症同时出现？,损伤与中毒
bridge_subgraph_12563.graphml,哪种疾病在男性中较常见，表现为手术前大肠癌的临床症状，同时伴随鼻塞，且需要系统康复方法辅助治疗？,失眠
bridge_subgraph_12558.graphml,哪种疾病在表现为蠕虫感染的同时，还常伴随慢性疲劳综合征和亚健康状态，并与原发性肾病有一定关联？,免疫相关疾病
bridge_subgraph_12557.graphml,哪种疾病在治疗过程中既需要高剂量右美托咪定，又可能涉及肺大泡切除，并且常常与安慰剂和肺癌的辅助治疗同时出现？,肋间神经阻滞
bridge_subgraph_12565.graphml,哪种疾病在彩色多普勒和二维超声检查中，常与心血管系统和心血管疾病同时出现？,威廉斯综合征
bridge_subgraph_12559.graphml,哪种疾病是由于脏腑气血亏虚引起的，需要通过穴位植线手术治疗，并常配合五音疗法和服用坤宝丸来辅助治疗？,失眠
bridge_subgraph_12560.graphml,哪种疾病在术后疼痛和腹胀的同时出现，且需要通过西酞普兰治疗和匹兹堡睡眠质量指数检查来辅助诊断？,失眠
bridge_subgraph_12578.graphml,哪种疾病会导致鼻塞和高血压病史，并且常伴有乏力和恶心？,失眠
bridge_subgraph_12562.graphml,哪种疾病适合采用西酞普兰联合阿普唑仑治疗，并辅以综合疗养因子、认知行为疗法及百合地黄汤的综合治疗方案？,老年慢性失眠症
bridge_subgraph_12569.graphml,哪种疾病会导致肌张力低，需要早期足量补钾，并且伴随心悸，同时需要积极治疗原发病？,低钾性麻痹
bridge_subgraph_12568.graphml,哪种疾病既有食管癌的临床表现，又能通过北冬虫夏草药物治疗，同时可采用针刺疗法辅助治疗，并且与银屑病的临床表现相似？,失眠
bridge_subgraph_12566.graphml,哪种疾病在T3期通过MRI检查发现，并伴随失眠症状，通常需要使用右美托咪定进行治疗？,乳腺癌
bridge_subgraph_12574.graphml,哪种疾病在术后疼痛的同时出现头痛，但不伴抑郁症状，且需要一般健康指导作为辅助治疗？,失眠
bridge_subgraph_12567.graphml,哪种疾病在配戴角膜塑形镜或周边屈光控制镜的人群中，同时结合年龄因素和耳穴贴压治疗时更易出现？,儿童近视
bridge_subgraph_12572.graphml,哪种医学内容能同时解释急性胃肠道反应和5-HT3受体拮抗剂的作用，并且与腹痛和呕吐相关？,恶心
bridge_subgraph_12576.graphml,哪种疾病在实验室检查中表现为血浆氨基丁酸异常，且临床表现为分裂样精神病，同时常采用温针灸和中医推拿作为辅助治疗？,失眠
bridge_subgraph_12573.graphml,哪种疾病在治疗过程中常采用光疗作为辅助手段，并通过肢体活动电图进行检查，同时患者常表现出焦虑和敌对情绪？,失眠
bridge_subgraph_12580.graphml,哪种疾病在急诊护理中常伴随意识障碍，且与脑血管病和脑卒中密切相关？,卒中单元
bridge_subgraph_12579.graphml,哪种疾病在治疗过程中需要结合针刺五脏背俞穴、服用氟伏沙明，并且同时进行行为干预和基础护理？,失眠
bridge_subgraph_12582.graphml,哪种疾病最适合采用穴位注射与针灸配合耳穴贴压的治疗方法？,脑卒中后呃逆
bridge_subgraph_12570.graphml,哪种疾病在需要呼吸机辅助通气治疗的同时，常伴随谵妄症状，并且使用喹诺酮类药物进行治疗，且患者的月收入水平是评估风险的重要因素？,nICU
bridge_subgraph_12571.graphml,哪种疾病在治疗过程中常使用齐拉西酮和硫辛酸，且可能引发自主神经病变和胃肠动力紊乱？,糖尿病
bridge_subgraph_12575.graphml,哪种疾病在采用针刺捻转补法治疗时，常伴随噪音影响，并且患者可能需要使用焦虑自评量表评估，同时可能服用氯氮平药物？,失眠
bridge_subgraph_12577.graphml,哪种疾病在治疗过程中会同时使用蒙古灸和血清脑颗粒联合右佐匹克隆片，并且需要监测血脂水平和采用酶联免疫法进行检测？,失眠
bridge_subgraph_12583.graphml,哪种疾病在采用帕瑞昔布治疗的同时，需要特别关注家庭态度和护理干预治疗的效果？,手术后疼痛
bridge_subgraph_12584.graphml,哪种疾病在使用益气解毒活血法或常规化疗后容易出现呕吐症状，并可能伴随银屑病并发症？,急性髓细胞白血病
bridge_subgraph_12593.graphml,哪种疾病会导致恐惧心理和惊厥，同时伴随呕吐和脑电图异常？,失眠
bridge_subgraph_12585.graphml,哪种疾病在临床表现为慢性肾炎的同时，还会出现呕吐和恶心，且常用谷维素片进行治疗？,失眠
bridge_subgraph_12581.graphml,哪种疾病需要基于体质的饮食调护，并可能使用枣仁安神丸治疗，同时患者需要进行头颅MRI或头部MRI检查？,失眠
bridge_subgraph_12587.graphml,哪种疾病在治疗过程中需要结合Thera-Band训练和关节持续被动活动(CPM)，并常常伴随心理疏导，且可能并发乳腺癌？,肩关节功能障碍
bridge_subgraph_12590.graphml,哪种疾病会导致神经质和眩晕，且常与2型糖尿病和维持性血液透析同时出现？,失眠
bridge_subgraph_12589.graphml,哪种疾病会导致低血压和冠状动脉穿孔，且常与高血压病或高血压同时出现？,心肌梗死
bridge_subgraph_12591.graphml,哪种疾病在γ-GABA水平异常和少量饮酒的情况下，常与丙型肝炎同时出现，且需要接受常规护理？,失眠
bridge_subgraph_12586.graphml,哪种疾病在治疗过程中常使用草酸艾司西酞普兰或肉蔻五味丸联合曲唑酮，并且辅助治疗中会采用循证护理，病因分析中会考虑耳穴压豆的影响？,失眠
bridge_subgraph_12600.graphml,哪种疾病在临床表现上既有睡眠不稳又有恢复期，且在辅助治疗中需要健康宣教和常规治疗相结合？,失眠
bridge_subgraph_12598.graphml,哪种疾病在皮肤科常见，表现为瘙痒，且可能与精神因素有关，通常需要通过酶联免疫吸附试验来辅助诊断？,慢性自发性荨麻疹
bridge_subgraph_12588.graphml,哪种疾病在治疗过程中常需同时使用维生素D和沙美特罗-氟替卡松，且需要与支气管炎进行鉴别诊断，并可采用中医护理措施作为辅助治疗？,变异性哮喘
bridge_subgraph_12601.graphml,哪种疾病在年龄≥30岁的人群中容易出现腔隙性脑梗死，且可采用针刺或针刺疗法作为辅助治疗？,失眠
bridge_subgraph_12597.graphml,哪种疾病在女性和特定年龄段人群中，通过症状自评量表和断层血管成像检查更容易被诊断出来？,UIA
bridge_subgraph_12595.graphml,哪种疾病与31.9%的发病率及参加课外辅导班的时间有关，且常与慢性心力衰竭和心律失常同时出现？,失眠
bridge_subgraph_12596.graphml,哪种疾病在小儿呼吸系统疾病和腹腔镜组中常见，且常伴随焦虑症状，中医药治疗有一定效果？,失眠
bridge_subgraph_12604.graphml,哪种疾病在进行颅内立体脑电图和磁共振成像检查时，常伴有智力损害的表现？,颞叶内侧癫痫
bridge_subgraph_12594.graphml,哪种疾病在老年糖尿病患者中，同时伴有2型糖尿病并发症和COVID-19病史时，SOD实验室检查结果最容易出现异常？,冠心病
bridge_subgraph_12609.graphml,哪种疾病会在宿舍声音嘈杂时引发室性早搏，并且适合采用运动疗法和推拿手法进行治疗？,失眠
bridge_subgraph_12592.graphml,哪种疾病需要采用保留括约肌挂线术和主灶切开挂线支管开窗对口引流，并配合中药熏洗和常规护理进行治疗？,高位复杂性肛瘘
bridge_subgraph_12608.graphml,哪种疾病在老年抑郁症伴失眠和突发性耳聋的情况下，同时与绝经和抑郁状态相关？,失眠
bridge_subgraph_12605.graphml,哪种疾病会导致学习压力过大引发u-RLS，并可能伴随脑梗死，适合采用针刺治疗辅助？,失眠
bridge_subgraph_12615.graphml,哪种疾病在早期规范化康复训练和早期康复干预的基础上，结合综合护理，能有效改善认知功能障碍？,老年全髋关节置换
