file,query,answer
bridge_subgraph_03667.graphml,哪种检查能够同时有效诊断皮下气肿、瘘管以及先兆流产和难免流产？,超声诊断
bridge_subgraph_03658.graphml,哪种检查能同时有效诊断宫内孕合并宫外孕、子宫内膜异位症及妇科疾病，并辅助护理干预？,妇科B超
bridge_subgraph_03651.graphml,哪种检查能够同时诊断胎盘血管前置和胎儿右室流出道梗阻，并且也能发现胎儿畸形和血管前置？,产前彩色多普勒超声
bridge_subgraph_03669.graphml,哪种检查能同时用于筛查人结肠癌、哮喘以及肝癌和肺癌？,流式细胞术测定
bridge_subgraph_03662.graphml,哪种检查能同时发现超声异常、细菌感染，并评估T2DM和冠心病的风险？,外周血WBC计数
bridge_subgraph_03664.graphml,哪种检查能更准确地鉴别滑动性食管裂孔疝、TIRADS以及同时出现的胃癌和胃炎？,超声诊断
bridge_subgraph_03675.graphml,哪种疾病在出现窒息和mAlb的同时，常伴随CABG和胰腺结石的情况？,糖尿病
bridge_subgraph_03665.graphml,哪种检查能够同时发现胎儿先天性短肢畸形、肠壁积气以及原发性肝癌（HCC）？,超声诊断
bridge_subgraph_03677.graphml,哪种检查能有效诊断宫内残留物、隐匿性脾破裂以及高血压？,超声诊断
bridge_subgraph_03676.graphml,哪种检查能同时应用于Skp2 siRNA治疗急性脑缺血以及肝癌和膀胱癌的研究？,半定量PCR法
bridge_subgraph_03672.graphml,哪种检查能同时有效诊断积乳、主动脉弓中断，以及HIE和肺癌？,超声诊断
bridge_subgraph_03671.graphml,哪种疾病会出现软组织肿块和血清癌胚抗原水平升高，并可能伴有淋巴瘤和CEA影像学检查异常？,乳腺癌
bridge_subgraph_03681.graphml,哪种检查能够有效诊断胰管结石和局部复发或转移，同时还能评估腰椎间盘突出症和NAFLD的情况？,超声诊断
bridge_subgraph_03674.graphml,哪种社会学理论能更好地解释老年脓毒症和肺结核患者同时患有糖尿病和脑卒中的现象？,肿瘤
bridge_subgraph_03684.graphml,哪种检查既能用于诊断肺炎支原体感染，又能有效鉴别煤工尘肺、肿瘤及肺癌？,X 线胸片
bridge_subgraph_03666.graphml,哪种疾病在进行超声诊断时，最可能与结直肠癌同时出现，并伴有脑梗死和冠心病的风险？,糖尿病
bridge_subgraph_03668.graphml,哪种检查可以同时用于检测颈动脉粥样斑块和子宫中晚期妊娠，并且也能发现卵巢癌和精神分裂症？,超声诊断
bridge_subgraph_03683.graphml,哪种检查最适用于同时检测乳腺癌、结肠肿瘤以及恶性肿瘤骨转移和骨转移瘤？,血清ICTP
bridge_subgraph_03682.graphml,哪种医学内容在涉及消化道穿孔和左冠状动脉-肺动脉瘘的同时，还常与糖尿病和精神分裂症相关？,超声诊断
bridge_subgraph_03687.graphml,哪种检查能同时准确诊断椎动脉闭塞、产后子宫胎盘植入、甲状腺结节和乳腺恶性肿瘤？,超声诊断
bridge_subgraph_03690.graphml,哪种检查能够同时诊断原发性甲状旁腺功能亢进症和SHPT，并且还能发现腺瘤和乳腺癌？,平面显像
bridge_subgraph_03673.graphml,哪种检查能够有效诊断肝外梗阻性黄疸、妇产科急症，并同时适用于冠心病和心肌梗塞的影像学评估？,超声诊断
bridge_subgraph_03678.graphml,哪种检查能同时有效诊断附睾结核和假性动脉瘤合并血栓，并且在T2DM和原发性肝癌患者中也适用？,超声诊断
bridge_subgraph_03679.graphml,哪种检查在急诊中能同时有效诊断实质脏器挫裂伤、急性阑尾炎和肠系膜淋巴结炎？,超声诊断
bridge_subgraph_03685.graphml,哪种检查能同时有效诊断食道溃疡、胃癌、贲门癌和结肠癌？,气钡双对比造影
bridge_subgraph_03680.graphml,哪种检查对中青年2型糖尿病及下肢动脉栓塞的诊断最为有效，同时适用于T2DM的影像学评估和2型糖尿病的辅助检查？,下肢动脉彩超
bridge_subgraph_03688.graphml,哪种检查能同时有效诊断糖尿病、高血压左室肥厚，以及高血压和胎儿心脏畸形？,超声诊断
bridge_subgraph_03689.graphml,哪种检查可以有效诊断中晚期妊娠时的脐带异常，并同时评估甲状腺结节及其良恶性？,3D-CPA
bridge_subgraph_03691.graphml,哪种检查最适合同时评估慢性肾病、肾上腺占位性病变、肾积水及下尿路梗阻的情况？,超声诊断
bridge_subgraph_03686.graphml,哪种检查能同时有效诊断左冠状动脉-肺动脉瘘、髋关节发育异常，以及肾细胞癌和小肝癌？,超声诊断
bridge_subgraph_03692.graphml,哪种检查可以同时用于膀胱结石、颈部肿瘤以及肾癌和其它肿瘤的影像学诊断？,超声诊断
bridge_subgraph_03695.graphml,哪种检查能同时诊断急性胰腺炎、多脏器损伤以及伴随的胸腔积液和糖尿病？,超声诊断
bridge_subgraph_03693.graphml,哪种社会学理论能解释麻痹性肠梗阻在超声诊断中的表现，以及其与胸腔积液和胃癌的关联性？,肿瘤
bridge_subgraph_03699.graphml,哪种检查能有效区分非酒精性脂肪肝炎、PBC与原发性肝癌、肝硬化的不同？,肝脏MRI
bridge_subgraph_03694.graphml,哪种检查能同时有效评估外周血管动静脉瘘、远端回肠状况，以及糖尿病和肾功能不全的情况？,超声诊断
bridge_subgraph_03696.graphml,哪种检查能同时用于结直肠高-中分化腺癌、结核杆菌、肺癌和卵巢癌的实验室诊断？,SYBR GreenⅠ
bridge_subgraph_03697.graphml,哪种检查能同时有效诊断B型乳腺导管疾病、恶性肿瘤和消化性溃疡？,超声诊断
bridge_subgraph_03700.graphml,哪种社会学理论能更好地解释偏瘫和FTHUE-HK现象，并关联AD和脑梗死的发生？,脑卒中
bridge_subgraph_03702.graphml,哪种检查在诊断结肠梗阻时，需要同时考虑EH和高血压的情况？,超声诊断
bridge_subgraph_03709.graphml,哪种检查能够同时有效诊断臂丛神经异常、Child-Pugh评分相关疾病、胸腔积液和肺癌？,超声诊断
bridge_subgraph_03698.graphml,哪种检查在诊断糖尿病、小儿颅脑疾病以及脑卒中和慢性乙型肝炎时最为常用？,超声诊断
bridge_subgraph_03701.graphml,哪种检查能同时有效诊断胎盘早期剥离、中央型肺癌、脑胶质瘤和脑梗死？,超声诊断
bridge_subgraph_03711.graphml,哪种检查能同时发现胎儿右位心、左侧甲状腺癌，以及2型糖尿病和高血压？,超声诊断
bridge_subgraph_03714.graphml,哪种检查能同时早期发现宫外孕、原发性心脏肿瘤，以及胃癌和大肠癌？,超声诊断
bridge_subgraph_03705.graphml,哪种检查能同时准确诊断急性呼吸窘迫综合征、肺水肿、气胸以及新生儿呼吸窘迫综合征？,床旁胸片
bridge_subgraph_03706.graphml,哪种检查能同时有效诊断Ⅰ型病变和肿瘤，并适用于结肠癌及肺动静脉瘘的筛查？,超声诊断
bridge_subgraph_03708.graphml,哪种检查能同时诊断晚期胃窦癌、肠系膜淋巴结肿大、糖尿病和甲状腺炎？,超声诊断
bridge_subgraph_03707.graphml,哪种检查能同时有效诊断缺血性心肌病、动脉导管未闭、肾积水和冠心病？,声学定量技术
bridge_subgraph_03704.graphml,哪种检查能同时准确诊断跟腱断裂、胡桃夹以及肝脏疾病？,超声诊断
bridge_subgraph_03713.graphml,哪种检查最适合同时诊断肩锁关节损伤、病毒性脑炎、甲状旁腺腺瘤和肝脓肿？,MRI影像诊断
bridge_subgraph_03703.graphml,哪种检查能同时有效诊断单纯性淋巴水囊瘤、软组织竹木刺异物以及肝硬化与慢性乙型肝炎？,超声诊断
bridge_subgraph_03720.graphml,哪种检查能同时准确诊断肠系膜上动脉压迫综合征、先天性下腔静脉畸形、病理性双胎妊娠和子宫腺肌病？,腹部彩色多普勒超声检查
bridge_subgraph_03712.graphml,哪种检查能同时诊断脂肪性肝病、心尖肥厚型心肌病，并排除NEC和急性阑尾炎？,超声诊断
bridge_subgraph_03715.graphml,哪种检查能有效区分结肠梗阻、卵巢内胚窦瘤、乳腺纤维腺瘤和食管癌？,超声诊断
bridge_subgraph_03710.graphml,哪种检查能同时用于诊断婴幼儿先天性肥厚性幽门狭窄和胎儿肾脏发育，以及急性心肌梗死和肾功能不全？,超声诊断
bridge_subgraph_03727.graphml,哪种检查能同时有效诊断原发性高血压、DCM、川崎病和高血压病？,SRI技术
bridge_subgraph_03716.graphml,哪种医学内容与甲状腺功能减退症和TC直接相关，且常与分化型甲状腺癌及胆总管结石同时出现？,促甲状腺激素水平
bridge_subgraph_03731.graphml,哪种检查能有效诊断联体双胎、内脏异位以及伴随的肝脏疾病和肝硬化？,超声诊断
bridge_subgraph_03729.graphml,哪种检查最适合同时诊断输尿管下段结石、肾脓肿以及单纯性和坏疽性阑尾炎？,超声诊断
bridge_subgraph_03725.graphml,哪种检查能同时有效筛查胆石症、隐睾以及早期肝癌和主动脉壁内血肿？,超声诊断
bridge_subgraph_03722.graphml,哪种检查能够同时有效诊断剖宫产瘢痕妊娠、胎儿多囊泡肾以及前列腺癌和甲状腺癌？,超声诊断
bridge_subgraph_03721.graphml,哪种检查能同时有效诊断乳腺占位性病变、特殊部位妊娠，并且适用于T2DM和乳腺癌患者？,超声诊断
bridge_subgraph_03733.graphml,哪种检查能最准确地鉴别急性痛风性关节炎（表现为软骨表面回声增强）与类风湿性关节炎（RA）？,关节超声
bridge_subgraph_03732.graphml,哪种检查能同时有效诊断AECOPD、前壁组病变以及伴随的心律失常和高血压？,M超
bridge_subgraph_03734.graphml,哪种检查能同时有效诊断急性冠脉综合征、心肌桥，以及伴随的2型糖尿病和冠心病？,运动心电图
bridge_subgraph_03719.graphml,哪种检查能同时准确诊断破裂损伤、法洛氏四联征，并且还能发现肿瘤和非酒精性脂肪肝？,超声诊断
bridge_subgraph_03726.graphml,哪种检查能够同时有效诊断高血压病、先天性胆管囊性扩张症、甲亢和乳腺癌？,超声诊断
bridge_subgraph_03730.graphml,哪种检查能有效诊断急性水肿型胰腺炎、处女膜闭锁，并同步排查子宫肌瘤和早期异位妊娠？,超声诊断
bridge_subgraph_03737.graphml,哪种检查最适合同时诊断DORV、肝破裂、恶性肿瘤和卵巢肿瘤？,超声诊断
bridge_subgraph_03736.graphml,哪种检查最适合同时评估老年教师的高血压病、心力衰竭以及伴随的2型糖尿病和心绞痛？,测量血压
bridge_subgraph_03723.graphml,哪种检查能同时准确诊断撕脱性骨折、胆囊恶性病变、输卵管间质部妊娠以及胎儿畸形？,超声诊断
bridge_subgraph_03717.graphml,哪种检查既能有效诊断撕脱或微小骨折、女性生殖系统疾病，又能同时筛查食管癌和HCM？,超声诊断
bridge_subgraph_03735.graphml,哪种检查能有效诊断多脏器损伤、婴幼儿血管瘤，并同时监测急性心肌梗死和心律失常？,超声诊断
bridge_subgraph_03718.graphml,哪种检查可以同时用于诊断急性淋巴细胞性白血病、单纯疱疹感染，并且也能发现甲状腺结节和胃癌？,DNA检测
bridge_subgraph_03739.graphml,哪种检查能有效诊断下肢DVT，并评估妇科肿瘤患者是否并发血栓？,X线静脉造影
bridge_subgraph_03728.graphml,哪种检查最适合用于评估同时患有2型糖尿病和颈动脉粥样硬化的老年男性冠心病患者的冠状动脉综合征风险？,测定血清铁蛋白
bridge_subgraph_03742.graphml,哪种医学内容与主动脉弓发育不良和HCC直接相关，同时与AD和淋巴瘤也有关联？,超声诊断
bridge_subgraph_03740.graphml,哪种医学内容在涉及腮腺癌和肝脓肿的同时，也常与糖尿病和胃癌相关？,超声诊断
bridge_subgraph_03741.graphml,哪种检查能有效诊断急慢性动脉闭塞、婴幼儿颈部包块、急性心肌梗死和不孕症？,超声诊断
bridge_subgraph_03743.graphml,哪种检查既能有效诊断外周血管动静脉瘘和出入境人员的脂肪肝，又能同时发现胸腔积液和慢性乙型肝炎？,超声诊断
bridge_subgraph_03724.graphml,哪种检查能同时用于诊断感染、湿疹、新辅助化疗的监测以及慢性乙型肝炎的评估？,外周血检测
bridge_subgraph_03747.graphml,哪种医学内容在涉及高血压的同时，也常与超声诊断和冠心病相关？,糖尿病
bridge_subgraph_03750.graphml,哪种检查能够同时有效筛查原发性肝细胞癌、老年前列腺癌以及乳腺癌和糖尿病？,免疫组化染色技术
bridge_subgraph_03751.graphml,哪种检查在诊断新生儿败血症、肺癌和急性肺栓塞时都会用到？,CRP联合检测
bridge_subgraph_03744.graphml,哪种检查能有效诊断腹部实质脏器损伤和胃肠外科急腹症，同时适用于原发性肝癌和慢性乙型肝炎的筛查？,超声诊断
bridge_subgraph_03752.graphml,哪种检查能同时诊断大网膜异常和胎盘植入，并适用于2型糖尿病或糖尿病患者？,超声诊断
bridge_subgraph_03738.graphml,哪种检查能同时用于评估人创伤性脑损伤和PTEN异常，以及脑卒中和甲状腺乳头状癌的情况？,免疫组化测定
bridge_subgraph_03748.graphml,哪种检查可以同时用于诊断血管前置、小儿急慢性阑尾炎以及2型糖尿病（T2DM）？,超声诊断
bridge_subgraph_03746.graphml,哪种检查能同时用于诊断Bell麻痹、冠状动脉粥样硬化性心脏病以及糖尿病（包括2型糖尿病）？,纤维蛋白原检测
bridge_subgraph_03753.graphml,哪种检查能够同时有效诊断髋臼盂唇损伤、肝纤维化以及肾动脉狭窄等问题？,超声诊断
bridge_subgraph_03755.graphml,哪种检查能同时准确评估羊水偏少、门腔静脉分流术以及结肠癌和大肠癌的情况？,超声诊断
bridge_subgraph_03745.graphml,哪种疾病在超声诊断中常表现为心力衰竭，且患者通常伴有血浆脑钠素水平升高和心血管病症状？,急性心肌梗死
bridge_subgraph_03757.graphml,哪种医学内容与EBC、黏膜下肿瘤直接相关，且常与子宫内膜息肉、异位妊娠同时出现？,超声诊断
bridge_subgraph_03759.graphml,哪种检查能同时准确诊断眼外伤、孤立性肠系膜上动脉夹层动脉瘤以及伴随的瘢痕和2型糖尿病？,超声诊断
bridge_subgraph_03761.graphml,哪种检查能同时有效诊断扭转、宫腔粘连、淋巴瘤和胸腔积液？,超声诊断
bridge_subgraph_03749.graphml,哪种检查能同时有效诊断乳腺结节和淋巴结转移，并且在妇科急腹症和药物流产的情况下也适用？,超声诊断
bridge_subgraph_03756.graphml,哪种检查能同时有效诊断胎儿肾上腺区占位性病变、小儿急性骨髓炎以及冠心病和T2DM？,超声诊断
bridge_subgraph_03760.graphml,哪种检查能同时有效诊断Ⅰ型病变和严重左心功能不全，并且还能发现肝癌和前列腺癌？,超声诊断
bridge_subgraph_03763.graphml,哪种检查能同时有效识别结节型导管内乳头状瘤、GLM、输尿管结石和NAFLD？,超声诊断
bridge_subgraph_03754.graphml,哪种检查能同时诊断胎儿外科相关畸形、甲状腺原氨酸异常，以及不孕症和多囊卵巢综合征？,超声诊断
bridge_subgraph_03758.graphml,哪种检查能有效诊断唇裂、肝小细胞瘤以及同时出现的肺癌和结肠癌？,超声诊断
bridge_subgraph_03766.graphml,哪种检查能同时发现恶性结节、主动脉弓异常、输尿管结石和膀胱肿瘤？,超声诊断
bridge_subgraph_03767.graphml,哪种疾病在血清Cys-C升高、合并冠心病房颤的同时，还常见于2型糖尿病和OS患者？,糖尿病
bridge_subgraph_03770.graphml,哪种检查能够同时准确诊断睾丸附件扭转、单纯性室间隔缺损以及高血压和糖尿病？,超声诊断
bridge_subgraph_03762.graphml,哪种检查能够有效区分人脑胶质瘤与胃癌细胞株MGC803，同时也能识别胃癌和肺癌？,划痕愈合实验
bridge_subgraph_03771.graphml,哪种检查能有效同时诊断急性骨髓炎、肺出血、室间隔缺损和糖尿病？,超声诊断
bridge_subgraph_03765.graphml,哪种检查能同时有效诊断阑尾炎周围脓肿、早期异位妊娠以及腹部外伤和阑尾炎？,超声诊断
bridge_subgraph_03764.graphml,哪种社会学理论能解释糖尿病和老年脂肪肝的关联，并涵盖先天性心脏病与天冬氨酸转移酶的相关性？,高血压
bridge_subgraph_03768.graphml,哪种检查能同时检测gyrA基因和rDNA，并且适用于淋巴瘤和结节性甲状腺肿的诊断？,PCR直接测序法
bridge_subgraph_03769.graphml,哪种检查能同时有效诊断实质脏器挫裂伤、甲状腺腺癌，以及静脉血栓和颈动脉狭窄？,超声诊断
bridge_subgraph_03776.graphml,哪种医学内容与血液回流常数和间质-血浆速率常数直接相关，且常在前列腺癌和乳腺癌的研究中同时出现？,Kep
bridge_subgraph_03775.graphml,哪种检查能同时有效诊断老年高血压性心脏病、甲状腺结节性腺肿，以及乳腺癌和乳腺肿块？,超声诊断
bridge_subgraph_03774.graphml,哪种检查能同时准确诊断急性盆腔炎、嵌入性疝、精索静脉曲张和睾丸附件扭转？,超声诊断
bridge_subgraph_03773.graphml,哪种检查能有效筛查妊娠高血压疾病和冠心病，同时还能兼顾2型糖尿病和脑梗死的早期发现？,超敏 C-反应蛋白
bridge_subgraph_03781.graphml,哪种检查能有效同时评估老年2型糖尿病（T2DM）和乳腺癌（RS）的风险？,智谋量表
bridge_subgraph_03780.graphml,哪种检查能有效诊断宫内宫外复合妊娠、外部性脑积水、急性盆腔炎和卵巢囊肿？,超声诊断
bridge_subgraph_03777.graphml,哪种疾病在进行超声诊断时，常与抑郁症相关，且同时存在神经管畸形和胃癌的高危风险评估因素？,糖尿病
bridge_subgraph_03782.graphml,哪种疾病在超声诊断中常与食管癌一同被识别，且属于恶性肿瘤的病理分型？,肺癌
bridge_subgraph_03772.graphml,哪种检查能够同时有效诊断软组织异物、良恶性甲状腺结节、膀胱癌以及妇科急腹症？,超声诊断
bridge_subgraph_03778.graphml,哪种检查能同时用于评估新生儿窒息、急性阑尾炎和2型糖尿病，且与H-FABP相关？,缺血修饰白蛋白
bridge_subgraph_03785.graphml,哪种检查能同时有效诊断早期糖尿病肾病肾间质纤维化、肝纤维化和慢性乙型肝炎？,血清CTGF
bridge_subgraph_03786.graphml,哪种检查能同时准确诊断卵巢蒂扭转、同侧腋窝淋巴结癌、肾细胞癌和甲状腺乳头状癌？,超声诊断
bridge_subgraph_03779.graphml,哪种检查可以同时用于诊断ABPA、流感病毒性肺炎，并鉴别急性呼吸窘迫综合征和纵隔肿瘤？,胸部CT影像
bridge_subgraph_03783.graphml,哪种检查能同时有效诊断浅表器官结外淋巴瘤、脑梗死以及甲状腺良恶性结节和恶性结节？,超声诊断
bridge_subgraph_03789.graphml,哪种疾病在胆囊疾病并发症中常见，且在进行身体测量辅助检查时常与心脑血管疾病和慢性病同时出现？,糖尿病
bridge_subgraph_03790.graphml,哪种检查最适合区分早期异位妊娠、宫外孕和黄体破裂？,超声诊断
bridge_subgraph_03784.graphml,哪种检查能有效区分子宫腺瘤样瘤、颈部迷走神经副节瘤，并同时适用于纤维腺瘤和淋巴瘤的辅助诊断？,大体检查
bridge_subgraph_03788.graphml,哪种检查能同时用于病毒感染和脑膜瘤恶性变的诊断，并且在实施新辅助化疗和胃肠道间质瘤治疗过程中也需要进行？,组织芯片技术
bridge_subgraph_03791.graphml,哪种检查能同时准确诊断阑尾炎、泌尿系结核以及胆囊炎和急性阑尾炎？,超声诊断
bridge_subgraph_03796.graphml,哪种检查能有效同时诊断胎儿膈疝、老年性主动脉瓣退行性病变以及肝癌和血栓？,超声诊断
bridge_subgraph_03792.graphml,哪种检查能同时有效诊断肝局灶性病变、肝细胞肝癌以及乳腺肿瘤和肝肿瘤？,动态三维超声造影
bridge_subgraph_03787.graphml,哪种检查能同时有效诊断单发性子宫内膜息肉、肝硬化小肝癌，并筛查DVT和高血压？,超声诊断
bridge_subgraph_03793.graphml,哪种检查能同时有效诊断胰管结石、永存增生原始玻璃体症、胃癌和原发性肝癌？,超声诊断
bridge_subgraph_03802.graphml,哪种检查能同时诊断妊娠期糖尿病、冠心病、非酒精性脂肪肝和低通气综合征？,血清白介素-6
bridge_subgraph_03795.graphml,哪种检查可以同时用于检测HO-8910和Fibronectin，并且适用于肺癌和前列腺癌的诊断？,Transwell小室法
bridge_subgraph_03805.graphml,哪种检查能够同时诊断过期流产、心脏横纹肌瘤以及冠心病和PTE？,超声诊断
bridge_subgraph_03798.graphml,哪种检查能同时有效诊断DDH和ALH，并适用于肝硬化及泌尿系结石的辅助诊断？,超声诊断
bridge_subgraph_03797.graphml,哪种检查能够同时诊断无精子症、月经紊乱性不孕症，并且适用于PCOS和子宫肌瘤的情况？,血清FSH
bridge_subgraph_03799.graphml,哪种医学内容更常与新生儿梗阻和子宫角部妊娠相关联，同时也会出现在胃癌和大肠癌的讨论中？,超声诊断
bridge_subgraph_03801.graphml,哪种检查能同时有效诊断部分性葡萄胎、胃窦癌、结核性胸膜炎和脑梗死？,超声诊断
bridge_subgraph_03804.graphml,哪种检查能同时有效诊断肾积水、病理性肿瘤以及肝癌和肝病？,超声诊断
bridge_subgraph_03794.graphml,哪种检查能同时用于术前急性阑尾炎和假性动脉瘤的诊断，并且在ER和子宫肌瘤的情况下也适用？,超声诊断
bridge_subgraph_03800.graphml,哪种检查能够同时有效诊断抗磷脂综合征和AIEMS，并且也能检测乙型肝炎肝硬化和前列腺癌？,血清检查
bridge_subgraph_03803.graphml,哪种检查能同时准确诊断胎儿骶骨发育不全、病理分型急性阑尾炎，以及识别肺癌和腹主动脉瘤？,超声诊断
bridge_subgraph_03810.graphml,哪种检查能同时用于检测HIV-1感染、预损伤坐骨神经、先心病和桥本甲状腺炎？,提取RNA
bridge_subgraph_03808.graphml,哪种检查能有效同时诊断结直肠癌、糖尿病肾损伤，并兼顾肺心病和急性胰腺炎的筛查？,联合检验
bridge_subgraph_03815.graphml,哪种疾病在急性肠炎和超声诊断中更为常见，并且可能与肺癌或急性肺栓塞同时出现？,冠心病
bridge_subgraph_03816.graphml,哪种医学内容在涉及VIP和胰岛素的同时，也与原发性肝癌和急性胰腺炎相关？,胰高糖素
bridge_subgraph_03806.graphml,哪种检查能同时准确诊断子宫腺肌症、腘动静脉瘘以及恶性肿瘤？,超声诊断
bridge_subgraph_03813.graphml,哪种检查能同时有效诊断女性盆腔附件扭转、新生儿感染性肺炎以及大肠癌和胃癌？,超声诊断
bridge_subgraph_03807.graphml,哪种检查能同时诊断心肌梗死、左前降支冠状动脉梗阻，并发现室间隔缺损和T2DM？,RT-3DE检查
bridge_subgraph_03811.graphml,哪种检查可以同时诊断胆总管结石、甲状腺良恶性肿瘤，以及心衰和泌尿系结石？,超声诊断
bridge_subgraph_03814.graphml,哪种检查可以同时诊断先天性幽门肥厚性狭窄、处女膜闭锁，以及结肠癌和胸腔积液？,超声诊断
bridge_subgraph_03809.graphml,哪种检查能同时准确诊断凶险性前置胎盘和腹内型病变，并排查子宫内膜癌及子宫肌瘤？,超声诊断
bridge_subgraph_03812.graphml,哪种检查能够有效评估ELWI和ARDS，同时还能检测急性肺损伤和胸腔积液？,血管外肺水
bridge_subgraph_03817.graphml,哪种检查能同时准确诊断外伤性胃肠穿孔、皮肤科问题以及乳腺占位性病变和CHD？,超声诊断
bridge_subgraph_03821.graphml,哪种检查能同时用于鼻咽癌的NPC检测、乳腺肿块的评估以及原发性肝癌的诊断？,DCE－MRI
bridge_subgraph_03823.graphml,哪种检查能有效诊断肠扭转、乳腺包块、冠心病和阑尾炎？,超声诊断
bridge_subgraph_03819.graphml,哪种检查能同时准确发现可疑恶性结节、输卵管积液以及大肠癌和胃癌？,超声诊断
bridge_subgraph_03826.graphml,哪种医学内容与先天性胎儿神经管畸形和脐尿管癌直接相关，且常与肿瘤和半月板损伤同时出现？,超声诊断
bridge_subgraph_03818.graphml,哪种检查可以同时用于诊断帕金森病、脓毒症，以及川崎病和心绞痛？,炎症因子水平
bridge_subgraph_03824.graphml,哪种检查能准确评估神经内科患者的神经功能缺损，并兼顾出血和肝硬化的风险？,凝血功能检查
bridge_subgraph_03829.graphml,哪种检查能同时确认AST异常、节育器位置异常以及排查乳腺肿瘤和乳腺疾病？,超声诊断
bridge_subgraph_03828.graphml,哪种检查能同时有效诊断腕管正中神经卡压、女性盆腔附件扭转以及早产和早孕的情况？,超声诊断
bridge_subgraph_03831.graphml,哪种检查能同时检测心肌磷酸肌酶同工酶、乳酸脱氢酶以及AST，并有助于诊断冠心病？,CPK-MB
bridge_subgraph_03827.graphml,哪种检查能准确评估NLVM和胎盘植入，同时在伴有重度积水和药物流产的情况下也能有效应用？,超声诊断
bridge_subgraph_03820.graphml,哪种检查能同时有效诊断盆腔囊实性占位病变、继发性中枢神经系统淋巴瘤，以及脑梗死和子宫瘢痕妊娠？,核磁共振成像检查
