file,query,answer
bridge_subgraph_07301.graphml,哪种疾病最适合采用益肺安神汤治疗，并辅以足部反射区按摩、护理干预及综合护理干预的综合疗法？,失眠
bridge_subgraph_07303.graphml,哪种疾病由火郁引起，常与2型糖尿病同时出现，并需要通过补脾益心和综合治疗进行辅助治疗？,失眠
bridge_subgraph_07299.graphml,哪种症状在服用七叶神安片和阿立哌唑的同时，通过中医护理能有效缓解失眠？,抑郁
bridge_subgraph_07306.graphml,哪种疾病在经济困难的情况下，通过服用宁心汤，并结合年龄因素和化疗手段，能够得到有效治疗？,失眠
bridge_subgraph_07308.graphml,哪种疾病既与腹膜后肿瘤和多原发肿瘤直接相关，又常伴随呕吐和慢性前列腺炎的症状？,下腹痛
bridge_subgraph_07310.graphml,哪种疾病在针刺和中医药治疗中，与δ阿片受体的诊断性试验比值比有显著关联？,DOR
bridge_subgraph_07307.graphml,哪种疾病具有5.76/1 000的发病率，常表现为应激性血糖升高，且其高危因素包括糖尿病，治疗中常需配合循证护理？,CRBSI
bridge_subgraph_07304.graphml,哪种疾病在治疗过程中需要内镜下黏膜剥离术和睡眠护理，并且常伴随酶联免疫吸附试验和心血管疾病的出现？,失眠
bridge_subgraph_07311.graphml,哪种疾病在进行顺铂化疗和联合放疗辅助治疗时，需要特别考虑患者年龄并结合中医药治疗？,晚期NSCLC
bridge_subgraph_07313.graphml,哪种疾病在内科和HADM的临床表现中常见，并且常采用耳穴贴压和综合护理作为辅助治疗？,失眠
bridge_subgraph_07315.graphml,哪种疾病在检查时需要同时进行温补镇和14C呼气试验，并常伴随磁共振和血常规的检测？,失眠
bridge_subgraph_07305.graphml,哪种疾病在横断面呈现“日全食征”和阑尾增粗的临床表现，且在特定性别患者中更常见，并常采用温针灸作为辅助治疗？,急性单纯性阑尾炎
bridge_subgraph_07312.graphml,哪种疾病在亚胺培南治疗过程中，常与肺心病和肺炎同时出现，并伴随EOS升高？,革兰阴性菌感染
bridge_subgraph_07320.graphml,哪种疾病在应激作用和年龄偏大的情况下，容易伴随感染并出现头痛症状？,谵妄状态
bridge_subgraph_07317.graphml,哪种医学内容在结合腹针疗法和基于体质的饮食调护的同时，还能有效配合护理干预，对肺癌患者的治疗起到积极作用？,失眠
bridge_subgraph_07314.graphml,哪种疾病在骨科就诊时表现为平均23.8°的临床症状，并常通过固定支架与支具接力固定进行辅助治疗，同时可能配合中药进行药物治疗？,桡骨远端粉碎性骨折
bridge_subgraph_07322.graphml,哪种疾病在心内科就诊时，吸烟可能是病因，并且可以通过奇迹询问辅助检查和经颅微电流刺激辅助治疗？,失眠
bridge_subgraph_07316.graphml,哪种疾病在低场 MRI 检查中表现出淋漓不尽的症状，且常伴有腹泻，尤其在中老年人群中高发？,宫颈肿瘤
bridge_subgraph_07321.graphml,哪种疾病在采用药物治疗时，与人食管癌和OSCC最为相似，并且常与慢性胃炎及感染同时出现？,穿心莲内酯
bridge_subgraph_07319.graphml,哪种疾病需要使用组合型人工肾和补液进行辅助治疗，并且常伴有肾脏发病和需要进行血常规检查？,鱼胆中毒
bridge_subgraph_07323.graphml,哪种疾病在超声消融组治疗过程中，常伴随胃安神药物的使用，且患者多表现为焦虑和神经症症状？,失眠
bridge_subgraph_07325.graphml,哪种疾病需要通过选择性输卵管造影术或宫腹腔镜联合手术进行治疗，并且常伴有腹痛症状，还需配合心理护理干预？,输卵管阻塞性不孕症
bridge_subgraph_07309.graphml,哪种疾病在治疗过程中需要同时使用低分子肝素钙和地屈孕酮片，并结合常规治疗来应对血瘀证？,不明原因复发性流产
bridge_subgraph_07327.graphml,哪种疾病在看书时需注意多塞平的使用，并常伴随代谢综合征，需要特别的护理措施？,失眠
bridge_subgraph_07324.graphml,哪种疾病更容易与甲状腺相关性眼病和眼球挫伤同时出现，是2型糖尿病还是多发性硬化？,视神经病变
bridge_subgraph_07318.graphml,哪种疾病会导致睡眠结构比例失衡，并可能在接受化疗时伴随呕吐，适合采用疏肝理气养心安神加减疗法治疗？,失眠
bridge_subgraph_07326.graphml,哪种社会学理论能更好地解释糖尿病鉴别诊断与重症监护室并发症之间的关系，尤其是在感染和血管紧张素受体拮抗剂治疗同时出现的情况下？,高血压
bridge_subgraph_07328.graphml,哪种疾病既表现为上呼吸道感染和胃癌的临床症状，又倾向于女性发病并伴随焦虑情绪？,失眠
bridge_subgraph_07334.graphml,哪种疾病在出现呼吸困难得分下降的临床表现时，适合使用补肾安神汤和细胞因子治疗，且多发于特定年龄段人群？,失眠
bridge_subgraph_07332.graphml,哪种疾病与Dickkopf-1和β-catenin密切相关，并且常与肺癌和原发性肝癌同时出现？,DKK1
bridge_subgraph_07330.graphml,哪种疾病适合采用妇可靖胶囊治疗，并辅以中药保留灌肠、针灸治疗以及中医综合疗法？,盆腔炎性疾病后遗症
bridge_subgraph_07331.graphml,哪种疾病在治疗过程中需要同时采用负压伤口治疗技术、无菌护创膜覆盖，并且辅以护理干预和舒适护理？,慢性伤口
bridge_subgraph_07337.graphml,哪种医学内容在治疗首乌藤引起的肝功能异常和心力衰竭时，需要进行干预护理？,失眠
bridge_subgraph_07339.graphml,哪种疾病在遭受钝性暴力后，常伴随HD症状，同时可能出现TH和呕吐？,肠系膜裂孔疝
bridge_subgraph_07344.graphml,哪种疾病会导致头晕乏力、听力下降，并伴随发热和贫血的症状？,多血管炎
bridge_subgraph_07335.graphml,哪种疾病在治疗时通常会同时使用前列地尔脂微球注射液和中药，并且针灸对改善其失眠症状有明显效果？,糖尿病
bridge_subgraph_07338.graphml,哪种疾病在不同性别和年龄段的人群中，通过电刺激治疗能够有效缓解失能症状？,老年人尿失禁
bridge_subgraph_07333.graphml,哪种疾病在治疗过程中常用抗精神类药物如右佐匹隆片，且患者常伴有骨质疏松风险，并通过酶联免疫吸附试验进行实验室检查？,失眠
bridge_subgraph_07345.graphml,哪种疾病与血管生成素样蛋白2和失眠密切相关，且在治疗过程中常结合中医护理技术和中药治疗？,冠心病
bridge_subgraph_07341.graphml,哪种疾病在男生中常见，且使用足反射疗法和多功能导眠仪治疗时，常伴随自杀意念的出现？,失眠
bridge_subgraph_07343.graphml,哪种疾病在进行影像学检查时常与褥疮同时出现，并且需要特别的护理和骨科治疗？,股骨粗隆骨折
bridge_subgraph_07342.graphml,哪种疾病在MUNSH和糖尿病的基础上，还常与贫血同时出现，并且可以通过蒙医药进行治疗？,失眠
bridge_subgraph_07340.graphml,哪种医学内容在急性ST段抬高性心肌梗死和失眠的治疗中更为关键，且常与心肌梗死和贫血同时出现？,PCI
bridge_subgraph_07348.graphml,哪种疾病既与髂前下棘和息肉样脉络膜血管病变相关，又常伴随感染和发热症状？,1型
bridge_subgraph_07346.graphml,哪种疾病在进行LPD手术后，容易出现发热和感染，且与黄体功能不全有关？,LPD
bridge_subgraph_07336.graphml,哪种疾病在采用手针配伍体针治疗时，常伴随呕吐症状，并且需要进行酶联免疫吸附试验来辅助诊断，类似于白细胞减少症的情况？,失眠
bridge_subgraph_07351.graphml,哪种疾病既有溶血性尿毒症（或称动脉病变）的病理特征，又常表现为呕吐和高血压？,HUS
bridge_subgraph_07347.graphml,哪种疾病在非脑血管病中，既能纠正贫血、控制血压，又常与急性脑梗死和子宫肌瘤同时出现？,失眠
bridge_subgraph_07350.graphml,哪种疾病在RT-3DE和彩色多普勒检查中常与心功能不全及心力衰竭同时出现？,NVM
bridge_subgraph_07329.graphml,哪种疾病在采用痰热清联合病毒唑或热毒宁联合更昔洛韦治疗的同时，也常配合自拟中药方剂，并且患者年龄是重要的危险因素？,儿童手足口病
bridge_subgraph_07349.graphml,哪种疾病在进行常规单管负压封闭引流术和维持水电解质平衡的同时，还需要特别重视优质护理，并且常与糖尿病并发？,口腔颌面部间隙感染
bridge_subgraph_07354.graphml,哪种疾病发病率约为11.89%，临床表现为单眼视网膜静脉阻塞，且常伴有高血压病和n1并发症？,视网膜出血
bridge_subgraph_07358.graphml,哪种疾病在围手术期常需进行CT检查，且患者常表现为腹痛和呕吐？,闭合性腹部外伤
bridge_subgraph_07357.graphml,哪种疾病在采用针刺配合耳穴贴压法治疗时，常伴随睡眠障碍，且患者多有血脂异常，尤其在中老年人群中较为常见？,失眠
bridge_subgraph_07359.graphml,哪种疾病在采用生物制剂治疗后，常伴随淋巴结肿大，并且可能与银屑病相关，需要通过磁共振成像进行检查？,脊柱关节炎
bridge_subgraph_07352.graphml,哪种疾病在使用外源性褪黑素干预和足穴按摩的同时，还需要配合FK506治疗，并且与脑损伤相关？,失眠
bridge_subgraph_07363.graphml,哪种疾病与IHH和慢性疾病直接相关，且常与肥胖和糖尿病同时出现？,睾酮水平降低
bridge_subgraph_07361.graphml,哪种疾病在军事训练后易发于头颈部，且需抗感染治疗并辅以甘草药物治疗？,冻伤
bridge_subgraph_07360.graphml,哪种疾病会出现脉络膜视网膜病变的临床表现，且通常使用阿普唑仑片治疗，同时吸烟和年龄是其高危因素？,失眠
bridge_subgraph_07353.graphml,哪种疾病在临床表现上既有ESD又有FD，且在药物治疗中常联合使用右佐匹克隆片和半夏泻心汤？,失眠
bridge_subgraph_07372.graphml,哪种疾病在腹部手术后出现疲劳、腹胀，且治疗时常用复方参芪颗粒和人参？,脾气虚证
bridge_subgraph_07355.graphml,哪种医学内容在氟哌噻吨美利曲辛和高压氧联合针刺的治疗中，最可能与嗜睡和呕吐同时出现？,失眠
bridge_subgraph_07362.graphml,哪种疾病在女性中常见，且在服用定心汤治疗期间，常伴随ET和先兆流产的临床表现？,失眠
bridge_subgraph_07375.graphml,哪种疾病会导致肛门疼痛和轻度排粪失禁，并可能伴随n1和n2这两种并发症？,吻合口出血
bridge_subgraph_07356.graphml,哪种疾病在同时使用博莱霉素（或同义词）和长春新碱（或同义词）治疗时，饮酒和服用褪黑素（或同义词）会增加风险评估？,BLM
bridge_subgraph_07369.graphml,哪种疾病在进行制片G显带检查时常被诊断，且患者常表现出焦虑症状，其病因与抑郁有关？,反复流产
bridge_subgraph_07365.graphml,哪种疾病在重型脑外伤和耳鼻咽喉科治疗中，常与ICU监护和中毒症状同时出现？,经皮扩张气管切开术
bridge_subgraph_07368.graphml,哪种疾病在心功能不全和慢性阻塞性肺疾病患者中，通过安慰剂治疗能有效缓解心（）症状？,失眠
bridge_subgraph_07366.graphml,哪种疾病在化疗过程中常伴随腹痛，且可能出现中枢神经损伤的并发症，而涌泉穴贴敷可作为其辅助治疗方法？,失眠
bridge_subgraph_07364.graphml,哪种疾病在运腹通经推拿法辅助治疗的同时，常伴随肝硬化的临床表现，且需通过检测心肌酶来辅助诊断，且可能与糖尿病相关？,失眠
bridge_subgraph_07374.graphml,哪种疾病既与CPFE综合征相关并影响肺功能，又常与吸烟作为病因和认知行为治疗作为辅助治疗同时出现？,COPD
bridge_subgraph_07373.graphml,哪种疾病在男性中较常见，表现为结节呈低回声，通常需要全甲状腺切除并配合化疗治疗？,甲状腺髓样癌
bridge_subgraph_07370.graphml,哪种疾病在治疗过程中需要纠正电解质失衡，且常由霉菌、病毒或原虫等微生物感染引起，同时伴随腹痛和腹胀的临床表现？,慢性肠炎
bridge_subgraph_07371.graphml,哪种疾病在进行钻孔术后会同时出现类风湿关节炎和疼痛，并且与芹菜素相关？,关节软骨缺损
bridge_subgraph_07378.graphml,哪种疾病在需要进行胸膜剥脱术和胸腔积液端粒酶检查的同时，还常伴随化疗和肺癌的临床表现？,癌性胸腔积液
bridge_subgraph_07377.graphml,哪种疾病在治疗过程中需要同时使用抗生素和肠内营养支持，并且常伴随心力衰竭的发生，还需进行常规护理？,ICU重症肺炎
bridge_subgraph_07381.graphml,哪种疾病会导致男性睾丸发育不全，并需要使用十一酸睾酮胶囊治疗，同时可能通过酶联免疫吸附试验进行诊断？,隐睾
bridge_subgraph_07384.graphml,哪种疾病在临床表现上与强直性脊柱炎相似，且常与乳腺癌和类风湿关节炎同时出现？,关节强直
bridge_subgraph_07376.graphml,哪种疾病是由生理因素引起的，临床表现为多梦，并且可以通过艾灸和常规护理进行辅助治疗？,失眠
bridge_subgraph_07386.graphml,哪种疾病在磁共振检查中表现为快进快出，且与肝血管癌和乳腺癌的病理分型有关？,肝转移癌
bridge_subgraph_07367.graphml,哪种疾病在淋巴结内较少见，多与免疫缺陷（如HIV病毒感染）相关，血管腔隙少见，梭形细胞裂隙内可见外渗的红细胞和淋巴细胞，透射电镜下有特殊表现，且常与混合型肿瘤同时出现？,Kaposi肉瘤
bridge_subgraph_07380.graphml,哪种疾病在女性中较为罕见，常通过酶联免疫吸附法进行实验室检查，且在治疗过程中需要结合健康教育，病理分型中包括尿道下裂？,先天性尿道下裂
bridge_subgraph_07388.graphml,哪种医学内容在涌泉穴按摩和运动指数的关联中，与磁共振和帕金森病的研究更为密切？,失眠
bridge_subgraph_07379.graphml,哪种疾病会出现难以缓解的多虑和MT，并且常伴随恶性肿瘤和MMT？,失眠
bridge_subgraph_07383.graphml,哪种疾病在百会药物治疗过程中，因与琪素相搏而引发，且在化疗时表现出与性别相关的特定症状？,失眠
bridge_subgraph_07390.graphml,哪种疾病会导致深黄色尿和湿热质，且常与糖尿病同时出现，需要特别注意常规护理？,失眠
bridge_subgraph_07387.graphml,哪种疾病在采用单孔腹腔镜疝囊高位结扎术式或两孔腹腔镜治疗时，更容易出现疼痛和感染等并发症？,小儿腹股沟疝
bridge_subgraph_07385.graphml,哪种疾病在治疗过程中既需要使用暖箱复温和肝素，又常伴随推拿和丹参注射液的应用？,新生儿寒冷损伤综合征
bridge_subgraph_07392.graphml,哪种疾病与石墨炉原子吸收法和世代时间缺陷直接相关，且常与精神分裂症和肝病同时出现？,铝
bridge_subgraph_07382.graphml,哪种疾病既与ALRI和G+菌败血症直接相关，又常与恶性肿瘤和感染同时出现？,G-菌
bridge_subgraph_07389.graphml,哪种疾病在实验室检查中表现为血小板参数异常，体格查体有相应体征，且临床上常伴随发热症状，需要联合治疗？,重症支原体肺炎
bridge_subgraph_07391.graphml,哪种疾病既有MCI作为高危因素，又可以通过心理干预疏导辅助治疗，且常伴随乙型肝炎肝硬化和肝硬化的临床表现？,失眠
bridge_subgraph_07395.graphml,哪种疾病与哮喘及甲苯二异氰酸酯直接相关，并且常与支气管哮喘和中医中药同时出现？,职业性哮喘
bridge_subgraph_07401.graphml,哪种医学内容在涉及闭塞处均有分支和皮冠状动脉介入治疗的同时，也与心内科和心电图相关？,冠状动脉慢性完全闭塞
bridge_subgraph_07400.graphml,哪种疾病会导致困倦和药物不良反应，且常与PCI和急性冠状动脉综合征同时出现？,失眠
bridge_subgraph_07398.graphml,哪种疾病在采用rTMS联合唑吡坦药物治疗的同时，还需要配合心理护理和综合护理进行辅助治疗，以达到抗抑郁焦虑的效果？,失眠
bridge_subgraph_07403.graphml,哪种疾病可以通过后溪辅助治疗，且病因是阳热亢盛，同时伴有呕吐和恶心的症状？,失眠
bridge_subgraph_07397.graphml,哪种疾病在亚硝酸盐中毒和创伤性休克兔肺损伤中更为常见，且可能与肿瘤或晚期癌症同时出现？,亚甲蓝
bridge_subgraph_07399.graphml,哪种疾病在采用芳香疗法和腹针疗法联合针灸作为辅助治疗的同时，常表现为慢性支气管炎，并需要通过磁共振成像进行检查？,失眠
bridge_subgraph_07394.graphml,哪种疾病在进行腹膜前修复手术治疗后，常伴随腹股沟疝的病理分型，且在综合护理干预过程中容易出现发热并发症？,疝
bridge_subgraph_07404.graphml,哪种疾病会导致大学生神经质人格患者在接受化疗和磁共振检查时出现VCI症状？,失眠
bridge_subgraph_07393.graphml,哪种医学内容最常涉及Dworak肿瘤和NSE，并且通常与肿瘤类型和患者年龄同时讨论？,pCR
bridge_subgraph_07405.graphml,哪种疾病在应用二维斑点追踪技术时，男性与女性的BMI差异最为显著？,NG
bridge_subgraph_07406.graphml,哪种疾病会以心为发病部位，通过运动处方辅助治疗，并伴随疼痛和骨质疏松这些临床表现和高危因素？,失眠
bridge_subgraph_07396.graphml,哪种疾病与体质量指数异常和焦虑自评量表高分密切相关，并且在进行酶联免疫吸附试验时常在男性患者中发现？,失眠
bridge_subgraph_07402.graphml,哪种疾病会同时出现帕金森病和高血压，并且与FIns、HOMA-IR和HbA1c的实验室检查结果密切相关？,OSAHS组
bridge_subgraph_07407.graphml,哪种疾病在安慰剂组和进展性脑梗死组中，常伴随血糖增高和高血脂现象？,糖尿病
bridge_subgraph_07416.graphml,哪种疾病在特定年龄阶段需要特别的护理干预方法，并且需要长期维护治疗以配合护理干预？,老年牙周炎
bridge_subgraph_07410.graphml,哪种疾病在慢性心力衰竭和健忘的同时，还可能伴随恶性肿瘤和食欲不振的出现？,失眠
bridge_subgraph_07411.graphml,哪种疾病在女性患者中更易与催眠类药物和安眠药的使用相关，并且常常伴随恶性肿瘤的出现？,失眠
bridge_subgraph_07418.graphml,哪种疾病在MRI检查中难以发现，常与隐匿性冠心病相伴，并且需要心理干预和糖尿病管理同时进行？,冠心病
bridge_subgraph_07409.graphml,哪种疾病在心内科就诊时表现为心悸，并且需要通过镶嵌治疗和免疫抑制法进行综合治疗？,肺动脉瓣狭窄
bridge_subgraph_07412.graphml,哪种疾病在拔管综合征的临床表现中，常需使用镇静催眠药治疗，并可能同时配合参松养心胶囊和艾灸进行辅助治疗？,失眠
bridge_subgraph_07414.graphml,哪种疾病在绝经后容易出现，且可以通过刺激百会穴、认知行为疗法和服用帕罗西汀来缓解？,失眠
bridge_subgraph_07424.graphml,哪种疾病与代谢综合征和SAS直接相关，且常与白塞病和磁共振检查同时出现？,失眠
bridge_subgraph_07423.graphml,哪种疾病在继发性失眠的治疗中，针刺结合耳穴治疗的效果比单纯药物治疗更显著，且常伴随发热症状？,失眠
bridge_subgraph_07421.graphml,哪种疾病在出现肺肿瘤和肺癌并发症时，需要通过胸腔引流手术治疗，并配合综合护理干预进行辅助治疗？,支气管胸膜瘘
bridge_subgraph_07415.graphml,哪种社会学理论能解释失眠与艾滋病毒感染并发，以及脑出血和维生素E治疗之间的关联？,恶性肿瘤
bridge_subgraph_07417.graphml,哪种疾病在蒙医温针治疗中常见，且表现为肌萎缩侧索硬化、焦虑，并多发于特定年龄段？,失眠
bridge_subgraph_07408.graphml,哪种疾病在出现突聋症状时，常伴随恐惧感，并且可以通过马来酸桂哌齐特注射液治疗及护理干预辅助缓解？,突发性感音神经性耳聋
bridge_subgraph_07425.graphml,哪种疾病在临床上常表现为mIU和冠心病，并且需要综合护理和常规护理作为辅助治疗？,失眠
bridge_subgraph_07422.graphml,哪种疾病会导致中老年人同时出现颈动脉斑块和头颅核磁异常，且常伴有高血压？,胼胝体梗死
bridge_subgraph_07432.graphml,哪种疾病在急性心肌梗死和睡眠质量较差的情况下，同时伴随心电图异常和肌钙蛋白升高？,冠心病
bridge_subgraph_07413.graphml,哪种疾病在骨科就诊时，通常需要通过前路外科手术或Wiltse肌间隙入路进行手术治疗，并且术后需配合优质护理？,胸腰段脊柱骨折
bridge_subgraph_07420.graphml,哪种疾病在鉴别诊断时需考虑抑郁障碍，且常表现为睡眠质量差，同时在年龄较大的人群中更常见，并通过半随机对照试验进行实验室检查？,失眠
bridge_subgraph_07429.graphml,哪种疾病在火郁和脑震荡后综合征的同时，需要配合心理疏导和心理护理进行治疗？,失眠
bridge_subgraph_07427.graphml,哪种医学内容在危重呼吸衰竭和颅脑病变的治疗中，常与肺炎和脑损伤同时出现？,有创通气
bridge_subgraph_07426.graphml,哪种疾病会导致CIV和睡眠时间、深度不足，且常与心脏病和维生素缺乏同时出现？,失眠
bridge_subgraph_07430.graphml,哪种疾病既会出现重型神经精神症状和胃食管反流病，又常与维持性血液透析和脑血管病同时发生？,失眠
bridge_subgraph_07431.graphml,哪种疾病在采用瑜伽训练艺术行为干预的同时，还需要关注血常规指标，并且可能辅以刺五加治疗，类似于多发性硬化的管理方式？,失眠
bridge_subgraph_07433.graphml,哪种疾病会导致夜间多尿和静息扫描异常，同时伴随腹胀和嗳气？,失眠
bridge_subgraph_07439.graphml,哪种疾病既会导致慢性肝炎和高血压，又常伴有喘憋和关节痛的临床表现？,冷球蛋白血症
bridge_subgraph_07436.graphml,哪种疾病在医院的常规护理中特别需要重视排痰护理，并且通常需要接受化疗？,肺癌晚期
bridge_subgraph_07419.graphml,哪种疾病需要进行逆行球头形硅胶管植入和逆行鼻泪管扩张手术，并辅以常规护理和心理护理？,鼻泪管阻塞
bridge_subgraph_07434.graphml,哪种疾病既与苯二氮卓类药物相关，又常伴随重性抑郁障碍，且可能导致中毒和睡眠障碍？,失眠
bridge_subgraph_07438.graphml,哪种疾病在脑血管意外后剖宫产术的护理中，需要特别关注舒适护理与常规护理的结合？,妊娠子痫前期
bridge_subgraph_07437.graphml,哪种疾病在治疗过程中常结合深部脑刺激和tDCS，且其发病与环境和慢性病因素密切相关？,神经精神疾病
bridge_subgraph_07440.graphml,哪种医学内容在电刺激小脑顶核、脾胰耳穴磁珠贴压的同时，常与心电图和肝硬化相关？,失眠
bridge_subgraph_07428.graphml,哪种社会学理论能更好地解释TTT治疗和超声造影剂时间-强度曲线在辅助治疗中的应用，以及穴位贴敷和磁共振成像在影像学检查中的协同作用？,肿瘤
bridge_subgraph_07449.graphml,哪种疾病在老年人中常见，且可以通过傅里叶红外变换光谱和实时PCR技术进行感染检测？,沙门菌
bridge_subgraph_07441.graphml,哪种疾病会导致男性在年龄增长时出现睡眠时间较短和恶性肿瘤的临床表现？,失眠
bridge_subgraph_07435.graphml,哪种疾病在治疗过程中特别需要通过营造舒适的病室环境、循经选穴针刺、舒适护理和常规护理等多种辅助手段来综合提升疗效？,失眠
bridge_subgraph_07454.graphml,哪种疾病会同时出现胸痛、心包积血以及皮疹和头痛的临床表现？,第45例
bridge_subgraph_07445.graphml,哪种疾病在治疗过程中需要使用硫酸镁和GDFT，并且常与感染和胃癌同时出现？,结直肠手术
bridge_subgraph_07444.graphml,哪种疾病在女性中较为常见，且与不良生活习惯有关，通常需要通过针刺加灸辅助治疗，并配合文拉法辛药物治疗？,失眠
bridge_subgraph_07448.graphml,哪种疾病以抑郁为高危因素，并且常采用闭合复位、中药熏洗和中医护理作为辅助治疗？,骨折
bridge_subgraph_07446.graphml,哪种疾病在辅助治疗中常采用舞动瑜伽，临床表现包括化疗后的反应和发热，且需通过磁共振进行影像学检查？,失眠
bridge_subgraph_07443.graphml,哪种社会学理论能解释失眠与TOAST分类的关系，并涉及腔隙性脑梗死和Fbg的因素？,脑梗死
bridge_subgraph_07456.graphml,哪种疾病在焦虑、抑郁患者中常见，并且可以通过神阙穴药物和护理干预来有效缓解？,骨肿瘤化疗
bridge_subgraph_07442.graphml,哪种疾病在未触及肝脾大时，常与小儿高雪氏病同时出现，且可能伴随尿毒症和乙型肝炎？,贫血貌
bridge_subgraph_07447.graphml,哪种疾病在采用小剂量米氮平治疗的同时，还需结合健康教育和舒适护理来缓解慢性盆腔炎症的症状？,失眠
bridge_subgraph_07451.graphml,哪种疾病在临床表现上既有疼痛又有胃癌症状，且在手术治疗中常采用游离皮瓣修复，同时需要通过CEA联合检测来辅助诊断？,癌性溃疡
