file,query,answer
bridge_subgraph_09302.graphml,哪种疾病既由经济压力和睡眠不规律引起，又常与新型冠状病毒肺炎的临床表现相似，且需通过健康宣教辅助治疗？,失眠
bridge_subgraph_09305.graphml,哪种疾病会导致髋臼磨损和寰枢椎骨折，且其病因常与脑卒中相关，临床表现中常伴有糖尿病？,关节脱位
bridge_subgraph_09308.graphml,哪种医学内容在涉及骨髓干细胞和外克隆形成法的同时，也需要考虑护理干预和心理干预的综合应用？,造血干细胞
bridge_subgraph_09307.graphml,哪种疾病在治疗时需要使用疏肝解郁胶囊联合小剂量氟伏沙明或加味甘麦大枣汤，且可能导致中毒并出现恶心的症状？,失眠
bridge_subgraph_09303.graphml,哪种疾病在治疗过程中需要同时使用中成药和维持性血液透析，并辅以常规护理及常规护理干预？,失眠
bridge_subgraph_09309.graphml,哪种疾病会导致膝关节肿胀和疼痛，且病理分型可能是恶性纤维组织细胞瘤或恶性肿瘤？,透明细胞肉瘤
bridge_subgraph_09313.graphml,哪种疾病在消化内科就诊时，除了内科保守治疗外，还需要配合有效护理和舒适护理进行辅助治疗？,胃溃疡合并出血
bridge_subgraph_09312.graphml,哪种疾病适合用蒿芩清胆汤和小柴胡汤治疗，并且常因风寒引起，同时可辅以中药足浴？,小儿外感发热
bridge_subgraph_09310.graphml,哪种疾病在使用二苓术泽汤治疗的同时，配合推拿手法和敷脐疗法，能达到96.00%的预后生存率？,小儿泄泻
bridge_subgraph_09315.graphml,哪种疾病在患者使用无环鸟苷治疗期间，同时出现腹胀和原发性高血压，且需要通过血清抗体检查来确诊？,HSV感染
bridge_subgraph_09311.graphml,哪种疾病在治疗时需要药物联合心理干预，并且常与百会、小檗碱和卒中同时出现？,失眠
bridge_subgraph_09317.graphml,哪种疾病在30岁前容易出现，且通过CT检查可发现，同时伴随疼痛和呕吐症状？,HAE
bridge_subgraph_09304.graphml,哪种疾病在尿毒症不安腿综合征患者中，通过针刺结合耳穴压豆治疗时，需要特别考虑年龄和心理护理的影响？,失眠
bridge_subgraph_09314.graphml,哪种疾病在治疗过程中常采用中医穴位按摩和手法按摩联合情志干预作为辅助治疗，且其临床表现包括脑性瘫痪，药物治疗中常用苯巴比妥？,失眠
bridge_subgraph_09319.graphml,哪种疾病在进行心理检查的同时，还需要通过纠正贫血、控制血压来辅助治疗，并且常伴随心电图和心脏超声的影像学检查？,失眠
bridge_subgraph_09321.graphml,哪种疾病在Ⅲ度面积风险评估下，需要特别重视感染并发症，并通过康复训练和舒适护理进行辅助治疗？,大面积深度烧伤
bridge_subgraph_09322.graphml,哪种疾病会导致男性血清25(OH)D3水平下降，并伴随心理因素，同时需要综合护理？,失眠
bridge_subgraph_09316.graphml,哪种疾病在进行盆底康复训练和预见性护理的同时，还需要结合心理护理及心理护理干预作为辅助治疗？,子宫全切
bridge_subgraph_09323.graphml,哪种疾病在彻底清除异物辅助治疗睾丸损伤的同时，需特别考虑患者年龄和感染高危因素？,开放性损伤
bridge_subgraph_09318.graphml,哪种疾病在产后抑郁和妊娠期肝内胆汁淤积症的情况下，更容易与慢性前列腺炎同时出现，并且可以通过中药治疗？,失眠
bridge_subgraph_09326.graphml,哪种疾病既可能由心理负担和饮食及药物因素引起，又常表现为腹胀和贫血？,失眠
bridge_subgraph_09320.graphml,哪种医学内容会同时涉及心脉瘀阻和一般健康指导，并且可能与右美托咪定和呕吐相关？,失眠
bridge_subgraph_09331.graphml,哪种疾病在治疗过程中需要使用镇静催眠药，且常伴随TBil升高、肿瘤和肝功能异常？,失眠
bridge_subgraph_09325.graphml,哪种疾病在治疗过程中常同时使用氯丙咪嗪和舍曲林，并且适合辅以浮针疗法，属于精神障碍范畴？,疼痛障碍
bridge_subgraph_09324.graphml,哪种疾病在早期需要通过脐血血气分析进行诊断，并采用人工排便联合光疗进行治疗，同时在护理干预后仍可能出现腹泻症状？,早产儿黄疸
bridge_subgraph_09327.graphml,哪种疾病既有抑郁症状作为高危因素，又常在消化内科出现临床表现，且治疗时除了使用右美托咪定药物外，还可辅助以穴位按摩联合理疗？,失眠
bridge_subgraph_09332.graphml,哪种疾病在冠心病患者中，通过个体化心理治疗效果最显著，且这种效果与患者的性别和年龄有怎样的关联？,失眠
bridge_subgraph_09335.graphml,哪种医学内容能解释BZDs与脚心不适、易醒和心悸同时出现的原因？,失眠
bridge_subgraph_09329.graphml,哪种疾病在老年人中多发，且临床表现为急性尿潴留，同时化疗也可能引发，且受教育程度是风险评估因素之一？,失眠
bridge_subgraph_09338.graphml,哪种疾病会导致脑腱黄瘤病和烧灼感，且常与年龄增长和慢性胃炎同时出现？,黄色瘤
bridge_subgraph_09340.graphml,哪种疾病在自我训练和心理负担较重的情况下，常常伴随饮酒习惯，并且需要特别的心理护理？,失眠
bridge_subgraph_09330.graphml,哪种疾病在MR影像学检查中表现为陈旧性寰枢关节脱位，且在治疗过程中需要结合健康宣教和常规护理？,难复性寰枢椎脱位
bridge_subgraph_09328.graphml,哪种疾病在透灸、中药足浴结合足底穴位按摩的辅助治疗下，常伴有肥胖和心房颤动的临床表现？,失眠
bridge_subgraph_09337.graphml,哪种疾病在使用多导睡眠记录仪监测的同时，常与学习压力相关，且可能需要通过认知疗法来辅助治疗，且与肿瘤有一定关联？,失眠
bridge_subgraph_09333.graphml,哪种医学内容在亚急性坏死性脑脊髓病和基底节的诊断中，常通过头颅MRI或磁共振进行检查？,Leigh病
bridge_subgraph_09334.graphml,哪种疾病与70.3%的高心理困扰直接相关，且常与肝硬化和突发性耳聋同时出现？,心理困扰
bridge_subgraph_09343.graphml,哪种疾病在治疗时可能同时使用六味安神汤和针对肾的药物，并且常与肿瘤及膀胱癌相关？,失眠
bridge_subgraph_09346.graphml,哪种疾病在从事体力劳动的人群中较为常见，且适合采用刺络拔罐、中医特色护理和针刺等辅助治疗手段？,下肢丹毒
bridge_subgraph_09345.graphml,哪种疾病在进行唇侧正畸非拔牙治疗和安氏Ⅰ类错颌矫正时，常伴随疼痛并需要心理治疗？,错颌畸形
bridge_subgraph_09336.graphml,哪种疾病在治疗过程中需要心理疏导辅助，并常使用黄芪注射药物，同时可能伴随肝功能异常和银屑病的表现？,失眠
bridge_subgraph_09344.graphml,哪种疾病在治疗过程中需要同时使用小柴胡汤和黄连肉桂汤，并结合心理疏导和舒适护理？,失眠
bridge_subgraph_09347.graphml,哪种疾病在涉及大动脉术后放射治疗的同时，常伴随发热和头颈部症状？,Rosai-Dorfman病
bridge_subgraph_09339.graphml,哪种医学内容涉及到针刺主穴四关穴和大脑中动脉供血区梗死，且常与女性和发热同时出现？,失眠
bridge_subgraph_09341.graphml,哪种疾病在治疗过程中需要使用GnRHa联合rhGH药物，并通过阴道涂片检查进行监测，同时还需要配合健康教育和考虑学习压力的影响？,ICPP
bridge_subgraph_09350.graphml,哪种疾病在采用滋水清肝饮和针刺法治疗的同时，还需要考虑婚姻状况并进行综合护理干预？,失眠
bridge_subgraph_09348.graphml,哪种疾病会导致腰部冷痛和雷诺病，且常伴有腹泻和2型糖尿病？,脾肾阳虚
bridge_subgraph_09342.graphml,哪种疾病在采用丙泊酚复合瑞芬太尼治疗时，容易引发下肢深静脉血栓，并且需要结合一般护理和糖尿病的手术治疗？,普外手术
bridge_subgraph_09352.graphml,哪种疾病在大于60岁的男性中，特别是糖尿病患者和ALP水平较高的人群中，发病率较高？,中重度血管钙化
bridge_subgraph_09353.graphml,哪种疾病在治疗过程中可能需要使用聚丙烯补片或人工合成材料无张力修补，并且常伴随结肠癌和肿瘤等并发症？,腹壁切口疝
bridge_subgraph_09356.graphml,哪种疾病与维生素B2缺乏和低氧适应直接相关，且常与OSAHS和CRF同时出现？,急性低氧
bridge_subgraph_09354.graphml,哪种疾病既与冠状动脉粥样硬化性疾病和肝豆状核变性相关，又常伴随震颤和脑电图异常？,神经型
bridge_subgraph_09349.graphml,哪种症状最常见于人间布病患者，且常伴随失眠、乏力和主要出现在男性身上？,发热
bridge_subgraph_09359.graphml,哪种医学内容在涉及DC-CIK和MFI的同时，也与卒中和高血压病史相关？,失眠
bridge_subgraph_09351.graphml,哪种疾病在宫缩乏力作为风险评估因素时，常采用阴道纱条填塞以及综合护理和综合护理干预作为辅助治疗？,阴道分娩产后出血
bridge_subgraph_09355.graphml,哪种疾病在更年期综合征的临床表现中，可以通过看书辅助治疗，并且常与中成药和安慰剂同时使用？,失眠
bridge_subgraph_09357.graphml,哪种疾病在MFS患者中通过超声心动图检查发现，并常伴随焦虑和心悸症状？,二尖瓣脱垂综合征
bridge_subgraph_09360.graphml,哪种疾病在采用清肝活血汤治疗的同时，还需要结合心理护理，并且与糖尿病和脑卒中有相似的病理分型？,轻度高血压
bridge_subgraph_09358.graphml,哪种疾病在药物治疗中需使用U-SGB，且常表现为褪黑素水平降低，同时在体格检查中可能发现与急性冠状动脉综合征相关的症状？,失眠
bridge_subgraph_09364.graphml,哪种疾病更容易在成绩水平较低、自我效能感不强，同时伴随生活压力和学习压力的人群中出现？,学习倦怠
bridge_subgraph_09361.graphml,哪种疾病在治疗过程中常采用针刺配合耳穴按压和扎来普隆药物，并且患者可能伴有肿瘤症状，同时需要进行健康教育？,失眠
bridge_subgraph_09362.graphml,哪种疾病在治疗过程中需要同时考虑美沙酮的使用和护理干预措施，且常与肺癌和恶性肿瘤并发？,失眠
bridge_subgraph_09363.graphml,哪种疾病既能通过调节阴阳的偏盛偏衰和疏通经络来辅助治疗，又常用半夏秫米汤作为药物治疗，并且与遗传和环境因素密切相关？,失眠
bridge_subgraph_09366.graphml,哪种疾病在临床上表现为名誉受损，西医治疗可作为辅助手段，且常伴有抑郁症状，需要配合心理疗法进行治疗？,失眠
bridge_subgraph_09369.graphml,哪种疾病在脑MRI检查中发现与AHDS相关，且常伴随运动障碍和脑损伤？,肌张力不全
bridge_subgraph_09370.graphml,哪种疾病容易导致大隐静脉桥血管狭窄或堵塞，且患者通常伴有高血压和吸烟习惯？,SVG
bridge_subgraph_09367.graphml,哪种疾病在对照组中出现，且常与肝硬化和肝性胸水同时伴随血常规异常？,糖尿病
bridge_subgraph_09372.graphml,哪种疾病会导致肱骨头坏死和感染，同时伴随疼痛，且可能需要使用锁定接骨板进行治疗？,LPHP
bridge_subgraph_09375.graphml,哪种疾病在北京和天津多发，常由意外伤害引起，并且容易导致糖尿病和恶性肿瘤？,早死
bridge_subgraph_09368.graphml,哪种疾病在治疗过程中常同时采用推拿疗法、益气宣肺法、温针灸和针灸治疗作为辅助手段？,小儿遗尿
bridge_subgraph_09374.graphml,哪种疾病会导致模型大鼠在经鼻空肠营养过程中出现兴奋型反应并伴随感染？,ASP
bridge_subgraph_09365.graphml,哪种疾病在针刺神门、三阴交和艾灸神阙的治疗过程中，常伴随腹泻症状，且在体格检查和PANSS评估中有明显表现？,失眠
bridge_subgraph_09373.graphml,哪种疾病可以通过肢体缺血预处理联合外周血干细胞治疗，并常与葛根素和糖尿病相关？,肢体缺血
bridge_subgraph_09380.graphml,哪种疾病会在胸腹部钝性外伤后，通过胸部上腹部CT扫描发现，并伴随胸闷和呕吐的症状？,膈疝
bridge_subgraph_09381.graphml,哪种疾病在服用和化安神方及环境改变后，仍会与产后抑郁或普通抑郁同时出现？,失眠
bridge_subgraph_09376.graphml,哪种疾病在绝经组中卵巢恶性肿瘤患者接受常规护理和心理护理时最常见？,卵巢囊肿蒂扭转
bridge_subgraph_09382.graphml,哪种疾病与浓度乙醇和ginine直接相关，并且常与2型糖尿病和血脂异常同时出现？,ADMA
bridge_subgraph_09377.graphml,哪种疾病在辅助治疗中需要同时进行饮食控制和运动锻炼，并且常伴随脑梗死和焦虑的临床表现？,护理后
bridge_subgraph_09379.graphml,哪种疾病在采用温通潜阳方治疗的同时，常需要通过经颅多普勒检查，并且往往与冠心病和原发性高血压并发？,失眠
bridge_subgraph_09384.graphml,哪种疾病在采用平衡针针刺治疗作为辅助治疗时，常伴有头痛和呕吐的临床表现，且其病因与精神心理因素密切相关？,失眠
bridge_subgraph_09385.graphml,哪种疾病既可能出现早产儿湿肺和雷诺氏综合征的临床表现，又常与糖尿病和骨折的症状同时出现？,青紫
bridge_subgraph_09371.graphml,哪种疾病在治疗过程中常采用针药联合治疗作为辅助手段，并且患者常表现为精神症状，通过脑电图检查可以辅助诊断，同时药物治疗中会用到滋心汤？,失眠
bridge_subgraph_09378.graphml,哪种疾病在采用按摩百会穴、耳穴压豆配合中药沐足的同时，还能通过综合护理干预和优质护理来辅助治疗？,失眠
bridge_subgraph_09388.graphml,哪种疾病在体格检查时发现异位放电，且常与TTP相关，并可能在不同年龄人群中出现？,CCD
bridge_subgraph_09391.graphml,哪种疾病会导致肝脏受损、异氟烷过敏，并伴随血糖升高和腰痛症状？,老年肾综合征出血热
bridge_subgraph_09390.graphml,哪种疾病会导致焦虑、急躁、不得卧，并且常与病毒性肝炎和肝病同时出现？,失眠
bridge_subgraph_09386.graphml,哪种疾病在治疗时常用卡马西平药物，必要时需进行枕大神经减压术，且患者常伴有发热症状，推拿可作为辅助治疗方法？,枕大神经痛
bridge_subgraph_09389.graphml,哪种疾病更容易导致老年脑积水和急性脑膨出，同时常伴随脑出血和肿瘤的出现？,急性脑积水
bridge_subgraph_09383.graphml,哪种疾病在女性中更常见，且通过改良中药外敷方法治疗，需与胫骨骨折进行鉴别诊断？,踝关节损伤
bridge_subgraph_09395.graphml,哪种社会学理论能够解释耳鸣和佐匹克隆的使用，以及它们与CAP和失语现象的同时出现？,高血压
bridge_subgraph_09397.graphml,哪种疾病会出现瘙痒，并且在使用右美托咪治疗的同时伴随呕吐和恶心？,七氟醚全麻
bridge_subgraph_09387.graphml,哪种疾病会导致中老年人出现腹胀，且与阿森斯失眠量表评分高和阴阳失调有关？,失眠
bridge_subgraph_09394.graphml,哪种疾病在老年抑郁症患者失眠的治疗中，既需要使用睡宁胶囊，又可能伴随椎动脉型颈椎病，并考虑采用星状神经节阻滞疗法？,失眠
bridge_subgraph_09392.graphml,哪种疾病在压患者耳部穴位和进行静息态fMRI检查时，常伴随阳陵泉穴位针刺治疗？,失眠
bridge_subgraph_09396.graphml,哪种疾病在出现胸闷症状的同时，可能因心肌梗死引发，并需要通过裂缺修复手术治疗其并发症完全性肺静脉异位引流？,二尖瓣关闭不全
bridge_subgraph_09407.graphml,哪种疾病会导致脱发且患者仍可独立行走，同时需要心理护理和护理干预？,神经炎
bridge_subgraph_09404.graphml,哪种疾病在治疗过程中会同时使用甜梦胶囊和芳香疗法，并且常见恶性肿瘤和化疗的临床表现？,失眠
bridge_subgraph_09402.graphml,哪种疾病在使用解郁安神颗粒治疗时，常因学习紧张导致肢体无力和头痛？,失眠
bridge_subgraph_09400.graphml,哪种疾病在采用颅内动脉瘤介入术治疗的同时，还需配合补心益气汤以及护理干预和中药辅助治疗？,失眠
bridge_subgraph_09399.graphml,哪种疾病在调养气血、使用他莫昔芬治疗的同时，还需要结合健康教育和心理干预进行辅助治疗？,PCOS不孕症
bridge_subgraph_09401.graphml,哪种疾病在男性患者中常见，且伴随射血分数减少和老年高同型半胱氨酸血症，同时需要心理干预？,高血压肾损害
bridge_subgraph_09393.graphml,哪种疾病在进行动态营养筛查时需特别关注医院内感染，且在常规护理中常辅以右美托咪定药物治疗？,重症患者
bridge_subgraph_09406.graphml,哪种疾病在治疗过程中需要特别加强睡眠护理和辨证用药，并且常伴随脑肿瘤的临床表现，通过磁共振成像进行检查？,失眠
bridge_subgraph_09398.graphml,哪种疾病在临床表现上既包括中、重度烧伤，又可能伴随胃癌，且在辅助治疗中常采用刺激控制训练法，并且其病因与性别有关？,失眠
bridge_subgraph_09410.graphml,哪种疾病会导致面颊区在照相时显得异常，且可能伴随按摩后肿瘤的出现？,凹陷
bridge_subgraph_09403.graphml,哪种疾病在治疗中常采用团体认知行为治疗作为辅助手段，同时森田疗法也用于其药物治疗，且吸烟是其常见病因之一，肥胖为其典型临床表现？,失眠
bridge_subgraph_09409.graphml,哪种疾病在劳动时弯腰次数多且需要保留后方韧带复合体椎管减压术治疗，同时还需要进行护理干预和心理护理？,腰椎病变
bridge_subgraph_09413.graphml,哪种疾病既有阴虚阳亢和躯体化的临床表现，又常与2型糖尿病相关，且需要护理干预作为辅助治疗？,失眠
bridge_subgraph_09412.graphml,哪种疾病在血液检查中仅占1%，且常伴有腹胀和腹泻的症状？,乳糜泻
bridge_subgraph_09427.graphml,哪种疾病会导致多器官功能障碍和心力衰竭，同时伴随发热和腹痛？,儿童暴发性心肌炎
bridge_subgraph_09411.graphml,哪种疾病在治疗时常用平肝安神汤和思诺思，且在诊断过程中需进行酶联免疫吸附试验，主要影响神经系统？,失眠
bridge_subgraph_09405.graphml,哪种疾病在治疗时需要用到蒙脱石散，并且需要特别关注家属心理护理，同时可能会用到酶联免疫法进行检测，还常与肺炎同时出现？,带状疱疹病毒感染
bridge_subgraph_09414.graphml,哪种疾病会导致排尿困难并伴随血管神经性头痛，同时在治疗中常采用单盲法和蒙药辅助？,失眠
bridge_subgraph_09419.graphml,哪种疾病在UM-3R超声成像中常与脾功能亢进症同时出现，且需要配合原发性肝癌的整体护理？,门脉高压症
bridge_subgraph_09422.graphml,哪种疾病在女性和肥胖人群中较常见，且在进行针刺按摩时容易导致骨折？,失眠
bridge_subgraph_09408.graphml,哪种疾病在采用温针灸联合头背部推拿法和综合护理干预辅助治疗的同时，常伴随腹痛，并需通过睡眠信念与态度量表进行辅助检查？,失眠
bridge_subgraph_09425.graphml,哪种疾病在女性患者中常见，且表现为气短，治疗时可能采用肢体取穴针刺法或使用酒石酸唑吡坦？,失眠
bridge_subgraph_09417.graphml,哪种社会学理论能够解释左室重量指数与失眠之间的关系，并且在这一过程中，心理干预治疗的有效性占比达到21.1%？,高血压
bridge_subgraph_09420.graphml,哪种疾病既有失眠和疼痛的临床表现，又与肌壁间肌瘤的高危因素相关，且可能需要使用垂体后叶素进行治疗？,子宫肌瘤
bridge_subgraph_09415.graphml,哪种疾病在控制血压和脑电治疗的同时，常伴随低热现象，并且需要通过磁共振成像进行检查？,失眠
bridge_subgraph_09416.graphml,哪种疾病在治疗过程中常同时使用丹参注射液、白芍以及喹硫平，并且需要进行尿常规检查？,失眠
bridge_subgraph_09423.graphml,哪种疾病会导致心脉瘀阻，且患者中占8.6%，常伴随胸闷和血常规异常？,失眠
bridge_subgraph_09421.graphml,哪种疾病在治疗过程中需要采用超声雾化吸入法进行及时的气道湿化，并且常常伴随循证护理和心律失常的情况？,人工气道
bridge_subgraph_09426.graphml,哪种疾病在采用八段锦结合针刺治疗和揉捏指（趾）末节法辅助治疗的同时，常伴随发热和呕吐的临床表现？,失眠
bridge_subgraph_09418.graphml,哪种疾病在并发阑尾炎时，可能需要经皮置管引流治疗，且常与结肠癌和糖尿病同时出现？,腹腔脓肿
bridge_subgraph_09433.graphml,哪种疾病可以通过Epley手法复位或耳石手法复位治疗，并常伴随眩晕和头晕症状？,耳石症
bridge_subgraph_09424.graphml,哪种疾病在产后出血风险评估因素中常见，且通过提高建卡率可以有效预防，同时患者常伴有焦虑和抑郁情绪？,产科并发症
bridge_subgraph_09429.graphml,哪种疾病在出现可疑失眠和中医针灸治疗的同时，还可能伴随骨折和高血压的症状？,失眠
bridge_subgraph_09435.graphml,哪种疾病在临床表现上与肝病相似，且在实验室检查中通过R×C卡方检验与肿瘤和体重指数有显著关联？,失眠
bridge_subgraph_09438.graphml,哪种疾病在时间-信号强度曲线上表现为流入型，且常伴有心动过速和恶性肿瘤？,TIC
bridge_subgraph_09430.graphml,哪种疾病在治疗时既需要用到白术又需要用到苦参，且其病因可能与强直性脊柱炎和头痛都有关联？,风邪
bridge_subgraph_09431.graphml,哪种疾病在进行宫颈捆扎联合多重正方形缝合术时，需要特别关注新生儿体重、贫血和年龄等高危和风险评估因素？,剖宫产产后出血
bridge_subgraph_09428.graphml,哪种社会学理论能解释失眠与凝固酶阴性葡萄球菌感染的关系，并涉及革兰阴性菌病因及替考拉宁治疗的应用？,感染
bridge_subgraph_09436.graphml,哪种疾病既与情志问题和颈内动脉扭曲直接相关，又常与慢性乙型肝炎及乙型肝炎肝硬化同时出现？,失眠
bridge_subgraph_09442.graphml,哪种疾病在检测支气管肺泡灌洗液时，通过免疫荧光法更容易与肺癌和肺炎区分开来？,慢性阻塞性肺疾病
bridge_subgraph_09434.graphml,哪种疾病在老年人中多发，常需通过白内障摘除手术进行治疗，并辅以常规护理，且在诊断过程中会使用A/B超进行影像学检查？,高度近视眼
bridge_subgraph_09439.graphml,哪种疾病与2型糖尿病和中药刺五加直接相关，且常与华枝睾吸虫病和食管癌同时出现？,失眠
bridge_subgraph_09437.graphml,哪种疾病在采用Western blot法检测nutlin-3的同时，常与慢性阻塞性肺疾病及化疗相关联？,DNA损伤
bridge_subgraph_09440.graphml,哪种疾病在Ⅲ或Ⅲ-Ⅳ期原发性肝癌阶段最常需要接受化疗？,TNM
bridge_subgraph_09447.graphml,哪种疾病需要同时进行口服抗结核药物治疗、淋巴结切开术，并辅以护理干预和心理护理干预？,颈部淋巴结结核
bridge_subgraph_09432.graphml,哪种疾病在使用佐匹克隆治疗时，仍无法获得正常睡眠，且常伴有缺血性卒中，尤其在老年人群中高发？,失眠
bridge_subgraph_09441.graphml,哪种疾病在治疗时通常会联合使用EH（同义词）和β-受体阻滞剂，并且常常需要配合尼群地平和护理干预？,老年原发性高血压病
bridge_subgraph_09445.graphml,哪种疾病在治疗过程中常需联合使用莫西沙星和胸腺肽，并辅以干预护理和常规护理？,耐多药性肺结核
bridge_subgraph_09444.graphml,哪种疾病在PCT升高和微生态制剂使用的情况下，更容易与感染相关，且在不同年龄人群中表现有差异？,ACLF
bridge_subgraph_09446.graphml,哪种疾病在进行灰阶超声和磁共振检查时，常常需要结合PI实验室检查结果，并可能需要外科干预作为辅助治疗？,乳腺结节
bridge_subgraph_09448.graphml,哪种疾病在治疗过程中常需结合多功能导眠仪和自助的认知行为疗法，并且通常伴随常规护理和磁共振检查？,失眠
bridge_subgraph_09452.graphml,哪种疾病在进行腹腔镜手术或腹腔镜输尿管切开术的同时，需要配合综合护理干预或护理干预以提高治疗效果？,尿结石
bridge_subgraph_09443.graphml,哪种疾病会导致9.1%的死亡率，并且其病因包括突发性耳聋，主要在内科发病？,针刺伤
bridge_subgraph_09454.graphml,哪种疾病在60岁及以上人群中多发，且常表现为老年髋部骨折和精神病，适合采用耳穴埋豆治疗作为辅助疗法？,失眠
bridge_subgraph_09450.graphml,哪种疾病在治疗时常用安神类中成药和中药足浴联合心理疏导，且患者常伴有腹胀和便秘的症状？,失眠
bridge_subgraph_09458.graphml,哪种疾病会同时出现SPAP异常和HR异常，并常伴随膀胱癌和颈动脉粥样硬化？,动脉血压
bridge_subgraph_09453.graphml,哪种疾病在临床上表现为吸入性肺炎和肺炎，且需通过肝门-空肠吻合术治疗，并常通过磁共振成像进行检查？,CTBF
