file,query,answer
bridge_subgraph_22583.graphml,哪种疾病在A2型胫骨平台骨折的情况下，CT扫描图像中常伴随开放性骨折的表现？,骨折
bridge_subgraph_22591.graphml,哪种疾病在采用开窗植骨复位或单切口双钢板支撑技术进行手术治疗时，预后较差？,胫骨平台骨折
bridge_subgraph_22588.graphml,哪种疾病在治疗过程中需要精确的关节面修复和切开复位锁定钢板内固定，同时还需要心理护理和MRI影像学检查？,胫骨平台骨折
bridge_subgraph_22576.graphml,哪种疾病多发于体力劳动者，临床表现为关节不稳，且常需通过运动疗法辅助治疗，同时年龄也是其高危因素？,胫骨平台骨折
bridge_subgraph_22587.graphml,哪种疾病在术前、术后需要加强护理以辅助治疗，且常见并发症为关节僵硬，同时通常需要进行MRI或磁共振成像检查？,胫骨平台骨折
bridge_subgraph_22577.graphml,哪种疾病在出现膝内外翻畸形时，通常需要通过空心加压螺钉内固定治疗，并且在进行诊断时会使用CT及CT平扫进行检查？,胫骨平台骨折
bridge_subgraph_22580.graphml,哪种疾病在进行切开复位治疗前，通常需要通过术前彩超和CT等影像学检查来辅助诊断和制定手术方案？,胫骨平台骨折
bridge_subgraph_22582.graphml,哪种疾病在采用LISS钢板治疗时，更容易并发深静脉血栓形成，并且通常需要通过CT和x线进行检查确认？,胫骨平台骨折
bridge_subgraph_22572.graphml,哪种疾病在治疗过程中需要同时使用盐酸氨基葡萄糖和关注收缩压，且常伴随下肢骨折并需进行护理干预？,GH
bridge_subgraph_22590.graphml,哪种疾病在男性患者中常见，且适合采用锁定加压钢板内固定手术治疗，并需配合早期康复治疗？,胫骨平台骨折
bridge_subgraph_22593.graphml,哪种疾病在MRI扫描中需要区分使用锁定钢板与普通解剖型钢板，并且常伴随Ⅱ型和Ⅲ型的情况？,胫骨平台骨折
bridge_subgraph_22589.graphml,哪种疾病在膝关节软组织损伤后，通过X线检查常发现同时伴随关节炎，且可能转化为骨性关节炎？,胫骨平台骨折
bridge_subgraph_22584.graphml,哪种疾病在治疗过程中会同时使用五皮饮合六味地黄汤和3D打印技术，并且需要进行CT扫描检查？,胫骨平台骨折
bridge_subgraph_22596.graphml,哪种疾病在并发Letournel-Judet并发症时，通过影像学检查尤其是CT扫描，预后效果较为理想？,胫骨平台骨折
bridge_subgraph_22600.graphml,哪种疾病在治疗过程中常同时使用疏风解毒胶囊和热毒宁，并辅以中药和心理护理？,病毒性上呼吸道感染
bridge_subgraph_22599.graphml,哪种疾病会出现局部压迫症状，且在CT检查中表现良好，同时肾脏存活率较高？,局灶型
bridge_subgraph_22597.graphml,哪种疾病在家族有哮喘史的情况下，更容易发展为喘息性疾病，并且适合通过常规护理和中西医结合治疗进行辅助治疗？,喘息性支气管肺炎
bridge_subgraph_22586.graphml,哪种疾病在男性患者中更常见，且在进行微创手术或前后联合入路治疗时容易并发感染？,胫骨平台骨折
bridge_subgraph_22585.graphml,哪种疾病在胫骨近端发病，并发症多且诊治复杂，通常需要通过透射电镜和CT进行影像学检查？,胫骨平台骨折
bridge_subgraph_22601.graphml,哪种疾病在肝外伤和肝损伤的并发症中，常与Ⅳ型和Ⅰ型病理分型同时出现？,肝静脉损伤
bridge_subgraph_22602.graphml,哪种疾病在治疗过程中需要用到可吸收螺钉和手术切开复位，且常常伴随CT平扫和早期护理干预？,胫骨平台骨折
bridge_subgraph_22594.graphml,哪种疾病在单独使用壮筋续骨汤辅助治疗的同时，还需结合CT三维重建图像进行影像学检查，并可能采用非手术疗法和甘油果糖进行药物治疗？,胫骨平台骨折
bridge_subgraph_22604.graphml,哪种疾病在车祸后常伴随折块移位，且治疗过程中可能需要心理干预和硬膜外麻醉？,胫骨平台骨折
bridge_subgraph_22605.graphml,哪种疾病需要使用左氧氟沙星滴眼液和抗生素治疗，并在必要时进行切开引流或手术？,麦粒肿
bridge_subgraph_22598.graphml,哪种疾病在治疗过程中需要同时使用焦虑自评量表评估患者心理状态、脱水剂控制症状，并且常伴随CT扫描检查和饮食护理措施？,胫骨平台骨折
bridge_subgraph_22603.graphml,哪种疾病在存在布朗吻合高危因素和术后胃排空障碍的情况下，更需要结合年龄进行风险评估，并通过中西医结合治疗辅助康复？,DGE
bridge_subgraph_22592.graphml,哪种疾病在治疗过程中常需进行手术复位和引导小切口手术，并且需要特别关注疼痛管理和预防感染？,胫骨平台骨折
bridge_subgraph_22595.graphml,哪种疾病在治疗过程中会同时使用壮骨镇痛胶囊和鸦胆子油乳注射液，并结合放疗和护理干预？,骨转移癌痛
bridge_subgraph_22608.graphml,哪种疾病在CT和磁共振成像中常表现为MDM2异常，且需切除病变的锤骨头及砧骨？,胆脂瘤
bridge_subgraph_22607.graphml,哪种疾病在螺旋CT灌注成像中显示出麦冬皂苷D的良好治疗效果，并且需要同时使用抗生素？,放射性肺损伤
bridge_subgraph_22612.graphml,哪种疾病在治疗过程中常采用Ⅴ型骨折复位、针刺、中药熏蒸加运动疗法，且通常需要配合CT检查和手术治疗？,胫骨平台骨折
bridge_subgraph_22614.graphml,哪种疾病在中国东部地区多发，且在实验室检查中常用双色球分组法，同时需要中西医结合治疗和手术治疗？,胫骨平台骨折
bridge_subgraph_22609.graphml,哪种疾病需要通过复合组织移植或交腿皮瓣移植手术治疗，并且治疗过程中还需配合饮食护理和疼痛护理？,组织缺损
bridge_subgraph_22611.graphml,哪种疾病在消化系统疾病和肺动脉发育异常的患者中，同时需要抗生素治疗且与年龄相关联？,风疹
bridge_subgraph_22618.graphml,哪种疾病在进行耳部手术后容易出现眩晕，且通常需要通过MRI或磁共振成像进行检查？,耳部疾病
bridge_subgraph_22606.graphml,哪种疾病需要常规骨科护理辅助治疗，且常通过关节镜辅助微创手术治疗，同时在进行诊断时常使用CT检查和MRI等影像学检查？,胫骨平台骨折
bridge_subgraph_22617.graphml,哪种疾病在CT和关节镜检查中常表现为局限性骨质侵蚀破坏和炎症刺激？,骨质改变
bridge_subgraph_22610.graphml,哪种疾病需要进行BF半肩关节置换或人工肱骨头置换术，并可能伴随内固定手术？,肱骨近端复杂骨折
bridge_subgraph_22616.graphml,哪种疾病在雅皓治疗中度牙周炎时，需要同时使用抗生素和护理干预？,牙龈炎
bridge_subgraph_22613.graphml,哪种疾病在循证护理实践中，通过综合护理干预能有效缓解气胸引起的疼痛？,开胸
bridge_subgraph_22619.graphml,哪种疾病会导致儿童出现NK细胞活性降低，同时伴随感染，并在CT图像上表现出噬血细胞性淋巴组织细胞增生症的特征？,HLH
bridge_subgraph_22615.graphml,哪种疾病在Ⅰ期膜性肾病通过肾脏穿刺活检术确诊后，更适合采用中药治疗，且与患者年龄有关？,特发性膜性肾病
bridge_subgraph_22620.graphml,哪种疾病在早期需要通过膝关节功能锻炼和康复训练辅助治疗，并且可能需要进行珊瑚人工骨移植手术，同时还要注意预防感染这一并发症？,胫骨平台骨折
bridge_subgraph_22625.graphml,哪种疾病在采用微创内固定技术治疗后容易发生骨折延迟愈合，但若进行全膝关节置换则效果良好？,胫骨平台骨折
bridge_subgraph_22629.graphml,哪种疾病在低场MRI和MR检查中表现明显，且常与MRI和X线检查结果同时出现？,膝关节隐性骨折
bridge_subgraph_22622.graphml,哪种疾病在Ⅳ型病理分型时需要采用钢板螺钉固定治疗，且常与Ⅰ型和Ⅲ型病理分型同时出现？,胫骨平台骨折
bridge_subgraph_22621.graphml,哪种疾病在进行螺旋CT扫描或CT检查时常伴有胫骨平台后柱骨折，且需特别重视康复护理？,胫骨平台骨折
bridge_subgraph_22626.graphml,哪种疾病在MRI检查中表现为囊壁光滑，且病理组织学检查能进一步确认其特征？,苗勒管囊肿
bridge_subgraph_22624.graphml,哪种疾病在进行MSCT扫描和减压伤口二期直接缝合后，需要特别重视术后护理和舒适护理？,胫骨平台骨折
bridge_subgraph_22631.graphml,哪种疾病在膝关节骨创伤的病理分型中，通过多层螺旋CT影像学检查，发现与年龄密切相关且预后良好？,胫骨平台骨折
bridge_subgraph_22628.graphml,哪种疾病在治疗过程中常伴随肺炎并发症，且需要采用Y形切口解剖钢板内固定手术治疗，同时使用抗生素和丹参注射液进行辅助治疗？,胫骨平台骨折
bridge_subgraph_22637.graphml,哪种疾病在治疗过程中需要同时采用超短波联合药物、针刺以及康复治疗，并辅以院内康复训练？,脑损伤综合征
bridge_subgraph_22623.graphml,哪种疾病在塌陷骨折复位手术治疗的同时，需要结合中医延续护理，并且通常需要通过CT平扫和MRI进行影像学检查？,胫骨平台骨折
bridge_subgraph_22632.graphml,哪种疾病在治疗过程中既需要传统的切开复位和常规骨科护理，又常常伴随MRI检查和针刺治疗？,胫骨平台骨折
bridge_subgraph_22630.graphml,哪种疾病在膝关节改变后需要进行手术复位内固定术，并且术后需配合常规护理和手术治疗？,胫骨平台骨折
bridge_subgraph_22627.graphml,哪种医学内容更常用于评估折块移位和鹿瓜多肽的治疗效果，是与CT还是64层螺旋CT相关的检查？,胫骨平台骨折
bridge_subgraph_22634.graphml,哪种疾病在治疗过程中会同时采用米非司酮药物和阴道彩超检查，并且辅以常规护理组或综合护理干预？,瘢痕子宫妊娠
bridge_subgraph_22638.graphml,哪种疾病在治疗过程中常需同时使用定喘汤、疏风宣肺汤等中药，并辅以常规护理？,咳嗽变异型哮喘
bridge_subgraph_22635.graphml,哪种疾病会导致粘连性肠梗阻和粘连，并且可以通过16层螺旋CT或螺旋CT进行检查？,老年性肠梗阻
bridge_subgraph_22636.graphml,哪种疾病在饮食及饮酒安全方面需要特别注意预防，且在临床表现上常通过T2WI、CT和MRI等影像学检查来诊断？,CO中毒
bridge_subgraph_22643.graphml,哪种疾病可以通过窄谱红蓝光照射、霉康唑药物治疗，同时辅以针灸或针灸治疗来综合治疗？,寻常性痤疮
bridge_subgraph_22645.graphml,哪种疾病在进行加压钢板内固定手术时，容易因轴向暴力而需要特别配合硬膜外麻醉和心理护理？,胫骨平台骨折
bridge_subgraph_22640.graphml,哪种疾病在东部地区多发，常需通过小切口手术治疗，且术后易感染，需借助CT进行影像学检查？,胫骨平台骨折
bridge_subgraph_22639.graphml,哪种疾病在41~50岁人群中常见，且需要通过CT影像学检查确诊，术后康复需制定个性化辅助治疗方案，其病理分型为闭合性骨折？,胫骨平台骨折
bridge_subgraph_22642.graphml,哪种疾病在钢板内固定和常规功能训练后，还需要配合常规护理，且患者年龄对其恢复有显著影响？,胫骨平台骨折
bridge_subgraph_22641.graphml,哪种疾病会导致90.8%的患者出现活动受限和疼痛，且常采用LISS钢板微创内固定治疗？,胫骨平台骨折
bridge_subgraph_22647.graphml,哪种疾病在进行膝关节CT及CT三维重建影像检查时，常需要结合CT和解剖复位手术治疗？,胫骨平台骨折
bridge_subgraph_22648.graphml,哪种疾病在CT诊断或CT扫描中常表现为较差，且与外髁骨折密切相关？,胫骨平台骨折
bridge_subgraph_22633.graphml,哪种疾病在治疗过程中需要同时采用解剖复位、足量植骨、微创内固定技术，并辅以心理护理，且在诊断时常用CT进行影像学检查？,胫骨平台骨折
bridge_subgraph_22644.graphml,哪种疾病在普伐他汀治疗和血UA检测中，常需要配合护理干预和护理措施？,舒张性心力衰竭
bridge_subgraph_22652.graphml,哪种疾病在需要进行下肢力线矫正和关节镜下微创手术治疗的同时，还常伴有焦虑和疼痛症状？,胫骨平台骨折
bridge_subgraph_22646.graphml,哪种疾病发病率约为5.6%，男性常表现为前列腺炎，女性可发生前庭大腺炎，且治疗常用抗生素，并可能伴随焦虑症状？,淋病
bridge_subgraph_22649.graphml,哪种疾病在经过X射线片影像学检查确诊为半月板损伤后，通过针灸辅助治疗能够获得满意的疗效？,胫骨平台骨折
bridge_subgraph_22653.graphml,哪种疾病在治疗时既需要闭合复位有限固定或钢板螺钉固定，又常常需要通过磁共振成像（MRI）来辅助诊断？,胫骨平台骨折
bridge_subgraph_22659.graphml,哪种疾病在治疗过程中需要使用加压钢板或双侧钢板内固定治疗，并且通常需要通过MRI和CT平扫来进行诊断？,胫骨平台骨折
bridge_subgraph_22651.graphml,哪种疾病在进行关节镜辅助手术治疗后，SchatzkerⅡ~Ⅴ型病理分型的患者需精心护理以预防感染并发症？,胫骨平台骨折
bridge_subgraph_22654.graphml,哪种疾病需要通过关节镜处理和多层螺旋CT检查，并且常伴随膝关节镜检查和关节镜的使用？,胫骨平台骨折
bridge_subgraph_22661.graphml,哪种疾病在进行体位干预和关节镜辅助下手术的同时，还需要进行CT及影像学检查？,胫骨平台骨折
bridge_subgraph_22663.graphml,哪种疾病在联合手术后需要早期功能锻炼，并且需要配合常规护理和充分的术前准备？,胫骨平台骨折
bridge_subgraph_22658.graphml,哪种疾病在治疗时需要使用锁定加压钢板，且常伴随膝关节不稳，同时还可能出现肺炎和深静脉血栓？,胫骨平台骨折
bridge_subgraph_22650.graphml,哪种疾病在膝周软组织损伤和膝关节问题时，常通过多层螺旋CT或CT检查来诊断？,胫骨平台骨折
bridge_subgraph_22660.graphml,哪种疾病在年龄≥50岁的人群中常见，常表现为关节活动受限，并且治疗时可能使用万古霉素，同时需要通过磁共振成像进行检查？,胫骨平台骨折
bridge_subgraph_22657.graphml,哪种疾病在心肌肥厚节段数增多的情况下，需要通过手助腹腔镜手术进行治疗，且术后容易出现切口感染，并通过CT进行影像学检查？,LS
bridge_subgraph_22656.graphml,哪种疾病需要通过锁定加压钢板固定手术进行治疗，并且通常需要结合螺旋CT三维重建检查、CT诊断和MRI等影像学手段进行确诊？,胫骨平台骨折
bridge_subgraph_22665.graphml,哪种疾病在30至59岁人群中常见，且在治疗时通常需要MIPO辅助治疗、常规护理以及抗生素药物治疗？,胫骨平台骨折
bridge_subgraph_22670.graphml,哪种疾病需要进行切开复位内固定术治疗和牵开骨痂，同时需要MRI检查和外科手术治疗？,胫骨平台骨折
bridge_subgraph_22666.graphml,哪种疾病在使用胫骨锁定多向带锁髓内钉和切开复位治疗的同时，配合针灸治疗能取得良好效果？,胫骨平台骨折
bridge_subgraph_22655.graphml,哪种疾病在治疗过程中需要结合康复训练、关节镜下复位内固定治疗，并且常伴随磁共振成像检查和心理护理？,胫骨平台骨折
bridge_subgraph_22668.graphml,哪种疾病在进行经皮微创钢板接骨术治疗41-B型骨折时，需要同时进行MRI检查和手术治疗？,胫骨平台骨折
bridge_subgraph_22662.graphml,哪种疾病在三维CT成像中常见，且容易导致韧带损伤和肺栓塞，同时可以通过中药进行治疗？,胫骨平台骨折
bridge_subgraph_22672.graphml,哪种疾病在进行手术切开复位时，关节面塌陷小于2 mm，并且常通过MRI和CT进行检查？,胫骨平台骨折
bridge_subgraph_22677.graphml,哪种疾病在增强CT检查中常见，并伴随外科消化道出血，需要手术治疗和综合护理？,胃底静脉曲张
bridge_subgraph_22667.graphml,哪种疾病在治疗41-B型骨折时通常需要支撑钢板治疗和综合护理，并且常用CT平扫进行检查？,胫骨平台骨折
bridge_subgraph_22673.graphml,哪种疾病在早期康复治疗、加强术前术后护理的同时，还需要特别注重个性化护理和围手术期护理？,胫骨平台骨折
bridge_subgraph_22664.graphml,哪种疾病在Ⅴ型或Ⅵ型（即胫骨平台双髁骨折）的情况下，通常需要采用切开复位手术治疗？,胫骨平台骨折
bridge_subgraph_22671.graphml,哪种疾病在男性患者中常见，且在进行尿道电切术（TUR）后需要特别关注血清白细胞介素水平，同时需配合常规护理？,非肌层浸润性膀胱癌
bridge_subgraph_22676.graphml,哪种疾病在进行经皮冠状动脉介入治疗和消融术时，特别需要优质护理和精心护理以减少并发症？,动静脉瘘
bridge_subgraph_22675.graphml,哪种疾病在进行外科手术治疗后，需要开展优质护理以辅助治疗，并可能引发局部皮肤坏死这一并发症，同时常需通过MRI进行影像学检查？,胫骨平台骨折
bridge_subgraph_22674.graphml,哪种疾病在采用优质护理干预和良好制动的同时，还需要结合X线检查和常规护理来治疗？,胫骨平台骨折
bridge_subgraph_22682.graphml,哪种疾病在进行关节镜检查和CT三维重建影像时，常伴随感染并发症且多需手术治疗？,胫骨平台骨折
bridge_subgraph_22686.graphml,哪种疾病在采用中西医结合护理方案治疗骨折分型时，常配合使用丹参注射液，并且患者容易出现抑郁症状？,胫骨平台骨折
bridge_subgraph_22678.graphml,哪种疾病需要同时进行微创经皮钢板固定手术和切开复位联合钢板固定治疗，并且术前术后需进行X线拍片检查？,胫骨平台骨折
bridge_subgraph_22685.graphml,哪种疾病在治疗过程中需要使用异烟肼和利福平，且临床表现类似急性白血病，同时辅以常规护理能有较好的预后？,肝损害
bridge_subgraph_22681.graphml,哪种疾病在治疗开放性骨折时需要使用外支架，并且通常需要进行CT检查和CT平扫？,胫骨平台骨折
bridge_subgraph_22684.graphml,哪种疾病在预防感染和延迟负重训练的同时，还需要进行康复治疗并使用抗生素？,胫骨平台骨折
bridge_subgraph_22680.graphml,哪种疾病在进行多元化的护理康复锻炼和微创手术骨折复位治疗的同时，还需要特别关注护理干预和骨质疏松问题？,胫骨平台骨折
bridge_subgraph_22683.graphml,哪种疾病在进行关节镜下复位固定术后，容易导致DVT，且常伴随骨折发生，预后骨性愈合？,胫骨平台骨折
bridge_subgraph_22669.graphml,哪种疾病在进行胫骨平台骨折手术和虚拟手术后，外科治疗效果较差？,胫骨平台骨折
bridge_subgraph_22687.graphml,哪种疾病需要采取周密的护理措施，同时配合恩替卡韦治疗，并且在使用焦虑自评量表评估患者心理状态和进行饮食护理的情况下进行综合管理？,肝硬化失代偿期
bridge_subgraph_22679.graphml,哪种疾病在治疗过程中常采用拔罐和中药，并且临床表现包括连串咳嗽，同时需要特别护理？,小儿咳嗽
bridge_subgraph_22692.graphml,哪种疾病在髌骨骨折后进行常规康复治疗时，容易同时引发骨质疏松和创伤性关节炎？,胫骨平台骨折
bridge_subgraph_22690.graphml,哪种疾病在治疗过程中需要特别强调早期康复训练、锻炼理疗和个性化护理，并常伴随CT影像学检查？,胫骨平台骨折
bridge_subgraph_22694.graphml,哪种疾病在室内活动后易发，常需通过关节镜辅助内固定手术进行治疗，且易引发肺栓塞，尤其在特定年龄段人群中高发？,胫骨平台骨折
bridge_subgraph_22693.graphml,哪种疾病会同时出现移位的耻骨下支骨折和骶髂关节脱位，并且常伴随B3型和C2型的情况？,骨盆后环损伤
bridge_subgraph_22689.graphml,哪种疾病在治疗过程中通常会同时采用亚甲蓝药物、功能锻炼和针灸作为辅助疗法？,痛症
bridge_subgraph_22688.graphml,哪种疾病在进行鼻牙槽塑形术治疗时，患者常表现为头位更伸展，且需通过螺旋CT扫描或CT进行影像学检查？,单侧完全性唇腭裂
bridge_subgraph_22695.graphml,哪种疾病会导致冠状动脉造影异常、HDL-C降低，并且常伴随MRI检查异常和肢体肿胀？,血管疾病
bridge_subgraph_22696.graphml,哪种疾病在Ⅰ型病理分型下，采用双钢板内固定手术治疗，并通过CT检查确认，预后状况良好？,胫骨平台骨折
bridge_subgraph_22698.graphml,哪种疾病在治疗过程中可能需要使用锁定钢板和中药，同时伴随着软组织坏死和塞来昔布的使用？,胫骨平台骨折
bridge_subgraph_22702.graphml,哪种疾病在进行肱骨外科颈骨折的病理分型时，需要同时使用计算机断层扫描和MRI扫描，并可能需要外科手术治疗？,胫骨平台骨折
bridge_subgraph_22701.graphml,哪种疾病在 CsA 治疗和回肠储袋肛管吻合术后，常伴随抑郁和焦虑症状？,重症溃疡性结肠炎
bridge_subgraph_22691.graphml,哪种疾病在临床表现为疼痛和腰痛，并伴随关节活动受限，且可通过乳香进行治疗？,风湿痛
bridge_subgraph_22697.graphml,哪种疾病在采用持续被动运动辅助治疗和延迟手术组手术治疗时，容易出现局部皮肤坏死并发症，并需要使用抗生素进行药物治疗？,胫骨平台骨折
bridge_subgraph_22703.graphml,哪种疾病在进行螺旋CT三维重建检查和LISS钢板治疗时，还需要特别关注健康宣教和患者的年龄因素？,胫骨平台骨折
bridge_subgraph_22706.graphml,哪种疾病在进行肺部CT和HRCT扫描时，最常通过影像学检查被发现？,LAM
bridge_subgraph_22700.graphml,哪种疾病在男性中较为常见，且需要通过CT影像学检查进行诊断，同时强调多元化护理和积极的功能锻炼作为辅助治疗手段？,胫骨平台骨折
bridge_subgraph_22699.graphml,哪种疾病在病原体培养实验室检查中常见，且可导致化脓性角膜炎，其预后状况既有良好的也有较差的？,化脓性眼内炎
bridge_subgraph_22705.graphml,哪种疾病在C2型病理分型中，通过透射电镜检查时，常伴随股骨远端骨折或骨折现象？,胫骨平台骨折
bridge_subgraph_22704.graphml,哪种疾病在瘦素抵抗风险较高的人群中常见，且治疗过程中常需配合康复护理，并通过MRI进行影像学检查，同时与中性粒细胞异常相关？,MID
bridge_subgraph_22713.graphml,哪种疾病会导致心包受累和UVC并发症，并常伴随肺栓塞的临床表现，且可通过X线影像学检查发现？,心包积液
bridge_subgraph_22709.graphml,哪种疾病在治疗时需要使用锁定加压钢板和内固定，并且常伴随活动受限和关节炎？,胫骨平台骨折
bridge_subgraph_22711.graphml,哪种疾病在治疗过程中需要切开复位关节面整复和非关节炎组的干预，并且还需要配合饮食指导和焦虑自评量表的使用？,胫骨平台骨折
bridge_subgraph_22719.graphml,哪种疾病在进行妇科腹腔镜检查和直肠部分切除术后，通常需要使用抗生素并配合外科手术治疗？,直肠肿瘤
bridge_subgraph_22710.graphml,哪种疾病会导致右下腹固定压痛，并可能需要通过多层螺旋CT检查和抗生素治疗，最终可能需进行开腹阑尾切除术？,儿童急性阑尾炎
bridge_subgraph_22721.graphml,哪种疾病在进行骨科外科手术前，通常需要同时进行CT和MRI影像学检查？,胫骨平台骨折
bridge_subgraph_22708.graphml,哪种疾病发病率高达6.2%，高血压是其高危因素，且常通过中西医结合治疗辅助，并需借助磁共振成像进行影像学检查？,RVO
bridge_subgraph_22720.graphml,哪种疾病会导致骨皮质变薄和皮肤损伤，同时可能引发骨关节炎，且与年龄增长密切相关？,氟中毒
bridge_subgraph_22707.graphml,哪种疾病在牙源性感染（病理分型）由鲍曼不动杆菌引起的情况下，更需考虑年龄因素进行风险评估，并需要特别的护理干预作为辅助治疗？,医源性感染
bridge_subgraph_22712.graphml,哪种疾病在髁间棘撕脱骨折后需要进行早期恢复锻炼，并且通常需要通过CT或MSCT进行检查？,胫骨平台骨折
bridge_subgraph_22716.graphml,哪种疾病会导致关节活动受限，并需要围手术期护理和CT检查，同时适合采用多元化护理方案？,胫骨平台骨折
bridge_subgraph_22715.graphml,哪种疾病在加强术前、术后护理和康复护理干预的同时，还需要特别重视护理干预与常规护理的结合？,胫骨平台骨折
bridge_subgraph_22714.graphml,哪种疾病在采用张氏微创手术或经皮钢板固定技术治疗后，预后良好，并且常通过磁共振成像进行检查？,胫骨平台骨折
bridge_subgraph_22726.graphml,哪种疾病在进行双切口手术和骨折内固定治疗的同时，还需要借助X线进行影像学检查和外科手术？,胫骨平台骨折
bridge_subgraph_22724.graphml,哪种疾病在进行关节镜下微创手术后，配合常规康复护理干预，同时需要借助多层螺旋CT或普通CT进行检查？,胫骨平台骨折
