file,query,answer
bridge_subgraph_25295.graphml,哪种疾病在超声检查中发现bFGF阳性，且常伴随CT检查和MRI的异常表现？,原发性卵巢癌
bridge_subgraph_25285.graphml,哪种疾病在64层螺旋CT和普通CT检查中，常伴随计算机断层成像和MRCP的异常表现？,胆胰疾病
bridge_subgraph_25289.graphml,哪种疾病在CT和X线影像学检查中表现为骨质硬化，且需与原始神经外胚瘤进行鉴别诊断？,骶骨尤文肉瘤
bridge_subgraph_25296.graphml,哪种疾病既会影响骨骼和肝脏，又需要通过磁共振成像检查，并常伴随心理干预治疗？,心肌疾病
bridge_subgraph_25292.graphml,哪种疾病在车祸伤后需要通过骨折切开复位钢板内固定或撬拨植骨手术治疗，并辅以综合护理？,胫骨平台骨折
bridge_subgraph_25288.graphml,哪种疾病在术前彩超检查中常见于肘关节和踝关节，并且通常表现为Ⅰ型或Ⅲ型病理分型？,胫骨平台骨折
bridge_subgraph_25298.graphml,哪种疾病在B超和CT扫描中容易被发现，且常需要通过外科手术来治疗颈静脉球体瘤？,咽旁间隙肿瘤
bridge_subgraph_25286.graphml,哪种疾病在围手术期护理不佳的情况下，经皮螺钉、钢板内固定术的效果会明显不如护理良好的情况？,胫骨平台骨折
bridge_subgraph_25293.graphml,哪种疾病最适合采用针刺联合艾灸、运动针刺、康复训练和中药进行辅助治疗？,中风后尿失禁
bridge_subgraph_25299.graphml,哪种疾病在进行前交叉韧带重建术和开窗夯实植骨的手术治疗时，容易出现切口感染？,胫骨平台骨折
bridge_subgraph_25290.graphml,哪种疾病在进行组外固定和膝关节稳定试验时常与交通伤相关，并且需要通过CT检查来确诊？,胫骨平台骨折
bridge_subgraph_25291.graphml,哪种疾病会导致胫腓骨粉碎性骨折并伴随针道感染，且常与粉碎性骨折和ORIF同时出现？,浅表感染
bridge_subgraph_25287.graphml,哪种疾病在充分透析和彩色多普勒超声的辅助下，通过综合护理干预比常规护理更能有效改善患者预后？,UP
bridge_subgraph_25302.graphml,哪种疾病在采用全麻下腹腔镜三孔法治疗后预后较好，且常通过CT扫描和CT诊断来确诊？,急慢性阑尾炎
bridge_subgraph_25297.graphml,哪种疾病在男性患者中较为常见，且其AO分类下的病理分型常需要使用非锁定支持钢板和优质护理进行辅助治疗？,胫骨平台骨折
bridge_subgraph_25301.graphml,哪种疾病在恢复期需要严密的病情观察和护理干预，并且通常需要手术治疗？,不完全性肠梗阻
bridge_subgraph_25294.graphml,哪种疾病在治疗过程中需要同时进行3DpCASL检查和股颈外动脉灌注化疗，并辅以常规护理和CT检查？,复发性鼻咽癌
bridge_subgraph_25304.graphml,哪种疾病会导致膝关节外翻畸形，并且需要通过合理功能锻炼辅助治疗，同时常需借助CT扫描进行影像学检查？,胫骨平台骨折
bridge_subgraph_25303.graphml,哪种疾病在进行个性化护理和微创手术的同时，容易并发骨关节炎和深静脉血栓？,胫骨平台骨折
bridge_subgraph_25300.graphml,哪种疾病在采用开放性锁定钢板内固定术治疗后，膝关节严重骨关节炎并发症能得到较好控制，且手术效果显著？,胫骨平台骨折
bridge_subgraph_25305.graphml,哪种疾病在开放骨折（高危因素）和Ⅱ型骨折（病理分型）的情况下，需要通过CT平扫和多层螺旋CT进行影像学检查？,胫骨平台骨折
bridge_subgraph_25309.graphml,哪种疾病在中国东部地区多发，且常通过X线或MRI检查被诊断为SchatzkerⅡ型？,胫骨平台骨折
bridge_subgraph_25317.graphml,哪种疾病在CT扫描三维重建图像中常见，并且需要使用氨甲环酸治疗，同时可能与DVT相关？,胫骨平台骨折
bridge_subgraph_25320.graphml,哪种疾病在治疗过程中需要手术修复复杂骨折，并伴随心理护理和饮食护理？,胫骨平台骨折
bridge_subgraph_25308.graphml,哪种疾病在膝关节软组织损伤的并发症中，通过CT扫描和X线检查，可进一步细分为A组和B组病理分型？,胫骨平台骨折
bridge_subgraph_25312.graphml,哪种疾病在进行白内障手术或Coats病治疗时，需特别考虑年龄因素和围术期护理以降低并发症风险？,黄斑裂孔
bridge_subgraph_25306.graphml,哪种疾病在进行传统钢板内固定手术方式后，需要通过X线检查来评估，并且常常伴随使用X线和CT进行进一步诊断？,胫骨平台骨折
bridge_subgraph_25310.graphml,哪种疾病在踝关节部位，采用单切口双钢板支撑技术辅助治疗时，容易出现骨折延迟愈合，且需通过MSCT进行影像学检查？,胫骨平台骨折
bridge_subgraph_25315.graphml,哪种疾病在进行社区动态治疗和留置尿管的同时，常伴有抑郁症状且需要磁共振成像检查？,药物成瘾
bridge_subgraph_25314.graphml,哪种疾病在治疗过程中需要连续康复护理和中西医结合治疗，并且常常需要通过正侧位X线片和MRI进行影像学检查？,胫骨平台骨折
bridge_subgraph_25324.graphml,哪种疾病在治疗过程中常需关节镜监护和饮食指导，并且常伴随闭合复位手术和骨折复位的高危因素？,胫骨平台骨折
bridge_subgraph_25307.graphml,哪种疾病在需要系统急诊护理干预和常规护理的同时，常表现为颅内压升高，并需使用脱水剂进行治疗？,急性重症颅脑损伤
bridge_subgraph_25319.graphml,哪种疾病在三维CT和CT检查中常表现为骨化性肌炎，且在X线检查中也能观察到相似症状？,胫骨平台骨折
bridge_subgraph_25322.graphml,哪种疾病在41至50岁人群中常见，需进行镇定钢板内定术治疗，且伴随疼痛，术后需优质护理？,胫骨平台骨折
bridge_subgraph_25321.graphml,哪种疾病在治疗过程中需要胃管置入、早期护理干预和综合护理，并且需要监测血浆谷氨酰胺水平？,消化道手术
bridge_subgraph_25325.graphml,哪种疾病在进行外科手术治疗时，常需采用钢板固定治疗辅助，并通过CT扫描图像进行诊断，且可能涉及端端吻合术？,胫骨平台骨折
bridge_subgraph_25323.graphml,哪种疾病在进行MRI检查后，需要特别重视术前术后的护理干预以及术后护理作为辅助治疗？,胫骨平台骨折
bridge_subgraph_25318.graphml,哪种疾病在进行多层螺旋CT薄层扫描时，常需采用单侧钢板辅助治疗，并且多与膝关节的CT影像学检查相关？,胫骨平台骨折
bridge_subgraph_25313.graphml,哪种疾病在术后CT检查和关节镜下小切口与切开内固定术治疗后，还需要特别重视术后护理和CT复查？,胫骨平台骨折
bridge_subgraph_25332.graphml,哪种疾病在进行骨折内固定治疗尤其是肘关节或踝关节手术后，常伴随抑郁症状，并需要特别护理？,胫骨平台骨折
bridge_subgraph_25328.graphml,哪种疾病在进行膝前正中纵切口手术治疗后，容易出现感染性骨不连并发症，且预后较差，需要通过MRI检查来评估？,胫骨平台骨折
bridge_subgraph_25329.graphml,哪种疾病在进行体能训练和优质护理、综合护理辅助治疗时，仍需特别注意术后并发症的风险？,胫骨平台骨折
bridge_subgraph_25330.graphml,哪种疾病在男性患者中常见，且在进行CT检查时常伴随闭合性骨折，需要通过诱导骨基质植入治疗？,胫骨平台骨折
bridge_subgraph_25326.graphml,哪种疾病在细胞因子检测中表现明显，且常导致严重急性肝炎和肺炎，但预后较好？,新型冠状病毒
bridge_subgraph_25316.graphml,哪种疾病在采用64排螺旋CT三维影像后处理技术进行诊断后，通常需要通过解剖钢板手术进行治疗，并且常常与DR检查和骨性关节炎同时出现？,胫骨平台骨折
bridge_subgraph_25336.graphml,哪种疾病在治疗过程中需要同时采用七氟烷吸入麻醉、穿刺时吸氧、心理护理和围术期护理等辅助治疗措施？,小儿手术
bridge_subgraph_25337.graphml,哪种疾病在治疗过程中需要置管引流和严密观察，并且特别强调护理以预防感染？,腹腔内脓肿
bridge_subgraph_25311.graphml,哪种疾病既可能引发贲门失弛缓症作为并发症，又常表现为腰背痛，并且通常需要外科手术治疗，且患者年龄是重要的风险评估因素？,急性尿潴留
bridge_subgraph_25338.graphml,哪种疾病在金银花药物治疗和护理干预下，能缓解道峰压的临床表现，且常与肺炎并发？,过敏
bridge_subgraph_25327.graphml,哪种疾病在Schatzker Ⅱ和Ⅵ型病理分型中，常需借助多排螺旋CT三维重建和CT扫描进行诊断，并需配合舒适护理进行辅助治疗？,胫骨平台骨折
bridge_subgraph_25334.graphml,哪种疾病在治疗过程中常采用双切口双钢板法辅助治疗，并配合使用万古霉素以及综合护理干预和综合护理？,胫骨平台骨折
bridge_subgraph_25342.graphml,哪种疾病在治疗过程中需要结合个案管理护理干预和经皮螺钉内固定术，且常通过X线和MRI进行影像学检查？,胫骨平台骨折
bridge_subgraph_25339.graphml,哪种疾病在表现为尿时长、使用右美托咪定治疗的同时，常与坠落伤及创伤性骨折相关联？,交通意外
bridge_subgraph_25343.graphml,哪种疾病在30～59岁人群中常见，且需进行胫骨平台手术，同时在诊断时通常需借助CT和MRI检查？,胫骨平台骨折
bridge_subgraph_25341.graphml,哪种疾病最适合采用综合优质护理辅助治疗，并可能需要经皮空心螺钉内固定术、关节镜治疗或关节镜微创手术治疗？,胫骨平台骨折
bridge_subgraph_25350.graphml,哪种疾病在大B细胞淋巴瘤中出现大包块病变，且手术效果较差？,PGI-DLBCL
bridge_subgraph_25331.graphml,哪种疾病在采用普通解剖钢板治疗的同时，需要结合Tscherne-Johnson药物治疗，并且需要鉴别软组织损伤和进行骨折的病理分型？,胫骨平台骨折
bridge_subgraph_25340.graphml,哪种疾病在采用双反牵引技术治疗外侧平台合并后柱骨折的同时，还需要结合功能锻炼和中医综合疗法进行辅助治疗？,胫骨平台骨折
bridge_subgraph_25346.graphml,哪种疾病在治疗过程中常需要支撑钢板固定、中西医结合护理，并配合护理干预和CT影像学检查？,胫骨平台骨折
bridge_subgraph_25349.graphml,哪种疾病具有3.1%的发病率，并且可以通过辅助奶嘴吸附凹陷乳头、穴位按摩和护理干预来进行辅助治疗？,乳头凹陷
bridge_subgraph_25335.graphml,哪种疾病在23～65岁人群中常见，需进行双侧锁定钢板内固定手术，且常通过三维CT或3D影像学检查来诊断？,胫骨平台骨折
bridge_subgraph_25353.graphml,哪种疾病在采用导管溶栓联合压力治疗的同时，配合穴位按摩和优质护理，尤其适合高龄患者？,LEDVT
bridge_subgraph_25351.graphml,哪种疾病在外髁骨折的治疗中，需要特别重视术前术后的护理干预，并且通常需要通过影像学检查和CT来辅助诊断？,胫骨平台骨折
bridge_subgraph_25333.graphml,哪种疾病在治疗过程中需要分期护理干预和螺栓固定加植骨术，并且通常需要通过MRI和CT进行影像学检查？,胫骨平台骨折
bridge_subgraph_25347.graphml,哪种疾病在CT检查中常见，且需要通过经纤维支气管镜灌洗和抗生素治疗，同时伴随C反应蛋白（CRP）升高？,急性肺脓肿
bridge_subgraph_25344.graphml,哪种疾病在骨科就诊时，摔伤后需要通过MSCT影像学检查，并可能使用锁定钢板或普通解剖型钢板进行辅助治疗？,胫骨平台骨折
bridge_subgraph_25354.graphml,哪种疾病在采用开窗夯实植骨钢板内固定治疗的同时，还需要结合护理和穴位按摩作为辅助治疗措施？,胫骨平台骨折
bridge_subgraph_25355.graphml,哪种疾病在男性患者中常见，需要尽早进行关节功能锻炼，并可能借助3D打印骨折模型和CT平扫来辅助治疗？,胫骨平台骨折
bridge_subgraph_25348.graphml,哪种疾病需要采用双侧钢板内固定手术或平行双钢板双柱固定技术，并且通常伴随锁定钢板内固定和早期功能锻炼的治疗方案？,肱骨远端粉碎性骨折
bridge_subgraph_25360.graphml,哪种疾病在采用中西医结合护理和手术治疗下肢骨折的过程中，最容易引发感染？,胫骨平台骨折
bridge_subgraph_25352.graphml,哪种疾病在治疗过程中通常需要结合锁定钢板内固定与植骨手术、膝关节镜辅助切开手术，并辅以MRI影像学检查和中药治疗？,胫骨平台骨折
bridge_subgraph_25356.graphml,哪种疾病在治疗时需要同时使用混合外固定支架和支撑钢板，并且通常需要通过CT检查来评估膝关节的情况？,胫骨平台骨折
bridge_subgraph_25358.graphml,哪种疾病在治疗过程中通常会结合使用解剖型钢板与CPM功能锻炼、普通钢板内固定治疗，并辅以唑来膦酸药物和优质护理模式？,胫骨平台骨折
bridge_subgraph_25357.graphml,哪种疾病在增殖细胞核抗原和糖皮质激素受体异常的同时，需要进行CT检查和手术治疗？,血管畸形
bridge_subgraph_25362.graphml,哪种疾病在治疗过程中需要结合多元化护理康复锻炼和桃红四物汤加减，并且常常需要通过X线和MRI进行影像学检查？,胫骨平台骨折
bridge_subgraph_25345.graphml,哪种疾病在治疗过程中常采用低压间断灌注法辅助，并通过引导小切口手术进行手术治疗，同时在诊断时需要依赖CT检查和X线平片进行影像学检查？,胫骨平台骨折
bridge_subgraph_25369.graphml,哪种疾病会导致血清尿酸水平升高和体重指数异常，并且通常需要结合护理干预和运动疗法进行治疗？,老年2 型糖尿病
bridge_subgraph_25359.graphml,哪种疾病在治疗过程中常采用闭合撬拨整复空心螺钉内固定和小切口复位内固定术，同时辅以常规护理和优质护理干预？,胫骨平台骨折
bridge_subgraph_25361.graphml,哪种疾病在进行输尿管软镜和彩超检查时，通常还需要同时进行MRI和CT影像学检查？,肾盂旁囊肿
bridge_subgraph_25365.graphml,哪种疾病在进行VATS手术前需要通过多层螺旋CT和影像学检查来确诊？,胸部疾病
bridge_subgraph_25364.graphml,哪种疾病在采用同指两叶复合皮瓣瓦合或行岛状皮瓣治疗后，预后状况通常良好且令人满意？,拇指软组织缺损
bridge_subgraph_25363.graphml,哪种疾病在11.7％～39.5％的患者中会出现HV现象，并且常常在X线片和MRI检查中被发现？,扁平足
bridge_subgraph_25373.graphml,哪种疾病在HRCT和高分辨率CT检查中表现明显，且常与普通CT和螺旋CT检查结果同时出现？,眼眶内侧壁骨折
bridge_subgraph_25368.graphml,哪种疾病在进行多层螺旋CT三维重建影像学检查后，需要配合护理康复锻炼、康复训练以及活血化瘀等辅助治疗？,胫骨平台骨折
bridge_subgraph_25371.graphml,哪种疾病在探查不清病因的情况下，需要通过端端吻合手术进行治疗，并特别强调围手术期护理的重要性？,胆道损伤
bridge_subgraph_25367.graphml,哪种医学内容在电化学发光免疫法和胸水常规检测中，与肺栓塞和CT检查同时出现时更为关键？,胸水
bridge_subgraph_25366.graphml,哪种疾病在治疗过程中需要同时采用瑞替普酶、循证护理、综合护理干预和心理护理？,抬高型心肌梗死
bridge_subgraph_25378.graphml,哪种医学内容在空心加压螺钉治疗和64层螺旋CT的应用中，结合综合护理干预和抗生素使用，最为关键？,胫骨平台骨折
bridge_subgraph_25370.graphml,哪种疾病在进行双向牵扯引和镇定钢板内定术治疗时，通常需要结合螺旋CT薄层扫描和螺旋CT三维成像技术进行诊断？,胫骨平台骨折
bridge_subgraph_25377.graphml,哪种疾病在进行充分填充植骨和64层CT重建的同时，还需要结合CT检查和中药治疗？,胫骨平台骨折
bridge_subgraph_25379.graphml,哪种疾病在进行膝关节X线平片检查和唑来膦酸治疗的同时，还需要进行多层螺旋CT扫描和心理护理？,胫骨平台骨折
bridge_subgraph_25380.graphml,哪种疾病在治疗过程中既需要稳定的内固定和功能恢复练习，又常伴随植骨和自体骨移植手术？,胫骨平台骨折
bridge_subgraph_25375.graphml,哪种疾病在采用优质护理措施和整体护理干预作为辅助治疗的同时，还需要结合常规护理和CT影像学检查？,甲状腺癌手术
bridge_subgraph_25383.graphml,哪种疾病在治疗过程中常需采用锁定钢板内固定术辅助治疗，并且通常需要通过CT扫描进行检查？,胫骨平台骨折
bridge_subgraph_25372.graphml,哪种疾病在治疗过程中需要结合虚拟手术系统和分期护理干预，并且通常需要通过CT和MRI进行辅助诊断？,胫骨平台骨折
bridge_subgraph_25381.graphml,哪种疾病在早期护理干预和64排螺旋CT三维重组影像的应用下，更容易在特定年龄段的MRI检查中被发现？,胫骨平台骨折
bridge_subgraph_25391.graphml,哪种疾病会导致心动过速，并需要使用抗生素和进行手术治疗来抗感染？,肛周坏死性筋膜炎
bridge_subgraph_25382.graphml,哪种疾病在治疗过程中常需进行开窗减压和创面护理，且诊断时通常会用到CT等影像学检查？,急性骨髓炎
bridge_subgraph_25390.graphml,哪种疾病需要通过球囊成形术和七叶皂苷钠治疗，并且常伴随使用X线和CT三维重建进行检查？,胫骨平台骨折
bridge_subgraph_25376.graphml,哪种疾病在股骨远端骨折后需要进行常规镇痛管理，并且通常需要通过CT和MPR进行检查？,胫骨平台骨折
bridge_subgraph_25385.graphml,哪种疾病在血清白细胞介素-2和干扰素-γ检测异常、血清高尔基体蛋白73升高的情况下，常与CT检查结果异常及特定年龄段的患者相关联？,慢性乙型肝炎病毒感染
bridge_subgraph_25374.graphml,哪种疾病在采用外科手术治疗的同时，还需要结合AO分型进行多元化护理康复锻炼治疗，并且常通过磁共振成像进行影像学检查？,胫骨平台骨折
bridge_subgraph_25397.graphml,哪种疾病更容易与胸膜肺母细胞瘤和AIH同时出现，骨折还是闭合性骨折？,II型
bridge_subgraph_25384.graphml,哪种疾病因缺氧引起，可以通过服用绿芝宝预防，且在CT和MRI影像学检查中常被诊断出来？,高原病
bridge_subgraph_25386.graphml,哪种疾病在治疗过程中需要使用外固定支架固定和开放复位AO支持钢板内固定，并且通常需要进行CT和螺旋CT检查？,胫骨平台骨折
bridge_subgraph_25396.graphml,哪种疾病需要通过肺动脉成形术治疗，并且在诊断过程中常需进行CTA、CT扫描及CT等影像学检查？,支气管肺癌
bridge_subgraph_25389.graphml,哪种疾病在经过卡方检验确诊后，通常需要采用切开复位可吸收螺钉或手术内固定治疗？,胫骨平台骨折
bridge_subgraph_25392.graphml,哪种疾病在男性中较为常见，且通过使用脱水剂和早期康复训练护理，预后状况通常良好？,胫骨平台骨折
bridge_subgraph_25395.graphml,哪种疾病需要通过骨膜切除和Ilizarov外固定器治疗，且常伴随关节炎和骨性关节炎作为并发症？,膝关节畸形
bridge_subgraph_25388.graphml,哪种疾病在进行DSA检查后，主要采用机械取栓的血管内治疗，且患者常需接受CT扫描，并受年龄因素影响？,急性前循环缺血性卒中
bridge_subgraph_25401.graphml,哪种疾病在治疗时通常会同时使用明胶海绵和栓塞治疗，并且需要配合氨甲环酸药物治疗和进行CT检查？,出血性疾病
bridge_subgraph_25402.graphml,哪种疾病在经皮锁定重建钢板固定治疗时，常与板组A型骨折、股骨远端骨折及髋臼损伤同时出现？,B型骨折
bridge_subgraph_25400.graphml,哪种疾病在治疗过程中需要精心护理辅助，常采用手术复位内固定及特定手术入路，并且术前术后需借助X线片进行影像学检查？,胫骨平台骨折
bridge_subgraph_25394.graphml,哪种疾病在B超和血管造影检查中常见，且通常需要结合CT平扫和CT检查来确诊？,黄色肉芽肿性肾盂肾炎
bridge_subgraph_25403.graphml,哪种疾病在治疗过程中常需要同时使用甲氨蝶呤和抗生素，并辅以细致的护理措施，以应对结节病等并发症？,虹膜睫状体炎
bridge_subgraph_25409.graphml,哪种疾病需要通过人工瓣膜置换术和呋塞米治疗，并需配合整体护理和常规护理？,重症心脏瓣膜病
bridge_subgraph_25398.graphml,哪种疾病在治疗时通常需要进行胫骨平台骨折钢板内固定术或手术内固定加植骨治疗，并辅以护理和MRI检查？,胫骨平台骨折
bridge_subgraph_25393.graphml,哪种疾病在治疗过程中需要特别注意室性心律失常的并发症，并且通过规范护理、饮食护理及护理干预等多种辅助治疗手段来提升疗效？,老年慢性肺源性心脏病
bridge_subgraph_25387.graphml,哪种疾病在车祸伤后常导致膝关节周围骨折，且需要通过X线扫描等影像学检查来确诊？,胫骨平台骨折
bridge_subgraph_25404.graphml,哪种医学内容在涉及经皮肾穿刺造瘘术(PCN)和MIP时，与传统治疗和传统手术相比更具优势？,上尿路疾病
bridge_subgraph_25406.graphml,哪种疾病在普罗帕酮和维拉帕米治疗的同时，还需要进行常规护理以预防感染并发症？,PSVT
bridge_subgraph_25408.graphml,哪种疾病在头颅CT检查中可能无明显异常，但常表现为躯体化症状，并伴随抑郁和焦虑情绪？,外伤后脑出血
bridge_subgraph_25407.graphml,哪种疾病在进行骨折手术时，单侧与双侧钢板内固定治疗的选择会影响到术后感染的风险，且需要通过MRI进行辅助诊断？,胫骨平台骨折
bridge_subgraph_25405.graphml,哪种疾病在治疗过程中需要个案管理护理干预和心理护理作为辅助治疗，同时常伴随疼痛，且可能需要手术复位内固定治疗？,胫骨平台骨折
bridge_subgraph_25416.graphml,哪种疾病在男性患者中较常见，且在进行膝关节置换术和积极处理复合损伤的同时，容易并发肺炎？,胫骨平台骨折
bridge_subgraph_25410.graphml,哪种疾病在继发性骨性关节炎患者中，通过关节镜检查发现并常采用锁定双钢板治疗？,胫骨平台骨折
bridge_subgraph_25399.graphml,哪种疾病在抑郁状态下，需要进行关节镜下复位内固定治疗，并且治疗过程中常伴随C型和硬膜外麻醉的使用？,胫骨平台骨折
bridge_subgraph_25412.graphml,哪种疾病在不稳定型骨折和解剖复位不良的高危因素下，通过MSCT影像学检查确诊后，手术治疗预后较差？,胫骨平台骨折
bridge_subgraph_25421.graphml,哪种疾病在进行CT平扫检查时，可能需要同时考虑同种异体骨和自体骨移植的治疗方案？,胫骨平台骨折
bridge_subgraph_25419.graphml,哪种疾病在采用锁定钢板的内固定手术治疗和X线扫描诊断的同时，还需要配合常规护理和综合护理干预？,胫骨平台骨折
bridge_subgraph_25413.graphml,哪种疾病在介入治疗和及时诊断、紧急复苏等辅助治疗方面尤为重要，且在非手术治疗与手术治疗的选择上需谨慎权衡？,肝脏外伤
bridge_subgraph_25420.graphml,哪种疾病需要进行关节清理术或关节清理，并且常常伴随使用塞来昔布和手术治疗？,创伤后肘关节僵硬
bridge_subgraph_25411.graphml,哪种疾病在进行解剖钢板行内固定术后，通过X线检查发现异常，且常伴随使用脱水剂和需要进行CT检查？,胫骨平台骨折
bridge_subgraph_25418.graphml,哪种疾病在男性中更常见，且在宣教和护理方面对麻疹的辅助治疗效果显著？,肠道传染病
bridge_subgraph_25417.graphml,哪种疾病在治疗过程中需要同时进行病因治疗和粒细胞集落刺激因子使用，并且还需要配合护理干预和手术治疗？,恶性实体瘤
bridge_subgraph_25414.graphml,哪种疾病在全脱位病理分型下，需进行小切口白内障手术，并在围术期护理和心理干预辅助治疗下效果更佳？,晶状体脱位
bridge_subgraph_25422.graphml,哪种疾病在进行CT扫描检查和外科治疗时，常需要使用加压接骨板？,胫骨平台骨折
bridge_subgraph_25427.graphml,哪种疾病在膝关节软组织损伤并发症出现时，需要结合胫骨平台X线摄片进行诊断，并辅以心理护理和康复护理进行治疗？,胫骨平台骨折
bridge_subgraph_25415.graphml,哪种疾病在男性中较为常见，通常需要通过双切口手术进行治疗，且在诊断过程中常需借助CT和MRI影像学检查？,胫骨平台骨折
bridge_subgraph_25425.graphml,哪种疾病会出现压痛和肿胀，并可能使用奇正消痛贴膏治疗，同时与下肢深静脉血栓有关？,软组织挫伤
bridge_subgraph_25423.graphml,哪种疾病在进行虚拟手术时，需要使用SEMENS 0.35T永磁MRI，并且常伴随Ⅰ型和Ⅲ型的表现？,胫骨平台骨折
bridge_subgraph_25424.graphml,哪种疾病在采用LISS钢板微创内固定和功能锻炼治疗时，需要特别考虑患者的年龄并辅以MRI检查？,胫骨平台骨折
bridge_subgraph_25431.graphml,哪种疾病在使用胫骨锁定多向带锁髓内钉和髂骨瓣植骨治疗的同时，还需要使用抗生素，且疗效较好？,胫骨平台骨折
