file,query,answer
bridge_subgraph_28576.graphml,哪种疾病在23～65岁人群中常见，且治疗时需使用锁定钢板，同时需通过CT及CT三维重建进行影像学检查？,胫骨平台骨折
bridge_subgraph_28570.graphml,哪种疾病在超声和声像图检查中表现出特定影像学特征，且常伴随功能障碍，同时X线检查也能发现相关异常？,局限性骨化性肌炎
bridge_subgraph_28564.graphml,哪种疾病在MDCT检查中常表现为Schatzker Ⅰ-Ⅳ型，并且适合采用保守治疗，同时需要借助三维重建成像来辅助诊断？,胫骨平台骨折
bridge_subgraph_28567.graphml,哪种疾病在冠状面MPR和常规轴位CT图像上常见，且常与骨折一起出现在X线检查中？,胸部骨折
bridge_subgraph_28566.graphml,哪种疾病在治疗过程中既需要锻炼理疗和坚强的内固定，又离不开护理干预和舒适护理的支持？,胫骨平台骨折
bridge_subgraph_28582.graphml,哪种疾病需要同时采用后外侧支撑固定手术治疗和针灸正骨辅助治疗，并且常伴随CT影像学检查？,胫骨平台骨折
bridge_subgraph_28578.graphml,哪种疾病在采用64层CT检查和膝前正中入路手术后，患者的年龄和婚姻状况对其治疗效果有明显影响？,胫骨平台骨折
bridge_subgraph_28585.graphml,哪种疾病需要通过经膝关节镜引导小切口手术治疗，并辅以康复训练和运动疗法？,胫骨平台骨折
bridge_subgraph_28575.graphml,哪种疾病在早期需要通过膝关节功能锻炼和常规护理进行辅助治疗，同时可能需要借助磁共振成像进行影像学检查，并在必要时采用关节镜下球囊成形术进行手术治疗？,胫骨平台骨折
bridge_subgraph_28573.graphml,哪种疾病在进行锁定加压钢板固定手术时，常需辅助使用支持钢板，且容易出现骨缺损和感染并发症？,胫骨平台骨折
bridge_subgraph_28577.graphml,哪种疾病在X线片和CT检查中常表现为囊状小脓肿，且通常需要通过前路手术进行治疗？,椎体结核
bridge_subgraph_28563.graphml,哪种疾病在男性中较为常见，且在治疗过程中常需使用甘油果糖药物，并通过CT检查辅助诊断，甚至可能需要手术治疗？,胫骨平台骨折
bridge_subgraph_28586.graphml,哪种疾病在综合优质护理辅助治疗和关节镜下手术等外科手术治疗中能取得最佳疗效？,胫骨平台骨折
bridge_subgraph_28579.graphml,哪种疾病在进行自体骨移植和关节镜微创手术治疗的同时，还需要进行CT和X线片检查？,胫骨平台骨折
bridge_subgraph_28583.graphml,哪种疾病在出现上消化道动脉出血时，需要通过支撑钢板治疗，并且通常会在CT平扫或64排螺旋CT检查中被发现？,胫骨平台骨折
bridge_subgraph_28584.graphml,哪种疾病会出现肿胀，需要通过CT检查和MRI确诊，并通常采用手术复位内固定治疗？,胫骨平台骨折
bridge_subgraph_28580.graphml,哪种疾病在治疗时既需要采用解剖钢板内固定术或微创内固定治疗，又常常需要通过CT检查和MRI来辅助诊断？,胫骨平台骨折
bridge_subgraph_28591.graphml,哪种疾病在治疗过程中需要结合针灸、饮食护理和康复护理，并且常常需要进行CT影像学检查？,胫骨平台骨折
bridge_subgraph_28587.graphml,哪种疾病在治疗过程中需要同时进行硬膜外麻醉、手术切开减压、切开复位内固定以及植骨治疗？,胫骨平台骨折
bridge_subgraph_28589.graphml,哪种疾病在进行双源CT扫描和CPR时，常伴随多层螺旋CT检查和普通CT检查？,肋骨隐匿性骨折
bridge_subgraph_28597.graphml,哪种疾病在MDCT检查中常见骨折脱位型损伤，且需要护理干预和综合护理？,胫骨平台骨折
bridge_subgraph_28588.graphml,哪种疾病在胫骨平台后内侧柱发病时，需要通过棒状玻璃骨植骨手术治疗，并且术后需配合常规护理和综合护理？,胫骨平台骨折
bridge_subgraph_28592.graphml,哪种疾病在使用空心螺钉治疗和AO技术的同时，常伴有骨关节炎的发生，且与年龄有关？,胫骨平台骨折
bridge_subgraph_28594.graphml,哪种疾病在创伤骨科的病理分型中，需要通过膝关节CT和X线平片进行影像学检查，并且常采用玻璃酸钠进行药物治疗？,胫骨平台骨折
bridge_subgraph_28604.graphml,哪种疾病在男性患者中常通过心电图检查发现，并与慢性肺源性心脏病密切相关，需要整体护理？,老年冠心痛
bridge_subgraph_28598.graphml,哪种疾病在治疗过程中需要钢板螺钉固定并配合常规功能锻炼，同时常常需要进行CT检查，并且与Ⅰ型相关？,胫骨平台骨折
bridge_subgraph_28605.graphml,哪种疾病在治疗简单骨折时需要采用可靠内固定，并辅以心理护理和全面护理？,胫骨平台骨折
bridge_subgraph_28601.graphml,哪种疾病在发生高处坠落伤或膝骨性关节炎时，更需要进行精心护理而非仅依赖常规护理？,胫骨平台骨折
bridge_subgraph_28603.graphml,哪种疾病会导致心脏畸形，并表现为右室小梁部缺如，同时可能分为Ⅲ型和Ⅱ型病理分型？,PA／IVS
bridge_subgraph_28581.graphml,哪种疾病需要采用克氏针内固定及植骨术或切开复位克氏针内固定及植骨手术，并且常常伴随植骨术和切开复位内固定术的治疗？,陈旧性肱骨外髁骨折
bridge_subgraph_28602.graphml,哪种疾病在车祸伤后常表现为低能量损伤导致的骨折，且适合采用苏氏正骨法进行治疗？,胫骨平台骨折
bridge_subgraph_28610.graphml,哪种疾病在24至64岁人群中常见，且通常需要通过经皮钢板内固定手术进行治疗？,胫骨平台骨折
bridge_subgraph_28590.graphml,哪种疾病在术前通过CT扫描三维重建进行影像学检查，并通过手术修复治疗，且患者多为男性，婚姻状况可能成为其高危因素？,胫骨平台骨折
bridge_subgraph_28599.graphml,哪种疾病在男性中更常见，且常通过高频超声和MRI检查发现于肘关节？,关节病变
bridge_subgraph_28595.graphml,哪种疾病在男性患者中，通过CT检查发现，需要早期进行功能锻炼且骨折全部愈合后才能康复？,胫骨平台骨折
bridge_subgraph_28593.graphml,哪种疾病在术前需要进行营养风险筛查，并且治疗过程中会用到白眉蛇毒血凝酶和抗生素，同时还需要进行疼痛护理？,普通外科手术
bridge_subgraph_28616.graphml,哪种疾病会导致护士因工作压力而不易入睡，且其风险与年龄和婚姻状况密切相关？,亚健康状况
bridge_subgraph_28614.graphml,哪种疾病在骨质疏松患者中更易发生，且常伴随侧副韧带和交叉韧带损伤，治疗时可能需要石膏外固定？,胫骨平台骨折
bridge_subgraph_28608.graphml,哪种疾病在治疗过程中特别需要正确的出院指导和行为干预，并且通常伴随护理及护理干预的实施？,精神分裂症合并糖尿病
bridge_subgraph_28613.graphml,哪种疾病在中央区和运动前区发病，且在MRI和CT检查中同时显现？,致痫灶
bridge_subgraph_28615.graphml,哪种疾病需要同时进行经皮微创椎弓根内固定术和经伤椎固定，并常伴随植骨内固定术和CT检查？,胸腰椎脊柱骨折
bridge_subgraph_28607.graphml,哪种疾病在影像学检查尤其是CT检查中常见，且常伴有神经血管损伤并发症，需通过经皮鱼嘴钳固定手术进行治疗？,胫骨平台骨折
bridge_subgraph_28606.graphml,哪种疾病通常与Ⅳ型11足（）、Ⅱ型25侧（）相关，且常伴随Ⅲ型骨折和植骨现象？,Sanders
bridge_subgraph_28609.graphml,哪种疾病既可以通过针灸治疗，又适用于空心加压螺钉治疗，并且通常需要通过MRI检查或磁共振成像来诊断？,胫骨平台骨折
bridge_subgraph_28612.graphml,哪种疾病在置管途径中出现概率为1.5%，且通常需要配合健康宣教和护理干预？,UEX
bridge_subgraph_28611.graphml,哪种疾病在临床上表现为肺部感染和反复咳喘，且在X线检查中可见相应影像学改变，并需要围手术期护理辅助治疗？,先天性迷走左肺动脉
bridge_subgraph_28617.graphml,哪种疾病在采用64排螺旋CT三维影像后处理技术和膝关节镜引导下微创手术的同时，还需要配合优质护理和心理护理？,胫骨平台骨折
bridge_subgraph_28620.graphml,哪种疾病在治疗过程中通常需要同时进行固定融合、闭合复位治疗，并且可能涉及钢板内固定和植骨治疗？,Sanders Ⅳ型跟骨骨折
bridge_subgraph_28621.graphml,哪种疾病在发生粉碎性骨折后，通过微创小切口钢板置入内固定术治疗，能够获得良好的CT检查结果？,胫骨平台骨折
bridge_subgraph_28600.graphml,哪种疾病在20~54岁（平均33.8岁）人群中，常通过前正中入路手术进行治疗，且常与关节镜或膝关节镜手术同时出现？,胫骨平台骨折
bridge_subgraph_28619.graphml,哪种检查（超声、BCA或影像学检查）最适合诊断骨折？,CT
bridge_subgraph_28623.graphml,哪种疾病在采用缩宫素联合益母草药物治疗和改良式剖宫产术治疗的同时，还需要配合综合护理和优质护理进行辅助治疗？,前置胎盘产妇
bridge_subgraph_28622.graphml,哪种疾病在进行微创钢板接骨术和CPM治疗时，通常需要结合MPR重建和多层螺旋CT扫描进行诊断？,胫骨平台骨折
bridge_subgraph_28596.graphml,哪种疾病在康复指导和病情观察、动态评估中需要特别关注，并且常常伴随CT影像学检查，预后状况较差？,胫骨平台骨折
bridge_subgraph_28624.graphml,哪种疾病在胸部X线摄片和CT检查中常同时出现影像学异常？,新生儿纵隔气肿
bridge_subgraph_28625.graphml,哪种疾病在MRI检查中常与地奥司明使用相关，且易与胫骨平台骨折组同时出现？,胫骨平台骨折
bridge_subgraph_28636.graphml,哪种疾病在足量植骨和膝关节镜治疗后，需要特别关注患者年龄和护理措施？,胫骨平台骨折
bridge_subgraph_28631.graphml,哪种疾病在进行游离腓骨皮瓣移植和植骨术时，需要特别注意饮食调护？,胫骨创伤性骨髓炎
bridge_subgraph_28633.graphml,哪种疾病在无肿块型IPMN-B和黄疸出现时，通常需要通过CT检查和手术来治疗？,IPMN-B
bridge_subgraph_28618.graphml,哪种医学内容在探讨螺旋CT动脉造影和血管造影时，通常也会涉及到深静脉血栓形成和SSD？,SCTPA
bridge_subgraph_28641.graphml,哪种疾病适合采用固定支架治疗或微型钢板手术，并且常与有限内固定联合外固定支架治疗及早期功能锻炼同时进行？,肘关节“恐怖三联征
bridge_subgraph_28634.graphml,哪种疾病在治疗过程中需要结合肢体功能锻炼和B1型、C2型病理分型的撬拨复位联合植骨手术？,胫骨平台骨折
bridge_subgraph_28628.graphml,哪种疾病在采用单侧或双侧钢板内固定治疗辅助治疗时，常需进行3D影像学检查，并且通常伴随Ⅴ型病理分型和地奥司明药物治疗？,胫骨平台骨折
bridge_subgraph_28639.graphml,哪种疾病在发生高处坠落伤后，常需要采用PFNA内固定手术治疗股骨近端骨折？,转子下骨折
bridge_subgraph_28645.graphml,哪种疾病在进行经皮钢板内固定（MIPPO）或LISS钢板治疗时，特别需要配合舒适护理以预防感染？,胫骨平台骨折
bridge_subgraph_28635.graphml,哪种疾病在治疗过程中常采用有限内固定结合外固定支架或锁定钢板内固定术，并辅以常规护理？,胫骨平台骨折
bridge_subgraph_28647.graphml,哪种疾病在CT片上显示血管神经损伤，且需外科手术治疗，预后较差？,胫骨平台骨折
bridge_subgraph_28632.graphml,哪种疾病在个性化治疗中常需辅助治疗，且患者会表现出吞咽困难，同时往往需要外科手术及术后护理？,主动脉疾病
bridge_subgraph_28637.graphml,哪种疾病在ADCmin实验室检查和MR影像学检查中表现明显，且常伴有较差的预后，同时CT影像学检查也常见相关异常？,胰腺黏液性囊性肿瘤
bridge_subgraph_28626.graphml,哪种疾病需要通过胫骨开窗撬拨复位、植骨或传统内固定手术进行治疗，且常伴随多层螺旋CT或其检查来辅助诊断？,胫骨平台骨折
bridge_subgraph_28630.graphml,哪种疾病在γ射线照射后髁骨折的情况下，最需要综合护理和护理干预？,胫骨平台骨折
bridge_subgraph_28627.graphml,哪种疾病在处理合并伤时需要特别注意，并且常采用内固定方式治疗，同时在诊断过程中会依赖X线平片检查，类似于SchatzkerⅤ型骨折的情况？,胫骨平台骨折
bridge_subgraph_28640.graphml,哪种疾病在骨科就诊时，通过MRI检查发现后，通常需要接受微骨折手术并结合康复治疗来辅助治疗？,膝关节软骨缺损
bridge_subgraph_28648.graphml,哪种疾病在感染预防不佳的情况下，容易与单纯髁间隆突骨折同时出现，并且预后较差？,胫骨平台骨折
bridge_subgraph_28644.graphml,哪种疾病在骨科就诊时，需要针对性护理和自拟外洗方作为辅助治疗，并且常伴随护理干预？,骨折后关节僵硬
bridge_subgraph_28629.graphml,哪种疾病在治疗过程中容易出现Fuchs葡萄膜炎和肿瘤并发症，并且常需联合手术治疗？,继发青光眼
bridge_subgraph_28643.graphml,哪种疾病在进行钢板内固定手术或小切口复位螺钉内固定术时，需要特别重视心理护理和围手术期护理？,胫骨平台骨折
bridge_subgraph_28642.graphml,哪种疾病在治疗过程中使用鹿瓜多肽，且通过磁共振成像（MRI）进行诊断时效果更满意？,胫骨平台骨折
bridge_subgraph_28653.graphml,哪种疾病在需要进行眶壁修补重建和骨折复位手术治疗的同时，通常通过CT影像学检查确诊为眼眶爆裂骨折？,眶周创伤
bridge_subgraph_28652.graphml,哪种疾病在感染后需要术后加强康复训练，并且通常会通过CT平扫或CT进行检查？,胫骨平台骨折
bridge_subgraph_28638.graphml,哪种疾病需要通过后路椎板切除减压术或颈椎管扩大成形术进行治疗，并辅以心理护理和康复训练？,无骨折脱位型颈脊髓损伤
bridge_subgraph_28654.graphml,哪种疾病会导致椎间盘组织受损，并可能需要前后路联合手术及内固定术来治疗，同时伴随骨缺损的情况？,胸腰椎脊柱结核
bridge_subgraph_28655.graphml,哪种疾病在采用银质针针刺疗法和充分的治疗前准备作为辅助治疗的同时，还需要结合康复治疗和再手术治疗？,腰椎手术失败综合征
bridge_subgraph_28650.graphml,哪种疾病在治疗过程中常伴随胫骨平台骨折和骨关节炎的并发症，且需要使用低分子肝素钙和常规护理作为综合治疗方案？,深静脉血栓
bridge_subgraph_28661.graphml,哪种疾病在疼痛护理联合康复训练过程中，需要进行CT扫描，并且常伴随CT和CT检查的出现？,胫骨平台骨折
bridge_subgraph_28659.graphml,哪种疾病在进行针灸、康复训练的同时，还需要配合构音训练、舌针及项针作为辅助治疗？,卒中后构音障碍
bridge_subgraph_28664.graphml,哪种疾病在MRI检查中显示异常，且恢复良好但有可能转化为癫痫？,边缘系统胶质瘤
bridge_subgraph_28646.graphml,哪种疾病在发生周围韧带损伤作为并发症时，需要与软组织损伤进行鉴别诊断，并且通常采用护理干预或综合护理干预作为辅助治疗？,胫骨平台骨折
bridge_subgraph_28651.graphml,哪种疾病在治疗过程中需要全方位护理和优质护理，并可能伴随髁间棘撕脱骨折并发症，同时常用丹参注射液进行药物治疗？,胫骨平台骨折
bridge_subgraph_28667.graphml,哪种疾病在膝关节韧带损伤和DVT的情况下，通常会伴随Ⅲ型表现并通过MRI扫描确诊？,胫骨平台骨折
bridge_subgraph_28663.graphml,哪种疾病在车祸后需要进行植入成型钛网和骨复位，并且通常需要通过X线检查来诊断？,眼球内陷畸形
bridge_subgraph_28666.graphml,哪种疾病在粤北地区通过责任护理与早期康复治疗相结合的方式，经卡方检验显示效果最为显著？,综合ICU
bridge_subgraph_28658.graphml,哪种疾病在辅助治疗中常采用穴位按摩，且需要与老年肺炎性假瘤进行鉴别诊断，同时在手术治疗中可能涉及局部切除？,肺癌
bridge_subgraph_28669.graphml,哪种疾病在治疗过程中需要结合使用鹿瓜多肽药物和双切口内固定手术，同时还需进行预防感染和饮食指导？,胫骨平台骨折
bridge_subgraph_28662.graphml,哪种疾病会导致骨骺的生长阻滞，并在64层螺旋CT的扫描图像中呈现特征性表现？,胫骨平台骨折
bridge_subgraph_28660.graphml,哪种疾病在采用双切口入路方式治疗和连续护理模式管理的同时，通常需要进行MRI或MRI检查？,胫骨平台骨折
bridge_subgraph_28656.graphml,哪种疾病在中医针灸正骨治疗作为辅助手段的同时，常伴随后外侧骨折块的临床表现，且需进行手术治疗并通过MRI影像学检查确诊？,胫骨平台骨折
bridge_subgraph_28665.graphml,哪种医学内容在涉及SPG4和肌电图检查时，通常需要结合磁共振成像（MRI）进行分析？,遗传性痉挛性截瘫
bridge_subgraph_28673.graphml,哪种疾病在术后负压引流后预后较差，且需要特别重视心理护理和康复护理？,胫骨平台骨折
bridge_subgraph_28668.graphml,哪种疾病在采用双切口双钢板固定治疗的同时，常通过MRI等影像学检查被诊断为Ⅵ型？,胫骨平台骨折
bridge_subgraph_28679.graphml,哪种疾病在Ⅱ型病理分型下，早期恢复锻炼与护理干预、优质护理相结合的辅助治疗效果最佳？,胫骨平台骨折
bridge_subgraph_28672.graphml,哪种疾病在进行膝关节早期功能练习辅助治疗时，常伴有CT影像学检查，且属于过伸损伤类DR病理分型？,胫骨平台骨折
bridge_subgraph_28671.graphml,哪种疾病在病理分型上与陈旧性髋臼骨折和髋臼骨折最为相似，且常与骨折和粉碎性骨折同时出现？,复合型骨折
bridge_subgraph_28649.graphml,哪种疾病在41~50岁人群中常见，需通过切开复位锁定钢板内固定手术治疗，且常伴随焦虑症状，需进行心理护理辅助治疗？,胫骨平台骨折
bridge_subgraph_28690.graphml,哪种疾病在X线下易于诊断且术后康复快，同时常需要MRI辅助检查和护理干预？,胫骨平台骨折
bridge_subgraph_28677.graphml,哪种疾病在治疗过程中需要同时使用3D打印技术辅助手术和舒经活血汤，并且通常需要进行MRI和螺旋CT检查？,胫骨平台骨折
bridge_subgraph_28684.graphml,哪种疾病在男性患者中，经n螺旋CT检查后常与交通伤相关，且在X线检查中也常见？,胫骨平台骨折
bridge_subgraph_28682.graphml,哪种疾病需要同时采用超关节外固定架结合和支撑钢板加植骨手术治疗，并且辅以抗生素药物和优质护理？,胫骨平台骨折
bridge_subgraph_28676.graphml,哪种症状在男性慢性心力衰竭患者中更常见，且在合并心房纤颤时，运动疗法对其辅助治疗效果更显著？,抑郁
bridge_subgraph_28670.graphml,哪种疾病在治疗过程中常需结合针灸理疗和髂骨瓣植骨手术，且在诊断时通常需要通过X线平片和CT进行影像学检查？,胫骨平台骨折
bridge_subgraph_28674.graphml,哪种疾病会导致背段出现异常，同时伴随中性粒细胞百分比升高，并在X线检查中发现明显X线征象？,SLSP
bridge_subgraph_28680.graphml,哪种疾病在治疗过程中通常需要结合组外固定和坚强的内固定辅助治疗，并且常常需要通过CT影像学检查来确诊，最终可能还需进行外科手术治疗？,胫骨平台骨折
bridge_subgraph_28687.graphml,哪种疾病在卵巢切除术后，通过磁共振成像检查发现良性平滑肌瘤，但预后较差？,子宫平滑肌肉瘤
bridge_subgraph_28688.graphml,哪种疾病在中医综合治疗和深部感染的情况下，通常需要同时进行外科治疗和手术治疗？,胫骨平台骨折
bridge_subgraph_28683.graphml,哪种疾病需要通过锁定双钢板治疗，并且在进行三维重建成像和CT平扫时，CT检查结果对其诊断尤为关键？,胫骨平台骨折
bridge_subgraph_28675.graphml,哪种疾病适合采用正骨联合中药袋热敷、蒙药治疗，并且常常需要配合X线平片检查和针灸治疗？,慢性颈椎病
bridge_subgraph_28681.graphml,哪种疾病会导致生活质量降低，同时出现疼痛和焦虑，并且与CMV-IgG相关？,nPSS
bridge_subgraph_28657.graphml,哪种疾病通常需要通过手术切开复位内固定治疗，并且可能采用重建钢板内固定或钢板螺钉治疗的方式？,关节内跟骨骨折
bridge_subgraph_28678.graphml,哪种疾病在治疗时既需要切开复位内固定和植骨治疗，又常伴随使用氨甲环酸，并且在进行CT检查时常发现伴有侧副韧带损伤？,胫骨平台骨折
bridge_subgraph_28693.graphml,哪种疾病适合采用锁定钢板结合木筏克氏针技术或固定架治疗，并且需要通过MRI或磁共振成像进行诊断？,胫骨平台骨折
bridge_subgraph_28695.graphml,哪种疾病在治疗过程中需要使用呋塞米并保证患者居住环境的舒适，同时还需要配合心理护理和桃红四物汤？,性心力衰竭
bridge_subgraph_28704.graphml,哪种疾病在采用微创治疗的同时，更需要个性化优质护理来提升治疗效果？,肝胆外科疾病
bridge_subgraph_28696.graphml,哪种疾病需要通过关节镜下手术和康复治疗，且在诊断过程中常需借助CT及多层螺旋CT进行影像学检查？,胫骨平台骨折
bridge_subgraph_28692.graphml,哪种疾病在CT检查中常见，且与高BMI和开放性骨折密切相关，同时需要优质护理作为辅助治疗？,胫骨平台骨折
bridge_subgraph_28699.graphml,哪种疾病在治疗过程中需要坚强的内固定和可靠内固定，并且同时需要常规护理和围手术期护理？,胫骨平台骨折
bridge_subgraph_28686.graphml,哪种疾病在采用威克伤高负压引流术或负压封闭引流技术治疗时，容易并发深静脉血栓，且常需配合硬膜外麻醉？,下肢开放性骨折
bridge_subgraph_28691.graphml,哪种疾病在采用Endobutton技术或微创内固定手术治疗后，Ⅳ型病理分型的患者预后状况能达到22%？,新鲜肩锁关节脱位
bridge_subgraph_28703.graphml,哪种疾病在CT图像上表现为弥漫浸润，并且在进行CT平扫时也常被观察到？,脾脏淋巴瘤
bridge_subgraph_28685.graphml,哪种疾病在治疗时需要切开并采用锁定钢板结合木筏克氏针技术，且通常需要通过CT检查，并可能涉及传统手术？,胫骨平台骨折
bridge_subgraph_28689.graphml,哪种疾病在进行MRI脊髓成像和CTM检查后，通常需要通过手术治疗或外科治疗来解决？,骶管内蛛网膜囊肿
bridge_subgraph_28700.graphml,哪种疾病在治疗过程中常需进行闭合复位和支撑钢板固定，且在诊断时通常会同时使用MRI和CT进行影像学检查？,胫骨平台骨折
bridge_subgraph_28705.graphml,哪种疾病在采用单双号抽签分组法进行实验室检查的同时，还需要结合锁定钢板内固定法、针灸治疗和康复治疗进行辅助治疗？,胫骨平台骨折
bridge_subgraph_28710.graphml,哪种疾病需要通过关节镜下球囊成形术和分期护理干预治疗，并且通常伴随MRI检查和膝关节镜检查？,胫骨平台骨折
bridge_subgraph_28712.graphml,哪种疾病在采用微创复位内固定手术治疗的同时，还需要配合完善、合理的康复计划？,胫骨平台骨折
bridge_subgraph_28702.graphml,哪种疾病既会导致布加综合征的并发症，又与白塞氏综合征相关，并且需要通过护理干预和手术治疗来共同治疗？,上腔静脉阻塞
bridge_subgraph_28697.graphml,哪种疾病在CT检查和X线检查后，常需进行胫骨平台手术，并辅以关节功能锻炼？,胫骨平台骨折
bridge_subgraph_28706.graphml,哪种疾病在术后早期综合康复锻炼中，因轴向暴力而易引发褥疮和感染？,胫骨平台骨折
bridge_subgraph_28694.graphml,哪种疾病在中度全身型病理分型中，同时涵盖了Ⅱa型18例、Ⅱb型、Ⅲ型和Ⅳ型？,Osserman
bridge_subgraph_28707.graphml,哪种疾病在推拿手法辅助治疗过程中，需要通过CT三维重建和螺旋CT扫描来评估胫骨外侧平台骨折的情况？,胫骨平台骨折
bridge_subgraph_28711.graphml,哪种疾病在综合康复护理、针刺及心理干预的同时，还需要进行康复训练和针刺辅助治疗？,脑卒中后言语障碍
bridge_subgraph_28715.graphml,哪种疾病在采用微创锁定钢板技术进行手术治疗的同时，还需要联合检查和综合护理干预来辅助治疗？,胫骨平台骨折
bridge_subgraph_28709.graphml,哪种疾病在进行髂胫束入路复位时，需要同时进行MRI和CT检查，并且常用x 2检验来辅助诊断？,胫骨平台骨折
bridge_subgraph_28701.graphml,哪种疾病在伴有高能量损伤和需要石膏制动的情况下，特别适用于疼痛护理，且常见于SchatzkerⅤ、Ⅵ型骨折？,胫骨平台骨折
bridge_subgraph_28722.graphml,哪种疾病在东部地区和西部地区采用间接复位技术治疗时，常需同时进行X线检查和MRI检查？,胫骨平台骨折
bridge_subgraph_28698.graphml,哪种疾病会导致右上腹部疼痛，并可能通过CT检查发现内脏动脉瘤，同时与感染有关？,肝动脉瘤
