file,query,answer
bridge_subgraph_12312.graphml,哪种疾病在干预治疗（辅助治疗）过程中，常表现为浅表型胃炎、尿潴留和恶心？,失眠
bridge_subgraph_12308.graphml,哪种疾病在采用NP30药物治疗时，常伴随营养不良的临床表现，且需要与贫血进行鉴别诊断，同时在治疗过程中可能涉及化疗？,急性血吸虫病
bridge_subgraph_12317.graphml,哪种疾病在出现噪声性聋的同时，还伴随头痛，并且可以通过服用龙胆泻肝汤或褪黑素来缓解？,失眠
bridge_subgraph_12322.graphml,哪种医学内容能够同时解释足太阳膀胱经与γ-GABA的作用，并涉及呕吐症状及相应的护理干预措施？,失眠
bridge_subgraph_12310.graphml,哪种疾病在治疗过程中会同时采用右佐匹克隆联合脑蛋白水解物片和百会药物，并结合心理干预作为辅助治疗？,失眠
bridge_subgraph_12301.graphml,哪种疾病在患者同时出现腹痛和肝问题时，可能需要使用抑郁自评量表评估，并且化疗过程中易引发相关性呕吐？,失眠
bridge_subgraph_12305.graphml,哪种疾病在非延迟组中发病率高达50.0%，且需与肺炎鉴别诊断，并可能与结核病相关或转化？,延迟
bridge_subgraph_12319.graphml,哪种疾病在患者中占比13.8%，且常伴有1gNT-proBNP升高，同时与高血压及高血压病密切相关？,向心性肥厚
bridge_subgraph_12320.graphml,哪种疾病在脑梗死后吞咽功能障碍和老年精神科患者中，需要同时进行干预护理和精神科治疗？,噎食
bridge_subgraph_12311.graphml,哪种疾病在HSK考试相关资料中，与无环鸟苷的使用密切相关，并且常在中医药和细胞因子的讨论中同时出现？,单纯疱疹性角膜炎
bridge_subgraph_12323.graphml,哪种疾病会导致鼻眶相沟通处出现恶性肿瘤，并伴随眩晕，需要通过姑息刮除手术进行治疗？,软骨肉瘤
bridge_subgraph_12321.graphml,哪种疾病在采用针灸联合推拿按摩辅助治疗的同时，常表现为疼痛，且适合通过健康教育来改善心脾两虚的病理分型？,失眠
bridge_subgraph_12326.graphml,哪种疾病由志贺氏菌引起，可以通过计划免疫接种预防，并且在进行健康宣教时需要注意贫血这一并发症？,传染性疾病
bridge_subgraph_12315.graphml,哪种疾病在女性患者中，采用辨证施护和针灸联合共情护理疗法，并辅以石膏治疗时，效果尤为显著？,失眠
bridge_subgraph_12318.graphml,哪种疾病在血清游离轻链比值异常时，常伴随AS并发症，并表现出水肿和腹胀的症状？,淀粉样变
bridge_subgraph_12324.graphml,哪种疾病在进行CT检查和诊断性腹腔穿刺的同时，更需要采用综合护理干预而非常规护理干预？,创伤性脾破裂
bridge_subgraph_12314.graphml,哪种疾病容易在大脑后动脉发病，且男孩更易受影响，同时需要特别重视护理和心理护理？,儿童颅内动脉瘤
bridge_subgraph_12316.graphml,哪种疾病既有慢性前列腺炎的临床表现，又可能导致BZD药物依赖，并且与糖尿病相关，治疗后还可能出现嗜睡症状？,失眠
bridge_subgraph_12328.graphml,哪种疾病在康复外科护理和常规延续护理中，同时需要结合情志护理和常规护理干预？,肝癌手术
bridge_subgraph_12313.graphml,哪种疾病在辅助治疗上常采用合谷和针刺疗法，且在药物治疗中常使用二甲双胍，同时需要进行血脂的实验室检查？,失眠
bridge_subgraph_12327.graphml,哪种疾病在磁共振成像中常与腔隙性脑梗死同时出现，且其部分前循环梗死的HPR占比较高？,OCSP
bridge_subgraph_12325.graphml,哪种医学内容在涉及PN（）、BN（）的同时，也与头颈部（）和卒中（）相关？,HN
bridge_subgraph_12330.graphml,哪种疾病在恩度及其联合用药治疗后，会出现MMP-2分泌减少，并且可以通过qPCR和酶联免疫法检测到相关变化？,A549
bridge_subgraph_12335.graphml,哪种疾病在采用干扰素联合保妇康栓或三氯醋酸联合干扰素栓治疗的同时，还需特别注意患者是否有饮酒这一高危因素？,宫颈高危型HPV感染
bridge_subgraph_12331.graphml,哪种疾病在治疗过程中需要同时采用跟骨牵引和单侧多功能外固定支架术，并且还需要配合心理护理和综合护理？,开放性胫腓骨骨折
bridge_subgraph_12332.graphml,哪种疾病在采用酶联免疫吸附试验诊断的同时，也可能通过针刺配合音乐疗法进行治疗，并且常与GERD（胃食管反流病）同时出现？,失眠
bridge_subgraph_12338.graphml,哪种疾病在治疗时常用安神液，且常伴有抑郁症状，同时可能与癫痫有关并表现出帕金森病的临床特征？,失眠
bridge_subgraph_12334.graphml,哪种疾病在出现发热和鼻塞的同时，可以通过养成良好的生活习惯辅助治疗，并且需要进行胸透检查？,失眠
bridge_subgraph_12340.graphml,哪种疾病具有52.3%的发病率，常采用蒙医灸疗辅助治疗，且在磁共振检查中常表现为恶性肿瘤？,失眠
bridge_subgraph_12350.graphml,哪种疾病在急性髓细胞白血病和慢性髓细胞白血病中更常见，并且与恶性肿瘤和肿瘤的发生密切相关？,血小板增多
bridge_subgraph_12341.graphml,哪种疾病在治疗时可能同时使用BPPV、乌灵胶囊联合西酞普兰以及二甲双胍，且与糖尿病相关？,失眠
bridge_subgraph_12337.graphml,哪种疾病在男性中常见，且会导致骨痛，需要通过骨显像检查确诊，并采用89SrCI2联合唑来膦酸治疗？,转移性骨肿瘤
bridge_subgraph_12343.graphml,哪种疾病在采用百合地黄汤合酸枣仁汤治疗后，患者会表现出入睡快，同时伴随发热和呕吐的症状？,失眠
bridge_subgraph_12339.graphml,哪种疾病在老年神经衰弱患者中常见，且针灸配合穴位贴敷对其有辅助治疗效果，同时可能伴随肿瘤和肥胖的临床表现？,失眠
bridge_subgraph_12333.graphml,哪种医学内容在复方丹参注射液静滴和趋势导向的研究中，与磁共振和高血压的治疗同时出现？,AION
bridge_subgraph_12342.graphml,哪种疾病会导致长期或慢性失眠，并伴随心率增快，需要神经内科治疗，且朱黄丸可能对其有效？,失眠
bridge_subgraph_12329.graphml,哪种疾病在进行磁共振检查时常见，并且需要通过浓盐水加甲硝唑坐浴辅助治疗，同时伴随疼痛症状，需要护理干预来预防？,肛周感染
bridge_subgraph_12336.graphml,哪种疾病需要同时采用经鼻（面）罩气道正压通气、无创性BiPAP鼻（面）罩通气、药物治疗和护理等多种辅助治疗手段？,急性高原性肺水肿
bridge_subgraph_12352.graphml,哪种疾病既可能导致血栓形成和下肢感觉异常，又常伴随急性尿潴留和腹泻？,腔内修复组
bridge_subgraph_12353.graphml,哪种医学内容能解释细胞色素c和脂毒与2型糖尿病及遗传因素之间的关系？,AMPK
bridge_subgraph_12349.graphml,哪种疾病在使用SUs药物与传统治疗的同时，还需要特别注意心力衰竭的发生并采取针对性护理？,糖尿病合并AMI
bridge_subgraph_12346.graphml,哪种疾病在躯体化阳性时，通过艾灸神阙并结合心理护理和常规护理干预，能有效缓解症状？,失眠
bridge_subgraph_12351.graphml,哪种疾病既表现为入睡快、慢性前列腺炎，又常伴随多发性硬化和腹痛？,失眠
bridge_subgraph_12345.graphml,哪种疾病会导致情志损伤，且在治疗中常需使用安神补脑软胶囊和右美托咪定，并需通过心电图进行检查？,失眠
bridge_subgraph_12348.graphml,哪种疾病发病率高达56.67%，治疗后常见支气管哮喘症状，且常需心理疏导辅助治疗，并以疼痛为主要临床表现？,失眠
bridge_subgraph_12344.graphml,哪种疾病在采用活血化瘀法治疗的同时，常伴随子宫肌瘤并发症，且通过固涩止带辅助治疗后，白带能够恢复正常？,带下病
bridge_subgraph_12355.graphml,哪种疾病会导致痰火食积诸邪干扰和PSSS，并常与肺癌、胸闷同时出现？,失眠
bridge_subgraph_12354.graphml,哪种疾病在循证护理中使用茯苓和氟西汀的治疗方案，其治愈率可达1.67%？,失眠
bridge_subgraph_12357.graphml,哪种疾病在手术压迫后常伴随疼痛，且需要针对性护理干预和综合护理干预来辅助治疗？,产后下肢深静脉血栓
bridge_subgraph_12347.graphml,哪种疾病与Rho激酶1和心肌同组基因蛋白直接相关，且常与精神分裂症和胃癌同时出现？,RhoA
bridge_subgraph_12360.graphml,哪种疾病需要通过改良额眶翼点入路手术或神经内镜辅助手术来治疗，并且常伴随呕吐和头痛症状？,鞍区病变
bridge_subgraph_12358.graphml,哪种疾病在检查CSF常规时发现多种抗体阳性，并伴有神经系统症状，同时需要接受高压氧治疗？,狼疮性脑病
bridge_subgraph_12356.graphml,哪种疾病会导致女性突发感音神经性耳聋，并伴随耳鸣，需要耳鼻咽喉头颈外科治疗？,SSNHL
bridge_subgraph_12362.graphml,哪种疾病在进行围手术期人文关怀护理和术前介入治疗后，容易出现恶心和呕吐的症状？,中晚期妇科恶性肿瘤
bridge_subgraph_12359.graphml,哪种社会学理论能更好地解释血管外皮细胞瘤的鉴别诊断与失眠的临床表现，同时涵盖孤立性纤维瘤和脑肿瘤的病理分型？,肿瘤
bridge_subgraph_12364.graphml,哪种疾病在进行准分子激光冠状动脉消融术时，容易出现冠状动脉穿孔，且常与心肌梗死和ACS同时发生？,ELCA
bridge_subgraph_12371.graphml,哪种疾病在慢性疼痛和杆菌痢疾的同时出现时，更需要护理干预和环境因素的共同作用？,失眠
bridge_subgraph_12363.graphml,哪种疾病在体动记录仪监测下，气虚质患者常同时患有慢性乙型肝炎，且适合使用小柴胡汤治疗？,失眠
bridge_subgraph_12373.graphml,哪种疾病既可能由心理及药物因素引起，又表现为烦躁、神疲乏力和心慌？,失眠
bridge_subgraph_12374.graphml,哪种疾病在接触性皮炎和紧张型头痛同时出现时，更需要注重常规护理和整体护理的结合？,失眠
bridge_subgraph_12365.graphml,哪种疾病在血浆血小板微颗粒升高和nPET/CT检查异常的同时，还常伴随AIS和肿瘤的出现？,PMP
bridge_subgraph_12366.graphml,哪种疾病在治疗时需要创造良好睡眠环境、服用多巴丝肼片，并且常伴随乏力和需要进行磁共振成像检查？,失眠
bridge_subgraph_12369.graphml,哪种疾病在临床表现上既有重性抑郁障碍，又可能导致糖尿病和脑出血，且心理行为治疗可作为其辅助治疗手段？,失眠
bridge_subgraph_12372.graphml,哪种疾病会导致胃蛋白酶原Ⅱ值明显升高，并在胃镜检查中可见，同时可能伴随胃癌和Hp感染？,结节性胃炎
bridge_subgraph_12370.graphml,哪种疾病在临床表现为躯体化阳性及银屑病，且通常采用交泰丸加减治疗并辅以常规护理？,失眠
bridge_subgraph_12368.graphml,哪种疾病既可能是肺原性心脏病的病理分型，又可能引发肾综合征出血热的并发症，还与中毒和COPD的病因相关？,低渗性脑病
bridge_subgraph_12367.graphml,哪种疾病在脑电生物反馈实验室检查和苏格木勒-3汤水提物治疗中常见，且常伴有抑郁症和MCI高危因素？,失眠
bridge_subgraph_12375.graphml,哪种疾病在改善循环和辅助治疗中常见，且患者常伴有高血压和高血脂，同时需要关注血小板计数的变化？,继发脑出血
bridge_subgraph_12377.graphml,哪种疾病在鉴别诊断中需考虑MM和红系疾病，且常伴随肺炎并发症和头晕的临床表现？,增生性贫血
bridge_subgraph_12379.graphml,哪种疾病在全身其他部位发病，且预后稳定率仅为0.01%，常与胃癌和肺癌同时出现？,原发灶
bridge_subgraph_12382.graphml,哪种疾病在采用穴位敷贴和光照疗法联合治疗时，效果显著优于对照组？,失眠
bridge_subgraph_12378.graphml,哪种疾病最适合采用艾灸结合穴位贴敷和中药足浴联合心理疏导的治疗方法，同时常见于脑性瘫痪和老年心血管疾病患者？,失眠
bridge_subgraph_12380.graphml,哪种疾病在女性患者中常见，且治疗时需结合苯二氮NFDA1类药物、归脾汤加减以及心理疏导？,失眠
bridge_subgraph_12385.graphml,哪种医学内容最能有效预防孕期并发症和低出生体质量儿，同时关注贫血和年龄因素的影响？,LBWI
bridge_subgraph_12387.graphml,哪种医学内容在涉及行为干预和CS2时，常伴随头痛和头晕的出现？,失眠
bridge_subgraph_12384.graphml,哪种疾病可以通过佐匹克隆治疗、正压通气联合认知疗法以及针灸和头痛穴的综合治疗来缓解？,失眠
bridge_subgraph_12386.graphml,哪种疾病会导致消化系统不适且无法入睡，通常需要心内科就诊并进行心脏超声检查？,失眠
bridge_subgraph_12381.graphml,哪种疾病在出现呼吸困难的同时，还需要通过心电图辅助检查来鉴别诊断，并且可能与主动脉夹层的病理分型及血液透析的并发症相关？,心血管急症
bridge_subgraph_12383.graphml,哪种疾病在AASV检测中通过间接免疫荧光法确诊，且常伴随血糖升高和肾脏问题？,原发性小血管炎
bridge_subgraph_12376.graphml,哪种疾病会导致觉醒次数增多，需要使用龙牡敛进行治疗，并且常常需要配合干预治疗和护理干预？,失眠
bridge_subgraph_12361.graphml,哪种疾病在遗传因素影响下，容易出现肢体疼痛，并且适合通过内服中药联合针刺治疗及针对性护理进行辅助治疗？,失眠
bridge_subgraph_12388.graphml,哪种疾病在血样检测中常表现为高脂蛋白血症，并且需要综合护理干预来有效控制高血脂？,HLP
bridge_subgraph_12391.graphml,哪种疾病表现为关节疼痛，常使用骨痹颗粒治疗，且与骨质疏松相关，可辅以针灸疗法？,骨痹
bridge_subgraph_12397.graphml,哪种疾病在血常规检查异常的同时，会出现急性扁桃体炎和腰痛，且适合采用正压通气联合认知疗法辅助治疗？,失眠
bridge_subgraph_12399.graphml,哪种疾病既表现为航天运动病和TMJ区疼痛，又需要通过控制血压和高压氧治疗进行辅助治疗？,失眠
bridge_subgraph_12400.graphml,哪种疾病在长新冠和mIU的影响下，更容易与慢性心力衰竭和COPD同时出现？,失眠
bridge_subgraph_12389.graphml,哪种疾病会导致输卵管积液，并伴随腰痛和先兆流产，同时在实验室检查中表现为垂体泌乳素升高？,宫腔积液
bridge_subgraph_12392.graphml,哪种疾病在服用喹硫平治疗期间，容易出现新冠肺炎和脑缺血的临床表现，同时伴随血脂异常的实验室检查结果？,失眠
bridge_subgraph_12409.graphml,哪种疾病会导致PSCAD组的焦虑症状和心血管神经症，同时伴随腹泻和呕吐？,失眠
bridge_subgraph_12398.graphml,哪种疾病在高龄老人中常见，且攻击性强、躁狂，并常与带状疱疹同时出现？,失眠
bridge_subgraph_12406.graphml,哪种疾病会导致肝功八项异常、腹泻，同时伴随心肌酶升高和呕吐？,失眠
bridge_subgraph_12390.graphml,哪种疾病在治疗过程中会同时使用黄体酮胶囊和昆泰胶囊，并伴随易激惹症状，也可能用到香芍颗粒？,女性围绝经期综合征
bridge_subgraph_12394.graphml,哪种疾病会导致反应迟钝，且常需背部经脉手法辅助治疗，同时在检查中常出现心电图异常，可能需要进行冠状动脉介入治疗？,失眠
bridge_subgraph_12395.graphml,哪种疾病在荣誉竞争和个人未来发展方面有显著影响，且与生活习惯密切相关，同时抑郁也是其重要的风险评估因素？,应激源
bridge_subgraph_12403.graphml,哪种疾病在黏液型SFT中通过免疫组织化学检测，且常伴随疼痛并需要化疗？,软组织肿瘤
bridge_subgraph_12396.graphml,哪种疾病在服用布洛芬治疗时，若同时饮酒会增加坏疽性脓皮病风险，且需配合健康教育辅助治疗？,关节病
bridge_subgraph_12402.graphml,哪种疾病在鞍上池发病，经CT检查后，化疗预后相对良好？,神经节细胞胶质瘤
bridge_subgraph_12393.graphml,哪种疾病既有脑缺血的临床表现，又属于原发性失眠的病理分型，并且在治疗过程中需要综合护理和一般护理的辅助？,失眠
bridge_subgraph_12408.graphml,哪种疾病在经过剥除术治疗后会出现头晕，且其临床表现包括失眠和呕吐？,腹腔镜卵巢囊肿
bridge_subgraph_12412.graphml,哪种疾病在水针治疗和睡眠效率低下的情况下，通常需要结合健康教育和心理护理来综合治疗？,失眠
bridge_subgraph_12405.graphml,哪种疾病在治疗时通常会同时使用LED红光、咪唑斯汀以及西药和心理疏导？,面部糖皮质激素依赖性皮炎
bridge_subgraph_12407.graphml,哪种疾病在采用针刺按摩辅助治疗的同时，常表现为睡眠时间和深度不足，且其病因与性别和婚姻状况密切相关？,失眠
bridge_subgraph_12413.graphml,哪种疾病会导致2hPG升高和血清睾酮水平下降，同时伴随甲状腺功能亢进症和骨折的临床表现？,骨密度下降
bridge_subgraph_12404.graphml,哪种疾病在辅助治疗中常用Hcrt能系统和针灸治疗，且常通过焦虑与抑郁自评量表进行检查，同时可能导致耳鸣？,失眠
bridge_subgraph_12411.graphml,哪种疾病适合采用中药汤剂联合湿润烧伤膏治疗，并辅以局部护理和中药熏洗，其中药物治疗中包含当归？,臁疮
bridge_subgraph_12401.graphml,哪种疾病在70.4%的情况下可以通过行为疗法治疗，并且常与艾司西酞普兰一同用于精神疾病的治疗？,失眠
bridge_subgraph_12410.graphml,哪种社会学理论能够有效解释混合型病理分型中肾阴亏虚证的高危因素，并指导贝那普利+氨氯地平的药物治疗与护理干预的预防措施？,高血压
bridge_subgraph_12416.graphml,哪种疾病与polyunsaturated fatty acid和SFA密切相关，且常伴随肿瘤或恶性肿瘤的出现？,多不饱和脂肪酸
bridge_subgraph_12417.graphml,哪种疾病会导致男性同时出现腹痛和尿毒症不安腿综合征？,失眠
bridge_subgraph_12421.graphml,哪种疾病在服用黄连素治疗期间，需要特别关注体重和性别差异，并通过心电图检查来评估风险？,室性早博
bridge_subgraph_12415.graphml,哪种疾病在治疗过程中使用天麻素注射液和小剂量米氮平，且常伴有皮疹和干咳的症状？,失眠
bridge_subgraph_12419.graphml,哪种疾病在电针治疗脑卒中的过程中，与肿瘤的发生和患者年龄有显著关联？,冠心病
bridge_subgraph_12414.graphml,哪种疾病在检测时常通过荧光高效液相色谱法分析，且患者往往伴随心律失常和颈动脉超声异常，同时与横向暴力有关？,失眠
bridge_subgraph_12418.graphml,哪种疾病在治疗时会同时使用心痛煎剂和复方丹参，并伴随胸闷症状，还需配合稳心颗粒？,冠心病不稳定性心绞痛
bridge_subgraph_12420.graphml,哪种疾病在临床表现上类似乳腺炎，且可以通过经络催眠法辅助治疗，同时常配合使用龙胆泻肝汤等中药汤剂进行药物治疗？,失眠
bridge_subgraph_12423.graphml,哪种疾病既有子宫癌的临床表现，又伴随发热、呕吐，且恶梦夜惊与焦虑是其风险评估因素？,失眠
bridge_subgraph_12425.graphml,哪种社会学理论能解释43.0%的腹泻患者同时患有中位疾病和终末期肾脏病的情况？,贫血
bridge_subgraph_12428.graphml,哪种疾病发病率高达57.1%，且与肺I/R损伤直接相关，同时还可能导致类风湿关节炎和转化为慢性阻塞性肺疾病？,肺功能损害
bridge_subgraph_12427.graphml,哪种疾病在治疗过程中需要全面合理的护理干预，并且常伴随后天性小口畸形，同时还需要综合心理干预和心理护理的支持？,颜面部烧伤
bridge_subgraph_12426.graphml,哪种疾病需要同时使用硝苯地平缓释片、卡维地洛以及尼群地平和右佐匹克隆片进行治疗？,中度原发性高血压
bridge_subgraph_12432.graphml,哪种疾病在实验室检查中表现为多巴胺水平异常，临床表现为焦虑和ET，且需要护理干预作为辅助治疗？,失眠
bridge_subgraph_12422.graphml,哪种疾病在治疗时常用酸枣仁和远志，且与毒品危害密切相关，同时患者可能伴有糖尿病或2型糖尿病？,失眠
bridge_subgraph_12433.graphml,哪种疾病既可能导致胃肠道出血和胃炎，又常伴有感染性发热和一般发热症状？,肿瘤性发热
bridge_subgraph_12431.graphml,哪种疾病会导致Hcy水平升高和高血压，并且常与年龄增长和贫血同时出现？,糖尿病
bridge_subgraph_12429.graphml,哪种疾病在血清叶酸检测异常时，使用槐耳清膏治疗，且常伴有乏力和呕吐的症状？,结肠癌肿瘤
bridge_subgraph_12434.graphml,哪种疾病在治疗时可能使用贝利尤单抗或甲基泼尼松龙，且患者常伴有发热和血脂异常的症状？,儿童系统性红斑狼疮
bridge_subgraph_12435.graphml,哪种疾病在治疗过程中常采用肱尺关节分离技术和尺骨鹰嘴粉碎性骨折处理，并辅以电针治疗和中药熏洗？,肘关节功能障碍
bridge_subgraph_12430.graphml,哪种疾病在复发转移性乳腺癌患者中常伴随失眠，并且在进行酶联免疫吸附试验和化疗时需特别关注？,乳腺癌
bridge_subgraph_12437.graphml,哪种社会学理论能解释失眠和遗传性皮肤病（如银屑病）之间的关系，并考虑安慰剂效应的影响？,肿瘤
bridge_subgraph_12438.graphml,哪种疾病在治疗过程中常用水针辅助，并使用调胃承气汤，同时患者会出现呕吐和头痛的症状？,失眠
bridge_subgraph_12424.graphml,哪种疾病在治疗时可以采用中药穴位贴敷法辅助，并可能需要使用催眠药，且常见病因包括心功能不全，实验室检查中常涉及大脑中动脉搏动指数的异常？,失眠
bridge_subgraph_12442.graphml,哪种疾病在治疗过程中会同时使用脑功能治疗仪、右佐匹克隆，并结合丹参注射液和健康教育？,失眠
bridge_subgraph_12440.graphml,哪种疾病在消化内科就诊时，需要使用奥美拉唑药物治疗，并配合局部药物喷洒和常规护理干预？,ANVUGIB
bridge_subgraph_12436.graphml,哪种疾病在治疗时通常采用针刺配合局部按摩，临床表现主要为乳汁甚少或全无，并且常结合中药和点穴按摩进行综合治疗？,缺乳
bridge_subgraph_12441.graphml,哪种疾病在治疗过程中可能需要进行胃切除术和胰岛素泵治疗，并且常伴有血脂异常的临床表现和血脂异常的实验室检查结果？,糖尿病肥胖
bridge_subgraph_12443.graphml,哪种疾病在采用引阳入阴推拿治疗时，常伴随血管危险因素，并且与SAS和老年心肌梗死同时出现？,失眠
bridge_subgraph_12445.graphml,哪种疾病在单肺通气的情况下，需要同时使用氨溴索和褪黑素药物治疗，并可能辅以高压氧治疗？,兔肺损伤
bridge_subgraph_12444.graphml,哪种疾病在体质指数较高、有既往慢性疾病史的人群中更容易发生，且与婚姻状况和年龄也有密切关联？,HRQoL
bridge_subgraph_12452.graphml,哪种疾病既多发于妊娠妇女和老年人，又常由紫色尿袋综合征和感染引起？,无乳链球菌
bridge_subgraph_12447.graphml,哪种疾病在康复期劳教戒毒和干预治疗过程中，与恶性肿瘤和脑卒中同时出现的可能性较高？,失眠
bridge_subgraph_12451.graphml,哪种疾病在进行超声乳化术手术治疗的同时，需要特别关注糖尿病患者的术前护理指导和心理护理？,小切口白内障
bridge_subgraph_12455.graphml,哪种医学内容在常规康复治疗和脑瘫治疗中，常常与针灸和脑电图同时出现？,偏瘫型脑性瘫痪
bridge_subgraph_12439.graphml,哪种疾病在需要进行削痂植皮术治疗的同时，还需要配合康复护理和心理干预，且其病因通常为热压伤？,手部深度烧伤
bridge_subgraph_12446.graphml,哪种疾病在脊柱X线片上表现明显，且常需进行球囊扩张锥体成形术治疗，同时患者还伴有腹痛和骨质疏松症状？,脊柱压缩性骨折
bridge_subgraph_12457.graphml,哪种疾病在进行正畸术和口腔健康宣教的同时，还需要特别考虑常规护理和经济因素的影响？,牙科焦虑
bridge_subgraph_12456.graphml,哪种疾病在mutate-type M（）、GA/AA（）的情况下，与食管癌（）和乳腺癌（）同时出现的概率较高？,突变型
bridge_subgraph_12454.graphml,哪种疾病在使用加味滋水清肝饮和益眠达片的同时，最适合配合循证护理和优质护理来治疗？,失眠
bridge_subgraph_12458.graphml,哪种疾病在病理分型上与低通气综合征和CAA直接相关，且常与腰椎间盘突出症和便秘同时出现？,肾阳虚型
bridge_subgraph_12449.graphml,哪种疾病在应用常规干预辅助治疗后，仍需特别关注患者离家出走的风险评估，且常与精神疾病相关，尤其在特定年龄段的人群中高发？,失眠
bridge_subgraph_12448.graphml,哪种疾病在早产儿中常表现为高胆红素血症，需要辅助治疗，且在手术治疗中需建立动脉通道，同时患者年龄和血糖升高也是其高危因素和临床表现？,换血
