file,query,answer
bridge_subgraph_09455.graphml,哪种疾病既会导致肌炎和大脑白质病变，又常与银屑病和自身免疫性疾病同时出现？,代谢障碍
bridge_subgraph_09456.graphml,哪种疾病在治疗过程中需要同时进行钢板内固定术和普通一般护理，并且通常还会配合常规治疗和中医护理？,小儿骨折
bridge_subgraph_09457.graphml,哪种疾病在采用朝医太极针疗法和运脾和胃治疗的同时，常伴随磁共振成像检查和腹泻症状？,失眠
bridge_subgraph_09462.graphml,哪种疾病既与经济因素有关，又表现为睡眠时间短，并可能伴随食管癌和肿瘤的出现？,失眠
bridge_subgraph_09449.graphml,哪种疾病在基因1a型患者中，通过药枕加涌泉穴贴敷治疗，并且与体质量指数相关，其治愈率可达20.00％？,失眠
bridge_subgraph_09460.graphml,哪种疾病在临床表现为急性缺血性卒中，并可通过暖肝煎药物治疗，同时还需要心理治疗和护理作为辅助治疗手段？,失眠
bridge_subgraph_09451.graphml,哪种疾病在ERCP和UC患者中，同时伴随肝功能异常和结肠癌的风险较高？,原发性硬化性胆管炎
bridge_subgraph_09461.graphml,哪种疾病在使用复方紫草油和苦地湿敷剂治疗时，需要特别考虑患者的性别和年龄？,深Ⅱ度烧伤
bridge_subgraph_09468.graphml,哪种疾病在住院环境改变和采用针刺捻转补法的同时，还需要结合西药治疗和中药调理？,失眠
bridge_subgraph_09465.graphml,哪种疾病会导致内膜增生，并且在使用氯化锂治疗的同时，吸烟可能引发并发症，而安慰剂治疗也可能作为药物治疗方法之一？,糖尿病
bridge_subgraph_09459.graphml,哪种疾病在女性中较为常见，通常通过色素痣手术进行治疗，发病部位多见于皮肤各处及面颈部，且术后易出现感染并发症？,色素痣
bridge_subgraph_09463.graphml,哪种社会学理论能更好地解释肺癌病理分型与肿瘤分期阶段之间的关系，并指导优质护理在预防VTE转化中的作用？,肿瘤
bridge_subgraph_09471.graphml,哪种疾病在出现多形性红斑和TCE的同时，还需要特别注意感染和加强常规护理？,药疹样皮炎
bridge_subgraph_09464.graphml,哪种疾病在治疗过程中需要特别依赖冷敷和常规护理方法作为辅助治疗手段？,甲状腺瘤手术
bridge_subgraph_09467.graphml,哪种疾病在11.3%的人群中较为常见，且与27.14%的抑郁患者同时出现，并随年龄增长而增加？,前列腺偶发癌
bridge_subgraph_09474.graphml,哪种疾病在常规治疗过程中，同时使用静注丙种球蛋白和麻杏石甘汤，且常伴有腹泻症状？,婴幼儿肺炎
bridge_subgraph_09470.graphml,哪种疾病在治疗过程中通常会同时使用血塞通片、芍药甘草汤等中药，并辅以心理护理？,脑血管意外后遗症
bridge_subgraph_09478.graphml,哪种疾病既表现为脾胃虚寒证和脾胃湿热，又常伴随水肿和阳虚质？,Hp相关性胃病
bridge_subgraph_09466.graphml,哪种疾病在治疗过程中常采用美托洛尔联合稳心颗粒或步长稳心颗粒，并辅以常规护理和稳心颗粒的综合疗法？,冠心病合并心律失常
bridge_subgraph_09479.graphml,哪种疾病在推拿后容易导致血压增高，且常与PD和2型糖尿病同时出现？,失眠
bridge_subgraph_09469.graphml,哪种疾病在采用乌灵胶囊联合西酞普兰治疗的同时，体格检查常见呕吐和恶心症状？,失眠
bridge_subgraph_09473.graphml,哪种疾病在治疗后随访1～6个月期间，常伴有腹泻和腹痛，且与虑障碍直接相关？,失眠
bridge_subgraph_09482.graphml,哪种疾病既与应激反应和社交焦虑直接相关，又常伴随抑郁症状和强迫行为？,神经质人格
bridge_subgraph_09480.graphml,哪种疾病在服用苯海索药物的同时，可能会因学习负担重而加重，且与肿瘤有一定关联？,失眠
bridge_subgraph_09477.graphml,哪种疾病与阿萨希丝孢酵母感染和UTI同时出现，并且还可能引发脑出血和精神病？,尿道感染
bridge_subgraph_09472.graphml,哪种疾病在进行前列腺根治性切除术后，0~5级阶段的患者预后生存率为19%，且常需辅助治疗以预防脑卒中？,机器人
bridge_subgraph_09475.graphml,哪种疾病在改良法药物治疗和特定分娩方式（高危因素）下，常需配合胃肠减压辅助治疗，且早期护理干预能有效预防其发生？,新生儿呕吐
bridge_subgraph_09476.graphml,哪种疾病既包括食管裂孔疝的病理分型，又可能引发歪嘴哭综合征的并发症，同时还表现为呕吐，且右美托咪定是其常用治疗药物？,消化道畸形
bridge_subgraph_09481.graphml,哪种疾病在治疗过程中需要加强护理工作，且常与氯氮平和抗精神病药同时使用，如慢性精神分裂症？,慢性精神病
bridge_subgraph_09484.graphml,哪种疾病既有敌对表现，又常伴随腹痛和腹胀，且与特定疾病因素相关？,失眠
bridge_subgraph_09485.graphml,哪种疾病在进行脑室外引流术后常伴随贫血，且肝硬化是其高危因素？,新型隐球菌性脑膜炎
bridge_subgraph_09486.graphml,哪种疾病常见于老年妇人，表现为排便异常，且多发于女性和老年人？,闭孔疝
bridge_subgraph_09483.graphml,哪种疾病在治疗过程中常同时采用针刺和穴位贴敷，且与腰椎间盘突出症和继发性不孕症有直接关联？,失眠
bridge_subgraph_09489.graphml,哪种医学内容能同时解释拔罐和时睡时醒，并可能与糖尿病和鼻塞相关？,失眠
bridge_subgraph_09491.graphml,哪种疾病在出现海洛因戒断症状和糖尿病的同时，还可能伴随高血压和老年期痴呆？,失眠
bridge_subgraph_09497.graphml,哪种疾病在牙源性菌培养过程中，需要同时进行常规护理和综合护理干预？,颌骨骨髓炎
bridge_subgraph_09495.graphml,哪种疾病在思想麻痹、心理因素和疲劳的共同作用下引发，且可以通过光镜检测来诊断？,重度伤
bridge_subgraph_09496.graphml,哪种疾病在治疗过程中需要同时使用糖皮质激素和椎管内麻醉术，并且还需要进行心理疏导和心理护理？,暂时性神经病学综合征
bridge_subgraph_09492.graphml,哪种疾病在采用碘酊灼烧联合药物治疗的情况下，发病率高达31.3%，并且通常需要配合综合护理和心理护理作为辅助治疗？,真菌性角膜溃疡
bridge_subgraph_09487.graphml,哪种疾病在治疗过程中常使用舍玻乙红霉素根管糊剂，且牙根折裂是其常见并发症，同时患者的受教育程度和接受的健康教育也会影响其风险评估和治疗效果？,牙髓病
bridge_subgraph_09504.graphml,哪种疾病会表现出BH4D和无精打采的症状，并且通常需要通过针灸和推拿进行辅助治疗？,失眠
bridge_subgraph_09493.graphml,哪种疾病会导致伴面神经受损，需要通过开放性乳突根治术治疗，并且常伴有耳鸣，通过磁共振成像可以确诊？,中耳胆脂瘤
bridge_subgraph_09488.graphml,哪种疾病会导致患者有强烈的不确定感，并可能需要进行乳房再造手术，同时常伴随焦虑症状，需要接受心理治疗？,乳房缺失
bridge_subgraph_09490.graphml,哪种疾病会导致右心室发育不良，并在电子束计算机断层摄影术、心电图和心脏超声检查中同时出现相关异常表现？,复杂先天性心脏病
bridge_subgraph_09499.graphml,哪种医学内容更容易在急性脑梗死和脑梗死患者中同时出现出血性转化和脱髓鞘斑块？,CBF
bridge_subgraph_09503.graphml,哪种疾病会出现头晕目眩的症状，并且可以通过舒肝清胃安神法、帕罗西汀和柴胡加龙骨牡蛎汤进行治疗？,失眠
bridge_subgraph_09501.graphml,哪种疾病同时涉及肾素血管紧张素系统异常、心率控制问题，并常伴随代谢综合征和高血压的出现？,RHR
bridge_subgraph_09494.graphml,哪种疾病在出现左侧肢体肌力0级的同时，常需通过静脉途径栓塞进行辅助治疗，并伴随脑出血并发症，还需进行心理护理？,硬脑膜动静脉瘘
bridge_subgraph_09500.graphml,哪种疾病会导致糖尿病性外周神经麻痹，并可能引发后交通动脉瘤，通常在眼科和神经内科就诊？,单侧动眼神经麻痹
bridge_subgraph_09502.graphml,哪种疾病在尿液人乳头瘤状病毒(HPV)检测阳性后，常采用干扰素a-2b凝胶治疗，且多发于特定年龄段人群，并需结合西医治疗辅助？,宫颈HPV感染
bridge_subgraph_09498.graphml,哪种疾病在蒙医灸疗辅助治疗和常规护理下，常表现为苔白和腹痛？,失眠
bridge_subgraph_09506.graphml,哪种疾病在治疗时同时需要用到氟哌利多（或其同义词）来缓解癌性剧痛，并且也需要用于治疗冠心病和肺癌？,氟哌啶
bridge_subgraph_09508.graphml,哪种疾病在大脑皮质发病，表现为出血性静脉脑梗死，且常伴有混合型和脑出血的临床症状？,出血灶
bridge_subgraph_09514.graphml,哪种疾病在女性患者中，通过穴位贴敷神门穴并结合稳心颗粒和心理护理，治疗效果尤为显著？,失眠
bridge_subgraph_09507.graphml,哪种疾病在临床上常表现为脑血管病，并伴有原发性高血压和恶性肿瘤，且可通过小剂量米氮平治疗？,失眠
bridge_subgraph_09510.graphml,哪种疾病适合采用酸枣仁汤治疗，并辅以中药熏洗、康复护理和穴位按摩来缓解症状？,失眠
bridge_subgraph_09509.graphml,哪种社会学理论能更好地解释失眠与PVTT的高危因素，并考虑磁共振成像结果和年龄在风险评估中的作用？,肿瘤
bridge_subgraph_09511.graphml,哪种疾病在治疗过程中常结合左房容积追踪技术辅助检查，并同时采用二甲双胍和中药治疗，辅以推拿手法？,早期2型糖尿病
bridge_subgraph_09505.graphml,哪种疾病在牙周炎和半夏枯草相关治疗中，常与ACI和脑梗死同时出现？,失眠
bridge_subgraph_09515.graphml,哪种疾病会同时出现同种异体骨和肿瘤，并且常伴随骨巨细胞瘤和T1WI的表现？,良恶性骨肿瘤
bridge_subgraph_09517.graphml,哪种疾病在进行单被试多基线实验时，常伴随睡眠效率降低，并且需要同时进行心理护理和基础护理？,失眠
bridge_subgraph_09516.graphml,哪种疾病在吸烟和糖尿病患者中常见，且需要使用贝复新药物治疗和定期换药辅助治疗？,脂肪液化
bridge_subgraph_09520.graphml,哪种疾病能阻止母婴垂直传播，主要流行于非洲撒哈拉以南地区，并伴随发热和皮疹症状？,儿童艾滋病
bridge_subgraph_09518.graphml,哪种疾病会导致逼真梦境和癫痫，并可能引发脑梗死，同时可以使用ALB进行辅助治疗？,失眠
bridge_subgraph_09521.graphml,哪种疾病在使用制霉菌素漱口液治疗的同时，还需配合护理干预和心理护理，以预防重症肺炎的发生？,口腔真菌感染
bridge_subgraph_09513.graphml,哪种疾病在中医辨证治疗中常作为辅助治疗，且其病因与橡胶相关，在实验室检查中常通过酶联免疫吸附试验诊断，病理分型上表现为接触性皮炎？,过敏性皮肤病
bridge_subgraph_09519.graphml,哪种疾病在经支气管镜肺活检和乳糜胸的情况下，常伴随支气管炎和多发性硬化？,肺淋巴管肌瘤病
bridge_subgraph_09524.graphml,哪种医学内容在治疗恶性肿瘤和脑卒中时，常与思诺思和温泉水联合运动疗法一同使用？,失眠
bridge_subgraph_09528.graphml,哪种疾病在出现肺部感染和光晕的同时，还伴随呕吐和皮疹？,nB
bridge_subgraph_09512.graphml,哪种疾病在实验室检查中常见GABA异常，治疗时需配合中药口服和心理护理，且容易并发脑梗死？,失眠
bridge_subgraph_09522.graphml,哪种疾病在治疗过程中需要同时使用安慰剂和胸透，并且辅以护理干预和基础护理？,失眠
bridge_subgraph_09525.graphml,哪种疾病在治疗过程中需要同时使用角膜溃疡的针对性护理和肠内营养混悬液的支持？,神经外科昏迷
bridge_subgraph_09529.graphml,哪种疾病与HANS和百合直接相关，且常与卒中和急性缺血性卒中同时出现？,失眠
bridge_subgraph_09523.graphml,哪种疾病在临床表现上既有紧张性头痛，又可能需要化疗，并且与糖尿病相关，还可以通过耳穴压丸疗法进行辅助治疗？,失眠
bridge_subgraph_09531.graphml,哪种疾病在出现上腹痛和乏力的同时，通过实时超声造影检查可能被诊断为原发性肝癌？,肝占位性病变
bridge_subgraph_09530.graphml,哪种疾病在运脾和胃及护理干预辅助治疗下，发病率达6.09％，且常与妊娠高血压综合征相关？,失眠
bridge_subgraph_09532.graphml,哪种疾病在治疗过程中会同时使用人参多糖、EGFR家族受体酪氨酸激酶药物、化疗以及中药？,抗肿瘤
bridge_subgraph_09533.graphml,哪种疾病会导致皮肤或皮下组织坏死，且在肿瘤晚期容易出现，同时需要考虑肿瘤风险评估并辅以循证护理治疗？,化疗药物外渗
bridge_subgraph_09536.graphml,哪种疾病在女性中较为常见，表现为发热，且在治疗过程中需辅助健康干预，使用艾司西酞普兰后症状有所改善？,失眠
bridge_subgraph_09534.graphml,哪种疾病同时涉及phospholamban异常和股骨干问题，并且常伴有糖尿病和腹痛症状？,PLB
bridge_subgraph_09526.graphml,哪种疾病在腹盆腔放疗和全腹腔镜脾切除后，容易出现重度烧伤和腹泻的临床表现？,肠源性感染
bridge_subgraph_09527.graphml,哪种疾病在山梨醇氢呼气试验阳性且伴有腹泻的情况下，通常需要使用枯草杆菌二联活菌和左氧氟沙星进行治疗？,SIBO
bridge_subgraph_09535.graphml,哪种疾病在年龄较大的人群中常见，表现为高血压，且其病因与阴阳失调有关，可通过智能心理多功能减压训练辅助治疗？,失眠
bridge_subgraph_09539.graphml,哪种疾病在牙周炎患者接受高压氧联合治疗时，较易同时出现惊厥和突发性耳聋？,失眠
bridge_subgraph_09549.graphml,哪种疾病在老年人男性中常见，且与P16和PTEN相关？,皮肤基底细胞癌
bridge_subgraph_09543.graphml,哪种疾病在治疗过程中通常会同时使用曲马多、硫酸吗啡控释片以及中药，并辅以常规护理？,肛门病
bridge_subgraph_09537.graphml,哪种疾病在治疗过程中常需使用唑吡坦和硝西泮，且患者可能出现骨折和扭伤的临床表现？,失眠
bridge_subgraph_09540.graphml,哪种疾病在耳穴按摩和护理干预的辅助治疗下，同时使用乙酰谷酰胺药物治疗，且慢性胃炎是其高危因素？,失眠
bridge_subgraph_09547.graphml,哪种疾病在心理干预和帕罗西汀联合乙酰谷酰胺治疗的同时，还需要考虑环境改变和婚姻状况的影响？,失眠
bridge_subgraph_09538.graphml,哪种疾病更容易在增龄、肥胖以及特定性别的人群中引发腰椎问题？,症状性OA
bridge_subgraph_09541.graphml,哪种疾病在老年人中常见，常表现为椎体骨折但无神经损伤，且多由骨质疏松引起？,骨折不愈合
bridge_subgraph_09553.graphml,哪种疾病会出现肿瘤细胞异型性显著、需进行根治性肾切除手术，同时伴随乏力和低热症状？,肾集合管癌
bridge_subgraph_09545.graphml,哪种疾病在使用光学相干断层扫描仪进行诊断时，常与糖尿病视网膜病变相伴，并且可能受针刺法和遗传因素影响？,黄斑病变
bridge_subgraph_09551.graphml,哪种社会学理论能解释失眠与原发性肿瘤、食管癌在四肢发病部位之间的关联？,恶性肿瘤
bridge_subgraph_09552.graphml,哪种疾病会导致难以入睡，且在睡眠日记中有所体现，同时可能伴随脑梗死和卒中症状？,失眠
bridge_subgraph_09550.graphml,哪种疾病在氯吡格雷抗栓治疗期间，与糖尿病同时出现时，更容易引发脑梗死，且与TC水平有关？,大动脉粥样硬化性脑梗死
bridge_subgraph_09542.graphml,哪种疾病在脑卒中后失眠的情况下，通过针灸和推拿按摩治疗时，常伴随恶心症状，并且可能需要使用右美托咪定？,失眠
bridge_subgraph_09554.graphml,哪种疾病会导致心脾两虚证但不伴抑郁症状，并且需要一般护理且可能伴随中毒现象？,失眠
bridge_subgraph_09548.graphml,哪种疾病在家庭经济水平较低的情况下容易导致冠心病，且在治疗后常出现艾司西酞普兰相关症状，同时与糖尿病有密切关联？,失眠
bridge_subgraph_09563.graphml,哪种疾病会导致PIH和颈强直，并且常伴有耳鸣和恶心？,体位性头痛
bridge_subgraph_09557.graphml,哪种疾病需要同时使用重组人血管内皮抑素、复方苦参等中药治疗，并配合化疗？,老年晚期非小细胞肺癌
bridge_subgraph_09544.graphml,哪种疾病在临床上表现为阴阳失调，需要进行视网膜电图辅助检查，并通过视网膜激光光凝术和西药进行治疗？,视网膜分支静脉阻塞
bridge_subgraph_09558.graphml,哪种疾病在进行冠心病介入治疗术和耳针疗法的同时，还常与糖尿病和牙周炎相伴出现？,失眠
bridge_subgraph_09546.graphml,哪种疾病在进行食管心房调搏术时需要同时服用华法林和维生素E，并且常伴随心房颤动？,AFL
bridge_subgraph_09559.graphml,哪种疾病在北京地区多发，且女性患者较多，常表现为乳酸酸中毒并影响心血管系统？,过早死亡
bridge_subgraph_09556.graphml,哪种疾病会导致冷冻后四肢出现异常，并且在不同年龄人群中通过酶联免疫吸附试验可以检测出来？,婴幼儿血管瘤
bridge_subgraph_09564.graphml,哪种疾病在眼科就诊时，通过光相干断层扫描检查可鉴别诊断出血性视网膜脱离，且可能与肿瘤相关？,脉络膜黑色素瘤
bridge_subgraph_09569.graphml,哪种疾病会同时出现脾虚湿困证和胃肠实热证，并且可能与精神分裂症和二甲双胍的使用相关？,药源性肥胖
bridge_subgraph_09562.graphml,哪种疾病在治疗时通常会采用耳穴贴压和循证护理作为辅助手段，同时使用黄芪注射液，并且其临床表现包括中度阴道前壁膨出？,失眠
bridge_subgraph_09565.graphml,哪种疾病在临床表现为流泪，通常需要通过超声乳化术治疗，且在治疗过程中可能会使用安慰剂和心理护理作为辅助？,抗青光眼
bridge_subgraph_09568.graphml,哪种疾病在男性中常见，且在治疗时可能需要使用新乐康或助眠药物，同时伴随牙周炎的临床表现？,失眠
bridge_subgraph_09567.graphml,哪种疾病在老年痴呆的背景下，同时需要考虑生物-社会-心理-环境因素，并可能涉及胃肠减压和整体护理？,失眠
bridge_subgraph_09566.graphml,哪种疾病可能导致宿舍声音嘈杂，并需要使用氟哌噻吨美利曲辛片治疗，同时辅以药物治疗和健康管理模式？,失眠
bridge_subgraph_09555.graphml,哪种疾病既有失眠的临床表现，又属于非小细胞癌的病理分型，并且可能需要心理干预和肺血管全肺切除作为治疗手段？,肺癌
bridge_subgraph_09570.graphml,哪种疾病在出现赤巴咂久病和前列地尔症状的同时，还伴随恶心和血常规异常？,黄疸型肝炎
bridge_subgraph_09571.graphml,哪种疾病会导致ACTH异常、需要使用复方醒神液治疗，并且常伴随精神障碍和心电图异常？,急性脑外伤
bridge_subgraph_09577.graphml,哪种疾病在出现头晕和缺血性脑卒中的同时，适合使用桂枝汤治疗，并且常伴随急性失眠？,失眠
bridge_subgraph_09576.graphml,哪种疾病在头部穴位按摩和服用苏格木勒-4的同时，常伴有头晕和血糖升高的症状？,失眠
bridge_subgraph_09580.graphml,哪种疾病在治疗时常用脑复康片和脑力宝丸，且患者常伴有耳鸣耳聋和多梦的症状？,脑力宝
bridge_subgraph_09560.graphml,哪种疾病在发病率约为3.1%的情况下，喉癌手术和糖尿病是其常见并发症，且心理护理在辅助治疗中尤为重要？,咽瘘
bridge_subgraph_09579.graphml,哪种医学内容在贫血患者的治疗中，与个体化系统营养管理和健康教育路径相结合，同时辅助常规护理，最为有效？,食管癌放疗
bridge_subgraph_09581.graphml,哪种医学内容在涉及18F-FDG PET-CT显像、肝叶切除的同时，也会与发热和化疗相关联？,原发性肝脏淋巴瘤
bridge_subgraph_09572.graphml,哪种疾病在治疗时需要疏通经络和服用五味子宁神合剂，并且患者常表现为疼痛，同时需要通过匹兹堡睡眠质量指数进行辅助检查？,失眠
bridge_subgraph_09578.graphml,哪种疾病在治疗过程中可以通过照海和改善住院环境辅助治疗，并且其临床表现可能包括子宫肌瘤和化疗？,失眠
bridge_subgraph_09573.graphml,哪种疾病在CTA检查中常见额叶和内囊后肢梗死，且患者常在眼科就诊，并伴有糖尿病？,后交通动脉瘤
bridge_subgraph_09583.graphml,哪种疾病在治疗过程中常需配合使用平衡针、安神足浴方和舒眠中药枕，并同时辅以高压氧治疗和血液透析？,失眠
bridge_subgraph_09584.graphml,哪种疾病在肢端型白癜风的转化过程中，通过CT影像学检查可以发现，并且常伴随TH病理分型和维生素E药物治疗？,局限型
bridge_subgraph_09575.graphml,哪种疾病在中度中毒组和重度中毒病理分型中常见，且可能导致肺水肿，同时需要通过心电图检查和高压氧综合治疗进行辅助诊断和治疗？,氯气中毒
bridge_subgraph_09586.graphml,哪种疾病在胆囊良性疾病并发症中，可能导致胆汁漏，并且与年龄和发热等临床表现密切相关？,胆管损伤
bridge_subgraph_09588.graphml,哪种疾病在治疗过程中常采用肛瘘切除术和低位切开高位挂线术，并且需要配合常规护理干预和综合护理干预？,高位肛瘘
bridge_subgraph_09587.graphml,哪种社会学理论能解释抑郁和颈动脉粥样硬化作为病因，以及混合斑和硬斑作为临床表现的关联性？,脑梗死
bridge_subgraph_09574.graphml,哪种疾病在治疗过程中需要特别注重饮食调护，并常结合灌胃肝胆两益汤和综合治疗，同时还会通过qPCR进行实验室检查？,失眠
bridge_subgraph_09561.graphml,哪种疾病在采用逍遥散药物治疗的同时，结合音乐疗法辅助治疗，能有效缓解类风湿关节炎引起的水肿？,失眠
bridge_subgraph_09595.graphml,哪种疾病在宫腔镜检查时表现为内膜与肌层交界模糊不清，且常与乳腺癌高危因素和糖尿病相关？,子宫内膜增厚
bridge_subgraph_09593.graphml,哪种疾病在采用多学科协作团队模式及动脉栓塞术治疗时，需要同时配合ICU监护和常规护理干预？,凶险型前置胎盘
bridge_subgraph_09585.graphml,哪种疾病在治疗过程中需要使用吸氧管，并常伴随神经损伤，同时适合采用循证护理和综合护理干预？,神经外科重症
bridge_subgraph_09590.graphml,哪种疾病在老年性痴呆和DC-CIK治疗过程中，常伴随皮疹和上呼吸道感染的出现？,失眠
bridge_subgraph_09592.graphml,哪种疾病在治疗过程中需要同时使用氯沙疗坦和波依定，并进行PSQI检查以评估西药治疗的疗效？,老年难治性高血压
bridge_subgraph_09596.graphml,哪种疾病在透灸辅助治疗下，常因环境因素引发，且与绝经和骨质疏松密切相关？,失眠
bridge_subgraph_09589.graphml,哪种疾病会导致微血管壁损伤和细胞损伤，并且在使用ACT药物治疗的同时，常通过实验室检查与老年性痴呆相鉴别？,Aβ1-42
bridge_subgraph_09603.graphml,哪种疾病在外用针刺治疗慢性头痛的同时，还需要通过心电图检查来排除心脏病的可能性？,失眠
bridge_subgraph_09597.graphml,哪种疾病在治疗过程中既需要使用美多巴，又可能伴随化疗，并且与多发性硬化同时出现？,失眠
bridge_subgraph_09599.graphml,哪种疾病在进行细菌耐药监测和穿刺针留置时间风险评估时，常伴随尿毒症和糖尿病等并发症？,菌血症
bridge_subgraph_09608.graphml,哪种疾病会导致呕吐、照海，并伴随腹泻和发热？,失眠
bridge_subgraph_09591.graphml,哪种疾病在IL-36β、γ异常表达时，常与重型银屑病并发，且可通过酶联免疫吸附试验检测，同时伴有上呼吸道感染症状？,GPP
bridge_subgraph_09600.graphml,哪种疾病较好地与慢性肺源性心脏病相关，并且常与脑卒中和血液透析同时出现？,重度低钠血症
bridge_subgraph_09606.graphml,哪种症状更容易与听力下降和特发性突聋同时出现，是皮疹还是突发性耳聋？,眩晕
bridge_subgraph_09594.graphml,哪种疾病在治疗过程中常需联合使用非苯二氮卓类催眠药物和米氮平，并辅以健康教育和心理护理？,失眠
bridge_subgraph_09598.graphml,哪种疾病与肝脏原癌基因和非霍奇金淋巴瘤直接相关，且常伴随肿瘤和吸烟现象？,c-myc
bridge_subgraph_09582.graphml,哪种疾病在进行经尿道电切术和电切镜联合腹腔镜检查时常需与膀胱癌进行鉴别诊断，且可能伴有头晕的临床表现？,膀胱副神经节瘤
bridge_subgraph_09601.graphml,哪种医学内容与阻塞性睡眠呼吸暂停和重度心力衰竭直接相关，并且常常与脑钠素和肥胖同时出现？,心力衰竭
