file,query,answer
bridge_subgraph_12613.graphml,哪种疾病在尿毒症不安腿综合征的治疗中，可以通过服用肝胆两益汤这类中药药物来缓解症状？,失眠
bridge_subgraph_12607.graphml,哪种疾病在出现恶心症状的同时，需要采用CS2和中医护理技术进行治疗，并且可能涉及腹膜透析？,失眠
bridge_subgraph_12599.graphml,哪种疾病在需要进行心脏介入术治疗的同时，常表现为夜眠浅，并且伴随心律失常，需要配合常规护理？,失眠
bridge_subgraph_12610.graphml,哪种疾病在治疗过程中常采用放松治疗和腹针结合背俞穴放血，且患者年龄和饮酒习惯也是重要考虑因素？,失眠
bridge_subgraph_12614.graphml,哪种疾病在治疗时常用耳穴贴压法辅助，并需服用镇静性抗抑郁药，同时在磁共振检查中常发现肿瘤表现？,失眠
bridge_subgraph_12602.graphml,哪种疾病在男性中多见，且常与尺桡骨远端骨折相关，需要常规护理干预？,儿童骨折
bridge_subgraph_12619.graphml,哪种疾病在扩散加权成像中表现出缺乏HVS，且常与心脏病和糖尿病同时出现？,HVS
bridge_subgraph_12621.graphml,哪种疾病在进行酶联免疫吸附试验时常伴有自杀意念，且可能同时出现肿瘤和乳腺癌的临床表现？,失眠
bridge_subgraph_12618.graphml,哪种疾病在男性中更常见，且随着年龄增长，失眠会加重高血压，中医护理干预对其有辅助治疗效果？,失眠
bridge_subgraph_12620.graphml,哪种疾病在洋地黄治疗后容易出现期前收缩，且在心电图上表现为心律失常？,紊乱性房性心动过速
bridge_subgraph_12616.graphml,哪种疾病既可能导致失眠和无症状心肌缺血，又常与马来酸桂哌齐特的使用及室性心律失常同时出现？,冠心病
bridge_subgraph_12622.graphml,哪种疾病在药物治疗的同时，还需要通过大脑中动脉搏动指数的实验室检查来辅助诊断，并且离不开护理和心理护理的综合辅助治疗？,失眠
bridge_subgraph_12603.graphml,哪种疾病在病理分型中属于泡型包虫病，且常伴随残腔积液和感染并发症，使用右美托咪定进行药物治疗？,肝包虫病
bridge_subgraph_12606.graphml,哪种疾病在进行体格检查时常发现，发病率约为31.91%，且在实验室检查中常用酶联免疫吸附试验，同时健康教育是其重要的辅助治疗手段？,失眠
bridge_subgraph_12617.graphml,哪种疾病既可能导致结肠癌等并发症，又常伴有慢性阻塞性肺病和呕吐的临床表现？,失眠
bridge_subgraph_12625.graphml,哪种疾病会导致胃窦晚期恶性肿瘤和胃癌，并且常伴有出血和恶心症状？,胃出口梗阻
bridge_subgraph_12624.graphml,哪种疾病既有慢性乙肝的临床表现，又有PI的临床表现，并且常需高压氧辅助治疗，属于混合型病理分型？,失眠
bridge_subgraph_12626.graphml,哪种疾病适合使用脑功能治疗仪并配合调脾方法，尤其在女性和中老年人中较为常见？,失眠
bridge_subgraph_12611.graphml,哪种疾病在治疗过程中会同时使用银蓝化斑汤、中药七参连软膏以及抗组胺药物，并且需要通过酶联免疫吸附试验进行辅助诊断？,玫瑰糠疹
bridge_subgraph_12632.graphml,哪种疾病在进行全子宫切除术后，常伴有头痛和恶心，且需要麻醉科就诊？,ASA Ⅰ～Ⅲ级
bridge_subgraph_12634.graphml,哪种疾病会导致睡眠习惯改变和睡眠质量下降，且常伴随高血压和需要做心脏超声检查？,失眠
bridge_subgraph_12623.graphml,哪种疾病会导致恐惧心理、恶梦夜惊与焦虑，并且需要通过脑电图检查和康复护理来治疗？,失眠
bridge_subgraph_12612.graphml,哪种疾病在婴儿法乐四联症术后更容易引发急性呼吸窘迫综合征，并且与肥胖和术后疼痛同时出现？,呼吸系统并发症
bridge_subgraph_12629.graphml,哪种疾病在患者出现纵向应变和服用氨氯地平片的同时，常伴随Hp感染和脑卒中的发生？,CSX
bridge_subgraph_12635.graphml,哪种疾病会导致黄曲霉菌丝聚集，并常与慢性荨麻疹和感染同时出现？,烟曲霉
bridge_subgraph_12639.graphml,哪种疾病会导致乳腺癌，并且在进行聚合酶链反应实验室检查和术前化疗时经常被关注？,肺癌
bridge_subgraph_12633.graphml,哪种疾病在实验室检查中表现为多巴胺水平异常，需用氯化锂治疗，且常伴有癫痫发作，影像学检查中头颅MRI可见相关病变？,失眠
bridge_subgraph_12636.graphml,哪种疾病在进行头颅CT检查后，通常需要结合高压氧治疗和优质护理来进行辅助治疗？,中重型颅脑损伤
bridge_subgraph_12637.graphml,哪种疾病在改善机体营养状况预防的同时，需要特别关注护理辅助治疗，并且年龄是高危因素之一？,手术感染
bridge_subgraph_12628.graphml,哪种疾病在进行过敏源点刺试验时常被诊断出，且可能导致过敏性结膜炎，并常与支气管哮喘并发，需要体针辅助治疗？,花粉症
bridge_subgraph_12631.graphml,哪种疾病在点穴推拿治疗辅助下，常伴有发热症状，且可能导致糖尿病，并需通过匹兹堡睡眠质量指数进行检查？,失眠
bridge_subgraph_12638.graphml,哪种疾病在治疗胃肠间质瘤时需要结合行为矫正，并且常伴随药物使用和血常规监测？,重症多形红斑
bridge_subgraph_12643.graphml,哪种疾病既可能导致前分支阻滞，又与先天性心脏病、高血压性心脏病及冠心病密切相关？,完全性右束支阻滞
bridge_subgraph_12644.graphml,哪种疾病与FLRX和胃为法直接相关，且常与遗传和心房颤动同时出现？,失眠
bridge_subgraph_12641.graphml,哪种疾病在皮质下发病，且常表现为冠心病，适合采用针刺结合耳穴压豆和艾灸进行辅助治疗？,失眠
bridge_subgraph_12645.graphml,哪种疾病会导致痰阻心脉和焦虑，且常与慢性病相伴，需要通过磁共振成像来诊断？,失眠
bridge_subgraph_12653.graphml,哪种疾病会导致ALT和BUN指标异常，同时伴有胸闷和腹泻的症状？,肝肾功能损伤
bridge_subgraph_12630.graphml,哪种疾病在干预治疗时需要特别考虑火邪的影响，并且常常与针灸疗法和针刺同时使用？,失眠
bridge_subgraph_12651.graphml,哪种疾病属于慢性肝炎组且无肝脏纤维化，同时伴有恶心和胸闷的临床表现？,弥漫性肝病
bridge_subgraph_12650.graphml,哪种疾病在完成治疗后，使用疏肝解郁胶囊进行治疗，且常伴有发热和胸闷的症状？,失眠
bridge_subgraph_12646.graphml,哪种疾病与七情过极和Hcrt能系统直接相关，且常伴随乏力和需要使用归脾汤治疗？,失眠
bridge_subgraph_12627.graphml,哪种疾病在改变睡眠习惯和进行健康干预的同时，还需要配合常规治疗和PCI？,失眠
bridge_subgraph_12647.graphml,哪种疾病在采用敷脐疗法治疗的同时，常伴随创伤性骨折、维持性血液透析和肝硬化的症状？,失眠
bridge_subgraph_12655.graphml,哪种医学内容与Gal-3和p53基因突变直接相关，并且常在原发性肝癌和乳腺癌中同时出现？,癌组织
bridge_subgraph_12642.graphml,哪种疾病在临床表现上类似HFD，需要通过脂肪清除来鉴别诊断，且常与肝病相关并可通过体重指数进行实验室检查？,脂肪变性
bridge_subgraph_12648.graphml,哪种疾病在采用系统康复方法及自拟安神解郁汤治疗的同时，常伴随心房颤动和慢性心衰的症状？,失眠
bridge_subgraph_12658.graphml,哪种疾病既容易导致窒息和感染，又多发于低体温患儿，且临床表现为震颤？,新生儿低血糖症
bridge_subgraph_12649.graphml,哪种疾病在使用盐酸度洛西汀肠溶胶囊治疗时，常伴随头晕眩晕症状，且眩晕成因复杂，需要结合认知行为治疗进行辅助治疗？,慢性主观性头晕
bridge_subgraph_12654.graphml,哪种疾病在应用常规干预和压患者耳部穴位的同时，还需要结合循证护理和常规护理干预？,失眠
bridge_subgraph_12659.graphml,哪种疾病既表现为胃食管反流和肝硬化，又因阳气耗损而导致发热？,失眠
bridge_subgraph_12652.graphml,哪种疾病既属于弥漫性肝病和肝胆疾病的范畴，又常与肝病和乙型肝炎同时出现？,慢性肝炎组
bridge_subgraph_12661.graphml,哪种疾病在治疗过程中需要结合C反应蛋白检测、骨痂延长术，以及心理护理和常规护理？,胫骨慢性骨髓炎
bridge_subgraph_12657.graphml,哪种疾病会导致复发性早期流产和不孕，同时伴随痤疮和先兆流产的症状？,黄体功能不全
bridge_subgraph_12640.graphml,哪种疾病在男性中较为常见，临床表现包括ESD，且原发性肝癌是其可能的并发症，治疗时可能使用苯二氮类药物？,失眠
bridge_subgraph_12665.graphml,哪种疾病适合采用中医综合疗法和针灸来治疗肝热血瘀型症状，并且需要服用肠溶阿斯匹林？,中风先兆
bridge_subgraph_12663.graphml,哪种疾病会导致十二指肠问题并需要肠切除吻合术，同时伴随贫血和腹胀症状？,原发性小肠肿瘤
bridge_subgraph_12664.graphml,哪种疾病会导致褪黑素水平降低和老年性痴呆，并且常在肝和头颈部发病？,失眠
bridge_subgraph_12656.graphml,哪种疾病在临床表现为抑郁症，且在辅助治疗中常采用针刺加音乐疗法，同时还需要结合常规护理和康复护理？,失眠
bridge_subgraph_12670.graphml,哪种疾病会导致碱性磷酸酶明显增高、身高变矮，并伴随骨痛和尿常规异常？,低血磷性骨软化症
bridge_subgraph_12667.graphml,哪种疾病既表现为血压增高和水肿，又可能伴随肺炎，且需使用催眠药物进行治疗？,失眠
bridge_subgraph_12660.graphml,哪种疾病在进行罗哌卡因硬膜外阻滞和CT检查时，常伴随出现焦虑抑郁症状，需要特别进行心理护理？,带状疱疹性神经痛
bridge_subgraph_12662.graphml,哪种疾病在采用药膳疗法的同时，若再配合生活起居疗法和康复护理，能通过尿常规检查发现与贫血相关的临床表现？,失眠
bridge_subgraph_12669.graphml,哪种疾病会导致服用奥美拉唑钠后出现肠鸣音，并伴随腹胀和右美托咪定的使用？,老年重症胰腺炎
bridge_subgraph_12673.graphml,哪种疾病在心理素质差的学生中，同时出现睡眠情况评定表异常、MG和ACI的情况？,失眠
bridge_subgraph_12666.graphml,哪种疾病在治疗过程中会同时使用西酞普兰联合枣仁安神颗粒和复方枣仁胶囊，并且可能出现肝硬化和呕吐的临床表现？,失眠
bridge_subgraph_12671.graphml,哪种疾病在HIV感染和侵袭性念珠菌病的基础上，更容易与2型糖尿病和新型冠状病毒感染同时出现？,核酸
bridge_subgraph_12668.graphml,哪种疾病在治疗过程中需要介入溶栓术和以和胃为法辅助，同时常伴随穴位敷贴治疗和体重减轻的症状？,失眠
bridge_subgraph_12676.graphml,哪种疾病既伴发高脂血症和过度劳累，又常与偏头痛和上呼吸道感染同时出现？,BPPV复发
bridge_subgraph_12674.graphml,哪种疾病在治疗后会出现困倦乏力的症状，临床表现为银屑病，且常需辅以心理治疗和电针治疗？,失眠
bridge_subgraph_12677.graphml,哪种疾病会导致不能获得充足睡眠，并且需要同时进行整体护理和常规护理，比如脑肿瘤？,失眠
bridge_subgraph_12681.graphml,哪种疾病会导致腹泻和慢性下消化道出血，并且常伴有腹胀，需要通过体格检查来诊断？,失眠
bridge_subgraph_12682.graphml,哪种疾病会导致肝动脉受侵，同时出现恶心症状，且其肿瘤类型预后较好？,胰腺腺泡细胞癌
bridge_subgraph_12675.graphml,哪种疾病在治疗时常用针刺配合循经闪罐法和整体护理，且患者常伴有贫血，并通过14C呼气试验进行检查？,失眠
bridge_subgraph_12680.graphml,哪种疾病更容易与婴儿巨细胞病毒性肝炎和脂肪肝同时出现，是类风湿关节炎还是2型糖尿病？,湿热内蕴证
bridge_subgraph_12679.graphml,哪种社会学理论能解释多浆膜腔积液和老年慢性病在药物使用和肝硬化症状中的相互关系？,肿瘤
bridge_subgraph_12683.graphml,哪种疾病在鉴别诊断中需考虑SDB，且常伴有抑郁并发症，同时表现为躯体化和由强迫因素引起？,失眠
bridge_subgraph_12687.graphml,哪种疾病在进行探索性因子分析时，能通过定病位明确与癫痫及其发作有直接关联？,失眠
bridge_subgraph_12685.graphml,哪种症状在经皮肾镜取石术后使用舒芬太尼治疗时，与失眠和耳穴按压同时出现？,呕吐
bridge_subgraph_12684.graphml,哪种疾病在男性中较为常见，治疗后症状（ACT）明显改善，且常通过焦虑自评量表（SAS）进行辅助检查，同时会导致腰痛？,失眠
bridge_subgraph_12689.graphml,哪种医学内容在针对新型冠状病毒肺炎的治疗中，既涉及对因护理又涵盖阴阳失调和舒适护理的综合应用？,失眠
bridge_subgraph_12692.graphml,哪种疾病在进行瘢痕挛缩修复术和瘢痕整形术时，需要特别重视整体护理和常规护理的差异？,手部烧伤
bridge_subgraph_12688.graphml,哪种疾病在采用个体化护理干预和滋水清肝饮辅助治疗的同时，还需要监测体重指数并可能使用可乐定进行治疗？,失眠
bridge_subgraph_12678.graphml,哪种疾病与阵发性夜间血红蛋白尿（PNH）和Bcl-2基因异常相关，且常伴有感染和乏力症状？,PNH
bridge_subgraph_12691.graphml,哪种疾病在患有2型糖尿病且伴随阴虚火旺型症状时，通过中药熏洗能有效改善失眠问题？,糖尿病
bridge_subgraph_12690.graphml,哪种疾病既可以通过坐浴方式辅助治疗，又需要使用医用防护口罩预防，且其病因可能与自身免疫性疾病和慢性前列腺炎有关？,病原微生物
bridge_subgraph_12695.graphml,哪种疾病会导致男性在思虑劳伤和绝经期同时出现腹泻的症状？,失眠
bridge_subgraph_12703.graphml,哪种疾病既表现为系统型结痂，又常伴随发热和心力衰竭？,结节性脂膜炎
bridge_subgraph_12694.graphml,哪种疾病在出现实时三维超声心动图显示肺动脉瓣狭窄的同时，还常伴随癫痫发作和心电图异常？,继发孔型ASD
bridge_subgraph_12693.graphml,哪种疾病会导致夜眠浅和疼痛，且其发病率为37.5%，通常需要常规护理干预辅助治疗？,失眠
bridge_subgraph_12672.graphml,哪种疾病在辅助检查中常见视网膜电图异常，同时伴随肾血管充血、腹痛，并可能引发银屑病并发症？,慢性砷中毒
bridge_subgraph_12696.graphml,哪种疾病在接触T-2毒素后，通过SPSS 17.0分析发现，与进行健康教育和补充维生素E有显著关联？,骨节病
bridge_subgraph_12686.graphml,哪种疾病在进行腺苷负荷心肌灌注显像和MRA检查时，需要特别关注舒适护理与常规护理的差异？,老年PCI
bridge_subgraph_12697.graphml,哪种疾病在男性患者中常见，且在治疗时通常会使用补心益气汤和四神聪，同时可能伴随骨折的临床表现？,失眠
bridge_subgraph_12704.graphml,哪种疾病会导致颈动脉体异常和血清总胆红素升高，且常与慢性阻塞性肺疾病和肿瘤同时出现？,CB
bridge_subgraph_12702.graphml,哪种疾病会导致呼吸不畅和失眠，并需要综合护理和常规护理同时进行辅助治疗？,失眠
bridge_subgraph_12699.graphml,哪种疾病在10～20岁的先天性脊柱侧凸组中，需要特别重视护理和心理护理？,重度脊柱侧凸
bridge_subgraph_12698.graphml,哪种疾病在女性和男性中都可能发病，且适合采用循经闪罐法和刺激控制训练法进行辅助治疗？,失眠
bridge_subgraph_12700.graphml,哪种疾病在AHAR和UC患者中常见，且常与COPD和OSAHS同时出现？,轻中度组
bridge_subgraph_12708.graphml,哪种疾病在心理调护和肝郁血虚方面需要特别注意，且常与高血压和肺癌同时出现？,失眠
bridge_subgraph_12709.graphml,哪种疾病在使用多塞平治疗时，可能与食物因素相关，并伴随呕吐症状，同时需要使用生脉注射液进行治疗？,失眠
bridge_subgraph_12701.graphml,哪种疾病在治疗过程中通常会采用闭合复位和经皮锁定加压钢板，同时配合中药治疗和循证护理？,胫腓骨中下段骨折
bridge_subgraph_12705.graphml,哪种疾病在耳鼻咽喉科中较为常见，且男女比例为2:1，常伴有慢性鼻炎和鼻塞症状？,UACS
bridge_subgraph_12710.graphml,哪种疾病需要开腹手术治疗，并且在治疗过程中需配合优质护理，同时患者常伴有腹胀症状？,老年肠梗阻
bridge_subgraph_12711.graphml,哪种疾病在出现肝郁血瘀证和生理不适的同时，还需要结合健康教育和常规护理来进行治疗？,失眠
bridge_subgraph_12715.graphml,哪种疾病会导致失用性肌萎缩，且通常需要滚针疗法辅助治疗，同时与年龄和性别密切相关？,失眠
bridge_subgraph_12712.graphml,哪种疾病在采用改进后的瑜伽功法辅助治疗后，仍会出现不得卧和腹胀，并伴随甲状腺功能亢进的临床表现？,失眠
bridge_subgraph_12707.graphml,哪种疾病既与颅咽管瘤和虹膜睫状体炎直接相关，又常伴随耳鸣和眼科问题？,颅内病变
bridge_subgraph_12719.graphml,哪种疾病会导致饮食不节，并表现为ESD、急性脑梗死及高血压病？,失眠
bridge_subgraph_12713.graphml,哪种疾病在出现室间隔支异常和室颤的同时，常伴随PCI治疗和心电图异常表现？,右冠状动脉
bridge_subgraph_12717.graphml,哪种疾病在血液透析治疗中常见，且表现为嗜酸性粒细胞增高，同时其风险与性别和年龄密切相关？,结核菌感染
bridge_subgraph_12706.graphml,哪种疾病在女性中更易发病，且与吸烟风险相关，同时涉及Smac蛋白药物治疗和单核苷酸多态性病理分型？,口腔白斑
bridge_subgraph_12722.graphml,哪种疾病在绝经后女性中常见，且在进行心脏介入治疗的同时，常伴有高血压和SBP升高的情况？,失眠
bridge_subgraph_12716.graphml,哪种疾病在头颈癌或其同义词的情况下，常通过介入移植术治疗，且患者常表现出食欲不振和乏力症状？,HNC
bridge_subgraph_12718.graphml,哪种疾病在技术类岗位人群中属于高危因素，常表现为神经精神症状，并且需要通过磁共振成像和血常规检查来辅助诊断？,失眠
bridge_subgraph_12714.graphml,哪种疾病在烧伤整形科治疗时常见瘀斑，且可能伴随参麦注射液使用和腹泻症状？,低血容量性休克
bridge_subgraph_12720.graphml,哪种疾病同时与水通道蛋白4抗体和高血压相关，并且常伴有脑梗死和认知功能障碍？,ApoE
bridge_subgraph_12721.graphml,哪种疾病在辅助治疗时会用到耳穴，并且常表现为腹胀、急性缺血性卒中和卒中？,失眠
bridge_subgraph_12727.graphml,哪种疾病最适合通过中药浴足、舒适护理、健康教育和护理干预等多种辅助治疗手段进行综合调理？,失眠
bridge_subgraph_12726.graphml,哪种疾病会导致脾肾亏虚，并出现食欲不振和嗳气的症状，可能需要使用催眠药进行治疗？,失眠
bridge_subgraph_12725.graphml,哪种医学内容在尿潴留的治疗中，与综合性护理干预和腰硬联合麻醉同时使用，比常规护理更有效？,下肢骨折手术
bridge_subgraph_12730.graphml,哪种疾病在治疗过程中需要同时采用水针、健康教育和整体护理，并且临床上常表现为急性脱瘾？,失眠
bridge_subgraph_12723.graphml,哪种疾病需要通过血管内介入治疗或弹簧圈联合血管内支架手术，并且常伴有高血压并发症，还需进行常规护理辅助治疗？,颅内宽颈动脉瘤
bridge_subgraph_12729.graphml,哪种疾病在早期联合检测中，与性别和吸烟因素共同作用下，最易被误诊为早期肺腺癌？,原位腺癌
bridge_subgraph_12728.graphml,哪种疾病在治疗过程中需要同时使用氯苯丙氨酸和抗抑郁剂，并且常伴随高血压症状，需辅以丹参注射液？,失眠
bridge_subgraph_12731.graphml,哪种疾病在出现病毒性脑炎和背俞穴铺灸治疗的同时，常伴随运动障碍和脑血管病？,后遗症
bridge_subgraph_12735.graphml,哪种疾病在早期功能锻炼的同时，适合配合中药熏洗和穴位贴敷作为辅助治疗？,手指屈肌腱断裂
bridge_subgraph_12724.graphml,哪种疾病在临床表现为脑血管病和发热，且常用安寐汤治疗，其发病率约为37.5%？,失眠
bridge_subgraph_12734.graphml,哪种疾病会导致甲亢，并伴随呕吐和多食的症状？,老年淡漠型甲亢
bridge_subgraph_12737.graphml,哪种疾病会导致心神失养或心神不安，在老年心内科常见，且可能伴随癫痫和头痛症状？,失眠
bridge_subgraph_12732.graphml,哪种疾病会导致肝血亏虚证，表现为精力和食欲差，并伴有痤疮和水肿？,失眠
bridge_subgraph_12733.graphml,哪种疾病在治疗过程中常配合使用温胆汤类、逍遥散等药物治疗，以及针刺和艾灸等中医疗法？,失眠
bridge_subgraph_12736.graphml,哪种疾病在治疗过程中需要控制性降压和鼻内镜双极电凝止血法，并且患者常伴有呕吐和结肠癌的临床表现？,鼻腔出血
bridge_subgraph_12745.graphml,哪种疾病在中医穴位按摩治疗和白昼时间延长的情况下，更容易与心血管疾病及骨质疏松同时出现？,失眠
bridge_subgraph_12740.graphml,哪种疾病与言语开导法直接相关，且多表现为多瘀，并常伴随肝和肝失疏泄的症状？,情志致病
bridge_subgraph_12738.graphml,哪种疾病在治疗过程中会同时涉及T N F‐α和n度洛西汀，并且常伴随慢性痛，使用电针作为辅助疗法？,病理性疼痛
bridge_subgraph_12744.graphml,哪种社会学理论能解释肝硬化导致的并发症如中枢神经系统白血病，以及脑电图影像学检查和肥胖作为风险评估因素之间的关系？,感染
bridge_subgraph_12748.graphml,哪种疾病在出现心理行为障碍和服用茯苓-远志的同时，还常伴随高血压和重症肌无力？,失眠
bridge_subgraph_12742.graphml,哪种疾病在居家的重性精神障碍患者中较为常见，且需要社区医生进行辅助管理，如精神分裂症等精神障碍？,重性精神障碍
bridge_subgraph_12750.graphml,哪种疾病最适合采用小针刀、针刺、手法推拿和针灸等辅助治疗，比如颈椎病？,颈椎综合征
bridge_subgraph_12749.graphml,哪种医学内容能够有效应对难以缓解的多虑和OSAS合并高血压，同时也能处理关节痛和贫血问题？,失眠
bridge_subgraph_12741.graphml,哪种疾病在治疗过程中常采用中药浴、针灸和针刺作为辅助手段，且其临床表现包括畸形？,小儿痉挛型脑性瘫痪
bridge_subgraph_12746.graphml,哪种疾病在冠心病风险评估因素中需特别关注，且在普外科手术治疗中常见，同时需要与高血压进行鉴别诊断，并可能引发脑血栓作为并发症？,糖尿病
bridge_subgraph_12752.graphml,哪种医学内容既与营养心肌治疗和心房相关，又常与脑卒中和头晕同时出现？,房性心动过速
bridge_subgraph_12739.graphml,哪种疾病在出现关节痛和乏力的同时，需要通过微生物检验来与脊柱结核进行鉴别诊断？,n布病
bridge_subgraph_12743.graphml,哪种疾病在治疗时既需要使用解郁宁神汤和养血清脑颗粒，又常伴随癫痫症状，并且可以通过检测大脑中动脉搏动指数来辅助诊断？,失眠
bridge_subgraph_12753.graphml,哪种疾病在超声心动图和心脏超声检查中可见异常，且常伴有咳嗽和发热症状？,原发性心脏血管肉瘤
bridge_subgraph_12751.graphml,哪种疾病在疏泄焦虑和老年抑郁的临床表现中，常需要通过护理干预和综合护理来进行辅助治疗？,失眠
bridge_subgraph_12758.graphml,哪种疾病最常导致老年人需要接受主动脉瓣膜置换手术，且往往伴随血脂异常的情况？,钙化性主动脉瓣疾病
bridge_subgraph_12761.graphml,哪种疾病在超声和超声造影检查中常与磁共振一同用于诊断乳腺癌？,浸润性小叶癌
bridge_subgraph_12754.graphml,哪种疾病在诊断过程中既需要使用多导睡眠检测仪，又常常与磁共振成像和慢性鼻窦炎同时出现？,失眠
bridge_subgraph_12760.graphml,哪种疾病在治疗过程中常用银杏达莫，临床表现为斑块及钙化，且常与慢性肾炎和高血压病同时出现？,早中期慢性肾衰竭
bridge_subgraph_12757.graphml,哪种疾病在采用当归四逆汤治疗后，可能会出现支气管哮喘症状，且常伴随心电图异常和胃食管反流病表现？,失眠
bridge_subgraph_12747.graphml,哪种疾病既会导致失眠和继发性巨结肠，又需要肠内营养支持策略，并可能引发肺炎？,顽固性便秘
bridge_subgraph_12762.graphml,哪种疾病既有遗传缺陷又有动态心电图异常，且常伴随心力衰竭和心血管系统问题？,线粒体疾病
bridge_subgraph_12755.graphml,哪种疾病在冠心病风险评估因素和颈动脉IMT影像学检查中表现突出，且常与颈动脉粥样硬化和NT-proBNP实验室检查结果相关？,糖尿病
bridge_subgraph_12756.graphml,哪种疾病的发病率约为2.42‰，在治疗过程中常需辅助抗感染治疗，并且可能会同时使用地西泮药物和高压氧综合治疗？,新生儿破伤风
