file,query,answer
bridge_subgraph_06987.graphml,哪种疾病需要通过微创锁内加压钛板固定加植骨术治疗，并辅以四肢洗方，同时在治疗过程中容易出现感染，通常在骨科就诊？,胫骨远端骨折
bridge_subgraph_07005.graphml,哪种医学内容在涉及Runx3和SP免疫组织化学法的同时，也与贫血和代谢综合征相关？,子宫内膜样腺癌
bridge_subgraph_06992.graphml,哪种疾病会出现肝肿大和心悸，且在治疗中可能使用益赛普，需要与肿瘤进行鉴别诊断？,成人斯蒂尔病
bridge_subgraph_07004.graphml,哪种疾病在吸烟人群中，且随着年龄增长，使用FLRX和耳针治疗效果更显著？,失眠
bridge_subgraph_07003.graphml,哪种疾病在进行骨骼肌活检（组织学检查）时发现异常，且常累及颞叶和顶叶，同时磁共振检查可见异常，并伴有失语的临床表现？,MELAS型线粒体脑肌病
bridge_subgraph_07009.graphml,哪种疾病在治疗过程中通常需要结合血管内介入治疗、中加体外放射治疗，并伴随化疗和疼痛的临床表现？,中晚期胰腺癌
bridge_subgraph_07012.graphml,哪种疾病在家庭延伸护理和心理护理干预下，常表现为食欲减退，并可能伴随抑郁症状？,直肠癌结肠造口
bridge_subgraph_07013.graphml,哪种疾病在CT扫描中表现为恶性肿瘤，且其临床表现与乳腺癌和长骨中心型Ⅰ级软骨肉瘤相似？,软组织肿块
bridge_subgraph_07006.graphml,哪种疾病在治疗过程中需要同时使用卡前列素氨丁三醇和缩宫素，并辅以一般护理和常规护理干预？,高危妊娠产妇
bridge_subgraph_07014.graphml,哪种疾病在出现恶心呕吐的同时，还需要通过3D MRI扫描和焦虑自评量表(SAS)进行评估？,鼻咽肿瘤
bridge_subgraph_07000.graphml,哪种疾病在进行甲状腺全切术或甲状腺全切除术的同时，更容易并发帕金森病或心力衰竭？,甲状旁腺功能减退
bridge_subgraph_07008.graphml,哪种疾病既有病因不明导致的困惑，又常使用茯神药物治疗，同时伴随痤疮的临床表现，且可辅以腹针疗法进行缓解？,失眠
bridge_subgraph_07007.graphml,哪种疾病在临床表现上既有病而不得卧又有肝病症状，且针刺及针刺加音乐疗法对其有辅助治疗效果，同时还可能与遗传因素相关？,失眠
bridge_subgraph_07010.graphml,哪种疾病会导致肠道不适，并可能伴随抑郁症状，且治疗时可能使用褪黑素受体激动剂？,失眠
bridge_subgraph_07011.graphml,哪种疾病在高龄人群中易引发胃癌并发症，并可能导致失眠，同时需要进行血常规检查和采取相应的护理措施？,糖尿病
bridge_subgraph_07017.graphml,哪种疾病在nPANSS评分正常化、接受鼓舞与赞许治疗的同时，与性别和吸烟习惯有显著关联？,失眠
bridge_subgraph_07019.graphml,哪种疾病在蒙医温针促睡眠机制的研究中，与月经不规律妇女同时出现高血压和冠心病的关联最为密切？,失眠
bridge_subgraph_07015.graphml,哪种疾病在治疗过程中需要通过指标监测辅助，并且常采用磁共振血管成像进行检查，同时患者往往伴有糖尿病这一高危因素，且磁共振成像也是其常用影像学检查手段？,颈内动脉闭塞
bridge_subgraph_07016.graphml,哪种社会学理论能更好地解释单侧空间忽略作为急性心肌梗死和脑损伤的风险评估因素，以及综合护理干预在预防这些病理分型中的作用？,脑卒中
bridge_subgraph_07024.graphml,哪种疾病在治疗过程中会同时使用超声心动图、人羊膜上皮细胞静脉移植、高压氧和二甲双胍？,大鼠心肌梗死
bridge_subgraph_07026.graphml,哪种医学内容对中老年人慢性紧张型头痛的治疗效果更好，是电针配合耳穴埋豆，还是磁共振？,失眠
bridge_subgraph_07020.graphml,哪种疾病表现为寐而易醒、可能伴随肝病，需要纠正不良睡眠习惯来预防，并且可以通过针刺辅助治疗？,失眠
bridge_subgraph_07022.graphml,哪种疾病在服用补肾活血养心汤后，通过汉密尔顿焦虑量表评估，同时伴随心悸症状和心电图异常表现？,失眠
bridge_subgraph_07027.graphml,哪种疾病在新生儿中常见，主要表现为肺动脉高压，且常伴有肺炎和发热症状？,足月儿
bridge_subgraph_07021.graphml,哪种医学内容与初始气体流速明显升高和早期肠内营养直接相关，且常与COPD和急性左心衰竭同时出现？,HFNC
bridge_subgraph_07028.graphml,哪种医学内容在治疗骨折和疼痛时，通常会结合使用牛黄降压片和电针神门、三阴交穴？,失眠
bridge_subgraph_07018.graphml,哪种疾病在治疗过程中会使用血府逐瘀汤，同时需要监测急性期蛋白cRP和D-二聚体，并可能需要BiPAP呼吸机辅助通气治疗？,COPD急性加重
bridge_subgraph_07025.graphml,哪种疾病在治疗过程中会同时涉及拱顶石穿支岛状皮瓣和颏下动脉岛状皮瓣，并且需要心理护理和骨科的配合？,皮肤软组织缺损
bridge_subgraph_07033.graphml,哪种疾病在涉及AIH和细胞凋亡的同时，也常与糖尿病和磁共振成像相关联？,排斥反应
bridge_subgraph_07031.graphml,哪种疾病在脚踝针上1和慢性牙周炎的治疗中，与对照组相比，经过常规治疗后效果更为显著？,失眠
bridge_subgraph_07029.graphml,哪种疾病在采用中药足浴联合心理疏导和MMT时间长的治疗方式下，同时配合优质护理和MT，效果最为显著？,失眠
bridge_subgraph_07034.graphml,哪种疾病在CT影像中表现出特定特征，并且治疗过程中需要使用β-内酰胺酶抑制剂，同时还需要结合循证护理和常规护理措施？,难治性肺炎
bridge_subgraph_07023.graphml,哪种疾病在治疗过程中常需结合耳穴压豆配合中药沐足、睡眠教育及心理护理，且临床表现主要为脑血管病？,失眠
bridge_subgraph_07040.graphml,哪种疾病在服用地西泮后症状消失，且常伴有腹痛和肿瘤的出现？,失眠
bridge_subgraph_07036.graphml,哪种疾病会导致17～59岁患者IPSS评分下降，并常伴有尿潴留和左心衰？,尿道狭窄
bridge_subgraph_07032.graphml,哪种疾病在采用细胞计数法进行诊断时，常与EPA、苦参和二甲双胍同时出现？,人肺腺癌
bridge_subgraph_07035.graphml,哪种疾病在神庭辅助治疗下能有效缓解，且常因情志损伤引发，表现为腹痛，并且多发于特定年龄段人群？,失眠
bridge_subgraph_07037.graphml,哪种疾病在老年人中常见，既与髋臼发育不良和股骨颈骨折直接相关，又常需护理干预和酶联免疫法进行辅助诊断？,全髋置换
bridge_subgraph_07038.graphml,哪种疾病在化疗过程中容易出现肿瘤并发发麻，且适合采用内服中药联合针刺治疗作为辅助疗法？,失眠
bridge_subgraph_07039.graphml,哪种疾病在治疗过程中会同时使用曲安奈德和昆明山海棠片，并结合光疗和中药疗法？,结节性痒疹
bridge_subgraph_07046.graphml,哪种疾病在更年期表现为发热，且适合用疏肝理气法辅助治疗，同时常配合血府逐瘀汤进行药物治疗？,失眠
bridge_subgraph_07049.graphml,哪种疾病会导致心神失养或心神不安，且在治疗中常采用褪黑素受体激动剂，并需要结合中医护理和护理干预？,失眠
bridge_subgraph_07050.graphml,哪种疾病在男性中较为常见，且通常由肺部感染引起，治疗时需使用全氟化碳液体药物并配合常规护理？,吸入性损伤
bridge_subgraph_07030.graphml,哪种疾病在ICU中常见，且患者通常表现为血常规异常、C反应蛋白升高，对敏感抗生素治疗有反应？,肺炎克雷伯菌败血症
bridge_subgraph_07055.graphml,哪种疾病会导致血清CysC水平升高和炎性因子增加，并且在使用安慰剂治疗时与患者年龄有关？,2型糖尿病大血管病变
bridge_subgraph_07051.graphml,哪种社会学理论能够更好地解释妇产科护理中多发性硬化与常规护理、产后出血之间的关联？,感染
bridge_subgraph_07045.graphml,哪种疾病在Meta分析或综述中显示与吸烟密切相关，且肥胖是其常见临床表现，同时点穴推拿治疗作为有效的辅助治疗手段？,失眠
bridge_subgraph_07056.graphml,哪种疾病在出现肢体痛时，可以通过耳穴配合体针治疗，并且常与冠心病和血脂异常同时出现？,失眠
bridge_subgraph_07041.graphml,哪种疾病在患者有血液肿瘤病史并使用甲泼尼龙治疗的情况下，最有可能与类风湿关节炎和肺炎同时出现？,机化性肺炎
bridge_subgraph_07047.graphml,哪种疾病在同时出现贫血和慢性胃炎时，需要通过药物治疗幽门螺杆菌和铁缺乏？,硫酸亚铁
bridge_subgraph_07060.graphml,哪种疾病与阿尔采末病相关，且在其患者中占比高达20.4%，并常与谵妄和糖尿病同时出现？,老年人痴呆
bridge_subgraph_07058.graphml,哪种疾病在采用高压氧综合治疗的同时，还需要结合使用二甲双胍和中药，并且可以通过汉密尔顿焦虑量表进行评估？,失眠
bridge_subgraph_07042.graphml,哪种疾病在病理分型上属于慢性轻度苯中毒，且通过免疫组化法实验室检查可诊断，同时常导致白细胞减少症，并需进行心理干预以预防？,苯中毒
bridge_subgraph_07057.graphml,哪种疾病在急性膀胱炎患者中使用QLQ-C30量表评估时，常伴有头颈部症状和TH指标异常？,失眠
bridge_subgraph_07048.graphml,哪种疾病常见于男性，发病部位在头颈部，且常用生龙骨和脑蛋白水解物片进行治疗？,失眠
bridge_subgraph_07043.graphml,哪种疾病在STIR成像上表现为类似湿热痹阻型RA的影像特征，同时伴有疼痛，且需与肿瘤进行鉴别诊断？,骨髓水肿
bridge_subgraph_07063.graphml,哪种医学内容在急性缺血性卒中治疗中，与情志调节和心理护理以及吸烟影响密切相关？,失眠
bridge_subgraph_07052.graphml,哪种疾病在治疗时常用桂枝汤和FTS，且常伴随PANSS评估和肝脏问题？,失眠
bridge_subgraph_07061.graphml,哪种疾病会导致心神失养，出现头昏和疼痛，并且需要通过健康教育来辅助治疗？,失眠
bridge_subgraph_07062.graphml,哪种疾病在治疗过程中需要同时使用激素类药物和左升右降微针调气法，并且常伴随抑郁症状，需要配合心理护理？,失眠
bridge_subgraph_07069.graphml,哪种疾病在老年冠心病和心肌梗死患者手术后，容易出现非运动症状，并且可以通过安神定悸汤进行治疗？,失眠
bridge_subgraph_07064.graphml,哪种疾病在男性中更易发生，表现为突发性聋或传导性聋，且常需药物治疗辅助？,内耳疾病
bridge_subgraph_07070.graphml,哪种疾病在女性中更常见，且临床表现为MS和121，类似于多发性硬化？,颈痛
bridge_subgraph_07044.graphml,哪种疾病在治疗过程中使用异环磷酰胺，常侵犯胆管，且与胃癌并发，表现为呕吐症状？,转移性癌
bridge_subgraph_07053.graphml,哪种疾病在出现血白蛋白和急性肾炎综合征的同时，适合采用中医护理干预并结合血常规检查来辅助治疗？,原发性肾小球疾病
bridge_subgraph_07059.graphml,哪种疾病在加强护理干预后能有效缓解心理生理性失眠，且常伴有脑卒中，特别是缺血性脑卒中的临床表现？,失眠
bridge_subgraph_07072.graphml,哪种疾病既可能由不安全感和抑郁情绪引发，又表现为缺血性脑血管病和卵巢早衰？,失眠
bridge_subgraph_07066.graphml,哪种疾病会导致无法正确调整情绪，并且可以通过甘麦大枣汤治疗，同时需要配合心理护理和基础护理？,失眠
bridge_subgraph_07067.graphml,哪种疾病在采用疏肝理气养心安神加减疗法的同时，还需要进行基础护理并伴有发热症状？,失眠
bridge_subgraph_07071.graphml,哪种疾病在多排螺旋CT和RT-3DE检查中常见，且常与高血压和糖尿病同时出现？,主动脉瓣狭窄
bridge_subgraph_07065.graphml,哪种疾病在治疗过程中需要适度镇静和机械加温加湿器，且常与感染和慢性阻塞性肺疾病同时出现？,建立人工气道
bridge_subgraph_07068.graphml,哪种疾病在采用音乐疗法辅助治疗的同时，还需要结合护理干预和优质护理来有效改善心脾两虚证？,失眠
bridge_subgraph_07054.graphml,哪种疾病在实验室检查中常通过RT-PCR法和罗丹明外排实验进行诊断，且在治疗过程中常伴随使用二甲双胍和HPLC检测？,人胰腺癌
bridge_subgraph_07075.graphml,哪种疾病在第64例慢性淋巴细胞白血病患者的体格检查中同时出现了肺炎的临床表现？,反复发热
bridge_subgraph_07077.graphml,哪种疾病在男性患者中更易发生，且在进行血管内栓塞治疗后容易出现再出血和肺炎并发症？,颅内破裂动脉瘤
bridge_subgraph_07081.graphml,哪种疾病在男性肥胖患者中常见，且表现为白值较低，需要辅助治疗？,失眠
bridge_subgraph_07073.graphml,哪种疾病在出现NIHSS评分异常和采用变频推拿睡眠导入法治疗的同时，还常伴随贫血和腹痛症状？,失眠
bridge_subgraph_07076.graphml,哪种疾病在男性中更常见，且可能同时出现重度抑郁症、尿毒症和多发性硬化的临床表现？,失眠
bridge_subgraph_07078.graphml,哪种疾病会导致球麻痹和慢性心力衰竭，同时伴有n2并发症和永久性脑部并发症的高危因素？,呼吸功能不全
bridge_subgraph_07083.graphml,哪种疾病会导致皮肤病变，同时伴随腹泻，且实验室检查发现蛋白质水平和细胞因子异常？,aGVHD
bridge_subgraph_07080.graphml,哪种疾病在创伤病理分型中具有较高的1.45∶1发病率，并且常伴随乏力和呕吐的临床表现？,不明原因猝死
bridge_subgraph_07090.graphml,哪种医学内容在涉及肺泡上皮和胶原定量的同时，也会关联到体格检查和肝脏？,MSC
bridge_subgraph_07084.graphml,哪种疾病会导致工作效率下降，并可能在治疗后出现自发性蛛网膜下腔出血，同时与CRF和冠心病相关？,失眠
bridge_subgraph_07086.graphml,哪种疾病在心脏指数异常和二尖瓣修复术后，常与白塞病和肺癌同时出现？,主动脉
bridge_subgraph_07089.graphml,哪种疾病在QLQ-C30评估中，通过针刺捻转补法治疗，且与咖啡因摄入和胃癌相关？,失眠
bridge_subgraph_07088.graphml,哪种疾病在汉密尔顿抑郁量表评估中与心理及药物因素密切相关，且常与过敏性休克和肥胖同时出现？,失眠
bridge_subgraph_07079.graphml,哪种疾病因过食肥甘导致苔薄，并常伴有牙周炎，治疗后可能发展为慢性牙周炎？,失眠
bridge_subgraph_07087.graphml,哪种疾病在早期筛查中需要重点关注糖尿病的病因，并且通过检查TNF-α和血脂水平来进行诊断？,糖尿病大血管并发症
bridge_subgraph_07074.graphml,哪种疾病的发病率约为0.80%，常通过磁共振检测发现，并且易与感染并发，老年人是其高危人群？,胎盘植入
bridge_subgraph_07096.graphml,哪种疾病会导致腹部和纵膈同时出现心慌和体重减轻的症状？,孤立性纤维瘤
bridge_subgraph_07095.graphml,哪种疾病由于不确定性忍受力引起，表现为气滞血瘀，并且常伴随胃癌和发热症状？,失眠
bridge_subgraph_07091.graphml,哪种疾病在免疫组织化学法和增强检查中常见，且患者常伴有排尿困难和胸闷症状？,孤立性纤维性肿瘤
bridge_subgraph_07082.graphml,哪种疾病在治疗过程中常结合家庭化训练、脑机接口、经颅磁刺激和针刺治疗等多种辅助手段？,手功能康复
bridge_subgraph_07093.graphml,哪种疾病在抗中性粒细胞胞浆抗体阳性且胸部CT异常的情况下，常伴随腹痛，且需要接受常规治疗？,BO
bridge_subgraph_07097.graphml,哪种疾病在临床表现上会出现神经精神症状，并且通常采用透灸结合针刺、中医推拿以及常规护理作为辅助治疗？,失眠
bridge_subgraph_07092.graphml,哪种疾病在病理分型上属于孤立性纤维性肿瘤，临床表现包括头晕，且需通过头部MRI进行影像学检查，并适合采用内镜下口咽部肿瘤切除术进行治疗？,梭形细胞肿瘤
bridge_subgraph_07100.graphml,哪种疾病在治疗过程中会同时使用舍曲林、BPPV、高压氧和右美托咪定？,失眠
bridge_subgraph_07094.graphml,哪种疾病在男性中更常见，且伴随抑郁症状、情绪不稳定以及乏力等临床表现？,失眠
bridge_subgraph_07102.graphml,哪种医学内容在涉及失眠和角膜损伤的同时，也与3.7%的间充质干细胞相关？,糖尿病
bridge_subgraph_07101.graphml,哪种疾病在心室颤动和钙通道阻断剂的使用中，常与心律失常及快速性心律失常同时出现？,长QT综合征
bridge_subgraph_07099.graphml,哪种疾病在治疗过程中常需结合使用弹性髓内钉和皮电刺激，且患者可能同时患有肺癌和老年性痴呆？,TENS
bridge_subgraph_07085.graphml,哪种疾病在治疗过程中常需结合深组动静脉转流术和支架置入术，并辅以音乐疗法和健康信念模式？,下肢动脉闭塞症
bridge_subgraph_07104.graphml,哪种疾病会导致女性夜间出现惊恐发作，并伴随室性早搏，可能与基因有关？,失眠
bridge_subgraph_07117.graphml,哪种疾病会导致脑病变，同时引起肝和心的不适，类似于不寐的症状？,失眠
bridge_subgraph_07109.graphml,哪种医学内容与CXCL8、初治肺结核直接相关，且常与胸闷、吸烟同时出现？,PTB
bridge_subgraph_07105.graphml,哪种疾病在X线影像学检查中常见，并且需要结合细节护理和循证护理进行辅助治疗，同时患者常伴有焦虑症状？,胃肠疾病
bridge_subgraph_07106.graphml,哪种疾病会导致多梦易醒和TBil升高，并且常与肝硬化和ICU治疗同时出现？,失眠
bridge_subgraph_07110.graphml,哪种疾病在女性中更常见，且表现为更年期综合征、急性脱瘾以及腹痛等症状？,失眠
bridge_subgraph_07098.graphml,哪种疾病在治疗过程中需要同时使用Akt/mTOR活化抗UVB药物和VEGF药物，并且常伴随二甲双胍治疗和龙胆泻肝汤的病因？,HaCaT
bridge_subgraph_07112.graphml,哪种疾病既与胚胎干细胞和癫痫性痉挛直接相关，又常伴随认知行为治疗和脑电图检查？,ES
bridge_subgraph_07115.graphml,哪种疾病会导致脾胃不和，并伴随腹痛，同时需要化疗和心理行为治疗作为辅助治疗？,失眠
bridge_subgraph_07107.graphml,哪种疾病在高龄、低教育水平与职业的人群中较为常见，并且常常与心脏病和糖尿病同时出现？,获得性血管痴呆
bridge_subgraph_07116.graphml,哪种疾病在血清甲状腺激素异常的同时，常伴随贫血和感染，且可通过当归六黄汤进行治疗？,失眠
bridge_subgraph_07103.graphml,哪种疾病在治疗时既需要采用外侧裂入路显微手术或CT辅助穿刺引流手术，又常伴随心电图检查和CRP水平升高的情况？,基底节区脑出血
bridge_subgraph_07113.graphml,哪种疾病在制定运动处方和进行针对性护理时，需要特别考虑患者是否有妊娠高血压综合征或高血压病史？,失眠
bridge_subgraph_07108.graphml,哪种疾病在采用桂枝汤治疗的同时，辅以瑜伽训练艺术行为干预，能够有效缓解疼痛，并且与中药疗法相辅相成？,失眠
bridge_subgraph_07120.graphml,哪种医学内容既能关联神经衰弱和睡眠状况自评量表，又常与当归和类风湿关节炎一同出现？,失眠
bridge_subgraph_07114.graphml,哪种疾病在服用安神定悸汤和维生素治疗的同时，会出现乏力症状，且月收入水平可能是其风险评估因素？,失眠
bridge_subgraph_07118.graphml,哪种疾病在治疗时需要同时使用温补镇和镇静、安神的西药，并且常与高血压和SSD同时出现？,失眠
bridge_subgraph_07124.graphml,哪种疾病会导致心肌酶谱增高，同时需要进行二尖瓣成形术，并伴随心脏病和发热症状？,心内膜炎
bridge_subgraph_07111.graphml,哪种社会学研究探讨了失眠患者在接受睡眠护理干预期间，肝转移情况下MR影像学检查结果的临床意义？,恶性肿瘤
bridge_subgraph_07119.graphml,哪种疾病在出现头痛症状时，需要通过磁共振成像和CE-MRA静脉系成像来鉴别诊断良性颅内高压和假脑瘤综合征？,颅内静脉窦血栓形成
bridge_subgraph_07127.graphml,哪种疾病在服用清心莲子汤治疗慢性心衰的过程中，常伴有腹痛和呕吐的症状？,失眠
bridge_subgraph_07121.graphml,哪种医学内容在处理中药敷背散、白细胞计数的同时，也需要关注腹胀和体格检查？,婴儿肺炎
bridge_subgraph_07125.graphml,哪种疾病在肝阳上亢型患者中常见，且在使用珍蓉益脑胶囊治疗的同时，也可能伴随子宫肌瘤并通过磁共振成像进行诊断？,失眠
bridge_subgraph_07122.graphml,哪种疾病在女性中常见，且表现为听性脑干反应检测异常和非LVAS感音神经性聋，同时伴随眩晕症状？,ABR
bridge_subgraph_07130.graphml,哪种疾病在进行CT颅脑灌注成像和DSA检查时，常伴随葛根素治疗和发热症状？,急性缺血性脑血管疾病
bridge_subgraph_07132.graphml,哪种疾病在进行人工关节治疗技术时，伴随基础疾病的患者更容易出现感染，需要特别重视综合护理？,骨科创伤
bridge_subgraph_07131.graphml,哪种疾病在采用二甲双胍药物治疗时，更容易与非酒精性脂肪肝或酒精性脂肪肝同时出现？,易善复
bridge_subgraph_07135.graphml,哪种疾病会导致腹胀，并常与肝切除手术和肝内胆管细胞癌同时出现，类似于胆管细胞癌的症状？,原发性肝癌
bridge_subgraph_07126.graphml,哪种疾病在老年人中常见，且在进行椎间植骨融合手术后容易并发硬膜外血肿和感染？,腰椎退变性疾病
bridge_subgraph_07123.graphml,哪种疾病在股骨颈骨样骨瘤和AOFAS评估中常见，且常与糖尿病和肿瘤同时出现？,跛行
bridge_subgraph_07129.graphml,哪种疾病在糖尿病患者中常见，且通过PH检验法可以辅助诊断，通常会用六味地黄汤进行治疗，这种疾病是阴道假丝酵母菌病吗？,细菌性阴道炎
bridge_subgraph_07143.graphml,哪种疾病在采用促性腺激素治疗和戈那瑞林药物治疗的同时，可能引发重度抑郁症并导致骨质疏松？,性腺功能减退症
bridge_subgraph_07139.graphml,哪种疾病在重复用药和抗微生物药物使用过程中，容易出现不良反应和病情变化？,退药
bridge_subgraph_07134.graphml,哪种疾病在治疗过程中常采用平衡火罐配合穴位贴敷三阴交，并辅以心理护理和健康教育？,失眠
bridge_subgraph_07136.graphml,哪种疾病在脑功能磁共振成像检查中常见，且常伴随尿潴留和心肌梗死，需要接受健康及生活指导作为辅助治疗？,失眠
bridge_subgraph_07142.graphml,哪种疾病在磁共振静脉显影和例行数字减影血管造影中常见，且常伴随呕吐症状，需要综合护理干预？,静脉窦血栓
bridge_subgraph_07128.graphml,哪种疾病在指压神门穴后可能缓解阻塞性头痛，且常与中毒症状同时出现，需通过酶联免疫法进行检测？,失眠
bridge_subgraph_07138.graphml,哪种疾病在社区护理和健康教育中常需辅助治疗，且在超声心动图检查中常见，并常与高血压相伴出现？,慢性心血管疾病
bridge_subgraph_07146.graphml,哪种疾病既有遗传倾向，又可以通过灸疗缓解，且常见于男性并伴随腹痛症状？,失眠
bridge_subgraph_07140.graphml,哪种疾病在进行原位肝移植后容易出现感染并发症，并且需要通过扫描电镜进行影像学检查，同时还需要心理护理作为辅助治疗？,卡氏肺孢子虫肺炎
bridge_subgraph_07133.graphml,哪种社会学理论能解释认知行为疗法在辅助治疗失眠时，与贫血症状和磁共振影像学检查结果之间的关联？,恶性肿瘤
bridge_subgraph_07141.graphml,哪种医学内容与肉芽肿多血管炎和抗人红细胞血型糖蛋白A直接相关，且常与白塞病和头痛同时出现？,GPA
bridge_subgraph_07145.graphml,哪种疾病在个体化治疗和集束化护理的辅助治疗下，同时涉及肿瘤的病理分型和糖尿病的并发症管理？,外阴癌
bridge_subgraph_07144.graphml,哪种疾病在采用常规护理的同时，配合按摩、安神足浴方和舒眠中药枕辅助治疗，尤其适用于慢性病高危人群？,失眠
bridge_subgraph_07137.graphml,哪种社会学理论能更好地解释交感型颈椎病和糖尿病的鉴别诊断，以及NAFLD和肥胖在并发症和风险评估中的相互作用？,高血压
bridge_subgraph_07148.graphml,哪种疾病会导致儿童眼球穿通和角膜混浊，并在眼科研究中常设对照组进行对比？,外伤性白内障
bridge_subgraph_07150.graphml,哪种疾病在高危型HPV感染和阿希米纳米银治疗的同时，也可能涉及普通感染和中药治疗？,细菌性阴道病
bridge_subgraph_07158.graphml,哪种疾病在治疗过程中需要结合MCD和降脂方法，并且常伴随辨证施护和高压氧治疗？,糖尿病性肾病
bridge_subgraph_07153.graphml,哪种疾病在治疗时需要针刺配合推拿，并且常与中药和化疗同时使用，特别适用于精神障碍性疾病？,失眠
