file,query,answer
bridge_subgraph_03501.graphml,哪种检查能同时用于诊断无症状舒张功能不全、异常早期妊娠、妇科疾病和癌前病变？,超声诊断
bridge_subgraph_03502.graphml,哪种检查能够同时有效诊断急性呼吸道感染、手足口病、慢性乙型肝炎和小儿肺炎？,免疫球蛋白检测
bridge_subgraph_03498.graphml,哪种检查能同时诊断腹主动脉瘤和合并室壁瘤，并且还能发现子宫肌瘤和胆石症？,超声诊断
bridge_subgraph_03496.graphml,哪种检查能有效诊断腹壁型、化脓性肛瘘以及泌尿系统和输尿管结石？,超声诊断
bridge_subgraph_03500.graphml,哪种检查能同时有效诊断输尿管腹段结石、恶性病变、甲状腺结节和桥本甲状腺炎？,超声诊断
bridge_subgraph_03507.graphml,哪种检查能同时有效诊断冠心病、坐骨直肠窝脓肿、类风湿性关节炎和代谢综合征？,超声诊断
bridge_subgraph_03505.graphml,哪种检查能有效诊断宫腔粘连、白线疝以及同时出现的慢性病和静脉曲张？,超声诊断
bridge_subgraph_03506.graphml,哪种检查既能评估肝胆损害和输精管道梗阻，又能同时检测急性心肌梗死和乳腺癌？,超声诊断
bridge_subgraph_03497.graphml,哪种疾病既具有非酒精性脂肪性肝炎的高危因素，又可能导致冠状动脉疾病并发症，同时需要与前列腺癌进行鉴别诊断，并与糖尿病肾病相关（转化）？,2型糖尿病
bridge_subgraph_03514.graphml,哪种检查能同时用于诊断心脏病、阴囊病、肿瘤和腹痛？,超声诊断
bridge_subgraph_03508.graphml,哪种检查能更准确地评估HOMA-IR和HOMA在糖尿病，尤其是2型糖尿病中的情况？,稳态胰岛素评价指数
bridge_subgraph_03504.graphml,哪种检查能同时用于检测细胞凋亡、肝细胞肝癌、脑胶质瘤和肺癌？,DNA含量分析
bridge_subgraph_03503.graphml,哪种检查最适合用于鉴别假体周围感染、CHD合并IE以及同时出现的先心病和不典型感染性心内膜炎？,血培养检查
bridge_subgraph_03519.graphml,哪种检查能同时用于诊断甲亢性肝病、梅毒、慢性乙型肝炎和恶性肿瘤？,血清检验
bridge_subgraph_03517.graphml,哪种检查能有效区分肺部结节、肺部周围性病变、气胸及炎性假瘤？,皮肺穿刺活检
bridge_subgraph_03510.graphml,哪种检查能同时有效诊断少支胶质瘤（AC）和食管癌？,EnVision免疫组化法
bridge_subgraph_03513.graphml,哪种医学内容在探讨肾挫裂伤和腹部器官闭合损伤时，通常会同时涉及乳腺癌及其亚型IDC？,超声诊断
bridge_subgraph_03512.graphml,哪种检查最适合同时诊断小儿急性肠套叠、胃肠道间质瘤以及肝肿瘤（包括HCC）？,超声诊断
bridge_subgraph_03521.graphml,哪种检查最适合用于同时诊断无症状性心肌缺血、ALHF、老年冠心病和心尖肥厚型心肌病？,常规心电图检查
bridge_subgraph_03522.graphml,哪种检查既能有效诊断膝关节交叉韧带损伤和DVT，又能同时筛查乳腺癌和限制型心肌病？,超声诊断
bridge_subgraph_03523.graphml,哪种检查能同时诊断1小时前列腺增生（内径小）和输尿管结石？,软性膀胱镜
bridge_subgraph_03515.graphml,哪种检查能同时有效诊断肺良性病变、胸部神经鞘瘤以及乳腺癌和神经鞘瘤？,线路SPECT显像
bridge_subgraph_03509.graphml,哪种医学内容与腺瘤样瘤和PMP直接相关，并且常与子宫内膜间质肉瘤和嗜铬细胞瘤同时出现？,免疫组织化学观察
bridge_subgraph_03511.graphml,哪种检查可以同时用于诊断急性心肌梗死和肠系膜淋巴结炎，并且在患者伴有胸腔积液和老年冠心病的情况下也适用？,超声诊断
bridge_subgraph_03518.graphml,哪种检查能同时诊断结核性盆腔炎、肾错构瘤以及伴随的高血压和糖尿病？,超声诊断
bridge_subgraph_03520.graphml,哪种疾病在超声诊断中常与原发性肝癌同时出现，并且可能与肠癌和IgE水平升高相关？,2型糖尿病
bridge_subgraph_03526.graphml,哪种社会学理论能更好地解释动态动脉硬化指数与超声诊断在心血管疾病和糖尿病研究中的应用？,高血压
bridge_subgraph_03527.graphml,哪种检查最适合用于同时伴有RHVD伴房颤、环状混合痔手术、结核性胸膜炎和糖尿病的患者？,摸球法
bridge_subgraph_03524.graphml,哪种检查能同时有效诊断先天性斜颈、先天性静脉畸形以及中央型肺癌和肿瘤？,超声诊断
bridge_subgraph_03531.graphml,哪种检查能同时有效诊断急性跟腱撕裂和EH，以及进展期胃癌和结肠癌？,超声诊断
bridge_subgraph_03533.graphml,哪种检查可以同时诊断宫腔内异常、半月板损伤，以及子宫腺肌病和先天性心脏病？,超声诊断
bridge_subgraph_03528.graphml,哪种检查能同时发现继发孔房间隔缺损、冠状动脉硬化斑块，以及CABG和主动脉夹层的情况？,胸超声检查
bridge_subgraph_03538.graphml,哪种检查能同时有效诊断原发性高血压（）、AMA（）以及肝病（）、EH（）？,抗心肌抗体
bridge_subgraph_03532.graphml,哪种检查能有效诊断脐下周围粘连、妊娠子宫破裂，并同时对甲状腺癌和脑梗死进行评估？,超声诊断
bridge_subgraph_03529.graphml,哪种检查能够同时有效诊断双动脉干下型VSD、囊性肾癌以及淋巴瘤和肿瘤？,超声诊断
bridge_subgraph_03534.graphml,哪种检查能同时准确诊断未破裂型异位妊娠、肺发育不良，以及肿瘤和精神分裂症？,超声诊断
bridge_subgraph_03536.graphml,哪种检查能最有效地鉴别腺体型乳房乳腺癌和不典型乳腺癌，并同时评估乳腺肿块和乳腺肿瘤的情况？,乳腺钼靶摄影
bridge_subgraph_03537.graphml,哪种检查能有效同时诊断视网膜疾病、甲状腺结节性腺肿、肺动脉高压和先心病？,超声诊断
bridge_subgraph_03535.graphml,哪种检查能同时准确诊断晶状体后脱位、局灶性脂肪肝以及乳腺肿块和乳腺疾病？,超声诊断
bridge_subgraph_03546.graphml,哪种医学内容在探讨冠状动脉狭窄和冠状静脉异常回流时，通常会与CHD和MSCT同时出现？,冠状动脉CT
bridge_subgraph_03545.graphml,哪种检查能同时有效诊断多灶性甲状腺癌、脑胶质瘤、乳腺癌和2型糖尿病？,超声诊断
bridge_subgraph_03530.graphml,哪种检查既能用于诊断滴虫性阴道炎和WBC异常，又能辅助诊断急性心肌梗死和川崎病？,白细胞介素-10(IL-10)
bridge_subgraph_03540.graphml,哪种检查能同时有效诊断乙肝、TR5类结节、乳腺癌和子宫肌瘤？,RTE检查
bridge_subgraph_03541.graphml,哪种检查能同时用于诊断胎儿18-三体综合征、女性盆腔囊性肿块、原发性肝癌和食管癌？,超声诊断
bridge_subgraph_03525.graphml,哪种检查可以同时用于诊断鼻腔鼻窦淋巴上皮癌、垂体瘤以及子宫内膜癌和GBA相关疾病？,CT和MRI
bridge_subgraph_03548.graphml,哪种检查能够同时检测纤维素血栓、异位性皮炎、原发性肝癌和膀胱肿瘤？,活体组织检查
bridge_subgraph_03553.graphml,哪种检查可以同时诊断妇产科阴道流血、胎儿肠管扩张以及缺血性脑卒中和脑卒中？,超声诊断
bridge_subgraph_03516.graphml,哪种检查在急性心力衰竭、soluble ST2（sST2）以及同时出现的2型糖尿病和冠心病中最为关键？,血清可溶性ST2
bridge_subgraph_03551.graphml,哪种检查能同时有效诊断颈椎失稳症、胸腹部肿瘤、食管癌和腰椎间盘突出症？,CT测量
bridge_subgraph_03550.graphml,哪种医学内容在涉及消化道出血的同时，也常与甲状腺疾患、甲状腺癌和甲状腺结节相关？,甲状腺显像
bridge_subgraph_03539.graphml,哪种检查能同时准确诊断双胎输血综合症、完全性大动脉转位，以及慢性乙型肝炎和糖尿病？,超声诊断
bridge_subgraph_03549.graphml,哪种检查能有效诊断包块型子宫角妊娠（发病率高达94.7%）并同步鉴别甲状腺结节及其良恶性？,超声诊断
bridge_subgraph_03544.graphml,哪种检查能有效诊断尿道狭窄、老年冠心病颈动脉硬化，并且也适用于药物流产和输卵管妊娠的影像学评估？,超声诊断
bridge_subgraph_03556.graphml,哪种检查能同时准确诊断主动脉弓异常、肺癌、胃癌和甲状腺癌？,超声诊断
bridge_subgraph_03554.graphml,哪种检查能同时有效诊断下肢静脉血栓、老年代偿期肝硬化、胃癌和前列腺癌？,超声诊断
bridge_subgraph_03547.graphml,哪种检查能同时诊断肾输尿管畸形、周围动脉硬化症、结肠息肉和脑梗死？,超声诊断
bridge_subgraph_03557.graphml,哪种检查能够同时准确诊断产后子宫胎盘植入、日本血吸虫病，以及伴随的高血压和PCOS？,超声诊断
bridge_subgraph_03552.graphml,哪种检查可以同时用于诊断产后出血、血吸虫肝病，以及卵巢卵黄囊瘤和乳腺癌？,超声诊断
bridge_subgraph_03543.graphml,哪种检查能有效鉴别ACS与AS（）、T2DMCI（），并兼顾CHD（）、精神分裂症（）的评估？,HCY水平
bridge_subgraph_03560.graphml,哪种检查能有效诊断女性生殖器结核和闭锁，并同时排查恶性肿瘤和肺癌？,超声诊断
bridge_subgraph_03559.graphml,哪种检查能同时有效诊断甲状腺弥漫性病变、坏死性肠套叠、白内障和T2DM？,超声诊断
bridge_subgraph_03542.graphml,哪种检查能准确区分胰腺囊性病变和胰头占位，同时识别胰腺占位病变和浆液性囊腺瘤？,EUS-FNA
bridge_subgraph_03561.graphml,哪种检查能有效诊断穿孔性食管异物、食管裂孔疝以及贲门癌和食管癌？,X线钡餐造影检查
bridge_subgraph_03555.graphml,哪种检查可以同时用于高血压、腹壁切口内膜异位症、糖尿病和肾脏疾病的影像学诊断？,超声诊断
bridge_subgraph_03569.graphml,哪种检查能够同时诊断上肢深静脉血栓、先天性肺囊腺瘤、恶性肿瘤和先天性心脏病？,超声诊断
bridge_subgraph_03558.graphml,哪种医学内容与EBC和急性肺损伤直接相关，且常与颈动脉粥样硬化和急性心肌梗死同时出现？,超声诊断
bridge_subgraph_03563.graphml,哪种检查能同时准确诊断缺血性脑卒中、颈内动脉粥样硬化斑块、心律失常和冠心病？,超声诊断
bridge_subgraph_03562.graphml,哪种检查能同时用于诊断慢性肝炎、重型β地中海贫血以及肿瘤和淋巴瘤？,肝脏穿刺活检
bridge_subgraph_03568.graphml,哪种检查能同时有效鉴别良、恶性淋巴结和急腹诊，且适用于肝硬化及脂肪肝的诊断？,超声诊断
bridge_subgraph_03567.graphml,哪种检查能同时有效诊断黄体囊肿破裂、冠心病、急性心肌梗死和膝关节问题？,超声诊断
bridge_subgraph_03566.graphml,哪种疾病在钼靶X射线检查中需与乳腺炎鉴别诊断，且常表现为乳腺肿块，病理分型可能是乳腺叶状肿瘤？,乳腺癌
bridge_subgraph_03573.graphml,哪种检查既能有效诊断冠状动脉病变和成人下肺叶结核，又能及时发现急腹症和冠心病？,放射线检查
bridge_subgraph_03564.graphml,哪种疾病在超声诊断中常表现为腹主动脉瘤破裂，且可能伴随NCV异常和脑梗死的发生？,糖尿病
bridge_subgraph_03577.graphml,哪种检查能同时诊断Galen静脉血管瘤、外伤性白内障以及糖尿病（T2DM）？,超声诊断
bridge_subgraph_03572.graphml,哪种检查在诊断冠心病及老年冠心病时，通常会同时涉及CMD和PTCA？,心磁图
bridge_subgraph_03575.graphml,哪种检查能有效同时诊断脾梗死、计划生育手术并发症以及排查肝癌和乳腺癌的风险？,超声诊断
bridge_subgraph_03570.graphml,哪种检查能有效诊断动脉粥样硬化性心脏病（冠心病），并在心绞痛发作时同步进行EET评估？,心电图运动试验
bridge_subgraph_03574.graphml,哪种检查能够同时辅助诊断甲状腺上皮样平滑肌肉瘤、缺血性心脏病，以及出现的阴道流血和脂肪肝？,身体检查
bridge_subgraph_03578.graphml,哪种检查在NACT过程中能够有效评估胃癌和肝病引起的腹部脏器损伤？,超声诊断
bridge_subgraph_03580.graphml,哪种检查能同时确认无穿刺禁忌证、神经功能缺损，以及泌尿系结石和脑梗死的情况？,出凝血时间
bridge_subgraph_03576.graphml,哪种检查在诊断心脏占位性病变和主动脉夹层时，2DE和RT3D-TEE哪个更有效？,二维经胸超声心动图
bridge_subgraph_03571.graphml,哪种检查可以同时用于诊断先天性胆管囊肿和儿童甲状腺疾病，并且也能检测脑梗死和高血压病？,超声诊断
bridge_subgraph_03588.graphml,哪种检查能同时发现动脉瘤、原发性高血压、脂肪肝和血栓？,彩色超声仪
bridge_subgraph_03587.graphml,哪种检查能够同时诊断体蒂异常、完全性大动脉转位以及肝纤维化和腺瘤？,超声诊断
bridge_subgraph_03579.graphml,哪种检查能同时有效诊断盆底功能障碍性疾病和孕中期前置胎盘，并评估压力性尿失禁和流产的风险？,会阴超声检查
bridge_subgraph_03585.graphml,哪种检查能有效鉴别隐性腕背腱鞘囊肿、胸廓出口综合征，以及同时出现的乳腺癌和乳腺肿块？,超声诊断
bridge_subgraph_03589.graphml,哪种检查能有效评估放射线损伤、骨肉瘤、子宫内膜息肉及乳腺癌？,MVD检测
bridge_subgraph_03565.graphml,哪种检查能同时有效诊断乳腺导管疾病、克罗恩病、结核性胸膜炎和下肢深静脉血栓？,超声诊断
bridge_subgraph_03581.graphml,哪种检查可以同时用于诊断颅内出血、贲门癌以及艾滋病（获得性免疫缺陷综合征）？,超声诊断
bridge_subgraph_03591.graphml,哪种检查能同时有效诊断脑微出血、鞍旁海绵状血管瘤、乳腺癌和脑胶质瘤？,多模态磁共振成像技术
bridge_subgraph_03583.graphml,哪种检查能有效鉴别亚急性期基底节区脑出血和缺血性脑血管病，同时也能发现肺癌和缺血性脑卒中？,CT灌注
bridge_subgraph_03590.graphml,哪种疾病在超声诊断中常与阑尾炎混淆，且可能同时伴随急性心肌梗死和2型糖尿病的出现？,糖尿病
bridge_subgraph_03584.graphml,哪种检查能同时用于诊断宫颈癌、子宫肌瘤以及输卵管妊娠，并且与子宫动脉造影相关？,导管超
bridge_subgraph_03593.graphml,哪种检查能有效诊断脾脏肿块和脱垂，同时适用于2型糖尿病和糖尿病患者？,超声诊断
bridge_subgraph_03582.graphml,哪种检查能有效鉴别甲状良恶性结节、瓦氏窦瘤破裂以及早期和晚期乳腺癌？,超声诊断
bridge_subgraph_03592.graphml,哪种检查能有效诊断胆道蛔虫和PCOS，同时也能发现肿瘤和乳腺导管内癌？,超声诊断
bridge_subgraph_03594.graphml,哪种检查能同时用于诊断MM和呼吸道感染，并且也可能在HIE和川崎病的诊断中出现？,CRP水平检测
bridge_subgraph_03598.graphml,哪种检查能够同时诊断肺动脉吊带、胎儿肾囊性疾病以及结节性甲状腺肿和甲状腺结节？,超声诊断
bridge_subgraph_03597.graphml,哪种医学内容在探讨胎儿颅后窝异常和胎儿先天性心脏病的同时，也会涉及乳腺癌和甲状腺乳头状癌的研究？,超声诊断
bridge_subgraph_03600.graphml,哪种检查能同时有效诊断新生儿肝炎、胎儿四肢骨骼系统发育畸形，以及肾损伤和妊娠高血压综合征？,超声诊断
bridge_subgraph_03599.graphml,哪种检查更适合评估NAFLD合并T2DM患者的肝纤维化情况，FIB-4还是慢性乙型肝炎的相关检查？,FIB-4指数
bridge_subgraph_03603.graphml,哪种检查能有效鉴别原发性小肠恶性肿瘤、宫颈癌、淋巴瘤及妇科肿瘤？,18F-FDGPET/CT显像
bridge_subgraph_03586.graphml,哪种检查能同时用于诊断DVPI和UmAPI，并且适用于先天性心脏病和双胎输血综合征的情况？,脐动脉搏动指数
bridge_subgraph_03596.graphml,哪种检查最适合同时评估轻度炎症、小儿颅脑疾病以及胃癌和结肠癌？,超声诊断
bridge_subgraph_03601.graphml,哪种医学内容更常与乳腺良恶性肿瘤和MFI相关联，同时也会涉及乳腺肿块和前列腺癌？,超声造影微血管成像
bridge_subgraph_03608.graphml,哪种检查可以同时诊断双肾结石、胎儿颈周脐带五型以及伴随的酒精性肝硬化和高血压？,超声诊断
bridge_subgraph_03604.graphml,哪种检查能同时准确诊断无脑儿、宫腔积血、脑梗死和2型糖尿病？,超声诊断
bridge_subgraph_03595.graphml,哪种检查能同时有效诊断实质性脏器破裂、妇产科急腹症疾病，以及乙型肝炎肝硬化和食管癌？,超声诊断
bridge_subgraph_03606.graphml,哪种检查能够同时准确识别宫内假孕囊、TFCC损伤、恶性肿瘤和深静脉血栓？,超声诊断
bridge_subgraph_03602.graphml,哪种检查最适合评估同时患有冠状动脉慢性完全闭塞病变、冠心病、代谢综合征和2型糖尿病的患者？,冠状动脉CT造影
bridge_subgraph_03607.graphml,哪种检查最适合用于诊断老年急性阑尾炎、剖宫产后再次妊娠，以及同时存在的2型糖尿病和高血压？,超声诊断
bridge_subgraph_03605.graphml,哪种检查能有效区分恶性卵巢肿瘤、恶性畸胎瘤、CSP和异位妊娠？,彩色多普勒阴道超声
bridge_subgraph_03613.graphml,哪种检查最适合同时诊断输尿管狭窄、膀胱破裂和肾盂癌？,逆行造影
bridge_subgraph_03614.graphml,哪种nan在超声诊断中与原发性肝癌的关联性最强？,HCC
bridge_subgraph_03617.graphml,哪种检查能同时准确诊断隐睾症、脾实质脏器破裂，以及鉴别肝癌和脑梗死？,超声诊断
bridge_subgraph_03615.graphml,哪种检查既能有效评估颈动脉及下肢动脉硬化，又能同时检测妊娠中期出生缺陷、血栓和Child-Pugh评分？,超声诊断
bridge_subgraph_03610.graphml,哪种检查能够有效诊断小儿急性肠套叠、早期酒精性肝病以及同时出现的肺癌和腺癌？,超声诊断
bridge_subgraph_03611.graphml,哪种社会学理论能解释B型糖尿病与尿毒症、腰椎间盘突出症之间的关联？,高血压
bridge_subgraph_03609.graphml,哪种医学内容与瘘管、早孕胎膜后出血直接相关，且常与乳腺导管内乳头状瘤和FNAC同时出现？,超声诊断
bridge_subgraph_03623.graphml,哪种检查能同时有效诊断尿路结石和甲状腺乳头状癌及相关的甲状腺肿瘤或甲状腺癌？,超声诊断
bridge_subgraph_03612.graphml,哪种检查能同时有效诊断儿童流行性腮腺炎和良性病变，且能发现肺动脉高压和冠心病？,超声诊断
bridge_subgraph_03622.graphml,哪种医学内容涉及Caspase-3和系统性白念珠菌感染，并且常与艾滋病和脑梗死同时出现？,蛋白酶
bridge_subgraph_03620.graphml,哪种检查既能有效诊断肿瘤和胎儿外生殖器畸形，又能同时筛查恶性肿瘤和肺癌？,超声诊断
bridge_subgraph_03619.graphml,哪种检查能够同时评估ACS、载脂蛋白E以及高血压病和2型糖尿病的风险？,apoB
bridge_subgraph_03616.graphml,哪种检查能同时发现无肌层浸润的子宫肌瘤、非妊娠期子宫肌瘤，以及大肠癌和前列腺癌？,超声诊断
bridge_subgraph_03618.graphml,哪种检查能有效诊断精索静脉曲张和腹壁内异症，并同步评估T2DM和NAFLD的情况？,超声诊断
bridge_subgraph_03621.graphml,哪种检查能有效区分非典型阑尾炎、阔韧带子宫肌瘤，并同时适用于类风湿性关节炎和急性阑尾炎的诊断？,超声诊断
bridge_subgraph_03626.graphml,哪种检查可以同时用于PPH和卵巢卵黄囊瘤，并且也适用于肾癌和大肠癌的筛查？,超声诊断
bridge_subgraph_03625.graphml,哪种检查既能有效避免假阴性甲状腺癌的漏诊，又能准确识别早孕，同时还能区分甲状腺结节和良性结节？,超声诊断
bridge_subgraph_03634.graphml,哪种疾病在检测血清癌胚抗原和超声诊断时，常与胃癌和结核性胸腔积液同时出现？,肺癌
bridge_subgraph_03628.graphml,哪种检查能同时用于诊断肾绞痛、新生儿胼胝体发育不全、甲状腺结节和桥本甲状腺炎？,超声诊断
bridge_subgraph_03624.graphml,哪种检查可以同时检测膝关节腔及周围滑膜囊积液、桡神经病变，以及子宫肌瘤和胎盘植入？,超声诊断
bridge_subgraph_03627.graphml,哪种检查能同时有效诊断法洛四联症、复杂先心病伴冠状动脉畸形，以及先心病和糖尿病？,DSCT血管成像
bridge_subgraph_03629.graphml,哪种检查能同时有效诊断早期肾癌、TRAP序列征、2型糖尿病和脑梗死？,超声诊断
bridge_subgraph_03630.graphml,哪种检查最适合同时诊断早期异位妊娠、乳腺慢性炎症、先兆流产和不孕症？,超声诊断
bridge_subgraph_03632.graphml,哪种检查能同时用于NACT乳腺癌、非典型阑尾炎以及脑卒中和精神分裂症的诊断？,超声诊断
bridge_subgraph_03635.graphml,哪种检查能够同时发现表浅软组织肿块和宫外孕破裂损伤，并有助于诊断胎儿泌尿系统畸形和出生缺陷？,超声诊断
bridge_subgraph_03631.graphml,哪种检查能准确评估冠脉狭窄病变和冠脉病变，尤其是在诊断冠心病（CHD）时？,多层螺旋CT冠脉成像
bridge_subgraph_03639.graphml,哪种检查能有效同时诊断脾血管瘤、单脐动脉合并、大肠癌和甲状腺癌？,超声诊断
bridge_subgraph_03636.graphml,哪种检查能同时诊断肝炎后肝硬化、主动脉-左室隧道以及男性不育症和隐睾？,超声诊断
bridge_subgraph_03633.graphml,哪种疾病在实验室检查中表现为超敏C反应蛋白（hs-CRP）升高，影像学检查通过超声诊断发现，且常与冠心病心绞痛和2型糖尿病同时出现？,冠心病
bridge_subgraph_03638.graphml,哪种检查能同时诊断腘动静脉瘘、感染性眼内炎，并评估高血压和RA的情况？,超声诊断
bridge_subgraph_03637.graphml,哪种医学内容与分化型甲状腺癌和输卵管积液直接相关，且常与胃癌和肝癌同时出现？,超声诊断
bridge_subgraph_03641.graphml,哪种检查能同时准确诊断肝炎后肝硬化、上消化道穿孔以及泌尿系结石和肾积水？,超声诊断
bridge_subgraph_03645.graphml,哪种检查最适合同时评估左乳腺癌、PTCA、冠心病和高血压病的情况？,QTVI技术
bridge_subgraph_03640.graphml,哪种疾病在颈动脉彩色多普勒超声检测中常发现颈动脉粥样斑块，且患者往往伴有原发性高血压？,糖尿病
bridge_subgraph_03646.graphml,哪种检查可以同时用于早期发现异常妊娠、先天性阴道斜隔综合症、2型糖尿病和贲门癌？,超声诊断
bridge_subgraph_03643.graphml,哪种检查可以同时用于诊断不育症和CRF，并且也适用于精神分裂症和2型糖尿病？,血浆IL-6
bridge_subgraph_03647.graphml,哪种医学内容在探讨复杂先天性心脏畸形疾病和胎儿四肢骨骼系统畸形时，常与心血管疾病及卵巢癌一同被提及？,超声诊断
bridge_subgraph_03644.graphml,哪种检查能同时用于评估VWF与早发型子痫前期，以及2型糖尿病（T2DM）的风险？,血清血管性血友病因子
bridge_subgraph_03649.graphml,哪种疾病在超声诊断中常表现为急性呼吸窘迫综合征，且与冠心病和短暂性脑缺血密切相关？,糖尿病
bridge_subgraph_03648.graphml,哪种检查能同时有效诊断甲状腺占位病变、下颌下区包块以及脑卒中和2型糖尿病？,超声诊断
bridge_subgraph_03654.graphml,哪种检查能同时有效诊断脊椎转移瘤、头颈部肿瘤以及前列腺癌？,千伏级锥形束CT
bridge_subgraph_03650.graphml,哪种检查能同时有效诊断小细胞肺癌、胃肠间质瘤以及伴随的肿瘤和胃溃疡？,免疫组织化学结果
bridge_subgraph_03642.graphml,哪种疾病既有左心室肥厚和腹股沟疝的并发症，又与冠心病的高风险评估相关，且需要检查LDL-C水平？,糖尿病
bridge_subgraph_03655.graphml,哪种检查能同时确诊幽门螺杆菌相关性胃病、胃部不适以及十二指肠溃疡和胃溃疡？,胃蛋白酶原
bridge_subgraph_03657.graphml,哪种检查能同时筛查梅毒、评估CDFI，并检测胎儿畸形和单脐动脉？,产前彩超
bridge_subgraph_03660.graphml,哪种检查能够同时发现隐匿性骨折和浅表淋巴结转移癌，并且也能检测出心绞痛和食管癌？,超声诊断
bridge_subgraph_03663.graphml,哪种检查能同时有效诊断特殊部位妊娠、子宫肌腺病、肾脏损伤和肝纤维化？,超声诊断
bridge_subgraph_03661.graphml,哪种检查能同时评估LDL-C水平、ACS高危因素以及2型糖尿病和CHD的风险？,LDL-C/HDL-C
bridge_subgraph_03652.graphml,哪种疾病在测定血脂水平时常见，且与急性肺栓塞、DM及血脂异常同时出现？,冠心病
bridge_subgraph_03659.graphml,哪种检查能同时准确诊断出血性生理性卵巢囊肿和绞窄性梗阻，并且适用于早期异位妊娠及异位妊娠的鉴别？,腹部彩色超声检查
bridge_subgraph_03653.graphml,哪种医学内容更值得关注：小腿三头肌损伤还是中甲状腺癌，同时考虑到肝门部胆管癌和ER的相关性？,超声诊断
bridge_subgraph_03670.graphml,哪种检查能同时有效诊断肝脏淋巴瘤、中央型肺癌和原发性肝癌？,MSCT动态增强扫描
bridge_subgraph_03656.graphml,哪种检查最适合同时评估晚孕期妊娠胎盘植入、糖尿病、肥胖型高血压和2型糖尿病的情况？,超声诊断
