file,query,answer
bridge_subgraph_28283.graphml,哪种疾病在采用研磨复位技术或打开关节囊后骨折复位治疗的同时，还需要配合优质护理干预和常规护理模式来提高疗效？,胫骨平台骨折
bridge_subgraph_28287.graphml,哪种疾病需要通过切开复位关节面整复、植骨治疗，并常常伴随内固定或钢板内固定的辅助治疗？,胫骨平台骨折
bridge_subgraph_28268.graphml,哪种检查最适合同时诊断胫骨平台骨折和肾上腺血肿，并能清晰显示粉碎性骨折的病理分型？,CT
bridge_subgraph_28288.graphml,哪种疾病在男性患者中，常通过单侧钢板内固定治疗或切开复位联合钢板固定治疗，且需要进行影像学检查来确诊？,胫骨平台骨折
bridge_subgraph_28291.graphml,哪种疾病在进行开腹手术治疗血吸虫性肝硬化的同时，还需要结合常规护理和优质护理作为辅助治疗？,胆囊结石手术
bridge_subgraph_28294.graphml,哪种疾病在Ⅰ型未分化胃腺癌患者中，伴随阳性淋巴结数和SSD的出现？,Borrmann分型
bridge_subgraph_28278.graphml,哪种疾病需要通过头颅CT检查并最终采用枕大池切开引流或外科手术治疗？,高血压小脑出血
bridge_subgraph_28292.graphml,哪种疾病会导致膝关节外翻畸形，且通常需要通过CT影像学检查和经皮微创钢板内固定术来进行治疗？,胫骨平台骨折
bridge_subgraph_28295.graphml,哪种疾病在采用锁定钢板内固定术治疗及术后护理的同时，还需要进行X线影像学检查和综合护理干预？,胫骨平台骨折
bridge_subgraph_28293.graphml,哪种疾病在进行放射性粒子植入和术前组织病理学检查的同时，还需要配合心理护理和护理干预？,颌面部恶性肿瘤
bridge_subgraph_28297.graphml,哪种疾病在病理分型为Luminal型乳腺癌且接受辅助放疗的情况下，预后较好，并且可以通过磁共振成像进行有效检查？,乳腺癌
bridge_subgraph_28302.graphml,哪种疾病会导致肩胛骨出现非软骨类肿瘤，并且可能同时影响膝关节，需要通过MRI进行检查？,软骨类肿瘤
bridge_subgraph_28298.graphml,哪种疾病需要进行植骨及内固定或胫骨平台骨折手术，并伴随手术切口和CT检查？,胫骨平台骨折
bridge_subgraph_28284.graphml,哪种疾病在治疗过程中既需要服用钙尔奇D和唑来膦酸，又需要接受日光照射和综合护理干预？,中老年骨质疏松
bridge_subgraph_28299.graphml,哪种疾病在X线检查中表现为肝源性病理分型，并伴有假膈影的临床表现？,肺底积液
bridge_subgraph_28303.graphml,哪种疾病在骨科就诊时，可能因创伤性关节炎导致需要接受全膝关节置换手术，并在术后通过康复护理干预进行辅助治疗？,胫骨平台骨折
bridge_subgraph_28285.graphml,哪种疾病需要通过内侧倒“L”形切口手术治疗，并辅以锁定钢板内固定术，同时需进行MRI检查来确诊？,胫骨平台骨折
bridge_subgraph_28290.graphml,哪种疾病在采用锁定钢板固定手术治疗和康复护理辅助治疗的同时，常需通过螺旋CT进行影像学检查，且多与交通伤相关？,胫骨平台骨折
bridge_subgraph_28300.graphml,哪种疾病在Ⅲ型病理分型下需要特定的康复指导，且常与Ⅱ型病理分型并存，并通过X线检查进行影像学诊断？,胫骨平台骨折
bridge_subgraph_28306.graphml,哪种疾病在治疗过程中特别需要预见性护理和家庭支持，并且通常伴随心理护理和舒适护理？,宫外孕手术
bridge_subgraph_28301.graphml,哪种疾病在社区护理管理和院外延续护理中需要特别注意感染并发症，并且患者的婚姻状况是重要的风险评估因素？,永久性膀胱造瘘
bridge_subgraph_28307.graphml,哪种疾病在采用微创内固定辅助治疗后，容易出现关节功能障碍，并且通常需要通过CT和MRI进行影像学检查？,胫骨平台骨折
bridge_subgraph_28311.graphml,哪种疾病需要进行全膝关节置换和灌洗关节腔，并常伴随使用抗生素和激光治疗？,胫骨平台骨折
bridge_subgraph_28305.graphml,哪种疾病在治疗过程中需要诱导骨基质植入和64排螺旋CT扫描，并且通常伴随健康宣教和抗生素的使用？,胫骨平台骨折
bridge_subgraph_28309.graphml,哪种疾病在头面部出现毁损伤的病理分型时，常需要进行CT扫描或CT检查？,撕裂伤
bridge_subgraph_28312.graphml,哪种医学内容在脑血管狭窄和脑梗死溶栓的治疗中，与较差的预后和患者年龄有更密切的关系？,TICI
bridge_subgraph_28314.graphml,哪种疾病在治疗时需要同时使用华法林和尿激酶注射液，且在手术高危因素下常通过螺旋CT进行影像学检查？,老年肺栓塞
bridge_subgraph_28313.graphml,哪种疾病在采用普通解剖钢板治疗的同时，还需进行Ⅳ型病理分型的功能锻炼，并通过X线平片进行检查？,胫骨平台骨折
bridge_subgraph_28317.graphml,哪种疾病需要通过间接复位技术、关节镜处理以及外科治疗等多种手术治疗方式来综合治疗？,胫骨平台骨折
bridge_subgraph_28296.graphml,哪种疾病在坠落导致后常表现为疼痛，并需要通过交锁髓内钉治疗和模块化康复训练来辅助康复？,胫骨平台骨折
bridge_subgraph_28310.graphml,哪种疾病在治疗过程中容易出现钢板外露的并发症，且常需通过关节镜辅助手术和自体髂骨植骨或植骨来进行治疗？,胫骨平台骨折
bridge_subgraph_28304.graphml,哪种疾病在体质指数高的人群中易发，且需在骨科进行胫骨高位截骨术或膝关节置换术治疗？,内翻型膝关节骨关节炎
bridge_subgraph_28308.graphml,哪种疾病在受伤至手术时间较长的情况下，通过MRI成像技术更易确诊，且需要特别强调护理干预与常规护理相结合的辅助治疗？,胫骨平台骨折
bridge_subgraph_28315.graphml,哪种疾病在进行微创手术治疗时，需要结合正确的功能锻炼和三维数字化模型的影像学检查？,胫骨平台骨折
bridge_subgraph_28325.graphml,哪种疾病在进行双柱支撑固定植骨手术治疗和手术复位后，患者容易出现抑郁症状，并且这种关联性可以通过卡方检验得到验证？,胫骨平台骨折
bridge_subgraph_28326.graphml,哪种疾病在增强扫描和螺旋CT检查中常见，且容易并发肠套叠，通常需要手术治疗？,胃肠道脂肪瘤
bridge_subgraph_28321.graphml,哪种疾病在术后需要负压引流和优质护理模式，并且常通过MRI和CT进行影像学检查？,胫骨平台骨折
bridge_subgraph_28318.graphml,哪种疾病在治疗过程中常需结合艾灸和温针灸作为辅助治疗，并且需要通过X线片或X线进行影像学检查？,膝骨关节病
bridge_subgraph_28320.graphml,哪种疾病在治疗过程中既需要运用中医特色护理辅助治疗，又容易并发脑梗死和感染，且其病理分型中包含骨折？,外科疾病
bridge_subgraph_28327.graphml,哪种疾病在进行关节镜镜检和连续护理模式治疗的同时，婚姻状况和体能训练也是重要的考虑因素？,胫骨平台骨折
bridge_subgraph_28316.graphml,哪种疾病在x线影像学检查中常见Ⅴ型5例和Ⅵ型病理分型，且多发于特定年龄段，需要常规护理作为辅助治疗？,胫骨平台骨折
bridge_subgraph_28334.graphml,哪种疾病在术前通过CT检查和MRI影像学检查后，预后状况极差？,颅内黑色素瘤
bridge_subgraph_28323.graphml,哪种疾病在进行软组织保护与修复的辅助治疗以及关节镜下微创手术治疗时，常需结合CT和X线平片进行影像学检查？,胫骨平台骨折
bridge_subgraph_28324.graphml,哪种疾病在CT图像上显示特征性表现，且常伴有交通伤并发症，需要接受MIPO治疗和手术修复？,胫骨平台骨折
bridge_subgraph_28337.graphml,哪种疾病在进行常规康复锻炼和阶段性膝关节功能康复治疗的同时，常伴随疼痛和需要内固定作为辅助治疗？,胫骨平台骨折
bridge_subgraph_28319.graphml,哪种疾病在家庭护理干预中能有效预防，并且在循证护理、康复指导和常规护理的辅助治疗下效果更佳？,宫颈癌化疗
bridge_subgraph_28330.graphml,哪种疾病在进行功能锻炼的护理和微创内固定系统治疗时，通常需要通过CT检查来辅助诊断？,胫骨平台骨折
bridge_subgraph_28335.graphml,哪种疾病在治疗过程中需要同时采用关节内固定植骨支撑、万古霉素药物治疗，以及运动疗法和心理护理等辅助治疗措施？,胫骨平台骨折
bridge_subgraph_28332.graphml,哪种疾病在传统的切开复位手术后，因解剖复位不良成为高危因素，且治疗中常需使用丹参注射液和抗生素？,胫骨平台骨折
bridge_subgraph_28333.graphml,哪种疾病在采用抗骨质疏松剂治疗和3D打印技术结合虚拟手术检查的同时，还需要心理护理，但预后状况较差？,胫骨平台骨折
bridge_subgraph_28336.graphml,哪种疾病在术后需要科学的功能锻炼辅助治疗，并且常通过1.5T MRI、多层螺旋CT和透射电镜进行影像学检查？,胫骨平台骨折
bridge_subgraph_28346.graphml,哪种疾病在进行颅内压监测和脑室引流辅助治疗后，通过CT检查显示预后较好？,原发性脑室出血
bridge_subgraph_28347.graphml,哪种疾病在增强扫描、MRI和CT检查中常表现为肝脏炎性肌纤维母细胞瘤的特征？,HIMT
bridge_subgraph_28345.graphml,哪种疾病在需要进行手术切开复位钢板内固定处理时，通常会同时采用3DCT和MRI等影像学检查来辅助诊断？,胫骨平台骨折
bridge_subgraph_28344.graphml,哪种疾病在治疗过程中常采用小夹板固定和皮牵甩肩法，并且需要结合心理护理和手术治疗？,颈骨折
bridge_subgraph_28328.graphml,哪种疾病在治疗过程中需要采用双切口显露和关节面骨折直接复位，并且常伴随MRI和CT检查，同时可能使用阿仑膦酸钠进行治疗？,胫骨平台骨折
bridge_subgraph_28329.graphml,哪种疾病需要通过手术治疗，尤其是采用手术切开复位内固定方法或锁定加压钢板固定手术，并且通常需要借助MRI进行影像学检查？,胫骨平台骨折
bridge_subgraph_28322.graphml,哪种疾病在进行解剖钢板内固定治疗时常伴随41-B型骨折，并且通常采用切开复位钢板内固定或解剖型钢板内固定手术治疗？,胫骨平台骨折
bridge_subgraph_28331.graphml,哪种疾病会导致两肺间质性炎症（并发症），属于Ⅰ型抗GBM抗体型（病理分型），且在治疗过程中需要心理护理（辅助治疗），预后状况良好？,急进性肾小球肾炎
bridge_subgraph_28348.graphml,哪种疾病在骨折X线检查后，还需同时进行64层CT、CT检查和MRI等影像学检查？,胫骨平台骨折
bridge_subgraph_28349.graphml,哪种疾病在薄层CT扫描和X线片上常表现为后外侧骨折块，且患者通常需要去骨科就诊？,胫骨平台骨折
bridge_subgraph_28341.graphml,哪种疾病需要服用中成药来治疗病因，并且辅助以卧床休息，同时可能使用万古霉素进行药物治疗，还容易引发感染作为并发症？,药物性肝衰竭
bridge_subgraph_28339.graphml,哪种疾病在采用脱水剂药物治疗的同时，需要结合多元化康复模式的护理干预和综合护理，尤其在高龄人群中更为常见？,胫骨平台骨折
bridge_subgraph_28350.graphml,哪种疾病在进行χ2检验和射频消融治疗后，通常还会考虑非手术疗法和外科治疗？,巨大肝癌
bridge_subgraph_28343.graphml,哪种疾病在男性中较常见，主要表现为疼痛，且康复治疗中常需辅助使用万古霉素？,胫骨平台骨折
bridge_subgraph_28356.graphml,哪种疾病会导致肿瘤呈多方向、不规则生长，并伴随性功能低下，同时在CT扫描或CT检查中有所体现？,大腺瘤
bridge_subgraph_28340.graphml,哪种疾病在诊断时需要结合三维重建影像和X线、CT检查，并常采用经皮空心螺钉内固定术进行治疗？,胫骨平台骨折
bridge_subgraph_28354.graphml,哪种疾病会导致肌腹增粗和冈下肌腱损伤，并且通常需要通过MRI和关节镜来诊断？,部分撕裂
bridge_subgraph_28342.graphml,哪种疾病在平均49.7岁的人群中高发，且常伴随深静脉血栓形成，治疗时需使用活血化瘀中药并配合护理？,胫骨平台骨折
bridge_subgraph_28357.graphml,哪种疾病在出现蛛网膜下腔出血后，需要进行按摩、康复治疗以及饮食指导？,废用综合征
bridge_subgraph_28338.graphml,哪种疾病在治疗过程中需要植骨和有效固定辅助，同时手术治疗时采用间接复位固定，且在诊断时常用X线平片和螺旋CT进行检查？,胫骨平台骨折
bridge_subgraph_28351.graphml,哪种疾病在CT检查后常需采用切开复位内固定和植骨治疗，且易导致功能障碍和骨性关节炎？,胫骨平台骨折
bridge_subgraph_28361.graphml,哪种医学内容在磁共振血管成像和CT血管成像中，与Ⅲ型和Ⅱ型同时出现？,VADA
bridge_subgraph_28352.graphml,哪种疾病会导致胫骨关节受损，通常需要通过关节镜检查并采用手术重建的方式进行手术治疗？,胫骨平台骨折
bridge_subgraph_28364.graphml,哪种疾病在常规的健康教育和CDSMP中经常被提及，并且与感染和常规护理密切相关？,PICC置管肿瘤
bridge_subgraph_28360.graphml,哪种疾病在治疗过程中需要同时进行关节镜手术治疗、CPM功能锻炼，并使用万古霉素等抗生素药物治疗？,胫骨平台骨折
bridge_subgraph_28353.graphml,哪种疾病在高能量暴力损伤后，通过改良双钢板法治疗，并且需要借助螺旋CT或多层螺旋CT检查来确诊？,胫骨平台骨折
bridge_subgraph_28355.graphml,哪种疾病在延迟手术组和解剖接骨板内固定治疗后，容易出现抑郁和焦虑的临床表现？,胫骨平台骨折
bridge_subgraph_28366.graphml,哪种疾病需要通过外科手术治疗，并且通常结合CT扫描和MRI检查来进行诊断？,胫骨平台骨折
bridge_subgraph_28358.graphml,哪种疾病在护理服务中特别需要细节护理干预，并且与常规护理和优质护理同时配合使用？,急诊危重患者
bridge_subgraph_28365.graphml,哪种疾病在乳腺外派杰病和慢性湿疹中，更可能需要通过外科手术或手术治疗？,EMPD
bridge_subgraph_28359.graphml,哪种疾病在治疗过程中常伴随溶血性贫血并发症，需要采用中成药进行治疗，并且通常需要通过CT进行影像学检查，同时推荐采用优质护理模式辅助治疗？,成人支原体肺炎
bridge_subgraph_28363.graphml,哪种疾病在Ⅴ型病理分型下，需要通过解剖复位手术治疗，并且通常伴随MRI检查的影像学表现？,胫骨平台骨折
bridge_subgraph_28379.graphml,哪种疾病在进行CPM功能锻炼和前交叉韧带重建术后，常伴随摔伤并在X线片上有明显表现？,胫骨平台骨折
bridge_subgraph_28367.graphml,哪种疾病会导致膝关节严重骨关节炎，且在微创钢板接骨术后仍伴随疼痛，甚至需要切开复位内固定？,胫骨平台骨折
bridge_subgraph_28370.graphml,哪种疾病在髌骨骨折后采用单柱支撑固定植骨手术治疗，且常由高能量暴力引起，治疗过程中可能使用CPM？,胫骨平台骨折
bridge_subgraph_28369.graphml,哪种疾病在使用解剖型支持锁定钢板辅助治疗后效果较好，且常需通过X线和CT进行影像学检查？,胫骨平台骨折
bridge_subgraph_28377.graphml,哪种疾病在治疗过程中常需结合头针、体针、核心肌群训练以及护理干预和针灸等多种辅助疗法？,缺血性脑卒中偏瘫
bridge_subgraph_28375.graphml,哪种疾病最适合采用显微手术和微创手术治疗，并且通常在神经外科进行就诊？,外伤性脑内血肿
bridge_subgraph_28362.graphml,哪种疾病在膝关节镜辅助下微创手术治疗中，通过综合护理干预能较好地避免畸形愈合这一并发症？,胫骨平台骨折
bridge_subgraph_28368.graphml,哪种疾病需要同时采用关节镜微创手术、经皮螺钉内固定以及切开复位内固定术治疗，并伴有肿胀的临床表现？,胫骨平台骨折
bridge_subgraph_28373.graphml,哪种疾病在进行三维CT重建影像检查后，常需通过人工膝关节置换术治疗，且术后易并发感染，还需配合心理干预辅助治疗？,胫骨平台骨折
bridge_subgraph_28381.graphml,哪种疾病在动态CT扫描中表现出肺腺癌的临床特征，且常伴随螺旋CT薄层扫描和螺旋CT的影像学检查结果？,肺部孤立结节
bridge_subgraph_28383.graphml,哪种疾病在治疗过程中需要充分植骨和并发症护理，并且常常伴随磁共振成像检查和心理护理？,胫骨平台骨折
bridge_subgraph_28371.graphml,哪种疾病会导致膝关节过伸暴力，进而需要进行固定支架手术，并常伴随胫骨平台后柱骨折，通过X线检查可以确诊？,胫骨平台骨折
bridge_subgraph_28385.graphml,哪种疾病在中药辅助治疗的同时，常需进行复位内固定手术，并通过X线影像学检查来确诊过伸损伤类病理分型？,胫骨平台骨折
bridge_subgraph_28380.graphml,哪种疾病在治疗过程中需要结合早期的膝关节功能锻炼、壮筋续骨汤辅助治疗，并且同时需要进行围术期护理和外科手术？,胫骨平台骨折
bridge_subgraph_28374.graphml,哪种疾病在神经内科就诊时，常需通过计算机断层扫描进行影像学检查，并可能使用云气南白药进行药物治疗，同时辅以针灸疗法？,急性高血压脑出血
bridge_subgraph_28372.graphml,哪种疾病需要同时采用胫骨锁定多向带锁髓内钉和64排螺旋CT三维重建成像，并伴随锁定钢板内固定术和阿仑膦酸钠的治疗？,胫骨平台骨折
bridge_subgraph_28389.graphml,哪种疾病在B组病理分型中，通过CT三维和磁共振成像（MRI）检查能同时发现？,胫骨平台骨折
bridge_subgraph_28384.graphml,哪种疾病会导致神经源性膀胱和尿潴留，同时需要通过康复训练和精心护理来辅助治疗？,神经源性膀胱功能障碍
bridge_subgraph_28394.graphml,哪种疾病会导致膝关节功能锻炼较差，活动受限，且在CT检查中有所体现？,胫骨平台骨折
bridge_subgraph_28376.graphml,哪种疾病在治疗过程中需要特别注重安全转运及护理，并常采用地佐辛复合芬太尼药物治疗，同时伴随常规护理和舒适护理？,心血管重症
bridge_subgraph_28387.graphml,哪种疾病在治疗时需要使用胫骨锁定多向带锁髓内钉或双钢板固定，并且常伴随疼痛，属于创伤骨科范畴？,胫骨平台骨折
bridge_subgraph_28382.graphml,哪种疾病在治疗过程中常需采用自体髂骨植骨结合内固定治疗和解剖复位及坚强内固定，并辅以抗生素药物治疗和CT扫描进行影像学检查？,胫骨平台骨折
bridge_subgraph_28378.graphml,哪种疾病在关节面塌陷程度较高时需要采用空心加压螺钉治疗，并辅以心理护理，同时常通过CT进行影像学检查？,胫骨平台骨折
bridge_subgraph_28386.graphml,哪种疾病在治疗过程中需要体位干预辅助，并可能采用解剖钢板内固定术，同时在诊断时常用CT或多层螺旋CT进行检查？,胫骨平台骨折
bridge_subgraph_28392.graphml,哪种疾病在膝关节稳定试验后常采用中药治疗，并配合舒适护理和传统手术以提升疗效？,胫骨平台骨折
bridge_subgraph_28396.graphml,哪种疾病在采用可吸收棒内固定术后容易出现延迟愈合，且需要通过功能锻炼辅助治疗并借助X线片进行影像学检查？,陈旧性腕舟骨骨折
bridge_subgraph_28391.graphml,哪种疾病在MSCT平扫中需与创伤性膈疝进行鉴别诊断，且常在X线和CT检查中同时出现？,膈肌破裂
bridge_subgraph_28395.graphml,哪种疾病在治疗过程中常采用外固定结合术后早期功能锻炼，并且通常与锁定钢板治疗或锁定加压钢板同时使用？,胫骨平台骨折
bridge_subgraph_28399.graphml,哪种疾病在进行胫骨平台骨折内固定术后，关节面塌陷小于2 mm，并且通常需要通过MRI和CT进行诊断？,胫骨平台骨折
bridge_subgraph_28398.graphml,哪种疾病在前臂发病时，通常需要通过MRI和CT检查来确诊？,骨外间叶型软骨肉瘤
bridge_subgraph_28388.graphml,哪种疾病在治疗过程中既需要常规护理和多维度护理作为辅助治疗，又可能采用前外侧入路进行手术治疗？,胫骨平台骨折
bridge_subgraph_28390.graphml,哪种疾病在治疗时需要采用手术内固定和双切口入路，并且通常需要通过MRI检查和关节镜检查来辅助诊断？,胫骨平台骨折
bridge_subgraph_28404.graphml,哪种疾病在CT检查和MRI中常与骨折分型及肺炎同时出现？,胫骨平台骨折
bridge_subgraph_28406.graphml,哪种疾病既表现为闭合性损伤和浮膝损伤，又常需要手术治疗，尤其是交锁髓内钉治疗？,关节外骨折
bridge_subgraph_28397.graphml,哪种疾病在治疗过程中需要结合骨筋膜室综合征和闭合撬拨整复空心螺钉内固定，并常常伴随心理护理和螺旋CT检查？,胫骨平台骨折
bridge_subgraph_28400.graphml,哪种疾病会导致关节活动受限，且常需通过填塞植骨术治疗，同时在诊断过程中常使用CT或多层螺旋CT进行检查？,胫骨平台骨折
bridge_subgraph_28405.graphml,哪种疾病在进行骨外固定架固定手术后需要尽早进行关节功能锻炼，并通常伴随CT平扫和多层螺旋CT的影像学检查？,胫骨平台骨折
bridge_subgraph_28401.graphml,哪种疾病在治疗过程中需要结合连续被动运动功能锻炼和护理，且常采用微创钢板接骨术并辅以CT影像学检查？,胫骨平台骨折
bridge_subgraph_28408.graphml,哪种疾病在进行内固定术后容易出现肿胀，且需使用万古霉素治疗，并通过MRI检查来确诊？,胫骨平台骨折
bridge_subgraph_28412.graphml,哪种疾病需要采用膝关节镜微创手术，并结合自体髂骨植骨内固定及围术期护理的综合治疗方案？,胫骨平台骨折
bridge_subgraph_28409.graphml,哪种疾病在进行多平面重建技术和正侧位数字X线摄影检查时，常伴有感染，并且需要使用多层螺旋CT进行进一步诊断？,胫骨平台骨折
bridge_subgraph_28402.graphml,哪种疾病在骨科治疗中常采用腓骨移植和皮拉力螺钉微创治疗，且与股骨远端骨折密切相关？,闭合性新鲜骨折
bridge_subgraph_28393.graphml,哪种疾病在治疗过程中需要采用双切口显露和关节面骨折直接复位手术，并通过64排螺旋CT三维重建成像进行检查，同时辅以针灸和鹿瓜多肽药物治疗？,胫骨平台骨折
bridge_subgraph_28413.graphml,哪种疾病在不良生活习惯和短期禁食后容易引发，且常需手术治疗？,乳糜瘘
bridge_subgraph_28410.graphml,哪种医学内容在东茛菪碱和曲马多的使用以及传统护理模式的实践中，与硬膜外麻醉和综合护理干预相结合更为有效？,剖宫产产妇
bridge_subgraph_28403.graphml,哪种疾病在治疗时既可采用交锁髓内钉固定，也可使用锁定加压钢板，并且常伴随交锁髓内钉治疗和创伤性关节炎的出现？,股骨下端骨折
bridge_subgraph_28407.graphml,哪种疾病在采用内固定方式手术治疗的同时，还需要正确处理合并伤，并辅以早期功能锻炼？,胫骨平台骨折
bridge_subgraph_28419.graphml,哪种疾病需要在进行支撑钢板和填塞植骨治疗的同时，配合常规护理和肢体功能锻炼？,胫骨平台骨折
bridge_subgraph_28415.graphml,哪种疾病在采用MIIG结合内固定治疗及围术期护理的同时，还需要进行CT检查和自体髂骨移植？,胫骨平台骨折
bridge_subgraph_28418.graphml,哪种疾病在进行MRI平扫及增强扫描时，通常还会同时进行CT和MRI检查？,肝脏EHE
bridge_subgraph_28416.graphml,哪种疾病在增强扫描时无坏死组表现，且常与CT平扫和CT检查同时出现？,前纵隔淋巴瘤
bridge_subgraph_28417.graphml,哪种疾病在男性患者中常见，且需要通过CT检查和拉力螺钉固定治疗，并适用于Pipkin分型？,Pipkin骨折
bridge_subgraph_28411.graphml,哪种社会学理论能更好地解释MODSE患者的病因、机械通气辅助治疗过程中的焦虑表现，以及CT检查在其中的影像学应用？,感染
bridge_subgraph_28423.graphml,哪种医学内容在涉及肺外结核病和中枢神经系统结核时，通常需要结合MRI检查和CT进行诊断？,颅内结核瘤
bridge_subgraph_28421.graphml,哪种疾病在磁共振成像（MRI）中表现为脑室前后角区域的点状损伤组（A1组）和簇状损伤？,局灶性脑白质损伤
bridge_subgraph_28414.graphml,哪种疾病在非关节炎组病理分型中，表现为后内和后外侧骨折块，且在CT扫描中可见，通常采用非手术治疗？,胫骨平台骨折
bridge_subgraph_28422.graphml,哪种疾病在进行骨折复位固定手术时，尤其是SchatzkerⅠ型骨折，常与传统手术方法同时使用？,胫骨平台骨折
bridge_subgraph_28424.graphml,哪种疾病在MRI扩散加权成像中表现明显，且常与神经鞘瘤相关，同时在MRI和CT检查中也有相应表现？,四肢软组织肿瘤
bridge_subgraph_28427.graphml,哪种疾病在因重物砸伤导致后，需要通过合理功能锻炼辅助治疗，且常表现为Ⅱ型或Ⅳ型病理分型？,胫骨平台骨折
