file,query,answer
bridge_subgraph_07609.graphml,哪种疾病会导致蠕形螨感染或马拉色菌毛囊炎，且常与糖尿病相关，多发病于头颈部？,毛囊炎
bridge_subgraph_07606.graphml,哪种疾病在学习紧张时容易出现，且与乙酰谷酰胺有关，同时多见于特定年龄人群并常伴有原发性高血压？,失眠
bridge_subgraph_07603.graphml,哪种疾病在维持性腹膜透析患者中，通过荧光高效液相色谱法检测时，与缺血性脑卒中和冠心病的并发率较高？,失眠
bridge_subgraph_07611.graphml,哪种疾病会同时出现TT-TG异常、关节软骨损害，并伴随感染和酶联免疫吸附试验阳性？,ACL
bridge_subgraph_07619.graphml,哪种疾病在采用音乐放松疗法的同时，与子宫肌瘤及混合型癫痫有关联？,失眠
bridge_subgraph_07618.graphml,哪种疾病在服用安神口服液调和阴阳的同时，吸烟和安慰剂的使用也会对其产生影响？,失眠
bridge_subgraph_07613.graphml,哪种疾病在41～60岁人群中较常见，且与卵巢转移瘤密切相关，同时可能影响肝、肾功能，并能通过磁共振成像进行检查？,乳腺浸润性导管癌
bridge_subgraph_07612.graphml,哪种疾病会导致低体重儿，且其发病率约为1.27%，并常伴随健康教育和腹胀症状？,新生儿坏死性小肠结肠炎
bridge_subgraph_07617.graphml,哪种疾病会导致左室射血分数异常，且在超声心动图检查中可见，同时伴随磁共振异常和头晕症状？,急性心肌梗死
bridge_subgraph_07620.graphml,哪种疾病在治疗时常用平衡针和内关，且常与急性脑梗死和ET同时出现？,失眠
bridge_subgraph_07614.graphml,哪种疾病在治疗过程中会同时使用紫杉醇联合顺铂和DC-CIK联合PC方案化疗，并且常涉及肾和肝的问题？,晚期肺腺癌
bridge_subgraph_07616.graphml,哪种疾病在治疗过程中既需要电刺激疗法又常结合针刺治疗，且与恶性血液病和肿瘤密切相关？,歇斯底里
bridge_subgraph_07623.graphml,哪种症状在食管癌患者接受肿瘤化疗时，最常与呕吐同时出现？,腹泻
bridge_subgraph_07629.graphml,哪种疾病与内皮细胞蛋白C受体和内皮细胞活化蛋白C受体直接相关，且常与恶性肿瘤和乳腺癌同时出现？,EPCR
bridge_subgraph_07615.graphml,哪种疾病在6.09%的发病率下，既与业务意识教育和医护人员态度问题密切相关，又常常受到环境因素的影响？,护理纠纷
bridge_subgraph_07632.graphml,哪种疾病在思诺思和百合地黄汤的治疗过程中，常与OSAHS和高血压病同时出现？,失眠
bridge_subgraph_07631.graphml,哪种疾病适合采用体针结合耳针贴压治疗和BCBT方法，并且常伴随血脂异常和饮酒问题？,失眠
bridge_subgraph_07624.graphml,哪种社会学理论能解释失眠和乳头状瘤与骨痛、肿瘤之间的关联？,恶性肿瘤
bridge_subgraph_07627.graphml,哪种疾病在温阳扶正辅助治疗和加味甘草泻心汤药物治疗的同时，常伴有疼痛症状，且中药治疗较为有效？,复发性口疮
bridge_subgraph_07621.graphml,哪种疾病在治疗过程中适合采用消癥软结方联合鸦胆子油乳和活血化瘀药，并配合化疗及综合护理干预？,中晚期原发性肝癌
bridge_subgraph_07628.graphml,哪种疾病在治疗过程中，针灸联合乌灵胶囊和齐哌西酮的使用，常伴随着磁共振成像检查和尿潴留现象的出现？,失眠
bridge_subgraph_07625.graphml,哪种疾病由大肠埃希杆菌引起，临床表现为软组织团块影密度均匀且无钙化灶，治疗时需配合心理护理并使用蒙药？,慢性化脓性鼻窦炎
bridge_subgraph_07634.graphml,哪种疾病在职业探索过程中常伴随PCL-C症状，且需要心理干预来缓解强迫行为？,手术室护士
bridge_subgraph_07630.graphml,哪种疾病会导致脑干肿瘤，并需要肺维护辅助治疗，同时在诊断过程中常进行酶联免疫吸附试验和磁共振检查？,脑死亡
bridge_subgraph_07633.graphml,哪种疾病在采用安魂强魄调营汤加减治疗的同时，常伴有顽固性便秘、腰痛症状，且与性别有关？,失眠
bridge_subgraph_07622.graphml,哪种疾病在女性精神病治疗后症状缓解，同时在老年期抑郁风险评估中需特别关注，且常采用蒙药和耳穴贴压法进行综合治疗？,失眠
bridge_subgraph_07635.graphml,哪种疾病在实验室检查中表现为FPG异常，需用火把花根片治疗，且常伴有肝功能异常和高血压？,中西结合组
bridge_subgraph_07626.graphml,哪种疾病既可能导致妊娠期肝内胆汁瘀积症，又可能转化为妊娠期合并恶性淋巴瘤，且其风险评估因素包括日间嗜睡，临床表现中有贫血？,胎死宫内
bridge_subgraph_07637.graphml,哪种疾病在乳腺癌化疗期间，可能会同时出现心肌梗死和卒中的临床表现，且吡唑并嘧啶类药物对其治疗有效？,失眠
bridge_subgraph_07640.graphml,哪种疾病的发病率高达15.79%，并且与精神科工作压力及环境因素密切相关，常需通过血液透析进行辅助治疗？,护理缺陷
bridge_subgraph_07641.graphml,哪种疾病在老年人中多发，且常通过断尾取血法检查发现血钾异常，同时伴随贫血症状？,失血性贫血
bridge_subgraph_07636.graphml,哪种疾病同时涉及冠心病心律失常和昼不精夜不瞑，并且常常与肿瘤和心理护理相关？,失眠
bridge_subgraph_07643.graphml,哪种疾病会导致肾部发病，伴随腹胀，且可通过当归六黄汤治疗，并表现为ST-T段和T波异常？,失眠
bridge_subgraph_07646.graphml,哪种疾病在治疗过程中既需要西药疗法和早期康复训练，又常常结合针刺法和按摩作为辅助治疗？,脑卒中后精神障碍
bridge_subgraph_07639.graphml,哪种疾病会导致长期偏身麻木和Chiari Ⅰ畸形，且常伴有腹痛，发病率约为55%？,脊髓空洞症
bridge_subgraph_07642.graphml,哪种疾病由于生活习惯改变引起，适合采用中医疗法辅助治疗，并且需要常规护理服务，且表现为急性发作？,失眠
bridge_subgraph_07644.graphml,哪种疾病更容易发生在经常食用辛辣油腻食物、存在免疫抑制、频繁饮酒且性别为特定人群的个体身上？,肝炎复发
bridge_subgraph_07647.graphml,哪种疾病会导致足部推拿后出现腹胀和恶心，且与吸毒有关？,失眠
bridge_subgraph_07645.graphml,哪种疾病在健康及生活指导中占比31.9%，且常与针刺治疗和电针同时出现？,失眠
bridge_subgraph_07638.graphml,哪种疾病在护理时需要采取半卧式体位，并且常伴有免疫球蛋白E（IgE）水平的升高，同时治疗过程中常用西药且常与慢性荨麻疹并发？,CU
bridge_subgraph_07651.graphml,哪种疾病既表现为急性扁桃体炎和胆汁淤积，还伴随腹痛，且认知心理治疗可作为辅助治疗手段？,失眠
bridge_subgraph_07648.graphml,哪种疾病在治疗时常用连翘，且患者常出现咯血和心悸症状，同时需要配合健康教育进行辅助治疗？,H7N9禽流感
bridge_subgraph_07652.graphml,哪种症状会在突发意识障碍和失眠的同时，伴随双肺呼吸音清和头晕出现？,头痛
bridge_subgraph_07650.graphml,哪种疾病在环境改变和年龄增长的双重影响下，与子宫癌的发生密切相关，并且可能同时引发眼科问题？,失眠
bridge_subgraph_07654.graphml,哪种疾病在进行尿道内切开术后容易出现血尿，且需要优质护理，同时与患者年龄有一定关联？,膀胱结石
bridge_subgraph_07653.graphml,哪种疾病在考前心理障碍和腧穴配伍的治疗中，常与匹兹堡睡眠质量指数升高和肥胖现象同时出现？,失眠
bridge_subgraph_07656.graphml,哪种疾病在白昼时间延长时易发，且可用首乌藤治疗，同时伴有发热和胸闷的症状？,失眠
bridge_subgraph_07649.graphml,哪种疾病在男性中较为常见，且通常需要抗精神病药治疗，其病因与恐惧心理密切相关，诊断时常用磁共振进行检查？,失眠
bridge_subgraph_07661.graphml,哪种疾病同时具有腰椎发病部位和血栓性脑梗死、胃癌、缺血性脑卒中的高危因素？,AA基因型
bridge_subgraph_07668.graphml,哪种疾病既与失眠和非糖尿病组直接相关，又常与心律失常和急性心肌梗死同时出现？,2型糖尿病
bridge_subgraph_07664.graphml,哪种疾病在辨证用药和艾灸治疗的同时，常与老年抑郁症和脑卒中相伴出现？,失眠
bridge_subgraph_07662.graphml,哪种疾病适合使用药食两用中药复方治疗，且常表现为耳鸣耳聋，尤其多见于男性且为混合型症状？,失眠
bridge_subgraph_07671.graphml,哪种疾病在出现IgA肾病和全血霉酚酸酯的同时，常伴随腹泻和腹痛的症状？,MMF
bridge_subgraph_07658.graphml,哪种疾病在采用纳米碳药物治疗时，常表现为失眠，且其高危因素包括肿瘤，特别是与非小细胞肺癌的病理分型密切相关？,乳腺癌
bridge_subgraph_07670.graphml,哪种疾病在通过生活护理干预和控制血压辅助治疗的同时，容易出现咳嗽的临床表现，且其风险评估与性别有关？,IgA 肾病
bridge_subgraph_07655.graphml,哪种疾病在治疗过程中，卡维地洛联合厄贝沙坦和诺欣妥的应用效果更好，且需要结合酶联免疫法检测和综合护理来提高疗效？,扩张型心肌病心力衰竭
bridge_subgraph_07659.graphml,哪种疾病在出现移位和3侧假体移位的同时，还需要特别关注护理干预和感染的风险？,隆乳
bridge_subgraph_07666.graphml,哪种疾病在出现中毒和乏力症状时，可能需要采用床边血滤串联血液灌流辅助治疗，且易引发重度有机磷中毒并发症？,横纹肌溶解
bridge_subgraph_07657.graphml,哪种疾病在临床上表现为人工肾组和输卵管结扎术的症状，同时其病因与耳穴压豆有关，还伴随甲状腺功能亢进的表现？,失眠
bridge_subgraph_07663.graphml,哪种疾病在采用子午流注针法和健康教育辅助治疗的同时，还可能出现发热，并且需要进行维持性腹膜透析？,失眠
bridge_subgraph_07665.graphml,哪种疾病在采用针药联合治疗的同时，常伴随睡眠效率低下、心律失常和血脂异常？,失眠
bridge_subgraph_07667.graphml,哪种疾病在血清DA水平异常和氯丙嗪治疗的同时，常与慢性乙型肝炎并存，且需要常规护理？,失眠
bridge_subgraph_07677.graphml,哪种疾病在MSCT影像上表现为软组织特别是肌肉的异常，且常伴随疼痛并需要康复护理？,骨化性肌炎
bridge_subgraph_07669.graphml,哪种疾病会出现痰热内扰、腹痛和呕吐，且可用加味甘麦大枣汤治疗？,失眠
bridge_subgraph_07672.graphml,哪种疾病会导致纵隔囊肿并在普外科就诊时出现腹胀症状？,淋巴管囊肿
bridge_subgraph_07675.graphml,哪种疾病在治疗时既适合采用中药辨证配和针灸，又常与喹硫平和汉密尔顿抑郁量表一同使用？,失眠
bridge_subgraph_07676.graphml,哪种疾病会导致失明，并通过颞动脉活检确诊，同时伴随恶心症状和头颅MRI异常表现？,颞动脉炎
bridge_subgraph_07673.graphml,哪种疾病在完全性唇裂的治疗中，需要通过全麻手术，并常伴随使用右美托咪定和镇静剂？,唇裂
bridge_subgraph_07678.graphml,哪种疾病在医疗付费方式和术后并发症方面需要特别关注，并且患者常表现出焦虑和人际关系敏感的临床症状？,青年骨折
bridge_subgraph_07681.graphml,哪种疾病在需要进行外科手术治疗的同时，常伴随心律失常和慢性阻塞性肺病，并且通常通过胸部CT检查来确诊？,肺癌
bridge_subgraph_07660.graphml,哪种疾病与AA基因型（高危因素）或AI（同义词）直接相关，且在治疗时常需采用尿激酶静脉溶栓治疗（药物治疗），同时需监测血脂（实验室检查）？,血栓性脑梗死
bridge_subgraph_07680.graphml,哪种疾病在检测时会同时出现尿脱氧吡啶啉和双能光子骨密度仪的应用，且常与肥胖和酶联免疫法相关联？,DXA
bridge_subgraph_07682.graphml,哪种疾病会因心理负担和元担忧引起，且在治疗过程中常需配合药物治疗，并可能与性别有关？,失眠
bridge_subgraph_07679.graphml,哪种医学内容能同时解释MsCT扫描中的异常表现、心律失常以及伴随的急性心肌梗死和胸闷症状？,左冠状动脉
bridge_subgraph_07674.graphml,哪种疾病在男性患者中常见，且常表现为腰痛，同时需要通过螺旋CT增强扫描和超声进行影像学检查？,主动脉瘤
bridge_subgraph_07689.graphml,哪种医学内容最常涉及亚健康状况和苯二氮(艹卓)类药物，且在ICU中患者出现烦躁时被提及？,失眠
bridge_subgraph_07693.graphml,哪种疾病在治疗过程中需要用到血府逐瘀汤和辩证选穴，并且常伴随乏力和慢性心力衰竭的症状？,失眠
bridge_subgraph_07694.graphml,哪种疾病在临床表现上既包括蕈中毒和n2症状，又可能与肿瘤相关，且调节积极心态对其辅助治疗有显著效果？,失眠
bridge_subgraph_07690.graphml,哪种疾病适合用针刺疗法治疗，并且需要配合当归等中药治疗，而不是单纯依赖药物治疗？,失眠
bridge_subgraph_07691.graphml,哪种疾病在辅助治疗睡眠的同时，临床表现为慢性病毒性肝炎和恶心，且实验室检查常出现血脂异常？,失眠
bridge_subgraph_07700.graphml,哪种医学内容在涉及心理咨询和BZDs的同时，也常与综合护理干预和干预治疗共同出现？,失眠
bridge_subgraph_07683.graphml,哪种疾病在温灸神阙穴的治疗中，与慢性肾衰竭、心肌梗死和糖尿病同时出现的概率较高？,失眠
bridge_subgraph_07699.graphml,哪种疾病在治疗过程中需要同时使用拉米夫啶等抗病毒药物，并辅以护理和中医综合疗法？,HBV-GN
bridge_subgraph_07696.graphml,哪种疾病在抗炎对症治疗后容易治愈，且常与肿瘤和肝硬化同时出现？,胆管炎
bridge_subgraph_07684.graphml,哪种疾病会出现鼻黏膜电位差异常，并且通过MRI增强扫描可诊断，同时常伴随酶联免疫吸附试验阳性及慢性阻塞性肺疾病症状？,CF
bridge_subgraph_07686.graphml,哪种疾病在X线透视检查后需要植入心外膜永久起搏器，且患者常伴有憋气和头晕的症状？,高度房室传导阻滞
bridge_subgraph_07692.graphml,哪种疾病在治疗时需要同时采用苯二氮(桌)类药物、辨证调护和心理护理，且其临床表现可能包括银屑病？,失眠
bridge_subgraph_07697.graphml,哪种疾病在治疗时会同时使用失荅刺知丸和潜阳法，并且患者常伴有呕吐和癫痫发作的症状？,失眠
bridge_subgraph_07685.graphml,哪种疾病既与LTA（同义词）和Lown 3～5级室早有关，又常伴随心功能不全，并且可能转化为新型冠状病毒肺炎？,致命性心律失常
bridge_subgraph_07695.graphml,哪种疾病在出现莫沙比利和GERC的同时，还可能伴随发热和支气管哮喘的症状？,胃食管返流
bridge_subgraph_07701.graphml,哪种疾病会导致血浆D-二聚体升高，在产科中常见，且可能伴随使用丹参注射液和头痛症状？,早发型子痫前期
bridge_subgraph_07698.graphml,哪种疾病在心理一致感量表和多维感恩量表的得分与焦虑自评量表的得分以及患者年龄存在显著关联？,CPSS
bridge_subgraph_07687.graphml,哪种疾病既可能因颅内血肿和脑梗死引起，又需要通过去骨瓣减压术治疗，同时还要控制血压作为辅助治疗手段？,脑膨出
bridge_subgraph_07702.graphml,哪种疾病在小鼠乳腺癌移植瘤和AS模型中常伴随水肿和白塞病的发生？,反应停
bridge_subgraph_07688.graphml,哪种疾病在胰腺损伤（病理分型）后，通过床旁超声FAST检查能及时发现，且常伴随感染（并发症）并需要常规护理（辅助治疗）？,腹部闭合性损伤
bridge_subgraph_07704.graphml,哪种医学内容与上消化道大出血和mSv直接相关，且常与高血压和骨折同时出现？,血管栓塞
bridge_subgraph_07710.graphml,哪种疾病会导致新生儿甲亢和胎膜早破，同时伴随感染和贫血？,妊娠甲亢
bridge_subgraph_07706.graphml,哪种疾病在大面积深度烧伤的治疗中，除了优质护理和心理疏导外，还会采用情景模拟教学作为辅助治疗手段？,烧伤整形科
bridge_subgraph_07714.graphml,哪种疾病会导致中学生听力减退，并伴随禀赋不足、乏力和水肿的现象？,失眠
bridge_subgraph_07707.graphml,哪种疾病在治疗过程中会同时使用丙泊酚和VSD治疗，并且可能需要结合高压氧治疗，常见于乳腺癌患者？,整形外科
bridge_subgraph_07713.graphml,哪种疾病会导致心血管症状加重，同时需要特别的肝肾养护法，并且常与肿瘤和高血压病同时出现？,失眠
bridge_subgraph_07708.graphml,哪种疾病在糖尿病患者中表现为抑郁症和思虑过度，且常伴随慢性鼻窦炎和胃食管反流病？,失眠
bridge_subgraph_07703.graphml,哪种疾病会出现气滞血瘀的临床表现，且在治疗中常使用苯二氮类药物，同时辅以高压氧治疗和针刺疗法？,失眠
bridge_subgraph_07709.graphml,哪种疾病在护理风险管理、预防性护理以及常规护理中都需要特别关注，且常伴有高血压这一并发症？,颅脑外科
bridge_subgraph_07705.graphml,哪种疾病既有阻塞性睡眠呼吸暂停的临床表现，又常需右佐匹克隆片联合脑蛋白水解物片治疗，且可能与冠心病和吸烟有关？,失眠
bridge_subgraph_07712.graphml,哪种疾病会导致褪黑素水平降低，并可能需要经颅微电流刺激治疗，同时常与急性脑梗死和心内科问题相伴出现？,失眠
bridge_subgraph_07711.graphml,哪种疾病会导致深黄色尿，加重家庭负担，且在血常规检查中有异常表现，需要通过常规治疗来辅助治疗？,失眠
bridge_subgraph_07715.graphml,哪种疾病既表现为老年冠心病心绞痛和经济困难，又与骨质疏松和痤疮同时出现？,失眠
bridge_subgraph_07718.graphml,哪种疾病在治疗过程中需要使用平阳霉素和明胶海绵栓塞，并常伴随恶心症状，同时需要常规护理？,肝海绵状血管瘤
bridge_subgraph_07717.graphml,哪种疾病会导致早产儿出现眼底病，并且通常与感染相关，可以通过酶联免疫法进行检测？,早产儿视网膜病变
bridge_subgraph_07716.graphml,哪种疾病既可能出现不安腿综合征和需要服用脑蛋白水解物片治疗，又可能与肺癌和骨折同时发生？,失眠
bridge_subgraph_07724.graphml,哪种医学内容在涉及DLEK和角膜病的同时，也会涵盖疼痛和常规护理方面的信息？,大泡性角膜病变
bridge_subgraph_07721.graphml,哪种疾病在切除肿瘤后可能导致颅底缺损，同时需要心理护理并伴随发热的临床表现？,脑脊液鼻漏
bridge_subgraph_07720.graphml,哪种医学内容在涉及自发性冠状动脉夹层和阿司匹林时，通常也会关联到急性冠状动脉综合征和缺血性卒中？,SCAD
bridge_subgraph_07722.graphml,哪种疾病更容易引发单发的深穿支梗死和颈动脉狭窄急性脑梗死，且常与缺血性脑卒中和冠心病同时出现？,中度狭窄组
bridge_subgraph_07723.graphml,哪种疾病会导致男性在服用瑞舒伐他汀后出现执行功能障碍，且头颅MRI检查有异常表现？,SIVD
bridge_subgraph_07725.graphml,哪种疾病在使用6F Sofia导管进行活血化瘀治疗时，常伴随血瘀证和急性脑梗死的出现？,基底动脉闭塞
bridge_subgraph_07730.graphml,哪种疾病会导致PDW PCT升高、心脏舒张功能改善，同时伴随抑郁和焦虑症状？,原发性高血压组
bridge_subgraph_07727.graphml,哪种疾病在采用艾条灸辅助治疗的同时，常伴随网络成瘾的临床表现，并且需要进行问诊和常规护理？,失眠
bridge_subgraph_07729.graphml,哪种社会学理论能解释小肠淋巴管扩张症引起的失眠和水肿，并涉及胶囊内镜检查的应用？,肿瘤
bridge_subgraph_07734.graphml,哪种疾病在放疗后容易出现腹泻和头晕，且需通过汉密尔顿焦虑量表进行辅助检查？,失眠
bridge_subgraph_07736.graphml,哪种疾病会导致双侧乙状窦处静脉途径栓塞，并伴随头晕和耳鸣的临床表现？,DAVF
bridge_subgraph_07732.graphml,哪种疾病在采用中药复方温胆汤治疗时，常伴随心慌症状，并且治疗过程中可能会用到黄连？,失眠
bridge_subgraph_07728.graphml,哪种社会学理论能解释失眠和呕吐的临床表现与精神分裂症的并发症之间的关系，并涉及肌酸激酶的实验室检查结果？,高血压
bridge_subgraph_07735.graphml,哪种疾病最适合采用西酞普兰合并乌灵胶囊治疗，并辅以耳穴埋豆、循证护理和整体护理的综合疗法？,失眠
bridge_subgraph_07733.graphml,哪种疾病在CT影像学检查中可见，常导致认知损害，并伴随失语的临床表现，治疗时可能使用度洛西汀？,丘脑卒中
bridge_subgraph_07719.graphml,哪种疾病在采用苯二氮(桌)类药物治疗时，常伴有呕吐症状，并且可能导致骨质增生，需要采取相应的护理措施辅助治疗？,失眠
bridge_subgraph_07731.graphml,哪种疾病适合采用针灸结合头颈部经穴推拿和胃安神法进行治疗，且常伴随焦虑症状，需要与常规治疗相结合？,失眠
bridge_subgraph_07726.graphml,哪种疾病在男性中较为常见，且多见于有吸烟史和一定年龄的人群，病理分型为鳞癌？,COPD合并肺癌
bridge_subgraph_07740.graphml,哪种医学内容在包含20例腹腔镜和他莫昔芬的同时，还涉及二甲双胍和综合护理干预的研究？,PCOS不孕
bridge_subgraph_07743.graphml,哪种疾病在社会内向量表和糖尿病家族史的影响下，更容易与肿瘤和饮酒习惯同时出现？,D
bridge_subgraph_07738.graphml,哪种疾病在进行口腔功能训练和远近配穴针刺的同时，通常还会采用针灸和推拿作为辅助治疗？,脑瘫流涎
bridge_subgraph_07737.graphml,哪种疾病最有可能导致男性在右眼被石头砸伤和玩具枪子弹眼外伤后，同时出现糖尿病症状？,继发性青光眼
bridge_subgraph_07739.graphml,哪种疾病在进行心脏介入治疗的同时，需要特别关注精神卫生教育，以缓解患者的焦虑和抑郁情绪？,失眠
bridge_subgraph_07747.graphml,哪种疾病在男性中更常见，且表现为复合性溃疡和表浅溃疡，同时伴有腹痛？,高位胃溃疡
bridge_subgraph_07742.graphml,哪种疾病会因为环境改变而导致日间功能受损，并且常与帕金森病和卒中同时出现？,失眠
bridge_subgraph_07745.graphml,哪种疾病需要使用中药疣毒净系列制剂进行治疗，且其病因与性激素相关，同时还需要配合心理护理干预和心理干预作为辅助治疗？,复发性尖锐湿疣
bridge_subgraph_07741.graphml,哪种疾病既有大肠癌的临床表现又有肺癌的病因，且预后生存率达到100%，同时还伴随ET的临床表现？,血小板增高
bridge_subgraph_07753.graphml,哪种疾病在高血压组中与背景神经肽Y直接相关，且常与癫痫和高血压同时出现？,NPY
bridge_subgraph_07751.graphml,哪种疾病在采用中药足浴联合心理疏导治疗时，常伴随皮疹和腹痛，且与噪声性耳聋有关？,失眠
bridge_subgraph_07760.graphml,哪种医学内容同时涉及慢性阻塞性肺病、甘草以及PD和氯丙嗪的相关研究？,失眠
bridge_subgraph_07752.graphml,哪种疾病在服用MT和炒酸枣仁配方颗粒的同时，还常伴随体重指数异常和高血压的症状？,失眠
bridge_subgraph_07748.graphml,哪种疾病在通过根治性手术和经直肠腔内超声治疗后，常与肛周脓肿和感染同时出现？,肛门直肠周围脓肿
bridge_subgraph_07746.graphml,哪种疾病在治疗时使用氟哌噻吨美利曲辛联合养血清脑颗粒，且患者表现出时寐时醒的症状，同时伴随急性脑梗死和心电图异常？,失眠
bridge_subgraph_07755.graphml,哪种疾病在19.05%的发病率下，常因穴位按摩引发，并伴随化疗和恶性肿瘤的临床表现？,失眠
bridge_subgraph_07756.graphml,哪种医学内容在常规药物治疗和奥氮平组（n=20）的研究中，与氯氮平和行为疗法同时出现？,老年慢性精神分裂症
bridge_subgraph_07758.graphml,哪种疾病在进行放射免疫联合检测CEA时，常伴随使用氟西汀进行抗抑郁治疗？,消化系恶性肿瘤
bridge_subgraph_07754.graphml,哪种社会学理论能够综合解释慢性乙型肝炎与心脏X综合征的关联，并涉及血脂异常和心理护理的影响？,高血压
bridge_subgraph_07749.graphml,哪种疾病在治疗时可能同时使用美洛昔康凝胶和A型肉毒毒素关节腔注射，并且常伴随骨质疏松和六味地黄汤的辅助治疗？,佐剂性关节炎
bridge_subgraph_07759.graphml,哪种疾病需要心内科进行射频消融术治疗，且常与缺血性脑卒中同时出现，比如AF？,非瓣膜病心房颤动
bridge_subgraph_07744.graphml,哪种疾病最适合采用帕罗西汀联合乌灵胶囊治疗，并辅以电针和针刺治疗来抗抑郁焦虑？,失眠
bridge_subgraph_07761.graphml,哪种疾病会导致解剖变形，并需要经腹膜外途径输尿管膀胱再吻合术治疗，同时还可能引发感染和子宫肌瘤？,输尿管阴道瘘
