file,query,answer
subgraphs_batch_022_textual_subgraph_0062.graphml,"Who is the individual born in the United States, known for their work on the X-Men films, and has professions as both a film producer and writer in Great Britain?",Stan Lee
subgraphs_batch_022_textual_subgraph_0060.graphml,"Who is the individual that has won awards like Steve Ditko, is associated with the film The Amazing Spider-Man, works as a writer, and has made personal appearances related to Iron Man?",Stan Lee
subgraphs_batch_022_textual_subgraph_0063.graphml,Who is the male actor from the United States who has been nominated for awards alongside Peter Jacobson and Hugh Laurie?,Kal Penn
subgraphs_batch_022_textual_subgraph_0074.graphml,"Who is the male writer influenced by Franz Kafka, born in San Francisco, and affiliated with Judaism?",Daniel Handler
subgraphs_batch_022_textual_subgraph_0071.graphml,Who is the male screenwriter known for his dubbing performances in the English language version of the film Evangelion 1.11: You Are (Not) Alone?,John Swasey
subgraphs_batch_022_textual_subgraph_0068.graphml,Who is the male actor from Great Britain who was married to Sridevi and starred in the film O.S.O.?,Mithun Chakraborty
subgraphs_batch_022_textual_subgraph_0066.graphml,"Who is the film producer from Great Britain who was born in the United States and received a BAFTA Award nomination for the film ""Mutiny on the Bounty""?",Lewis Milestone
subgraphs_batch_022_textual_subgraph_0065.graphml,Who is the film producer and writer from Palm Springs who has been nominated for the Golden Globe Award for Best Screenplay - Motion Picture?,Cameron Crowe
subgraphs_batch_022_textual_subgraph_0070.graphml,Who is the screenwriter and British television producer who has been nominated for awards and lived in Stamford?,Mark Tinker
subgraphs_batch_022_textual_subgraph_0067.graphml,"Who is the individual born in the United States, known for their association with the X-Men films, and has worked as both a television and film producer in Great Britain?",Stan Lee
subgraphs_batch_022_textual_subgraph_0073.graphml,"Who is the British film producer, actor, and screenwriter known for practicing Judaism?",Stan Lee
subgraphs_batch_022_textual_subgraph_0072.graphml,"Who is the Jewish television producer from Great Britain, known for creating the film Hulk, and has a notable connection to the United States Dollar?",Stan Lee
subgraphs_batch_022_textual_subgraph_0075.graphml,Who is the male voice actor and writer from Great Britain who is also known for his involvement with the X-Men film?,Stan Lee
subgraphs_batch_022_textual_subgraph_0079.graphml,"Who is the male screenwriter known for producing the TV shows ""Chicago Hope"" and ""Wonder Woman""?",David E. Kelley
subgraphs_batch_022_textual_subgraph_0077.graphml,"Which actor, known for his work on the X-Men film series and affiliated with Judaism, was born in New York City?",Stan Lee
subgraphs_batch_022_textual_subgraph_0076.graphml,"Who is the male writer from Great Britain who speaks English and is associated with the film ""Even Cowgirls Get the Blues""?",Crispin Glover
subgraphs_batch_022_textual_subgraph_0080.graphml,"Who is the British individual who has both produced films and acted, and is notably associated with the movies X-Men and Spider-Man 3?",Stan Lee
subgraphs_batch_022_textual_subgraph_0083.graphml,Who is the male voice actor known for his work in X-Men films and also recognized as a film producer from Great Britain?,Stan Lee
subgraphs_batch_022_textual_subgraph_0078.graphml,"Who is the male actor born in Venice, known for winning awards like Carrie Preston, and is currently married?",Stephen Moyer
subgraphs_batch_022_textual_subgraph_0082.graphml,"Who is the person that has contributed to films like Hulk and X-Men, worked as an actor in Great Britain, and has been married?",Stan Lee
subgraphs_batch_022_textual_subgraph_0088.graphml,Who is the male voice actor known for his work in both the X-Men and Iron Man 3 films?,Stan Lee
subgraphs_batch_022_textual_subgraph_0085.graphml,Who is the screenwriter from the United States who has been nominated for awards by Josh Griffith and has won awards attributed to Nancy Williams Watt?,Trent Jones
subgraphs_batch_022_textual_subgraph_0084.graphml,"Who is the actor born in Houston, known for their role in the film ""Star Trek: First Contact,"" and holds British citizenship while being a national of the United States?",Brent Spiner
subgraphs_batch_022_textual_subgraph_0089.graphml,Who is the male actor and voice actor from Great Britain who is also known for his involvement in the X-Men film series?,Stan Lee
subgraphs_batch_022_textual_subgraph_0087.graphml,Who is the male writer from Great Britain who was influenced by Victor Hugo and is affiliated with Catholicism?,Oscar Wilde
subgraphs_batch_022_textual_subgraph_0086.graphml,"Which male individual, who is associated with Judaism, has contributed to both the X-Men and Iron Man 3 films?",Stan Lee
subgraphs_batch_022_textual_subgraph_0069.graphml,"Who is the individual that has been nominated for both the Writers Guild of America Award for Best Original Screenplay and the Academy Award for Best Original Screenplay, and is also known for being both an actor and a screenwriter?",John Sayles
subgraphs_batch_022_textual_subgraph_0081.graphml,"Who is the person that both Paula Abdul and Richard Curtis have been nominated for awards by, and who is also associated with marriage and the United States Dollar?",Simon Fuller
subgraphs_batch_022_textual_subgraph_0100.graphml,Who is the Filipino film producer who has worked at Star Cinema and is known for their marriage?,Charo Santos-Concio
subgraphs_batch_022_textual_subgraph_0095.graphml,Who is the male writer from Great Britain who is affiliated with both The Avengers and X-Men films?,Stan Lee
subgraphs_batch_022_textual_subgraph_0091.graphml,Who is the male film producer from Great Britain who has been nominated for awards alongside Franco Zeffirelli and Evil Angels?,Yoram Globus
subgraphs_batch_022_textual_subgraph_0093.graphml,"Who is the male author born in The Bronx, who has won awards associated with Dennis Lehane and holds American nationality?",Richard Price
subgraphs_batch_022_textual_subgraph_0098.graphml,"Who is the male Jewish actor known for his role in the film ""Independence Day"" and nominated for a Tony Award for Best Actor in a Play?",Harvey Fierstein
subgraphs_batch_022_textual_subgraph_0097.graphml,"Who is the male American personality known for his work on ""The Avengers"" film and his affiliation with Judaism?",Stan Lee
subgraphs_batch_022_textual_subgraph_0090.graphml,Who is the British politician and film producer who speaks Hindi and is known for their marriage?,Sunil Dutt
subgraphs_batch_022_textual_subgraph_0092.graphml,"Who is the British individual who has worked as a journalist, television producer, and writer, and has also been nominated for awards related to NYPD Blue?",David Mills
subgraphs_batch_022_textual_subgraph_0094.graphml,"Who is the male actor from Great Britain, known for his work on the X-Men film series and his affiliation with Judaism?",Stan Lee
subgraphs_batch_022_textual_subgraph_0109.graphml,Which male actor from Great Britain is known for his appearances in both the X-Men and Iron Man 3 films?,Stan Lee
subgraphs_batch_022_textual_subgraph_0103.graphml,"Who is the British musician known for being both a bassist and an actor, and is also recognized for their marriage?",Jack Bruce
subgraphs_batch_022_textual_subgraph_0099.graphml,"Who is the male actor known for his roles in the films ""In Bruges"" and ""The Village,"" and is also known for his marriage?",Brendan Gleeson
subgraphs_batch_022_textual_subgraph_0096.graphml,"Who is the male actor from Great Britain, known for his work in ""Iron Man 3"" and affiliated with Judaism?",Stan Lee
subgraphs_batch_022_textual_subgraph_0102.graphml,Who is the male screenwriter that has won awards like Aaron Sorkin and has been nominated for the Primetime Emmy Award for Outstanding Directing - Drama Series?,John Wells
subgraphs_batch_022_textual_subgraph_0105.graphml,Who is the film producer from GB known for their cameo appearances and nominated for both the MTV Movie Award for Best Fight and the Hong Kong Film Award for Best Director?,Stephen Chow
subgraphs_batch_022_textual_subgraph_0107.graphml,"Who is the male writer from Great Britain, affiliated with Judaism, who contributed to the film ""Iron Man 3""?",Stan Lee
subgraphs_batch_022_textual_subgraph_0101.graphml,"Who is the film producer from the United States known for their work on ""Girl, Interrupted"" and their association with Britney Spears?",Jared Leto
subgraphs_batch_022_textual_subgraph_0104.graphml,Who is the male record producer from Great Britain who has lived in Manhattan and is known for his marriage?,Adam Horovitz
subgraphs_batch_022_textual_subgraph_0106.graphml,"Who is the person that has won awards like Steve Ditko, was involved in the film ""The Amazing Spider-Man,"" is married, and works as a screenwriter?",Stan Lee
subgraphs_batch_022_textual_subgraph_0112.graphml,"Who is the male screenwriter known for his work on ""The Avengers"" film and is affiliated with Judaism in Great Britain?",Stan Lee
subgraphs_batch_022_textual_subgraph_0111.graphml,"Who is the American film director and television producer, known for their work as an executive producer on TV programs, and also has a connection to television production in Great Britain?",Marc Cherry
subgraphs_batch_022_textual_subgraph_0116.graphml,"Who is the male actor known for his roles in the films ""X2"" and ""Emma,"" and has been married?",Alan Cumming
subgraphs_batch_022_textual_subgraph_0114.graphml,"Who is the British actor who has won awards like Stacy Keach and received nominations for the film Alfie, and is also known for his marriages?",Michael Caine
subgraphs_batch_022_textual_subgraph_0113.graphml,"Who is the male individual known for his association with the films ""X-Men: The Last Stand"" and ""X-Men,"" and is also recognized for his marital status?",Stan Lee
subgraphs_batch_022_textual_subgraph_0115.graphml,"Who is the person known for playing slide guitar and bass, has been married, and is also recognized as a British actor?",John Paul Jones
subgraphs_batch_022_textual_subgraph_0117.graphml,Who is the male television producer from Great Britain who has won awards attributed to Jack Bender and received award nominations associated with David Fury?,Bryan Burk
subgraphs_batch_022_textual_subgraph_0110.graphml,"Who is the actor from Great Britain known for appearing in both ""Iron Man 3"" and ""The Avengers,"" and is also related to someone through marriage?",Stan Lee
subgraphs_batch_022_textual_subgraph_0121.graphml,Who is the male film producer from Great Britain who was married to both June Allyson and Joan Blondell?,Dick Powell
subgraphs_batch_022_textual_subgraph_0118.graphml,"Who is the individual known for their work on the X-Men film, is affiliated with Judaism, and is part of the Jewish community, also having been married?",Stan Lee
subgraphs_batch_022_textual_subgraph_0119.graphml,"Who is the writer known for contributing to films like ""X-Men: The Last Stand"" and ""The Avengers,"" and is also recognized for their personal life involving marriage?",Stan Lee
subgraphs_batch_022_textual_subgraph_0108.graphml,"Who is the person born in the United States, known for their work on ""The Amazing Spider-Man"" film, and is both a screenwriter and someone who has been married?",Stan Lee
subgraphs_batch_022_textual_subgraph_0123.graphml,"Who is the actor from Great Britain who was born in Minneapolis, has been nominated for awards alongside Dawn French, and is known for their marriages?",Terry Gilliam
subgraphs_batch_022_textual_subgraph_0128.graphml,Who is the male writer from Great Britain who provided a voice for The Avengers film?,Stan Lee
subgraphs_batch_022_textual_subgraph_0122.graphml,"Who is the actor born in the United States, known for his work on ""The Avengers"" and his affiliation with Judaism?",Stan Lee
subgraphs_batch_022_textual_subgraph_0130.graphml,Who is the person that provided a voice for The Incredible Hulk film and also worked as a film producer and screenwriter?,Stan Lee
subgraphs_batch_022_textual_subgraph_0126.graphml,Who is the film producer from Great Britain who has won awards alongside Walter Matthau and has been married?,Jack Lemmon
subgraphs_batch_022_textual_subgraph_0125.graphml,"Who is the male actor from the United Kingdom who starred in the film ""Ryan's Daughter"" and is known for his marriage?",Trevor Howard
subgraphs_batch_022_textual_subgraph_0120.graphml,Who is the male Indian national born in Jaipur and known for his marriage?,Asrani
subgraphs_batch_022_textual_subgraph_0137.graphml,Who is the male vegetarian influenced by Lenny Bruce and known for his marriage?,Russell Brand
subgraphs_batch_022_textual_subgraph_0127.graphml,"Who is the individual that was born in New York City, has a connection to the films Hulk and X-Men, and is known for their marriage?",Stan Lee
subgraphs_batch_022_textual_subgraph_0129.graphml,"Who is the television producer from Great Britain who has won awards like Richard Culliton and received nominations like Michael Conforti, and is also known for their marriage?",Robert Guza Jr.
subgraphs_batch_022_textual_subgraph_0134.graphml,"Who is the screenwriter born in St. Louis, influenced by James Baldwin, and of United States nationality?",Maya Angelou
subgraphs_batch_022_textual_subgraph_0132.graphml,"Who is the actor from Great Britain who has been nominated for awards alongside Elijah Wood and Martin Sheen, and is married to someone from New York City?",David Krumholtz
subgraphs_batch_022_textual_subgraph_0138.graphml,Who is the male screenwriter that has been nominated for awards related to both B. J. Novak and the show Everybody Loves Raymond?,Aaron Shure
subgraphs_batch_022_textual_subgraph_0124.graphml,"Who is the screenwriter married to someone and has been nominated for a BAFTA Academy Fellowship Award, also known for their involvement in the film adaptation of ""The Chronicles of Narnia: The Lion, the Witch and the Wardrobe""?",Dawn French
subgraphs_batch_022_textual_subgraph_0136.graphml,"Who is the actor known for speaking both Hindi and Telugu, and is also recognized for their marital status in the film industry?",Sunny Deol
subgraphs_batch_022_textual_subgraph_0135.graphml,"Who is the male individual from the United States who has a connection to both ""The Avengers"" and ""Iron Man 3"" films?",Stan Lee
subgraphs_batch_022_textual_subgraph_0139.graphml,"Who is the male actor from Great Britain known for his role in the film ""Flags of Our Fathers"" and has also worked as a model?",Paul Walker
subgraphs_batch_022_textual_subgraph_0133.graphml,"Which male individual, known for his association with both ""X-Men: The Last Stand"" and the original ""X-Men"" films, also has a notable connection to the concept of marriage?",Stan Lee
subgraphs_batch_022_textual_subgraph_0145.graphml,Who is the male film director and screenwriter known for his work with streaming media distributors?,Uwe Boll
subgraphs_batch_022_textual_subgraph_0147.graphml,Who was the male actor from India who passed away in Thiruvananthapuram?,Murali
subgraphs_batch_022_textual_subgraph_0131.graphml,Who is the male actor from Great Britain known for his work on the X-Men films and has an extra role related to the United States Dollar?,Stan Lee
subgraphs_batch_022_textual_subgraph_0146.graphml,"Who is the male screenwriter born in Houston and known for the film ""Dazed and Confused""?",Richard Linklater
subgraphs_batch_022_textual_subgraph_0140.graphml,"Who is the film producer from the United States who has collaborated with Christina Ricci and contributed to the track ""Melodica""?",Michael Stipe
subgraphs_batch_022_textual_subgraph_0141.graphml,Who is the male individual from the United Kingdom who was nominated for an Academy Award for Best Original Song and is also known for his marriage?,Friedrich Hollaender
subgraphs_batch_022_textual_subgraph_0143.graphml,"Who is the person known for being a voice actor in the X-Men films, and is also recognized as an actor and film producer from Great Britain?",Stan Lee
subgraphs_batch_022_textual_subgraph_0149.graphml,Who is the male actor from Great Britain who has been associated with both the X-Men and The Avengers film series?,Stan Lee
subgraphs_batch_022_textual_subgraph_0152.graphml,Who is the television producer from the United States who has won awards like B. J. Novak and received award nominations similar to Paul Feig?,Justin Spitzer
subgraphs_batch_022_textual_subgraph_0144.graphml,"Who is the screenwriter from the United States who has won award nominations for HBO and wrote the film ""Sex and the City 2""?",Michael Patrick King
subgraphs_batch_022_textual_subgraph_0159.graphml,Who was the male film producer from Great Britain who was born in Chicago and passed away in West Hollywood?,Ray Stark
subgraphs_batch_022_textual_subgraph_0148.graphml,Who is the screenwriter from the United States who worked on Iron Man 3 and is known for their marriage?,Stan Lee
subgraphs_batch_022_textual_subgraph_0155.graphml,Who is the male screenwriter that has won awards like Barry Pepper and is affiliated with Heather Graham?,Edward Burns
subgraphs_batch_022_textual_subgraph_0142.graphml,"Who is the male actor known for his role in films that earned him a Filmfare Award for Best Supporting Actor and has an official webpage, also recognized for his profession as an actor?",Prem Chopra
subgraphs_batch_022_textual_subgraph_0150.graphml,"Who is the actor known for their role in ""The Hangover"" and has won awards alongside Jenna Fischer, also working as a screenwriter and a television producer in Great Britain?",Ed Helms
subgraphs_batch_022_textual_subgraph_0165.graphml,Who is the male voice actor who practices Judaism and is married?,Stan Lee
subgraphs_batch_022_textual_subgraph_0157.graphml,Which male individual from the United States is known for his involvement with films like X-Men and Iron Man 3?,Stan Lee
subgraphs_batch_022_textual_subgraph_0161.graphml,Who is the American voice actor and film producer known for their role in Iron Man 3?,Stan Lee
subgraphs_batch_022_textual_subgraph_0167.graphml,"Who is the American screenwriter known for their work on ""Iron Man 3"" and affiliation with Judaism?",Stan Lee
subgraphs_batch_022_textual_subgraph_0158.graphml,"Who is the male voice actor known for his work in ""X-Men: The Last Stand"" and is also associated with Jewish heritage?",Stan Lee
subgraphs_batch_022_textual_subgraph_0151.graphml,"Who is the individual that has been nominated for awards for both Tess and Rosemary's Baby, and is also associated with Jewish heritage and has a spouse related to the concept of marriage?",Roman Polanski
subgraphs_batch_022_textual_subgraph_0156.graphml,Who is the male actor from the United States who has lived in New Jersey and won awards alongside Keir Dullea?,Joe Pesci
subgraphs_batch_022_textual_subgraph_0154.graphml,"Who is the actor known for their roles in ""Batman Forever"" and ""The Grifters,"" and is also recognized for their profession as an actor from Great Britain and their marital status?",Pat Hingle
subgraphs_batch_022_textual_subgraph_0162.graphml,"Who is the voice actor known for their work in the X-Men films, was born in New York City, and has a notable marriage?",Stan Lee
subgraphs_batch_022_textual_subgraph_0163.graphml,"Who is the male individual from the United States of America who has a connection to both ""Iron Man 3"" and ""The Avengers""?",Stan Lee
subgraphs_batch_022_textual_subgraph_0172.graphml,Who is the screenwriter from the United States who has contributed to films like Spider-Man 3 and Iron Man?,Stan Lee
subgraphs_batch_022_textual_subgraph_0166.graphml,"Who is the male individual born in New York City, affiliated with the United States of America, and has won awards like Steve Ditko?",Stan Lee
subgraphs_batch_022_textual_subgraph_0171.graphml,"Who is the male individual born in Watford, England, and known for being married?",Vinnie Jones
subgraphs_batch_022_textual_subgraph_0174.graphml,"Which male actor from Great Britain has appeared in both ""Iron Man 3"" and ""The Amazing Spider-Man""?",Stan Lee
subgraphs_batch_022_textual_subgraph_0169.graphml,"Who is the screenwriter known for their work on ""Spider-Man 3"" and is also a prominent figure in the Jewish community, practicing Judaism?",Stan Lee
subgraphs_batch_022_textual_subgraph_0170.graphml,"Who is the male film producer from Great Britain who has been nominated for awards for the movie ""Waterworld"" and is affiliated with Universal Studios?",Lawrence Gordon
subgraphs_batch_022_textual_subgraph_0153.graphml,"Who is the actor known for being nominated for both the Primetime Emmy Award for Outstanding Guest Actor in a Drama Series and the Primetime Emmy Award for Outstanding Lead Actor in a Drama Series, and is also recognized for his marriage and British nationality?",Edward Woodward
subgraphs_batch_022_textual_subgraph_0176.graphml,"Which male Jewish individual, known for his connection to ""The Amazing Spider-Man"" film, also practices Judaism?",Stan Lee
subgraphs_batch_022_textual_subgraph_0168.graphml,"Which actor, born in the United States and known for his role in the film ""The Host,"" was nominated for a Razzie Award for Worst Supporting Actor and is also recognized for his profession as an Actor from Great Britain?",Scott Wilson
subgraphs_batch_022_textual_subgraph_0173.graphml,"Which male individual from the United States is known for his affiliation with both ""Iron Man 3"" and ""The Amazing Spider-Man""?",Stan Lee
subgraphs_batch_022_textual_subgraph_0175.graphml,Who is the male screenwriter from England who has been nominated for a Writers Guild of America Award for Best Adapted Screenplay?,Ian La Frenais
subgraphs_batch_022_textual_subgraph_0164.graphml,"Who is the male individual who has been involved in the creation of both ""The Incredible Hulk"" and ""Iron Man 3"" films and is also known for his marital status?",Stan Lee
subgraphs_batch_022_textual_subgraph_0160.graphml,"Which person is both associated with the films ""Iron Man 3"" and ""The Avengers"" and is known for their acting profession in Great Britain, as well as being in a marriage relationship?",Stan Lee
subgraphs_batch_022_textual_subgraph_0180.graphml,"Who was the person born in Bucharest, affiliated with Jewish people, and known for their role in the film ""The Prize"" as well as being married?",Edward G. Robinson
subgraphs_batch_022_textual_subgraph_0183.graphml,Who is the male playwright and film director from Great Britain who is also known for his marriage?,Wim Wenders
subgraphs_batch_022_textual_subgraph_0181.graphml,"Who is the male actor from Great Britain, born in Melbourne, who was influenced by Allen Ginsberg?",Jim Morrison
subgraphs_batch_022_textual_subgraph_0184.graphml,"Who is the artist known for their contributions to bass tracks, a member of Funkadelic, and also recognized as a British actor who has been married?",Bootsy Collins
subgraphs_batch_022_textual_subgraph_0179.graphml,"Which male actor from Great Britain is known for making appearances in both ""Iron Man 3"" and ""Spider-Man 3""?",Stan Lee
subgraphs_batch_022_textual_subgraph_0182.graphml,Who is the individual known for both writing for the X-Men and Iron Man films and working as a screenwriter and television producer in Great Britain?,Stan Lee
subgraphs_batch_022_textual_subgraph_0185.graphml,Who is the voice actor and writer from Great Britain who was born in New York City and has an extra role related to the United States Dollar?,Stan Lee
subgraphs_batch_022_textual_subgraph_0178.graphml,"Who is the person that was married to their spouse, worked as an actor in Great Britain, and also held professions as a screenwriter and a film producer in Great Britain?",Stan Lee
subgraphs_batch_022_textual_subgraph_0177.graphml,"Who is the actor born in the United States, known for their role in Iron Man 3, and affiliated with Judaism?",Stan Lee
subgraphs_batch_022_textual_subgraph_0188.graphml,"Who is the actor from Great Britain, born in Richmond, known for their bass contributions to tracks, and currently married?",Les Claypool
subgraphs_batch_022_textual_subgraph_0186.graphml,Who is the person that not only provided the voice for Iron Man 3 but also excelled as a film producer from Great Britain and a screenwriter?,Stan Lee
subgraphs_batch_022_textual_subgraph_0189.graphml,"Who is the male individual who is related to both ""Iron Man 3"" and ""The Avengers"" and has been involved in a marriage?",Stan Lee
subgraphs_batch_022_textual_subgraph_0187.graphml,"Who was the individual born in Vienna, buried in Forest Lawn Memorial Park, known for their marriages, and associated with Jewish heritage?",Fritz Lang
subgraphs_batch_022_textual_subgraph_0192.graphml,"Who is the male actor from the United States who was nominated for an award for his role in the film ""3:10 to Yuma""?",Alan Tudyk
subgraphs_batch_022_textual_subgraph_0190.graphml,"Who is the person that was born in Denver, has a background in national security films, and is known for being both a screenwriter and a television producer in Great Britain?",Martin Lawrence
subgraphs_batch_022_textual_subgraph_0191.graphml,"Who is the male actor known for his roles in the films ""I am Here"" and ""O.S.O.,"" and also recognized for making a cameo appearance in another film?",Shahrukh Khan
subgraphs_batch_022_textual_subgraph_0194.graphml,Who is the screenwriter from the United States who is associated with celebrities like Seth Meyers and John Krasinski?,Rashida Jones
