file,query,answer
subgraphs_batch_016_textual_subgraph_0047.graphml,"Which film was produced by Judd Apatow, released in Portugal and Australia, and had nominees for the BAFTA Award for Best Actress in a Supporting Role?",Bridesmaids
subgraphs_batch_016_textual_subgraph_0067.graphml,"Which film was distributed in the United Kingdom, released in Slovenia, and is related to the English language and the United States of America?",Bridesmaids
subgraphs_batch_016_textual_subgraph_0075.graphml,"Which film was released in Belgium and on DVD, and is also associated with the English language and the United States?",Bridesmaids
subgraphs_batch_016_textual_subgraph_0069.graphml,"Who is the female personality known for her marriage and proficiency in the English language, and who holds American nationality?",Bea Arthur
subgraphs_batch_016_textual_subgraph_0062.graphml,"Which film, featuring a nominee for the Academy Award for Best Actress in a Supporting Role and supervised by a visual effects expert, was released in Belgium and has a significant connection to the United States?",Bridesmaids
subgraphs_batch_016_textual_subgraph_0066.graphml,"Which film, featuring music by Alan Menken and falling under the genre of costume drama, was released in the United States and primarily spoken in English?",Pocahontas
subgraphs_batch_016_textual_subgraph_0058.graphml,"Which screenwriter has been nominated for both the Independent Spirit Award for Best Screenplay and the Academy Award for Best Original Screenplay, as well as the Writers Guild of America Award for Best Original Screenplay, and is associated with Scott Rudin?",Joel Coen
subgraphs_batch_016_textual_subgraph_0074.graphml,"Which film features Ellie Kemper, was released in the Republic of Ireland, is in the English language, and had a nominee for the Academy Award for Best Actress in a Supporting Role?",Bridesmaids
subgraphs_batch_016_textual_subgraph_0076.graphml,"Which film was produced by Robert Altman, featured a Special Effects Supervisor and a Sound Mixer, and is associated with the United States of America?",Cookie's Fortune
subgraphs_batch_016_textual_subgraph_0070.graphml,"Who is the filmmaker born in the United States, known for being nominated for both the BAFTA Award for Best Direction and the Academy Award for Best Original Screenplay, and is also recognized for their marriage to a notable individual?",M. Night Shyamalan
subgraphs_batch_016_textual_subgraph_0073.graphml,"Which film, featuring Kristen Wiig as an award-winning actress, was released in both Italy and Belgium and is primarily in the English language?",Bridesmaids
subgraphs_batch_016_textual_subgraph_0068.graphml,"Which film features Jon Hamm in a role that earned him an award nomination, was distributed in the United Kingdom, and had a nominee for the MTV Movie Award for Best Villain, all while being primarily in the English language?",Bridesmaids
subgraphs_batch_016_textual_subgraph_0072.graphml,"Who is the British individual known for their work as both a television producer and an author, and has been nominated for the MTV Movie Award for Best Comedic Performance while being influenced by Judd Apatow?",Steve Martin
subgraphs_batch_016_textual_subgraph_0079.graphml,"Which film, produced by Regency Enterprises and featuring the genre of drama, was primarily in the English language and had a notable makeup artist from Great Britain on its crew?",Six Degrees of Separation
subgraphs_batch_016_textual_subgraph_0065.graphml,"Which film was released in the Republic of Ireland, had an estimated budget in United States Dollars, and was nominated for the Writers Guild of America Award for Best Original Screenplay, while being closely associated with the United States of America?",Bridesmaids
subgraphs_batch_016_textual_subgraph_0086.graphml,"Which film, featuring a Visual Effects Supervisor from Germany and released on DVD, is also associated with the United States of America?",Bridesmaids
subgraphs_batch_016_textual_subgraph_0083.graphml,"Which film has won the BFCA Critics' Choice Award for Best Comedy, was released in the Republic of Ireland, is related to the United States of America, and is primarily in the English language?",Bridesmaids
subgraphs_batch_016_textual_subgraph_0071.graphml,"Which actress has won awards alongside Matt Damon, received nominations for her role in The Departed, and was also nominated for both the Screen Actors Guild Award for Outstanding Performance by a Female Actor in a Supporting Role and the Broadcast Film Critics Association Award for Best Supporting Actress?",Vera Farmiga
subgraphs_batch_016_textual_subgraph_0080.graphml,"Which actress has been nominated for both the Broadcast Film Critics Association Award for Best Supporting Actress and the BAFTA Award for Best Actress in a Supporting Role, and shares award nominations with Craig T. Nelson and William Fichtner?",Holly Hunter
subgraphs_batch_016_textual_subgraph_0081.graphml,"Which actress, celebrated for her performances alongside Topher Grace and Linda Cardellini, has won both the Broadcast Film Critics Association Award for Best Supporting Actress and the Screen Actors Guild Award for Outstanding Performance by a Female Actor in a Supporting Role?",Anne Hathaway
subgraphs_batch_016_textual_subgraph_0084.graphml,"Who is the actress who lived in Raleigh, was married to Robert Wagner, and was nominated for the Academy Award for Best Actress in a Supporting Role, all while being fluent in English?",Natalie Wood
subgraphs_batch_016_textual_subgraph_0077.graphml,"Which film was released in Portugal and distributed in the United Kingdom, and also had nominees for both the Broadcast Film Critics Association Award for Best Supporting Actress and the BAFTA Award for Best Actress in a Supporting Role?",Bridesmaids
subgraphs_batch_016_textual_subgraph_0087.graphml,"What film was produced by Alex Gibney, features personal appearances by George W. Bush, is in the English language, and is related to the United States?",Enron: The Smartest Guys in the Room-GB
subgraphs_batch_016_textual_subgraph_0085.graphml,"Which film, distributed in the United Kingdom and released in the Republic of Ireland, was nominated for the Broadcast Film Critics Association Award for Best Cast and won the MTV Movie Award for Best WTF Moment?",Bridesmaids
subgraphs_batch_016_textual_subgraph_0093.graphml,"Which film was released in Slovenia and Belgium, and is also associated with the United States of America and had a DVD release date?",Bridesmaids
subgraphs_batch_016_textual_subgraph_0078.graphml,"Who is the actress who was born in the United States and has been nominated for a BAFTA Award for Best Actress in a Supporting Role, known for her roles in both ""Edward Scissorhands"" and ""Star Trek""?",Winona Ryder
subgraphs_batch_016_textual_subgraph_0094.graphml,"Which film has a Visual Effects Supervisor, was released in Malaysia, is in the English language, and has an estimated budget in United States Dollars?",Bridesmaids
subgraphs_batch_016_textual_subgraph_0090.graphml,"Which film was released in both the Republic of Ireland and Portugal, and also received nominations for the Academy Award for Best Original Screenplay and the Producers Guild of America Award for Best Theatrical Motion Picture?",Bridesmaids
subgraphs_batch_016_textual_subgraph_0089.graphml,"Which film was distributed in the United Kingdom, won the BFCA Critics' Choice Award for Best Comedy, and had release dates in both Poland and Hungary?",Bridesmaids
subgraphs_batch_016_textual_subgraph_0096.graphml,"Which film, featuring Olympia Dukakis as an award-winning actress, blends both drama and comedy genres and is associated with the United States of America?",Moonstruck
subgraphs_batch_016_textual_subgraph_0098.graphml,"Which film features a crew that includes both a Special Effects Supervisor and a Visual Effects Supervisor, and is associated with the United States of America?",The Kite Runner
subgraphs_batch_016_textual_subgraph_0092.graphml,"Which film was released in the Republic of Ireland and features Ellie Kemper, who won awards for her performance, and was also nominated for both the Broadcast Film Critics Association Award for Best Supporting Actress and the Academy Award for Best Actress in a Supporting Role?",Bridesmaids
subgraphs_batch_016_textual_subgraph_0095.graphml,"Which film was released in Germany and Belgium, and is associated with the United States, as well as having nominees for the Academy Award for Best Actress in a Supporting Role?",Bridesmaids
subgraphs_batch_016_textual_subgraph_0088.graphml,"Which film, featuring Ellie Kemper and nominated for the Screen Actors Guild Award for Outstanding Performance by a Female Actor in a Supporting Role, was released in the Republic of Ireland and is associated with the United States of America?",Bridesmaids
subgraphs_batch_016_textual_subgraph_0091.graphml,"Which film was distributed in the United Kingdom, released in the Republic of Ireland, and had its screenplay nominated for a Writers Guild of America Award, while also being closely associated with the United States?",Bridesmaids
subgraphs_batch_016_textual_subgraph_0082.graphml,"Which film, released in the Republic of Ireland, features Ellie Kemper and was nominated for both the Screen Actors Guild Award for Outstanding Performance by a Female Actor in a Supporting Role and the BAFTA Award for Best Actress in a Supporting Role?",Bridesmaids
subgraphs_batch_016_textual_subgraph_0097.graphml,"Which film, set in Philadelphia, won the Satellite Award for Best Original Screenplay and was nominated for an Academy Award in the same category, also involving a notable sound mixer in its crew?",The Sixth Sense
subgraphs_batch_016_textual_subgraph_0103.graphml,"Which film features Ellie Kemper among its award winners, was released in the Republic of Ireland, and has nominees for the Writers Guild of America Award for Best Original Screenplay, while being closely associated with the United States?",Bridesmaids
subgraphs_batch_016_textual_subgraph_0104.graphml,"Which film was released in Portugal and the Republic of Ireland, and had nominees for the BAFTA Award for Best Actress in a Supporting Role, with distributors in the United Kingdom?",Bridesmaids
subgraphs_batch_016_textual_subgraph_0100.graphml,"Who is the record producer from Great Britain who has been nominated for awards alongside Elton John and has also been honored at the 38th People's Choice Awards, hailing from the United States?",Lady Gaga
subgraphs_batch_016_textual_subgraph_0108.graphml,"Which film was released in Chile, is associated with the United States, and had both a Visual Effects Supervisor and a Sound Mixer on its crew?",Bridesmaids
subgraphs_batch_016_textual_subgraph_0115.graphml,"What drama film produced by Michael Mann, released on DVD, and primarily in the English language are we referring to?",The Kingdom
subgraphs_batch_016_textual_subgraph_0102.graphml,"Which American TV show, primarily in English, has won a Primetime Emmy Award for Outstanding Supporting Actor - Drama Series with Fyvush Finkel as one of its recipients?",Picket Fences
subgraphs_batch_016_textual_subgraph_0109.graphml,"Which film was released in both Chile and Belgium and involved a sound mixer, while also being associated with the United States?",Bridesmaids
subgraphs_batch_016_textual_subgraph_0118.graphml,"Which comedy film was released in Germany and distributed in the United Kingdom, and also had a DVD release date?",Bridesmaids
subgraphs_batch_016_textual_subgraph_0106.graphml,"Which film was released in Belgium, had a Visual Effects Supervisor, was executive produced by Paul Feig, and is related to the United States of America?",Bridesmaids
subgraphs_batch_016_textual_subgraph_0114.graphml,"Which film features an Art Director and Sound Mixer in its crew, is produced by Davis Entertainment, and has a runtime associated with the United States of America?",Marmaduke
subgraphs_batch_016_textual_subgraph_0110.graphml,"Which individual has won both the Academy Award for Best Actor in a Supporting Role and the Academy Award for Best Writing Adapted Screenplay, and is associated with films released in the United States of America and primarily in the English language?",Julia
subgraphs_batch_016_textual_subgraph_0105.graphml,"Which film has won the BFCA Critics' Choice Award for Best Comedy, was made with an estimated budget in United States Dollars, is related to the United States of America, and is primarily in the English Language?",Bridesmaids
subgraphs_batch_016_textual_subgraph_0099.graphml,"Which individual is connected to both ""The Curious Case of Benjamin Button"" and Peter Morgan in terms of award nominations, and is also associated with English language film dubbing performances and the Producers Guild of America Award for Best Theatrical Motion Picture?",Frank Marshall
subgraphs_batch_016_textual_subgraph_0121.graphml,"Which comedy film, associated with both the United States and Germany, was released on DVD in Germany?",Bridesmaids
subgraphs_batch_016_textual_subgraph_0101.graphml,"Who is the actor that has been nominated for the MTV Movie Award for Best Comedic Performance, starred in ""The Lost World: Jurassic Park,"" and speaks English, also sharing a connection with Stephen Root in terms of award nominations?",Vince Vaughn
subgraphs_batch_016_textual_subgraph_0112.graphml,"Which actress has been nominated for the Academy Award for Best Actress in a Supporting Role and won the Screen Actors Guild Award for Outstanding Performance by a Female Actor in a Supporting Role, while also being associated with Guy Pearce's award nominations and Gloria Stuart's award wins?",Kim Basinger
subgraphs_batch_016_textual_subgraph_0117.graphml,"Which film features costume design by Dorothy Jeakins, has won awards for Lawrence of Arabia, is in the English language, and was released on DVD?",The Music Man
subgraphs_batch_016_textual_subgraph_0124.graphml,"Which film was released in Malaysia and Australia, and is available in English and on DVD?",Bridesmaids
subgraphs_batch_016_textual_subgraph_0122.graphml,"Which film featuring Ellie Kemper and Kristen Wiig, known for its comedic genre and with an estimated budget in United States Dollars, has both actresses winning awards for their performances?",Bridesmaids
subgraphs_batch_016_textual_subgraph_0113.graphml,"Who is the actress who has been nominated for an award alongside Josh Lucas and is married to someone from Scotland, having also won both the Academy Award for Best Actress in a Supporting Role and the Broadcast Film Critics Association Award for Best Supporting Actress?",Jennifer Connelly
subgraphs_batch_016_textual_subgraph_0119.graphml,"Which martial arts film, born in Hong Kong and featuring a Visual Effects Supervisor, has won the Hong Kong Film Award for Best Action Choreography?",Ip Man
subgraphs_batch_016_textual_subgraph_0127.graphml,"Which film, known for its stop-motion animation and inclusion in the National Film Registry, was released on DVD and primarily spoken in English?",King Kong
subgraphs_batch_016_textual_subgraph_0120.graphml,"Which film, featuring Rose Byrne in a role that earned her an award nomination, is a comedy released in Germany and primarily in the English language?",Bridesmaids
subgraphs_batch_016_textual_subgraph_0116.graphml,"Which film was distributed in the United Kingdom, released in the Republic of Ireland, nominated for the MTV Movie Award for Best Comedic Performance, and is in the English language?",Bridesmaids
subgraphs_batch_016_textual_subgraph_0130.graphml,"Which film was released in both Malaysia and Australia, has an estimated budget in United States Dollars, and is primarily in the English language?",Bridesmaids
subgraphs_batch_016_textual_subgraph_0126.graphml,"Which film, featuring makeup work by a British artist and released in the United States, has its official website and won awards for Howard Shore?",Eastern Promises
subgraphs_batch_016_textual_subgraph_0128.graphml,Which animated TV show that combines comedy and was born in the United States has won a Peabody Award?,Animaniacs
subgraphs_batch_016_textual_subgraph_0131.graphml,"Which TV show combines the genres of romance and period piece, is primarily in English, and originates from the United States?",That '70s Show
subgraphs_batch_016_textual_subgraph_0107.graphml,"Which actress, known for her role in ""The Mask"" and nominated for both the Screen Actors Guild Award for Outstanding Performance by a Female Actor in a Supporting Role and the MTV Movie Award for Best Comedic Performance, is also associated with Mike Myers in the context of award nominations?",Cameron Diaz
subgraphs_batch_016_textual_subgraph_0135.graphml,"Which horror film features Gary Rydstrom as part of its crew, includes a sound mixer, and is primarily in the English language?",The Haunting
subgraphs_batch_016_textual_subgraph_0137.graphml,"Which comedy film, originally from the UK and released in Germany, is also connected to the United States and had a DVD release date?",Bridesmaids
subgraphs_batch_016_textual_subgraph_0134.graphml,"Which film was written by Robert Rodriguez, won a Razzie Award for Worst Supporting Actress, and was made in English with an estimated budget in United States Dollars?",Four Rooms
subgraphs_batch_016_textual_subgraph_0123.graphml,"What film has release dates in Belgium and Poland, and is associated with both a DVD release and a Visual Effects Supervisor in its crew?",Bridesmaids
subgraphs_batch_016_textual_subgraph_0111.graphml,"Who is the screenwriter born in New York City who has been nominated for an Academy Award for Best Writing Adapted Screenplay, won a BAFTA Award for Best Original Screenplay, and received a nomination for a Writers Guild of America Award for Best Original Screenplay?",Charlie Kaufman
subgraphs_batch_016_textual_subgraph_0129.graphml,"Which film, released in the Republic of Ireland, won the BFCA Critics' Choice Award for Best Comedy and was nominated for the Broadcast Film Critics Association Award for Best Cast, also being closely associated with the United States of America?",Bridesmaids
subgraphs_batch_016_textual_subgraph_0141.graphml,"Which comedy film was released in Belgium and the United States, and also became available on DVD?",Bridesmaids
subgraphs_batch_016_textual_subgraph_0138.graphml,"Which film was distributed in the United Kingdom, released in Mexico and on DVD, and falls under the genre of British comedy?",Bridesmaids
subgraphs_batch_016_textual_subgraph_0132.graphml,"Which historical fiction film, released on DVD and featuring the English language, has won awards from HBO?",John Adams
subgraphs_batch_016_textual_subgraph_0150.graphml,Which English-language comedy film was released in Germany and also became available on DVD?,Bridesmaids
subgraphs_batch_016_textual_subgraph_0145.graphml,"What film was released in Germany, distributed in the United Kingdom, produced in the United States, and primarily spoken in English?",Bridesmaids
subgraphs_batch_016_textual_subgraph_0143.graphml,"Which film features a collaboration between distributors in the United Kingdom, a Visual Effects Supervisor, a Sound Mixer, and a Makeup Artist from Great Britain?",Bridesmaids
subgraphs_batch_016_textual_subgraph_0136.graphml,"Which film features Ellie Kemper and was distributed in the United Kingdom, also earning nominations for the BAFTA Award for Best Actress in a Supporting Role and the Screen Actors Guild Award for Outstanding Performance by a Female Actor in a Supporting Role?",Bridesmaids
subgraphs_batch_016_textual_subgraph_0125.graphml,"Which film, shot in English and with an estimated budget in United States Dollars, has won the BFCA Critics' Choice Award for Best Comedy and had a nominee for the Screen Actors Guild Award for Outstanding Performance by a Female Actor in a Supporting Role?",Bridesmaids
subgraphs_batch_016_textual_subgraph_0142.graphml,"What film was released in Belgium, had a Visual Effects Supervisor, is in the English language, and is related to the United States?",Bridesmaids
subgraphs_batch_016_textual_subgraph_0144.graphml,Who is the vegetarian actress born in Australia who has been nominated for both a BAFTA Award for Best Actress in a Supporting Role and an award alongside Abigail Breslin?,Toni Collette
subgraphs_batch_016_textual_subgraph_0140.graphml,"Which film, produced by Judd Apatow and released in Malaysia, was nominated for both the BAFTA Award for Best Original Screenplay and the Academy Award for Best Original Screenplay?",Bridesmaids
subgraphs_batch_016_textual_subgraph_0146.graphml,"Which film, nominated for both the Frenzy and Rope awards, is set in the United States and primarily spoken in English?",Saboteur
subgraphs_batch_016_textual_subgraph_0139.graphml,"Which film, released in Brazil and featuring Kristen Wiig as an award-winning actress, also includes a makeup artist from Great Britain and is associated with the United States of America?",Bridesmaids
subgraphs_batch_016_textual_subgraph_0148.graphml,"Which film, released in Chile and featuring Kristen Wiig as an award-winning actress, was primarily in English and had a notable Makeup Artist from Great Britain on its crew?",Bridesmaids
subgraphs_batch_016_textual_subgraph_0133.graphml,"Which film, released in the Republic of Ireland and celebrated with an MTV Movie Award for Best Comedic Performance, was also nominated for a Producers Guild of America Award for Best Theatrical Motion Picture and has a strong connection to the United States of America?",Bridesmaids
subgraphs_batch_016_textual_subgraph_0155.graphml,"Which film, set in Brooklyn and belonging to the drama genre, was released in the United States and primarily spoken in English?",Dog Day Afternoon
subgraphs_batch_016_textual_subgraph_0153.graphml,"Which comedy film, related to the United States and distributed in the United Kingdom, also had a release date in Germany?",Bridesmaids
subgraphs_batch_016_textual_subgraph_0147.graphml,"Which film features both a Special Effects crew and an Art Director, and has been nominated for both the MTV Movie Award for Best Movie and the Screen Actors Guild Award for Outstanding Performance by a Female Actor in a Supporting Role?",Good Will Hunting
subgraphs_batch_016_textual_subgraph_0152.graphml,"Which film, estimated to have a budget in United States Dollars and featuring Ellie Kemper as an award-winning actress, is also associated with the United States of America and has a title linked to Comedy-GB?",Bridesmaids
subgraphs_batch_016_textual_subgraph_0154.graphml,"Which musical film, featuring locations in Los Angeles and released on DVD in the United States, are we referring to?",The Runaways
subgraphs_batch_016_textual_subgraph_0156.graphml,"Which film was released in both Germany and Australia and also has a DVD release date, featuring a makeup artist from Great Britain in its crew?",Bridesmaids
subgraphs_batch_016_textual_subgraph_0149.graphml,"Which film was produced by Judd Apatow, distributed in the United Kingdom, and had nominees for both the Academy Award for Best Actress in a Supporting Role and the Screen Actors Guild Award for Outstanding Performance by a Female Actor in a Supporting Role?",Bridesmaids
subgraphs_batch_016_textual_subgraph_0151.graphml,"Which film, featuring Ellie Kemper and honored with the BFCA Critics' Choice Award for Best Comedy, is also connected to the United States and had a nominee for the BAFTA Award for Best Actress in a Supporting Role?",Bridesmaids
subgraphs_batch_016_textual_subgraph_0158.graphml,"Which black-and-white biographical film, released in the United States and primarily in English, is known for its powerful portrayal of a real-life figure?",Raging Bull
subgraphs_batch_016_textual_subgraph_0165.graphml,What English-language comedy film was released in Belgium and also made available on DVD?,Bridesmaids
subgraphs_batch_016_textual_subgraph_0160.graphml,"Which film was distributed in the United Kingdom, released in Mexico, falls under the genre of British comedy, and is associated with the United States of America?",Bridesmaids
subgraphs_batch_016_textual_subgraph_0162.graphml,"Which film was released in Belgium, won awards for Kristen Wiig, is in the English language, and had an estimated budget in United States Dollars?",Bridesmaids
subgraphs_batch_016_textual_subgraph_0157.graphml,"Which film, produced by Metro-Goldwyn-Mayer and classified as a romance, has won the BAFTA Award for Best Actress in a Supporting Role and was released in the United Kingdom?",The Go-Between-GB
subgraphs_batch_016_textual_subgraph_0167.graphml,"Which film has won the BFCA Critics' Choice Award for Best Comedy and was released in the Republic of Ireland, Germany, and Sweden?",Bridesmaids
subgraphs_batch_016_textual_subgraph_0164.graphml,"Which film was released in both Chile and Poland, is related to the United States of America, and was made in the English language?",Bridesmaids
subgraphs_batch_016_textual_subgraph_0159.graphml,"Which film, known for its thrilling suspense, has won awards for both Cliffhanger and The Specialist, is primarily in the English language, and is associated with the United States of America?",Lock Up
subgraphs_batch_016_textual_subgraph_0161.graphml,"Which popular TV show featured Henry Winkler and Ron Howard as regular cast members, was primarily in English, and originated in the United States?",Happy Days
subgraphs_batch_016_textual_subgraph_0166.graphml,"Who is the actress that has been nominated for the Academy Award for Best Actress in a Supporting Role alongside Mary Kay Place and Amy Brenneman, and is known for speaking English?",Glenn Close
subgraphs_batch_016_textual_subgraph_0169.graphml,"Which film was released in Mexico and Germany, falls under the genre of British comedy, and is associated with the United States?",Bridesmaids
