file,query,answer
subgraphs_batch_071_textual_subgraph_0799.graphml,"Which actor has appeared in films such as Twister, Aliens, The Terminator, and Spy Kids 3-D: Game Over?",Bill Paxton
subgraphs_batch_071_textual_subgraph_0796.graphml,"Which actress has won a Screen Actors Guild Award for Outstanding Performance by a Cast in a Motion Picture and appeared in both ""Planet of the Apes"" and ""Harry Potter and the Half-Blood Prince""?",Helena Bonham Carter
subgraphs_batch_071_textual_subgraph_0792.graphml,"Which actor, known for his roles in ""Nick and Norah's Infinite Playlist"" and ""Night at the Museum: Battle of the Smithsonian,"" was born in Canada and has won awards for his work in ""How to Train Your Dragon""?",Jay Baruchel
subgraphs_batch_071_textual_subgraph_0802.graphml,"What subject did both William Pitt the Younger and Joe Biden major in, and is also connected to the genres of the films ""The Count of Monte Cristo"" and ""Red Tails""?",History
subgraphs_batch_071_textual_subgraph_0804.graphml,"Which genre of film, associated with artists like Brendon Small and featuring in classics such as Starship Troopers and Ghostbusters II, remains a hidden gem in the world of cinema?",Satire
subgraphs_batch_071_textual_subgraph_0801.graphml,"Which award is associated with nominees from movies like ""The Hangover,"" ""21 Jump Street,"" ""Transformers: Revenge of the Fallen,"" and ""Zombieland""?",MTV Movie Award for Best WTF Moment
subgraphs_batch_071_textual_subgraph_0818.graphml,"Which country won a gold medal at the 1976 Winter Olympics and is also associated with the release dates of both ""Star Wars Episode IV: A New Hope"" and ""A Better Tomorrow""?",West Germany
subgraphs_batch_071_textual_subgraph_0823.graphml,Which city is both home to Brad Pitt and serves as a backdrop for movies like Rush Hour 2 and Lethal Weapon 4?,Las Vegas
subgraphs_batch_071_textual_subgraph_0805.graphml,"What prestigious award is associated with nominees like ""Happy Feet"" and ""Waltz with Bashir,"" and has also recognized winners such as ""Rango"" and nominees like ""The Adventures of Tintin: The Secret of the Unicorn""?",BAFTA Award for Best Animated Film
subgraphs_batch_071_textual_subgraph_0811.graphml,"Who is the filmmaker who has been nominated for awards for both ""American Gangster"" and ""Leonard Dick,"" and is also known for directing ""Robin Hood"" and ""Kingdom of Heaven""?",Ridley Scott
subgraphs_batch_071_textual_subgraph_0820.graphml,"Which actor has appeared in films such as ""Frost/Nixon,"" ""Harry Potter and the Chamber of Secrets,"" ""The Hunger Games,"" and ""Captain America: The First Avenger""?",Toby Jones
subgraphs_batch_071_textual_subgraph_0807.graphml,"Which actor has won awards alongside Miranda Otto and Andy Serkis, and is also connected to the films ""The Lord of the Rings: The Fellowship of the Ring"" and ""The Lord of the Rings: The Two Towers"" through award nominations?",Billy Boyd
subgraphs_batch_071_textual_subgraph_0821.graphml,"Which country is known for hosting the 2012 Summer Olympics, is associated with the release of the films ""The Tourist"" and ""Super 8,"" and contains the city of Doha?",Qatar
subgraphs_batch_071_textual_subgraph_0813.graphml,"Which actor, known for their roles in ""Awakenings,"" ""xXx,"" and ""The Fast and the Furious: Tokyo Drift,"" is also associated with Nicole Kidman?",Vin Diesel
subgraphs_batch_071_textual_subgraph_0806.graphml,"Which actor has been nominated for awards alongside Bruce Greenwood and has won awards like Sean Bean, also being associated with the film ""The Bourne Supremacy"" and the ""Star Trek"" series?",Karl Urban
subgraphs_batch_071_textual_subgraph_0825.graphml,"Which Canadian actor, known for his roles in both ""Star Trek"" and ""Kung Fu Panda 2,"" has also won awards like Rory Cochrane?",Victor Garber
subgraphs_batch_071_textual_subgraph_0812.graphml,"Which award is associated with nominees from ""A Beautiful Mind,"" ""Traffic,"" ""Pirates of the Caribbean: The Curse of the Black Pearl,"" and ""Gladiator""?",Screen Actors Guild Award for Outstanding Performance by a Male Actor in a Leading Role
subgraphs_batch_071_textual_subgraph_0814.graphml,"Which award is associated with nominees from films such as ""The Sessions,"" ""Hope and Glory,"" ""Prizzi's Honor,"" and ""Skyfall""?",BAFTA Award for Best Actress in a Supporting Role
subgraphs_batch_071_textual_subgraph_0824.graphml,"Who is the actor that was nominated for awards alongside Dominic Monaghan and appeared in both the 1941 film and ""The Man with the Golden Gun""?",Christopher Lee
subgraphs_batch_071_textual_subgraph_0827.graphml,"Which filmmaker is connected to both Ali Larter and the creation of films like Inglourious Basterds, Kill Bill Volume 2, and Sin City?",Quentin Tarantino
subgraphs_batch_071_textual_subgraph_0810.graphml,"Which actor has been nominated for awards for their role in ""The Lord of the Rings: The Two Towers"" and has won awards alongside Billy Boyd, while also being part of the film ""Spy Kids 3-D: Game Over""?",Elijah Wood
subgraphs_batch_071_textual_subgraph_0808.graphml,"Which actor, known for his roles in both ""300"" and ""How to Train Your Dragon,"" has also been nominated for a Razzie Award for Worst Screen Couple/Ensemble and has lived in Glasgow?",Gerard Butler
subgraphs_batch_071_textual_subgraph_0809.graphml,"What genre of film is known for featuring titles like ""Trainspotting"" and ""American Splendor,"" and also shares characteristics with movies such as ""A Bridge Too Far"" and ""Super""?",Indie film
subgraphs_batch_071_textual_subgraph_0816.graphml,"Which city was born in Argentina, is affiliated with the sports team Boca Juniors, and has connections to the film releases of Green Lantern and Super 8?",Buenos Aires
subgraphs_batch_071_textual_subgraph_0822.graphml,"Which actor has been nominated for the National Society of Film Critics Award for Best Actor, starred alongside Courteney Cox, and appeared in both ""Batman Returns"" and ""Jackie Brown""?",Michael Keaton
subgraphs_batch_071_textual_subgraph_0826.graphml,"Who is the actor that has won a Screen Actors Guild Award for Outstanding Performance by a Cast in a Motion Picture, was nominated for the same award, and appeared in both ""Star Wars Episode I: The Phantom Menace"" and ""John Carter""?",Dominic West
subgraphs_batch_071_textual_subgraph_0828.graphml,"Which city is home to both the University of California, Hastings College of the Law and the University of California, San Francisco, and has also served as a filming location for the movies ""The Towering Inferno"" and ""The Rock""?",San Francisco
subgraphs_batch_071_textual_subgraph_0817.graphml,"Who is the actor that received a Broadcast Film Critics Association Award nomination for Best Supporting Actor for their role in ""Moulin Rouge!"" and also appeared in ""Indiana Jones and the Kingdom of the Crystal Skull"" and ""Harry Potter and the Half-Blood Prince""?",Jim Broadbent
subgraphs_batch_071_textual_subgraph_0831.graphml,"Which award is associated with nominees from movies like ""21 Jump Street,"" ""The Hangover,"" ""Zombieland,"" and ""Kiss Kiss Bang Bang""?",BFCA Critics' Choice Award for Best Comedy
subgraphs_batch_071_textual_subgraph_0815.graphml,"Which individual has been nominated for an Academy Award for Best Makeup and Hairstyling for their work on ""Albert Nobbs"" and has also contributed to the film crews of ""Tropic Thunder"" and ""Rocky Balboa""?",Matthew W. Mungle
subgraphs_batch_071_textual_subgraph_0833.graphml,"Who is the person born in the United States of America, has won awards like Scott Rudin, and was an executive producer for both Blade II and Rush Hour 2?",Michael DeLuca
subgraphs_batch_071_textual_subgraph_0829.graphml,"Which actor has been nominated for an award for his role in ""Big Fish"" and is also known for his appearances in ""The Bourne Ultimatum"" and ""Skyfall""?",Albert Finney
subgraphs_batch_071_textual_subgraph_0834.graphml,"Which country is situated in the Central European Time Zone, borders Albania, and is associated with the release dates of both ""The Lord of the Rings: The Two Towers"" and the film ""2012""?",Republic of Macedonia
subgraphs_batch_071_textual_subgraph_0832.graphml,"Which award has been won by both Bill Murray and Brad Pitt, and also seen nominations for performances in ""Patton"" and ""Butch Cassidy and the Sundance Kid""?",National Society of Film Critics Award for Best Actor
subgraphs_batch_071_textual_subgraph_0843.graphml,"Who is the television director married to a person and known for voicing characters in both ""The Incredibles"" and ""Brave""?",John Ratzenberger
subgraphs_batch_071_textual_subgraph_0835.graphml,"Which city experiences pleasant weather in October and April and has been featured as a filming location for both ""Sin City"" and ""Friday Night Lights""?",Austin
subgraphs_batch_071_textual_subgraph_0842.graphml,"Who is the male composer from the United States who worked on the music for both the film ""Resident Evil"" and ""I, Robot""?",Marco Beltrami
subgraphs_batch_071_textual_subgraph_0838.graphml,"Which actor has been nominated for awards for their roles in both ""Boogie Nights"" and ""Don Cheadle,"" and has also appeared in the films ""Planet of the Apes"" and ""The Other Guys""?",Mark Wahlberg
subgraphs_batch_071_textual_subgraph_0845.graphml,"Which prestigious award has recognized nominees from films like ""The Wrestler,"" ""Pretty Woman,"" ""Saving Private Ryan,"" and ""Looper""?",Writers Guild of America Award for Best Original Screenplay
subgraphs_batch_071_textual_subgraph_0849.graphml,"What film genre is associated with both Rambo and 300, and is also connected to Dataworld's split?",War film
subgraphs_batch_071_textual_subgraph_0830.graphml,"Which actor has won awards alongside Ian McKellen and Ian Holm, and is also connected to the films ""Indiana Jones and the Last Crusade"" and ""The Lord of the Rings: The Two Towers"" through award nominations?",John Rhys-Davies
subgraphs_batch_071_textual_subgraph_0841.graphml,"Which company offers customer service in French and was involved in the production of both ""The Newton Boys"" and ""Stargate"" films?",Canal+
subgraphs_batch_071_textual_subgraph_0836.graphml,"Which actor has been nominated for awards alongside Bernard Telsey and Mary McDonnell, and is also associated with the films ""Master and Commander: The Far Side of the World"" and ""The Avengers""?",Paul Bettany
subgraphs_batch_071_textual_subgraph_0846.graphml,"Which prestigious award category is associated with nominees from ""The Fly,"" ""Star Trek,"" and ""The Time Machine""?",Academy Award for Best Makeup and Hairstyling
subgraphs_batch_071_textual_subgraph_0837.graphml,"Which actress has been nominated for awards alongside Heath Ledger and Bruce Greenwood, and has also won awards for her roles in ""The Lord of the Rings: The Fellowship of the Ring"" and ""The Lord of the Rings: The Two Towers""?",Cate Blanchett
subgraphs_batch_071_textual_subgraph_0848.graphml,"What genre connects the films ""Mao's Last Dancer"" and ""All the President's Men"" and is also associated with ""The Siege"" and ""Blood Diamond""?",Political drama
subgraphs_batch_071_textual_subgraph_0852.graphml,"Which actor has delivered notable performances in films such as Inglourious Basterds, Star Trek Nemesis, Star Trek, and Ghostbusters II?",Deleted scene
subgraphs_batch_071_textual_subgraph_0850.graphml,"Who is the male producer associated with both the film ""Blood Diamond"" and the award nominations for ""The Tourist""?",Graham King
subgraphs_batch_071_textual_subgraph_0844.graphml,"Who is the individual that has won awards for ""The Lord of the Rings: The Two Towers"" and ""Howard Shore,"" and has been nominated for a BAFTA Award for Best Film, as well as being involved in the production of ""King Kong""?",Fran Walsh
subgraphs_batch_071_textual_subgraph_0856.graphml,"What genre connects movies like ""The Prestige"" and ""Shutter Island"" and also shares a theme with films such as ""Unknown"" and ""Taken""?",Psychological thriller
subgraphs_batch_071_textual_subgraph_0858.graphml,"Who is the male actor who has been nominated for awards and appeared in both ""The Avengers"" and ""Sin City"" films?",Powers Boothe
subgraphs_batch_071_textual_subgraph_0853.graphml,"Who is the person born in New Zealand who has been nominated for awards alongside Richard Curtis and is also affiliated with producing the films ""Green Zone"" and ""Hot Fuzz""?",Tim Bevan
subgraphs_batch_071_textual_subgraph_0847.graphml,"Which company is known for distributing films like ""Shanghai,"" ""TMNT,"" and ""Rambo,"" and also has a connection to the award nominations for ""Hannibal Rising""?",The Weinstein Company
subgraphs_batch_071_textual_subgraph_0855.graphml,"Which actor, who has been nominated for awards like Alan Bates and is known for his association with celebrities such as Jennifer Aniston, has also appeared in films like Sin City and The Pink Panther?",Clive Owen
subgraphs_batch_071_textual_subgraph_0857.graphml,"Which award has been won by both John Travolta and Uma Thurman, and is also associated with the films ""Austin Powers: International Man of Mystery"" and ""Charlie's Angels""?",MTV Movie Award for Best Dance Sequence
subgraphs_batch_071_textual_subgraph_0861.graphml,"Which actress has been nominated for awards alongside Colm Feore and Lili Taylor, and is also associated with the films ""Ocean's Twelve"" and ""The Phantom""?",Catherine Zeta-Jones
subgraphs_batch_071_textual_subgraph_0859.graphml,"Which country, located in the Atlantic Time Zone and using the United States Dollar, is also associated with the release dates of the films Transformers and Battleship?",Bahrain
subgraphs_batch_071_textual_subgraph_0851.graphml,"Which actress has been nominated for awards alongside Imelda Staunton and has won awards like Tom Wilkinson, while also being featured in movies such as Iron Man and Austin Powers: Goldmember?",Gwyneth Paltrow
subgraphs_batch_071_textual_subgraph_0860.graphml,"Which place is both home to University College Cork and the setting for the limerick, and also shares a connection with the release dates of the films ""Drive"" and ""Green Lantern""?",Ireland
subgraphs_batch_071_textual_subgraph_0867.graphml,"Who is the individual that was born in Paterson, speaks English, and is affiliated with the music of the films ""Anaconda"" and ""National Security""?",Randy Edelman
subgraphs_batch_071_textual_subgraph_0863.graphml,"Who is the person born in the United States who founded Relativity Media and also served as an executive producer for both ""Talladega Nights: The Ballad of Ricky Bobby"" and ""Land of the Lost""?",Ryan Kavanaugh
subgraphs_batch_071_textual_subgraph_0872.graphml,"Which award is associated with nominees such as Shrek, Lilo & Stitch, Men in Black, and Rango?",Satellite Award for Best Animated or Mixed Media Feature
subgraphs_batch_071_textual_subgraph_0865.graphml,"Who is the male individual that has been nominated for awards for his work on both ""Star Wars Episode I: The Phantom Menace"" and ""Super 8,"" and is also associated with Gary Rydstrom?",Tom Johnson
subgraphs_batch_071_textual_subgraph_0862.graphml,"What is the term used to describe the genre that connects Himesh Reshammiya, the film ""Kal Ho Naa Ho,"" and also relates to ""Endhiran"" and the genre O.S.O.?",Bollywood
subgraphs_batch_071_textual_subgraph_0864.graphml,"Who is the British actor known for their roles in the films ""Alien,"" ""Indiana Jones and the Kingdom of the Crystal Skull,"" and ""V for Vendetta""?",John Hurt
subgraphs_batch_071_textual_subgraph_0866.graphml,"Which actor is known for being associated with Sarah Silverman, has won awards like Mark Moses, and has been involved in films such as Shrek Forever After and Space Cowboys?",Jon Hamm
subgraphs_batch_071_textual_subgraph_0873.graphml,"Which company is affiliated with the production of Brave and Cars 2, and has also received award nominations for WALL-E and Up?",Pixar
subgraphs_batch_071_textual_subgraph_0869.graphml,"Which country is both geographically adjacent to Turkey and has athletes who participated in the 2012 Summer Olympics, as well as a connection to the release dates of the films ""The Hunger Games"" and ""Kung Fu Panda 2""?",Armenia
subgraphs_batch_071_textual_subgraph_0870.graphml,"Which actor has been nominated for awards alongside Miguel Sandoval and Dakota Fanning, and is also known for his roles in the films ""Green Zone"" and ""Cars 2""?",Jason Isaacs
subgraphs_batch_071_textual_subgraph_0871.graphml,Who is the individual that has been nominated for an Academy Award for Best Sound Mixing for the film Cast Away and has also worked on the crew of Percy Jackson & the Olympians: The Lightning Thief and Madagascar: Escape 2 Africa?,Randy Thom
subgraphs_batch_071_textual_subgraph_0874.graphml,"Which language is spoken in both the Palestinian National Authority and South Africa, and is also the language used in the films ""Date Night"" and ""You Don't Mess with the Zohan""?",Hebrew Language
subgraphs_batch_071_textual_subgraph_0882.graphml,"Who is the voice actor nominated for awards for their roles in ""Tropic Thunder"" and ""Pineapple Express""?",Danny McBride
subgraphs_batch_071_textual_subgraph_0879.graphml,"Which actor has won awards like Ryan Phillippe and appeared in films such as The Longest Yard, Date Night, and Heat?",William Fichtner
subgraphs_batch_071_textual_subgraph_0878.graphml,"Which actor has been nominated for an Independent Spirit Award for Best Male Lead, shared award nominations with Julianne Moore, and is also associated with films like The Avengers and The Brothers Bloom?",Mark Ruffalo
subgraphs_batch_071_textual_subgraph_0887.graphml,"Which genre encompasses movies like WarGames and The Birds, and also includes films such as Air Force One and Enemy at the Gates?",Suspense
subgraphs_batch_071_textual_subgraph_0889.graphml,"Which entity is connected to the films ""The Polar Express,"" ""Unstoppable,"" and ""The Cassandra Crossing""?",Train
subgraphs_batch_071_textual_subgraph_0875.graphml,"Which city is both associated with the United States Department of Housing and Urban Development's estimated number of mortgages and served as a filming location for both ""Confessions of a Dangerous Mind"" and ""Cannonball Run II""?",Tucson
subgraphs_batch_071_textual_subgraph_0880.graphml,"Which actor has been nominated for a Screen Actors Guild Award for Outstanding Performance by a Cast in a Motion Picture alongside Sam Rockwell and has also appeared in the films ""Gladiator"" and ""Blood Diamond""?",Michael Sheen
subgraphs_batch_071_textual_subgraph_0868.graphml,"Which actor has been nominated for awards like Gil Bellows and has won awards like Portia de Rossi, and is also known for his roles in the film ""Battleship"" and the film ""24: Redemption""?",Peter MacNicol
subgraphs_batch_071_textual_subgraph_0885.graphml,"What genre of film connects titles like ""Husbands and Wives,"" ""Little Fockers,"" ""It's a Mad, Mad, Mad, Mad World,"" and ""The Blues Brothers""?",Screwball comedy
subgraphs_batch_071_textual_subgraph_0888.graphml,"Which actress has been nominated for awards for her role in ""The Losers"" and appeared in both ""Avatar"" and ""Pirates of the Caribbean: The Curse of the Black Pearl""?",Zoe Saldana
subgraphs_batch_071_textual_subgraph_0876.graphml,"Who is the person born in England who has been nominated for awards alongside John Powell and has won awards for their work on the film ""Kingdom of Heaven"" as well as composing the music for ""Cowboys & Aliens""?",Harry Gregson-Williams
subgraphs_batch_071_textual_subgraph_0884.graphml,"Which award is associated with nominees from ""Beginners"" and ""Apollo 13,"" and has also recognized performances in ""The Last Samurai"" and celebrated achievements in ""The Lord of the Rings: The Fellowship of the Ring""?",Screen Actors Guild Award for Outstanding Performance by a Male Actor in a Supporting Role
subgraphs_batch_071_textual_subgraph_0891.graphml,"Who is the person that practices Catholicism, has lived in Munich, and is associated with the films ""John Carter"" and ""Robin Hood""?",Mark Strong
subgraphs_batch_071_textual_subgraph_0877.graphml,"Who is the individual that works as a film producer in Great Britain, has been nominated for awards alongside Leonard Dick, and is also known for creating the TV show Alias and writing the film Super 8?",J.J. Abrams
subgraphs_batch_071_textual_subgraph_0881.graphml,"Who is the executive producer that was involved in both the award-nominated film ""Shakespeare in Love"" and the production of TV programs, as well as executive producing the films ""Kill Bill Volume 2"" and ""Jackie Brown""?",Harvey Weinstein
subgraphs_batch_071_textual_subgraph_0892.graphml,"Who is the American writer who has been nominated for a Saturn Award for Best Writing and contributed to the stories of ""Star Trek: First Contact"" and ""Mission: Impossible II""?",Brannon Braga
subgraphs_batch_071_textual_subgraph_0895.graphml,"Who is the person that was born in Greenwich, has been nominated for awards related to Howards End, and is also affiliated with the films Cars 2 and Deep Impact?",Vanessa Redgrave
subgraphs_batch_071_textual_subgraph_0894.graphml,"Which actor has been nominated for an MTV Movie Award for Best On-Screen Duo alongside Brooke Shields and has appeared in both ""The Taking of Pelham 123"" and ""Austin Powers: Goldmember""?",John Travolta
subgraphs_batch_071_textual_subgraph_0901.graphml,"Who is the actor that appeared in both ""Rush Hour 2"" and ""Scott Pilgrim vs. the World"" and is married to someone named Paul?",Bill Hader
subgraphs_batch_071_textual_subgraph_0893.graphml,"Who is the film producer from Great Britain who counts Johnny Depp among their celebrity friends, and has been involved in the production of ""Abraham Lincoln: Vampire Hunter"" as well as receiving award nominations for ""Mars Attacks!""?",Tim Burton
subgraphs_batch_071_textual_subgraph_0899.graphml,"Who is the individual that has been nominated for awards for both ""The Mission"" and ""Harry Potter and the Half-Blood Prince,"" and also contributed to the art direction of the film ""A Bridge Too Far""?",Stuart Craig
subgraphs_batch_071_textual_subgraph_0896.graphml,"Which actor, known for starring in ""A Time to Kill"" and also appearing in ""Night at the Museum: Battle of the Smithsonian"" and ""The Newton Boys,"" is associated with Kate Hudson?",Matthew McConaughey
subgraphs_batch_071_textual_subgraph_0898.graphml,"What language is spoken in Finland and is used in the films ""The Girl with the Dragon Tattoo,"" ""Minority Report,"" and ""The Cassandra Crossing""?",Swedish Language
subgraphs_batch_071_textual_subgraph_0890.graphml,"Which actor has won awards like Vera Farmiga and received nominations like Mark Wahlberg, and also appeared in films such as ""Beowulf"" and ""Percy Jackson & the Olympians: The Lightning Thief""?",Ray Winstone
subgraphs_batch_071_textual_subgraph_0897.graphml,"Who is the individual that has been nominated for awards for their work on ""The Fugitive"" and ""Snow Falling on Cedars,"" and also contributed to the music of ""Blood Diamond"" and ""The Tourist""?",James Newton Howard
subgraphs_batch_071_textual_subgraph_0906.graphml,"Who is the British actor known for his role in ""Glory"" and for writing ""The Last Samurai,"" and who is also married to a notable individual?",Edward Zwick
subgraphs_batch_071_textual_subgraph_0904.graphml,"Which company has its headquarters in New York, operates an official website known as Common's webpage, and was involved in the production of both ""The Dark Knight Rises"" and ""Jonah Hex""?",DC Comics
subgraphs_batch_071_textual_subgraph_0907.graphml,"Who is the film producer from Great Britain who has won awards with Revolution Studios and produced movies like ""The Losers"" and ""Waterworld""?",John Davis
subgraphs_batch_071_textual_subgraph_0910.graphml,"What city is associated with the Library of Congress Classification in June, and also linked to the release dates of the films ""The Expendables 2"" and ""Exodus""?",Madrid
subgraphs_batch_071_textual_subgraph_0902.graphml,"Who is the actor born in the United States who has won awards and appeared in both ""You Don't Mess with the Zohan"" and ""Transformers: Dark of the Moon""?",John Turturro
subgraphs_batch_071_textual_subgraph_0913.graphml,"Which country has won a bronze medal at the 2008 Summer Olympics and is also associated with the release dates of both ""The Bourne Identity"" and ""The Hunger Games"" films?",Uruguay
subgraphs_batch_071_textual_subgraph_0918.graphml,"Who is the British businessperson who has been nominated for a BAFTA Award for Best Film and has produced the movie ""Jumper"" as well as executive produced ""Heat""?",Arnon Milchan
subgraphs_batch_071_textual_subgraph_0903.graphml,"Who is the person married to Cedric the Entertainer, has been nominated for an award for the movie 16 Blocks, and appeared in the film Showtime?",Mos Def
subgraphs_batch_071_textual_subgraph_0914.graphml,"Which country is known for its GDP being measured in United States Dollars, had athletes compete in the 2012 Summer Olympics, and is associated with the release dates of the films Prometheus and Attack the Block?",Israel
subgraphs_batch_071_textual_subgraph_0905.graphml,Which language is spoken in Thailand and is also featured in the films Infernal Affairs II and The Man with the Golden Gun?,Thai Language
subgraphs_batch_071_textual_subgraph_0919.graphml,"Which male composer is known for his work on the music of both ""Brave"" and ""Thor,"" and has also been nominated for an award for ""Sense and Sensibility""?",Patrick Doyle
