file,query,answer
subgraphs_batch_022_textual_subgraph_0831.graphml,"Which film features Craig Barron as part of its crew, has an Animation Director, is in the English language, and was distributed on DVD?",X-Men
subgraphs_batch_022_textual_subgraph_0835.graphml,"Which action film, featuring locations in Toronto and with Craig Barron on the crew, was made in the English language?",X-Men
subgraphs_batch_022_textual_subgraph_0826.graphml,"Which film features a storyboard artist, has Sean Connery among its award-winning cast, won an MTV Movie Award for Best On-Screen Duo, and had its estimated budget in United States Dollars?",The Rock
subgraphs_batch_022_textual_subgraph_0821.graphml,"Which film, known for its thriller genre and featuring an animation director, was distributed on DVD and has a strong connection to the United States of America?",X-Men
subgraphs_batch_022_textual_subgraph_0830.graphml,"Which screenwriter, known for being nominated for the Razzie Award for Worst Screen Couple/Ensemble, is also affiliated with streaming media distributors in the United Kingdom?",Uwe Boll
subgraphs_batch_022_textual_subgraph_0834.graphml,"Which film features Gary Rydstrom as part of its crew, is distributed on DVD, has a Visual Effects Supervisor, and is related to the United States of America?",X-Men
subgraphs_batch_022_textual_subgraph_0839.graphml,"Which film, produced by Relativity Media and featuring the work of Makeup Artist-GB and a Special Effects Supervisor, falls under the Thriller genre?",Vantage Point
subgraphs_batch_022_textual_subgraph_0838.graphml,"Which film features Craig Barron in its crew, was filmed in Toronto, is related to the United States, and is primarily in the English language?",X-Men
subgraphs_batch_022_textual_subgraph_0840.graphml,"Which film combines genres like slapstick and comedy-GB, is associated with the United States, and also delves into the realm of fantasy?",The Flintstones in Viva Rock Vegas
subgraphs_batch_022_textual_subgraph_0841.graphml,"Which film features Craig Barron as part of its crew, falls under both the Fantasy and Action genres, and includes a Visual Effects Supervisor?",X-Men
subgraphs_batch_022_textual_subgraph_0837.graphml,"Which film has an estimated budget in United States Dollars, features Craig Barron as part of its crew, was distributed on DVD, and is related to the United States of America?",X-Men
subgraphs_batch_022_textual_subgraph_0842.graphml,"Who is the film director that is friends with Leonardo DiCaprio, has lived in New York City, and has an association with the United States Dollar?",Vincent Gallo
subgraphs_batch_022_textual_subgraph_0843.graphml,"Which film was released in both Turkey and Indonesia and features a Visual Effects Supervisor, while also being connected to the United States of America?",New Year's Eve
subgraphs_batch_022_textual_subgraph_0833.graphml,Which film directed by an individual who won the Saturn Award for Best Director and executive produced by Avi Arad is set in the United States and falls under the Science Fiction genre?,X-Men
subgraphs_batch_022_textual_subgraph_0846.graphml,"What film was adapted from a story by Dashiell Hammett, released in Canada, and is both a thriller and associated with the United States?",The Maltese Falcon
subgraphs_batch_022_textual_subgraph_0836.graphml,"Which film features English as its language, includes Craig Barron in its crew, and was distributed on DVD with a Visual Effects Supervisor also on board?",X-Men
subgraphs_batch_022_textual_subgraph_0851.graphml,"Which action film, featuring English dialogue, had Gary Rydstrom and Craig Barron as part of its crew?",X-Men
subgraphs_batch_022_textual_subgraph_0849.graphml,"Which popular TV show features Dee Bradley Baker and Tom Kenny in its regular cast, is set in the fantasy genre, and is primarily in the English language?",The Fairly OddParents
subgraphs_batch_022_textual_subgraph_0845.graphml,"Which film features Craig Barron on its crew, is distributed in the United Kingdom, and includes both a Special Effects Supervisor and a Sound Mixer among its team members?",X-Men
subgraphs_batch_022_textual_subgraph_0853.graphml,"Which film features Craig Barron as part of its crew, is animated by a notable director, and is available in English on DVD?",X-Men
subgraphs_batch_022_textual_subgraph_0860.graphml,"Which film features a sound mixer, was filmed in Toronto, is in the English language, and falls under the thriller genre?",X-Men
subgraphs_batch_022_textual_subgraph_0848.graphml,"Which film features Gary Rydstrom as a sound mixer, is primarily in English, and had its estimated budget in United States Dollars?",X-Men
subgraphs_batch_022_textual_subgraph_0850.graphml,"Which film features cinematography by Anthony B. Richmond, falls under the genre of political cinema, was nominated for an MTV Movie Award for Best Movie, and is primarily in the English language?",Legally Blonde
subgraphs_batch_022_textual_subgraph_0854.graphml,"Which film features Gary Rydstrom as part of its crew, has won a Saturn Award for Best Director, involves a sound mixer in its production, and was distributed on DVD?",X-Men
subgraphs_batch_022_textual_subgraph_0855.graphml,"Which TV series features Damian Lewis as a regular cast member, falls under the genre of Drama, originates from the United States, and is primarily in the English language?",Homeland
subgraphs_batch_022_textual_subgraph_0856.graphml,"Which film features Craig Barron and Avi Arad among its crew, includes a Special Effects Supervisor, and showcases New York City as one of its prominent locations?",X-Men
subgraphs_batch_022_textual_subgraph_0863.graphml,"Which film features a blend of fantasy and cutting-edge visual effects, and has a team that includes both a Visual Effects Supervisor and a Sound Mixer?",X-Men
subgraphs_batch_022_textual_subgraph_0859.graphml,"Which film, executive produced by Avi Arad, falls under both the Fantasy and Thriller genres and has an estimated budget in United States Dollars?",X-Men
subgraphs_batch_022_textual_subgraph_0847.graphml,"Which TV series features cinematography by Vittorio Storaro, includes Susan Sarandon in its regular cast, is primarily in the English language, and falls under the science fiction genre?",Dune
subgraphs_batch_022_textual_subgraph_0861.graphml,"Which film has distributors for both streaming media and DVD, and includes Craig Barron and a Visual Effects Supervisor on its crew?",X-Men
subgraphs_batch_022_textual_subgraph_0858.graphml,"Which film features an Animation Director and a Sound Mixer on its crew, is categorized under the Fantasy genre, and is primarily in the English language?",X-Men
subgraphs_batch_022_textual_subgraph_0844.graphml,"Which film features Craig Barron and a Visual Effects Supervisor on its crew, and has an estimated budget denominated in United States Dollars?",X-Men
subgraphs_batch_022_textual_subgraph_0865.graphml,"Which science fiction TV show, featuring Callum Keith Rennie as a regular cast member and having an official website, is primarily in the English language?",Tin Man
subgraphs_batch_022_textual_subgraph_0862.graphml,"Which film, featuring a fantasy theme and distributed through streaming media, had an animation director and was primarily in English?",X-Men
subgraphs_batch_022_textual_subgraph_0852.graphml,Who is the male performer from the United States who has been nominated for both a Primetime Emmy Award for Individual Performance in a Variety or Music Program and an MTV Movie Award for Best On-Screen Duo?,Dana Carvey
subgraphs_batch_022_textual_subgraph_0864.graphml,"Which film, featuring Burt Lancaster and winner of the National Society of Film Critics Award for Best Actor, is primarily in English and has a strong connection to the United States?",Atlantic City
subgraphs_batch_022_textual_subgraph_0857.graphml,"Which fantasy film was executive produced by Avi Arad, had an estimated budget in United States Dollars, and was distributed on DVD?",X-Men
subgraphs_batch_022_textual_subgraph_0870.graphml,"Which action film, produced by Warner Bros. Entertainment and related to Japan, was released on DVD?",Summer Wars
subgraphs_batch_022_textual_subgraph_0866.graphml,"Which film featuring Bam Margera in a documentary style, primarily in English, was nominated for the MTV Movie Award for Best On-Screen Duo?",Jackass: The Movie
subgraphs_batch_022_textual_subgraph_0871.graphml,"Which film combines the genres of thriller and action, has an estimated budget in United States Dollars, and is associated with the United States of America?",X-Men
subgraphs_batch_022_textual_subgraph_0869.graphml,"Which film was released in the United States, had Craig Barron on its crew, and featured locations in both New York City and Toronto?",X-Men
subgraphs_batch_022_textual_subgraph_0867.graphml,"Which film has a runtime associated with France, features a sound editor from Great Britain, falls under the thriller genre, and has release dates linked to the United States?",A Prophet
subgraphs_batch_022_textual_subgraph_0875.graphml,"Which film was released in both Iceland and Venezuela, features a sound mixer in its crew, and is primarily in the English language?",G.I. Joe: Retaliation
subgraphs_batch_022_textual_subgraph_0877.graphml,"Which film features music by Michel Legrand, falls under the drama genre, has an estimated budget in United States Dollars, and was released on DVD?",Lady Sings the Blues
subgraphs_batch_022_textual_subgraph_0868.graphml,"Which thriller film features Craig Barron as part of its crew and has a Visual Effects Supervisor, while being related to the United States of America?",X-Men
subgraphs_batch_022_textual_subgraph_0873.graphml,Who is the actor from Great Britain who has been nominated for an MTV Movie Award for Best On-Screen Duo and shares a connection with Ben Foster?,Rachael Leigh Cook
subgraphs_batch_022_textual_subgraph_0884.graphml,Which action film features animation directed by Craig Barron and is associated with the United States of America?,X-Men
subgraphs_batch_022_textual_subgraph_0872.graphml,Which film directed by the recipient of a Saturn Award for Best Director and featuring Craig Barron among its crew is also known for being in the English language and classified as a thriller?,X-Men
subgraphs_batch_022_textual_subgraph_0881.graphml,"Which film features a crew that includes an Animation Director, a Visual Effects Supervisor, and a Sound Mixer, and is classified as an Action Film?",X-Men
subgraphs_batch_022_textual_subgraph_0880.graphml,"What is the name of the film that was released in France and executive produced by Bruce Timm, and falls under the genres of Science Fiction and Action?",Superman/Batman: Public Enemies
subgraphs_batch_022_textual_subgraph_0882.graphml,"Which film, featuring English dialogue and released on DVD, has been recognized by the National Film Registry and earned awards for Edith Head?",Sabrina
subgraphs_batch_022_textual_subgraph_0876.graphml,"Which film features art direction by Walter H. Tyler, has won awards attributed to Gwen Wakeling, belongs to the action genre, and was released on DVD?",Samson and Delilah
subgraphs_batch_022_textual_subgraph_0885.graphml,"Which film has won the Hong Kong Film Award for Best Film, was released in Argentina, and involved a notable sound mixer, also being available on DVD?",Election
subgraphs_batch_022_textual_subgraph_0879.graphml,"Which thriller film, featuring Toronto as a prominent filming location and involving significant contributions from visual effects teams, is also closely associated with the United States of America?",X-Men
subgraphs_batch_022_textual_subgraph_0883.graphml,"Which film was executive produced by Ron Silver, featured Makeup Artist-GB and Sound Mixer in its crew, and falls under the genre of Action Film?",Get Carter
subgraphs_batch_022_textual_subgraph_0891.graphml,"Which film is known for blending genres like fantasy and thriller, and also involves a notable sound mixer in its production team?",X-Men
subgraphs_batch_022_textual_subgraph_0874.graphml,"Which film, featuring both drama and thriller genres and primarily in English, won the Los Angeles Film Critics Association Award for Best Actress?",The Grifters
subgraphs_batch_022_textual_subgraph_0886.graphml,"Which film featuring English dialogue and involving Craig Barron as part of the crew, also has a Visual Effects Supervisor and falls under the Thriller genre?",X-Men
subgraphs_batch_022_textual_subgraph_0890.graphml,"Which film features both Craig Barron and a sound mixer among its crew, is distributed on DVD, and is primarily in the English language?",X-Men
subgraphs_batch_022_textual_subgraph_0887.graphml,"Which film was written by Billy Wilder, released in West Germany, and is also available on DVD with a connection to the United States of America?",Stalag 17
subgraphs_batch_022_textual_subgraph_0889.graphml,"Which film features Craig Barron as the Visual Effects Supervisor, has a notable Sound Mixer in its crew, and was nominated for an MTV Movie Award for Best Movie?",X-Men
subgraphs_batch_022_textual_subgraph_0894.graphml,"Which film features Craig Barron as part of its crew, has a sound mixer, is in the English language, and is associated with the United States of America?",X-Men
subgraphs_batch_022_textual_subgraph_0897.graphml,"Which TV series features James Marsters as a regular cast member and falls under the genres of adventure, superhero, and fantasy?",Smallville
subgraphs_batch_022_textual_subgraph_0892.graphml,"Which film was shot in Toronto, had a notable sound mixer on its crew, and falls under both the Science Fiction and Thriller genres?",X-Men
subgraphs_batch_022_textual_subgraph_0878.graphml,"Which film features Toronto as a prominent location, has Craig Barron on its crew, and is associated with the United States, also including a Visual Effects Supervisor in its team?",X-Men
subgraphs_batch_022_textual_subgraph_0893.graphml,"Which film was executive produced by Avi Arad, falls under the genres of Thriller and Action, and had a Special Effects Supervisor on its crew?",X-Men
subgraphs_batch_022_textual_subgraph_0899.graphml,"Which film features Gary Rydstrom as an Animation Director, was distributed on DVD, and is primarily in the English language?",X-Men
subgraphs_batch_022_textual_subgraph_0898.graphml,"Which film features both Craig Barron and a sound mixer on its crew, and is categorized as both an action film and a thriller?",X-Men
subgraphs_batch_022_textual_subgraph_0902.graphml,Which film featuring special effects supervised by Craig Barron falls under the fantasy genre and is primarily in the English language?,X-Men
subgraphs_batch_022_textual_subgraph_0896.graphml,"Which fantasy film, primarily in English, had a budget estimated in United States Dollars and included a Sound Mixer among its crew members?",X-Men
subgraphs_batch_022_textual_subgraph_0888.graphml,"Which film, featuring a Wardrobe Supervisor and belonging to the comedy genre from Great Britain, is also associated with the United States and primarily in the English language?",Being Julia
subgraphs_batch_022_textual_subgraph_0903.graphml,"Which animated film, distributed on DVD and featuring a special effects supervisor, is closely associated with the United States and includes an animation director in its crew?",X-Men
subgraphs_batch_022_textual_subgraph_0905.graphml,Which American sitcom featuring Agnes Moorehead as a regular cast member was originally broadcast in English?,Bewitched
subgraphs_batch_022_textual_subgraph_0895.graphml,"Which film features Craig Barron as part of its sound crew, is classified as a thriller, and is primarily in the English language?",X-Men
subgraphs_batch_022_textual_subgraph_0904.graphml,"Which film features Toronto as a key location, has Gary Rydstrom on its crew, falls under the thriller genre, and includes a Special Effects Supervisor?",X-Men
subgraphs_batch_022_textual_subgraph_0900.graphml,"Which film features Toronto as a prominent filming location and includes Craig Barron, as well as both a Special Effects Supervisor and a Visual Effects Supervisor, among its crew members?",X-Men
subgraphs_batch_022_textual_subgraph_0911.graphml,"What film combines the genres of drama and fantasy, is presented in English, and has an official website?",Stranger than Fiction
subgraphs_batch_022_textual_subgraph_0901.graphml,"Which film has an estimated budget in United States Dollars, features Craig Barron and a Sound Mixer in its crew, and is related to the United States of America?",X-Men
subgraphs_batch_022_textual_subgraph_0912.graphml,"Which film is connected to both Spain and the United States, features dialogue in Spanish, and includes a notable Sound Mixer in its crew?",Midnight in Paris
subgraphs_batch_022_textual_subgraph_0906.graphml,"Which film was executive produced by Avi Arad and involved Craig Barron, a Sound Mixer, and a Visual Effects Supervisor in its crew?",X-Men
subgraphs_batch_022_textual_subgraph_0908.graphml,"What film features Craig Barron in its crew, falls under the fantasy genre, and has a strong focus on visual effects with a visual effects supervisor on board?",X-Men
subgraphs_batch_022_textual_subgraph_0907.graphml,"Which film is known for blending genres like drama, costume drama, and action, and was released in the United States?",Sergeant York
subgraphs_batch_022_textual_subgraph_0920.graphml,"Which superhero movie featuring Antonio Banderas, filmed in Germany and presented in English, has won notable awards?",The Mask of Zorro
subgraphs_batch_022_textual_subgraph_0913.graphml,"Which film features animation direction by a notable crew member, was filmed in Toronto, is associated with the United States, and has been distributed on DVD?",X-Men
subgraphs_batch_022_textual_subgraph_0909.graphml,"Which thriller film, distributed on DVD and featuring sound work by Gary Rydstrom, is associated with the United States of America?",X-Men
subgraphs_batch_022_textual_subgraph_0923.graphml,"Which animated film, featuring locations in Toronto and directed by an animation director, was distributed on DVD and primarily spoken in English?",X-Men
subgraphs_batch_022_textual_subgraph_0910.graphml,"Which film, known for its dramatic genre and English dialogue, has not only won the prestigious Palme d'Or but also saw its release on DVD?",Wild at Heart
subgraphs_batch_022_textual_subgraph_0916.graphml,"Which film features Avi Arad as an executive producer and has crew members including an Animation Director, a Visual Effects Supervisor, and a Sound Mixer?",X-Men
subgraphs_batch_022_textual_subgraph_0921.graphml,"Which film combines the genres of world cinema and romance, was released on DVD, and is distributed by 20th Century Fox?",The Pirate Movie
subgraphs_batch_022_textual_subgraph_0922.graphml,"Which romantic comedy film, shot in the English language and affiliated with the United States, has won awards similar to those won by The Help?","Crazy, Stupid, Love."
subgraphs_batch_022_textual_subgraph_0915.graphml,"Which film, featuring Charlton Heston and associated with the Planet of the Apes series in terms of awards, is also known for being distributed through streaming media and primarily in the English language?",Cats & Dogs
subgraphs_batch_022_textual_subgraph_0919.graphml,"Which popular television series featured Brent Spiner and Whoopi Goldberg as regular cast members, and was also associated with Patrick Stewart receiving award nominations, while being primarily broadcast in the English language?",Star Trek: The Next Generation
subgraphs_batch_022_textual_subgraph_0918.graphml,"Which film was released in the United States, features a sound mixer in its crew, is in the English language, and was distributed on DVD?",X-Men
subgraphs_batch_022_textual_subgraph_0925.graphml,"Which romance film features a makeup artist from Great Britain and a visual effects supervisor, and was also released on DVD?",Solitary Man
subgraphs_batch_022_textual_subgraph_0914.graphml,"Which film features Gary Rydstrom and Craig Barron in its crew, was distributed on DVD, and is associated with the United States of America?",X-Men
subgraphs_batch_022_textual_subgraph_0928.graphml,"Which film features cinematography by James Wong Howe, falls under the drama genre, is in the English language, and was released on DVD?",Yankee Doodle Dandy
subgraphs_batch_022_textual_subgraph_0917.graphml,"Which film, known for its historical genre and recognized with the London Film Critics Circle Award for Actor of the Year, also features notable contributions from a Special Effects Supervisor and a Sound Mixer?",Downfall
subgraphs_batch_022_textual_subgraph_0927.graphml,"Which science fiction film, featuring English dialogue, had Gary Rydstrom and Craig Barron as part of its crew?",X-Men
subgraphs_batch_022_textual_subgraph_0929.graphml,"Which film features Gary Rydstrom and Craig Barron in its crew, was distributed on DVD, and includes ""Fantasy"" in its title?",X-Men
subgraphs_batch_022_textual_subgraph_0924.graphml,"Which film, featuring Craig Barron in its crew, won a Saturn Award for Best Director, is classified as a thriller, and was distributed on DVD?",X-Men
subgraphs_batch_022_textual_subgraph_0931.graphml,"Which film was shot in Vancouver, has a connection to Japan, was made with a budget in United States Dollars, and had a Special Effects Supervisor on its crew?",Spy Game
subgraphs_batch_022_textual_subgraph_0932.graphml,"Which film was shot in Toronto, had Craig Barron on its crew, is in English, and was distributed on DVD?",X-Men
subgraphs_batch_022_textual_subgraph_0937.graphml,"Which film features Craig Barron as the Visual Effects Supervisor, is in the English language, and was distributed on DVD?",X-Men
subgraphs_batch_022_textual_subgraph_0933.graphml,"Which film, directed by someone who won the Saturn Award for Best Director and featuring Craig Barron in its crew, is primarily in English and associated with the United States?",X-Men
subgraphs_batch_022_textual_subgraph_0941.graphml,"Which film was shot in both Hamilton and Toronto and falls under the science fiction genre, distributed on DVD?",X-Men
subgraphs_batch_022_textual_subgraph_0930.graphml,"Which film features Craig Barron as part of its crew, is set in the United States, and is primarily in the English language?",X-Men
subgraphs_batch_022_textual_subgraph_0926.graphml,"Which film was released in the United States, featured Gary Rydstrom in its crew, was primarily in English, and had its budget estimated in United States Dollars?",X-Men
subgraphs_batch_022_textual_subgraph_0935.graphml,"Which film features Craig Barron as part of its crew, is animated, and falls under the fantasy genre while being presented in the English language?",X-Men
subgraphs_batch_022_textual_subgraph_0934.graphml,"Which film was released in the United States, had Craig Barron on its crew, was budgeted in United States Dollars, and distributed on DVD?",X-Men
subgraphs_batch_022_textual_subgraph_0943.graphml,"Which science fiction film, distributed through streaming media and featuring Craig Barron in its crew, is primarily in the English language?",X-Men
subgraphs_batch_022_textual_subgraph_0940.graphml,"Which film features Gary Rydstrom in its crew, has won the Saturn Award for Best Director, was distributed on DVD, and is associated with the United States of America?",X-Men
subgraphs_batch_022_textual_subgraph_0944.graphml,"Which film features Craig Barron as a member of its sound mixer crew, is set in the United States, and is primarily in the English language?",X-Men
subgraphs_batch_022_textual_subgraph_0938.graphml,"Which film, directed by someone who has won a Saturn Award for Best Director and featuring Gary Rydstrom in its crew, is primarily in English and associated with the United States?",X-Men
subgraphs_batch_022_textual_subgraph_0942.graphml,"Which film features Gary Rydstrom in its crew, was filmed in Toronto, is in the English language, and is associated with the United States of America?",X-Men
subgraphs_batch_022_textual_subgraph_0947.graphml,"Which film was shot in 35 mm format, had a sound editor from the UK, and was distributed both in the United Kingdom and through streaming media?",Let the Right One In
subgraphs_batch_022_textual_subgraph_0936.graphml,"Which action film, featuring the work of Gary Rydstrom and Craig Barron, was produced with a budget denominated in United States Dollars?",X-Men
subgraphs_batch_022_textual_subgraph_0945.graphml,"Which film, featuring comedic elements and set in New York City, has won the Los Angeles Film Critics Association Award for Best Actress and is primarily in English?",The Fisher King
subgraphs_batch_022_textual_subgraph_0955.graphml,"Who is the male actor born in the United States who starred in the film ""The Holiday"" and holds a Master of Fine Arts degree?",James Franco
subgraphs_batch_022_textual_subgraph_0956.graphml,Which animated science fiction film was released in the Czech Republic and has an official website?,Frankenweenie
subgraphs_batch_022_textual_subgraph_0951.graphml,"What is the name of the TV series that falls under the genres of Animation, Anime, Thriller, and Action Film?",Code Geass
subgraphs_batch_022_textual_subgraph_0946.graphml,"Which fantasy film distributed through streaming media, featuring English dialogue and with Craig Barron as part of its crew, are we referring to?",X-Men
subgraphs_batch_022_textual_subgraph_0949.graphml,"Which film was shot in Toronto, had Craig Barron on its crew, is in the English language, and is associated with the United States?",X-Men
subgraphs_batch_022_textual_subgraph_0939.graphml,"Which science fiction film features Craig Barron as part of its crew and has DVD as one of its distributors, also including a Visual Effects Supervisor in its team?",X-Men
