file,query,answer
subgraphs_batch_016_textual_subgraph_0825.graphml,"Which sovereign state, known for exporting goods to Algeria, is also connected to the release dates of the films ""Insidious"" and ""Beginners""?",Portugal
subgraphs_batch_016_textual_subgraph_0837.graphml,"Which actor has been nominated for awards and appeared in films such as MASH, Contact, and Alien?",Tom Skerritt
subgraphs_batch_016_textual_subgraph_0830.graphml,"Which sovereign state is both a member of the Asian Development Bank and shares film release dates with classics like ""Ferris Bueller's Day Off"" and ""The Silence of the Lambs""?",Portugal
subgraphs_batch_016_textual_subgraph_0828.graphml,"Which sovereign state, known for exporting goods to Egypt, is also associated with the release dates of both the ""Super 8"" and ""Transformers"" films?",Portugal
subgraphs_batch_016_textual_subgraph_0831.graphml,"Which country has won a bronze medal at the 2004 Summer Olympics and also had athletes participating in the 2012 Summer Olympics, while currently having a person holding the office of President?",Portugal
subgraphs_batch_016_textual_subgraph_0824.graphml,"Which country is known for its association with the Portuguese language, won medals at the 2008 Summer Olympics, and is both the setting for the film ""Metropolis"" and located in Europe?",Portugal
subgraphs_batch_016_textual_subgraph_0823.graphml,"Which company is known for distributing the film ""Dancer in the Dark"" and is involved in the filmmaking industry, as well as being associated with the production of both ""Resident Evil"" and ""The Three Musketeers""?",Constantin Film
subgraphs_batch_016_textual_subgraph_0827.graphml,"Who is the individual that has been nominated for awards alongside Michael Semanick for ""Star Wars Episode III: Revenge of the Sith"" and has also worked on the crew of both ""Super 8"" and ""Star Wars Episode IV: A New Hope""?",Ben Burtt
subgraphs_batch_016_textual_subgraph_0829.graphml,"Which country is both a member of the Asian Development Bank and has athletes who have won silver medals at the Olympics, and is also associated with the release dates of the films ""The Wolfman"" and ""Men in Black 3""?",Portugal
subgraphs_batch_016_textual_subgraph_0833.graphml,"Which country is known for exporting goods to Algeria and Egypt, and is also connected to the release dates of the films ""A Prophet"" and ""Zero Dark Thirty""?",Portugal
subgraphs_batch_016_textual_subgraph_0841.graphml,"Who is the male individual affiliated with NASA, known for a personal appearance in ""Transformers: Dark of the Moon,"" and practicing Catholicism?",John F. Kennedy
subgraphs_batch_016_textual_subgraph_0832.graphml,"Which film production company, known for distributing ""Slumdog Millionaire"" and ""Let Me In,"" and involved in the production of ""Hyde Park on Hudson,"" is based in the United States?",Icon Productions
subgraphs_batch_016_textual_subgraph_0844.graphml,"Which sovereign state, known for exporting goods to Egypt, is also linked to the release dates of the films ""Whip It!"" and ""A Prophet""?",Portugal
subgraphs_batch_016_textual_subgraph_0836.graphml,"Which award has been won by Stanley Kubrick for ""A Clockwork Orange"" and has also recognized ""Star Trek: Deep Space Nine"" and ""Alien"" as nominees?",Hugo Award for Best Dramatic Presentation
subgraphs_batch_016_textual_subgraph_0840.graphml,"Which country is known for exporting goods to Algeria, is a member of the Asian Development Bank, and shares film release dates with both ""Frankenstein"" and ""Rushmore""?",Portugal
subgraphs_batch_016_textual_subgraph_0845.graphml,"What genre encompasses movies like ""The Quiet American"" and ""WarGames"" and is also associated with films in the style of ""Foreign Correspondent""?",Political thriller
subgraphs_batch_016_textual_subgraph_0842.graphml,"Which country, known for exporting goods to Algeria and having a parliamentary system, also shares film release dates with ""Terminator Salvation"" and ""This Is England""?",Portugal
subgraphs_batch_016_textual_subgraph_0843.graphml,"Which country is both a member of the Asian Development Bank and exports goods to Egypt, and is also associated with the release dates of the films ""Mildred Pierce"" and ""Laura""?",Portugal
subgraphs_batch_016_textual_subgraph_0838.graphml,"Which country has won a silver medal at the Olympics, exports goods to Algeria, is affiliated with NATO, and is featured in the film ""WarGames""?",Portugal
subgraphs_batch_016_textual_subgraph_0839.graphml,"Which company is responsible for distributing films such as King Kong, Back to the Future Part III, Snow White and the Huntsman, and Inglourious Basterds?",Universal Studios Home Entertainment
subgraphs_batch_016_textual_subgraph_0834.graphml,"Who is the artist known for contributing tracks to the electronic keyboard, nominated for awards related to ""The Sweet Hereafter,"" and also involved in the music for ""Moneyball"" and ""Life of Pi,"" where they won awards?",Mychael Danna
subgraphs_batch_016_textual_subgraph_0846.graphml,"Which award is associated with winners from the 17th Critics' Choice Awards and nominees like Winter’s Bone, The Impossible, and Life of Pi?",Broadcast Film Critics Association Award for Best Young Performer
subgraphs_batch_016_textual_subgraph_0849.graphml,"Which sovereign state has won a silver medal at the Olympics and is also connected to the release dates of the films ""Silkwood"" and ""Marley""?",Portugal
subgraphs_batch_016_textual_subgraph_0850.graphml,"Which sovereign state, known for exporting goods to Egypt, is also connected to the release dates of the films ""Drive"" and ""Shame""?",Portugal
subgraphs_batch_016_textual_subgraph_0851.graphml,"Which country both exports goods to Egypt and Algeria, and is associated with the release dates of the films ""Mary and Max"" and ""The Terminator""?",Portugal
subgraphs_batch_016_textual_subgraph_0848.graphml,"Which country is both a member of the Asian Development Bank and shares the same release year for the films ""Terminator Salvation"" and ""Bridesmaids""?",Portugal
subgraphs_batch_016_textual_subgraph_0853.graphml,"Which country is known for exporting goods to Morocco, shares a border with Spain, has its GDP nominal per capita measured in United States Dollars, and operates under a Parliamentary system?",Portugal
subgraphs_batch_016_textual_subgraph_0835.graphml,"Which creative field is associated with films like ""The Aviator,"" ""An Alan Smithee Film: Burn Hollywood Burn,"" ""Hugo,"" and ""Zack and Miri Make a Porno""?",Filmmaking
subgraphs_batch_016_textual_subgraph_0855.graphml,"Who was the individual married to Eleanor Roosevelt, served as Governor-General, held the position of President, and was instrumental in founding the United Nations?",Franklin D. Roosevelt
subgraphs_batch_016_textual_subgraph_0852.graphml,"Which country has exported goods to both Algeria and Egypt, and has also won silver and bronze medals at the Olympics?",Portugal
subgraphs_batch_016_textual_subgraph_0847.graphml,"What concept connects the films 13 Going on 30, Click, and The Terminator, and is also associated with a timeline theme?",Time travel
subgraphs_batch_016_textual_subgraph_0857.graphml,"Which country, known for exporting goods to Egypt, is also connected to the release dates of the films Quadrophenia and The King of Comedy?",Portugal
subgraphs_batch_016_textual_subgraph_0858.graphml,"Which sovereign state is both a member of the Asian Development Bank and shares film release dates with movies like ""(500) Days of Summer"" and ""Mary and Max""?",Portugal
subgraphs_batch_016_textual_subgraph_0859.graphml,"Which award has recognized nominees from films such as ""Tinker, Tailor, Soldier, Spy,"" ""Happy-Go-Lucky,"" ""Submarine,"" and ""Fish Tank""?",British Independent Film Award for Best Supporting Actress
subgraphs_batch_016_textual_subgraph_0863.graphml,"What language is spoken in both Canada and Uzbekistan and is also the language used in the films ""A Separation"" and ""Persepolis""?",Persian Language
subgraphs_batch_016_textual_subgraph_0861.graphml,"Which country is a member of the Asian Development Bank, exports goods to Egypt, and is associated with the release of the films ""The Lady"" and ""The Tree of Life""?",Portugal
subgraphs_batch_016_textual_subgraph_0854.graphml,"Which country is known for exporting goods to both Egypt and Algeria, and is also connected to the release date of the film ""An Inconvenient Truth"" and the Library of Congress Classification system?",Portugal
subgraphs_batch_016_textual_subgraph_0856.graphml,"Which country, known for exporting goods to Algeria and being a member of the Asian Development Bank, is also associated with the release dates of the films Hairspray and The Notebook?",Portugal
subgraphs_batch_016_textual_subgraph_0862.graphml,"Which country is known for using the French language, borders Australia, and has its government led by a President, while also being associated with the United States Dollar in terms of its GDP per capita?",New Caledonia
subgraphs_batch_016_textual_subgraph_0865.graphml,"Which country is bordered by the Democratic Republic of the Congo and the Central African Republic, and is also a member of the United Nations?",South Sudan
subgraphs_batch_016_textual_subgraph_0871.graphml,"What Italian-language thriller, related to the United States and released on DVD, am I referring to?",Serpico
subgraphs_batch_016_textual_subgraph_0868.graphml,"Which historical event is connected to the films Schindler's List, Sunshine, The Pianist, and The Reader?",The Holocaust
subgraphs_batch_016_textual_subgraph_0869.graphml,"Which action film, featuring animation work by a British animator and released on DVD, received award nominations thanks to its affiliation with Paramount Pictures?",G.I. Joe: The Rise of Cobra
subgraphs_batch_016_textual_subgraph_0860.graphml,"Which country is known for exporting goods to Egypt and Algeria, and is also connected to the release dates of the films ""Insidious"" and ""Let Me In""?",Portugal
subgraphs_batch_016_textual_subgraph_0870.graphml,"Which film, known for its crime fiction genre and Italian language, has connections to the United States and features nominees for the Academy Award for Best Actor?",Serpico
subgraphs_batch_016_textual_subgraph_0867.graphml,"Which country is known for exporting goods to both Algeria and Egypt, and is also associated with the release dates of the films ""Anatomy of a Murder"" and ""The Glenn Miller Story""?",Portugal
subgraphs_batch_016_textual_subgraph_0864.graphml,"Which country, known for exporting goods to Egypt and being a member of the Asian Development Bank, is also connected to the release dates of the films ""Wuthering Heights"" and ""E.T. the Extra-Terrestrial""?",Portugal
subgraphs_batch_016_textual_subgraph_0878.graphml,"Who is the male individual born in New York City and affiliated with Paramount Pictures, who has also been nominated for awards alongside Jon Avnet?",Scott Rudin
subgraphs_batch_016_textual_subgraph_0874.graphml,"Which film was produced by Paramount Pictures, has a runtime specified for Spain, is related to the United States, and is primarily in the English language?",Serpico
subgraphs_batch_016_textual_subgraph_0875.graphml,"What is the name of the war film that was produced with an estimated budget in United States Dollars, released in the United States, and primarily spoken in English?",Top Gun
subgraphs_batch_016_textual_subgraph_0873.graphml,"Which film was nominated for awards alongside ""The Cat in the Hat,"" falls under the genre of British comedy, was released on DVD, and is affiliated with Paramount Pictures?",The Love Guru
subgraphs_batch_016_textual_subgraph_0872.graphml,"Which film, directed by a nominee for the BAFTA Award for Best Direction, was produced by Paramount Pictures, is in the Italian language, and is associated with the United States of America?",Serpico
subgraphs_batch_016_textual_subgraph_0876.graphml,Who is the male actor born in the United States who was nominated for a BAFTA Award for Best Actor in a Leading Role and is in a domestic partnership?,Philip Seymour Hoffman
subgraphs_batch_016_textual_subgraph_0881.graphml,"Which film was produced by Bob Fosse, features both Hebrew and English languages, and was nominated for the BAFTA Award for Best Direction?",Cabaret
subgraphs_batch_016_textual_subgraph_0879.graphml,"Which film, adapted from a written work and set in the United States, has won both the Academy Award for Best Actor in a Supporting Role and the Academy Award for Best Writing Adapted Screenplay?",The Cider House Rules
subgraphs_batch_016_textual_subgraph_0866.graphml,"Which sovereign state, known for exporting goods to Egypt, is also connected to the release dates of the films ""This Must Be the Place"" and ""Beasts of the Southern Wild""?",Portugal
subgraphs_batch_016_textual_subgraph_0883.graphml,"Which animated film, featuring a crew that includes an Animation Director and a Boom Operator, is related to the United States of America and primarily uses the English language?",Rango
subgraphs_batch_016_textual_subgraph_0877.graphml,"Which film, known for its crime fiction genre and Spanish language, was nominated for both the BAFTA Award for Best Actor in a Leading Role and the Academy Award for Best Writing Adapted Screenplay?",Serpico
subgraphs_batch_016_textual_subgraph_0886.graphml,"Who is the actor that has been nominated for awards like Oliver Reed and Judd Hirsch, and won the BAFTA Award for Best Actor in a Leading Role for their role in ""The Insider""?",Russell Crowe
subgraphs_batch_016_textual_subgraph_0885.graphml,"Which film had its costume designed by Manish Malhotra, was budgeted in Indian rupees, released on DVD, and primarily featured the English language?",3 Idiots
subgraphs_batch_016_textual_subgraph_0891.graphml,"Which crime fiction film, with a runtime from Spain and a release date on DVD, is also connected to the United States of America?",Serpico
subgraphs_batch_016_textual_subgraph_0884.graphml,"Which film featuring Al Pacino and produced by Dino De Laurentiis, won the National Board of Review Award for Best Actor and was filmed in Italian?",Serpico
subgraphs_batch_016_textual_subgraph_0893.graphml,"Which film was released on DVD and has a runtime associated with Spain, while being available in both English and Italian languages?",Serpico
subgraphs_batch_016_textual_subgraph_0888.graphml,"Which crime fiction film, released on DVD and primarily in Spanish, is notably connected to the United States of America?",Serpico
subgraphs_batch_016_textual_subgraph_0882.graphml,"Which country has won medals at the 1972 Winter Olympics, is home to the Pontifical Gregorian University, shares its nationality with Dino De Laurentiis, and is closely associated with the Italian Language?",Italy
subgraphs_batch_016_textual_subgraph_0894.graphml,"Which film, produced by Paramount Pictures and featuring the English language, won the National Board of Review Award for Best Actor and is classified as a docudrama?",Serpico
subgraphs_batch_016_textual_subgraph_0897.graphml,"Which crime fiction film, set in Italy and also associated with the United States, was primarily filmed in the English language?",Serpico
subgraphs_batch_016_textual_subgraph_0880.graphml,"Which film, written by David Mamet and featuring English dialogue, has won both the London Film Critics Circle Award for Actor of the Year and the BAFTA Award for Best Film Music?",The Untouchables
subgraphs_batch_016_textual_subgraph_0898.graphml,"Which film is primarily in Italian and Spanish, set in the United States, and falls under the genre of crime fiction?",Serpico
subgraphs_batch_016_textual_subgraph_0895.graphml,"Which film, set in the United States and primarily in English, has won the Golden Globe Award for Best Screenplay and falls under the genre of romance?",The Purple Rose of Cairo
subgraphs_batch_016_textual_subgraph_0887.graphml,"Who is the actor that has been nominated for the Tony Award for Best Actor in a Play, worked as a film producer in Great Britain, and has also won both the Academy Award for Best Actor and the National Board of Review Award for Best Actor?",Laurence Olivier
subgraphs_batch_016_textual_subgraph_0889.graphml,"Which film or individual is connected to both Matt Damon and Lucy Liu, and has been recognized with nominations for the Academy Award for Best Writing Adapted Screenplay and winners of the National Board of Review Award for Best Actor?",George Clooney
subgraphs_batch_016_textual_subgraph_0900.graphml,"Which film combines the genres of sex comedy and drama, was released in the United States, and is primarily in the English language?",Knocked Up
subgraphs_batch_016_textual_subgraph_0901.graphml,"Which film has a sound mixer from the United Kingdom, was released in both Spain and the United States, and remains unidentified in this context?",Submarine
subgraphs_batch_016_textual_subgraph_0890.graphml,"Which film, directed by someone who has won both the National Board of Review Award for Best Director and the BAFTA Award for Best Sound, is also associated with the United States and was nominated for the BAFTA Award for Best Film Music?",Mississippi Burning
subgraphs_batch_016_textual_subgraph_0896.graphml,"Which actor, who has won the National Board of Review Award for Best Actor for a film in Italian, was also nominated for awards by Dino De Laurentiis and worked with Sidney Lumet?",Serpico
subgraphs_batch_016_textual_subgraph_0899.graphml,"What film has a story by Nathaniel Hawthorne, was produced by Andrew G. Vajna, is related to the United States, and was released on DVD?",The Scarlet Letter
subgraphs_batch_016_textual_subgraph_0892.graphml,"Which actor, known for his role in the film ""Becket,"" was nominated for both the Screen Actors Guild Award for Outstanding Performance by a Male Actor in a Leading Role and the Academy Award for Best Actor, and is also fluent in the English language?",Peter O'Toole
subgraphs_batch_016_textual_subgraph_0903.graphml,"Which film was produced by Ethan Coen, featured a Special Effects Supervisor, and is both in the English language and classified as a thriller genre?",The Ladykillers
subgraphs_batch_016_textual_subgraph_0902.graphml,"Which film, featuring the Italian language and falling under the genre of crime fiction, is also associated with the United States and was released on DVD?",Serpico
subgraphs_batch_016_textual_subgraph_0906.graphml,"Which film, primarily in Spanish and belonging to the biography genre, is associated with the United States and has won the National Board of Review Award for Best Actor?",Serpico
subgraphs_batch_016_textual_subgraph_0914.graphml,"Which thriller film was primarily in Italian but also featured English, and is associated with the United States?",Serpico
subgraphs_batch_016_textual_subgraph_0908.graphml,"Which crime fiction film, produced by Paramount Pictures, is set in the United States and primarily spoken in English?",Serpico
subgraphs_batch_016_textual_subgraph_0904.graphml,"Which film, featuring both Italian and Spanish languages, has a nominee for the BAFTA Award for Best Actor in a Leading Role and is associated with the United States of America?",Serpico
subgraphs_batch_016_textual_subgraph_0910.graphml,"Which film features personal appearances by Don Rickles and George Carlin, was released on DVD, and is primarily in the English language?",The Aristocrats
subgraphs_batch_016_textual_subgraph_0905.graphml,"Who was born in Los Angeles, starred in the film ""Kramer vs. Kramer,"" and has won the Academy Award for Best Actor as well as been nominated for the BAFTA Award for Best Actor in a Leading Role?",Dustin Hoffman
subgraphs_batch_016_textual_subgraph_0915.graphml,"Which thriller film was made in the United States, primarily in Spanish, but also includes English dialogue?",Serpico
subgraphs_batch_016_textual_subgraph_0909.graphml,"Which film, featuring Al Pacino who has won several awards, was produced by Paramount Pictures and is available in both English and Spanish languages?",Serpico
subgraphs_batch_016_textual_subgraph_0912.graphml,"Which film has a runtime associated with Spain, was produced by Paramount Pictures, released on DVD, and is related to the United States of America?",Serpico
subgraphs_batch_016_textual_subgraph_0913.graphml,"Which film, set in the United States and primarily in English, has won the MTV Movie Award for Best Villain and has an official website?",Sweeney Todd: The Demon Barber of Fleet Street
subgraphs_batch_016_textual_subgraph_0907.graphml,"Which film was produced by Paramount Pictures, has a runtime related to Spain, and was nominated for both the BAFTA Award for Best Film Music and the Academy Award for Best Actor?",Serpico
subgraphs_batch_016_textual_subgraph_0911.graphml,Which Italian-language film from Italy features a lead performance that was nominated for both the Academy Award for Best Actor and the BAFTA Award for Best Actor in a Leading Role?,Serpico
subgraphs_batch_016_textual_subgraph_0916.graphml,"Which film was primarily shot in Italian and English, has a runtime associated with Spain, and had nominees for the Academy Award for Best Actor?",Serpico
subgraphs_batch_016_textual_subgraph_0922.graphml,"Which crime fiction film, set in Spain and released on DVD, is primarily in the English language?",Serpico
subgraphs_batch_016_textual_subgraph_0923.graphml,"Which crime fiction film, spoken in Italian, is related to the United States and produced by Paramount Pictures?",Serpico
subgraphs_batch_016_textual_subgraph_0919.graphml,"Which film, featuring nominees for the Academy Award for Best Actor and set in the United States, is a thriller primarily spoken in Spanish?",Serpico
subgraphs_batch_016_textual_subgraph_0921.graphml,"What film, set in a period piece and featuring Mark Berger in its crew, is both in the English language and has a title that suggests it belongs to the thriller genre?",The Singing Detective
subgraphs_batch_016_textual_subgraph_0917.graphml,"Which film, featuring a nominee for the Academy Award for Best Actor, was produced by Paramount Pictures, has a runtime associated with Spain, and is primarily in the English language?",Serpico
subgraphs_batch_016_textual_subgraph_0926.graphml,"Which film features genres like Biography and Crime Fiction, was released on DVD, and is primarily in the English language?",Serpico
subgraphs_batch_016_textual_subgraph_0920.graphml,"Which film features music composed by Jerry Goldsmith, includes a makeup artist from Great Britain in its crew, is in the English language, and is associated with the United States of America?",The Mummy
subgraphs_batch_016_textual_subgraph_0934.graphml,"Which film is primarily in Spanish and Italian, is associated with the United States, and falls under the Thriller genre?",Serpico
subgraphs_batch_016_textual_subgraph_0924.graphml,"Which film was produced by Paramount Pictures, primarily in Italian, and had a nominee for the BAFTA Award for Best Actor in a Leading Role, as well as a release on DVD?",Serpico
subgraphs_batch_016_textual_subgraph_0928.graphml,"Which crime fiction film, set in Spain and featuring thriller elements, is primarily spoken in English?",Serpico
subgraphs_batch_016_textual_subgraph_0929.graphml,"Which film was written by Charlie Kaufman, nominated for an award for Adaptation, and falls under the genres of Crime Fiction and Biography?",Confessions of a Dangerous Mind
subgraphs_batch_016_textual_subgraph_0930.graphml,"Which film was produced by Paramount Pictures, released on DVD, and has a runtime associated with Spain, all while being in the English language?",Serpico
subgraphs_batch_016_textual_subgraph_0932.graphml,"Which film was released in Germany and Finland, belongs to the crime fiction genre, and was produced by Paramount Pictures?",Jack Reacher
subgraphs_batch_016_textual_subgraph_0925.graphml,"Which film has a runtime associated with Spain, was produced by Paramount Pictures, had its release date on DVD, and had nominees for the BAFTA Award for Best Film Music?",Serpico
subgraphs_batch_016_textual_subgraph_0927.graphml,"Which film, featuring the genre of drama and starring Marlene Dietrich who won awards for her performance, was released on DVD and primarily spoken in the English language?",Judgment at Nuremberg
subgraphs_batch_016_textual_subgraph_0937.graphml,"Which film, featuring a biography and released on DVD, was primarily in Spanish and has a runtime associated with Spain?",Serpico
subgraphs_batch_016_textual_subgraph_0936.graphml,"Which thriller film, produced by Paramount Pictures and featuring a runtime associated with Spain, is primarily in the English language?",Serpico
subgraphs_batch_016_textual_subgraph_0939.graphml,"Which film was nominated for an award in ""Lost in Translation,"" is associated with Luxembourg, and was released on DVD in English?",Girl with a Pearl Earring
subgraphs_batch_016_textual_subgraph_0931.graphml,Which Italian-language biography film was nominated for the BAFTA Award for Best Film Music and released on DVD?,Serpico
subgraphs_batch_016_textual_subgraph_0918.graphml,"Which film was released in Argentina, Taiwan, and Spain, and also distributed on DVD?",Snow White and the Huntsman
subgraphs_batch_016_textual_subgraph_0935.graphml,"Which film has been nominated for awards for both ""The Birds"" and ""Dr. No"" and is also associated with the genre of crime fiction and had a release date in Spain?",The Prize
subgraphs_batch_016_textual_subgraph_0946.graphml,Which film was released on DVD in the United States and is available in both Italian and English languages?,Serpico
subgraphs_batch_016_textual_subgraph_0938.graphml,"What is the name of the film that belongs to the genres of Thriller and Crime Fiction, is associated with the United States of America, and is primarily in the English language?",Serpico
