file,query,answer
subgraphs_batch_004_textual_subgraph_0009.graphml,"What genre connects movies like ""The Legend of Bagger Vance,"" ""Band of Brothers,"" ""The Insider,"" and the film ""The Tourist""?",Drama
subgraphs_batch_004_textual_subgraph_0002.graphml,"Which actress, known for her roles in ""Charmed"" and ""Picket Fences,"" has been nominated for awards alongside Lauren Holly and is also associated with Matt LeBlanc?",Holly Marie Combs
subgraphs_batch_004_textual_subgraph_0016.graphml,"What genre connects Amelia, The Legend of Bagger Vance, and Ali, and is also associated with the film Extremely Loud and Incredibly Close?",Drama
subgraphs_batch_004_textual_subgraph_0018.graphml,"What genre connects the films ""Forrest Gump,"" ""The Sea Inside,"" and ""Volver""?",Drama
subgraphs_batch_004_textual_subgraph_0006.graphml,"Which genre is associated with both ""Cape Fear"" and ""Before the Devil Knows You're Dead,"" and also encompasses films like ""Tess"" and ""Carnage""?",Drama
subgraphs_batch_004_textual_subgraph_0015.graphml,"Who is the film producer from Great Britain who was nominated for an Academy Award for Best Adapted Screenplay for their work on ""L.A. Confidential"" and also wrote ""Mystic River""?",Brian Helgeland
subgraphs_batch_004_textual_subgraph_0012.graphml,"Which country is known for its connection to the Khmer language and being a unitary state, and also shares a link with the release dates of the films ""The Dark Knight Rises"" and ""Life of Pi""?",Cambodia
subgraphs_batch_004_textual_subgraph_0008.graphml,"What genre connects the films ""Million Dollar Baby"" and ""Sergeant York"" with ""The Lives of a Bengal Lancer""?",Drama
subgraphs_batch_004_textual_subgraph_0022.graphml,"Who is the Italian cinematographer known for their work on the films ""Heat"" and ""The Family Man""?",Dante Spinotti
subgraphs_batch_004_textual_subgraph_0014.graphml,"Who is the cinematographer known for their work on ""Rosemary's Baby"" and nominated for awards for both ""WarGames"" and ""One Flew Over the Cuckoo's Nest""?",William A. Fraker
subgraphs_batch_004_textual_subgraph_0017.graphml,"What genre connects the films ""Mississippi Burning"" and ""House of Sand and Fog"" and is also associated with the TV show ""Mad Men"" and the film ""Waltz with Bashir""?",Drama
subgraphs_batch_004_textual_subgraph_0010.graphml,Who is the composer that has won awards like Glen Ballard and is affiliated with the music for films such as Cast Away and Maid in Manhattan?,Alan Silvestri
subgraphs_batch_004_textual_subgraph_0011.graphml,"Which actor has won awards like Bob Balaban and received nominations like Sophie Thompson, and also appeared in films such as ""The Life and Death of Peter Sellers"" and ""Sherlock Holmes: A Game of Shadows""?",Stephen Fry
subgraphs_batch_004_textual_subgraph_0023.graphml,"Which actor has been nominated for awards alongside Michael C. Hall and James Remar, and is also associated with the films ""The Savages"" and ""Michael Clayton""?",David Zayas
subgraphs_batch_004_textual_subgraph_0025.graphml,"Which genre encompasses movies such as ""The Savages"" and ""Million Dollar Baby,"" and also includes films like ""In the Heat of the Night"" and ""Pearl Harbor""?",Drama
subgraphs_batch_004_textual_subgraph_0019.graphml,"What genre encompasses both the film ""The Station Agent"" and the TV series ""Nurse Jackie,"" and is also associated with media titles like ""A Dangerous Method"" and ""W.""?",Drama
subgraphs_batch_004_textual_subgraph_0027.graphml,"Which genre connects the films ""Driving Miss Daisy,"" ""Michael Collins,"" and ""PS, I Love You,"" and is also associated with ""Million Dollar Baby""?",Drama
subgraphs_batch_004_textual_subgraph_0028.graphml,"Which genre connects movies like ""The Legend of Bagger Vance"" and ""Amelia"" with both ""A Beautiful Mind"" and the TV series ""From the Earth to the Moon""?",Drama
subgraphs_batch_004_textual_subgraph_0030.graphml,"What genre connects the films ""Fast Food Nation"" and ""The Savages"" to movies like ""Thank You for Smoking"" and ""We Were Soldiers""?",Drama
subgraphs_batch_004_textual_subgraph_0024.graphml,"Who is the person that speaks English, has lived in Nevada, and is associated with the films ""L.A. Confidential"" and ""8 Mile""?",Curtis Hanson
subgraphs_batch_004_textual_subgraph_0029.graphml,"Which genre connects the films ""Forrest Gump"" and ""The Savages"" with movies like ""Dune"" and ""Showgirls""?",Drama
subgraphs_batch_004_textual_subgraph_0032.graphml,"Who is the American photographer known for their work on the film ""Drugstore Cowboy"" and nominated for awards for ""Good Will Hunting""?",Gus Van Sant
subgraphs_batch_004_textual_subgraph_0026.graphml,"Who is the person that has lived in both Brooklyn and Manhattan and is associated with the film ""A.I. Artificial Intelligence"" as well as having been nominated for an award for the TV show ""Entourage""?",Adrian Grenier
subgraphs_batch_004_textual_subgraph_0021.graphml,"Which actor starred in the 1941 film, had a spouse, and also appeared in both ""A Bridge Too Far"" and ""New York, I Love You""?",James Caan
subgraphs_batch_004_textual_subgraph_0031.graphml,"Which prestigious award is associated with winners from the 61st and 60th Primetime Emmy Awards and has recognized achievements in ""The Gathering Storm"" and nominated works like ""The Life and Death of Peter Sellers""?","Primetime Emmy Award for Outstanding Writing - Miniseries, Movie or Dramatic Special"
subgraphs_batch_004_textual_subgraph_0039.graphml,"What genre connects the films ""Forrest Gump"" and ""Million Dollar Baby"" and also includes movies like ""Mumford"" and ""Nixon""?",Drama
subgraphs_batch_004_textual_subgraph_0038.graphml,"Who is the person that was known for their Catholic faith, passed away in Los Angeles, and starred in both ""Donnie Darko"" and ""Ghost""?",Patrick Swayze
subgraphs_batch_004_textual_subgraph_0035.graphml,"Who is the male actor who has won the BAFTA Award for Best Actor in a Leading Role for his role in ""Amadeus"" and also appeared in the film ""Star Trek: Insurrection""?",F. Murray Abraham
subgraphs_batch_004_textual_subgraph_0033.graphml,"Who is the person born in the United States, specifically Pennsylvania, who was nominated for an award for the film ""A Streetcar Named Desire"" and also worked on the music for the film ""Who's Afraid of Virginia Woolf?""?",Alex North
subgraphs_batch_004_textual_subgraph_0042.graphml,"What genre connects movies like ""Six Degrees of Separation,"" ""Amelia,"" ""The Curious Case of Benjamin Button,"" and ""The Reader""?",Drama
subgraphs_batch_004_textual_subgraph_0020.graphml,"Which genre is connected to both ""The Verdict"" and ""Six Degrees of Separation"" and also shares its characteristics with films like ""Million Dollar Baby"" and ""The Hurt Locker""?",Drama
subgraphs_batch_004_textual_subgraph_0041.graphml,"What genre connects the films ""Amelia"" and ""The Legend of Bagger Vance"" with ""Maid in Manhattan"" and ""Rent""?",Drama
subgraphs_batch_004_textual_subgraph_0036.graphml,"What genre connects movies like ""The Savages"" and ""It's a Wonderful Life"" as well as ""The Heiress""?",Drama
subgraphs_batch_004_textual_subgraph_0044.graphml,"What genre encompasses both ""The Savages"" and ""W."" and is also associated with the TV series ""Roots: The Next Generations"" and the film ""Apocalypse Now""?",Drama
subgraphs_batch_004_textual_subgraph_0034.graphml,"Which award has recognized both Gary Ross as a winner and films like Casino Royale, The Truman Show, and Inglourious Basterds as nominees?",Saturn Award for Best Writing
subgraphs_batch_004_textual_subgraph_0037.graphml,"What genre connects the films ""Mississippi Burning,"" ""Fast Food Nation,"" and ""Thirteen,"" and is also associated with the film genre ""Traffic""?",Drama
subgraphs_batch_004_textual_subgraph_0055.graphml,"Which genre is associated with both Michael Collins and Mississippi Burning, and also linked to The Proposal and Silkwood?",Drama
subgraphs_batch_004_textual_subgraph_0040.graphml,"Who is the individual that has been nominated for awards alongside Christopher Plummer, was married, and is connected to both ""The Muppet Movie"" and ""A Beautiful Mind""?",Austin Pendleton
subgraphs_batch_004_textual_subgraph_0045.graphml,"What genre connects the films ""We Need to Talk About Kevin"" and ""Mr. Nobody"" and also includes movies like ""Amour"" and ""Atlantic City""?",Drama
subgraphs_batch_004_textual_subgraph_0052.graphml,Which event recognized both Sammy Cahn and Milton R. Krasner for their achievements and also celebrated the films The Glenn Miller Story and The Country Girl?,27th Academy Awards
subgraphs_batch_004_textual_subgraph_0046.graphml,"Who is the male individual who has worked for Marvel Entertainment and was involved in the production of both ""Ghost Rider"" as an executive producer and ""Spider-Man 2"" as a producer?",Avi Arad
subgraphs_batch_004_textual_subgraph_0051.graphml,"Who is the male actor born in Memphis who was part of the regular cast of ""Deadwood"" and also appeared in the film ""Coal Miner's Daughter""?",William Sanderson
subgraphs_batch_004_textual_subgraph_0047.graphml,"Which actor has won awards alongside Allison Janney and Richard Schiff, and has been nominated for awards for their role in ""The West Wing"" as well as being associated with the film ""Philadelphia""?",Bradley Whitford
subgraphs_batch_004_textual_subgraph_0049.graphml,"What genre connects the films ""Braveheart"" and ""Fast Food Nation"" and also shares a common thread with ""The Devil Wears Prada"" and ""A Midsummer Night's Dream""?",Drama
subgraphs_batch_004_textual_subgraph_0048.graphml,"Which company is responsible for distributing films such as ""Father of the Bride Part II,"" ""The Prestige,"" and ""Summer of Sam,"" and also has a connection to the award nominations for ""Starship Troopers""?",Touchstone Pictures
subgraphs_batch_004_textual_subgraph_0043.graphml,"What genre connects movies like ""Mr. Nobody"" and ""The Wrestler"" with films such as ""The Way We Were"" and ""The Informant!""?",Drama
subgraphs_batch_004_textual_subgraph_0054.graphml,"Which genre connects the films ""Six Degrees of Separation"" and ""A Dangerous Method"" and also shares a common thread with ""The Siege"" and ""A Civil Action""?",Drama
subgraphs_batch_004_textual_subgraph_0053.graphml,"Which actress has an official website, is known for her voice acting, appeared in the film ""Remember the Titans,"" and was a regular cast member on the TV show ""Ally McBeal""?",Hayden Panettiere
subgraphs_batch_004_textual_subgraph_0060.graphml,"Which media entity is connected to titles like ""The Verdict"" and ""Six Degrees of Separation,"" and also associated with ""Shattered Glass"" and the film genre known as ""Heat""?",Drama
subgraphs_batch_004_textual_subgraph_0059.graphml,"Which award has recognized winners from the 64th Golden Globe Awards and nominees including ""The Princess and the Frog,"" ""Arthur Christmas,"" and ""Ratatouille""?",Golden Globe Award for Best Animated Feature Film
subgraphs_batch_004_textual_subgraph_0050.graphml,"Which genre connects movies like ""The Savages"" and ""Band of Brothers"" with films such as ""Cries and Whispers"" and ""Margin Call""?",Drama
subgraphs_batch_004_textual_subgraph_0056.graphml,"Who is the individual that has been nominated for awards like Anthony Minghella, is associated with the United States Dollar, and has produced films such as ""The Reader"" and ""Breaking and Entering""?",Sydney Pollack
subgraphs_batch_004_textual_subgraph_0061.graphml,"What genre connects the films ""Mississippi Burning,"" ""Six Degrees of Separation,"" and ""Adaptation,"" and is also associated with the movie ""Coriolanus""?",Drama
subgraphs_batch_004_textual_subgraph_0063.graphml,"What genre connects movies like ""The Legend of Bagger Vance,"" ""Braveheart,"" ""About Schmidt,"" and ""The Savages""?",Drama
subgraphs_batch_004_textual_subgraph_0069.graphml,"What genre encompasses both the media titles ""The Savages"" and ""W."", and is also associated with the TV show ""The Wire"" and the film ""Garden State""?",Drama
subgraphs_batch_004_textual_subgraph_0058.graphml,"What genre encompasses movies like ""The Savages"" and ""W."", as well as being associated with the film ""American Gangster"" and the TV series ""Roots: The Next Generations""?",Drama
subgraphs_batch_004_textual_subgraph_0057.graphml,"Who is the individual that was nominated for a BAFTA Award for Best Adapted Screenplay for ""The Talented Mr. Ripley,"" executive produced ""The Quiet American,"" and contributed to the writing of ""New York, I Love You""?",Anthony Minghella
subgraphs_batch_004_textual_subgraph_0067.graphml,"What genre encompasses movies like ""Million Dollar Baby"" and ""W."" and is also associated with the TV series ""Into the West""?",Drama
subgraphs_batch_004_textual_subgraph_0068.graphml,"What genre connects movies like ""The Legend of Bagger Vance,"" ""Braveheart,"" ""The Messenger,"" and the film ""Into the Wild""?",Drama
subgraphs_batch_004_textual_subgraph_0073.graphml,"What genre connects the films ""Million Dollar Baby"" and ""The Savages"" and also shares characteristics with ""Chinatown"" and ""Showgirls""?",Drama
subgraphs_batch_004_textual_subgraph_0066.graphml,"Which filmmaker is known for writing the movie ""Chicago"" and directing ""Dreamgirls,"" and has also seen both Phil Alden Robinson and Hugh Jackman receive award nominations for their work?",Bill Condon
subgraphs_batch_004_textual_subgraph_0064.graphml,"Who is the male actor known for his cameo appearance in a film and is also associated with the award nominations for ""Dilwale Dulhania Le Jayenge"" and the movie ""My Name is Khan""?",Shahrukh Khan
subgraphs_batch_004_textual_subgraph_0072.graphml,"What genre connects the films ""The Savages"" and ""W."" with classics like ""Roman Holiday"" and ""Yankee Doodle Dandy""?",Drama
subgraphs_batch_004_textual_subgraph_0062.graphml,"Which actor has been nominated for both a Screen Actors Guild Award for Outstanding Performance by a Cast in a Motion Picture and an Academy Award for Best Actor, and is known for his roles in the films ""A League of Their Own"" and ""The Firm""?",David Strathairn
subgraphs_batch_004_textual_subgraph_0070.graphml,"Who is the individual married to and has lived in New York, and is also associated with the films ""Bel Ami"" and ""Pulp Fiction""?",Uma Thurman
subgraphs_batch_004_textual_subgraph_0076.graphml,"Which genre connects the films ""Million Dollar Baby"" and ""Forrest Gump"" and also shares a common thread with ""8 Women"" and ""The Dreamers""?",Drama
subgraphs_batch_004_textual_subgraph_0065.graphml,"Who is the person that was born in Des Moines, has contributed to English dubbing performances in films, and is associated with drama students as well as being nominated for an award for their role in ""The Last Picture Show""?",Cloris Leachman
subgraphs_batch_004_textual_subgraph_0071.graphml,"Which genre encompasses films like ""House of Sand and Fog,"" ""Mississippi Burning,"" ""Breaking Away,"" and ""Any Given Sunday""?",Drama
subgraphs_batch_004_textual_subgraph_0078.graphml,"What genre connects the movies Forrest Gump and The Aviator, and is also shared by The Scarlet Letter and Tombstone?",Drama
subgraphs_batch_004_textual_subgraph_0074.graphml,"Who is the person that has a domestic partnership with Sara Ramirez, has won awards, and is affiliated with both the film ""The Red Violin"" and the TV show ""Grey's Anatomy""?",Sandra Oh
subgraphs_batch_004_textual_subgraph_0081.graphml,"Who is the television director known for directing the films ""Battleship,"" ""The Kingdom,"" and ""Hancock""?",Peter Berg
subgraphs_batch_004_textual_subgraph_0075.graphml,"Which actor, known for his roles in ""The Greatest Story Ever Told"" and ""North by Northwest,"" has been nominated for the Academy Award for Best Actor in a Supporting Role and is recognized as a British actor?",Martin Landau
subgraphs_batch_004_textual_subgraph_0077.graphml,"Which actress, known for her role in ""The Adventures of Pluto Nash,"" has also been nominated for an award for her performance in ""Jackie Brown"" and appeared in the film ""Larry Crowne""?",Pam Grier
subgraphs_batch_004_textual_subgraph_0079.graphml,"What genre connects the films ""Band of Brothers,"" ""Mr. Nobody,"" and ""Barney's Version,"" and is also associated with the film genre ""Sunshine""?",Drama
subgraphs_batch_004_textual_subgraph_0087.graphml,"What genre connects Michael Collins and Mississippi Burning, and is also shared by films like Little Women and The Man in the Iron Mask?",Drama
subgraphs_batch_004_textual_subgraph_0086.graphml,"What is the common genre that connects the films ""Six Degrees of Separation,"" ""Lawrence of Arabia,"" and ""The Mission""?",Drama
subgraphs_batch_004_textual_subgraph_0082.graphml,"Which event has recognized both Thomas Schlamme and the creators of Family Guy, The Shield, and The Gathering Storm-GB with prestigious awards?",54th Primetime Emmy Awards
subgraphs_batch_004_textual_subgraph_0089.graphml,"What genre connects the films ""Quadrophenia"" and ""The Madness of King George"" and also shares a theme with ""Unforgiven"" and ""Lonesome Dove""?",Drama
subgraphs_batch_004_textual_subgraph_0083.graphml,"What genre connects movies like ""The Rainmaker,"" ""The Verdict,"" and ""The Patriot,"" and also shares a theme with the film ""Being There""?",Drama
subgraphs_batch_004_textual_subgraph_0088.graphml,"Which genre connects the films ""Six Degrees of Separation"" and ""The Rainmaker"" to the themes of ""Batman Begins"" and ""Equus""?",Drama
subgraphs_batch_004_textual_subgraph_0080.graphml,"Who is the individual that has been nominated for awards by Barry Levinson, worked as a playwright in Great Britain, created the TV program Oz, and produced the TV show St. Elsewhere?",Tom Fontana
subgraphs_batch_004_textual_subgraph_0090.graphml,"Who is the cinematographer known for their work on ""A Civil Action"" and ""Love Affair,"" and who passed away in Santa Monica, also having been nominated for the Satellite Award for Best Cinematography?",Conrad L. Hall
subgraphs_batch_004_textual_subgraph_0092.graphml,"Which genre connects the films ""The Verdict"" and ""Million Dollar Baby"" and is also associated with ""Sunday Bloody Sunday-GB"" and ""Network""?",Drama
subgraphs_batch_004_textual_subgraph_0094.graphml,"What genre connects the films ""The Verdict,"" ""Cape Fear,"" ""The Rainmaker,"" and ""Amelia""?",Drama
subgraphs_batch_004_textual_subgraph_0085.graphml,"Who is the actor who has been nominated for a Daytime Emmy Award for Outstanding Younger Actor in a Drama Series, has lived in Edmonton, and is associated with both the film ""Saving Private Ryan"" and the TV show ""Desperate Housewives""?",Nathan Fillion
subgraphs_batch_004_textual_subgraph_0093.graphml,"What genre encompasses both the films ""The Rainmaker"" and ""The Verdict,"" as well as being associated with ""Persepolis"" and ""Alfie""?",Drama
subgraphs_batch_004_textual_subgraph_0100.graphml,"Which event saw both Anne Hathaway and Ang Lee presenting awards, and also recognized films like ""Life of Pi"" and ""Zero Dark Thirty""?",85th Academy Awards
subgraphs_batch_004_textual_subgraph_0091.graphml,"Which actor has been nominated for awards alongside Ben Stiller and Gwyneth Paltrow, and is also connected to the films ""The Royal Tenenbaums"" and ""Rushmore""?",Luke Wilson
subgraphs_batch_004_textual_subgraph_0084.graphml,"Which genre connects the films ""A Dangerous Method,"" ""Million Dollar Baby,"" and ""The Verdict,"" and also shares a thematic link with ""A Star Is Born""?",Drama
subgraphs_batch_004_textual_subgraph_0095.graphml,"What genre connects the films ""Six Degrees of Separation,"" ""The Rainmaker,"" ""The Bourne Ultimatum,"" and ""There Will Be Blood""?",Drama
subgraphs_batch_004_textual_subgraph_0098.graphml,"Which film distribution company, based in New York City, has distributed movies such as ""In the Loop,"" ""The Killer Inside Me,"" and ""Brighton Rock""?",IFC Films
subgraphs_batch_004_textual_subgraph_0102.graphml,"What genre connects Amelia, The Legend of Bagger Vance, The Piano, and Oscar and Lucinda in the world of media and film?",Drama
subgraphs_batch_004_textual_subgraph_0101.graphml,"What genre connects the films ""Band of Brothers"" and ""Secretariat"" and also includes movies like ""New Moon"" and ""Up""?",Drama
subgraphs_batch_004_textual_subgraph_0096.graphml,"What genre connects movies like ""The Barbarian Invasions,"" ""Seabiscuit,"" ""Saving Private Ryan,"" and the film ""Cries and Whispers""?",Drama
subgraphs_batch_004_textual_subgraph_0105.graphml,"What genre connects the films ""A Dangerous Method"" and ""Million Dollar Baby"" with the film ""Basic Instinct"" and the TV show ""The Practice""?",Drama
subgraphs_batch_004_textual_subgraph_0107.graphml,"What genre encompasses movies such as ""The Verdict"" and ""Million Dollar Baby,"" and also shares characteristics with films like ""Bulworth"" and ""The Truman Show""?",Drama
subgraphs_batch_004_textual_subgraph_0104.graphml,"What genre connects the films ""A Dangerous Method,"" ""Million Dollar Baby,"" ""Love Is a Many-Splendored Thing,"" and ""Blade Runner""?",Drama
subgraphs_batch_004_textual_subgraph_0097.graphml,"Who is the composer known for their work on the films ""Patton"" and ""In Harm's Way,"" and who has also been nominated for an Academy Award for Best Original Song?",Jerry Goldsmith
subgraphs_batch_004_textual_subgraph_0099.graphml,"Which individual has been recognized with awards won by Walter H. Tyler and has also been associated with the award nominations for Samson and Delilah and Breakfast at Tiffany's, as well as the film set design for Pat Garrett and Billy the Kid?",Ray Moyer
subgraphs_batch_004_textual_subgraph_0106.graphml,Which athlete won a silver medal at the 1996 Summer Olympics and is also connected to the release dates of the films Twilight and The Perks of Being a Wallflower?,Ecuador
subgraphs_batch_004_textual_subgraph_0108.graphml,"Which genre connects films like ""Six Degrees of Separation"" and ""A Dangerous Method"" and also shares common ground with movies such as ""Network"" and ""Rocky""?",Drama
subgraphs_batch_004_textual_subgraph_0109.graphml,"Which actor, known for their roles in ""Basic Instinct"" and ""Tarzan,"" was born in New York City and has a profession linked to Actor-GB?",Wayne Knight
subgraphs_batch_004_textual_subgraph_0111.graphml,"Who is the male executive producer from the United States who worked on both ""The Invasion"" and ""Training Day""?",Bruce Berman
subgraphs_batch_004_textual_subgraph_0115.graphml,"What genre connects the movies ""Million Dollar Baby"" and ""Forrest Gump"" and is also associated with the TV show ""Sons of Anarchy"" and the film ""Drive""?",Drama
subgraphs_batch_004_textual_subgraph_0103.graphml,"Which actor has been nominated for a Screen Actors Guild Award for Outstanding Performance by an Ensemble in a Drama Series alongside Desmond Harrington, and has also been a regular cast member on both ""Sons of Anarchy"" and ""Dexter""?",Jimmy Smits
subgraphs_batch_004_textual_subgraph_0116.graphml,"What genre encompasses both the media titles ""The Verdict"" and ""The Rainmaker,"" as well as the films ""The Artist"" and ""The Impossible""?",Drama
subgraphs_batch_004_textual_subgraph_0112.graphml,"What genre connects the movies ""Forrest Gump"" and ""W."" with TV shows like ""Last of the Summer Wine"" and ""Entourage""?",Drama
subgraphs_batch_004_textual_subgraph_0119.graphml,"What genre connects the films ""The Wrestler,"" ""A Dangerous Method,"" ""The Portrait of a Lady,"" and ""Hannah and Her Sisters""?",Drama
subgraphs_batch_004_textual_subgraph_0114.graphml,"What genre connects the films ""Cape Fear"" and ""The Verdict"" and is also associated with ""Black Hawk Down"" and the series ""Band of Brothers""?",Drama
subgraphs_batch_004_textual_subgraph_0117.graphml,"Which city serves as the capital of Victoria and experiences a March climate, and is also linked to the release dates of the films ""Heaven's Gate"" and ""Please Give""?",Melbourne
subgraphs_batch_004_textual_subgraph_0121.graphml,"Who is the actor from the United States known for their roles in ""The Shawshank Redemption"" and ""Glory""?",Bob Gunton
subgraphs_batch_004_textual_subgraph_0113.graphml,"Who is the film director known for his award nominations and his connection to the drama major, as well as for his role in the film ""American Psycho""?",Justin Theroux
subgraphs_batch_004_textual_subgraph_0110.graphml,"Which director, who has been nominated for an Academy Award alongside Laura Linney and is associated with the films ""Network"" and ""Mystic River,"" remains unidentified in this context?",Tim Robbins
subgraphs_batch_004_textual_subgraph_0118.graphml,"Who is the person married to Joseph Gordon-Levitt and has connections to both ""The Amazing Spider-Man"" film and the ""ER"" series through award nominations?",Sally Field
subgraphs_batch_004_textual_subgraph_0122.graphml,"What genre connects movies like ""The Savages"" and ""The Bridge on the River Kwai"" as well as ""Lawrence of Arabia""?",Drama
subgraphs_batch_004_textual_subgraph_0120.graphml,"Who is the individual who practices Protestantism and has starred in films such as ""The Cassandra Crossing"" and ""Atlantic City""?",Burt Lancaster
subgraphs_batch_004_textual_subgraph_0124.graphml,"Which location is both featured in the films ""3:10 to Yuma"" and ""Jarhead"" and has an official website?",Yuma
subgraphs_batch_004_textual_subgraph_0126.graphml,"What is the genre that connects the films Mr. Nobody, The Wrestler, and Mulholland Drive, and is also associated with the movie A Civil Action?",Drama
