file,query,answer
subgraphs_batch_022_textual_subgraph_0327.graphml,Who is the male actor from Great Britain who is known for his work in both the X-Men and The Avengers film series?,Stan Lee
subgraphs_batch_022_textual_subgraph_0333.graphml,"Which British male actor has appeared in both the film adaptation of ""Around the World in 80 Days"" and the film version of ""Hamlet""?",John Mills
subgraphs_batch_022_textual_subgraph_0329.graphml,"Who is the male author influenced by Jack Vance and nominated for the Michael L. Printz Award, and is also known for his marriage?",Terry Pratchett
subgraphs_batch_022_textual_subgraph_0322.graphml,"Who is the person that works both as a presenter and an actor in Great Britain, is known for the film ""Merry Christmas, Mr. Lawrence,"" and is also associated with a notable marriage?",Takeshi Kitano
subgraphs_batch_022_textual_subgraph_0334.graphml,Which male individual is both related to the films Iron Man 3 and The Avengers and has a connection to the concept of marriage?,Stan Lee
subgraphs_batch_022_textual_subgraph_0331.graphml,Who is the male voice actor known for his work in the X-Men films and is also famously known for his marriage?,Stan Lee
subgraphs_batch_022_textual_subgraph_0341.graphml,Who is the male television producer from Great Britain who is famously associated with the films X-Men and Hulk?,Stan Lee
subgraphs_batch_022_textual_subgraph_0330.graphml,"Who is the actor from the United States who has been nominated for an Academy Award for Best Short Film (Live Action) and is known for their role in the film ""The Missing""?",Ray McKinnon
subgraphs_batch_022_textual_subgraph_0338.graphml,"Who was the Russian national born in Russia, who founded the Red Army, was associated with Jewish people, and had a spouse?",Leon Trotsky
subgraphs_batch_022_textual_subgraph_0335.graphml,"Who is the voice actor known for their work in ""Iron Man 3"" and also has a background in film production, as well as being recognized for their marital status?",Stan Lee
subgraphs_batch_022_textual_subgraph_0328.graphml,"Who is the individual that worked as a television producer in Great Britain, was involved in creating both the X-Men and The Amazing Spider-Man films, and is known for being married?",Stan Lee
subgraphs_batch_022_textual_subgraph_0337.graphml,"Who is the male producer from the United States known for creating both ""Angel"" and ""Buffy the Vampire Slayer""?",David Greenwalt
subgraphs_batch_022_textual_subgraph_0339.graphml,"Who is the person that worked on the film ""Iron Man 3,"" practices Judaism, and is known for their marriage and career as an actor from Great Britain?",Stan Lee
subgraphs_batch_022_textual_subgraph_0343.graphml,"Who is the male individual from the United States who was nominated for an Academy Award for Best Picture for both ""The Nun's Story"" and another notable film?",Henry Blanke
subgraphs_batch_022_textual_subgraph_0344.graphml,"Who is the male voice actor known for his work in ""The Avengers"" and has been married?",Stan Lee
subgraphs_batch_022_textual_subgraph_0340.graphml,"Who is the male writer from Great Britain who was nominated for an award for his role in ""The Greatest Story Ever Told"" and is also associated with Sophia Loren?",Sidney Poitier
subgraphs_batch_022_textual_subgraph_0332.graphml,"Which actress, known for her role in ""Maid in Manhattan,"" was nominated for a British Independent Film Award for Best Actress and has connections to both acting in the UK and living in New York City?",Natasha Richardson
subgraphs_batch_022_textual_subgraph_0346.graphml,"Who is the composer known for his BAFTA Award nominations for Best Film Music, born in New York City, and affiliated with Jewish people?",Bernard Herrmann
subgraphs_batch_022_textual_subgraph_0336.graphml,"Which film producer, known for a cameo appearance in a movie and nominated for both the Academy Award for Best Picture and the Golden Globe Cecil B. DeMille Award, might this hidden entity be?",Adolph Zukor
subgraphs_batch_022_textual_subgraph_0342.graphml,"Who is the male actor from Great Britain who has won awards for his work and has been nominated for the same awards as Frasier, with Jay Kogen also being a recipient of these awards?",Jeffrey Richman
subgraphs_batch_022_textual_subgraph_0349.graphml,Who is the male actor from Great Britain who provided a voice in the film Iron Man 3 and is also known for his acting career?,Stan Lee
subgraphs_batch_022_textual_subgraph_0352.graphml,Which male individual from the United States is known for his significant contributions to films like Spider-Man 3 and X-Men?,Stan Lee
subgraphs_batch_022_textual_subgraph_0354.graphml,Who is the actor and film producer from Woodland Hills who has been nominated for awards alongside Rebecca Romijn?,America Ferrera
subgraphs_batch_022_textual_subgraph_0359.graphml,Who is the male screenwriter that is affiliated with both The Avengers and X-Men films?,Stan Lee
subgraphs_batch_022_textual_subgraph_0348.graphml,"Who is the individual born in Petersburg, known for their roles in the film ""Rules of Engagement,"" and has professions as both a film producer and an actor in Great Britain?",Blair Underwood
subgraphs_batch_022_textual_subgraph_0347.graphml,"Who is the individual born in the United States who has been both a writer and a film producer, and is also known for their association with the X-Men film series?",Stan Lee
subgraphs_batch_022_textual_subgraph_0355.graphml,"Who is the male individual born in New York City, known for creating the film Hulk and being affiliated with Judaism-GB?",Stan Lee
subgraphs_batch_022_textual_subgraph_0353.graphml,"Who is the male actor from Great Britain, known for his work on the X-Men films and often associated with the United States Dollar?",Stan Lee
subgraphs_batch_022_textual_subgraph_0360.graphml,Who is the English-speaking actor and presenter from the UK who is also known for his marriage and acting career?,Abhishek Bachchan
subgraphs_batch_022_textual_subgraph_0345.graphml,"Who is the person known for writing ""The Avengers"" film, working as a film producer in Great Britain, and being involved in a notable marriage?",Stan Lee
subgraphs_batch_022_textual_subgraph_0350.graphml,"Who is the writer from Great Britain, influenced by Nathaniel Hawthorne, known for their atheistic beliefs, and has a spouse related to marriage?",H. P. Lovecraft
subgraphs_batch_022_textual_subgraph_0363.graphml,"Who is the male actor known for his roles in the films ""2012"" and ""A History of Violence,"" and who is also married?",Stephen McHattie
subgraphs_batch_022_textual_subgraph_0364.graphml,"Who is the male individual born in the United States, affiliated with Judaism, and known for his significant contributions to the film ""The Avengers""?",Stan Lee
subgraphs_batch_022_textual_subgraph_0361.graphml,"Who is the person that has contributed to both the X-Men and Iron Man 3 films, is known for their work as a screenwriter, and has a notable connection to marriage?",Stan Lee
subgraphs_batch_022_textual_subgraph_0357.graphml,"Who is the renowned individual who has won the Filmfare Award for Best Actor, works as both a film director and a screenwriter, and is also known for his marriages in the film industry?",Dev Anand
subgraphs_batch_022_textual_subgraph_0362.graphml,"Who is the film producer from the United States of America, known for their work with the United States Dollar and having won awards alongside Steve Ditko?",Stan Lee
subgraphs_batch_022_textual_subgraph_0351.graphml,"Who is the person that was born in the United States, is affiliated with the X-Men film, and has professions as both a screenwriter and an actor from Great Britain?",Stan Lee
subgraphs_batch_022_textual_subgraph_0369.graphml,Who is the male writer born in New York City who is affiliated with the film Spider-Man 3?,Stan Lee
subgraphs_batch_022_textual_subgraph_0372.graphml,Who was the male film producer and presenter from Great Britain who passed away in Woodland Hills?,Mack Sennett
subgraphs_batch_022_textual_subgraph_0370.graphml,"Who is the male individual affiliated with Judaism, known for his involvement in the film ""Iron Man 3"" and having been married?",Stan Lee
subgraphs_batch_022_textual_subgraph_0371.graphml,Who is the male actor and politician from the UK who has lived in Maharashtra?,Govinda
subgraphs_batch_022_textual_subgraph_0368.graphml,"Who is the screenwriter and television producer from Great Britain who is also known for their work on films like ""The Avengers"" and ""The Amazing Spider-Man""?",Stan Lee
subgraphs_batch_022_textual_subgraph_0356.graphml,"Which individual is known for their roles in both ""X-Men: The Last Stand"" and ""X-Men,"" and has also worked as both an actor and a film producer in Great Britain?",Stan Lee
subgraphs_batch_022_textual_subgraph_0373.graphml,Who is the male Jewish individual who has been nominated for both the Grammy Award for Best Country Album and an award alongside Jay-Z?,Rick Rubin
subgraphs_batch_022_textual_subgraph_0378.graphml,"Who is the male musician and film producer from Hammersmith, England?",Roger Daltrey
subgraphs_batch_022_textual_subgraph_0358.graphml,"Who is the individual that has been nominated for both the Academy Award for Best Original Song and the Grammy Award for Best Song Written for a Motion Picture, Television or Other Visual Media, and is also known for their work as an actor and screenwriter from Great Britain?",Gulzar
subgraphs_batch_022_textual_subgraph_0367.graphml,"Who is the male voice actor from the United States, known for his work in the X-Men film series and often credited with an extra role involving the United States Dollar?",Stan Lee
subgraphs_batch_022_textual_subgraph_0365.graphml,"Who is the male individual who has been married and is known for his significant contributions to both ""X-Men: The Last Stand"" and ""Iron Man 3""?",Stan Lee
subgraphs_batch_022_textual_subgraph_0375.graphml,"Who is the male actor from Great Britain, known for his work on the X-Men films and his affiliation with Judaism?",Stan Lee
subgraphs_batch_022_textual_subgraph_0374.graphml,"Who is the male television producer from Great Britain who is affiliated with Jennifer Love Hewitt and appeared in the film ""Jay and Silent Bob Strike Back""?",Jamie Kennedy
subgraphs_batch_022_textual_subgraph_0366.graphml,"Who is the artist that has won both the Grammy Award for Best R&B Album and the Grammy Award for Best Female Pop Vocal Performance, and is also known for her acting career in the UK and has a connection to the United States Dollar?",Toni Braxton
subgraphs_batch_022_textual_subgraph_0379.graphml,"Who is the screenwriter from the United States who worked on the film ""The Incredible Hulk"" and has won awards like Steve Ditko?",Stan Lee
subgraphs_batch_022_textual_subgraph_0377.graphml,"Who is the individual that was both an actor and a film producer from Great Britain, and is associated with the films ""Iron Man 3"" and ""X-Men: The Last Stand""?",Stan Lee
subgraphs_batch_022_textual_subgraph_0376.graphml,"Who is the person that has worked both as a voice actor in the X-Men films and as a writer from Great Britain, and is also associated with the United States Dollar?",Stan Lee
subgraphs_batch_022_textual_subgraph_0381.graphml,Who is the male celebrity from the United States who is friends with Selena Gomez and Kevin Jonas?,David Henrie
subgraphs_batch_022_textual_subgraph_0380.graphml,"Who is the individual born in Great Britain, affiliated with Judaism, known for producing films and being married, and also associated with the film ""Hulk""?",Stan Lee
subgraphs_batch_022_textual_subgraph_0385.graphml,Who is the actor born in the United States of America who is known for their work in both the X-Men and The Avengers film series?,Stan Lee
subgraphs_batch_022_textual_subgraph_0382.graphml,"Who is the male actor that has been nominated for awards alongside Jerome Flynn and Mark Addy, and is also known for his marriage?",Julian Glover
subgraphs_batch_022_textual_subgraph_0387.graphml,Who is the male cinematographer and actor from Great Britain who was influenced by Fritz Lang and his peers?,Jean-Luc Godard
subgraphs_batch_022_textual_subgraph_0388.graphml,"Who is the screenwriter known for the X-Men film series, born in the United States, and affiliated with Judaism?",Stan Lee
subgraphs_batch_022_textual_subgraph_0386.graphml,"Who is the individual born in the United States, known for their cameo appearances in X-Men films and their personal life involving marriage?",Stan Lee
subgraphs_batch_022_textual_subgraph_0383.graphml,"Who is the individual that has been nominated for the Academy Award for Best Documentary Feature and is associated with David Milch, while also working as a film producer and screenwriter in Great Britain?",Walon Green
subgraphs_batch_022_textual_subgraph_0384.graphml,"Who is the male individual born in the United States of America, affiliated with Judaism-GB, and known for their involvement in the film Iron Man 3?",Stan Lee
subgraphs_batch_022_textual_subgraph_0392.graphml,"Who is the film director and producer from the United States who worked on the film ""Tombstone""?",Jason Priestley
subgraphs_batch_022_textual_subgraph_0396.graphml,Who is the actor from Great Britain who has been nominated for awards alongside David Wain and has lived in both Massachusetts and New York City?,Rob Corddry
subgraphs_batch_022_textual_subgraph_0394.graphml,"Who is the person born in Dallas, known for practicing vegetarianism, and has professions as both a film producer and an actor in Great Britain?",Meat Loaf
subgraphs_batch_022_textual_subgraph_0389.graphml,"Who is the male actor from Great Britain who is known for his roles in the films ""X-Men: The Last Stand"" and ""X-Men""?",Stan Lee
subgraphs_batch_022_textual_subgraph_0400.graphml,"Who is the male actor born in San Diego who was nominated for an award for his work in ""The Sixth Sense""?",Tak Fujimoto
subgraphs_batch_022_textual_subgraph_0406.graphml,Which male actor from Great Britain is known for his contributions to films like The Avengers and X-Men?,Stan Lee
subgraphs_batch_022_textual_subgraph_0404.graphml,Who is the male film director and producer from GB who worked on the film Infernal Affairs?,Eric Tsang
subgraphs_batch_022_textual_subgraph_0393.graphml,"Who is the multifaceted individual from Great Britain who has excelled as a politician, film director, actor, and film producer?",Dilip Kumar
subgraphs_batch_022_textual_subgraph_0399.graphml,"Who is the male individual born in the United States, affiliated with Judaism, and known for his involvement in the film Iron Man 3?",Stan Lee
subgraphs_batch_022_textual_subgraph_0403.graphml,"Who is the male actor from Great Britain who has lived in Mumbai and starred in the film ""O.S.O.""?",Rishi Kapoor
subgraphs_batch_022_textual_subgraph_0397.graphml,Who is the male writer from Great Britain who has been nominated for a BAFTA Award for Best Film Music alongside Alan Bergman?,Paul Williams
subgraphs_batch_022_textual_subgraph_0407.graphml,"Who is the male individual affiliated with Judaism, known for creating the Hulk in films, and has been married?",Stan Lee
subgraphs_batch_022_textual_subgraph_0398.graphml,"Who is the writer from Great Britain known for contributing to films like ""X-Men"" and ""The Avengers"" and also had a spouse?",Stan Lee
subgraphs_batch_022_textual_subgraph_0395.graphml,"Who is the person that has been associated with both Spider-Man 3 and Iron Man 3, is known for their profession as an actor from Great Britain, and has a connection to the concept of marriage?",Stan Lee
subgraphs_batch_022_textual_subgraph_0405.graphml,"Who is the screenwriter from the United States who has received award nominations for both ""Band of Brothers"" and ""The Sum of All Fears""?",Phil Alden Robinson
subgraphs_batch_022_textual_subgraph_0410.graphml,"Who was the British journalist and actor, also known for being a screenwriter, who passed away in Hong Kong?",Wong Jim
subgraphs_batch_022_textual_subgraph_0390.graphml,"Which actor, known for his roles in ""Pirates of the Caribbean: At World's End"" and nominated for awards for ""Curse of the Golden Flower,"" also has a background in both acting and screenwriting?",Chow Yun-Fat
subgraphs_batch_022_textual_subgraph_0412.graphml,Who is the male television director and actor from Great Britain who has lived in Sacramento?,Timothy Busfield
subgraphs_batch_022_textual_subgraph_0402.graphml,"Who is the male individual who is related to both the films ""X-Men"" and ""The Avengers"" and has a connection to the concept of marriage?",Stan Lee
subgraphs_batch_022_textual_subgraph_0408.graphml,"Who is the male individual influenced by Baruch Spinoza, practices Paganism, and is known for his marriage?",Johann Wolfgang von Goethe
subgraphs_batch_022_textual_subgraph_0401.graphml,Who is the male screenwriter that was nominated for both a Tony Award for Best Book of a Musical and an award associated with Walter Scharf?,Anthony Newley
subgraphs_batch_022_textual_subgraph_0413.graphml,Who is the actor born in New York City who has been nominated for both the Lantana and Primetime Emmy Award for Outstanding Lead Actor in a Drama Series?,Anthony LaPaglia
subgraphs_batch_022_textual_subgraph_0415.graphml,Who is the male guitarist from Great Britain who has lived in Costa Rica and is known for his marriage?,Stephen Stills
subgraphs_batch_022_textual_subgraph_0411.graphml,"Who is the person born in China, known for winning the Hong Kong Film Award for Best Action Choreography, works as a film producer in Great Britain, and is also recognized for their marriage?",Sammo Hung
subgraphs_batch_022_textual_subgraph_0391.graphml,"Who is the individual that has been nominated for awards for both ""The Wolfman"" and ""The Nutty Professor,"" and is also associated with the film ""X-Men: The Last Stand"" as part of the crew, while being known for their profession as an actor from Great Britain?",Richard A. Baker
subgraphs_batch_022_textual_subgraph_0409.graphml,Who is the television producer from the United States who has been nominated for a Primetime Emmy Award for Outstanding Drama Series alongside Elizabeth Sarnoff?,Brian K. Vaughan
subgraphs_batch_022_textual_subgraph_0418.graphml,Who is the male Indian national affiliated with Hinduism and known for his marriage?,Vijayakumar
subgraphs_batch_022_textual_subgraph_0416.graphml,"Who is the male voice actor known for his work in ""Iron Man 3"" and has been married?",Stan Lee
subgraphs_batch_022_textual_subgraph_0421.graphml,Who is the male individual from the United States of America who is associated with the films X-Men and Iron Man 3?,Stan Lee
subgraphs_batch_022_textual_subgraph_0424.graphml,"Who is the male writer of ""Spider-Man 3"" who is also known for his affiliation with Jewish people?",Stan Lee
subgraphs_batch_022_textual_subgraph_0414.graphml,Who is the person that provided a voice for an X-Men film and is also known for being an actor and film producer from Great Britain?,Stan Lee
subgraphs_batch_022_textual_subgraph_0426.graphml,Who is the male individual from the United States who has been affiliated with both the X-Men and Iron Man 3 films?,Stan Lee
subgraphs_batch_022_textual_subgraph_0422.graphml,"Who is the male individual born in Austria, influenced by Arthur Schopenhauer, and affiliated with Judaism-GB?",Sigmund Freud
subgraphs_batch_022_textual_subgraph_0427.graphml,"Who is the person known for their work as a screenwriter and actor in the UK, and is also associated with Judaism and the film ""Hulk""?",Stan Lee
subgraphs_batch_022_textual_subgraph_0420.graphml,"Who is the screenwriter and television producer from Great Britain who has a Catholic background and received award nominations for ""Wallace & Gromit: The Curse of the Were-Rabbit""?",Nick Park
subgraphs_batch_022_textual_subgraph_0417.graphml,"Who was the male film producer from Great Britain whose place of death was Chelsea and who was associated with the film ""Mutiny on the Bounty""?",Carol Reed
subgraphs_batch_022_textual_subgraph_0425.graphml,"Who was the Swiss actor known for his role in ""The King and I"" and also known for his marriage, who passed away in New York City?",Yul Brynner
subgraphs_batch_022_textual_subgraph_0429.graphml,Who is the male screenwriter and voice actor from the United States who is also known for his association with the United States Dollar?,Stan Lee
subgraphs_batch_022_textual_subgraph_0428.graphml,"Who is the male individual affiliated with Judaism and known for making a cameo appearance in the film ""Spider-Man 3""?",Stan Lee
subgraphs_batch_022_textual_subgraph_0431.graphml,"Who is the male actor from Great Britain who appeared in both ""Iron Man 3"" and ""The Avengers""?",Stan Lee
subgraphs_batch_022_textual_subgraph_0423.graphml,"Which individual is connected to both the films ""Iron Man 3"" and ""X-Men: The Last Stand,"" produced the movie ""Smokin' Aces,"" and is married?",Stan Lee
subgraphs_batch_022_textual_subgraph_0435.graphml,"Who is the actor born in New York City, known for their work in the X-Men film series and affiliated with Judaism?",Stan Lee
subgraphs_batch_022_textual_subgraph_0436.graphml,"Who is the screenwriter known for working on the ""X-Men"" and ""X-Men: The Last Stand"" films, and has also been involved in a marriage?",Stan Lee
subgraphs_batch_022_textual_subgraph_0430.graphml,"Who is the male guitarist from Great Britain who was in the film ""One Flew Over the Cuckoo's Nest"" and has been married?",Scatman Crothers
subgraphs_batch_022_textual_subgraph_0434.graphml,Who is the male television producer from Great Britain who has lived in Hollywood and practices Catholicism?,David Boreanaz
subgraphs_batch_022_textual_subgraph_0445.graphml,Who is the male screenwriter born in the United States who is affiliated with the X-Men film series?,Stan Lee
subgraphs_batch_022_textual_subgraph_0438.graphml,"Who is the male voice actor from Canada known for his work in ""The Transformers: The Movie""?",Peter Cullen
subgraphs_batch_022_textual_subgraph_0437.graphml,Who is the male artist from the United States who has been nominated for the Latin Grammy Award for Best Male Pop Vocal Album and has an official website?,Enrique Iglesias
subgraphs_batch_022_textual_subgraph_0433.graphml,Who is the male television producer from Great Britain who has a connection to the United States Dollar and was involved with the film featuring Hulk?,Stan Lee
subgraphs_batch_022_textual_subgraph_0432.graphml,"Which male writer, known for his work on Spider-Man 3 and X-Men: The Last Stand, is often celebrated in the film industry?",Stan Lee
subgraphs_batch_022_textual_subgraph_0441.graphml,"Who is the male film producer from Great Britain who was nominated for the Razzie Award for Worst Prequel, Remake, Rip-off or Sequel alongside John Travolta?",Elie Samaha
subgraphs_batch_022_textual_subgraph_0439.graphml,"Who is the male writer born in San Francisco and influenced by Charles Darwin, who is also known for his marriage?",Jack London
subgraphs_batch_022_textual_subgraph_0440.graphml,"Who is the female actor from Great Britain, known for her association with Tom Cruise, and whose personal life often involves discussions about the United States Dollar?",Victoria Beckham
subgraphs_batch_022_textual_subgraph_0442.graphml,"Who is the male actor from Great Britain who appeared in both ""Iron Man 3"" and ""The Avengers""?",Stan Lee
subgraphs_batch_022_textual_subgraph_0446.graphml,"Which individual, known for making cameo appearances in X-Men films and having a significant connection to the United States Dollar, was also born in the United States of America?",Stan Lee
subgraphs_batch_022_textual_subgraph_0451.graphml,"Who is the male football player turned film producer from Gary, GB?",Fred Williamson
subgraphs_batch_022_textual_subgraph_0444.graphml,"Who is the male actor born in Petersburg, known for his role in the film ""Heaven's Gate"" and holding United States nationality?",Joseph Cotten
subgraphs_batch_022_textual_subgraph_0419.graphml,"Who is the female actor born in New York City, known for her role in the film ""Public Enemies"" and has been married?",Leelee Sobieski
subgraphs_batch_022_textual_subgraph_0454.graphml,"Who is the male Production Designer known for his award nominations, who was also affiliated with Judaism-GB?",Alexandre Trauner
subgraphs_batch_022_textual_subgraph_0447.graphml,Who is the male actor and voice actor from Great Britain who is known for his work in the X-Men film series?,Stan Lee
subgraphs_batch_022_textual_subgraph_0455.graphml,Who is the male actor from Great Britain known for his work as a voice actor in the X-Men film series?,Stan Lee
subgraphs_batch_022_textual_subgraph_0450.graphml,"Who is the film producer from the United States who has been nominated for awards for their work on movies like ""John Wells"" and ""Far from Heaven""?",Christine Vachon
subgraphs_batch_022_textual_subgraph_0456.graphml,"Who is the screenwriter known for working on films like X-Men and Hulk, and also has a notable marriage in their personal life?",Stan Lee
subgraphs_batch_022_textual_subgraph_0443.graphml,"Who is the individual that wrote for the film industry, was involved with movies like ""The Avengers"" and ""Iron Man 3,"" and has a connection to marriage?",Stan Lee
subgraphs_batch_022_textual_subgraph_0452.graphml,"Who is the Indian film producer who speaks Malayalam and is known for their work in the film industry, as well as for their personal life involving marriage?",Mammootty
subgraphs_batch_022_textual_subgraph_0449.graphml,"Who is the male screenwriter born in the United States who was involved in the film ""Hulk"" and has an extra credit related to the United States Dollar?",Stan Lee
