file,query,answer
subgraphs_batch_084_textual_subgraph_0910.graphml,"Which film was produced by Steve Tisch, features makeup work by Makeup Artist-GB, is primarily in English, and is associated with the United States of America?",The Pursuit of Happyness
subgraphs_batch_084_textual_subgraph_0909.graphml,"Which film features Robert Smigel as the writer and has crew members serving as both Visual Effects Supervisor and Special Effects Supervisor, and was released in the United States?",You Don't Mess with the Zohan
subgraphs_batch_084_textual_subgraph_0917.graphml,"Which film was released in Argentina, Brazil, and the United States, and also had a DVD release date?",Quest for Fire
subgraphs_batch_084_textual_subgraph_0904.graphml,"Which film, related to Canada and featuring a notable sound crew, was released on DVD and had its release dates in both Canada and the United States?",Quest for Fire
subgraphs_batch_084_textual_subgraph_0908.graphml,"Which crime fiction film was featured at the 2008 Toronto International Film Festival and released in the United States, also becoming available on DVD?",The Brothers Bloom
subgraphs_batch_084_textual_subgraph_0915.graphml,"Which film has an estimated budget in United States Dollars, falls under the genre of Comedy-GB, features a Makeup Artist-GB in its crew, and is associated with the United States of America?",Adaptation
subgraphs_batch_084_textual_subgraph_0916.graphml,"Which film features a Sound Editor from Great Britain, was released in Argentina, and also saw its release on DVD and in the United States?",Quest for Fire
subgraphs_batch_084_textual_subgraph_0920.graphml,"Which film was nominated for awards, released in the United States, distributed on DVD, and available in the Croatian language?",Harry Potter and the Half-Blood Prince
subgraphs_batch_084_textual_subgraph_0912.graphml,"Which film was released in Brazil and Argentina, features a makeup artist from Great Britain, and is known as a period piece?",Quest for Fire
subgraphs_batch_084_textual_subgraph_0911.graphml,"Which film features Gary Rydstrom in its crew and combines the genres of comedy, fantasy, and adventure?",A Bug's Life
subgraphs_batch_084_textual_subgraph_0921.graphml,Which film was released in both Argentina and Japan and had a Makeup Artist and Sound Editor from Great Britain on its crew?,Quest for Fire
subgraphs_batch_084_textual_subgraph_0922.graphml,"What film was released in Belgium, is associated with Canada, and is considered a period piece that also had a DVD release date?",Quest for Fire
subgraphs_batch_084_textual_subgraph_0919.graphml,"Which film, starring Cary Grant and produced by Alfred Hitchcock, is an adventure movie and is associated with the United States of America?",North by Northwest
subgraphs_batch_084_textual_subgraph_0926.graphml,"What film combines the genres of musical and satire and was released in the United States, also available on DVD?",Team America: World Police
subgraphs_batch_084_textual_subgraph_0927.graphml,"Which adventure film, also known as a period piece, was released in both Australia and the United States?",Quest for Fire
subgraphs_batch_084_textual_subgraph_0918.graphml,"Which film features a set decorator from Great Britain and sound designer Skip Lievsay, and is also connected to nominees for the Academy Award for Best Makeup and Hairstyling, as well as being associated with the United States of America?",Men in Black
subgraphs_batch_084_textual_subgraph_0925.graphml,"Which film was released in Argentina, France, and the United States, and also had a DVD release date?",Quest for Fire
subgraphs_batch_084_textual_subgraph_0928.graphml,"Which fantasy film, produced by DreamWorks and featuring notable visual effects, was released in the United States?",Small Soldiers
subgraphs_batch_084_textual_subgraph_0924.graphml,"Which film was released in Sweden and Japan, and also involved a sound editor from Great Britain, in addition to being released in the United States?",Quest for Fire
subgraphs_batch_084_textual_subgraph_0929.graphml,"Which film features contributions from visual effects experts, makeup artists, and special effects supervisors, including notable work by Stan Winston?",Terminator 3: Rise of the Machines
subgraphs_batch_084_textual_subgraph_0923.graphml,"Which film was released in both the Netherlands and Brazil, and was also nominated for the Golden Globe Award for Best Foreign Language Film, with a strong connection to France?",Quest for Fire
subgraphs_batch_084_textual_subgraph_0932.graphml,"Which film was released in Argentina, the Netherlands, and the United States, and had a Sound Editor from Great Britain?",Quest for Fire
subgraphs_batch_084_textual_subgraph_0934.graphml,"Which film is associated with Canada, has release dates in Argentina and the United States, and also has a DVD release date?",Quest for Fire
subgraphs_batch_084_textual_subgraph_0935.graphml,"Which film, known for its period setting and available on DVD, has won the Academy Award for Best Makeup and Hairstyling and is associated with Canada?",Quest for Fire
subgraphs_batch_084_textual_subgraph_0931.graphml,Which romance film featuring Tom Fleischman in its crew and nominated for the BAFTA Award for Best Makeup & Hair also includes a makeup artist from Great Britain?,Chocolat
subgraphs_batch_084_textual_subgraph_0939.graphml,"Which film combines the genres of black-and-white and melodrama, was released in the United States, and had a sound editor from Great Britain?",Talk to Her
subgraphs_batch_084_textual_subgraph_0933.graphml,"What film features both a makeup artist from Great Britain and a sound crew, was released in Australia, and also had a DVD release date?",Quest for Fire
subgraphs_batch_084_textual_subgraph_0937.graphml,"Which film was released in Belgium and Brazil, and also had a DVD release date, with a makeup artist from Great Britain on its crew?",Quest for Fire
subgraphs_batch_084_textual_subgraph_0940.graphml,"Which film was released in Japan and the Philippines and features a makeup artist from Great Britain, while also being known as a period piece?",Quest for Fire
subgraphs_batch_084_textual_subgraph_0938.graphml,"Which film has connections to Canada, Brazil, and the United States, and features a sound editor from Great Britain in its crew?",Quest for Fire
subgraphs_batch_084_textual_subgraph_0942.graphml,"Which film has an estimated budget in United States Dollars, features a Sound Mixer and Makeup Artist from Great Britain in its crew, and was released on DVD?",Brotherhood of the Wolf
subgraphs_batch_084_textual_subgraph_0943.graphml,"Which film was released in Argentina, the Netherlands, and the United States, and also had a DVD release date?",Quest for Fire
subgraphs_batch_084_textual_subgraph_0944.graphml,"What film was released in Brazil and Canada, and had a sound editor from Great Britain, also being associated with the United States of America?",Quest for Fire
subgraphs_batch_084_textual_subgraph_0930.graphml,"Which film features music by Carter Burwell, has won the Screen Actors Guild Award for Outstanding Performance by a Female Actor in a Leading Role, includes a Special Effects Supervisor in its crew, and is associated with the United States of America?",The Blind Side
subgraphs_batch_084_textual_subgraph_0936.graphml,"Which film, released in Brazil and awarded the Academy Award for Best Makeup and Hairstyling, also had a Special Effects Supervisor and a Sound Editor from Great Britain on its crew?",Quest for Fire
subgraphs_batch_084_textual_subgraph_0947.graphml,"What film was released in Japan and had a sound editor from GB, as well as a special effects supervisor and a makeup artist from GB on its crew?",Quest for Fire
subgraphs_batch_084_textual_subgraph_0949.graphml,Which film was released in both Brazil and the United States and had a Sound Editor from GB and a Special Effects Supervisor on its crew?,Quest for Fire
subgraphs_batch_084_textual_subgraph_0952.graphml,Which romantic period piece film was produced by Metro-Goldwyn-Mayer and is associated with the United States of America?,Ryan's Daughter
subgraphs_batch_084_textual_subgraph_0946.graphml,"Which film, starring Zach Braff and belonging to the romance genre, was released on DVD and is associated with the United States of America?",Garden State
subgraphs_batch_084_textual_subgraph_0948.graphml,"Which film was released in Argentina and the United States, and had a Sound Editor from Great Britain and a Special Effects Supervisor on its crew?",Quest for Fire
subgraphs_batch_084_textual_subgraph_0945.graphml,"Which film, known for its comedic genre and British origins, has won a BAFTA Award for Best Actress in a Supporting Role and features notable work by a British sound editor, also available on DVD?",Hope and Glory
subgraphs_batch_084_textual_subgraph_0950.graphml,"Which fantasy film, set in the United Kingdom and featuring a Special Effects Supervisor, has its official website listed under Common's webpage?",The Chronicles of Narnia: Prince Caspian
subgraphs_batch_084_textual_subgraph_0941.graphml,"Which film has been nominated for awards for both ""On Her Majesty's Secret Service"" and ""For Your Eyes Only,"" and is also known for its release on DVD and classified as an Adventure Film?",Octopussy
subgraphs_batch_084_textual_subgraph_0953.graphml,"What is the name of the period piece that originated in the United Kingdom, involved a sound mixer in its film crew, and was released on DVD?",Ballet Shoes
subgraphs_batch_084_textual_subgraph_0957.graphml,Which film was written by Kevin Williamson and released on both Blu-ray and DVD in the United States?,The Faculty
subgraphs_batch_084_textual_subgraph_0951.graphml,"Which film has won the Academy Award for Best Makeup and Hairstyling, was released in Argentina and on DVD, and is known as a period piece?",Quest for Fire
subgraphs_batch_084_textual_subgraph_0955.graphml,Which film was released in both Japan and the United States and had a Sound Editor and Makeup Artist from Great Britain on its crew?,Quest for Fire
subgraphs_batch_084_textual_subgraph_0959.graphml,"What film was released in Belgium, Australia, and the United States, and also had a DVD release date?",Quest for Fire
subgraphs_batch_084_textual_subgraph_0963.graphml,"Which film was released in Brazil, Sweden, and the United States, and also had a DVD release date?",Quest for Fire
subgraphs_batch_084_textual_subgraph_0962.graphml,"Which adventure film, released in Brazil and on DVD, has won the Academy Award for Best Makeup and Hairstyling?",Quest for Fire
subgraphs_batch_084_textual_subgraph_0958.graphml,"Which film features a set decorator and makeup artist from Great Britain, belongs to the slapstick genre, and was released on DVD?",Paul
subgraphs_batch_084_textual_subgraph_0960.graphml,"Which film features a Sound Editor from Great Britain and a Special Effects Supervisor, and was released in both Brazil and the United States?",Quest for Fire
subgraphs_batch_084_textual_subgraph_0967.graphml,"Which film combines the genres of horror and fantasy, is primarily in Latin, and was released on DVD?",Van Helsing
subgraphs_batch_084_textual_subgraph_0954.graphml,"What is the name of the fantasy film that was released in the Philippines and had a makeup artist from Great Britain on its crew, which also came out on DVD?",Quest for Fire
subgraphs_batch_084_textual_subgraph_0961.graphml,Which film features a graphic designer and storyboard artist from the UK in its crew and was released in the United States and on DVD?,Date Night
subgraphs_batch_084_textual_subgraph_0956.graphml,"Which film was produced by Metro-Goldwyn-Mayer, won an award for Adolph Green, and featured both a makeup artist and a sound editor from Great Britain in its crew?",Singin' in the Rain
subgraphs_batch_084_textual_subgraph_0964.graphml,"Which film was released in both the United States and Japan, belongs to the fantasy genre, and has won the Academy Award for Best Makeup and Hairstyling?",Quest for Fire
subgraphs_batch_084_textual_subgraph_0970.graphml,"Which film was released in Canada and Argentina, is associated with a DVD release date, and is known for being a period piece?",Quest for Fire
subgraphs_batch_084_textual_subgraph_0974.graphml,"What film, set in Brazil and Canada, features a Special Effects Supervisor and falls under the Fantasy genre?",Quest for Fire
subgraphs_batch_084_textual_subgraph_0965.graphml,"Which film was made in the English language, had an estimated budget in United States Dollars, was released in the United States, and included a Special Effects Supervisor among its crew?",Beowulf
subgraphs_batch_084_textual_subgraph_0969.graphml,"Which film, set in a historical period and featuring notable special effects, was released in France and has a release date associated with Brazil?",Quest for Fire
subgraphs_batch_084_textual_subgraph_0971.graphml,"Which film was released in France, Belgium, and the United States, and had a sound editor from Great Britain?",Quest for Fire
subgraphs_batch_084_textual_subgraph_0966.graphml,"Which film, produced by Warner Bros. Entertainment, won the Academy Award for Best Cinematography, is classified as a period piece, and is associated with the United States of America?",Anthony Adverse
subgraphs_batch_084_textual_subgraph_0977.graphml,"Which film was released in Brazil, is related to Canada, features a makeup artist from Great Britain, and has a DVD release date?",Quest for Fire
subgraphs_batch_084_textual_subgraph_0968.graphml,"Which film was released in Argentina and Belgium, and also involved a makeup artist from Great Britain in its crew, along with a release in the United States?",Quest for Fire
subgraphs_batch_084_textual_subgraph_0973.graphml,"Which action film was released in the United States and features a special effects supervisor, all while being primarily in the German language?",Tomorrow Never Dies
subgraphs_batch_084_textual_subgraph_0984.graphml,Which film was released in both Japan and France and falls under the genres of Adventure and Fantasy?,Quest for Fire
subgraphs_batch_084_textual_subgraph_0972.graphml,"Which film has won the Academy of Canadian Cinema and Television Award for Best Achievement in Sound Editing, falls under the fantasy genre, features a makeup artist from Great Britain, and was released in the United States?",Quest for Fire
subgraphs_batch_084_textual_subgraph_0976.graphml,"Which film, related to Canada and Brazil, features a Sound Editor from GB and has a DVD release date?",Quest for Fire
subgraphs_batch_084_textual_subgraph_0975.graphml,"Which film combines the genres of comedy and is associated with the United Kingdom, while also featuring both a Visual Effects Supervisor and a Special Effects Supervisor, and has a connection to the United States of America?",Anger Management
subgraphs_batch_084_textual_subgraph_0978.graphml,"What film was released in Brazil, is related to Canada, had its DVD release, and featured a makeup artist from Great Britain in its crew?",Quest for Fire
subgraphs_batch_084_textual_subgraph_0985.graphml,Which crime fiction film produced by Ridley Scott was released in the United States and also made available on DVD?,The Losers
subgraphs_batch_084_textual_subgraph_0981.graphml,"Which thriller film, edited by Walter Murch, is related to Canada and was released on DVD?",K-19: The Widowmaker
subgraphs_batch_084_textual_subgraph_0989.graphml,"Which film features music by Maurice Jarre, is in the English language, is associated with the United States, and was released on DVD?",Dead Poets Society
subgraphs_batch_084_textual_subgraph_0991.graphml,Which adventure film was released in both Brazil and the United States and had a Special Effects Supervisor on its crew?,Quest for Fire
subgraphs_batch_084_textual_subgraph_0988.graphml,"Which film was released in Brazil and Japan, features a Special Effects Supervisor, and falls under the Fantasy genre?",Quest for Fire
subgraphs_batch_084_textual_subgraph_0990.graphml,"What film was released in Belgium and Brazil, belongs to the fantasy genre, and also had a release date in the United States?",Quest for Fire
subgraphs_batch_084_textual_subgraph_0983.graphml,"Which film has an estimated budget in United States Dollars, was filmed in Hawaii, falls under the fantasy genre, and was released in the United States of America?",Pirates of the Caribbean: At World's End
subgraphs_batch_084_textual_subgraph_0992.graphml,"Which film features a biography and period piece genre, and has Ve Neill and a Special Effects Supervisor among its crew members?",Man on the Moon
subgraphs_batch_084_textual_subgraph_0979.graphml,"Which film has release dates associated with Argentina, Belgium, and the United States, and also has a DVD release date?",Quest for Fire
subgraphs_batch_084_textual_subgraph_0986.graphml,Which film was released in both Japan and Argentina and had a Special Effects Supervisor and a Makeup Artist from Great Britain on its crew?,Quest for Fire
subgraphs_batch_084_textual_subgraph_0980.graphml,"Which film has been recognized with awards won by Alexander Payne and Jim Taylor, and is also associated with a DVD release date and the contributions of a Makeup Artist from Great Britain?",About Schmidt
subgraphs_batch_084_textual_subgraph_0982.graphml,"Which animated film, with an estimated budget in United States Dollars and featuring a Technical Director among its crew, is related to the United States of America and had its release date on DVD?",The Princess and the Frog
subgraphs_batch_084_textual_subgraph_0998.graphml,"Which teen film, featuring both a Visual Effects Supervisor and a Special Effects Supervisor, is closely associated with the United States of America?",American Wedding
subgraphs_batch_084_textual_subgraph_0999.graphml,"Which adventure film, featuring a makeup artist from Great Britain and sound crew, was released in the United States of America?",Quest for Fire
subgraphs_batch_084_textual_subgraph_0996.graphml,"Which romantic comedy film, set in New York City, was released on DVD and had a notable Special Effects Supervisor on its crew?",Youth in Revolt
subgraphs_batch_084_textual_subgraph_0997.graphml,"Which film, known for its biographical and period piece genres, has won awards for ""The Practice"" and is associated with Argentina in terms of its runtime?",Gia
subgraphs_batch_085_textual_subgraph_0002.graphml,"Which film was produced by Icon Productions, has connections to both Germany and the United States, and was released on DVD?",The Contender
subgraphs_batch_084_textual_subgraph_0995.graphml,"Which film was released in both the Netherlands and Argentina and also had a DVD release date, featuring a notable Special Effects Supervisor in its crew?",Quest for Fire
subgraphs_batch_084_textual_subgraph_0994.graphml,"Which film was released in the Netherlands and the United States, is associated with France, and had a makeup artist from Great Britain on its crew?",Quest for Fire
subgraphs_batch_084_textual_subgraph_0987.graphml,"Which film features a Sound Editor from Great Britain, is associated with France, includes a Special Effects Supervisor in its crew, and has a release date related to a DVD release?",Quest for Fire
subgraphs_batch_085_textual_subgraph_0008.graphml,"Which film was released in France, Argentina, and the United States, and also had a DVD release date?",Quest for Fire
subgraphs_batch_085_textual_subgraph_0001.graphml,"Which film features production design by Peter Lamont, editing by Conrad Buff, includes a Special Effects Supervisor in its crew, and is associated with the United States of America?",True Lies
subgraphs_batch_084_textual_subgraph_0993.graphml,"Which film has won the Genie Award for Best Achievement in Overall Sound, was released in Brazil and the United States, and features a makeup artist from Great Britain in its crew?",Quest for Fire
subgraphs_batch_085_textual_subgraph_0004.graphml,"Which film was produced by Jerry Bruckheimer, featured special effects and makeup by Makeup Artist-GB, and has a runtime associated with the United States of America?",Con Air
subgraphs_batch_085_textual_subgraph_0006.graphml,"What film was released in Australia and Belgium, and featured a makeup artist from Great Britain, as well as being released in the United States?",Quest for Fire
subgraphs_batch_084_textual_subgraph_1000.graphml,"Which film features Ed Harris as an award-winning actor, includes a Visual Effects Supervisor in its crew, was released on DVD, and had its release dates in the United States of America?",The Truman Show
subgraphs_batch_085_textual_subgraph_0005.graphml,"Which film, related to Canada and Brazil, features a Sound Editor from GB and also has a release date in the United States of America?",Quest for Fire
subgraphs_batch_085_textual_subgraph_0007.graphml,"Which film was shot in London, executive produced by Steven Spielberg, has a runtime associated with the United States, and was released on DVD?",Hereafter
subgraphs_batch_085_textual_subgraph_0014.graphml,Which film features a makeup artist from Great Britain and was released in both Australia and the United States?,Quest for Fire
subgraphs_batch_085_textual_subgraph_0009.graphml,"Which film has won the Genie Award for Best Achievement in Overall Sound, was released in both Brazil and the United States, and had a Sound Editor from Great Britain on its crew?",Quest for Fire
subgraphs_batch_085_textual_subgraph_0016.graphml,"Which film, primarily in English and celebrated in the National Film Registry, is closely associated with the United States and was released on DVD?",Groundhog Day
subgraphs_batch_085_textual_subgraph_0015.graphml,"Which film was produced by Scott Rudin, featured music by Marc Shaiman, and had its release dates in the United States on DVD?",In & Out
subgraphs_batch_085_textual_subgraph_0003.graphml,Which adventure film was released in both France and Argentina and featured a makeup artist from Great Britain on its crew?,Quest for Fire
subgraphs_batch_085_textual_subgraph_0018.graphml,"Which film, born in France and affiliated with both the adventure and fantasy genres, has won the Genie Award for Best Achievement in Overall Sound?",Quest for Fire
subgraphs_batch_085_textual_subgraph_0012.graphml,"Which adventure film, produced by Regency Enterprises and featuring a storyboard artist, is related to the United States of America?",Fantastic Mr. Fox
subgraphs_batch_085_textual_subgraph_0010.graphml,"Which film, known for its period piece setting and involving a crew member associated with sound, was released in both Belgium and the United States?",Quest for Fire
subgraphs_batch_085_textual_subgraph_0022.graphml,"Which film has won the I Spy award, features a set decorator and makeup artist from Great Britain, and is related to the United States of America?",Meet Dave
subgraphs_batch_085_textual_subgraph_0017.graphml,"Which adventure film, set as a period piece, was released in both Argentina and the United States?",Quest for Fire
subgraphs_batch_085_textual_subgraph_0011.graphml,Which film features Felicity Huffman and Dolly Parton as award winners and includes a DVD release date and credits a Makeup Artist-GB in its crew?,Transamerica
subgraphs_batch_085_textual_subgraph_0021.graphml,"Which film has won the Academy Award for Best Makeup and Hairstyling, falls under the fantasy genre, was released on DVD, and had a Sound Editor from Great Britain on its crew?",Quest for Fire
subgraphs_batch_085_textual_subgraph_0031.graphml,"Which adventure film was released in Belgium and the United States, and also made available on DVD?",Quest for Fire
subgraphs_batch_085_textual_subgraph_0029.graphml,"Which adventure and fantasy film, released on DVD and associated with France, am I referring to?",Quest for Fire
subgraphs_batch_085_textual_subgraph_0024.graphml,"Which film was released in Canada, Argentina, and the United States, and also had a DVD release date?",Quest for Fire
subgraphs_batch_085_textual_subgraph_0013.graphml,"Which film has won the Academy of Canadian Cinema and Television Award for Best Achievement in Sound Editing and was released in both Argentina and the United States, also featuring a Special Effects Supervisor in its crew?",Quest for Fire
subgraphs_batch_085_textual_subgraph_0025.graphml,"Which film is connected to France, has a release date associated with Japan, won the Academy Award for Best Makeup and Hairstyling, and also had a DVD release date?",Quest for Fire
subgraphs_batch_085_textual_subgraph_0027.graphml,What film was released in both Australia and the United States and features a fantasy genre with notable contributions from its sound crew?,Quest for Fire
subgraphs_batch_085_textual_subgraph_0028.graphml,"Which film was released in France and Belgium, and is also available on DVD and known for being a period piece?",Quest for Fire
subgraphs_batch_085_textual_subgraph_0020.graphml,"Which film features locations in Bali, has a sound mixer and a makeup artist from Great Britain in its crew, and was released in the United States?",Eat Pray Love
subgraphs_batch_085_textual_subgraph_0019.graphml,"Which film had an estimated budget in United States Dollars, included a Set Dresser and a Special Effects Supervisor among its crew, and was released on DVD?",Body of Lies
subgraphs_batch_085_textual_subgraph_0033.graphml,"Which adventure film features music by Hans Zimmer, includes notable visual effects, and was released in the United States?",Madagascar: Escape 2 Africa
subgraphs_batch_085_textual_subgraph_0023.graphml,"Which film features music by Mark Mancina, includes a sound mixer in its crew, is related to the United States, and falls under the fantasy genre?",Imagine That
subgraphs_batch_085_textual_subgraph_0032.graphml,"Which film features music by David Newman, falls under the genres of both crime fiction and fantasy, and was released on DVD?",The Flintstones
