file,query,answer
subgraphs_batch_071_textual_subgraph_0320.graphml,"Which action film, featuring a boom operator and released on DVD, was primarily filmed in the English language?",Rango
subgraphs_batch_071_textual_subgraph_0316.graphml,"Which film features music by Jerry Goldsmith, includes a makeup artist and a sound mixer in its crew, and is associated with the United States of America?",The Haunting
subgraphs_batch_071_textual_subgraph_0315.graphml,"Which film features Hans Zimmer as its music composer, has a boom operator on its crew, is primarily in the English language, and falls under the genre of British comedy?",Rango
subgraphs_batch_071_textual_subgraph_0327.graphml,"Which animated film, made in the United States and primarily in English, has won the BAFTA Award for Best Animated Film?",Rango
subgraphs_batch_071_textual_subgraph_0328.graphml,Which TV show featuring Lauren Tom as a regular cast member is both a British comedy and originates from the United States?,King of the Hill
subgraphs_batch_071_textual_subgraph_0310.graphml,"Which film, directed by someone who won the National Board of Review Award for Best Director, is set in both the United Kingdom and the United States and belongs to the Western genre?",Dances with Wolves
subgraphs_batch_071_textual_subgraph_0323.graphml,"Which film, featuring a Western genre and contributions from a Storyboard Artist, was released on DVD and has a significant connection to the United States of America?",Rango
subgraphs_batch_071_textual_subgraph_0311.graphml,"What film features an Animation Director and a Boom Operator in its crew, is primarily in the English language, and was released on DVD?",Rango
subgraphs_batch_071_textual_subgraph_0330.graphml,"Which film features a Technical Director, a Boom Operator, and a Visual Effects Supervisor, and is also associated with the United States of America?",Rango
subgraphs_batch_071_textual_subgraph_0324.graphml,"Which film features both a Boom Operator and a Sound Mixer in its crew, and is recognized for blending the genres of Western and Action?",Rango
subgraphs_batch_071_textual_subgraph_0326.graphml,"Which film was released in Portugal, Uruguay, and the United States, and is classified under the genre Comedy-GB?",Fast Food Nation
subgraphs_batch_071_textual_subgraph_0331.graphml,"Which animated film, with its story crafted by John Logan and distributed by Paramount Pictures, is associated with the United States of America?",Rango
subgraphs_batch_071_textual_subgraph_0329.graphml,"Which adventure film features Bill Nighy and was distributed by Paramount Pictures, with a notable contribution from a technical director?",Rango
subgraphs_batch_071_textual_subgraph_0325.graphml,"Which TV show features Elizabeth Perkins and Zooey Deschanel as regular cast members and is categorized as an Adventure Film, primarily in English?",Weeds
subgraphs_batch_071_textual_subgraph_0319.graphml,"Which animated film has won the Broadcast Film Critics Association Award for Best Animated Feature, features a Boom Operator and a Visual Effects Supervisor among its crew, and is associated with the United States of America?",Rango
subgraphs_batch_071_textual_subgraph_0332.graphml,"Which musical film, executive produced by Ryan Murphy, was released on DVD and is primarily in the English language?",Glee: The 3D Concert Movie
subgraphs_batch_071_textual_subgraph_0334.graphml,Which American period piece TV movie won a Primetime Emmy Award and was later released on DVD?,Grey Gardens
subgraphs_batch_071_textual_subgraph_0333.graphml,"Which film combines the genres of action and adventure, features a storyboard artist in its crew, and is primarily in the English language?",Rango
subgraphs_batch_071_textual_subgraph_0339.graphml,Which film features both Western and Action genres and has a crew that includes a Technical Director and a Visual Effects Supervisor?,Rango
subgraphs_batch_071_textual_subgraph_0338.graphml,"Which action film, featuring a visual effects supervisor and a boom operator on its crew, was distributed by Paramount Pictures?",Rango
subgraphs_batch_071_textual_subgraph_0349.graphml,"Which animated film features dubbing performances by Mona Marshall and Lily Tomlin, and was released in the United States?",Ponyo
subgraphs_batch_071_textual_subgraph_0345.graphml,"Which film features both a Boom Operator and a Storyboard Artist in its crew, was released on DVD, and is primarily in the English language?",Rango
subgraphs_batch_071_textual_subgraph_0340.graphml,"Which film combines the genres of action and adventure, features a visual effects supervisor, and is presented in the English language?",Rango
subgraphs_batch_071_textual_subgraph_0344.graphml,"Which animated film, known for its comedic genre and featuring a sound editor and visual effects team from the UK, has won the BAFTA Award for Best Animated Film?",Happy Feet
subgraphs_batch_071_textual_subgraph_0343.graphml,"Which action film, featuring a boom operator and produced in the United States, is primarily in the English language?",Rango
subgraphs_batch_071_textual_subgraph_0342.graphml,"What English-language action film, featuring a nomination for Johnny Depp, had a boom operator as part of its crew?",Rango
subgraphs_batch_071_textual_subgraph_0336.graphml,"Which film, directed by Cecil B. DeMille and featuring music by Victor Young, is an English-language adventure that has won prestigious awards?",The Greatest Show on Earth
subgraphs_batch_071_textual_subgraph_0337.graphml,"What film, directed by Sydney Pollack who has won numerous awards, was written by Larry Gelbart, is in the English language, and is associated with the United States?",Tootsie
subgraphs_batch_071_textual_subgraph_0346.graphml,"Which film features both a Boom Operator and a Visual Effects Supervisor, is set in the United States, and is primarily in English?",Rango
subgraphs_batch_071_textual_subgraph_0335.graphml,"Which action-packed Western film, set in the United States and primarily spoken in English, might be the one we're thinking of?",Rango
subgraphs_batch_071_textual_subgraph_0356.graphml,"Which film features a storyboard artist, falls under the genres of Western and British comedy, and is distributed by Paramount Pictures?",Rango
subgraphs_batch_071_textual_subgraph_0348.graphml,"Which film has won both the National Society of Film Critics Award for Best Director and Best Actor, and was released on DVD in English?",Taxi Driver
subgraphs_batch_071_textual_subgraph_0341.graphml,"Which animated film, released on DVD and celebrated with a Broadcast Film Critics Association Award for Best Animated Feature, also had notable contributions from a Boom Operator and a Sound Mixer?",Rango
subgraphs_batch_071_textual_subgraph_0354.graphml,"Which film features a Boom Operator and has a story by John Logan, is in the English language, and was released on DVD?",Rango
subgraphs_batch_071_textual_subgraph_0347.graphml,"Which film features both a Boom Operator and a Storyboard Artist on its crew, is primarily in the English language, and was released on DVD?",Rango
subgraphs_batch_071_textual_subgraph_0351.graphml,"What film features cinematography by Robert Richardson, falls under the genres of political satire and British comedy, and was released on DVD?",Wag the Dog
subgraphs_batch_071_textual_subgraph_0352.graphml,"Which film was born in the United States, is affiliated with genres like Action, Western, and British Comedy?",Rango
subgraphs_batch_071_textual_subgraph_0359.graphml,"Which film features a Storyboard Artist and a Sound Mixer in its crew, falls under the Western genre, and was released on DVD?",Rango
subgraphs_batch_071_textual_subgraph_0357.graphml,"Which action film, featuring a boom operator and distributed by Paramount Pictures, is related to the United States of America?",Rango
subgraphs_batch_071_textual_subgraph_0353.graphml,"Which film features a storyboard artist, falls under the genre of British comedy, was released on DVD, and has a connection to the United States of America?",Rango
subgraphs_batch_071_textual_subgraph_0355.graphml,"Which film, featuring personal appearances by Frank Capra, won awards from CBC Television, is in the English language, and was released on DVD?",Why We Fight
subgraphs_batch_071_textual_subgraph_0350.graphml,"Which film, featuring a makeup artist from Great Britain and a sound mixer in its crew, was released in the United States and won the Broadcast Film Critics Association Award for Best Supporting Actor?",Primary Colors
subgraphs_batch_071_textual_subgraph_0360.graphml,"Which film has an Animation Director and a Boom Operator on its crew, is related to the United States of America, and was released on DVD?",Rango
subgraphs_batch_071_textual_subgraph_0358.graphml,"Which film, featuring a Western theme and supervised by a Visual Effects expert, also has ties to the United States and includes a notable Sound Mixer in its crew?",Rango
subgraphs_batch_071_textual_subgraph_0363.graphml,"Which film blends genres like Action, Western, and British Comedy, and is associated with the United States of America?",Rango
subgraphs_batch_071_textual_subgraph_0361.graphml,"Which film features a storyboard artist and an animation director on its crew, was released on DVD, and is primarily in the English language?",Rango
subgraphs_batch_071_textual_subgraph_0364.graphml,"Which action film, featuring a storyboard artist and produced in the United States, is primarily in English?",Rango
subgraphs_batch_071_textual_subgraph_0362.graphml,"Which film features music by James Horner, falls under the genres of drama and adventure, and is primarily in the English language?",The New World
subgraphs_batch_071_textual_subgraph_0370.graphml,"Which action film, featuring a boom operator and filmed in English, is associated with the United States of America?",Rango
subgraphs_batch_071_textual_subgraph_0371.graphml,"Which animated film, featuring a boom operator in its crew, was produced in the United States and primarily spoken in English?",Rango
subgraphs_batch_071_textual_subgraph_0365.graphml,"Which film, known for its Western and Action-Adventure themes, had a notable Visual Effects Supervisor?",Rango
subgraphs_batch_071_textual_subgraph_0366.graphml,"Which animated film, with a story by John Logan and directed by an animation director, is also associated with the United States and has been released on DVD?",Rango
subgraphs_batch_071_textual_subgraph_0369.graphml,"Which film features a Technical Director, a Sound Mixer, and a Visual Effects Supervisor, and falls under the Western genre?",Rango
subgraphs_batch_071_textual_subgraph_0379.graphml,"Which action film, featuring a technical director and a visual effects supervisor, is closely associated with the United States of America?",Rango
subgraphs_batch_071_textual_subgraph_0367.graphml,"Which film features a Storyboard Artist and a Boom Operator in its crew, is classified as an Adventure Film, and has an estimated budget in United States Dollars?",Rango
subgraphs_batch_071_textual_subgraph_0373.graphml,"Which film, known for its comedic genre and featuring a storyboard artist, was released on DVD and primarily spoken in English?",Rango
subgraphs_batch_071_textual_subgraph_0378.graphml,"Which action and western film, with a story by John Logan, is associated with the United States of America?",Rango
subgraphs_batch_071_textual_subgraph_0368.graphml,"Which film was written by Joseph L. Mankiewicz, produced by The Samuel Goldwyn Company, falls under the genre of Comedy-GB, and was released on DVD?",Guys and Dolls
subgraphs_batch_071_textual_subgraph_0372.graphml,"Which animated adventure film, made in English and with a budget in United States dollars, has won the BAFTA Award for Best Animated Film?",Rango
subgraphs_batch_071_textual_subgraph_0374.graphml,"Which film features John Logan as the story writer, has an animation director among its crew, was released on DVD, and is associated with the United States of America?",Rango
subgraphs_batch_071_textual_subgraph_0380.graphml,"Which TV show features Daniel Roebuck and Treat Williams in its regular cast, originates from the United States, and is associated with the comedy genre?",The Late Shift
subgraphs_batch_071_textual_subgraph_0377.graphml,"Which film features John Logan as the story writer, has a Boom Operator and a Visual Effects Supervisor on its crew, and was made with an estimated budget in United States Dollars?",Rango
subgraphs_batch_071_textual_subgraph_0375.graphml,"Which animated film, featuring a boom operator in its crew, has won the BAFTA Award for Best Animated Film, is primarily in English, and falls under the genre of British comedy?",Rango
subgraphs_batch_071_textual_subgraph_0381.graphml,"Which action film, featuring locations in Mexico and involving key crew members like a Sound Mixer and a Boom Operator, remains unidentified in this context?",Rango
subgraphs_batch_071_textual_subgraph_0376.graphml,"Which animated film, featuring a Visual Effects Supervisor and winner of the BAFTA Award for Best Animated Film, is affiliated with the United States and primarily in the English language?",Rango
subgraphs_batch_071_textual_subgraph_0385.graphml,"Which film has won the BAFTA Award for Best Animated Film, is categorized as both an action and a comedy, and is primarily in the English language?",Rango
subgraphs_batch_071_textual_subgraph_0382.graphml,"Which animated film, known for its comedic style and produced in the United States, has won the BAFTA Award for Best Animated Film and featured a notable boom operator in its crew?",Rango
subgraphs_batch_071_textual_subgraph_0389.graphml,"Which film is both an adventure and a British comedy, and has a technical director associated with the United States?",Rango
subgraphs_batch_071_textual_subgraph_0383.graphml,"Which film won the Los Angeles Film Critics Association Award for Best Actress, is classified as a docudrama, was released on DVD, and had its estimated budget in United States Dollars?",Boys Don't Cry
subgraphs_batch_071_textual_subgraph_0391.graphml,"Which film, associated with Germany and the United States, has an official website and falls under the action genre?",Speed Racer
subgraphs_batch_071_textual_subgraph_0393.graphml,"Which action film, featuring a Technical Director and a Visual Effects Supervisor, is affiliated with the United States of America?",Rango
subgraphs_batch_071_textual_subgraph_0384.graphml,"Which film, set in the United States and primarily in English, has won the Screen Actors Guild Award for Outstanding Performance by a Female Actor in a Leading Role and falls under the drama genre?",The Blind Side
subgraphs_batch_071_textual_subgraph_0387.graphml,"Which action film features a Visual Effects Supervisor and a Boom Operator, and was released on DVD?",Rango
subgraphs_batch_071_textual_subgraph_0396.graphml,"Which film features special effects, falls under the genres of mystery and action, and has an estimated budget in United States Dollars?",Brotherhood of the Wolf
subgraphs_batch_071_textual_subgraph_0395.graphml,"Which film features a Technical Director and Visual Effects Supervisor, is in the English language, and was released on DVD?",Rango
subgraphs_batch_071_textual_subgraph_0390.graphml,"Which film was released in Norway, produced by the UK Film Council, also had a release date in the United States, and was primarily in the English language?",Tyrannosaur
subgraphs_batch_071_textual_subgraph_0392.graphml,"Which film was released in Panama and the United States, features Washington, D.C. as a prominent location, and is primarily in the English language?",The Butterfly Effect
subgraphs_batch_071_textual_subgraph_0394.graphml,"What film combines the genres of action, adventure, and British comedy, and also features notable work from a sound mixer?",Rango
subgraphs_batch_071_textual_subgraph_0388.graphml,"What film, known for its world cinema genre and affiliation with Liechtenstein, was released on DVD and had an estimated budget measured in United States Dollars?","Paris, je t'aime"
subgraphs_batch_071_textual_subgraph_0399.graphml,"Which action film, directed by an animation director, is related to the United States and primarily in English?",Rango
subgraphs_batch_071_textual_subgraph_0386.graphml,"Which film features a story by John Logan and has a crew that includes a Boom Operator, Sound Mixer, and Visual Effects Supervisor?",Rango
subgraphs_batch_071_textual_subgraph_0397.graphml,"Which film features a Western and Comedy-GB blend, and has a Storyboard Artist and Visual Effects Supervisor on its crew?",Rango
subgraphs_batch_071_textual_subgraph_0398.graphml,"Which action film, created with the expertise of a storyboard artist, is affiliated with the United States and primarily features dialogue in English?",Rango
subgraphs_batch_071_textual_subgraph_0404.graphml,"Which action film, recognized with a BAFTA Award for Best Animated Film, involved a notable Visual Effects Supervisor and was released on DVD?",Rango
subgraphs_batch_071_textual_subgraph_0403.graphml,Which film features both a Storyboard Artist and a Boom Operator in its crew and is associated with the genres of Action and Animation?,Rango
subgraphs_batch_071_textual_subgraph_0408.graphml,"Which action film features a boom operator and a visual effects supervisor, and was also released on DVD?",Rango
subgraphs_batch_071_textual_subgraph_0400.graphml,"Which film features a Boom Operator, falls under the genres of Western, Animation, and Adventure, and remains unnamed in this context?",Rango
subgraphs_batch_071_textual_subgraph_0411.graphml,"Which action film, featuring a sound mixer in its crew, was released on DVD and primarily spoken in English?",Rango
subgraphs_batch_071_textual_subgraph_0405.graphml,"Which film combines the genres of action and comedy, features Mexico as a prominent filming location, and has a notable contribution from a sound mixer?",Rango
subgraphs_batch_071_textual_subgraph_0406.graphml,Who is the television director married to someone and has been both a winner of the Golden Globe Award for Best Animated Feature Film and nominated for the Academy Award for Best Animated Feature Film?,John Lasseter
subgraphs_batch_071_textual_subgraph_0413.graphml,"Which action and adventure film, with an estimated budget in United States Dollars and released on DVD, are we referring to?",Rango
subgraphs_batch_071_textual_subgraph_0407.graphml,"Which TV show, produced by Jerry Nelson and featuring the genre of comedy from Great Britain, also has its roots in the United States and involves an executive producer?",The Muppet Show-GB
subgraphs_batch_071_textual_subgraph_0420.graphml,Which animated action film features dubbing performances by Luci Christian and John Swasey?,EX Machina
subgraphs_batch_071_textual_subgraph_0401.graphml,"Which film, directed in a period piece style and featuring English dialogue, has won the National Society of Film Critics Award for Best Director and is also recognized for its British comedy elements?",Hope and Glory
subgraphs_batch_071_textual_subgraph_0409.graphml,"Which film, featuring a Makeup Artist from Great Britain and a Visual Effects Supervisor, falls under the Biography genre and is associated with the United States of America?",Quills
subgraphs_batch_071_textual_subgraph_0402.graphml,"Which film features a blend of comedy and drama, has a makeup artist from Great Britain on its crew, and was also categorized under British comedy and released on DVD?",Garden State
subgraphs_batch_071_textual_subgraph_0410.graphml,"Which animated film, featuring the work of both a Boom Operator and a Sound Mixer, has won the BAFTA Award for Best Animated Film and falls under the genre of British comedy?",Rango
subgraphs_batch_071_textual_subgraph_0416.graphml,"Which film features personal appearances by James Brown and B.B. King, is related to the United States, and is primarily in the English language?",When We Were Kings
subgraphs_batch_071_textual_subgraph_0412.graphml,"Which film features a Visual Effects Supervisor and falls under the genres of Western and Action, and also has a release date associated with its DVD version?",Rango
subgraphs_batch_071_textual_subgraph_0415.graphml,"What animated film, released on DVD and featuring Greg Ayres in its dubbing, is associated with Japan?",Evangelion 1.11: You Are (Not) Alone
subgraphs_batch_071_textual_subgraph_0419.graphml,"Which film, known for its LGBT and indie themes, features a notable sound mixer and is associated with the United States of America?",I Shot Andy Warhol
subgraphs_batch_071_textual_subgraph_0414.graphml,"Which film was produced by Relativity Media and executive produced by Katherine Heigl, and also had a Boom Operator and a Visual Effects Supervisor on its crew?",The Ugly Truth
subgraphs_batch_071_textual_subgraph_0417.graphml,"Which film, produced by Warner Bros. Entertainment, won the Academy Award for Best Cinematography, was made in the United States, and is in the English language?",Anthony Adverse
subgraphs_batch_071_textual_subgraph_0423.graphml,"Which film features a Boom Operator and a Visual Effects Supervisor, is in the English language, and was released on DVD?",Rango
subgraphs_batch_071_textual_subgraph_0418.graphml,Which actress has won the London Film Critics Circle Award for Actress of the Year for her role in a comedy-drama film that was in English and involved a notable sound mixer?,Erin Brockovich
subgraphs_batch_071_textual_subgraph_0421.graphml,"Which action film, featuring a boom operator and a storyboard artist, was primarily shot in the English language?",Rango
subgraphs_batch_071_textual_subgraph_0428.graphml,"Which teen film, released on DVD and affiliated with the United States, has won the BAFTA Award for Best Film?",Dead Poets Society
subgraphs_batch_071_textual_subgraph_0426.graphml,"Which film was released in both Australia and the United States, features English dialogue, and has won the BAFTA Award for Best Film Music?","Merry Christmas, Mr. Lawrence"
subgraphs_batch_071_textual_subgraph_0424.graphml,"Which film belongs to the genre of world cinema, features a Sound Editor from Great Britain, includes a Boom Operator in its crew, and has been released on DVD?",The Motorcycle Diaries
subgraphs_batch_071_textual_subgraph_0422.graphml,"Which film, featuring Katharine Hepburn and belonging to the drama genre, had its estimated budget in United States Dollars and was released on DVD?",Guess Who's Coming to Dinner
subgraphs_batch_071_textual_subgraph_0435.graphml,"Which action film, featuring a boom operator and a sound mixer in its crew, is associated with the United States of America?",Rango
subgraphs_batch_071_textual_subgraph_0427.graphml,"Which film features a story by John Logan, includes a storyboard artist in its crew, is presented in the English language, and was released on DVD?",Rango
subgraphs_batch_071_textual_subgraph_0425.graphml,"Which film features a Boom Operator and has a story by John Logan, is in the English language, and is related to the United States of America?",Rango
subgraphs_batch_071_textual_subgraph_0433.graphml,"Which film combines the genres of comedy and action, was released on DVD, and has a connection to the United States of America?",Rango
subgraphs_batch_071_textual_subgraph_0439.graphml,"Which romantic film, distributed in the United Kingdom and featuring a sound mixer, is primarily in the English language?",Mr. Nobody
subgraphs_batch_071_textual_subgraph_0431.graphml,"Which film features both a Boom Operator and a Visual Effects Supervisor on its crew, and is recognized for blending the genres of Western and British Comedy?",Rango
subgraphs_batch_071_textual_subgraph_0432.graphml,"Which film features a Technical Director and a Boom Operator on its crew, is distributed by Paramount Pictures, and has been released on DVD?",Rango
subgraphs_batch_071_textual_subgraph_0442.graphml,"Which film features a Technical Director and a Boom Operator, is primarily in the English language, and is associated with the United States of America?",Rango
subgraphs_batch_071_textual_subgraph_0436.graphml,Which TV show featuring Brad Garrett as a regular cast member combines elements of Fantasy and Action Film genres and originates from the United States?,The Transformers
subgraphs_batch_071_textual_subgraph_0438.graphml,"Which film features a Storyboard Artist and a Visual Effects Supervisor, and falls under both the Action and Adventure genres?",Rango
subgraphs_batch_071_textual_subgraph_0429.graphml,"Which film was released in both Sweden and Japan, had a sound mixer on its crew, and was made with an estimated budget in United States Dollars?",Naked Lunch
subgraphs_batch_071_textual_subgraph_0430.graphml,"Which film features a story by John Logan, includes a storyboard artist in its crew, is in the English language, and was released on DVD?",Rango
subgraphs_batch_071_textual_subgraph_0445.graphml,"Which film features a Technical Director and a Boom Operator in its crew, was released on DVD, and is primarily in the English language?",Rango
subgraphs_batch_071_textual_subgraph_0437.graphml,"Which animated action film, affiliated with the United States and primarily in English, has won the BAFTA Award for Best Animated Film?",Rango
subgraphs_batch_071_textual_subgraph_0434.graphml,"Which animated film features an animation director and storyboard artist, is in the English language, and is associated with the United States of America?",Rango
subgraphs_batch_071_textual_subgraph_0440.graphml,"Which film was executive produced by Avi Arad, featured music by Marco Beltrami, involved a Visual Effects Supervisor, and is related to the United States of America?",Blade II
