file,query,answer
subgraphs_batch_071_textual_subgraph_0570.graphml,"Which film, known for its Western and Action genres, features a Storyboard Artist and is primarily in the English language?",Rango
subgraphs_batch_071_textual_subgraph_0575.graphml,"Which film is both an adventure and a British comedy, and features a Technical Director and a Visual Effects Supervisor in its crew?",Rango
subgraphs_batch_071_textual_subgraph_0564.graphml,"Which film features a Western genre and has a crew that includes a Boom Operator, Sound Mixer, and Visual Effects Supervisor?",Rango
subgraphs_batch_071_textual_subgraph_0572.graphml,"What animated film, featuring a Boom Operator in its crew and primarily in English, is associated with the United States of America?",Rango
subgraphs_batch_071_textual_subgraph_0576.graphml,"Which action film, featuring a boom operator on its crew, was released on DVD and primarily spoken in English?",Rango
subgraphs_batch_071_textual_subgraph_0574.graphml,"Which film, executive produced by Eric Fellner, is set in Australia, features titles related to the Western genre, and is primarily in the English language?",Ned Kelly
subgraphs_batch_071_textual_subgraph_0567.graphml,Which English-language sitcom featuring a character who has won the Primetime Emmy Award for Outstanding Supporting Actress in a Comedy Series is also known for its Comedy-GB genre?,Bewitched
subgraphs_batch_071_textual_subgraph_0577.graphml,"Which romantic comedy film was released in Spain and is affiliated with the 84th Academy Awards, also having a connection to the United States of America?",Midnight in Paris
subgraphs_batch_071_textual_subgraph_0579.graphml,"Which Western and Action film, made in the United States and primarily in English, are we referring to?",Rango
subgraphs_batch_071_textual_subgraph_0571.graphml,"What film features a Boom Operator and a Sound Mixer in its crew, is set in the United States of America, and belongs to the Western genre?",Rango
subgraphs_batch_071_textual_subgraph_0573.graphml,"Which film, released on DVD and featuring a Boom Operator and a Visual Effects Supervisor, is affiliated with the United States of America?",Rango
subgraphs_batch_071_textual_subgraph_0584.graphml,"Which film was executive produced by Harvey Weinstein, primarily spoken in Spanish and English, and released in the United States?",Kill Bill Volume 2
subgraphs_batch_071_textual_subgraph_0580.graphml,"What TV show features Christopher McCulloch as a regular cast member, has an official website linked to Common, is categorized as an adventure film, and originates from the United States?",The Venture Bros.
subgraphs_batch_071_textual_subgraph_0583.graphml,"Which action film, with an estimated budget in United States Dollars and distributed by Paramount Pictures, is related to the United States of America?",Rango
subgraphs_batch_071_textual_subgraph_0581.graphml,"What drama film was released in France and on DVD, and was also made in the English language?",Swimming Upstream
subgraphs_batch_071_textual_subgraph_0587.graphml,"Which film was released in Canada and Denmark-GB, is related to the United States of America, and was made in the English language?",Kaboom
subgraphs_batch_071_textual_subgraph_0578.graphml,"Which film, featuring a Technical Director and classified as both an Action and Adventure genre, is closely associated with the United States of America?",Rango
subgraphs_batch_071_textual_subgraph_0585.graphml,"What is the name of the film that has an official webpage, features a sound editor in its crew, falls under the genre of British comedy, and is primarily in the English language?",Cats & Dogs
subgraphs_batch_071_textual_subgraph_0590.graphml,"Which film was released in the United States, features music by Hans Zimmer, came out on DVD, and is primarily in English?",Rango
subgraphs_batch_071_textual_subgraph_0586.graphml,"Which action film features a sound mixer and a visual effects supervisor, and was also released on DVD?",Rango
subgraphs_batch_071_textual_subgraph_0589.graphml,Which film features John Logan as its storyboard artist and is related to the English language and released on DVD?,Rango
subgraphs_batch_071_textual_subgraph_0588.graphml,"Which adventure film, featuring Spanish language dialogue and notable special effects, also credits a boom operator as part of its crew?",Resident Evil: Afterlife
subgraphs_batch_071_textual_subgraph_0591.graphml,Which animated film that has won a BAFTA Award and falls under the genres of action and adventure was made in English?,Rango
subgraphs_batch_071_textual_subgraph_0582.graphml,"Which film has been nominated for awards for both Saboteur and Family Plot, and was also released on DVD in the United States of America?",The Birds
subgraphs_batch_071_textual_subgraph_0592.graphml,What animated film featuring music by Hans Zimmer is both in the English language and falls under the genre of British comedy?,Rango
subgraphs_batch_071_textual_subgraph_0597.graphml,"Which romantic comedy film, set in the United States and primarily in English, has won awards including The Help?","Crazy, Stupid, Love."
subgraphs_batch_071_textual_subgraph_0593.graphml,"Which animated film, made in the United States and primarily in English, has won the BAFTA Award for Best Animated Film?",Rango
subgraphs_batch_071_textual_subgraph_0599.graphml,"Which romance film was released in Portugal and on DVD, and is also available in the English language?",My Man Godfrey
subgraphs_batch_071_textual_subgraph_0604.graphml,"Which film, featuring a storyboard artist and falling under the genres of Western and Adventure, is associated with the United States of America?",Rango
subgraphs_batch_071_textual_subgraph_0602.graphml,"Which film, known for blending the genres of action and Western, is associated with the United States and primarily features dialogue in English?",Rango
subgraphs_batch_071_textual_subgraph_0605.graphml,"Which film combines the genres of comedy and action, was released on DVD, and is primarily in the English language?",Rango
subgraphs_batch_071_textual_subgraph_0598.graphml,"Which animated film features dubbing performances by Timothy Daly and Frank Welker, was released in the United States, and is available on DVD?",My Neighbor Totoro
subgraphs_batch_071_textual_subgraph_0596.graphml,"Which film starring Julie Andrews, known for its musical and comedy elements, is associated with both the United States and the United Kingdom?",Victor Victoria
subgraphs_batch_071_textual_subgraph_0608.graphml,"Which action film, featuring a boom operator and produced in the United States, is primarily in English?",Rango
subgraphs_batch_071_textual_subgraph_0607.graphml,"Which film features music by Alan Menken, falls under the genres of romance and animation, and was released in the United States?",The Little Mermaid
subgraphs_batch_071_textual_subgraph_0594.graphml,"Which film, known for its technical direction and blending of Western and action genres, was primarily made in the English language?",Rango
subgraphs_batch_071_textual_subgraph_0603.graphml,"Which film combines elements of Western and Action genres, is primarily in English, and also falls under the category of British Comedy?",Rango
subgraphs_batch_071_textual_subgraph_0601.graphml,"Which animated film, featuring both a Boom Operator and a Sound Mixer in its crew, has won the Broadcast Film Critics Association Award for Best Animated Feature and is associated with the United States of America?",Rango
subgraphs_batch_071_textual_subgraph_0595.graphml,"Which animated film, directed by an animation director and winner of the BAFTA Award for Best Animated Film, was made with a budget in United States Dollars and released on DVD?",Rango
subgraphs_batch_071_textual_subgraph_0610.graphml,"Which film features genres like Adventure, Animation, and Action, and credits a Storyboard Artist among its crew?",Rango
subgraphs_batch_071_textual_subgraph_0609.graphml,"Which film was primarily shot in Mexico, falls under the Western genre, is in the English language, and had a notable Visual Effects Supervisor on its crew?",Rango
subgraphs_batch_071_textual_subgraph_0606.graphml,"Which film features a Boom Operator and has a story by John Logan, is related to the United States of America, and is primarily in the English language?",Rango
subgraphs_batch_071_textual_subgraph_0614.graphml,"What film was written by John Logan, featured a Storyboard Artist in its crew, is in the English language, and was released on DVD?",Rango
subgraphs_batch_071_textual_subgraph_0613.graphml,"Which film is both an anime and an action film, produced by DC Comics, and is in the English language?",Batman: Gotham Knight
subgraphs_batch_071_textual_subgraph_0612.graphml,"Which film features both a Boom Operator and an Animation Director, is primarily in English, and was released on DVD?",Rango
subgraphs_batch_071_textual_subgraph_0611.graphml,"Which animated film has won the BAFTA Award for Best Animated Film, was released in the United States, and is available in English on DVD?",Rango
subgraphs_batch_071_textual_subgraph_0600.graphml,"Which film features Bruce Broughton as a recipient of its awards, has a Sound Editor from Great Britain, and includes a Visual Effects Supervisor among its crew, as well as being released on DVD?",Lost in Space
subgraphs_batch_071_textual_subgraph_0617.graphml,"Which action film, released on DVD and featuring a storyboard artist, is associated with the United States of America?",Rango
subgraphs_batch_071_textual_subgraph_0616.graphml,"Which film features a Boom Operator, falls under the genres of Western, Animation, and Comedy-GB, and remains unnamed in this context?",Rango
subgraphs_batch_071_textual_subgraph_0625.graphml,Which action film features Mexico as a prominent filming location and includes both a Boom Operator and a Visual Effects Supervisor on its crew?,Rango
subgraphs_batch_071_textual_subgraph_0624.graphml,"What popular TV series combines the genres of teen drama and thriller, is primarily in English, and was born in the United States?",Pretty Little Liars
subgraphs_batch_071_textual_subgraph_0615.graphml,"Which film features both a Boom Operator and a Storyboard Artist on its crew, is classified as an Action Film, and has an estimated budget denominated in United States Dollars?",Rango
subgraphs_batch_071_textual_subgraph_0622.graphml,"Which action film, with a story by John Logan and visual effects supervised by another crew member, had an estimated budget in United States Dollars?",Rango
subgraphs_batch_071_textual_subgraph_0621.graphml,"What is the name of the film that is classified as both an Action and Adventure genre and was distributed by Paramount Pictures, with a release date on DVD?",Rango
subgraphs_batch_071_textual_subgraph_0627.graphml,"Which animated action film, featuring the work of a storyboard artist, is associated with the United States of America?",Rango
subgraphs_batch_071_textual_subgraph_0620.graphml,"Which animated TV show, featuring Don Messick as a regular cast member and primarily in the fantasy genre, is also known for being in the English language?",The Smurfs
subgraphs_batch_071_textual_subgraph_0618.graphml,"Which film was released in the United States, features music by Hans Zimmer, has an estimated budget in United States Dollars, and falls under the genre of British Comedy?",Rango
subgraphs_batch_071_textual_subgraph_0631.graphml,"Which animated action film, primarily in English, has won the BAFTA Award for Best Animated Film and is associated with the United States of America?",Rango
subgraphs_batch_071_textual_subgraph_0623.graphml,"Which film features Ray Winstone, has a storyboard artist on its crew, and blends the genres of action and Western?",Rango
subgraphs_batch_071_textual_subgraph_0629.graphml,"Which film, blending the genres of supernatural and mystery, is associated with the United States and was released on DVD?",It
subgraphs_batch_071_textual_subgraph_0619.graphml,Which animated series featuring Tom Kenny as a regular cast member was born in the United States and is affiliated with both the adventure film genre and TV's animated genre?,SpongeBob SquarePants
subgraphs_batch_071_textual_subgraph_0626.graphml,"Which film, known for its comedic genre and featuring a boom operator in its crew, is primarily in English and has a strong connection to the United States?",Rango
subgraphs_batch_071_textual_subgraph_0632.graphml,"Which comedy film, executive produced by Allen Covert, was released in Japan and primarily features the English language?",Grown Ups
subgraphs_batch_071_textual_subgraph_0628.graphml,"Which film combines the genres of action and adventure, is presented in the English language, and features a notable sound mixer in its crew?",Rango
subgraphs_batch_071_textual_subgraph_0636.graphml,"Which animated action film, directed by a notable animation director, is primarily in English and had its budget estimated in United States dollars?",Rango
subgraphs_batch_071_textual_subgraph_0630.graphml,"Which film features a Boom Operator, a Storyboard Artist, a Visual Effects Supervisor, and is primarily in the English language?",Rango
subgraphs_batch_071_textual_subgraph_0637.graphml,"Which animated film, made in the United States and primarily in English, has won the BAFTA Award for Best Animated Film?",Rango
subgraphs_batch_071_textual_subgraph_0639.graphml,"Which film features a Boom Operator, falls under the Western genre, was released on DVD, and is primarily in the English language?",Rango
subgraphs_batch_071_textual_subgraph_0638.graphml,Which animated film featuring music by Hans Zimmer is primarily in English and also falls under the genre of British comedy?,Rango
subgraphs_batch_071_textual_subgraph_0635.graphml,"Which film, known for its action and comedy elements, features a storyboard artist and has a strong connection to the United States of America?",Rango
subgraphs_batch_071_textual_subgraph_0644.graphml,"Which film features both a Boom Operator and a Storyboard Artist on its crew, and is categorized under the genres of Action and Animation?",Rango
subgraphs_batch_071_textual_subgraph_0640.graphml,"Which English-language comedy film, released on DVD and featuring a Visual Effects Supervisor, is known for its unique blend of humor and captivating visual effects?",Rango
subgraphs_batch_071_textual_subgraph_0634.graphml,"What film is both a sequel to ""Superman II: The Richard Donner Cut"" and falls under the genre of Adventure, being available in both Spanish and English languages?",Superman III
subgraphs_batch_071_textual_subgraph_0642.graphml,"Which film has a story by John Logan, was released on DVD, is related to the United States of America, and is in the English language?",Rango
subgraphs_batch_071_textual_subgraph_0646.graphml,"Which film features both a Storyboard Artist and a Boom Operator in its crew, and is associated with genres like Animation and Action Film?",Rango
subgraphs_batch_071_textual_subgraph_0648.graphml,"Which film, known for its action-packed scenes and impressive visual effects, also blends elements of comedy and has strong ties to the United States of America?",Rango
subgraphs_batch_071_textual_subgraph_0641.graphml,"Which film, known for blending action and comedy genres, has won the BAFTA Award for Best Animated Film and is associated with the United States of America?",Rango
subgraphs_batch_071_textual_subgraph_0655.graphml,"Which award is associated with nominees such as Little Miss Sunshine, Moonrise Kingdom, The Dark Knight, and District 9?",Producers Guild of America Award for Best Theatrical Motion Picture
subgraphs_batch_071_textual_subgraph_0633.graphml,"What is the name of the film whose story was crafted by John Logan, featuring a Boom Operator in its crew, and falls under the genres of both Animation and Action Film?",Rango
subgraphs_batch_071_textual_subgraph_0647.graphml,"Which film features a Boom Operator and a Visual Effects Supervisor, is released in the English language, and has a DVD release date?",Rango
subgraphs_batch_071_textual_subgraph_0652.graphml,"Who is the Japanese voice actor known for their work in both ""Case Closed: Captured in Her Eyes"" and ""Fist of the North Star""?",Kaneto Shiozawa
subgraphs_batch_071_textual_subgraph_0649.graphml,"Which action film, featuring the work of a storyboard artist and released on DVD, is closely associated with the United States of America?",Rango
subgraphs_batch_071_textual_subgraph_0653.graphml,"Who is the film producer from Great Britain who worked on ""A Beautiful Mind"" and is also associated with ""Man of Steel"" and won awards for ""Gladiator""?",Russell Crowe
subgraphs_batch_071_textual_subgraph_0645.graphml,"What film, featuring Chiwetel Ejiofor who has won awards, falls under the mystery genre, has an estimated budget in United States Dollars, and is primarily in the English language?",Dirty Pretty Things
subgraphs_batch_071_textual_subgraph_0650.graphml,"Who is the actor that was born in Huntington and is known for his roles in ""Color of Night,"" ""Alien Resurrection,"" and ""Dune""?",Brad Dourif
subgraphs_batch_071_textual_subgraph_0654.graphml,"What type of film is connected to both the animated adventure of Popeye and the action-packed thriller From Dusk till Dawn, and also features in the collection of films known as Kaboom?",Cult film
subgraphs_batch_071_textual_subgraph_0643.graphml,"Which film features music by Klaus Badelt, is in the Filipino language, includes a sound mixer in its crew, and was released in the United States?",Constantine
subgraphs_batch_071_textual_subgraph_0656.graphml,"Which award has been won by both David Fincher and James Ivory, and is also associated with the accolades received by the films ""Ran"" and ""The Last Samurai""?",National Board of Review Award for Best Director
subgraphs_batch_071_textual_subgraph_0657.graphml,"Which actor has been nominated for both The Last Emperor and the Razzie Award for Worst Actor, and is also known for his roles in the films Prometheus and Troy?",Peter O'Toole
subgraphs_batch_071_textual_subgraph_0660.graphml,"Which historical event is associated with significant military involvement in Asia and New Zealand, and has been depicted in films such as ""The Longest Day"" and ""Saving Private Ryan""?",World War II
subgraphs_batch_071_textual_subgraph_0663.graphml,"Which prestigious writing award, won in 2006 for ""The Insider"" and also nominated for ""Out of Sight"" and ""Crouching Tiger, Hidden Dragon,"" is this entity associated with?",Writers Guild of America Award for Best Adapted Screenplay
subgraphs_batch_071_textual_subgraph_0658.graphml,"Who is the film producer from Great Britain who was influenced by Richard Pryor and worked on movies like ""Ice Age: Dawn of the Dinosaurs"" and ""Small Soldiers""?",Denis Leary
subgraphs_batch_071_textual_subgraph_0662.graphml,"Which actor has won an Independent Spirit Award for Best First Screenplay, was nominated for an award related to Con Air, and is associated with the film Dead Man?",Steve Buscemi
subgraphs_batch_071_textual_subgraph_0664.graphml,"Which actor has been influenced by George Carlin, was nominated for awards for his role in Moonrise Kingdom, and appeared in both the film adaptations of Charlie's Angels and Get Smart?",Bill Murray
subgraphs_batch_071_textual_subgraph_0659.graphml,"Who is the individual born in Los Angeles County who has been nominated for awards alongside James Cameron and is known for editing both ""Seraphim Falls"" and ""Terminator Salvation""?",Conrad Buff
subgraphs_batch_071_textual_subgraph_0666.graphml,"Which country has athletes who participated in the 2004 Summer Olympics, won medals in the 2010 Winter Olympics, and is associated with the release dates of the films ""Knight and Day"" and ""Cars 2""?",Kazakhstan
subgraphs_batch_071_textual_subgraph_0672.graphml,"Which actress has been nominated for awards alongside Claudia Schiffer and has appeared in films such as ""I Am Legend,"" ""Men in Black 3,"" and ""Brave""?",Emma Thompson
subgraphs_batch_071_textual_subgraph_0668.graphml,"Which actor has appeared in the films Juno, Paul, Hancock, and Smokin' Aces?",Jason Bateman
subgraphs_batch_071_textual_subgraph_0674.graphml,"Who is the individual that has been nominated for a Satellite Award for Best Original Song, is married, and has contributed to the music of films like ""Sin City"" and ""Kill Bill Volume 2""?",Robert Rodriguez
subgraphs_batch_071_textual_subgraph_0677.graphml,"Who is the composer that provided the music for ""The Fast and the Furious: Tokyo Drift"" and ""Constantine,"" and was also nominated for an award for ""The Expendables""?",Brian Tyler
subgraphs_batch_071_textual_subgraph_0665.graphml,"Which award is associated with nominees from ""The Birdcage,"" ""50 First Dates,"" and ""Rush Hour 2,"" and has also been won by ""The Lord of the Rings: The Two Towers""?",MTV Movie Award for Best On-Screen Duo
subgraphs_batch_071_textual_subgraph_0673.graphml,"Who is the actor that has been nominated for a Tony Award for Best Actor in a Play alongside Denise Richards and has also appeared in movies like ""Clash of the Titans"" and ""Batman Begins""?",Liam Neeson
subgraphs_batch_071_textual_subgraph_0667.graphml,"Which actor has won awards for his role in a film like ""One Flew Over the Cuckoo's Nest"" and has also been nominated for awards in a movie such as ""Prizzi's Honor,"" while being associated with the film ""Batman""?",Jack Nicholson
subgraphs_batch_071_textual_subgraph_0670.graphml,"Which award is associated with nominees from films like ""The Fighter,"" ""The Assassination of Jesse James by the Coward Robert Ford,"" ""Drive,"" and ""Rise of the Planet of the Apes""?",Broadcast Film Critics Association Award for Best Supporting Actor
subgraphs_batch_071_textual_subgraph_0669.graphml,"Who is the actor from Great Britain who has been nominated for a Broadcast Film Critics Association Award for Best Supporting Actor and has appeared in both the film ""Beowulf"" and the film ""Thor""?",Anthony Hopkins
subgraphs_batch_071_textual_subgraph_0675.graphml,"Who is the person married to Daniel Craig and known for her roles in films like ""The Mummy,"" ""Constantine,"" and ""Enemy at the Gates""?",Rachel Weisz
subgraphs_batch_071_textual_subgraph_0676.graphml,"Which actor, known for his work with Icon Productions and collaborating with Ridley Scott, also starred in movies like Lethal Weapon 4 and We Were Soldiers?",Mel Gibson
subgraphs_batch_071_textual_subgraph_0671.graphml,"Which city is home to both the Detroit Lions and Detroit Tigers, and also served as a filming location for ""Transformers: Dark of the Moon"" and ""RoboCop""?",Detroit
subgraphs_batch_071_textual_subgraph_0661.graphml,"Who is the British television producer known for producing films like ""Pineapple Express"" and ""Talladega Nights: The Ballad of Ricky Bobby,"" and has also been nominated for a Grammy Award for Best Song Written for a Motion Picture, Television, or Other Visual Media?",Judd Apatow
subgraphs_batch_071_textual_subgraph_0683.graphml,"Which award has been won by both Clea DuVall and Mark Addy, and has also recognized films like Gladiator and Saving Private Ryan as nominees?",Screen Actors Guild Award for Outstanding Performance by a Cast in a Motion Picture
subgraphs_batch_071_textual_subgraph_0685.graphml,"What is the common theme or category that connects the films ""I Love You Phillip Morris,"" ""Transamerica,"" ""Kung Fu Panda 2,"" and ""Dune""?",LGBT
subgraphs_batch_071_textual_subgraph_0678.graphml,"Which prestigious award has been won by Tom Hanks and has nominees including those from ""Quills,"" ""Mutiny on the Bounty,"" and ""Henry V""?",Academy Award for Best Actor
subgraphs_batch_071_textual_subgraph_0681.graphml,"Which renowned individual is connected to the films ""Interview"" and ""Hamlet,"" as well as the award nominations for ""The Sand Pebbles"" and the film ""A Bridge Too Far""?",Richard Attenborough
subgraphs_batch_071_textual_subgraph_0686.graphml,"Which prestigious award is associated with nominees from films like Bulworth, The Conversation, Prizzi's Honor, and The Towering Inferno?",Golden Globe Award for Best Screenplay - Motion Picture
subgraphs_batch_071_textual_subgraph_0680.graphml,"Which actor has won a Razzie Award for Worst Supporting Actor and was also nominated for an award for his role in ""The Lord of the Rings: The Two Towers,"" in addition to being part of the film ""Troy""?",Orlando Bloom
subgraphs_batch_071_textual_subgraph_0689.graphml,What film genre is known for its dark humor and is also associated with movies like Snatch and Smokin' Aces?,Black comedy
subgraphs_batch_071_textual_subgraph_0687.graphml,"Which country is known for its military conflicts with Nazi Germany, is partially located along the Danube, and has served as the backdrop for films like Hellboy and Terminator Salvation?",Slovakia
subgraphs_batch_071_textual_subgraph_0682.graphml,"Which actor has been nominated for a National Society of Film Critics Award for Best Supporting Actor, appeared in ""Cannonball Run II,"" and starred in ""In the Name of the King: A Dungeon Siege Tale""?",Burt Reynolds
subgraphs_batch_071_textual_subgraph_0684.graphml,"Which film editor has been nominated for both the Academy Award for Best Film Editing and an award related to Sleepy Hollow, and has also worked on the films Hudson Hawk and Armageddon?",Chris Lebenzon
subgraphs_batch_071_textual_subgraph_0679.graphml,"What prestigious honor has been awarded to winners of the 26th Academy Awards and nominees of films like Kramer vs. Kramer, District 9, and Full Metal Jacket?",Academy Award for Best Writing Adapted Screenplay
