file,query,answer
subgraphs_batch_022_textual_subgraph_0588.graphml,"Who is the voice actor born in Los Angeles, known for their work in the film ""Pulp Fiction"" and holding United States nationality?",Phil LaMarr
subgraphs_batch_022_textual_subgraph_0592.graphml,Who is the male voice actor known for his work in Iron Man 3 and has been married?,Stan Lee
subgraphs_batch_022_textual_subgraph_0590.graphml,"Who is the male individual born in the United States of America, affiliated with Judaism, and known for his involvement in the film Iron Man 3?",Stan Lee
subgraphs_batch_022_textual_subgraph_0591.graphml,"Who is the voice actor known for their work in the X-Men films and also recognized as an accomplished actor from Great Britain, who has been married?",Stan Lee
subgraphs_batch_022_textual_subgraph_0585.graphml,"Who is the male individual who has been married and is associated with the films ""Iron Man 3"" and ""The Avengers""?",Stan Lee
subgraphs_batch_022_textual_subgraph_0596.graphml,"Which film was released in Brazil and the United States, features a sound editor from Great Britain, and falls under the fantasy genre?",Quest for Fire
subgraphs_batch_022_textual_subgraph_0594.graphml,"Which film features Bruce Davison and has an animation director and sound mixer on its crew, with its estimated budget measured in United States Dollars?",X-Men
subgraphs_batch_022_textual_subgraph_0597.graphml,"Which animated film, featuring locations in Toronto and distributed on DVD, has an animation director and is closely associated with the United States of America?",X-Men
subgraphs_batch_022_textual_subgraph_0589.graphml,"Who is the individual born in Great Britain, affiliated with Judaism, known for being both a screenwriter and an actor, and has won awards similar to those won by Steve Ditko?",Stan Lee
subgraphs_batch_022_textual_subgraph_0604.graphml,Which TV show is available in both German and Italian and falls under the genres of Fantasy and Science Fiction?,Sonic X
subgraphs_batch_022_textual_subgraph_0599.graphml,"Which film was executive produced by Stan Lee and Avi Arad, distributed through streaming media, and had an estimated budget in United States Dollars?",X-Men
subgraphs_batch_022_textual_subgraph_0598.graphml,"Which film has an estimated budget in United States Dollars, features Gary Rydstrom as part of its crew, is related to the United States of America, and was distributed on DVD?",X-Men
subgraphs_batch_022_textual_subgraph_0595.graphml,"Which animated action film, featuring locations in Toronto and directed by an animation director, is also associated with the United States of America?",X-Men
subgraphs_batch_022_textual_subgraph_0593.graphml,"Who is the individual known for being a voice actor, has been involved with the X-Men film series, and also holds professions as an actor and film producer from Great Britain?",Stan Lee
subgraphs_batch_022_textual_subgraph_0603.graphml,"Which action film, featuring New York City as a prominent location and having both a Special Effects Supervisor and a Visual Effects Supervisor on its crew, might this hidden entity be?",X-Men
subgraphs_batch_022_textual_subgraph_0600.graphml,"Which action film, featuring music by Dimitri Tiomkin and produced by United Artists, is associated with the United States of America?",The Guns of Navarone
subgraphs_batch_022_textual_subgraph_0609.graphml,"Which film features Jena Malone and Lauren Bacall in its dubbing performances, was released in the United Kingdom, and falls under the fantasy genre?",Howl's Moving Castle
subgraphs_batch_022_textual_subgraph_0612.graphml,"Which film features a Sound Mixer, Visual Effects team, a Special Effects Supervisor, and is primarily in the English language?",X-Men
subgraphs_batch_022_textual_subgraph_0605.graphml,"Which film, directed by a recipient of the Saturn Award for Best Director and featuring Craig Barron among its crew, is associated with the United States and was distributed on DVD?",X-Men
subgraphs_batch_022_textual_subgraph_0606.graphml,"Who is the person who was born in the United States, speaks English, is married, and was nominated for an award for their role in Apollo 13?",Tom Hanks
subgraphs_batch_022_textual_subgraph_0610.graphml,"Which film, featuring locations in Toronto and associated with the thriller genre, has a sound mixer in its crew and is related to the United States of America?",X-Men
subgraphs_batch_022_textual_subgraph_0613.graphml,"Which film, distributed on DVD and featuring an animation director, is primarily in English and falls under the fantasy genre?",X-Men
subgraphs_batch_022_textual_subgraph_0611.graphml,"Which action film features Craig Barron as part of its crew and is distributed through streaming media, also involving a Visual Effects Supervisor in its production?",X-Men
subgraphs_batch_022_textual_subgraph_0614.graphml,"Which film was animated by a director associated with Toronto and New York City, and executive produced by Avi Arad?",X-Men
subgraphs_batch_022_textual_subgraph_0602.graphml,"Which celebrity, known for their connection to Demi Moore and nominated for awards related to Zoolander, was born in the United States and speaks English?",Owen Wilson
subgraphs_batch_022_textual_subgraph_0601.graphml,"Which film has an estimated budget in United States Dollars, features Craig Barron in its crew, is related to the United States of America, and includes Visual Effects specialists in its team?",X-Men
subgraphs_batch_022_textual_subgraph_0608.graphml,"Which film has been recognized with awards won by both Marlene Dietrich and Spencer Tracy, and is available on DVD with a connection to the United States of America?",Judgment at Nuremberg
subgraphs_batch_022_textual_subgraph_0617.graphml,"Which film was released on DVD, features both Khmer and English languages, and has an award won by Carmine Coppola?",Apocalypse Now
subgraphs_batch_022_textual_subgraph_0607.graphml,"Which film has won both the Goya Award for Best Film and the Golden Globe Award for Best Foreign Language Film, and is also associated with a DVD release date and a notable sound mixer?",The Sea Inside
subgraphs_batch_022_textual_subgraph_0620.graphml,"Which film combines genres like comedy, crime fiction, and thriller, and was also released on DVD?",Ocean's Eleven
subgraphs_batch_022_textual_subgraph_0622.graphml,Which film features Craig Barron and Bryan Singer in its crew and is animated in English?,X-Men
subgraphs_batch_022_textual_subgraph_0615.graphml,"Which film features costume design by Albert Wolsky, won an award by Demi Moore, includes a sound mixer in its crew, and is related to the United States of America?",Striptease
subgraphs_batch_022_textual_subgraph_0621.graphml,"Which film features Craig Barron and a Sound Mixer among its crew, is in the English language, and also includes a Special Effects Supervisor?",X-Men
subgraphs_batch_022_textual_subgraph_0616.graphml,"Which film features Craig Barron as part of its crew, is animated by a notable director, and is both in the English language and associated with the United States of America?",X-Men
subgraphs_batch_022_textual_subgraph_0619.graphml,"Which film was distributed by a streaming media company, had Gary Rydstrom as part of its crew, and is related to the United States of America and the English language?",X-Men
subgraphs_batch_022_textual_subgraph_0625.graphml,"Which film, directed by an individual who won a Saturn Award for Best Director, is primarily in English and associated with the United States?",X-Men
subgraphs_batch_022_textual_subgraph_0631.graphml,"Which film belongs to the genres of Horror, Adventure, and Action, and was released on DVD?",Bleach: The DiamondDust Rebellion
subgraphs_batch_022_textual_subgraph_0618.graphml,"Which film features voice acting by John Swasey and falls under the genres of Drama, Science Fiction, and Fantasy?",Evangelion: 2.0 You Can (Not) Advance
subgraphs_batch_022_textual_subgraph_0634.graphml,Which science fiction film was filmed in Hamilton and is available on streaming media and DVD?,X-Men
subgraphs_batch_022_textual_subgraph_0626.graphml,"Which film, featuring West Hollywood as one of its primary locations and falling under the slasher genre, also had notable contributions from a Sound Mixer and a Special Effects Supervisor?",Scream 3
subgraphs_batch_022_textual_subgraph_0627.graphml,"Which film features Craig Barron on its crew, falls under the fantasy genre, includes a Visual Effects Supervisor, and has scenes set in Hamilton?",X-Men
subgraphs_batch_022_textual_subgraph_0628.graphml,"Which film features both a Special Effects Supervisor and a Sound Mixer, and is classified as both a Thriller and an Action Film?",X-Men
subgraphs_batch_022_textual_subgraph_0629.graphml,"Which science fiction TV show features Takehito Koyasu in its regular cast and has a film adaptation where Michelle Ruff provides dubbing performances, all in the English language?",Gate Keepers 21
subgraphs_batch_022_textual_subgraph_0632.graphml,"Which film, directed by Craig Barron and winner of the Saturn Award for Best Director, is associated with the United States and distributed on DVD?",X-Men
subgraphs_batch_022_textual_subgraph_0633.graphml,"Which film features Craig Barron in its crew, is distributed through streaming media and DVD, and is primarily in the English language?",X-Men
subgraphs_batch_022_textual_subgraph_0623.graphml,"Which movie features Hamilton as a filming location, is related to the United States, and includes Famke Janssen in its cast, as well as being nominated for the MTV Movie Award for Best On-Screen Duo?",X-Men
subgraphs_batch_022_textual_subgraph_0630.graphml,Which animated film features Patrick Stewart and was executive produced by both Avi Arad and Stan Lee?,X-Men
subgraphs_batch_022_textual_subgraph_0637.graphml,"What film combines the genres of world cinema, science fiction, and fantasy, and was written by Akira Toriyama?",Dragon Ball Z: Dead Zone
subgraphs_batch_022_textual_subgraph_0624.graphml,"Which film, featuring a performance that earned the Razzie Award for Worst Supporting Actor and falling under the drama genre, is associated with the United States and primarily spoken in English?",Mommie Dearest
subgraphs_batch_022_textual_subgraph_0640.graphml,"Who is the male director affiliated with TriStar Pictures and 20th Century Fox, and has won the Saturn Award for Best Director?",Roland Emmerich
subgraphs_batch_022_textual_subgraph_0642.graphml,"Which film blends genres like Animation and Drama, and also incorporates elements of Science Fiction and Action?",The Animatrix
subgraphs_batch_022_textual_subgraph_0635.graphml,"Which film combines the genres of erotica and psychological thriller, is in the English language, and had its estimated budget in United States Dollars?",I Know Who Killed Me
subgraphs_batch_022_textual_subgraph_0643.graphml,"Which film, featuring crew member Craig Barron and distributed through streaming media, is associated with the United States and primarily in the English language?",X-Men
subgraphs_batch_022_textual_subgraph_0639.graphml,"Which film combines the genres of superhero and thriller, features a Visual Effects Supervisor, and is primarily in the English language?",X-Men
subgraphs_batch_022_textual_subgraph_0638.graphml,"Which film, supervised by a Visual Effects Supervisor and directed by someone who won the Saturn Award for Best Director, is distributed on DVD and has a strong connection to the United States of America?",X-Men
subgraphs_batch_022_textual_subgraph_0651.graphml,"Which film, known for its computer animation and visual effects, was produced in Hong Kong and primarily features dialogue in English?",Astro Boy
subgraphs_batch_022_textual_subgraph_0648.graphml,"Which film was released in the Republic of Ireland, won a Golden Bear award, falls under the fantasy genre, and also had a DVD release date?",Cinderella
subgraphs_batch_022_textual_subgraph_0641.graphml,"Which film was produced by Gary Goetzman, had its costume design done by Albert Wolsky, and involved a Visual Effects Supervisor in its crew, also being released on DVD?",Larry Crowne
subgraphs_batch_022_textual_subgraph_0645.graphml,"Which film has won the Academy Award for Best Sound Mixing, was released in Chile, is in the English language, and features notable work by a sound mixer?",Hugo
subgraphs_batch_022_textual_subgraph_0644.graphml,"Which film, featuring the genres of fantasy and having an animation director, was made with a budget in United States Dollars and distributed by 20th Century Fox?",X-Men
subgraphs_batch_022_textual_subgraph_0649.graphml,"Which film was produced by Marshall Herskovitz, won awards associated with Edward Zwick, is related to the United States, and was made in the English language?",Legends of the Fall
subgraphs_batch_022_textual_subgraph_0653.graphml,"Which film was shot in Toronto, featured a sound mixer in its crew, and is known for its fantasy elements and English language dialogue?",X-Men
subgraphs_batch_022_textual_subgraph_0646.graphml,"Which film was released in the United States, had a Special Effects Supervisor on its crew, was made in English, and had its estimated budget in United States Dollars?",X-Men
subgraphs_batch_022_textual_subgraph_0647.graphml,"Which film features Gary Rydstrom as part of its crew, was distributed on Blu-ray, and is primarily in the English language with a sound mixer also listed among its staff?",X-Men
subgraphs_batch_022_textual_subgraph_0660.graphml,"Which film features a sound mixer, falls under the genres of fantasy and thriller, and is primarily in the English language?",X-Men
subgraphs_batch_022_textual_subgraph_0650.graphml,"Who is the filmmaker who directed both ""Men in Black"" and ""Catch Me If You Can,"" and has also been honored with a Saturn Award for Best Director and has a connection to the United States Dollar?",Steven Spielberg
subgraphs_batch_022_textual_subgraph_0652.graphml,"Which film, directed by someone who has won awards like Clint Eastwood, falls under the genre of history, features a notable sound mixer, and is associated with the United States of America?",Invictus
subgraphs_batch_022_textual_subgraph_0636.graphml,"Which film features Craig Barron as a member of its sound crew, is related to the United States of America, and is primarily in the English language?",X-Men
subgraphs_batch_022_textual_subgraph_0658.graphml,"Which film was executive produced by Robert De Niro, had Gregory Nicotero on its crew, and was released on DVD in the United States?",Public Enemies
subgraphs_batch_022_textual_subgraph_0657.graphml,"Which fantasy film, featuring a Visual Effects Supervisor and produced in the United States, is primarily in the English language?",X-Men
subgraphs_batch_022_textual_subgraph_0654.graphml,"Who is the artist known for their contributions to acoustic guitar tracks, has won awards associated with Mark Stent, and is connected to the United States Dollar and the English Language?",Madonna
subgraphs_batch_022_textual_subgraph_0656.graphml,"Which film was executive produced by Michael Stipe, falls under the musical genre, was released on DVD, and is primarily in the English language?",Velvet Goldmine
subgraphs_batch_022_textual_subgraph_0667.graphml,"Which film has won awards such as Over the Top and Lock Up, and is classified under both the Thriller and Action Film genres?",Cobra
subgraphs_batch_022_textual_subgraph_0664.graphml,"Which action film was produced by Universal Studios, featured cinematography by William A. Fraker, and had a dedicated Visual Effects Supervisor on its crew?",1941
subgraphs_batch_022_textual_subgraph_0655.graphml,"Which film was written by William S. Burroughs, won the Independent Spirit Award for Best Supporting Male, was made with an estimated budget in United States Dollars, and is in the English language?",Drugstore Cowboy
subgraphs_batch_022_textual_subgraph_0666.graphml,"Which film featuring James Stewart, known for its screwball comedy genre, was released on DVD and primarily spoken in English?",The Philadelphia Story
subgraphs_batch_022_textual_subgraph_0663.graphml,"Which film features Hamilton as one of its prominent filming locations, has Craig Barron as part of its crew, and is closely associated with the United States of America?",X-Men
subgraphs_batch_022_textual_subgraph_0661.graphml,"Which TV show features John DiMaggio as a regular cast member, is primarily a comedy from the UK, and also delves into science fiction themes while originating from the United States?",Futurama
subgraphs_batch_022_textual_subgraph_0671.graphml,"Which film, known for its historical and period piece genres, features a notable sound mixer and was released in the United States?",Agora
subgraphs_batch_022_textual_subgraph_0668.graphml,"Which movie, known for its sex comedy genre and available on its official website, is primarily in English and has won the MTV Movie Award for Best Movie?",Wedding Crashers
subgraphs_batch_022_textual_subgraph_0659.graphml,"Which film, featuring a story by Agatha Christie and with music by Richard Rodney Bennett, has won awards and is both set in the United Kingdom and classified as a thriller?",Murder on the Orient Express
subgraphs_batch_022_textual_subgraph_0669.graphml,"Which film is known for its fantasy genre, features an animation director, was distributed on DVD, and is primarily in the English language?",X-Men
subgraphs_batch_022_textual_subgraph_0672.graphml,"Which science fiction film, featuring Craig Barron among its crew and a sound mixer, had an estimated budget in United States Dollars?",X-Men
subgraphs_batch_022_textual_subgraph_0679.graphml,Which adventure film was released in the United Kingdom and distributed by FilmFlex?,13 Assassins
subgraphs_batch_022_textual_subgraph_0674.graphml,"Which animated film, featuring locations in Toronto and directed by an animation director, is affiliated with the United States and primarily spoken in English?",X-Men
subgraphs_batch_022_textual_subgraph_0662.graphml,"Which film features art direction by Carroll Clark and has won awards for Julie Andrews, was released on DVD, and is associated with the United States of America?",Mary Poppins
subgraphs_batch_022_textual_subgraph_0665.graphml,"Which film features Craig Barron as part of its crew, has an estimated budget in United States Dollars, is primarily in the English language, and includes a Sound Mixer among its other crew members?",X-Men
subgraphs_batch_022_textual_subgraph_0675.graphml,"Which film was shot in Hamilton, released in the United States, distributed on DVD, and had an estimated budget measured in United States Dollars?",X-Men
subgraphs_batch_022_textual_subgraph_0673.graphml,"Which romantic comedy shot in 35 mm film, featuring a sound mixer in its crew, was released in the United States?",Monsoon Wedding
subgraphs_batch_022_textual_subgraph_0680.graphml,"Which film features animation direction by Craig Barron and falls under the fantasy genre, presented in the English language?",X-Men
subgraphs_batch_022_textual_subgraph_0677.graphml,"What film features Craig Barron on its crew, has an estimated budget in United States Dollars, was distributed on DVD, and is primarily in the English language?",X-Men
subgraphs_batch_022_textual_subgraph_0670.graphml,"Which actor, who has been nominated for awards alongside Demi Moore and Ian McKellen, was born in the United States and is known for their profession as an Actor-GB?",Elijah Wood
subgraphs_batch_022_textual_subgraph_0678.graphml,"Which film features Gary Rydstrom as an Animation Director, is related to the United States, and had its cast nominated for the MTV Movie Award for Best On-Screen Duo?",X-Men
subgraphs_batch_022_textual_subgraph_0676.graphml,"Which film features costume design by Albert Wolsky, includes Makeup Artist-GB in its crew, and was released in the United States on DVD?",The Jackal
subgraphs_batch_022_textual_subgraph_0683.graphml,Which animated film features Patrick Stewart and has both a Blu-ray disc distribution and a Special Effects Supervisor in its crew?,X-Men
subgraphs_batch_022_textual_subgraph_0685.graphml,"Which film won the New York Film Critics Circle Award for Best Film, is classified as both a drama and a thriller, and was released in the United States?",Mulholland Drive
subgraphs_batch_022_textual_subgraph_0684.graphml,"Which film, produced by Clint Eastwood and belonging to the LGBT genre, also involves a notable sound mixer and has a known DVD release date?",J. Edgar
subgraphs_batch_022_textual_subgraph_0690.graphml,"Which animated film, featuring locations in Toronto and directed by an animation director, is also related to the United States and distributed on DVD?",X-Men
subgraphs_batch_022_textual_subgraph_0682.graphml,"Which film has won both the National Society of Film Critics Award for Best Film and the Academy Award for Best Visual Effects, and was released on DVD in English?",Babe
subgraphs_batch_022_textual_subgraph_0688.graphml,"Which film, produced by Jerry Bruckheimer and released on DVD, has won the BAFTA Award for Best Editing and is related to the United States of America?",Flashdance
subgraphs_batch_022_textual_subgraph_0686.graphml,"Which film was executive produced by Avi Arad, featured crew member Craig Barron, was filmed in Toronto, and won the Saturn Award for Best Costume?",X-Men
subgraphs_batch_022_textual_subgraph_0687.graphml,"Which film was shot in Vancouver, has won awards involving Simon Cowell, is associated with the United States, and was released on DVD?",Scary Movie 3
subgraphs_batch_022_textual_subgraph_0681.graphml,"Which animated film features music by Hans Zimmer, won the Broadcast Film Critics Association Award for Best Animated Feature, and stars Patrick Stewart, with its release date associated with the United States of America?",The Prince of Egypt
subgraphs_batch_022_textual_subgraph_0689.graphml,"Which film features a Visual Effects Supervisor and an Animation Director, is distributed on DVD, and includes a Sound Mixer in its crew?",X-Men
subgraphs_batch_022_textual_subgraph_0694.graphml,"Which film was shot in Toronto, had Gary Rydstrom as part of its crew, is in English, and was distributed on DVD?",X-Men
subgraphs_batch_022_textual_subgraph_0700.graphml,"Which spy film was primarily in Japanese, also featured English, and had its estimated budget in United States Dollars?",You Only Live Twice
subgraphs_batch_022_textual_subgraph_0695.graphml,"Which fantasy film, featuring the work of Craig Barron and known as a blockbuster, was distributed on DVD?",X-Men
subgraphs_batch_022_textual_subgraph_0692.graphml,"Which film features Gary Rydstrom and Craig Barron on its crew, is distributed on DVD, and has a connection to the United States of America?",X-Men
subgraphs_batch_022_textual_subgraph_0691.graphml,"Which film, known for its science fiction and fantasy elements, features a team that includes a Streaming Media distributor and a Visual Effects Supervisor among its crew?",X-Men
subgraphs_batch_022_textual_subgraph_0698.graphml,"Which film features Craig Barron as the Visual Effects Supervisor, is related to the United States of America, and is primarily in the English language?",X-Men
subgraphs_batch_022_textual_subgraph_0704.graphml,"Which film combines the genres of Drama and History, was released on DVD, and is primarily in the English language?",Pocahontas
subgraphs_batch_022_textual_subgraph_0703.graphml,"Which film features Gary Rydstrom and Craig Barron on its crew, is associated with the United States, and was distributed on DVD?",X-Men
subgraphs_batch_022_textual_subgraph_0702.graphml,Which film features both Craig Barron and Gary Rydstrom on its crew and is categorized under both Action and Science Fiction genres?,X-Men
subgraphs_batch_022_textual_subgraph_0696.graphml,"Which film features music by Harry Gregson-Williams, was filmed in Oregon, and includes both a sound mixer and visual effects specialists in its crew?",Seraphim Falls
subgraphs_batch_022_textual_subgraph_0697.graphml,"Which film, featuring the French language and the steampunk genre, was made with the involvement of a special effects supervisor and is associated with the United States of America?",The Brothers Grimm
subgraphs_batch_022_textual_subgraph_0701.graphml,"What film features music by David Arnold, is shot in Super 35 format, and has both a Visual Effects Supervisor and Visual Effects team as part of its crew?",2 Fast 2 Furious
subgraphs_batch_022_textual_subgraph_0708.graphml,"What English-language spy film, featuring notable visual effects supervision, has its official website at Common's webpage?","Lust, Caution"
subgraphs_batch_022_textual_subgraph_0706.graphml,"Which film features Craig Barron as part of its crew, has English as its language, and falls under the Science Fiction genre?",X-Men
subgraphs_batch_022_textual_subgraph_0709.graphml,"Which film features Craig Barron as part of its animation crew, is distributed on DVD, and falls under the science fiction genre?",X-Men
subgraphs_batch_022_textual_subgraph_0699.graphml,"Which film has won awards for both Rocky IV and Rocky V, and is also associated with the genres of Science Fiction and Superhero?",Judge Dredd
subgraphs_batch_022_textual_subgraph_0705.graphml,"Which film has won the Writers Guild of America Award for Best Adapted Screenplay, featured a Sound Re-Recording Mixer from Great Britain, was released in the United States, and is primarily in the English language?",American Splendor
subgraphs_batch_022_textual_subgraph_0693.graphml,"Which film features Gary Rydstrom as a Special Effects Supervisor, has a budget denominated in United States Dollars, and includes a Sound Mixer in its crew?",X-Men
subgraphs_batch_022_textual_subgraph_0710.graphml,"Which film features Gary Rydstrom and Craig Barron on its crew, is associated with the United States, and was distributed on DVD?",X-Men
