file,query,answer
subgraphs_batch_010_textual_subgraph_0722.graphml,"Who is the male television producer from Great Britain who made a cameo appearance in a film and was nominated for an award for ""Man on the Moon""?",Danny DeVito
subgraphs_batch_010_textual_subgraph_0719.graphml,"Who is the male film producer from Great Britain who has been nominated for awards and is associated with the film ""Terms of Endearment""?",Danny DeVito
subgraphs_batch_010_textual_subgraph_0727.graphml,"Who is the male actor affiliated with Catholicism, known for his role in ""The Greatest Story Ever Told"" and nominated for awards alongside Sophia Loren?",Sidney Poitier
subgraphs_batch_010_textual_subgraph_0721.graphml,"Who is the film and television producer from Great Britain who produced the TV show ""The Good Wife"" and was nominated for a Primetime Emmy Award for Outstanding Miniseries?",Tony Scott
subgraphs_batch_010_textual_subgraph_0728.graphml,"Who is the male screenwriter known for directing the film ""Be Cool"" and being nominated for a Razzie Award for Worst Director?",Danny DeVito
subgraphs_batch_010_textual_subgraph_0723.graphml,"Who is the individual that has been nominated for awards alongside Shea Whigham, and is known for being an actor, film producer, and screenwriter in Great Britain?",Ray McKinnon
subgraphs_batch_010_textual_subgraph_0725.graphml,Who is the television producer from Great Britain who practices Catholicism and has won awards like Megan Mullally and received nominations like Debra Messing?,Sean Hayes
subgraphs_batch_010_textual_subgraph_0733.graphml,Who is the male musician and screenwriter from Serbia known for his work in the UK?,Emir Kusturica
subgraphs_batch_010_textual_subgraph_0738.graphml,"Who is the Indian film director, producer, and screenwriter who has been nominated for the Filmfare Award for Best Director?",Satyajit Ray
subgraphs_batch_010_textual_subgraph_0730.graphml,"Who is the male actor who has been nominated for awards and appeared in the film ""When in Rome,"" and is also known for his marriage?",Danny DeVito
subgraphs_batch_010_textual_subgraph_0734.graphml,Who is the male film producer from Great Britain who has been nominated for a Razzie Award for Worst Director and has made a cameo appearance in a film?,Danny DeVito
subgraphs_batch_010_textual_subgraph_0737.graphml,Who is the male artist and screenwriter influenced by Lenny Bruce and known for his work in Great Britain?,Bill Hicks
subgraphs_batch_010_textual_subgraph_0741.graphml,"Who is the individual that has directed episodes of ""Batman Beyond"" and is also known for their work as a film director, television director, and screenwriter?",Bruce Timm
subgraphs_batch_010_textual_subgraph_0729.graphml,"Who is the television producer from Great Britain who made a cameo appearance in the film ""Man on the Moon"" and has been nominated for awards related to that film, and is also known for their marriage to a notable person?",Danny DeVito
subgraphs_batch_010_textual_subgraph_0744.graphml,Who is the composer and organist known for their marriage and affiliation with Catholicism?,Edward Elgar
subgraphs_batch_010_textual_subgraph_0735.graphml,Who was the American film producer born in Pittsburgh and who passed away in New York City?,Andy Warhol
subgraphs_batch_010_textual_subgraph_0732.graphml,"Who is the individual known for being a screenwriter and a British television producer, as well as being associated with the film ""Be Cool"" and receiving award nominations for ""Man on the Moon""?",Danny DeVito
subgraphs_batch_010_textual_subgraph_0739.graphml,"Who is the male actor known for his roles in ""All That Jazz"" and ""Toy Story 2,"" and is also affiliated with Judaism in Great Britain?",Wallace Shawn
subgraphs_batch_010_textual_subgraph_0736.graphml,"Who is the male screenwriter who has been nominated for both the Grammy Award for Best Song Written for a Motion Picture, Television or Other Visual Media and the Satellite Award for Best Original Song?",Gulzar
subgraphs_batch_010_textual_subgraph_0748.graphml,Who is the renowned film director and screenwriter from Bavaria who also worked as a film producer in Great Britain?,Rainer Werner Fassbinder
subgraphs_batch_010_textual_subgraph_0731.graphml,"Who is the film producer from Great Britain who has been nominated for a Primetime Emmy Award for Outstanding Lead Actor in a Miniseries or Movie and is known for their role in ""The Brothers Bloom,"" as well as being married?",Maximilian Schell
subgraphs_batch_010_textual_subgraph_0747.graphml,"Who is the male musician from Great Britain who starred in the film ""Tommy"" and is known for his marriage?",Roger Daltrey
subgraphs_batch_010_textual_subgraph_0740.graphml,Who is the male actor who graduated from the American Academy of Dramatic Arts and has been nominated for both a Razzie Award for Worst Director and an award alongside David Strathairn?,Danny DeVito
subgraphs_batch_010_textual_subgraph_0752.graphml,Who is the male actor and film producer from India who is also known for his work in the UK?,Prithviraj Sukumaran
subgraphs_batch_010_textual_subgraph_0743.graphml,"Who is the American voice actor and screenwriter known for their role in the film ""Be Cool""?",Danny DeVito
subgraphs_batch_010_textual_subgraph_0750.graphml,Who is the film producer from China who has won awards from NBC and is also known for their marriage?,Zhang Yimou
subgraphs_batch_010_textual_subgraph_0746.graphml,"Who is the director born in Galveston, nominated for a Golden Globe for Best Director and an Academy Award for Best Picture, and holds United States nationality?",King Vidor
subgraphs_batch_010_textual_subgraph_0749.graphml,Who is the screenwriter from the United States who was nominated for a Razzie Award for Worst Director and is affiliated with Catholicism?,Danny DeVito
subgraphs_batch_010_textual_subgraph_0754.graphml,"Who is the male individual born in Detroit, has lived in Southern California, and is affiliated with Catholicism?",Roger Corman
subgraphs_batch_010_textual_subgraph_0745.graphml,"Who is the celebrity born in the United States and affiliated with Catholicism, known for their role in the film ""Jay and Silent Bob Strike Back"" alongside Jennifer Love Hewitt?",Jamie Kennedy
subgraphs_batch_010_textual_subgraph_0758.graphml,Who is the male film producer from Great Britain who has lived in North Carolina and is associated with the United States Dollar?,Kevin Williamson
subgraphs_batch_010_textual_subgraph_0756.graphml,Who is the male comedian and actor from Great Britain who was nominated for an award for his role in Monty Python and the Holy Grail?,Graham Chapman
subgraphs_batch_010_textual_subgraph_0761.graphml,"Who is the vegetarian film producer known for making a cameo appearance in ""Be Cool""?",Danny DeVito
subgraphs_batch_010_textual_subgraph_0755.graphml,Who is the male television producer from Great Britain who has been nominated for a Razzie Award for Worst Director and is known for his marriages?,Danny DeVito
subgraphs_batch_010_textual_subgraph_0762.graphml,"Who is the screenwriter and television producer from the United States who was involved in the film ""When in Rome""?",Danny DeVito
subgraphs_batch_010_textual_subgraph_0760.graphml,Who is the actor and film director from the United States who is also known for his work as a television director?,Jason Priestley
subgraphs_batch_010_textual_subgraph_0751.graphml,"Who is the individual that has been nominated for a Razzie Award for Worst Director for the film ""Be Cool"" and is also known for working as both a television and film producer in the UK?",Danny DeVito
subgraphs_batch_010_textual_subgraph_0765.graphml,Who is the male screenwriter and Catholic who has been nominated for awards alongside David Strathairn?,Danny DeVito
subgraphs_batch_010_textual_subgraph_0763.graphml,Who is the male celebrity impressionist known for his Tony Award nominations for both Best Actor in a Musical and Best Book of a Musical?,Anthony Newley
subgraphs_batch_010_textual_subgraph_0742.graphml,"Who is the individual that has been nominated for a Razzie Award for Worst Director for the film ""Man on the Moon"" and is also known for their work as a Television Director and Television producer in Great Britain?",Danny DeVito
subgraphs_batch_010_textual_subgraph_0753.graphml,"Who is the person that was born in the United States, has won a Razzie Award for Worst Director, made a cameo appearance in a film, and is also known for being a television producer in Great Britain?",Danny DeVito
subgraphs_batch_010_textual_subgraph_0759.graphml,"Who is the voice actor who has been nominated for awards for their role in ""Man on the Moon"" and is also known for their personal life, including marriage?",Danny DeVito
subgraphs_batch_010_textual_subgraph_0766.graphml,Who is the Television Director born in Los Angeles who has been nominated for awards alongside James Burrows and Tim Kaiser?,Andy Ackerman
subgraphs_batch_010_textual_subgraph_0764.graphml,Who is the male individual known for both a cameo appearance in a film about Malcolm X and for holding a government position as President?,Nelson Mandela
subgraphs_batch_010_textual_subgraph_0773.graphml,"Who is the male voice actor known for his roles in ""Batman Returns"" and ""When in Rome""?",Danny DeVito
subgraphs_batch_010_textual_subgraph_0767.graphml,"Who is the male filmmaker from the United States who has been nominated for awards alongside Tom Hanks and for the miniseries ""Band of Brothers""?",Phil Alden Robinson
subgraphs_batch_010_textual_subgraph_0769.graphml,Who is the male film producer from Great Britain who has been nominated for both a Razzie Award for Worst Director and an award alongside Kim Basinger?,Danny DeVito
subgraphs_batch_010_textual_subgraph_0771.graphml,Who is the male playwright and screenwriter from Great Britain known for his work as a writer?,Steven Berkoff
subgraphs_batch_010_textual_subgraph_0757.graphml,"Who is the person that has been nominated for a Primetime Emmy Award for Outstanding Guest Actor in a Comedy Series, has a connection to the film ""Terms of Endearment,"" and is known for their work as a voice actor?",Danny DeVito
subgraphs_batch_010_textual_subgraph_0768.graphml,"Who is the comedian and television producer from Great Britain who was nominated for an award for their role in the film ""Hoffa"" and is associated with Michael Shamberg?",Danny DeVito
subgraphs_batch_010_textual_subgraph_0772.graphml,Who is the male television producer from Great Britain who was born in Cleveland and has received award nominations for his work with Jack Bender?,Brian K. Vaughan
subgraphs_batch_010_textual_subgraph_0770.graphml,"Who is the screenwriter from the United States who worked on ""Madagascar: Escape 2 Africa"" and has been nominated for awards by Conan O'Brien?",Andy Richter
subgraphs_batch_010_textual_subgraph_0775.graphml,"Who is the male television director who was nominated for an award for ""Man on the Moon"" and directed the film ""Big Fish""?",Danny DeVito
subgraphs_batch_010_textual_subgraph_0777.graphml,"Who is the male film producer from Great Britain who is known for his work on the films ""Terms of Endearment"" and ""When in Rome""?",Danny DeVito
subgraphs_batch_010_textual_subgraph_0782.graphml,"Who is the male philosopher influenced by Friedrich Nietzsche and proficient in the English language, who also had a spouse?",Sigmund Freud
subgraphs_batch_010_textual_subgraph_0785.graphml,"Who is the television director born in the United States, known for their affiliation with Catholicism and for appearing in the film ""Big Fish""?",Danny DeVito
subgraphs_batch_010_textual_subgraph_0786.graphml,Who is the screenwriter born in New York City and married to John Lennon?,Yoko Ono
subgraphs_batch_010_textual_subgraph_0781.graphml,"Who is the multifaceted individual from Great Britain who has excelled as an actor, teacher, screenwriter, and television director?",K. Balachander
subgraphs_batch_010_textual_subgraph_0776.graphml,"Who is the television director born in the United States of America who has won an award for their role in ""Terms of Endearment"" and was also nominated for an award related to ""The Rainmaker""?",Danny DeVito
subgraphs_batch_010_textual_subgraph_0778.graphml,"Who is the film producer from Great Britain who has been nominated for awards for ""Man on the Moon"" and is also known for their marriage and association with David Strathairn's award nominations?",Danny DeVito
subgraphs_batch_010_textual_subgraph_0779.graphml,"Which male actor, known for a cameo in the film ""Man on the Moon"" and nominated for an award for that role, is also affiliated with Catholicism?",Danny DeVito
subgraphs_batch_010_textual_subgraph_0791.graphml,"Who is the male actor from the United States known for his cameo appearance in ""When in Rome""?",Danny DeVito
subgraphs_batch_010_textual_subgraph_0792.graphml,"Who is the voice actor from the United States who was nominated for awards and appeared in the film ""When in Rome""?",Danny DeVito
subgraphs_batch_010_textual_subgraph_0787.graphml,Who is the male actor from Mumbai known for his profession and also related to marriage?,Mohnish Behl
subgraphs_batch_010_textual_subgraph_0774.graphml,"Who is the renowned figure that has won the Hong Kong Film Award for Best Action Choreography, works as both a film director and a screenwriter, and is known for their marriage to a notable spouse?",Sammo Hung
subgraphs_batch_010_textual_subgraph_0780.graphml,"Who is the comedian from the United States known for voicing characters in ""Family Guy Presents: Stewie Griffin: The Untold Story"" and ""The SpongeBob SquarePants Movie""?",Lori Alan
subgraphs_batch_010_textual_subgraph_0784.graphml,"Who is the television director known for their work in films like ""When in Rome"" and ""Terms of Endearment,"" and is also recognized for their marriage?",Danny DeVito
subgraphs_batch_010_textual_subgraph_0788.graphml,"Who is the screenwriter known for their work on films like ""Men in Black"" and ""Be Cool,"" and is also affiliated with Catholicism?",Danny DeVito
subgraphs_batch_010_textual_subgraph_0790.graphml,"Who is the male actor known for a cameo appearance in the film ""When in Rome"" and is also related to the concept of marriage?",Danny DeVito
subgraphs_batch_010_textual_subgraph_0797.graphml,"Who is the male actor with dual nationality from Canada and the United States, known for his role in the film ""Transformers: Revenge of the Fallen""?",Peter Cullen
subgraphs_batch_010_textual_subgraph_0783.graphml,"Who is the actor known for appearing in the films ""Youth in Revolt"" and ""Blow,"" and is also affiliated with Catholicism and of Italian American descent?",Ray Liotta
subgraphs_batch_010_textual_subgraph_0799.graphml,"Who is the male voice actor known for making a cameo appearance in the film ""When in Rome""?",Danny DeVito
subgraphs_batch_010_textual_subgraph_0789.graphml,"Who is the celebrity known for their roles in ""Get Shorty"" and alongside Lucy Liu, and also has a background as both a screenwriter and a film producer from Great Britain?",Danny DeVito
subgraphs_batch_010_textual_subgraph_0793.graphml,"Which actor, known for his role in ""Bones"" and starring alongside Sarah Michelle Gellar, is of Italian American descent and practices Catholicism?",David Boreanaz
subgraphs_batch_010_textual_subgraph_0796.graphml,"Who is the male film producer from Great Britain who was nominated for the National Society of Film Critics Award for Best Director for the film ""Dead Man""?",Jim Jarmusch
subgraphs_batch_010_textual_subgraph_0794.graphml,Who is the male director who has been nominated for a Razzie Award for Worst Director and is also known for his marriage?,Danny DeVito
subgraphs_batch_010_textual_subgraph_0795.graphml,Who is the American filmmaker who has been nominated for a Razzie Award for Worst Director and is also known for working as both a film producer and a screenwriter?,Danny DeVito
subgraphs_batch_010_textual_subgraph_0802.graphml,Who is the male radio personality and screenwriter from Great Britain known for his work as a presenter?,Steve-O
subgraphs_batch_010_textual_subgraph_0798.graphml,"Who is the individual that starred in the film ""Be Cool,"" was nominated for an award alongside David Strathairn, is married, and works as a screenwriter?",Danny DeVito
subgraphs_batch_010_textual_subgraph_0800.graphml,"Who is the male film producer from Great Britain who was nominated for a Razzie Award for Worst Director for the movie ""Be Cool""?",Danny DeVito
subgraphs_batch_010_textual_subgraph_0808.graphml,Who is the male film director and architect who is also known for his work as a film producer in Great Britain?,Fred Williamson
subgraphs_batch_010_textual_subgraph_0801.graphml,Who is the male screenwriter who directed the film Hoffa and was nominated for a Razzie Award for Worst Director?,Danny DeVito
subgraphs_batch_010_textual_subgraph_0809.graphml,"Who is the male film producer from Kochi, India, known for his significant contributions to the film industry?",Mammootty
subgraphs_batch_010_textual_subgraph_0805.graphml,"Who was the male filmmaker of Jewish descent who passed away in Hollywood and is renowned for directing the classic film ""Casablanca""?",Michael Curtiz
subgraphs_batch_010_textual_subgraph_0811.graphml,Who is the male cartoonist and screenwriter buried in Holy Cross Cemetery?,Pinto Colvig
subgraphs_batch_010_textual_subgraph_0818.graphml,Who is the male screenwriter and Catholic who has been nominated for a Razzie Award for Worst Director?,Danny DeVito
subgraphs_batch_010_textual_subgraph_0812.graphml,"Who is the film producer from the United States who has worked on movies like ""When in Rome"" and ""Terms of Endearment""?",Danny DeVito
subgraphs_batch_010_textual_subgraph_0807.graphml,"Who is the film producer born in the United States who has been nominated for awards for the movies ""I'm Not There"" and ""Far from Heaven""?",Christine Vachon
subgraphs_batch_010_textual_subgraph_0806.graphml,Who is the male comedian known for his cameo appearances in films and has been nominated for awards alongside David Strathairn?,Danny DeVito
subgraphs_batch_010_textual_subgraph_0803.graphml,"Who is the male film producer from Great Britain who was nominated for a Razzie Award for Worst Director for the movie ""Be Cool""?",Danny DeVito
subgraphs_batch_010_textual_subgraph_0813.graphml,Who is the television director from the United Kingdom who has been nominated for a BAFTA Award for Best Direction and is known for their marriages?,Ken Loach
subgraphs_batch_010_textual_subgraph_0823.graphml,Who is the comedian and voice actor that has an official website and is affiliated with the San Diego Chargers?,Terry Crews
subgraphs_batch_010_textual_subgraph_0819.graphml,"Who is the male individual born in New York City, known for making cameo appearances in films and having an official website?",Ron Jeremy
subgraphs_batch_010_textual_subgraph_0814.graphml,"Who is the male screenwriter known for the film ""Be Cool"" and nominated for a Razzie Award for Worst Director?",Danny DeVito
subgraphs_batch_010_textual_subgraph_0820.graphml,"Who was the actor, film producer, and screenwriter from Great Britain who passed away in Pacific Palisades?",Bob Clark
subgraphs_batch_010_textual_subgraph_0810.graphml,"Who is the individual known for their work as both a composer and a screenwriter, and has contributed significantly to piano performances, as well as being notable for their marriage?",Dudley Moore
subgraphs_batch_010_textual_subgraph_0817.graphml,"Who is the male actor known for his role in the film ""Be Cool"" and is of Catholic faith, also hailing from the United States?",Danny DeVito
subgraphs_batch_010_textual_subgraph_0821.graphml,"Who is the male television producer from Great Britain who is known for his roles in the films ""Terms of Endearment"" and ""Batman Returns""?",Danny DeVito
subgraphs_batch_010_textual_subgraph_0825.graphml,"Who is the male film director who directed ""Harry Potter and the Half-Blood Prince"" and is married?",David Thewlis
subgraphs_batch_010_textual_subgraph_0815.graphml,"Who is the male actor known for his role in the film ""Slumdog Millionaire"" and has an official webpage, also being recognized for his personal life, particularly his marriage?",Anil Kapoor
subgraphs_batch_010_textual_subgraph_0804.graphml,"Who is the individual that has been nominated for both the Academy Award for Best Picture and the Razzie Award for Worst Director, and is known for being both a screenwriter and a comedian?",Danny DeVito
subgraphs_batch_010_textual_subgraph_0826.graphml,Who was the animator and voice actor from the United States who passed away in Burbank?,Tex Avery
subgraphs_batch_010_textual_subgraph_0827.graphml,Who is the male screenwriter known for a cameo appearance in a film and nominated for a Razzie Award for Worst Director?,Danny DeVito
subgraphs_batch_010_textual_subgraph_0816.graphml,"Who is the person that has lived in Los Angeles, worked as a voice actor, and appeared in both the film ""When in Rome"" and ""Batman Returns""?",Danny DeVito
subgraphs_batch_010_textual_subgraph_0830.graphml,Who is the male playback singer and film producer from Great Britain who is also proficient in the English language?,Thomas Dekker
subgraphs_batch_010_textual_subgraph_0822.graphml,"Who is the individual that has been nominated for a Razzie Award for Worst Director for the film Hoffa, and is also known for working as both a television producer and director in Great Britain?",Danny DeVito
subgraphs_batch_010_textual_subgraph_0824.graphml,"Who is the individual that has been nominated for both the Razzie Award for Worst Director and an Academy Award for Best Picture, and is also known for their role in ""Get Shorty"" as well as their marriage?",Danny DeVito
subgraphs_batch_010_textual_subgraph_0840.graphml,Who is the male screenwriter from India who has lived in Varanasi?,Anurag Kashyap
subgraphs_batch_010_textual_subgraph_0835.graphml,"Who is the male philosopher influenced by Immanuel Kant, born in Austria, and affiliated with Catholicism?",Friedrich Hayek
subgraphs_batch_010_textual_subgraph_0834.graphml,Who is the male screenwriter known for his atheistic beliefs and nominated for a BAFTA Award for Best Actor in a Leading Role?,Billy Connolly
subgraphs_batch_010_textual_subgraph_0829.graphml,"Who is the screenwriter and actor known for their role in ""Be Cool"" and nomination for the Razzie Award for Worst Director, as well as their personal life involving marriage?",Danny DeVito
subgraphs_batch_010_textual_subgraph_0836.graphml,Who is the British writer and television producer known for their affiliation with Christianity and nomination for the Razzie Award for Worst Director?,Tyler Perry
subgraphs_batch_010_textual_subgraph_0833.graphml,"Who is the person who practices vegetarianism, is in a domestic partnership, and is affiliated with both Christianity and Catholicism?",John Abraham
subgraphs_batch_010_textual_subgraph_0837.graphml,"Which actor has been in the films ""When in Rome"" and ""Terms of Endearment,"" and has also been nominated for the Academy Award for Best Picture and been married?",Danny DeVito
subgraphs_batch_010_textual_subgraph_0844.graphml,"Who is the voice actor from the United States known for their roles in ""Mississippi Burning"" and ""Toy Story""?",R. Lee Ermey
subgraphs_batch_010_textual_subgraph_0828.graphml,"Who is the actor born in the United States who was nominated for both the Razzie Award for Worst Director for the film ""Batman Returns"" and the Primetime Emmy Award for Outstanding Supporting Actor in a Comedy Series?",Danny DeVito
subgraphs_batch_010_textual_subgraph_0832.graphml,Who is the screenwriter who was married and nominated for both an Eric Idle award and a Hugo Award for Best Dramatic Presentation?,Terry Jones
subgraphs_batch_010_textual_subgraph_0846.graphml,Who is the television director and producer from Great Britain who has produced 24 TV programs and has been nominated for awards alongside Howard Gordon?,Manny Coto
subgraphs_batch_010_textual_subgraph_0831.graphml,"Who is the individual that was born in the United States, has won a Razzie Award for Worst Director for the film ""Be Cool,"" and is also known for being a television producer in Great Britain?",Danny DeVito
subgraphs_batch_010_textual_subgraph_0845.graphml,"Which film producer from the United States, known for their work on the movie ""Inception"" and nominated for awards related to ""Cheers,"" are we referring to?",Tom Berenger
subgraphs_batch_010_textual_subgraph_0843.graphml,"Which actor is known for their roles in the films ""Be Cool"" and ""Big Fish"" and has also pursued careers as both a screenwriter and a comedian?",Danny DeVito
subgraphs_batch_010_textual_subgraph_0838.graphml,"Which actor has appeared in both the films ""When in Rome"" and ""Big Fish,"" and is also known for their marriage and cameo appearances in other films?",Danny DeVito
subgraphs_batch_010_textual_subgraph_0842.graphml,Who is the male playwright from Great Britain who has won the Filmfare Award for Best Supporting Actor and is also known for his marriage?,Girish Karnad
subgraphs_batch_010_textual_subgraph_0839.graphml,"Who is the individual who has been nominated for awards alongside Russell Crowe, appeared in the movie ""When in Rome,"" is married, and works as a film producer in Great Britain?",Danny DeVito
subgraphs_batch_010_textual_subgraph_0847.graphml,"Who is the animation director and television producer from Great Britain, known for their official website and being married?",Butch Hartman
subgraphs_batch_010_textual_subgraph_0851.graphml,Who is the male actor and film producer from Great Britain who has been nominated for a Filmfare Award for Best Supporting Actor?,Ashok Kumar
