file,query,answer
subgraphs_batch_072_textual_subgraph_0020.graphml,"Who is the person that was born in New York, has won awards alongside Chris Pine, and is affiliated with both the film ""I, Robot"" and the ""Star Trek"" series?",Bruce Greenwood
subgraphs_batch_072_textual_subgraph_0021.graphml,"Which actor, known for their role alongside Elizabeth Taylor and nominated for an award for ""On the Waterfront,"" also appeared in ""The Longest Day"" and ""Mars Attacks!""?",Rod Steiger
subgraphs_batch_072_textual_subgraph_0023.graphml,"Which actor has been nominated for both the MTV Movie Award for Best Villain and the Hong Kong Film Award for Best Film, and is also associated with the films Lethal Weapon 4 and The Expendables 2?",Jet Li
subgraphs_batch_072_textual_subgraph_0030.graphml,"Which actor has won awards like Ralph Fiennes and been nominated for awards for The Hurt Locker, while also appearing in films such as Eagle Eye and Abraham Lincoln: Vampire Hunter?",Anthony Mackie
subgraphs_batch_072_textual_subgraph_0026.graphml,"Which country is known for its GDP nominal per capita being measured in United States Dollars, operates under a unitary state system, and is associated with the release dates of both ""The Avengers"" and ""Prometheus"" films?",Cambodia
subgraphs_batch_072_textual_subgraph_0033.graphml,"Which actor has appeared in movies such as Marmaduke, Ghost Rider, Gettysburg, and Hulk?",Sam Elliott
subgraphs_batch_072_textual_subgraph_0031.graphml,"Which actor, known for their roles in Dogville and 1941, as well as the film Dick Tracy, has also lived in Queens?",James Caan
subgraphs_batch_072_textual_subgraph_0027.graphml,"Which cinematographer was nominated for an Academy Award for their work on ""One Flew Over the Cuckoo's Nest"" and also contributed to the cinematography of ""Rules of Engagement"" and ""The Island of Dr. Moreau""?",William A. Fraker
subgraphs_batch_072_textual_subgraph_0035.graphml,"What prestigious award has been won by George Lucas and has also recognized films like The Truman Show, Star Trek, and The Matrix as nominees?",Saturn Award for Best Writing
subgraphs_batch_072_textual_subgraph_0034.graphml,"Who is the male producer who was behind both ""Die Hard"" and ""The Rocketeer"" and also received a Razzie Award nomination for Worst Picture?",Lawrence Gordon
subgraphs_batch_072_textual_subgraph_0022.graphml,"Which company is responsible for distributing films like ""The Grudge,"" ""The Adventures of Tintin: The Secret of the Unicorn,"" and ""Terminator Salvation,"" and also has connections to Jay-Z's award nominations?",Sony Pictures Entertainment
subgraphs_batch_072_textual_subgraph_0039.graphml,"Which prestigious award is associated with nominees such as Atlantic City, The Red Violin, Ran, and Apocalypto?",Golden Globe Award for Best Foreign Language Film
subgraphs_batch_072_textual_subgraph_0029.graphml,"Who is the voice actor that has an official website and is part of the regular cast of ""Magical Girl Lyrical Nanoha"" as well as having a role in ""Naruto Shippuden the Movie: Bonds""?",Nana Mizuki
subgraphs_batch_072_textual_subgraph_0037.graphml,"Which actor was born in Bermuda, received award nominations alongside Erika Christensen, and is affiliated with the films ""Face/Off"" and ""Shining Through""?",Michael Douglas
subgraphs_batch_072_textual_subgraph_0036.graphml,"Which film production company is both associated with Columbia Pictures and Marlon Wayans in their award nominations, and also involved in the production of movies like Rambo and The Missing?",Revolution Studios
subgraphs_batch_072_textual_subgraph_0032.graphml,"Who is the cinematographer born in Great Britain who was nominated for an award for their work on ""Pinocchio"" and also contributed to the cinematography of ""Heat"" and ""Hudson Hawk""?",Dante Spinotti
subgraphs_batch_072_textual_subgraph_0038.graphml,"Which actor has won awards for his performances, was nominated for a Razzie Award for Worst Screen Couple/Ensemble, and appeared in both ""Superman Returns"" and ""The Island of Dr. Moreau""?",Marlon Brando
subgraphs_batch_072_textual_subgraph_0046.graphml,"Who is the male actor from the United States who appeared in both ""Transformers: Dark of the Moon"" and ""I, Robot""?",Alan Tudyk
subgraphs_batch_072_textual_subgraph_0045.graphml,"Who is the male presenter from the UK who has been nominated for the ""I am Here"" award and has also done dubbing work for the film ""The Incredibles""?",Shahrukh Khan
subgraphs_batch_072_textual_subgraph_0041.graphml,"Which actor has been nominated for a Broadcast Film Critics Association Award for Best Supporting Actor and has appeared in the films ""Margin Call,"" ""Prizzi's Honor,"" and ""Captain America: The First Avenger""?",Stanley Tucci
subgraphs_batch_072_textual_subgraph_0040.graphml,"Which company is responsible for distributing both ""Pretty Woman"" and ""Oscar,"" and also has ties to the production of ""Enemy of the State"" and ""Starship Troopers""?",Touchstone Pictures
subgraphs_batch_072_textual_subgraph_0042.graphml,"Who is the individual associated with the films ""Chasing Amy,"" ""Dogma,"" ""TMNT,"" and ""Live Free or Die Hard,"" and has received award nominations for ""Chasing Amy""?",Kevin Smith
subgraphs_batch_072_textual_subgraph_0049.graphml,"Which individual has been nominated for awards alongside Mark Harmon and Adam Arkin, and is also associated with the films Hancock and Smokin' Aces?",Peter Berg
subgraphs_batch_072_textual_subgraph_0044.graphml,Which award was won by Peter Jackson and had both Cars 2 and The Adventures of Tintin: The Secret of the Unicorn among its nominees and winners at the 67th Golden Globe Awards?,Golden Globe Award for Best Animated Feature Film
subgraphs_batch_072_textual_subgraph_0043.graphml,"Who is the film producer from Great Britain known for working on ""The Man Who Wasn't There,"" as well as contributing to ""Cars 2"" and ""Spy Kids 3-D: Game Over""?",Tony Shalhoub
subgraphs_batch_072_textual_subgraph_0048.graphml,Who is the actor born in the United States who has won awards like Benicio del Toro and appeared in movies such as Jaws 3-D and G.I. Joe: The Rise of Cobra?,Dennis Quaid
subgraphs_batch_072_textual_subgraph_0056.graphml,"What is the common theme or concept that connects the films ""The Fly,"" ""Hold Back the Dawn,"" ""Star Wars Episode III: Revenge of the Sith,"" and ""Face/Off""?",Tragedy
subgraphs_batch_072_textual_subgraph_0055.graphml,"Who is the individual who has been nominated for awards alongside Kathleen Kennedy, has a profession as an Author from Great Britain, and has produced films such as Small Soldiers and Troy?",Colin Wilson
subgraphs_batch_072_textual_subgraph_0052.graphml,"What genre connects Wyatt Earp, Back to the Future Part III, Butch Cassidy and the Sundance Kid, and Jonah Hex in their respective media titles?",Western
subgraphs_batch_072_textual_subgraph_0054.graphml,"Who is the individual who has been nominated for awards alongside Carlton Cuse, contributed to the TV show Lost, produced the film Star Trek, and wrote the screenplay for Prometheus?",Damon Lindelof
subgraphs_batch_072_textual_subgraph_0065.graphml,"Which language is spoken in both Croatia and Serbia, and is also used in the films Machete and I Spy?",Hungarian language
subgraphs_batch_072_textual_subgraph_0050.graphml,"Who is the cinematographer who has worked on films like National Treasure and Abraham Lincoln: Vampire Hunter, was nominated for an award for The Passion of the Christ, and has lived in Philadelphia?",Caleb Deschanel
subgraphs_batch_072_textual_subgraph_0062.graphml,"Which actor, known for his roles in ""Star Trek Nemesis,"" ""Enemy at the Gates,"" and ""The Island of Dr. Moreau,"" is male?",Ron Perlman
subgraphs_batch_072_textual_subgraph_0051.graphml,"Who is the person that was born in The Bronx, has been married, and is affiliated with both the film ""Transformers: Revenge of the Fallen"" and ""Star Wars: The Clone Wars""?",Kevin Michael Richardson
subgraphs_batch_072_textual_subgraph_0057.graphml,"Which actor has been nominated for awards alongside Steve Carell and has appeared in films such as Final Destination 5, Austin Powers: The Spy Who Shagged Me, and The Dukes of Hazzard?",David Koechner
subgraphs_batch_072_textual_subgraph_0063.graphml,Which country is known for participating in the 2004 Summer Olympics and is associated with the release dates of both the films Prometheus and Green Lantern?,Azerbaijan
subgraphs_batch_072_textual_subgraph_0053.graphml,"Who is the actor that speaks English, is associated with Joy Bryant, and has appeared in both ""Charlie's Angels"" and ""3:10 to Yuma""?",Luke Wilson
subgraphs_batch_072_textual_subgraph_0047.graphml,"Who is the individual who is married to a notable person, has been nominated for a Satellite Award for Best Original Screenplay, and is associated with the films ""The Adventures of Baron Munchausen"" and ""Percy Jackson & the Olympians: The Lightning Thief""?",Uma Thurman
subgraphs_batch_072_textual_subgraph_0068.graphml,"Who is the actor known for their roles in ""The Cable Guy,"" ""The Specialist,"" and ""The Dark Knight""?",Eric Roberts
subgraphs_batch_072_textual_subgraph_0061.graphml,"Who is the film director that has lived in Washington, D.C. and is known for writing the story of ""Tropic Thunder"" as well as being involved in the film ""Miami Vice""?",Justin Theroux
subgraphs_batch_072_textual_subgraph_0058.graphml,"Which country is associated with athletes who participated in the 2008 Summer Olympics, speaks Spanish, and is linked to the release dates of the films ""Abraham Lincoln: Vampire Hunter"" and ""Skyfall""?",Ecuador
subgraphs_batch_072_textual_subgraph_0060.graphml,"Which actor has been nominated for a BAFTA Award for Best Actor in a Leading Role for the film ""Bob Roberts"" and is also associated with the movies ""Howard the Duck"" and ""Austin Powers: The Spy Who Shagged Me""?",Tim Robbins
subgraphs_batch_072_textual_subgraph_0064.graphml,"Who is the actor that was born in the United States, is married to their spouse, and has been a regular cast member on the TV show ""24"" as well as starring in the film ""Glory""?",Bob Gunton
subgraphs_batch_072_textual_subgraph_0071.graphml,"Who is the screenwriter who has been nominated for awards like Alex Borstein and is associated with the films ""Flags of Our Fathers"" and ""Fair Game""?",Thomas McCarthy
subgraphs_batch_072_textual_subgraph_0070.graphml,"Which actor has appeared in the films Centurion and Prometheus, as well as being nominated for an award for Inglourious Basterds and starring in 300?",Michael Fassbender
subgraphs_batch_072_textual_subgraph_0072.graphml,"Which film distribution company, known for distributing movies like ""Howl,"" ""The Losers,"" and ""Judge Dredd,"" is headquartered in California?",Hollywood Pictures
subgraphs_batch_072_textual_subgraph_0075.graphml,"Who is the voice actor known for their roles in both ""Mobile Suit Gundam SEED"" and ""Mobile Suit Gundam SEED Destiny""?",Houko Kuwashima
subgraphs_batch_072_textual_subgraph_0069.graphml,"Who is the male writer that was influenced by Steve Ditko and contributed to the stories of both ""The League of Extraordinary Gentlemen"" and ""Watchmen"" films?",Alan Moore
subgraphs_batch_072_textual_subgraph_0081.graphml,"Which male actor has won awards similar to Queen Latifah and appeared in both the film ""Thor"" and ""24: Redemption""?",Colm Feore
subgraphs_batch_072_textual_subgraph_0077.graphml,"Who is the composer born in London who provided the music for both ""Charlie's Angels"" and ""Charlie's Angels: Full Throttle""?",Edward Shearmur
subgraphs_batch_072_textual_subgraph_0067.graphml,"Which British actor, known for producing films like ""The Losers"" and ""Fair Game,"" has been nominated for the Razzie Award for Worst Prequel, Remake, Rip-off or Sequel?",Akiva Goldsman
subgraphs_batch_072_textual_subgraph_0073.graphml,"Who is the individual that designed the film sets for ""Little Nicky"" and ""2 Fast 2 Furious,"" and was nominated for an award in 2010, also being involved in the crew of ""Rules of Engagement""?",Rick Simpson
subgraphs_batch_072_textual_subgraph_0076.graphml,"Who is the person born in Manhattan, married to someone, and known for their film production design work on movies like ""Charlie's Angels: Full Throttle"" and ""Lethal Weapon 4""?",J. Michael Riva
subgraphs_batch_072_textual_subgraph_0078.graphml,"Which language is spoken in both Pakistan and Qatar, and is also the language used in the films ""Iron Man"" and ""I am Here""?",Urdu Language
subgraphs_batch_072_textual_subgraph_0074.graphml,"Which country, known for its currency being the United States Dollar and featured in the same schema as Earth, is also linked to the release dates of the films ""How to Train Your Dragon"" and ""Snow White and the Huntsman""?",Cyprus
subgraphs_batch_072_textual_subgraph_0079.graphml,"Which actor, known for his roles in ""Shrek the Third,"" ""Kung Fu Panda,"" and ""The Sorcerer's Apprentice,"" hails from Great Britain?",Ian McShane
subgraphs_batch_072_textual_subgraph_0080.graphml,"Who is the voice actress known for her work in ""Final Fantasy VII: Advent Children"" and ""RahXephon,"" and is also married to a person involved in the film industry?",Maaya Sakamoto
subgraphs_batch_072_textual_subgraph_0066.graphml,"Which location in the Mountain Time Zone-US is known for being featured in both the film ""3:10 to Yuma"" and ""Star Wars Episode VI: Return of the Jedi,"" and is also associated with the United States Department of Housing and Urban Development for its estimated number of mortgages?",Yuma
subgraphs_batch_072_textual_subgraph_0087.graphml,"Who is the comedian who is married and has appeared in both the film ""Grindhouse"" and the ""Star Trek"" series?",Simon Pegg
subgraphs_batch_072_textual_subgraph_0091.graphml,"Which theme connects the films ""The Crying Game,"" ""Munich,"" ""Die Hard,"" and ""The Kingdom""?",Terrorism
subgraphs_batch_072_textual_subgraph_0086.graphml,"Who is the person born in New Orleans who was influenced by Ernest Hemingway and wrote the stories for the films ""Out of Sight"" and ""Jackie Brown""?",Elmore Leonard
subgraphs_batch_072_textual_subgraph_0084.graphml,"Who is the audio engineer that worked on both ""Alien Resurrection"" and ""Star Wars Episode II: Attack of the Clones"" and was also nominated for an award for ""I Am Legend""?",Rick Kline
subgraphs_batch_072_textual_subgraph_0094.graphml,"Which actor has been nominated for a Razzie Award for Worst Actor and appeared in both ""The Guns of Navarone"" and ""The Count of Monte Cristo""?",Richard Harris
subgraphs_batch_072_textual_subgraph_0088.graphml,"Who is the person that speaks English, has won an award associated with Zsa Zsa Gábor, and is known for their dubbing performance in Howl's Moving Castle as well as their role in the film Spartacus?",Jean Simmons
subgraphs_batch_072_textual_subgraph_0085.graphml,"Which city is known for its significant number of mortgages as estimated by the United States Department of Housing and Urban Development, contains The Citadel, and has been featured in the films ""Die Hard with a Vengeance"" and ""The Patriot""?",Charleston
subgraphs_batch_072_textual_subgraph_0082.graphml,"Who is the individual who practices Catholicism, is married, and has been involved in the production of both the film ""Dune"" as an executive producer and ""Flash Gordon"" as a producer?",Dino De Laurentiis
subgraphs_batch_072_textual_subgraph_0093.graphml,"Which individual is known for producing the TV show ""The Good Wife,"" being nominated for awards alongside Leonard Dick, and directing films such as ""Top Gun"" and ""Enemy of the State""?",Tony Scott
subgraphs_batch_072_textual_subgraph_0099.graphml,"Who is the male actor from Great Britain who appeared in the films ""2012"" and ""300""?",Stephen McHattie
subgraphs_batch_072_textual_subgraph_0097.graphml,"Who is the actor from Great Britain who has lived in Salt Lake City and appeared in both ""The Incredible Hulk"" and ""National Treasure: Book of Secrets""?",Ty Burrell
subgraphs_batch_072_textual_subgraph_0095.graphml,"Which male actor, known for his roles in the 1941 film and Sin City, has been nominated for a Screen Actors Guild Award for Outstanding Performance by a Male Actor in a Leading Role?",Mickey Rourke
subgraphs_batch_072_textual_subgraph_0098.graphml,Who is the film producer from the United States who has worked on movies like xXx and Lock Up?,Danny Trejo
subgraphs_batch_072_textual_subgraph_0103.graphml,"Which actor has appeared in the films ""Imagine That,"" ""Sideways,"" ""Spider-Man 3,"" and ""John Carter""?",Thomas Haden Church
subgraphs_batch_072_textual_subgraph_0102.graphml,Who is the German composer born in Frankfurt who is known for his work on the music for the films K-19: The Widowmaker and Catwoman?,Klaus Badelt
subgraphs_batch_072_textual_subgraph_0083.graphml,"Which actor has been associated with films like ""Mortal Kombat: Annihilation,"" ""2 Fast 2 Furious,"" and ""Transformers: Dark of the Moon,"" and has also received award nominations for their role in a project involving Julie Benz?",James Remar
subgraphs_batch_072_textual_subgraph_0096.graphml,"Which actor has been nominated for a Primetime Emmy Award for Outstanding Guest Actor in a Drama Series for their role in ""The Cell"" and is also known for their performances in the films ""The Newton Boys"" and ""Full Metal Jacket""?",Vincent D'Onofrio
subgraphs_batch_072_textual_subgraph_0089.graphml,"Which actor has been nominated for the National Society of Film Critics Award for Best Supporting Actor for their role in ""The New World"" and has also appeared in both ""Sherlock Holmes: A Game of Shadows"" and ""Snow White and the Huntsman""?",Eddie Marsan
subgraphs_batch_072_textual_subgraph_0101.graphml,"Who is the renowned filmmaker who directed Mission: Impossible II and produced Red Cliff, while also being known for their work as both a film director and screenwriter?",John Woo
subgraphs_batch_072_textual_subgraph_0092.graphml,"Which actor has been nominated for an award for Silkwood, starred in the film Tombstone, was a regular cast member in the TV show Stargate, and also appeared in the movie 3000 Miles to Graceland?",Kurt Russell
subgraphs_batch_072_textual_subgraph_0105.graphml,"Which language is spoken in both Croatia and the Czech Republic and is also featured in the films ""xXx"" and ""The Brothers Bloom""?",Czech Language
subgraphs_batch_072_textual_subgraph_0109.graphml,"Who is the male screenwriter that has contributed to the films ""The Tourist"" and ""Octopussy""?",Steven Berkoff
subgraphs_batch_072_textual_subgraph_0107.graphml,Who is the person born in the United States who has been affiliated with Warner Bros. Entertainment and produced both the films Tango & Cash and Superman Returns?,Jon Peters
subgraphs_batch_072_textual_subgraph_0104.graphml,"Who is the actor from Great Britain who has been nominated for a Hong Kong Film Award for Best Supporting Actor and has both starred in ""Crouching Tiger, Hidden Dragon"" and won awards for ""A Better Tomorrow""?",Chow Yun-Fat
subgraphs_batch_072_textual_subgraph_0110.graphml,Which city is both home to McMaster University and served as a filming location for movies like The Incredible Hulk and X-Men?,Hamilton
subgraphs_batch_072_textual_subgraph_0108.graphml,"Which company is known for distributing films like ""The Passion of the Christ"" and ""Paranormal Activity,"" and is also associated with the production of movies such as ""Apocalypto"" and ""We Were Soldiers""?",Icon Productions
subgraphs_batch_072_textual_subgraph_0090.graphml,"Who is the actor that received award nominations for his role in a film with James Gandolfini, and also appeared in movies like ""The Fugitive,"" ""Percy Jackson & the Olympians: The Lightning Thief,"" and ""Cats & Dogs""?",Joe Pantoliano
subgraphs_batch_072_textual_subgraph_0125.graphml,"Who is the actor born in Anniston, known for his roles in ""The Terminator"" and ""Grindhouse""?",Michael Biehn
subgraphs_batch_072_textual_subgraph_0118.graphml,"Which company is responsible for distributing films such as Casper, Back to the Future Part II, King Kong, and Snow White and the Huntsman?",Universal Studios Home Entertainment
subgraphs_batch_072_textual_subgraph_0121.graphml,"Which award, known for recognizing outstanding supporting actresses in film, has both ""Crouching Tiger, Hidden Dragon"" and ""Red Cliff"" among its list of honored and nominated works?",Hong Kong Film Award for Best Supporting Actress
subgraphs_batch_072_textual_subgraph_0116.graphml,"Which actor has appeared in the films ""Youth in Revolt,"" ""Blow,"" ""Smokin' Aces,"" and ""Date Night""?",Ray Liotta
subgraphs_batch_072_textual_subgraph_0112.graphml,"What historical period is connected to the films ""Thirteen Days"" and ""K-19: The Widowmaker,"" as well as ""Watchmen,"" and is associated with significant events in the Soviet Union?",Cold War
subgraphs_batch_072_textual_subgraph_0119.graphml,"Which language is commonly spoken in both ""Rush Hour 3"" and ""King Arthur"" and is also studied by students majoring in Politics and History?",Latin Language
subgraphs_batch_072_textual_subgraph_0124.graphml,Who is the female singer-songwriter from Great Britain who was also part of the regular cast of the TV show My-HiME?,Kikuko Inoue
subgraphs_batch_072_textual_subgraph_0130.graphml,"Who is the British television producer known for producing ""The Walking Dead"" and also for producing the films ""The Terminator"" and ""Armageddon""?",Gale Anne Hurd
subgraphs_batch_072_textual_subgraph_0126.graphml,"Who is the person born in Catania who has been nominated for an award for Good Will Hunting and has won awards for Gladiator, and also edited the film Body of Lies?",Pietro Scalia
subgraphs_batch_072_textual_subgraph_0122.graphml,"Who is the voice actor known for their roles in the TV series ""Code Geass"" and the film ""Bleach: The DiamondDust Rebellion""?",Takahiro Sakurai
subgraphs_batch_072_textual_subgraph_0114.graphml,"Who is the model turned actor who received award nominations for his role in ""Gladiator"" and is also known for his appearance in ""Stargate""?",Djimon Hounsou
subgraphs_batch_072_textual_subgraph_0123.graphml,"Who is the actor born in Lund who has been nominated for awards for ""Extremely Loud and Incredibly Close"" and is also known for his roles in ""Minority Report"" and ""Dune""?",Max von Sydow
subgraphs_batch_072_textual_subgraph_0127.graphml,"Who was the male actor that passed away in Los Angeles and is known for his roles in ""Mars Attacks!"" and ""Star Trek II: The Wrath of Khan""?",Paul Winfield
subgraphs_batch_072_textual_subgraph_0128.graphml,"Who is the screenwriter known for films such as ""Oscar and Lucinda,"" ""Van Helsing,"" and ""The League of Extraordinary Gentlemen""?",Richard Roxburgh
subgraphs_batch_072_textual_subgraph_0106.graphml,"Which actress has been nominated for a BAFTA Award for Best Actress in a Supporting Role alongside Melissa Leo and has appeared in both ""Talladega Nights: The Ballad of Ricky Bobby"" and ""Night at the Museum: Battle of the Smithsonian""?",Amy Adams
subgraphs_batch_072_textual_subgraph_0135.graphml,Which award has been won by Nicholas Tse and is associated with films like Kung Fu Hustle and Bodyguards and Assassins?,Hong Kong Film Award for Best New Performer
subgraphs_batch_072_textual_subgraph_0117.graphml,"Which actor, known for his roles in ""Pinocchio,"" ""Ghostbusters II,"" and ""Cars 2,"" also works as an author in Great Britain?",Cheech Marin
subgraphs_batch_072_textual_subgraph_0129.graphml,"What genre encompasses movies like WarGames, The Quiet American, V for Vendetta, and The Invasion?",Political thriller
subgraphs_batch_072_textual_subgraph_0115.graphml,"Which company is known for distributing films such as ""Scream 3,"" ""Sin City,"" and ""Spy Kids 3-D: Game Over,"" and has also been nominated for the Razzie Award for Worst Prequel, Remake, Rip-off or Sequel?",Dimension Films
subgraphs_batch_072_textual_subgraph_0133.graphml,"Who is the actor from the United Kingdom who has been nominated for a Tony Award for Best Featured Actor in a Play and is also known for his roles in the films ""G.I. Joe: The Rise of Cobra"" and ""G.I. Joe: Retaliation""?",Jonathan Pryce
subgraphs_batch_072_textual_subgraph_0136.graphml,"Who is the female actor that appeared in both ""Bleach: Memories of Nobody"" and ""Bleach: The DiamondDust Rebellion,"" and was also part of the regular cast in ""Mobile Suit Gundam 00""?",Rie Kugimiya
subgraphs_batch_072_textual_subgraph_0132.graphml,"Who is the film director that was nominated for a Razzie Award for Worst Supporting Actor and is associated with the movies ""The Island of Dr. Moreau"" and ""Timeline""?",David Thewlis
subgraphs_batch_072_textual_subgraph_0131.graphml,"Who is the person that was born in Flint, is married, and has been in the films ""Get Smart"" and ""Terminator Salvation""?",Terry Crews
subgraphs_batch_072_textual_subgraph_0139.graphml,"Who is the male actor that appeared in ""Dead Man Walking"" and also had roles in ""Full Metal Jacket"" and ""X-Men: The Last Stand""?",R. Lee Ermey
subgraphs_batch_072_textual_subgraph_0120.graphml,"Which individual has been nominated for the Razzie Award for Worst Prequel, Remake, Rip-off or Sequel, and is associated with the films Get Carter and 3000 Miles to Graceland, alongside director Renny Harlin?",Elie Samaha
subgraphs_batch_072_textual_subgraph_0140.graphml,"Who is the actor born in the United States of America who has appeared in both ""Planet of the Apes"" and ""Elektra""?",Cary-Hiroyuki Tagawa
subgraphs_batch_072_textual_subgraph_0144.graphml,"Who is the actor that is married to Tom Hanks's spouse and has appeared in both ""We Were Soldiers"" and ""Enemy of the State""?",Barry Pepper
