file,query,answer
subgraphs_batch_085_textual_subgraph_0167.graphml,"Which adventure film was released in France, the United States, and Japan?",Quest for Fire
subgraphs_batch_085_textual_subgraph_0160.graphml,"Which film was released in Argentina, the Philippines, and the United States, and also had a DVD release date?",Quest for Fire
subgraphs_batch_085_textual_subgraph_0164.graphml,"What adventure film was released in France and the United States, and had a sound editor from Great Britain?",Quest for Fire
subgraphs_batch_085_textual_subgraph_0158.graphml,"Which film was released in both Japan and the United States and is associated with the fantasy genre, featuring a sound editor from Great Britain?",Quest for Fire
subgraphs_batch_085_textual_subgraph_0154.graphml,"Which adventure film, featuring a crew member associated with sound and connected to both Canada and the United States, remains unidentified in this context?",Quest for Fire
subgraphs_batch_085_textual_subgraph_0156.graphml,"What film was released in both Australia and the United States, and had a crew member associated with sound, as well as a DVD release date?",Quest for Fire
subgraphs_batch_085_textual_subgraph_0150.graphml,"What adventure film, which was released in Australia and has a connection to Canada, also features the role of a Special Effects Supervisor in its crew?",Quest for Fire
subgraphs_batch_085_textual_subgraph_0149.graphml,"Which film was produced by Happy Madison Productions, featured music by Robert Wachtel, included a Special Effects Supervisor in its crew, and is associated with the United States of America?",Bucky Larson: Born to Be a Star
subgraphs_batch_085_textual_subgraph_0153.graphml,"What is the title of the romance film that was released in the United States and had an estimated budget in United States Dollars, also available on DVD?",Life as We Know It
subgraphs_batch_085_textual_subgraph_0162.graphml,Which film features a makeup artist from Great Britain and was released in both Australia and the United States?,Quest for Fire
subgraphs_batch_085_textual_subgraph_0166.graphml,"Which thriller film was released on DVD and in the United States, and is primarily in the English language?",End of Days
subgraphs_batch_085_textual_subgraph_0151.graphml,"Which film was released in Japan, won the Academy Award for Best Makeup and Hairstyling, and had a makeup artist from Great Britain and a special effects supervisor on its crew?",Quest for Fire
subgraphs_batch_085_textual_subgraph_0165.graphml,"Which adventure film features a makeup artist from Great Britain and was released on DVD, also including a sound crew member?",Quest for Fire
subgraphs_batch_085_textual_subgraph_0157.graphml,"Which film featuring Jennifer Aniston, produced by New Line Cinema, involved a Special Effects Supervisor and was released in the United States?",Horrible Bosses
subgraphs_batch_085_textual_subgraph_0163.graphml,"Which film, featuring locations in Pittsburgh and produced by Danny DeVito, was released in the United States and nominated for the Academy Award for Best Makeup and Hairstyling?",Hoffa
subgraphs_batch_085_textual_subgraph_0168.graphml,"Which film has won the Genie Award for Best Achievement in Overall Sound, features a Sound Editor and Makeup Artist from Great Britain, and falls under the fantasy genre?",Quest for Fire
subgraphs_batch_085_textual_subgraph_0159.graphml,"Which film was featured at the 2009 Toronto International Film Festival, had a Boom Operator and Sound Editor-GB in its crew, and was released in the United States of America?",The Road
subgraphs_batch_085_textual_subgraph_0175.graphml,Which animated romance and adventure film is affiliated with the United States of America?,Tarzan
subgraphs_batch_085_textual_subgraph_0170.graphml,"Which romantic comedy film, spoken in Japanese and released in the United States, features a makeup artist from Great Britain in its crew?",Shopgirl
subgraphs_batch_085_textual_subgraph_0169.graphml,"Which film was released in both Sweden and the Netherlands and also features the work of a makeup artist from Great Britain, with its release date associated with a DVD release?",Quest for Fire
subgraphs_batch_085_textual_subgraph_0161.graphml,"Which film, produced by Paramount Pictures, won the National Society of Film Critics Award for Best Actor and featured the talents of a makeup artist and a sound editor from Great Britain?",The Nutty Professor
subgraphs_batch_085_textual_subgraph_0171.graphml,"Which film, featuring visual effects supervised by a notable professional and associated with both Iceland and the United States, falls under the fantasy genre?",Stardust
subgraphs_batch_085_textual_subgraph_0180.graphml,"Which fantasy film was released in the Philippines and Australia, and is associated with Canada?",Quest for Fire
subgraphs_batch_085_textual_subgraph_0177.graphml,"Which film was released in Belgium and France, and also had its release dates in the United States and on DVD?",Quest for Fire
subgraphs_batch_085_textual_subgraph_0173.graphml,"Which teen comedy film, also known for its British humor, was released on DVD and had a notable makeup artist from Great Britain on its crew?",Orange County
subgraphs_batch_085_textual_subgraph_0174.graphml,"Which film is known for being in German, featuring a Visual Effects Supervisor and a Makeup Artist from Great Britain, and has a connection to Italy?",Downfall
subgraphs_batch_085_textual_subgraph_0183.graphml,"Which adventure film, featuring a makeup artist from Great Britain and sound crew, was released on DVD?",Quest for Fire
subgraphs_batch_085_textual_subgraph_0184.graphml,"Which film features Bam Margera, is a documentary, and has both a makeup artist from Great Britain and a special effects supervisor on its crew?",Jackass 3D
subgraphs_batch_085_textual_subgraph_0185.graphml,Which film was released in both Australia and the United States and had crew members including a sound technician and a makeup artist from Great Britain?,Quest for Fire
subgraphs_batch_085_textual_subgraph_0182.graphml,"Which film was released in Brazil and Argentina and also involved a Special Effects Supervisor, with a release date in the United States?",Quest for Fire
subgraphs_batch_085_textual_subgraph_0176.graphml,"Which film was featured at the 2009 Sundance Film Festival, primarily spoken in English, released on DVD, and had a Special Effects Supervisor as part of its crew?",Adventureland
subgraphs_batch_085_textual_subgraph_0186.graphml,Which film that involves time travel and is in English was released on DVD and had a makeup artist from Great Britain on its crew?,Lost in Space
subgraphs_batch_085_textual_subgraph_0191.graphml,Which animated musical film was released in the United States and also made available on DVD?,The Little Mermaid
subgraphs_batch_085_textual_subgraph_0178.graphml,"Which film was written by Michael Mann, features English as its language, and includes notable contributions from a makeup artist and a special effects supervisor in its crew?",Miami Vice
subgraphs_batch_085_textual_subgraph_0187.graphml,Which film features a makeup artist from Great Britain and was released in both Argentina and the United States?,Quest for Fire
subgraphs_batch_085_textual_subgraph_0181.graphml,"Which film has won the Academy Award for Best Makeup and Hairstyling, was released in Brazil, and had a Sound Editor from Great Britain and a Special Effects Supervisor on its crew?",Quest for Fire
subgraphs_batch_085_textual_subgraph_0188.graphml,"Which adventure film was released in the Netherlands, France, and the United States of America?",Quest for Fire
subgraphs_batch_085_textual_subgraph_0190.graphml,Which adventure film was released in both Australia and the United States and had notable contributions from a sound crew?,Quest for Fire
subgraphs_batch_085_textual_subgraph_0172.graphml,"What science fiction film, which serves as a prequel to the story of Hulk, is both associated with the United States and had contributions from a notable makeup artist known as Makeup Artist-GB?",The Incredible Hulk
subgraphs_batch_085_textual_subgraph_0189.graphml,"Which adventure film, featuring sound work by notable crew members, was released on DVD and had its release dates in the United States?",Quest for Fire
subgraphs_batch_085_textual_subgraph_0179.graphml,"Which film features Kevin O'Connell and Makeup Artist-GB in its crew, is produced by David Foster, and has a release date associated with a DVD release?",The Mask of Zorro
subgraphs_batch_085_textual_subgraph_0196.graphml,"Which film was released in Brazil and Japan, and had a Sound Editor from Great Britain, also being related to France?",Quest for Fire
subgraphs_batch_085_textual_subgraph_0192.graphml,"Which film features a Technical Director and is primarily in German, while also being connected to France and having a Makeup Artist from Great Britain?",Spy Game
subgraphs_batch_085_textual_subgraph_0201.graphml,"Which film was released in France, Argentina, and the United States, and also had a DVD release date?",Quest for Fire
subgraphs_batch_085_textual_subgraph_0194.graphml,"Which film, set in the genre of fantasy, was released in France and Belgium and also had its DVD release date associated with these countries?",Quest for Fire
subgraphs_batch_085_textual_subgraph_0197.graphml,"Which film was released in both Brazil and the United States, won a Genie Award for Best Achievement in Overall Sound, and had a Special Effects Supervisor on its crew?",Quest for Fire
subgraphs_batch_085_textual_subgraph_0198.graphml,"Which film, released in the Philippines and featuring the work of a makeup artist and a sound editor from Great Britain, won the Academy Award for Best Makeup and Hairstyling?",Quest for Fire
subgraphs_batch_085_textual_subgraph_0210.graphml,"Which film was released in France, Belgium, and the United States, and also had a DVD release date?",Quest for Fire
subgraphs_batch_085_textual_subgraph_0193.graphml,"Which animated film features Gary Rydstrom as part of its crew, was produced by Walt Disney Animation Studios, is associated with the United States, and was released on DVD?",Hercules
subgraphs_batch_085_textual_subgraph_0195.graphml,"Which film, known for its adventurous and fantasy elements, features a crew with notable contributions from France and is associated with the sound aspect of filmmaking?",Quest for Fire
subgraphs_batch_085_textual_subgraph_0199.graphml,"Which film has won the Academy Award for Best Makeup and Hairstyling, is related to Canada, and has release dates associated with both the United States of America and DVD?",Quest for Fire
subgraphs_batch_085_textual_subgraph_0203.graphml,"Which film is connected to Canada, has release dates associated with Brazil, the United States, and also saw a DVD release?",Quest for Fire
subgraphs_batch_085_textual_subgraph_0209.graphml,"What is the name of the adventure film that was released in the Netherlands, Hong Kong, and is related to Canada?",Quest for Fire
subgraphs_batch_085_textual_subgraph_0200.graphml,"Which film features Skip Lievsay and a Visual Effects Supervisor among its crew, has a release date associated with a DVD, and includes a Makeup Artist from Great Britain?",Beloved
subgraphs_batch_085_textual_subgraph_0205.graphml,"Which film was released in West Germany, is related to Canada, has won the BAFTA Award for Best Makeup & Hair, and is known as a period piece?",Quest for Fire
subgraphs_batch_085_textual_subgraph_0208.graphml,"Which film features special effects and was shot in Rome, also involving a makeup artist from Great Britain and being related to the United States of America?",When in Rome
subgraphs_batch_085_textual_subgraph_0204.graphml,"Which film was released in Argentina and Brazil, and also involved a Special Effects Supervisor, with a release date in the United States?",Quest for Fire
subgraphs_batch_085_textual_subgraph_0206.graphml,"Which film was released in Japan, Brazil, and the United States, and had a makeup artist from Great Britain on its crew?",Quest for Fire
subgraphs_batch_085_textual_subgraph_0207.graphml,"Which film was released in Belgium and Brazil, and also featured a makeup artist from Great Britain in its crew, in addition to being available on DVD?",Quest for Fire
subgraphs_batch_085_textual_subgraph_0217.graphml,Which adventure film was released in both Australia and the United States and had a makeup artist from Great Britain on its crew?,Quest for Fire
subgraphs_batch_085_textual_subgraph_0202.graphml,"Which film has won the Genie Award for Best Achievement in Overall Sound, was released in Argentina and the United States of America, and features a Special Effects Supervisor among its crew?",Quest for Fire
subgraphs_batch_085_textual_subgraph_0214.graphml,"Which film was released in Belgium, is associated with Canada, had its DVD release date, and won the BAFTA Award for Best Makeup & Hair?",Quest for Fire
subgraphs_batch_085_textual_subgraph_0213.graphml,Which animated TV series featuring Kikuko Inoue as a regular cast member is also associated with the adventure film genre and originates from Japan?,My-HiME
subgraphs_batch_085_textual_subgraph_0216.graphml,"Which film was released in Brazil, is affiliated with France, and falls under the genres of Fantasy and Adventure?",Quest for Fire
subgraphs_batch_085_textual_subgraph_0211.graphml,"Which film has connections to both Australia and the United States for its release dates, and also involves notable contributions from its sound crew, with a DVD release as part of its distribution?",Quest for Fire
subgraphs_batch_085_textual_subgraph_0212.graphml,"Which film was released in Brazil, won the Genie Award for Best Achievement in Overall Sound, and had both a makeup artist from Great Britain and a special effects supervisor on its crew?",Quest for Fire
subgraphs_batch_085_textual_subgraph_0220.graphml,"Which film has a makeup artist from Great Britain, was released in Australia, Sweden, and Portugal, but is not yet named?",Quest for Fire
subgraphs_batch_085_textual_subgraph_0215.graphml,"Which film serves as the sequel to ""Superman II: The Richard Donner Cut,"" was nominated for awards like its predecessor ""Superman,"" and falls under the fantasy genre with a known DVD release date?",Superman III
subgraphs_batch_085_textual_subgraph_0221.graphml,"Which film, distributed in the United Kingdom and belonging to the drama genre, is also connected to Sweden and had its release date associated with a DVD release?",Let the Right One In
subgraphs_batch_085_textual_subgraph_0218.graphml,Which adventure film has won the Genie Award for Best Achievement in Overall Sound and was released in Japan and on DVD?,Quest for Fire
subgraphs_batch_085_textual_subgraph_0219.graphml,"What film was edited by Michael Kahn, falls under the comedy genre, and had both a makeup artist and a sound editor from Great Britain on its crew?",The Terminal
subgraphs_batch_085_textual_subgraph_0226.graphml,What is the name of the TV drama-fantasy series that features Takahiro Sakurai as a regular cast member and originates from Japan?,Code Geass
subgraphs_batch_085_textual_subgraph_0225.graphml,"Which film features a Sound Editor from Great Britain, was released in Japan, falls under the Fantasy genre, and includes a Special Effects Supervisor among its crew?",Quest for Fire
subgraphs_batch_085_textual_subgraph_0229.graphml,Which adventure film produced by Ryan Kavanaugh and featuring a Special Effects Supervisor in its crew is known for its impressive special effects?,Immortals
subgraphs_batch_085_textual_subgraph_0230.graphml,"What film was released in Argentina, Brazil, and the United States, and also had a DVD release date?",Quest for Fire
subgraphs_batch_085_textual_subgraph_0223.graphml,Which film was released in both Australia and Sweden and had a Sound Editor from Great Britain and a Special Effects Supervisor on its crew?,Quest for Fire
subgraphs_batch_085_textual_subgraph_0224.graphml,"Which film, known for its comedic elements and set in a historical period, was made in the United States and primarily features dialogue in English?",A Midsummer Night's Dream
subgraphs_batch_085_textual_subgraph_0228.graphml,"Which film has an estimated budget in United States Dollars, falls under the genre of Crime Fiction, features a Makeup Artist from Great Britain, and was released on DVD?",Dirty Pretty Things
subgraphs_batch_085_textual_subgraph_0227.graphml,"Which teen film features a set dresser, a special effects supervisor, and a makeup artist from Great Britain in its crew?",The Last Song
subgraphs_batch_085_textual_subgraph_0231.graphml,"Which country is both home to Gifu Prefecture and Keio University, and is also associated with the film ""Dead Man"" as well as the release of ""Psycho""?",Japan
subgraphs_batch_085_textual_subgraph_0238.graphml,"What is the entity that is both found in Gifu Prefecture and Keio University, and is also connected to the release dates of the films Titanic and Snow White and the Huntsman?",Japan
subgraphs_batch_085_textual_subgraph_0237.graphml,"Which country is home to both Keio University and Hokkaido, and is the birthplace of Shohei Imamura and Tomoyuki Tanaka?",Japan
subgraphs_batch_085_textual_subgraph_0222.graphml,"Which film has won awards for Sylvester Stallone's performance and the movie ""Lock Up,"" and also features a Special Effects Supervisor and a Makeup Artist from Great Britain in its crew?",Daylight
subgraphs_batch_085_textual_subgraph_0233.graphml,"Which entity is both located within Gifu Prefecture and Hokkaido, and is also associated with the release dates of the films ""Terminator 2: Judgment Day"" and ""Funny People""?",Japan
subgraphs_batch_085_textual_subgraph_0234.graphml,"Which award has been won by both Woody Allen and Anthony Minghella, and is also associated with the films Zero Dark Thirty and The Silence of the Lambs?",National Board of Review Award for Best Director
subgraphs_batch_085_textual_subgraph_0247.graphml,"Which country contains Osaka, won medals at the 1988 Summer Olympics, and is the nationality of both Aya Hisakawa and Maaya Sakamoto?",Japan
subgraphs_batch_085_textual_subgraph_0235.graphml,"Which country is home to both Hokkaido and Gifu Prefecture and also shares film release dates with ""Footloose"" and ""Oliver!""?",Japan
subgraphs_batch_085_textual_subgraph_0232.graphml,"Which country is both home to Hokkaido and Keio University, and is associated with the films ""Good Night, and Good Luck"" and ""Inception""?",Japan
subgraphs_batch_085_textual_subgraph_0241.graphml,"Who is the person that has been nominated for the BFCA Critics' Choice Award for Best Comedy for ""The Larry Sanders Show"" and is also connected to the film ""Funny People"" as well as being married?",Judd Apatow
subgraphs_batch_085_textual_subgraph_0244.graphml,"Which musical genre is associated with artists such as Gorillaz, Rick Wakeman, Ryuichi Sakamoto, and Hikaru Utada?",Electronica
subgraphs_batch_085_textual_subgraph_0236.graphml,"Which musical instrument is associated with performances by Bass, has been played by James Levine, and is also connected to the talents of Yoko Ono and Ryuichi Sakamoto?",Piano
subgraphs_batch_085_textual_subgraph_0249.graphml,"Who is the male artist known for contributing tracks to electronic keyboard music and composing the scores for films like ""Kiki's Delivery Service"" and ""My Neighbor Totoro""?",Joe Hisaishi
subgraphs_batch_085_textual_subgraph_0248.graphml,"Which country is home to both Keio University and Hokkaido, and is also the birthplace of Shinya Tsukamoto and Liv Ullmann?",Japan
subgraphs_batch_085_textual_subgraph_0242.graphml,"Which prestigious award has been won by both Michael Haneke and Terrence Malick, and is also associated with Shohei Imamura and the nominated film The Tree of Life?",Palme d'Or
subgraphs_batch_085_textual_subgraph_0252.graphml,"Which entity is both located in Gifu Prefecture and Hokkaido, and is also associated with the release dates of the films ""Giant"" and ""Unforgiven""?",Japan
subgraphs_batch_085_textual_subgraph_0245.graphml,"Who is the individual that has been nominated for both the Writers Guild of America Award for Best Adapted Screenplay and the Independent Spirit Award for Best Female Lead, and is also associated with the film ""Primary Colors"" as well as being married?",Emma Thompson
subgraphs_batch_085_textual_subgraph_0253.graphml,"Which country won medals at the 1980 Winter Olympics, contains the city of Osaka, and is the birthplace of both Hayao Miyazaki and Joe Hisaishi?",Japan
subgraphs_batch_085_textual_subgraph_0250.graphml,"Which country has won medals at the 1964 Summer Olympics, contains Kagoshima Prefecture, uses the United States Dollar as its GNI per capita in PPP dollars, and recognizes marriage as a type of personal union?",Japan
subgraphs_batch_085_textual_subgraph_0246.graphml,"Which place is known for containing both Hokkaido and Keio University, and is also associated with the release dates of the films ""Sherlock Holmes: A Game of Shadows"" and ""Pirates of the Caribbean: The Curse of the Black Pearl""?",Japan
subgraphs_batch_085_textual_subgraph_0257.graphml,"Which award has recognized actresses from films like ""The English Patient,"" ""Fargo,"" ""The Help,"" and ""The Bridges of Madison County""?",Screen Actors Guild Award for Outstanding Performance by a Female Actor in a Leading Role
subgraphs_batch_085_textual_subgraph_0251.graphml,"What is the entity that is both connected to Keio University and Osaka, and also has ties to the release dates of the films ""Psycho"" and ""Insidious""?",Japan
subgraphs_batch_085_textual_subgraph_0240.graphml,"Which country is known for containing Osaka and Gifu Prefecture, and is also associated with the nationality of Hayao Miyazaki and the spouse of Gene Roddenberry?",Japan
subgraphs_batch_085_textual_subgraph_0243.graphml,"Which award has been won by both Drew Barrymore and Rachel McAdams, and is also associated with the nominations for Django Unchained and the wins for The Lord of the Rings: The Two Towers?",MTV Movie Award for Best On-Screen Duo
subgraphs_batch_085_textual_subgraph_0258.graphml,"Which country is home to both Keio University and Gifu Prefecture, and is also the birthplace of Minami Takayama and Maaya Sakamoto?",Japan
subgraphs_batch_085_textual_subgraph_0255.graphml,"Which country is known for hosting the 1924 Summer Olympics, is home to the city of Yokohama, and has connections to the films ""Home Alone"" and ""13 Assassins""?",Japan
subgraphs_batch_085_textual_subgraph_0239.graphml,"Which award, known for recognizing less-than-stellar cinematic achievements, has nominees including ""In the Name of the King: A Dungeon Siege Tale,"" ""The Scarlet Letter,"" ""The Expendables,"" and ""Battleship""?",Razzie Award for Worst Director
subgraphs_batch_085_textual_subgraph_0254.graphml,"Which film entity is associated with both the titles ""Cookie's Fortune"" and ""Mystic River,"" as well as the genres of ""Jaws 3-D"" and ""Kaboom""?",Mystery
subgraphs_batch_085_textual_subgraph_0261.graphml,"Which actress, known for her roles in ""Inception"" and ""The Dark Knight Rises,"" has been nominated for the National Society of Film Critics Award for Best Actress?",Marion Cotillard
subgraphs_batch_085_textual_subgraph_0262.graphml,"Which country is both home to Hokkaido and Osaka, and is connected to the films ""Memoirs of a Geisha"" and ""L.A. Confidential""?",Japan
subgraphs_batch_085_textual_subgraph_0266.graphml,"Which country is both home to Hokkaido and Osaka, and has connections to the films ""Unforgiven"" and ""Wonder Boys""?",Japan
subgraphs_batch_085_textual_subgraph_0256.graphml,"Which company is responsible for distributing films like Fast Food Nation and Beasts of the Southern Wild, and has produced movies such as The Best Exotic Marigold Hotel, while also being associated with award nominations for Fantastic Mr. Fox?",Fox Searchlight Pictures
subgraphs_batch_085_textual_subgraph_0260.graphml,"Which country has won medals at the 1988 Summer Olympics, contains the region of Hokkaido, and is associated with the release dates of the films ""Beginners"" and ""Kung Fu Panda 2""?",Japan
subgraphs_batch_085_textual_subgraph_0264.graphml,"What is the country that includes Osaka and Gifu Prefecture, and is also connected to the release dates of the films ""Fight Club"" and ""A Serious Man""?",Japan
subgraphs_batch_085_textual_subgraph_0267.graphml,"Which country is known for hosting the 1924 Summer Olympics in Sapporo and also has connections to the release dates of iconic films like ""Back to the Future"" and ""E.T. the Extra-Terrestrial""?",Japan
subgraphs_batch_085_textual_subgraph_0270.graphml,"Which country has won medals at the 2000 Summer Olympics, exports goods to Sudan, contains Fukushima Prefecture, and is related to Tokyo?",Japan
subgraphs_batch_085_textual_subgraph_0265.graphml,"Which country is known for being located in Kagoshima Prefecture, winning medals at the 2008 Summer Olympics, exporting goods to the United States, and having English as one of its spoken languages?",Japan
subgraphs_batch_085_textual_subgraph_0263.graphml,"Which company is known for distributing films like ""The Usual Suspects,"" ""WarGames,"" and ""Carrie,"" and has been associated with Mervyn LeRoy's award nominations?",Metro-Goldwyn-Mayer
subgraphs_batch_085_textual_subgraph_0271.graphml,"Which country is home to both Keio University and Hokkaido, and has also been associated with the release dates of the films ""Mrs Henderson Presents"" and ""Tyrannosaur""?",Japan
subgraphs_batch_085_textual_subgraph_0269.graphml,Which country is home to both Hokkaido and Gifu Prefecture and also shares a connection with the release dates of the films Tyrannosaur and (500) Days of Summer?,Japan
