file,query,answer
subgraphs_batch_004_textual_subgraph_0733.graphml,"Which actress, known for her roles in both romance and drama films, has won an Academy Award for Best Actress and is associated with the United States?",Moonstruck
subgraphs_batch_004_textual_subgraph_0742.graphml,Who is the American record producer known for being influenced by Whitney Houston and has an official website?,Lady Gaga
subgraphs_batch_004_textual_subgraph_0725.graphml,"Who is the actor who was married to s., received an Academy Award nomination for Best Actor, and was also nominated for an award for the film All That Jazz, with an official website listed under Common's webpage?",Roy Scheider
subgraphs_batch_004_textual_subgraph_0739.graphml,"Which indie and action film, also known for its dramatic elements, has an official website dedicated to it?",American History X
subgraphs_batch_004_textual_subgraph_0743.graphml,"Who is the person who was married to Dan Aykroyd, speaks English, and has United States nationality?",Fran Drescher
subgraphs_batch_004_textual_subgraph_0735.graphml,"Which film features Matthew W. Mungle and a Sound Mixer in its crew, is associated with the United States, and has nominees for the Academy Award for Best Actor?",American History X
subgraphs_batch_004_textual_subgraph_0727.graphml,"Which action film, featuring Matthew W. Mungle in its crew and presented in English, has an official website dedicated to it?",American History X
subgraphs_batch_004_textual_subgraph_0751.graphml,"Which action film, released on DVD, is affiliated with the United States of America and primarily spoken in English?",American History X
subgraphs_batch_004_textual_subgraph_0746.graphml,"What film has an official website, was released on DVD, is primarily in English, and falls under the genre of drama?",American History X
subgraphs_batch_004_textual_subgraph_0745.graphml,"Which film, featuring a Sound Mixer and produced by New Line Cinema, is known for being in the English language and belonging to the Drama genre?",American History X
subgraphs_batch_004_textual_subgraph_0740.graphml,"What action and drama film, featuring Matthew W. Mungle in its crew and primarily in English, are we referring to?",American History X
subgraphs_batch_004_textual_subgraph_0741.graphml,"Which film features Edward Norton, who has won notable awards, includes Matthew W. Mungle in its crew, and has been nominated for the Academy Award for Best Actor, all while being related to the United States of America?",American History X
subgraphs_batch_004_textual_subgraph_0748.graphml,"Which film was produced by Avi Arad, presented in IMAX format, involved a sound mixer in its crew, and is associated with the United States of America?",The Amazing Spider-Man
subgraphs_batch_004_textual_subgraph_0753.graphml,"Which indie film, featuring Matthew W. Mungle in its crew, was made in the United States and primarily in the English language?",American History X
subgraphs_batch_004_textual_subgraph_0744.graphml,"Who is the actor that starred in ""The Lost World: Jurassic Park"" and was influenced by Bill Murray, speaks English, and was born in the United States?",Vince Vaughn
subgraphs_batch_004_textual_subgraph_0749.graphml,"What action and drama film, which has an official website called Common's webpage, is affiliated with the United States of America?",American History X
subgraphs_batch_004_textual_subgraph_0752.graphml,"Which indie and action film, associated with the United States and featured on its official website, remains unnamed in this context?",American History X
subgraphs_batch_004_textual_subgraph_0755.graphml,"Which film features an art director and falls under the genre of British comedy, while being in English and associated with the United States?",Role Models
subgraphs_batch_004_textual_subgraph_0756.graphml,"Which indie and action film, featuring English dialogue and notable for its sound mixing, remains a hidden gem in cinematic history?",American History X
subgraphs_batch_004_textual_subgraph_0762.graphml,"Which action film, produced by New Line Cinema and featuring an official website, was primarily released in the English language?",American History X
subgraphs_batch_004_textual_subgraph_0764.graphml,"Which action and indie film, made in the United States and primarily in English, might this be referring to?",American History X
subgraphs_batch_004_textual_subgraph_0766.graphml,"Which action film, featuring Matthew W. Mungle in its crew, is related to the United States of America and has an official website?",American History X
subgraphs_batch_004_textual_subgraph_0754.graphml,"Which film, directed by Gethin Creagh and honored with the Los Angeles Film Critics Association Award for Best Director, was released on DVD and falls under the drama genre?",The Piano
subgraphs_batch_004_textual_subgraph_0757.graphml,"Which film features Edward Norton as an award-winning actor, includes Matthew W. Mungle and a sound mixer in its crew, and falls under the drama genre?",American History X
subgraphs_batch_004_textual_subgraph_0747.graphml,"Which film features Edward Norton, who has won awards, includes a Sound Mixer in its crew, is in the English language, and has a nominee for the Academy Award for Best Actor?",American History X
subgraphs_batch_004_textual_subgraph_0750.graphml,"Which film has won both the Academy Award for Best Director and the National Society of Film Critics Award for Best Actor, and was also nominated for the Academy Award for Best Actor, while being closely associated with the United States of America?",Midnight Cowboy
subgraphs_batch_004_textual_subgraph_0759.graphml,"Who is the artist born in the United States who has been nominated for both the Grammy Award for Album of the Year and the MTV Video Music Award for Best Rap Video, and also has an official website?",Snoop Dogg
subgraphs_batch_004_textual_subgraph_0760.graphml,"Which crime fiction film, produced by New Line Cinema and with an estimated budget in United States Dollars, is closely associated with the United States of America?",American History X
subgraphs_batch_004_textual_subgraph_0763.graphml,What English-language indie drama film features Matthew W. Mungle as part of its crew?,American History X
subgraphs_batch_004_textual_subgraph_0761.graphml,"Which film combines the genres of action and drama, features Matthew W. Mungle in its crew, and is associated with the United States of America?",American History X
subgraphs_batch_004_textual_subgraph_0775.graphml,"Which film was produced by New Line Cinema, features both action and drama genres, and is primarily in the English language?",American History X
subgraphs_batch_004_textual_subgraph_0767.graphml,"Which action film, distributed in the United Kingdom, is related to the United States and primarily spoken in English?",American History X
subgraphs_batch_004_textual_subgraph_0765.graphml,"Which TV series features Shohreh Aghdashloo and Xander Berkeley in its regular cast, is set in the genre of crime fiction, and originates from the United States?",24
subgraphs_batch_004_textual_subgraph_0758.graphml,"Which film, released on DVD and featuring Matthew W. Mungle in its crew, is related to the United States and primarily in the English language?",American History X
subgraphs_batch_004_textual_subgraph_0777.graphml,Which action film featuring English dialogue had Rick Kline as the Visual Effects Supervisor?,Percy Jackson & the Olympians: The Lightning Thief
subgraphs_batch_004_textual_subgraph_0768.graphml,"Which film was shot in Mesa, primarily spoken in Arabic, and had its release date on DVD while also featuring a notable sound mixer in its crew?",The Kingdom
subgraphs_batch_004_textual_subgraph_0770.graphml,"What film features Matthew W. Mungle in its crew, was released on DVD, is related to the United States of America, and is primarily in the English language?",American History X
subgraphs_batch_004_textual_subgraph_0776.graphml,"Which action film, distributed in the United Kingdom and with an estimated budget in United States Dollars, was released on DVD?",American History X
subgraphs_batch_004_textual_subgraph_0772.graphml,"What indie and action film, also related to a DVD release and the drama genre, are we talking about?",American History X
subgraphs_batch_004_textual_subgraph_0773.graphml,"Which film, featuring Edward Norton who has won awards, was distributed in the United Kingdom, released on DVD, and primarily spoken in English?",American History X
subgraphs_batch_004_textual_subgraph_0779.graphml,"Which film was released in Finland, primarily in Spanish and English, and is associated with the United States?",Hold Back the Dawn
subgraphs_batch_004_textual_subgraph_0774.graphml,"Which TV series features Ted Danson as a regular cast member and has Ted Danson as an executive producer, while also belonging to the genres of Crime Fiction and Drama?",Damages
subgraphs_batch_004_textual_subgraph_0771.graphml,"Which film has Edward Norton won awards for, is distributed in the United Kingdom, and has a release date associated with DVD in the United States?",American History X
subgraphs_batch_004_textual_subgraph_0778.graphml,"Which film, featuring a sound mixer from the United States and released on DVD, was primarily in the English language?",American History X
subgraphs_batch_004_textual_subgraph_0787.graphml,"Which film is known for blending genres such as Bollywood, Comedy-GB, Drama, and Action Film?",O.S.O.
subgraphs_batch_004_textual_subgraph_0769.graphml,"Which film, featuring an English language soundtrack and originating from the United States, has not only won the Academy Award for Best Original Music Score but also been recognized by the National Film Registry?",The Music Man
subgraphs_batch_004_textual_subgraph_0782.graphml,"Which action film, featuring a sound mixer and released on DVD, was primarily in English?",American History X
subgraphs_batch_004_textual_subgraph_0780.graphml,Which action film featuring Matthew W. Mungle in its crew was released on DVD and is associated with the United States of America?,American History X
subgraphs_batch_004_textual_subgraph_0781.graphml,"Which film features Matthew W. Mungle in its crew, was produced by New Line Cinema, has its own official website, and falls under the genre of drama?",American History X
subgraphs_batch_004_textual_subgraph_0790.graphml,"Who is the female actor born in Houston, known for her English dubbing performances and associated with an official website?",Hilary Haag
subgraphs_batch_004_textual_subgraph_0792.graphml,"Which adventure film, produced by 20th Century Fox and distributed in the United States on DVD, remains unidentified in this context?",The Transformers: The Movie
subgraphs_batch_004_textual_subgraph_0788.graphml,"Which film was produced by Richard D. Zanuck, featured special effects crew, falls under the drama genre, and had an estimated budget in United States Dollars?",Deep Impact
subgraphs_batch_004_textual_subgraph_0794.graphml,"Which film is both an action and drama genre, has its official website, and is associated with the United States of America?",American History X
subgraphs_batch_004_textual_subgraph_0798.graphml,"What indie film, also categorized as a drama, was produced by New Line Cinema and released on DVD?",American History X
subgraphs_batch_004_textual_subgraph_0783.graphml,"Which action film, released on DVD and featuring a sound mixer in its crew, is affiliated with the United States of America?",American History X
subgraphs_batch_004_textual_subgraph_0796.graphml,"What indie film, featuring Edward Norton and available on its official website, is primarily in the English language?",American History X
subgraphs_batch_004_textual_subgraph_0785.graphml,"Which film, featuring a sound mixer and produced by New Line Cinema, is related to the United States of America and primarily in the English language?",American History X
subgraphs_batch_004_textual_subgraph_0784.graphml,"Which film features Edward Norton as an award-winning actor, includes Matthew W. Mungle in its crew, was released on DVD, and falls under the genre of action?",American History X
subgraphs_batch_004_textual_subgraph_0795.graphml,"Which indie film, featuring Matthew W. Mungle in its crew and available in English with an official website, are we referring to?",American History X
subgraphs_batch_004_textual_subgraph_0797.graphml,"Which action film, featuring a sound mixer in its crew and nominees for the Academy Award for Best Actor, was also released on DVD?",American History X
subgraphs_batch_004_textual_subgraph_0789.graphml,Who is the sailor who was nominated for an Academy Award for Best Actor for their role in Casablanca and is also known for speaking English?,Humphrey Bogart
subgraphs_batch_004_textual_subgraph_0803.graphml,"What action film features Matthew W. Mungle in its crew, is in English, and has an official website?",American History X
subgraphs_batch_004_textual_subgraph_0791.graphml,"Which film, known for its dramatic genre and distributed in the United Kingdom, is also connected to the United States and features notable work from a sound mixer?",American History X
subgraphs_batch_004_textual_subgraph_0799.graphml,"Which film features a Makeup Artist from Great Britain and a Visual Effects Supervisor on its crew, is classified as an Action Film, and is primarily in the English language?",Real Steel
subgraphs_batch_004_textual_subgraph_0786.graphml,"Which film features Matthew W. Mungle as part of its crew, has a sound mixer, is related to the United States of America, and is primarily in the English language?",American History X
subgraphs_batch_004_textual_subgraph_0793.graphml,"Which film featuring Edward Norton, known for its action genre, was released in the United States and became available on DVD, and has also earned notable awards?",American History X
subgraphs_batch_004_textual_subgraph_0804.graphml,"Who is the musician from Great Britain who has lived in Sacramento, holds American nationality, and has an official website?",Brian Posehn
subgraphs_batch_004_textual_subgraph_0801.graphml,"Which TV show features Lauren Tom as a regular cast member, falls under the genres of both Cartoon and Drama, and originates from the United States of America?",King of the Hill
subgraphs_batch_004_textual_subgraph_0800.graphml,"Which TV show, known for blending comedy and drama, is produced in the English language and has an executive producer overseeing its creation?",Weeds
subgraphs_batch_004_textual_subgraph_0802.graphml,"What is the name of the action film that features Matthew W. Mungle in its crew, has an official website, and is associated with the United States of America?",American History X
subgraphs_batch_004_textual_subgraph_0807.graphml,"Which film, set in the United States and categorized as a drama, has won a Primetime Emmy Award for Outstanding Television Movie and features Drew Barrymore?",Grey Gardens
subgraphs_batch_004_textual_subgraph_0806.graphml,"Which indie film, featuring Matthew W. Mungle in its crew and associated with the United States, has an official website?",American History X
subgraphs_batch_004_textual_subgraph_0811.graphml,"Which film was released in both Argentina and Sweden, is primarily in English, and had its estimated budget in United States Dollars?",Lost Highway
subgraphs_batch_004_textual_subgraph_0810.graphml,"Which film was produced by Sydney Pollack, falls under the genre of Comedy-GB, is in the English language, and was released on DVD?",Tootsie
subgraphs_batch_004_textual_subgraph_0808.graphml,"Which film, featuring crew member Matthew W. Mungle and released on DVD, is associated with the United States of America and has an official website?",American History X
subgraphs_batch_004_textual_subgraph_0816.graphml,"Which action film, featuring Matthew W. Mungle in its crew and available in English, has an official website?",American History X
subgraphs_batch_004_textual_subgraph_0805.graphml,"Which film was distributed in the United Kingdom, had Matthew W. Mungle as part of its crew, and features nominees for the Academy Award for Best Actor, while also being related to the United States of America?",American History X
subgraphs_batch_004_textual_subgraph_0817.graphml,"Which action film, featuring Edward Norton and released on DVD, was primarily in English and won notable awards?",American History X
subgraphs_batch_004_textual_subgraph_0815.graphml,"Which action film, featuring Matthew W. Mungle in its crew, is primarily in English and associated with the United States?",American History X
subgraphs_batch_004_textual_subgraph_0813.graphml,Which film features both the genres of action and drama and includes Matthew W. Mungle and a sound mixer in its crew?,American History X
subgraphs_batch_004_textual_subgraph_0818.graphml,"Which film was produced by New Line Cinema, falls under the genres of indie and drama, and was released on DVD?",American History X
subgraphs_batch_004_textual_subgraph_0819.graphml,"Which black-and-white spy film, made in the United States and primarily in English, remains a hidden gem in cinematic history?",Saboteur
subgraphs_batch_004_textual_subgraph_0812.graphml,"Which film, featuring Edward Norton and awarded him for his performance, is distributed by New Line Cinema and falls under the action genre, with its official website being Common's webpage?",American History X
subgraphs_batch_004_textual_subgraph_0814.graphml,"What indie film, featuring crew member Matthew W. Mungle, was made in the United States and primarily spoken in English?",American History X
subgraphs_batch_004_textual_subgraph_0829.graphml,"Which TV show, known for both its sitcom and drama elements, stars Jeremy Piven and originates from the United States?",Entourage
subgraphs_batch_004_textual_subgraph_0824.graphml,"Which film is both an action and drama genre, has an official website, and includes a notable sound mixer in its crew?",American History X
subgraphs_batch_004_textual_subgraph_0820.graphml,"Which film, featuring a sound mixer and connected to the United States, has won both the Academy Award for Best Original Screenplay and the Academy Award for Best Actor in a Supporting Role?",Good Will Hunting
subgraphs_batch_004_textual_subgraph_0823.graphml,"Which indie and action film, made in the United States and primarily in English, are we referring to?",American History X
subgraphs_batch_004_textual_subgraph_0822.graphml,What is the title of the indie drama film that was made in the United States and had Matthew W. Mungle as part of its crew?,American History X
subgraphs_batch_004_textual_subgraph_0828.graphml,"Which film features music by Mark Isham, was produced by Miramax Films, is in the English language, and falls under the genre of drama?",Mrs. Parker and the Vicious Circle
subgraphs_batch_004_textual_subgraph_0825.graphml,"Which political drama film, known for its cinematography by Robert Richardson and also falling under the genre of drama, was released on DVD?",Wag the Dog
subgraphs_batch_004_textual_subgraph_0821.graphml,"Which film, set in the genre of crime fiction and budgeted in United States Dollars, features Edward Norton, who has won notable awards, and was nominated for the Academy Award for Best Actor?",American History X
subgraphs_batch_004_textual_subgraph_0834.graphml,"Which action film, distributed in the United Kingdom and related to the United States, was primarily made in the English language?",American History X
subgraphs_batch_004_textual_subgraph_0826.graphml,"Which film, featuring Matthew W. Mungle in its crew and Edward Norton winning awards for his performance, falls under the drama genre and has an official website?",American History X
subgraphs_batch_004_textual_subgraph_0809.graphml,"Which film features costume design by Dorothy Jeakins, cinematography by George Barnes, is in the English language, and is associated with the United States of America?",The Greatest Show on Earth
subgraphs_batch_004_textual_subgraph_0836.graphml,"Which film featuring Edward Norton, who has won awards, and including Matthew W. Mungle in its crew, is primarily in the English language and associated with the United States?",American History X
subgraphs_batch_004_textual_subgraph_0835.graphml,"Which action film, produced by New Line Cinema and set in the United States, was primarily filmed in English?",American History X
subgraphs_batch_004_textual_subgraph_0827.graphml,"What film, featuring Matthew W. Mungle in its crew and belonging to the crime fiction genre, is associated with the United States and has an official website?",American History X
subgraphs_batch_004_textual_subgraph_0840.graphml,"Which film was produced by New Line Cinema, distributed in the United Kingdom, features a Sound Mixer in its crew, and falls under the Drama genre?",American History X
subgraphs_batch_004_textual_subgraph_0837.graphml,"Which film, featuring the work of Matthew W. Mungle and belonging to the drama genre, was made in the United States and primarily in the English language?",American History X
subgraphs_batch_004_textual_subgraph_0832.graphml,"Which film, featuring Edward Norton who has won notable awards, was distributed in the United Kingdom, falls under the indie genre, and had its release date associated with a DVD release?",American History X
subgraphs_batch_004_textual_subgraph_0833.graphml,"Which film has won the Academy Award for Best Original Screenplay, been included in the National Film Registry, and is associated with a DVD release and a notable sound mixer in its crew?",Dog Day Afternoon
subgraphs_batch_004_textual_subgraph_0841.graphml,"Which film featuring Edward Norton, with Matthew W. Mungle as part of the crew, falls under the drama genre and was released on DVD?",American History X
subgraphs_batch_004_textual_subgraph_0831.graphml,"What is the title of the action film that features Matthew W. Mungle in its crew, is set in the United States, and is primarily in English?",American History X
subgraphs_batch_004_textual_subgraph_0848.graphml,"Which action film was produced by New Line Cinema, is related to the United States, and was released on DVD?",American History X
subgraphs_batch_004_textual_subgraph_0830.graphml,"Which romantic comedy and romance film, released in the United States and also available on DVD, are we referring to?",Breakfast at Tiffany's
subgraphs_batch_004_textual_subgraph_0842.graphml,"Who is the person born in California, closely affiliated with Anthony Kiedis, speaks English, and holds United States nationality?",Sofia Coppola
subgraphs_batch_004_textual_subgraph_0843.graphml,"Which indie film, featuring Edward Norton and set in the United States, was primarily shot in English and earned notable awards for its lead actor?",American History X
subgraphs_batch_004_textual_subgraph_0849.graphml,"Which film was written by Wong Kar-wai and released in Taiwan, also having an official website and a DVD release date?",In the Mood for Love
subgraphs_batch_004_textual_subgraph_0846.graphml,"Which film, known for its blend of action and indie genres, is associated with an official website and has a strong connection to the United States of America?",American History X
subgraphs_batch_004_textual_subgraph_0839.graphml,"Which action film, starring Edward Norton and set in the United States, was primarily filmed in English and earned him notable awards?",American History X
subgraphs_batch_004_textual_subgraph_0845.graphml,"Which film features both action and drama genres and includes Matthew W. Mungle in its crew, while also having an official website?",American History X
subgraphs_batch_004_textual_subgraph_0847.graphml,"Which biographical film featuring costume design by Colleen Atwood, falls under the genres of crime fiction and was released in the United States?",Wyatt Earp
subgraphs_batch_004_textual_subgraph_0852.graphml,"Which film was written by Roberto Benigni, is related to Germany and the United States, and was made in the English language?",Pinocchio
subgraphs_batch_004_textual_subgraph_0838.graphml,"Which film was produced by New Line Cinema, distributed in the United Kingdom, and has a release date associated with DVD, while also being connected to the United States of America?",American History X
subgraphs_batch_004_textual_subgraph_0857.graphml,"Which film was released in Argentina and Turkey, and is also available in English and on DVD?",Lawless
subgraphs_batch_004_textual_subgraph_0858.graphml,Which black-and-white indie film from Spain was also released on DVD?,Talk to Her
subgraphs_batch_004_textual_subgraph_0844.graphml,"Which film was produced by Columbia Pictures and Walter F. Parkes, and is known for its dramatic storyline and a nomination for the Academy Award for Best Actor?",Awakenings
subgraphs_batch_004_textual_subgraph_0850.graphml,"Which film has an official website known as Common's webpage, falls under the genres of both action and drama, and features a notable sound mixer in its crew?",American History X
subgraphs_batch_004_textual_subgraph_0851.graphml,"Which TV drama featuring Talia Shire in its regular cast and for which Ed Asner has won awards, is primarily presented in the English language?","Rich Man, Poor Man"
subgraphs_batch_004_textual_subgraph_0855.graphml,"Which indie drama film, featuring Matthew W. Mungle in its crew, is closely associated with the United States of America?",American History X
subgraphs_batch_004_textual_subgraph_0856.graphml,"What film, featuring Edward Norton and recognized for his award-winning performance, combines both drama and action genres and was released on DVD?",American History X
subgraphs_batch_004_textual_subgraph_0859.graphml,"Which classic film is both a black-and-white musical and was released on DVD, with a strong connection to the United States?",Top Hat
