file,query,answer
bridge_structure_132.graphml,"Which medical condition can lead to overcompensation behaviors like excessive affection seeking and a craving for material possessions as ways to cope with anxiety, often influenced by cultural factors in addressing and escaping the condition?","""ANXIETY"""
bridge_structure_134.graphml,"Which medical condition is influenced by culture, leading to overcompensation behaviors, and may also be triggered by the anxiety-inducing behavior of neurotic parents or the inherent anxiety in neurotic individuals?","""ANXIETY"""
bridge_structure_127.graphml,"Which medical condition is explored by Freud's theories as a key theme, often experienced by neurotic individuals who develop defenses against it, and can be alleviated by a craving for possession?","""ANXIETY"""
bridge_structure_125.graphml,"Which medical condition is explored by Freud as a key theme in his theories, often manifesting as a response to danger or stress and sometimes leading to the manifestation of hostility?","""ANXIETY"""
bridge_structure_130.graphml,"Which medical condition is often accompanied by a response to danger and physical symptoms, and can lead to a desire to shift responsibility onto others due to intrinsic weakness and basic hostility, while also being a common component of the neurotic need for affection driven by underlying anxiety to alleviate unease?","""ANXIETY"""
bridge_structure_148.graphml,"Which medical condition involves defenses against anxiety, acute hostile impulses, neurosis, and repressed hostility leading to anxiety?","""ANXIETY"""
bridge_structure_122.graphml,"Which CONCEPT involves antidote experiences to counteract negative materials or emotions, promoting relief and balance, and is closely related to taking in the good, HEAL steps, and the experience of love?","""NEGATIVE MATERIAL"""
bridge_structure_152.graphml,"Which person integrates experiences differently from the neurotic person, who reacts with anxiety due to lack of mastery, influenced by cultural patterns and potentially exhibiting hostility while demanding affection?","""NEUROTIC PERSON"""
bridge_structure_141.graphml,"Which medical condition involves anxiety as a response to danger or stress, often accompanied by physical symptoms, and is explored theoretically by Freud as a key theme in his work?","""ANXIETY"""
bridge_structure_138.graphml,"Which medical condition is directly related to acute hostile impulse, craving for possession, and sometimes appears alongside Kitty's anorexia or a child's repressed hostility?","""ANXIETY"""
bridge_structure_140.graphml,Which MEDICAL_CONDITION is directly caused by an acute hostile impulse and is also a symptom of Kitty's anorexia?,"""ANXIETY"""
bridge_structure_143.graphml,"Which MEDICAL_CONDITION is associated with overcompensation behaviors, craving for material possessions, neurotic personality traits, and is a key theme explored by Freud's theories?","""ANXIETY"""
bridge_structure_128.graphml,"Which medical condition involves a desire to shift responsibility onto others due to intrinsic weakness and basic hostility, often accompanied by a response to danger and physical symptoms, and is closely related to fear and neuroses as both reactions to danger, with anxiety being more subjective and internal compared to fear, which is more objective and external?","""ANXIETY"""
bridge_structure_150.graphml,"Which person is influenced by cultural patterns, intellectualizing, friendships, and anxiety?","""NEUROTIC PERSON"""
bridge_structure_154.graphml,"Which neurotic individuals may experience discrepancies between their realistic accomplishments and grandiose ambitions, unrealistic ambitions that do not align with their capabilities, strong guilt feelings, and self-recrimination?","""NEUROTIC PERSON"""
bridge_structure_135.graphml,"Which medical condition is often accompanied by overcompensation behaviors, such as excessive affection seeking, and can also be associated with timidity, physical symptoms, and a craving for material possessions as a way to cope with anxiety?","""ANXIETY"""
bridge_structure_145.graphml,"Which medical condition is significantly influenced by anxiety as a trigger, psychological condition, and is explored as a key theme in Freud's theoretical foundation and research, while also being addressed differently across various cultures?","""ANXIETY"""
bridge_structure_151.graphml,"Which PERSON is often characterized by intellectualizing to avoid emotional experiences, using indigestion as an alibi to avoid confronting their shortcomings, and experiencing hidden hostility that drives their demands for affection, as well as being exacerbated by humiliation?","""NEUROTIC PERSON"""
bridge_structure_144.graphml,"Which medical condition does Freud explore as a key theme in his theories, focusing on understanding and explaining its nature, including causes and manifestations, and which individuals with neuroses may develop defenses against as a way to cope with symptoms?","""ANXIETY"""
bridge_structure_139.graphml,"Which MEDICAL_CONDITION is associated with overcompensation behaviors, anxiety as a symptom in Kitty's anorexia, and a theoretical focus by Freud on its psychological and physiological state?","""ANXIETY"""
bridge_structure_146.graphml,"Which medical condition is often accompanied by defenses against anxiety, a response to danger or physical symptoms, and is closely linked to the neurotic need for affection as a root cause and emotional isolation as a potential outcome?","""ANXIETY"""
bridge_structure_149.graphml,"Which Kitty is influenced by her eating disorder, the desire for emotional separation, and cultural expectations of independence and self-sufficiency, while also experiencing behavioral changes and receiving sedatives as part of her anorexia treatment?","""KITTY"""
bridge_structure_136.graphml,"Which medical condition is significantly influenced by anxiety in patients undergoing psychoanalysis, triggering psychological conditions and defenses against anxiety, and commonly experienced by neurotic individuals who fear disapproval and guilt, often weakening self-confidence?","""ANXIETY"""
bridge_structure_147.graphml,"Which MEDICAL_CONDITION can lead individuals to develop defenses against anxiety, shift responsibility onto others, and be influenced by culture in their coping mechanisms?","""ANXIETY"""
bridge_structure_153.graphml,"Which PERSON do neurotic individuals often exhibit unrealistic ambitions, anxiety, and fragile self-esteem due to a discrepancy between their grandiose goals and actual capabilities?","""NEUROTIC PERSON"""
bridge_structure_162.graphml,"Which PERSON is influenced by Yom Kippur, sedatives, Mother's Day visits, and the emotional bond with EMMA?","""KITTY"""
bridge_structure_157.graphml,"Which neurotic person may use indigestion as an alibi to avoid confronting their shortcomings, experience grandiose fantasies to cope with feelings of inferiority, feel strong guilt, and be overly concerned with public opinion?","""NEUROTIC PERSON"""
bridge_structure_161.graphml,"Which PERSON is directly affected by her eating disorder, anxiety, and aspirations to attend Columbia University, while also experiencing emotional support from her mother?","""KITTY"""
bridge_structure_167.graphml,"Which PERSON does Kitty's aspirations to attend Columbia University, dietary changes, experiences with love, and struggles with anxiety all influence?","""KITTY"""
bridge_structure_170.graphml,"Which CONCEPT is closely related to distress tolerance and protection, and often appears alongside resilience and the avoiding system in managing uncomfortable experiences?","""PROTECTION"""
bridge_structure_173.graphml,"Which PERSON can influence a child's behavior through parenting styles like LAXNESS or TIME-OUT, while also being responsible for guiding the child and supporting family members like Kitty?","""PARENT"""
bridge_structure_156.graphml,"Which neurotic individuals often experience a discrepancy between their realistic accomplishments and their grandiose ambitions, leading to feelings of inferiority, anxiety, and guilt, and how can cultural patterns influence this relationship between mental health and cultural impact?","""NEUROTIC PERSON"""
bridge_structure_165.graphml,"Which CONCEPT can be triggered by ANXIETY, REJECTION, and NEUROTIC ANXIETY, and how does it relate to the emotional responses of a CHILD?","""HOSTILITY"""
bridge_structure_174.graphml,"Which ""HEAL STEPS"" are related to SPECT STUDIES and the BRAIN, and are often seen with KITTY and a CHILD?","""(""ENTITY"""
bridge_structure_164.graphml,"Which CONCEPT is often rooted in repressed hostility, driving both neurotic anxiety and the demands for affection in neurotic individuals?","""HOSTILITY"""
bridge_structure_158.graphml,"Which PERSON is central to the LIBIDO THEORY, involving transference dynamics with the analyst and the patient's exploration of sexual needs and psychological issues?","""PATIENT"""
bridge_structure_159.graphml,"Which MEDICAL_CONDITION is an insidious chronic process that affects an individual's personality, often starting in childhood and leading to character distortions, anxiety, and psychological conflicts such as the Oedipus complex?","""NEUROSIS"""
bridge_structure_166.graphml,"Which CONCEPT is closely related to ANXIETY and Hostility, and often co-occurs with NEUROTIC PERSON and CHILD in contexts of emotional response and parental influence?","""HOSTILITY"""
bridge_structure_155.graphml,"Which person may experience indigestion as an alibi to avoid confronting their shortcomings, or develop depression due to the inability to defend arguments, while also being influenced by cultural patterns and anxiety stemming from fear of disapproval?","""NEUROTIC PERSON"""
bridge_structure_176.graphml,"Which parent experiences challenges like divorce and supporting a child with ADD, while also caring for Kitty and fostering a child's feeling of being valued?","""PARENTS"""
bridge_structure_171.graphml,"Which PERSON experience challenges in managing their child's sleep and wakefulness, leading to conflicts in the morning due to parenting challenges and family dynamics?","""PARENTS"""
bridge_structure_172.graphml,"Which ORGANIZATION influences a child's educational experience through its environment and accommodations for ADD, and how does it connect with the family's support in overcoming fears and engaging in normal activities?","""SCHOOL"""
bridge_structure_168.graphml,"Which PERSON exhibits parental concern and behavioral change, draws upon Health Magazine for health awareness, and demonstrates resilience through transforming anxiety into positive energy?","""ME"""
bridge_structure_178.graphml,"Which PERSON is significantly impacted by their struggle with Anorexia at Thanksgiving dinner, undergoes dietary changes as part of recovery, and receives support and care from their family during their healing process?","""KITTY"""
bridge_structure_175.graphml,"Which PERSON may experience grief or denial due to the challenges of raising a child with ADD, while also being responsible for caring for children like Kitty and teaching them values and rules?","""PARENTS"""
bridge_structure_163.graphml,"Which DRUG is reviewed by Cheung and colleagues for treating depression in children, which is relevant to FDA and MHRA approvals and is the same DRUG that Dr. Beth suggests adjusting for Kitty's medication dose?","""FLUOXETINE"""
bridge_structure_160.graphml,"Which PERSON is central to the LIBIDO THEORY, involving the analyst's role in the treatment relationship, psychological exploration, and the patient's resistance to change, while also focusing on the connection between personal experiences and inhibitions?","""PATIENT"""
bridge_structure_181.graphml,"Which CONCEPT is strongly associated with WOMEN's need for affection, dissatisfaction with sexual life, the determination of neurotics to obtain affection, and the often misunderstood desire for affection central to the neurotic need for affection?","""AFFECTION"""
bridge_structure_180.graphml,"Which person's challenges include balancing work, school, and managing anorexia while seeking medical support and dealing with emotional well-being?","""KITTY"""
bridge_structure_183.graphml,"Which person is deeply concerned about Kitty's recent behavioral change and anxiety, given their role as a caregiver and family member who supports her through her anorexia treatment?","""KITTY"""
bridge_structure_203.graphml,"Which CATEGORY experiences different affection-seeking strategies between men and women, and how do neurotic individuals disrupt love relationships?","""LOVE RELATIONSHIPS"""
bridge_structure_193.graphml,"Which DRUG is a brand name for fluoxetine, an antidepressant medication approved by the FDA for treating depression, and was prescribed to Monica, Celina, and Samuel for various mental health conditions?","""PROZAC"""
bridge_structure_185.graphml,"Which CONCEPT is closely related to LIFE, POSITIVE EMOTION, GOOD EXPERIENCE, and often contrasted with NEUROTIC tendencies?","""GRATITUDE"""
bridge_structure_199.graphml,Which CONCEPT involves the integration of positive and negative material to promote emotional balance and therapeutic healing?,"""NEGATIVE MATERIAL"""
bridge_structure_198.graphml,"Which person is struggling with an eating disorder that requires treatment, and whose family considers the Maudsley Approach as a potential solution?","""KITTY"""
bridge_structure_209.graphml,"Which PERSON is affected by anorexia, dietary changes, and Yom Kippur fasting considerations?","""KITTY"""
bridge_structure_194.graphml,"Which ""MEDICAL_TEST"" includes a SPECT study used for brain activity assessment, as seen in Allison's case, and is also associated with cognitive evaluation in individuals like Mark and Celina?","""SPECT STUDY"""
bridge_structure_186.graphml,"Which MEDICAL_TEST is used for diagnosis, cognitive assessment, and assessing ADD, as seen in Allison's SPECT study for brain activity and Sal's SPECT study for brain damage?","""SPECT STUDY"""
bridge_structure_192.graphml,"Which CONCEPT metaphorically represents the state of the brain in the responsive mode, involving the Green Setting, Subgenual Cingulate Cortex, Attaching to Others System, and Approaching Rewards System?","""RESPONSIVE MODE"""
bridge_structure_188.graphml,"Which CONCEPT is closely related to SCRIPT, COMPETITION, NEUROTIC, and OUR CULTURE?","""SUCCESS"""
bridge_structure_179.graphml,"Which ORGANIZATION is central to both the family's authority dynamics and the support system for Kitty's anorexia, connecting social well-being with educational and health outcomes?","""FAMILY"""
bridge_structure_207.graphml,"Which medical condition is associated with experiences like belonging, self-compassion, being appreciated, friendship, kindness, and assertiveness, as well as the responsive mode and childhood issues, and how does Stephen Porges' polyvagal theory relate to it?","""ATTACHING TO OTHERS SYSTEM"""
bridge_structure_210.graphml,"Which organ releases chemicals in response to negative thoughts, leading to emotional response and stress, while also housing the mind for cognitive functions and the experience of good things?","""BRAIN"""
bridge_structure_208.graphml,"Which ""HEAL STEPS"" are associated with the anterior cingulate gyrus, a brain organ, and are often observed in families with KITTY and CHILD?","""(""ENTITY"""
bridge_structure_197.graphml,"Which person is prescribed sedatives by Dr. Newbie to manage their emotional state, which is part of their treatment for anorexia, and has a tense and controlled relationship with food, particularly those with fat, which is a concern for their parents, and requires therapy as part of their recovery process, which the family is actively seeking?","""KITTY"""
bridge_structure_211.graphml,"Which Jamie utilizes the role of The Mother to protect Kitty from the emotional impact of her illness, while also reflecting the influence of The Brother's preference and the staff's presence on her self-confidence?","""THE MOTHER"""
bridge_structure_225.graphml,Which PERSON is associated with Wakefield's research and Jenny McCarthy's endorsement of shared beliefs regarding Autism Spectrum Disorder?,"""JENNY MCCARTHY"""
bridge_structure_200.graphml,Which approach is being considered by Kitty's family for her treatment of anorexia?,"""KITTY"""
bridge_structure_169.graphml,"Which medical condition is associated with diminished self-esteem, affects an individual's character, may appear alongside character neuroses, and includes anxiety as a symptom?","""NEUROSIS"""
bridge_structure_212.graphml,"Which person is directly affected by her eating disorder, which significantly impacts her life and mental health, and experiences emotional distress during events like Thanksgiving dinner?","""KITTY"""
bridge_structure_213.graphml,"Which PERSON is influenced by her eating disorder and the desire for emotional separation during events like Thanksgiving and Yom Kippur, while also receiving therapy and benefiting from the narrator's parental involvement and support?","""KITTY"""
bridge_structure_216.graphml,"Which ""MEDICAL_PERSON"" conducted research on ADD at Fort Irwin, utilizing biofeedback and neurofeedback, and whose EEG findings correlate with SPECT studies in understanding the condition?","""DR. LUBAR"""
bridge_structure_204.graphml,"Which PERSON is a patient in the ICU receiving treatment for anorexia, where her struggle with eating influences medical decisions and her doctors advise her to drink a milk shake as part of her recovery process from dietary changes, despite fasting during Yom Kippur being discouraged due to her condition?","""KITTY"""
bridge_structure_222.graphml,"Which medical condition is associated with genetic factors, environmental influences, and has been linked to Jenny McCarthy and the MMR vaccine?","""AUTISM SPECTRUM DISORDER"""
bridge_structure_214.graphml,"Which approach does Kitty's family consider as a potential treatment for her anorexia, impacting her aspirations and daily life?","""KITTY"""
bridge_structure_228.graphml,"Which MEDICAL_TEST is used to measure brain activity, diagnose conditions like ADD, and assess medical conditions such as seizures, strokes, and dementia by evaluating brain physiology?","""SPECT STUDY"""
bridge_structure_229.graphml,"Which Kitty has experienced dietary changes, skipped Thanksgiving, had her BMI monitored, and been treated by doctors due to her eating disorder?","""KITTY"""
bridge_structure_227.graphml,"Which medical condition is associated with the fear of accusation, internal conflict, and the defense mechanism of self-recrimination in neurotic individuals?","""SELF-RECRIMINATION"""
bridge_structure_195.graphml,"Which PERSON is influenced by her eating disorder, family observations of OCD symptoms, and the side effects of fluoxetine, impacting her decision to skip Thanksgiving and her aspirations to attend Columbia University?","""KITTY"""
bridge_structure_226.graphml,"Which medical condition is closely associated with fear of disapproval, guilt feelings, disapproval, and is often experienced by neurotic individuals?","""GUILT FEELINGS"""
bridge_structure_233.graphml,"Which UNKNOWN is discussed in relation to permissive parenting and parenting views, including references to Ilg and Rosemond?","""MYTH #50"""
bridge_structure_232.graphml,"Which person attempted to help Kitty but faced treatment failure and communication issues, while also prescribing sedatives to manage her emotional state during her anorexia treatment?","""KITTY"""
bridge_structure_231.graphml,"Which PERSON is impacted by health issues such as anorexia, anxiety, and the desire to attend Columbia University, leading to challenges like fasting during Yom Kippur and receiving support from her mother?","""KITTY"""
bridge_structure_230.graphml,"Which PERSON has experienced treatment failure and communication issues with Dr. V., considers fasting during Yom Kippur despite medical discouragement, receives support from her family, and faces sleep difficulties while recovering from anorexia?","""KITTY"""
bridge_structure_234.graphml,Which person is prescribed sedatives by Dr. Newbie as part of her treatment for anorexia and whose family considers the Maudsley Approach as a potential treatment method?,"""KITTY"""
bridge_structure_177.graphml,Which PERSON may experience grief or denial due to parenting challenges with a child with ADD?,"""PARENTS"""
bridge_structure_215.graphml,Which MEDICAL_PERSON applied his research on ADD at Fort Irwin using biofeedback and SPECT studies to correlate with EEG findings?,"""DR. LUBAR"""
bridge_structure_201.graphml,"Which medical condition involves character disturbances as observable signs of neurosis, can include anxiety as a symptom reflecting an individual's struggle to overcome fears, is treated through psychoanalysis to uncover and address root causes, and is influenced by cultural factors leading to false generalizations about the condition?","""NEUROSIS"""
bridge_structure_115.graphml,whichchunk-0d63fd5ef94cdcaeb91ffe1a3353d6fd<SEP>chunk-7f44979ce02c8e93c21b55ba7cf2ecbe<SEP>chunk-a1d03c8f6115799b4aeb603af1aaff6c<SEP>chunk-34c190c6898109afd673932ed911d87a<SEP>chunk-299c62d6ecd523e0525043667dda24c6<SEP>chunk-5d40a19fd9e231b683230345ae3177d4<SEP>chunk-1d91e342870b1cd976cb0e8e9778b2b3<SEP>chunk-0dda5434445264489541ecc9eeec8bc1<SEP>chunk-47dcef0366e155c69344362608e46910<SEP>chunk-f521e1779ce8eb651a0c403b9bac39ed<SEP>chunk-63cf3a7f056ba42fe4e2080f00725397<SEP>chunk-89f1510752213251869d59f641551a02<SEP>chunk-7cb3d22760b80a49e8858eecdffc814a<SEP>chunk-ccc87984e1e54ede5a506c07ad79d3b4<SEP>chunk-df7906e0205c049c1ed31b34b8f90e6f<SEP>chunk-d76434003d21374a8fbc6982455dae27<SEP>chunk-51a12e2d3f7a108fb4d8b5f581cc6032<SEP>chunk-3d5e5017158321ea70468039286c854c<SEP>chunk-ca7a0d20793d6b3f74dcbae8fa9ec2c1<SEP>chunk-20209ec129517a38a3d97ead8c5392cd<SEP>chunk-739020ed581d5cc2e68f6a2da726a0fc<SEP>chunk-bba0dfa1eedaa33d1b5a9ba0b9476f7b<SEP>chunk-e0c112ace59f4c955d07ed566733629d<SEP>chunk-f4dcb1fe20e179ebbdb522194ffd5b61<SEP>chunk-7ae3f746842021304474fb1ac0e5d820<SEP>chunk-dd4c622d25daeabb0f1f01ee474d3a2c<SEP>chunk-98a5f8189a422d35ca81ba9c86b25c8f<SEP>chunk-24b4fd1936a8d332c5416c6190d383c6<SEP>chunk-eb143e31e122b019b44b81dff08a48b0<SEP>chunk-b530612820db8dda5b8e7e5f54a3cb75<SEP>chunk-7f387217737f6618aae3fc95b8557fa3<SEP>chunk-5f1be8fb50a9ad177fbfaa5d2feea45f<SEP>chunk-791ed2fff74709010b5ff8b074b491a9<SEP>chunk-0f5d60ba176572d1b9a62cd3243686b6<SEP>chunk-5650372c74e7d521db6d334cdd2669cd<SEP>chunk-d729c0cc094a264bbe7a4db767c26324<SEP>chunk-dac4eaa0798709fcbc4a32a0985b32d3<SEP>chunk-cfe677e36792af650dbb39f323719001 what chunk discusses the impact of tension in parental relationships and the importance of open communication in decision-making regarding a child's DSD management?,"""PARENTS"""
