file,query,answer
bridge_structure_007.graphml,"Which organ is associated with Temporal Lobe ADD, head injury impact, Depakote treatment, and SPECT study for diagnosis?","""TEMPORAL LOBE"""
bridge_structure_017.graphml,Which person was prescribed Adderall and Prozac for their ADD and depression?,"""CELINA"""
bridge_structure_006.graphml,"Which PERSON was prescribed Prozac and Adderall to manage depression and ADD symptoms, and underwent a SPECT study to understand her brain activity?","""CELINA"""
bridge_structure_015.graphml,Which person has been prescribed both Adderall and Prozac for conditions related to ADD and depression?,"""CELINA"""
bridge_structure_011.graphml,"Which MEDICAL_PERSON applied his research on ADD at Fort Irwin using biofeedback and SPECT, correlating EEG findings with Sally's study and contributing to the understanding of ADD treatment?","""DR. LUBAR"""
bridge_structure_014.graphml,"Which person uses stimulants like nicotine and caffeine to self-medicate for ADD, potentially contributing to negative health consequences?","""DAVID"""
bridge_structure_004.graphml,"Which person was prescribed Celexa and diagnosed with ADD, and also treated with DL-phenylalanine and L-tyrosine?","""CHARITY"""
bridge_structure_010.graphml,"Which person was prescribed Adderall and Prozac, and had a SPECT study to understand their brain activity related to ADD and depression?","""CELINA"""
bridge_structure_002.graphml,"Which person is more likely to experience issues with punctuality and academic challenges due to ADD, affecting their ability to get up on time and attend school regularly?","""PEOPLE WITH ADD"""
bridge_structure_016.graphml,"Which PERSON led Celina to accept medication treatment after her SPECT study, and was prescribed Adderall for ADD?","""CELINA"""
bridge_structure_003.graphml,"Which PERSON's mother works to provide financial security and health insurance crucial for Kitty's medical care, experiences emotional distress at Thanksgiving dinner due to Anorexia, receives potential treatment with medicine, and has caring parents concerned about her health and well-being?","""KITTY"""
bridge_structure_013.graphml,"Which medical condition is commonly associated with head trauma, affecting the brain's functioning and potentially leading to symptoms similar to ADD, which can be detected through SPECT imaging?","""HEAD TRAUMA"""
bridge_structure_012.graphml,"Which PERSON was diagnosed with ADD and had SPECT results indicating overactivity in the Anterior Cingulate Gyrus, leading to the addition of Prozac to his treatment regimen?","""SAMUEL"""
bridge_structure_008.graphml,"Which PERSON was prescribed Depakote and Adderall as part of his treatment regimen, alongside undergoing a SPECT study to monitor his brain activity?","""RONNY"""
bridge_structure_018.graphml,"Which Celina is influenced by ADD, has a SPECT study, and is prescribed Adderall?","""CELINA"""
bridge_structure_019.graphml,Which PERSON was prescribed Adderall and Prozac as part of her treatment for ADD and depression?,"""CELINA"""
bridge_structure_001.graphml,"Which child experiences emotional dependence on their parents, leading to repressed feelings, and how does their relationship with their mother and challenges like ADD influence their school life and ability to overcome fears?","""CHILD"""
bridge_structure_031.graphml,"Which medical condition is influenced by cultural factors, character, psychoanalysis, and anxiety?","""NEUROSIS"""
bridge_structure_023.graphml,"Which disease is explored in ""The Golden Cage,"" affecting families and mental health, and categorized under eating disorders?","""ANOREXIA"""
bridge_structure_028.graphml,"Which MEDICAL_CONDITION is explored by Freud as a key theme in his theories, often triggered by acute hostile impulses and affecting patients with neurosis?","""ANXIETY"""
bridge_structure_026.graphml,Which PERSON is discouraged from fasting during Yom Kippur due to anorexia?,"""KITTY"""
bridge_structure_021.graphml,"Which CONCEPT is related to negative thought patterns, emotional responses, and stress, and is often associated with figures like Abraham Lincoln and conditions like ADD?","""NEGATIVE THOUGHTS"""
bridge_structure_029.graphml,"Which person's theories discuss concepts such as repression and anxiety, focusing on the interpretation of melancholia as a neurotic disorder?","""FREUD"""
bridge_structure_033.graphml,"Which CONCEPT is closely related to POSITIVE EXPERIENCE, the sixth sense, and may also be linked to CHILD and NEUROTIC behaviors?","""LOVE"""
bridge_structure_036.graphml,"Which MEDICAL_CONDITION is associated with a desire for care and a place to cope with illness, as well as hidden emotions and psychological defense mechanisms?","""NEUROTIC"""
bridge_structure_030.graphml,"Which person may use indigestion as an alibi to avoid confronting their shortcomings, experience anxiety due to fear of disapproval and guilt feelings influenced by the super-ego, and be affected by cultural patterns that contribute to the development of neurosis?","""NEUROTIC PERSON"""
bridge_structure_034.graphml,"Which MEDICAL_CONDITION is associated with overcompensation behaviors, acute hostile impulses, and symptoms like Kitty's anorexia in neurotic individuals?","""ANXIETY"""
bridge_structure_035.graphml,"Which PERSON is depicted as emotionally and physically present for Kitty in the playroom, referencing scientific research on metabolism while also showing a strong bond with a child who experienced abandonment?","""MOTHER"""
bridge_structure_022.graphml,"Which disease affects Kitty Westin, a cat, by influencing her eating habits, leading to self-starvation and a distorted body image, and is a central focus of her case and the narrative?","""ANOREXIA"""
bridge_structure_025.graphml,"Which DISEASE has significantly impacted Kitty's physical and mental health, characterized by her eating habits and preference for smoothies over milkshakes, and requires intervention and support from her family and medical professionals, including pediatricians who may lack specific training in treating it as a mental health condition?","""ANOREXIA"""
bridge_structure_037.graphml,"Which CONCEPT is closely related to POSITIVE EXPERIENCE and HOSTILITY, and often co-occurs with CHILD and NEUROTIC behaviors?","""LOVE"""
bridge_structure_032.graphml,"Which medical condition is directly caused by acute hostile impulses and also triggered by competition, while being explored as a key theme in Freud's theories and sometimes present as a symptom of neurosis?","""ANXIETY"""
bridge_structure_039.graphml,"Which CONCEPT involves the release of negative material to maintain a compassionate and assertive state of mind, while also being associated with neurotics' strong desire for love, children's repressed feelings, and the emotional support that overcomes anorexia?","""LOVE"""
bridge_structure_041.graphml,"Which PERSON is responsible for managing behavior, seeking discipline strategies, using ice cream as a treatment method, guiding the child in a system, and supporting Kitty through her anorexia?","""PARENT"""
bridge_structure_038.graphml,"Which CONCEPT is closely related to POSITIVE EXPERIENCE, incompatible with HOSTILITY, and often associated with CHILD or NEUROTIC behaviors?","""LOVE"""
bridge_structure_024.graphml,"Which disease is discussed in 'The Golden Cage' and affects families, contributing to challenges in pediatric treatment and highlighting the impact on families' well-being?","""ANOREXIA"""
bridge_structure_040.graphml,"Which CONCEPT is demonstrated when the narrator's belief in love's power overcomes Kitty's anorexia, fostering positive experiences and emotional support, and how does it contrast with hostility while emphasizing affection and well-being?","""LOVE"""
bridge_structure_053.graphml,"Which medical condition is associated with speech generating devices, social stories, the MMR vaccine, and Jenny McCarthy's beliefs?","""AUTISM"""
bridge_structure_055.graphml,"Which medical condition are often treated with natural supplements, contribute to symptoms like difficulty concentrating and low energy levels, and can lead to workplace challenges if left untreated?","""ADD"""
bridge_structure_042.graphml,"Which CONCEPT is closely related to positive experiences like love and well-being, and sometimes involves the release of negative material to maintain a compassionate and assertive state of mind?","""LOVE"""
bridge_structure_047.graphml,"Which PERSON is shaped by family dynamics and maternal influence, as seen in the cases of the narrator, Laura, and Kitty?","""MOTHER"""
bridge_structure_048.graphml,"Which PERSON has experienced the most significant impact from family dynamics and maternal influence, considering cases like Laura's anorexia and the emotional neglect felt by a child abandoned by their mother?","""MOTHER"""
bridge_structure_052.graphml,"Which medical condition is associated with speech generating devices, the MMR vaccine, and the debate surrounding vaccines, including Jenny McCarthy's beliefs?","""AUTISM"""
bridge_structure_058.graphml,"Which MEDICAL_CONDITION do individuals like Celina and the child affected by it often seek help to manage, given its generational impact on mental health and daily challenges?","""ADD"""
bridge_structure_043.graphml,"Which ""HEAL STEPS"" are associated with the anterior cingulate gyrus, Jamie, and the family of Kitty and the child?","""(""ENTITY"""
bridge_structure_049.graphml,"Which PERSON is depicted as someone who is emotionally and physically present for Kitty during her struggles, showing a strong parent-child bond?","""MOTHER"""
bridge_structure_046.graphml,"Which medical condition is associated with shifting responsibility onto others due to intrinsic weakness and basic hostility, as well as with participation in competitive activities that trigger stress and lead to fatigue and inhibition?","""ANXIETY"""
bridge_structure_051.graphml,"Which medical condition is often triggered by participation in competitive activities and influenced by culture, and is also commonly associated with psychiatric illness and neurotic individuals?","""ANXIETY"""
bridge_structure_050.graphml,"Which approach does Kitty's family consider as a potential treatment for her eating disorder, and how does it relate to her experiences with Thanksgiving dinner, Ms. Susan's support group, and Dr. Beth's medical care?","""KITTY"""
bridge_structure_045.graphml,"Which MEDICAL_CONDITION is commonly associated with short-term memory issues and cognitive impairment, often seen in children like Laura who exhibit inflexible rituals and may benefit from intense aerobic exercise for cognitive enhancement?","""ADD"""
bridge_structure_054.graphml,"Which MEDICAL_CONDITION is often associated with challenges in concentration, short-term memory issues, and the need for intense aerobic exercise for cognitive enhancement, particularly among people like David who may self-medicate with substances?","""ADD"""
bridge_structure_027.graphml,"Which ORGANIZATION is directly involved in Kitty Westin's case, where her family provides support and faces the financial implications of her anorexia, while also dealing with the interplay between family dynamics, school attendance, and the challenges of her condition?","""FAMILY"""
bridge_structure_068.graphml,"Which medical condition is associated with natural supplements for treatment, negative thoughts, head trauma, and cases like Paul's diagnosis and successful medication management?","""ADD"""
bridge_structure_057.graphml,"Which medical condition is often triggered by repressed feelings in children, concurrent with psychiatric illness, and influences the psychological state of patients undergoing psychoanalysis, particularly through the alleviation of anxiety and the pursuit of security via craving for material possessions?","""ANXIETY"""
bridge_structure_056.graphml,"Which MEDICAL_CONDITION is associated with symptoms like short-term memory issues and can be influenced by factors such as intense aerobic exercise, Celina's depression, and David's substance abuse habits?","""ADD"""
bridge_structure_066.graphml,"Which MEDICAL_CONDITION do individuals like Celina and Charity seek help for, and how does it impact those with symptoms similar to Sara's?","""ADD"""
bridge_structure_074.graphml,"Which ""PERSON"" can effectively support a child with ADD by utilizing school resources, adapting the learning environment, and considering parental influence on socialization?","""CHILD"""
bridge_structure_070.graphml,"Which MEDICAL_CONDITION is affected by the deep limbic system, treated with natural supplements, and managed by both teachers and parents in school settings?","""ADD"""
bridge_structure_067.graphml,"Which MEDICAL_CONDITION is often managed with help to improve quality of life, as seen in cases like Paul's and Celina's, and is associated with temporal lobe involvement and potential generational impacts?","""ADD"""
bridge_structure_075.graphml,"Which medical condition involves the development of defenses against anxiety, influenced by culture, and can co-occur with hostility and stem from neurotic parents?","""ANXIETY"""
bridge_structure_072.graphml,"Which PERSON is associated with the activation of reward centers in the brain, charity, Celexa, L-tyrosine, and ADD?","""CHARITY"""
bridge_structure_064.graphml,"Which medical condition, often diagnosed in children and adolescents like Paul, can impact the anterior cingulate gyrus, leading to difficulties in attention and emotional regulation, and may be treated by pediatricians with varying accuracy, affecting the child's behavior and learning?","""ADD"""
bridge_structure_065.graphml,"Which medical condition is supported by the National Adult Literacy and Learning Disabilities Center, treated with natural supplements, and researched by Dr. Lubar for its brainwave activity and treatment with neurofeedback?","""ADD"""
bridge_structure_063.graphml,"Which MEDICAL_CONDITION is associated with pediatricians, influencing individuals like Celina, co-occurring with psychiatric illness, and researched by the National Institutes of Health?","""ADD"""
bridge_structure_060.graphml,"Which MEDICAL_CONDITION is associated with pediatricians potentially providing incorrect information, affecting temporal lobes and contributing to mood instability, memory difficulties, and generational impacts on mental health?","""ADD"""
bridge_structure_073.graphml,"Which person may repress their feelings of love or hostility due to fear of losing it, being perceived as rebellious, or their emotional dependence on parents, especially when affected by ADD?","""CHILD"""
bridge_structure_069.graphml,"Which medical condition is often treated with medication and dietary changes, for which pediatricians may provide treatment or incorrect information, and for which individuals often seek help to manage symptoms and improve their quality of life?","""ADD"""
bridge_structure_059.graphml,"Which MEDICAL_CONDITION is influenced by Celina's depression, impacts the basal ganglia and prefrontal cortex, and may be treated with psychostimulants, while also being subject to treatment or misinformation from pediatricians?","""ADD"""
bridge_structure_077.graphml,Which PERSON is more likely to experience increased attentiveness and anxiety due to repressed hostility and love?,"""CHILD"""
bridge_structure_093.graphml,Which MEDICAL_DEVICE requires motivation and patience from both children and parents for successful implementation?,"""URINE ALARM"""
bridge_structure_078.graphml,"Which PERSON may repress their hostility due to parental influence, leading to anxiety and guilt in the sexual sphere?","""CHILD"""
bridge_structure_085.graphml,Which person's role in fixing things for the family and caring for Kitty reflects their practical and supportive nature?,"""JAMIE"""
bridge_structure_082.graphml,"Which ""PERSON"" are affected by ADD and may repress their feelings of hostility due to the behavior of their neurotic parents, while school resources are available to support managing ADD symptoms and improving their educational experience?","""CHILD"""
bridge_structure_079.graphml,"Which child may repress their feelings of hostility or love due to parental influence, while also being affected by ADD and the emotional impact of maternal abandonment?","""CHILD"""
bridge_structure_080.graphml,"Which person's emotional suppression and socialization are influenced by their environment, parenting style, and ADD?","""CHILD"""
bridge_structure_081.graphml,"Which PERSON is most impacted by the speaker's abandonment by their MOTHER, the environmental adaptation challenges of ADD, and the emotional outcomes of repressed hostility and anxiety?","""CHILD"""
bridge_structure_091.graphml,"Which medical condition, often associated with depression and anxiety, is frequently discussed alongside ADD and highlighted in the 1994 study as a prevalent psychiatric illness in the U.S. population?","""PSYCHIATRIC ILLNESS"""
bridge_structure_076.graphml,"Which person is central to the libido theory, involving transference, anxiety, and the mother figure in psychoanalytic treatment?","""PATIENT"""
bridge_structure_088.graphml,"Which DRUG is prescribed for Brian to address attention and focus issues resulting from his brain injury, and also used by Jenna to improve focus and cognitive function, similar to how it's recommended for David's ADD?","""ADDERALL"""
bridge_structure_084.graphml,"Which person is a dedicated medical professional specializing in the treatment of Kitty, who is battling anorexia, and plays a significant role in her recovery process by providing comprehensive medical care, guidance, and support?","""KITTY"""
bridge_structure_094.graphml,"Which CONCEPT influences Calder's view of reality and creativity, represents the intuitive and imaginative aspects of creativity, is central to self-realization, and contrasts with the classical ego mode and ice cream consciousness?","""QUANTUM SELF"""
bridge_structure_092.graphml,"Which person uses nicotine as a stimulant for self-medication, potentially worsening their ADD symptoms, and might benefit from Adderall as a treatment option?","""DAVID"""
bridge_structure_083.graphml,Which person's family considers the Maudsley Approach as a potential treatment for their eating disorder and experiences emotional distress at Thanksgiving dinner due to their struggle with Anorexia?,"""KITTY"""
bridge_structure_062.graphml,"Which MEDICAL_CONDITION is supported by resources from the National Adult Literacy and Learning Disabilities Center, characterized by short-term memory issues, and has affected individuals like Samuel and Celina?","""ADD"""
bridge_structure_090.graphml,"Which medical test, used by Mark, Celina, and Allison for evaluating brain function, revealed marked hyperfrontality in Mark and showed decreased activity in Allison's prefrontal and temporal lobes?","""SPECT STUDY"""
bridge_structure_105.graphml,Which MEDICAL_TREATMENT uses beta waves to improve attention and focus in children with ADD or ADHD?,"""NEUROFEEDBACK"""
bridge_structure_089.graphml,"Which DRUG is effective in treating Type 2 ADD, as seen in Jenna's case, and has been observed to improve frontal cortex activity in Gloria's Son, while also being prescribed to Brandon for focus and Celina for concentration?","""ADDERALL"""
bridge_structure_095.graphml,"Which medical condition is associated with threats, rage, analysis, and anxiety in individuals?","""NEUROTIC"""
bridge_structure_111.graphml,"Which parents experience divorce and tension, and how do they care for children like Kitty and manage conditions like ADD?","""PARENTS"""
bridge_structure_103.graphml,"Which event, associated with the formation of new synapses and enhanced awareness, contributes to both neural structure and well-being, potentially influenced by love?","""POSITIVE EXPERIENCE"""
bridge_structure_113.graphml,"Which PERSON experience tension due to relationship turmoil, contribute to a child's feeling of being valued, support children with ADD, and care for Kitty's health and well-being?","""PARENTS"""
bridge_structure_119.graphml,"Which MEDICAL_PERSON is responsible for weight management, food consumption, and the treatment of Kitty's eating disorder and obesity concerns?","""DOCTORS"""
bridge_structure_112.graphml,"Which DRUG is associated with treatment for ADD and condition management, as well as its potential influence from internet chat rooms and use in teenagers for sleep disturbances?","""MEDICATION"""
bridge_structure_117.graphml,"Which MEDICAL_CONDITION is often driven by anxiety, characterized by a neurotic need for affection and a fear of dependency, leading to feelings of unease and distrust?","""NEUROTIC NEED FOR AFFECTION"""
bridge_structure_101.graphml,"Which MEDICAL_CONDITION is often associated with the use of justice to justify demands, hidden aggression, difficulty in feeling gratitude, and challenges in concentrating or completing work?","""NEUROTIC"""
bridge_structure_097.graphml,"Which medical condition involves maintaining a facade for social presentation and psychological defense, experiencing a strong fear of disapproval that can lead to social anxiety, and often being driven by a desire for love, creating a vicious circle?","""NEUROTIC"""
bridge_structure_118.graphml,"Which CONCEPT does the text explore as a manifestation of stereotypes and its consequences, including the potential for accurately predicting group differences as illustrated by Circleology, while also discussing racial comparisons between Asians and Caucasians?","""STEREOTYPES"""
bridge_structure_109.graphml,"Which organ can be impacted by ADD, leading to dopamine production issues in the basal ganglia and contributing to impulsivity in Type 1 ADD?","""BASAL GANGLIA"""
bridge_structure_107.graphml,"Which organ is crucial for memory formation, emotional stability, and often affected by conditions like ADD, with medications such as Depakote potentially stabilizing its function?","""TEMPORAL LOBES"""
bridge_structure_099.graphml,"Which medical condition is often associated with a fear of disapproval, threats in relationships, anxiety due to internal conflicts, and a vicious circle of negative emotions?","""NEUROTIC"""
bridge_structure_098.graphml,"Which MEDICAL_CONDITION involves neurotics using the concept of justice to justify their demands and actions, appealing to fairness and moral principles to obtain affection, engaging in competitive struggles that lead to destructive behavior, and fearing success due to the potential loss of affection?","""NEUROTIC"""
bridge_structure_100.graphml,"Which MEDICAL_CONDITION is often associated with appealing to justice for affection, experiencing a strong fear of disapproval, and being influenced by cultural norms and expectations?","""NEUROTIC"""
bridge_structure_102.graphml,"Which medical condition is associated with appealing to justice for affection, seeking care in a sanitarium, and being influenced by cultural norms in shaping one's approach to illness coping?","""NEUROTIC"""
bridge_structure_131.graphml,"Which medical condition is influenced by culture, patient psychological states, competition, and neurotic tendencies?","""ANXIETY"""
bridge_structure_110.graphml,"Which DRUG is commonly used in the treatment of ADD to manage symptoms and improve functioning, often accompanied by brain-imaging work for diagnosis and treatment, and medication use for sleep disturbances in teenagers like Kitty?","""MEDICATION"""
bridge_structure_121.graphml,"Which approach does Kitty's family consider as a potential treatment for her eating disorder, involving sedatives and parental support to manage her emotional state and relationship with food?","""KITTY"""
bridge_structure_133.graphml,Which MEDICAL_CONDITION is often accompanied by physical symptoms as a response to danger and can also be influenced by Freud's theories exploring its psychological and physiological state?,"""ANXIETY"""
bridge_structure_123.graphml,"Which medical condition is triggered by stressors such as competition and destructive competitiveness, affecting both patients undergoing psychoanalysis and individuals experiencing psychological conditions or responses to danger?","""ANXIETY"""
bridge_structure_096.graphml,"Which medical condition involves maintaining a facade for social presentation and psychological defense, seeking care in a sanitarium for illness coping, being influenced by cultural norms in pursuing affection, and displaying hostility in responses to perceived threats or injustices?","""NEUROTIC"""
bridge_structure_129.graphml,"Which medical condition is often a response to danger or physical symptoms, can lead to overcompensation behaviors like excessive affection seeking, and may be accompanied by repressed feelings or symptoms of illness such as tight chest and restlessness?","""ANXIETY"""
bridge_structure_120.graphml,"Which MEDICAL_PERSON have historically overlooked the ability of infants to feel pain, are involved in the care of Kitty, advise on the consumption of food, and may be overly concerned with obesity?","""DOCTORS"""
bridge_structure_124.graphml,Which medical condition can involve the development of defenses against anxiety and the craving for material possessions as ways to cope with symptoms like a response to danger and physical symptoms?,"""ANXIETY"""
bridge_structure_126.graphml,"Which medical condition is often triggered by acute hostile impulses, affecting the psychological state of patients undergoing psychoanalysis and commonly experienced by neurotic individuals due to their internal conflicts and fear of disapproval?","""ANXIETY"""
